{"test_class": {"identifier": "MessageFormatControllerTest", "superclass": "extends AbstractMvcTest", "interfaces": "", "fields": [{"original_string": "@Autowired\n    private MessageFormatTestTools messageFormatTestTools;", "modifier": "@Autowired\n    private", "type": "MessageFormatTestTools", "declarator": "messageFormatTestTools", "var_name": "messageFormatTestTools"}, {"original_string": "@Autowired\n    private MessageFormatRepository messageFormatRepository;", "modifier": "@Autowired\n    private", "type": "MessageFormatRepository", "declarator": "messageFormatRepository", "var_name": "messageFormatRepository"}, {"original_string": "@Autowired\n    private ViewTestTools viewTestTools;", "modifier": "@Autowired\n    private", "type": "ViewTestTools", "declarator": "viewTestTools", "var_name": "viewTestTools"}, {"original_string": "private String deserializerUploadPath;", "modifier": "private", "type": "String", "declarator": "deserializerUploadPath", "var_name": "deserializerUploadPath"}], "file": "kafka-webview-ui/src/test/java/org/sourcelab/kafka/webview/ui/controller/configuration/messageformat/MessageFormatControllerTest.java"}, "test_case": {"identifier": "testIndex", "parameters": "()", "modifiers": "@Test @Transactional public", "return": "void", "body": "@Test\n    @Transactional\n    public void testIndex() throws Exception {\n        // Create some dummy formats\n        final MessageFormat format1 = messageFormatTestTools.createMessageFormat(\"Format 1\");\n        final MessageFormat format2 = messageFormatTestTools.createMessageFormat(\"Format 2\");\n\n        // Hit index.\n        mockMvc\n            .perform(get(\"/configuration/messageFormat\").with(user(adminUserDetails)))\n            //.andDo(print())\n            .andExpect(status().isOk())\n            // Validate cluster 1\n            .andExpect(content().string(containsString(format1.getName())))\n            .andExpect(content().string(containsString(format1.getClasspath())))\n\n            // Validate cluster 2\n            .andExpect(content().string(containsString(format2.getName())))\n            .andExpect(content().string(containsString(format2.getClasspath())));\n    }", "signature": "void testIndex()", "full_signature": "@Test @Transactional public void testIndex()", "class_method_signature": "MessageFormatControllerTest.testIndex()", "testcase": true, "constructor": false, "invocations": ["createMessageFormat", "createMessageFormat", "andExpect", "andExpect", "andExpect", "andExpect", "andExpect", "perform", "with", "get", "user", "isOk", "status", "string", "content", "containsString", "getName", "string", "content", "containsString", "getClasspath", "string", "content", "containsString", "getName", "string", "content", "containsString", "getClasspath"]}, "focal_class": {"identifier": "MessageFormatController", "superclass": "extends BaseController", "interfaces": "", "fields": [{"original_string": "@Autowired\n    private UploadManager uploadManager;", "modifier": "@Autowired\n    private", "type": "UploadManager", "declarator": "uploadManager", "var_name": "uploadManager"}, {"original_string": "@Autowired\n    private PluginFactory<Deserializer> deserializerLoader;", "modifier": "@Autowired\n    private", "type": "PluginFactory<Deserializer>", "declarator": "deserializerLoader", "var_name": "deserializerLoader"}, {"original_string": "@Autowired\n    private MessageFormatRepository messageFormatRepository;", "modifier": "@Autowired\n    private", "type": "MessageFormatRepository", "declarator": "messageFormatRepository", "var_name": "messageFormatRepository"}, {"original_string": "@Autowired\n    private ViewRepository viewRepository;", "modifier": "@Autowired\n    private", "type": "ViewRepository", "declarator": "viewRepository", "var_name": "viewRepository"}], "methods": [{"identifier": "index", "parameters": "(final Model model)", "modifiers": "@RequestMapping(path = \"\", method = RequestMethod.GET) public", "return": "String", "signature": "String index(final Model model)", "full_signature": "@RequestMapping(path = \"\", method = RequestMethod.GET) public String index(final Model model)", "class_method_signature": "MessageFormatController.index(final Model model)", "testcase": false, "constructor": false}, {"identifier": "createMessageFormat", "parameters": "(final MessageFormatForm messageFormatForm, final Model model)", "modifiers": "@RequestMapping(path = \"/create\", method = RequestMethod.GET) public", "return": "String", "signature": "String createMessageFormat(final MessageFormatForm messageFormatForm, final Model model)", "full_signature": "@RequestMapping(path = \"/create\", method = RequestMethod.GET) public String createMessageFormat(final MessageFormatForm messageFormatForm, final Model model)", "class_method_signature": "MessageFormatController.createMessageFormat(final MessageFormatForm messageFormatForm, final Model model)", "testcase": false, "constructor": false}, {"identifier": "editMessageFormat", "parameters": "(\n        @PathVariable final Long id,\n        final MessageFormatForm messageFormatForm,\n        final Model model,\n        final RedirectAttributes redirectAttributes)", "modifiers": "@RequestMapping(path = \"/edit/{id}\", method = RequestMethod.GET) public", "return": "String", "signature": "String editMessageFormat(\n        @PathVariable final Long id,\n        final MessageFormatForm messageFormatForm,\n        final Model model,\n        final RedirectAttributes redirectAttributes)", "full_signature": "@RequestMapping(path = \"/edit/{id}\", method = RequestMethod.GET) public String editMessageFormat(\n        @PathVariable final Long id,\n        final MessageFormatForm messageFormatForm,\n        final Model model,\n        final RedirectAttributes redirectAttributes)", "class_method_signature": "MessageFormatController.editMessageFormat(\n        @PathVariable final Long id,\n        final MessageFormatForm messageFormatForm,\n        final Model model,\n        final RedirectAttributes redirectAttributes)", "testcase": false, "constructor": false}, {"identifier": "create", "parameters": "(\n        @Valid final MessageFormatForm messageFormatForm,\n        final BindingResult bindingResult,\n        final RedirectAttributes redirectAttributes,\n        @RequestParam final Map<String, String> allRequestParams)", "modifiers": "@RequestMapping(path = \"/update\", method = RequestMethod.POST) public", "return": "String", "signature": "String create(\n        @Valid final MessageFormatForm messageFormatForm,\n        final BindingResult bindingResult,\n        final RedirectAttributes redirectAttributes,\n        @RequestParam final Map<String, String> allRequestParams)", "full_signature": "@RequestMapping(path = \"/update\", method = RequestMethod.POST) public String create(\n        @Valid final MessageFormatForm messageFormatForm,\n        final BindingResult bindingResult,\n        final RedirectAttributes redirectAttributes,\n        @RequestParam final Map<String, String> allRequestParams)", "class_method_signature": "MessageFormatController.create(\n        @Valid final MessageFormatForm messageFormatForm,\n        final BindingResult bindingResult,\n        final RedirectAttributes redirectAttributes,\n        @RequestParam final Map<String, String> allRequestParams)", "testcase": false, "constructor": false}, {"identifier": "handleCustomOptions", "parameters": "(final MessageFormatForm messageFormatForm)", "modifiers": "private", "return": "String", "signature": "String handleCustomOptions(final MessageFormatForm messageFormatForm)", "full_signature": "private String handleCustomOptions(final MessageFormatForm messageFormatForm)", "class_method_signature": "MessageFormatController.handleCustomOptions(final MessageFormatForm messageFormatForm)", "testcase": false, "constructor": false}, {"identifier": "deleteCluster", "parameters": "(@PathVariable final Long id, final RedirectAttributes redirectAttributes)", "modifiers": "@RequestMapping(path = \"/delete/{id}\", method = RequestMethod.POST) public", "return": "String", "signature": "String deleteCluster(@PathVariable final Long id, final RedirectAttributes redirectAttributes)", "full_signature": "@RequestMapping(path = \"/delete/{id}\", method = RequestMethod.POST) public String deleteCluster(@PathVariable final Long id, final RedirectAttributes redirectAttributes)", "class_method_signature": "MessageFormatController.deleteCluster(@PathVariable final Long id, final RedirectAttributes redirectAttributes)", "testcase": false, "constructor": false}, {"identifier": "setupBreadCrumbs", "parameters": "(final Model model, final String name, final String url)", "modifiers": "private", "return": "void", "signature": "void setupBreadCrumbs(final Model model, final String name, final String url)", "full_signature": "private void setupBreadCrumbs(final Model model, final String name, final String url)", "class_method_signature": "MessageFormatController.setupBreadCrumbs(final Model model, final String name, final String url)", "testcase": false, "constructor": false}], "file": "kafka-webview-ui/src/main/java/org/sourcelab/kafka/webview/ui/controller/configuration/messageformat/MessageFormatController.java"}, "focal_method": {"identifier": "index", "parameters": "(final Model model)", "modifiers": "@RequestMapping(path = \"\", method = RequestMethod.GET) public", "return": "String", "body": "@RequestMapping(path = \"\", method = RequestMethod.GET)\n    public String index(final Model model) {\n        // Setup breadcrumbs\n        setupBreadCrumbs(model, null, null);\n\n        // Retrieve all default formats\n        final Iterable<MessageFormat> defaultMessageFormats = messageFormatRepository.findByIsDefaultFormatOrderByNameAsc(true);\n\n        // Retrieve all custom formats\n        final Iterable<MessageFormat> customMessageFormats = messageFormatRepository.findByIsDefaultFormatOrderByNameAsc(false);\n\n        // Set view attributes\n        model.addAttribute(\"defaultMessageFormats\", defaultMessageFormats);\n        model.addAttribute(\"customMessageFormats\", customMessageFormats);\n\n        return \"configuration/messageFormat/index\";\n    }", "signature": "String index(final Model model)", "full_signature": "@RequestMapping(path = \"\", method = RequestMethod.GET) public String index(final Model model)", "class_method_signature": "MessageFormatController.index(final Model model)", "testcase": false, "constructor": false, "invocations": ["setupBreadCrumbs", "findByIsDefaultFormatOrderByNameAsc", "findByIsDefaultFormatOrderByNameAsc", "addAttribute", "addAttribute"]}, "repository": {"repo_id": 106082622, "url": "https://github.com/SourceLabOrg/kafka-webview", "stars": 256, "created": "10/7/2017 8:28:45 AM +00:00", "updates": "2020-01-25T06:02:44+00:00", "fork": "False", "license": "licensed"}}