{"test_class": {"identifier": "LeaderTest", "superclass": "extends AbstractLeaderTest<Leader>", "interfaces": "", "fields": [{"original_string": "static final String FOLLOWER_ID = \"follower\";", "modifier": "static final", "type": "String", "declarator": "FOLLOWER_ID = \"follower\"", "var_name": "FOLLOWER_ID"}, {"original_string": "public static final String LEADER_ID = \"leader\";", "modifier": "public static final", "type": "String", "declarator": "LEADER_ID = \"leader\"", "var_name": "LEADER_ID"}, {"original_string": "private final TestActorRef<ForwardMessageToBehaviorActor> leaderActor = actorFactory.createTestActor(\n            Props.create(ForwardMessageToBehaviorActor.class), actorFactory.generateActorId(\"leader\"));", "modifier": "private final", "type": "TestActorRef<ForwardMessageToBehaviorActor>", "declarator": "leaderActor = actorFactory.createTestActor(\n            Props.create(ForwardMessageToBehaviorActor.class), actorFactory.generateActorId(\"leader\"))", "var_name": "leaderActor"}, {"original_string": "private final TestActorRef<ForwardMessageToBehaviorActor> followerActor = actorFactory.createTestActor(\n            Props.create(ForwardMessageToBehaviorActor.class), actorFactory.generateActorId(\"follower\"));", "modifier": "private final", "type": "TestActorRef<ForwardMessageToBehaviorActor>", "declarator": "followerActor = actorFactory.createTestActor(\n            Props.create(ForwardMessageToBehaviorActor.class), actorFactory.generateActorId(\"follower\"))", "var_name": "followerActor"}, {"original_string": "private Leader leader;", "modifier": "private", "type": "Leader", "declarator": "leader", "var_name": "leader"}, {"original_string": "private final short payloadVersion = 5;", "modifier": "private final", "type": "short", "declarator": "payloadVersion = 5", "var_name": "payloadVersion"}], "file": "opendaylight/md-sal/sal-akka-raft/src/test/java/org/opendaylight/controller/cluster/raft/behaviors/LeaderTest.java"}, "test_case": {"identifier": "testLaggingFollowerStarvation", "parameters": "()", "modifiers": "@Test public", "return": "void", "body": "@Test\n    public void testLaggingFollowerStarvation() {\n        logStart(\"testLaggingFollowerStarvation\");\n\n        String leaderActorId = actorFactory.generateActorId(\"leader\");\n        String follower1ActorId = actorFactory.generateActorId(\"follower\");\n        String follower2ActorId = actorFactory.generateActorId(\"follower\");\n\n        final ActorRef follower1Actor = actorFactory.createActor(MessageCollectorActor.props(), follower1ActorId);\n        final ActorRef follower2Actor = actorFactory.createActor(MessageCollectorActor.props(), follower2ActorId);\n\n        MockRaftActorContext leaderActorContext =\n                new MockRaftActorContext(leaderActorId, getSystem(), leaderActor);\n\n        DefaultConfigParamsImpl configParams = new DefaultConfigParamsImpl();\n        configParams.setHeartBeatInterval(new FiniteDuration(200, TimeUnit.MILLISECONDS));\n        configParams.setIsolatedLeaderCheckInterval(new FiniteDuration(10, TimeUnit.SECONDS));\n\n        leaderActorContext.setConfigParams(configParams);\n\n        leaderActorContext.setReplicatedLog(\n                new MockRaftActorContext.MockReplicatedLogBuilder().createEntries(1,5,1).build());\n\n        Map<String, String> peerAddresses = new HashMap<>();\n        peerAddresses.put(follower1ActorId,\n                follower1Actor.path().toString());\n        peerAddresses.put(follower2ActorId,\n                follower2Actor.path().toString());\n\n        leaderActorContext.setPeerAddresses(peerAddresses);\n        leaderActorContext.getTermInformation().update(1, leaderActorId);\n\n        leader = createBehavior(leaderActorContext);\n\n        leaderActor.underlyingActor().setBehavior(leader);\n\n        for (int i = 1; i < 6; i++) {\n            // Each AppendEntriesReply could end up rescheduling the heartbeat (without the fix for bug 2733)\n            RaftActorBehavior newBehavior = leader.handleMessage(follower1Actor,\n                    new AppendEntriesReply(follower1ActorId, 1, true, i, 1, (short)0));\n            assertTrue(newBehavior == leader);\n            Uninterruptibles.sleepUninterruptibly(200, TimeUnit.MILLISECONDS);\n        }\n\n        // Check if the leader has been receiving SendHeartbeat messages despite getting AppendEntriesReply\n        List<SendHeartBeat> heartbeats = MessageCollectorActor.getAllMatching(leaderActor, SendHeartBeat.class);\n\n        assertTrue(String.format(\"%s heartbeat(s) is less than expected\", heartbeats.size()),\n                heartbeats.size() > 1);\n\n        // Check if follower-2 got AppendEntries during this time and was not starved\n        List<AppendEntries> appendEntries = MessageCollectorActor.getAllMatching(follower2Actor, AppendEntries.class);\n\n        assertTrue(String.format(\"%s append entries is less than expected\", appendEntries.size()),\n                appendEntries.size() > 1);\n    }", "signature": "void testLaggingFollowerStarvation()", "full_signature": "@Test public void testLaggingFollowerStarvation()", "class_method_signature": "LeaderTest.testLaggingFollowerStarvation()", "testcase": true, "constructor": false, "invocations": ["logStart", "generateActorId", "generateActorId", "generateActorId", "createActor", "props", "createActor", "props", "getSystem", "setHeartBeatInterval", "setIsolatedLeaderCheckInterval", "setConfigParams", "setReplicatedLog", "build", "createEntries", "put", "toString", "path", "put", "toString", "path", "setPeerAddresses", "update", "getTermInformation", "createBehavior", "setBehavior", "underlyingActor", "handleMessage", "assertTrue", "sleepUninterruptibly", "getAllMatching", "assertTrue", "format", "size", "size", "getAllMatching", "assertTrue", "format", "size", "size"]}, "focal_class": {"identifier": "Leader", "superclass": "extends AbstractLeader", "interfaces": "", "fields": [{"original_string": "@VisibleForTesting\n    static final Object ISOLATED_LEADER_CHECK = new Object();", "modifier": "@VisibleForTesting\n    static final", "type": "Object", "declarator": "ISOLATED_LEADER_CHECK = new Object()", "var_name": "ISOLATED_LEADER_CHECK"}, {"original_string": "private final Stopwatch isolatedLeaderCheck = Stopwatch.createStarted();", "modifier": "private final", "type": "Stopwatch", "declarator": "isolatedLeaderCheck = Stopwatch.createStarted()", "var_name": "isolatedLeaderCheck"}, {"original_string": "private @Nullable LeadershipTransferContext leadershipTransferContext;", "modifier": "private @Nullable", "type": "LeadershipTransferContext", "declarator": "leadershipTransferContext", "var_name": "leadershipTransferContext"}], "methods": [{"identifier": "Leader", "parameters": "(final RaftActorContext context, @Nullable final AbstractLeader initializeFromLeader)", "modifiers": "", "return": "", "signature": " Leader(final RaftActorContext context, @Nullable final AbstractLeader initializeFromLeader)", "full_signature": "  Leader(final RaftActorContext context, @Nullable final AbstractLeader initializeFromLeader)", "class_method_signature": "Leader.Leader(final RaftActorContext context, @Nullable final AbstractLeader initializeFromLeader)", "testcase": false, "constructor": true}, {"identifier": "Leader", "parameters": "(final RaftActorContext context)", "modifiers": "public", "return": "", "signature": " Leader(final RaftActorContext context)", "full_signature": "public  Leader(final RaftActorContext context)", "class_method_signature": "Leader.Leader(final RaftActorContext context)", "testcase": false, "constructor": true}, {"identifier": "handleMessage", "parameters": "(final ActorRef sender, final Object originalMessage)", "modifiers": "@Override public", "return": "RaftActorBehavior", "signature": "RaftActorBehavior handleMessage(final ActorRef sender, final Object originalMessage)", "full_signature": "@Override public RaftActorBehavior handleMessage(final ActorRef sender, final Object originalMessage)", "class_method_signature": "Leader.handleMessage(final ActorRef sender, final Object originalMessage)", "testcase": false, "constructor": false}, {"identifier": "beforeSendHeartbeat", "parameters": "()", "modifiers": "@Override protected", "return": "void", "signature": "void beforeSendHeartbeat()", "full_signature": "@Override protected void beforeSendHeartbeat()", "class_method_signature": "Leader.beforeSendHeartbeat()", "testcase": false, "constructor": false}, {"identifier": "handleAppendEntriesReply", "parameters": "(final ActorRef sender,\n            final AppendEntriesReply appendEntriesReply)", "modifiers": "@Override protected", "return": "RaftActorBehavior", "signature": "RaftActorBehavior handleAppendEntriesReply(final ActorRef sender,\n            final AppendEntriesReply appendEntriesReply)", "full_signature": "@Override protected RaftActorBehavior handleAppendEntriesReply(final ActorRef sender,\n            final AppendEntriesReply appendEntriesReply)", "class_method_signature": "Leader.handleAppendEntriesReply(final ActorRef sender,\n            final AppendEntriesReply appendEntriesReply)", "testcase": false, "constructor": false}, {"identifier": "transferLeadership", "parameters": "(@NonNull final RaftActorLeadershipTransferCohort leadershipTransferCohort)", "modifiers": "public", "return": "void", "signature": "void transferLeadership(@NonNull final RaftActorLeadershipTransferCohort leadershipTransferCohort)", "full_signature": "public void transferLeadership(@NonNull final RaftActorLeadershipTransferCohort leadershipTransferCohort)", "class_method_signature": "Leader.transferLeadership(@NonNull final RaftActorLeadershipTransferCohort leadershipTransferCohort)", "testcase": false, "constructor": false}, {"identifier": "tryToCompleteLeadershipTransfer", "parameters": "(final String followerId)", "modifiers": "private", "return": "void", "signature": "void tryToCompleteLeadershipTransfer(final String followerId)", "full_signature": "private void tryToCompleteLeadershipTransfer(final String followerId)", "class_method_signature": "Leader.tryToCompleteLeadershipTransfer(final String followerId)", "testcase": false, "constructor": false}, {"identifier": "close", "parameters": "()", "modifiers": "@Override public", "return": "void", "signature": "void close()", "full_signature": "@Override public void close()", "class_method_signature": "Leader.close()", "testcase": false, "constructor": false}, {"identifier": "markFollowerActive", "parameters": "(final String followerId)", "modifiers": "@VisibleForTesting", "return": "void", "signature": "void markFollowerActive(final String followerId)", "full_signature": "@VisibleForTesting void markFollowerActive(final String followerId)", "class_method_signature": "Leader.markFollowerActive(final String followerId)", "testcase": false, "constructor": false}, {"identifier": "markFollowerInActive", "parameters": "(final String followerId)", "modifiers": "@VisibleForTesting", "return": "void", "signature": "void markFollowerInActive(final String followerId)", "full_signature": "@VisibleForTesting void markFollowerInActive(final String followerId)", "class_method_signature": "Leader.markFollowerInActive(final String followerId)", "testcase": false, "constructor": false}], "file": "opendaylight/md-sal/sal-akka-raft/src/main/java/org/opendaylight/controller/cluster/raft/behaviors/Leader.java"}, "focal_method": {"identifier": "handleMessage", "parameters": "(final ActorRef sender, final Object originalMessage)", "modifiers": "@Override public", "return": "RaftActorBehavior", "body": "@Override\n    public RaftActorBehavior handleMessage(final ActorRef sender, final Object originalMessage) {\n        requireNonNull(sender, \"sender should not be null\");\n\n        if (ISOLATED_LEADER_CHECK.equals(originalMessage)) {\n            if (isLeaderIsolated()) {\n                log.warn(\"{}: At least {} followers need to be active, Switching {} from Leader to IsolatedLeader\",\n                    context.getId(), getMinIsolatedLeaderPeerCount(), getLeaderId());\n                return internalSwitchBehavior(new IsolatedLeader(context, this));\n            } else {\n                return this;\n            }\n        } else {\n            return super.handleMessage(sender, originalMessage);\n        }\n    }", "signature": "RaftActorBehavior handleMessage(final ActorRef sender, final Object originalMessage)", "full_signature": "@Override public RaftActorBehavior handleMessage(final ActorRef sender, final Object originalMessage)", "class_method_signature": "Leader.handleMessage(final ActorRef sender, final Object originalMessage)", "testcase": false, "constructor": false, "invocations": ["requireNonNull", "equals", "isLeaderIsolated", "warn", "getId", "getMinIsolatedLeaderPeerCount", "getLeaderId", "internalSwitchBehavior", "handleMessage"]}, "repository": {"repo_id": 16362479, "url": "https://github.com/opendaylight/controller", "stars": 313, "created": "1/29/2014 11:10:45 PM +00:00", "updates": "2020-01-20T11:02:36+00:00", "fork": "False", "license": "licensed"}}