{"test_class": {"identifier": "IFieldNamePluginTest", "superclass": "", "interfaces": "", "fields": [{"original_string": "private IFieldNamePlugin plugin;", "modifier": "private", "type": "IFieldNamePlugin", "declarator": "plugin", "var_name": "plugin"}, {"original_string": "private IBootstrap bootstrap;", "modifier": "private", "type": "IBootstrap", "declarator": "bootstrap", "var_name": "bootstrap"}], "file": "CoreFeatures/IObject-plugins/PluginIFieldName/src/test/java/info/smart_tools/smartactors/iobject_plugins/ifieldname_plugin/IFieldNamePluginTest.java"}, "test_case": {"identifier": "MustInCorrectExecuteActionWhenKeysThrowException", "parameters": "()", "modifiers": "@Test public", "return": "void", "body": "@Test\n    public void MustInCorrectExecuteActionWhenKeysThrowException() throws Exception {\n\n        BootstrapItem item = mock(BootstrapItem.class);\n        whenNew(BootstrapItem.class).withArguments(\"IFieldNamePlugin\").thenReturn(item);\n\n        when(item.after(anyString())).thenReturn(item);\n\n        plugin.load();\n\n        verifyNew(BootstrapItem.class).withArguments(\"IFieldNamePlugin\");\n\n        verify(item).after(\"IOC\");\n\n        ArgumentCaptor<IPoorAction> iPoorActionArgumentCaptor = ArgumentCaptor.forClass(IPoorAction.class);\n        verify(item).process(iPoorActionArgumentCaptor.capture());\n\n        verify(bootstrap).add(item);\n\n        when(Keys.getOrAdd(\"info.smart_tools.smartactors.iobject.ifield_name.IFieldName\")).thenThrow(new ResolutionException(\"\"));\n\n        try {\n            iPoorActionArgumentCaptor.getValue().execute();\n        } catch (ActionExecuteException e) {\n\n            verifyStatic();\n            Keys.getOrAdd(\"info.smart_tools.smartactors.iobject.ifield_name.IFieldName\");\n            return;\n        }\n        assertTrue(\"Must throw exception\", false);\n\n    }", "signature": "void MustInCorrectExecuteActionWhenKeysThrowException()", "full_signature": "@Test public void MustInCorrectExecuteActionWhenKeysThrowException()", "class_method_signature": "IFieldNamePluginTest.MustInCorrectExecuteActionWhenKeysThrowException()", "testcase": true, "constructor": false, "invocations": ["mock", "thenReturn", "withArguments", "whenNew", "thenReturn", "when", "after", "anyString", "load", "withArguments", "verifyNew", "after", "verify", "forClass", "process", "verify", "capture", "add", "verify", "thenThrow", "when", "getOrAdd", "execute", "getValue", "verifyStatic", "getOrAdd", "assertTrue"]}, "focal_class": {"identifier": "IFieldNamePlugin", "superclass": "", "interfaces": "implements IPlugin", "fields": [{"original_string": "private final IBootstrap<IBootstrapItem<String>> bootstrap;", "modifier": "private final", "type": "IBootstrap<IBootstrapItem<String>>", "declarator": "bootstrap", "var_name": "bootstrap"}], "methods": [{"identifier": "IFieldNamePlugin", "parameters": "(final IBootstrap<IBootstrapItem<String>> bootstrap)", "modifiers": "public", "return": "", "signature": " IFieldNamePlugin(final IBootstrap<IBootstrapItem<String>> bootstrap)", "full_signature": "public  IFieldNamePlugin(final IBootstrap<IBootstrapItem<String>> bootstrap)", "class_method_signature": "IFieldNamePlugin.IFieldNamePlugin(final IBootstrap<IBootstrapItem<String>> bootstrap)", "testcase": false, "constructor": true}, {"identifier": "load", "parameters": "()", "modifiers": "@Override public", "return": "void", "signature": "void load()", "full_signature": "@Override public void load()", "class_method_signature": "IFieldNamePlugin.load()", "testcase": false, "constructor": false}], "file": "CoreFeatures/IObject-plugins/PluginIFieldName/src/main/java/info/smart_tools/smartactors/iobject_plugins/ifieldname_plugin/IFieldNamePlugin.java"}, "focal_method": {"identifier": "load", "parameters": "()", "modifiers": "@Override public", "return": "void", "body": "@Override\n    public void load() throws PluginException {\n        try {\n            IBootstrapItem<String> item = new BootstrapItem(\"IFieldNamePlugin\");\n\n            item\n                    .after(\"IOC\")\n                    .process(() -> {\n                        try {\n                            IKey iFieldNameKey = Keys.getOrAdd(\"info.smart_tools.smartactors.iobject.ifield_name.IFieldName\");\n                            IOC.register(iFieldNameKey,\n                                    new ResolveByNameIocStrategy(\n                                            (args) -> {\n                                                try {\n                                                    String nameOfFieldName = (String) args[0];\n                                                    IFieldName result = new FieldName(nameOfFieldName);\n\n                                                    return result;\n                                                } catch (ClassCastException e) {\n                                                    throw new RuntimeException(\"Can't cast object to String: \" + args[0],\n                                                            e);\n                                                } catch (ArrayIndexOutOfBoundsException e) {\n                                                    throw new RuntimeException(\n                                                            \"Can't get args: args must contain one or more elements \" +\n                                                                    \"and first element must be String\",\n                                                            e);\n                                                } catch (InvalidArgumentException e) {\n                                                    throw new RuntimeException(\n                                                            \"Can't create new field name with this name: \" + args[0],\n                                                            e);\n                                                }\n                                        }\n                                    )\n                            );\n                        } catch (ResolutionException e) {\n                            throw new ActionExecuteException(\"IFieldName plugin can't load: can't get IFieldName key\", e);\n                        } catch (InvalidArgumentException e) {\n                            throw new ActionExecuteException(\"IFieldName plugin can't load: can't create strategy\", e);\n                        } catch (RegistrationException e) {\n                            throw new ActionExecuteException(\"IFieldName plugin can't load: can't register new strategy\", e);\n                        }\n                    });\n            bootstrap.add(item);\n        } catch (InvalidArgumentException e) {\n            throw new PluginException(\"Can't get BootstrapItem from one of reason\", e);\n        }\n    }", "signature": "void load()", "full_signature": "@Override public void load()", "class_method_signature": "IFieldNamePlugin.load()", "testcase": false, "constructor": false, "invocations": ["process", "after", "getOrAdd", "register", "add"]}, "repository": {"repo_id": 52972024, "url": "https://github.com/SmartTools/smartactors-core", "language": "Java", "is_fork": false, "fork_count": 7, "stargazer_count": 17, "size": 58816, "license": "licensed"}}