{"test_class": {"identifier": "CreateAsyncOperationTaskTest", "superclass": "", "interfaces": "", "fields": [{"original_string": "private CreateAsyncOperationTask testTask;", "modifier": "private", "type": "CreateAsyncOperationTask", "declarator": "testTask", "var_name": "testTask"}, {"original_string": "private IDatabaseTask targetTask;", "modifier": "private", "type": "IDatabaseTask", "declarator": "targetTask", "var_name": "targetTask"}, {"original_string": "private IStorageConnection connection;", "modifier": "private", "type": "IStorageConnection", "declarator": "connection", "var_name": "connection"}, {"original_string": "private IField documentField;", "modifier": "private", "type": "IField", "declarator": "documentField", "var_name": "documentField"}, {"original_string": "private IField collectionNameField;", "modifier": "private", "type": "IField", "declarator": "collectionNameField", "var_name": "collectionNameField"}], "file": "CoreFeatures/Database/AsyncOperationCollection/src/test/java/info/smart_tools/smartactors/database/async_operation_collection/task/CreateAsyncOperationTaskTest.java"}, "test_case": {"identifier": "MustCorrectPrepare", "parameters": "()", "modifiers": "@Test public", "return": "void", "body": "@Test\n    public void MustCorrectPrepare() throws ResolutionException, ReadValueException, InvalidArgumentException, TaskPrepareException {\n        IObject query = mock(IObject.class);\n\n        String collectionName = \"examplecn\";\n        Object document = mock(Object.class);\n\n        when(collectionNameField.in(query)).thenReturn(collectionName);\n        when(documentField.in(query)).thenReturn(document);\n\n        IKey upsertTaskKey = mock(IKey.class);\n        when(Keys.getOrAdd(\"db.collection.upsert\")).thenReturn(upsertTaskKey);\n\n        when(IOC.resolve(upsertTaskKey, connection, collectionName, document)).thenReturn(targetTask);\n\n        testTask.prepare(query);\n\n        verifyStatic();\n        Keys.getOrAdd(\"db.collection.upsert\");\n\n        verify(collectionNameField).in(query);\n        verify(documentField).in(query);\n\n        verifyStatic();\n        IOC.resolve(upsertTaskKey, connection, collectionName, document);\n    }", "signature": "void MustCorrectPrepare()", "full_signature": "@Test public void MustCorrectPrepare()", "class_method_signature": "CreateAsyncOperationTaskTest.MustCorrectPrepare()", "testcase": true, "constructor": false, "invocations": ["mock", "mock", "thenReturn", "when", "in", "thenReturn", "when", "in", "mock", "thenReturn", "when", "getOrAdd", "thenReturn", "when", "resolve", "prepare", "verifyStatic", "getOrAdd", "in", "verify", "in", "verify", "verifyStatic", "resolve"]}, "focal_class": {"identifier": "CreateAsyncOperationTask", "superclass": "", "interfaces": "implements IDatabaseTask", "fields": [{"original_string": "private IDatabaseTask task;", "modifier": "private", "type": "IDatabaseTask", "declarator": "task", "var_name": "task"}, {"original_string": "private IStorageConnection connection;", "modifier": "private", "type": "IStorageConnection", "declarator": "connection", "var_name": "connection"}, {"original_string": "private IField documentField;", "modifier": "private", "type": "IField", "declarator": "documentField", "var_name": "documentField"}, {"original_string": "private IField collectionNameField;", "modifier": "private", "type": "IField", "declarator": "collectionNameField", "var_name": "collectionNameField"}], "methods": [{"identifier": "CreateAsyncOperationTask", "parameters": "(final IStorageConnection connection)", "modifiers": "public", "return": "", "signature": " CreateAsyncOperationTask(final IStorageConnection connection)", "full_signature": "public  CreateAsyncOperationTask(final IStorageConnection connection)", "class_method_signature": "CreateAsyncOperationTask.CreateAsyncOperationTask(final IStorageConnection connection)", "testcase": false, "constructor": true}, {"identifier": "prepare", "parameters": "(final IObject query)", "modifiers": "@Override public", "return": "void", "signature": "void prepare(final IObject query)", "full_signature": "@Override public void prepare(final IObject query)", "class_method_signature": "CreateAsyncOperationTask.prepare(final IObject query)", "testcase": false, "constructor": false}, {"identifier": "execute", "parameters": "()", "modifiers": "@Override public", "return": "void", "signature": "void execute()", "full_signature": "@Override public void execute()", "class_method_signature": "CreateAsyncOperationTask.execute()", "testcase": false, "constructor": false}], "file": "CoreFeatures/Database/AsyncOperationCollection/src/main/java/info/smart_tools/smartactors/database/async_operation_collection/task/CreateAsyncOperationTask.java"}, "focal_method": {"identifier": "prepare", "parameters": "(final IObject query)", "modifiers": "@Override public", "return": "void", "body": "@Override\n    public void prepare(final IObject query) throws TaskPrepareException {\n        try {\n            task = IOC.resolve(\n                    Keys.getOrAdd(\"db.collection.upsert\"),\n                    connection,\n                    collectionNameField.in(query),\n                    documentField.in(query)\n            );\n        } catch (ResolutionException e) {\n            throw new TaskPrepareException(\"Can't create ISearchQuery from input query\", e);\n        } catch (ReadValueException | InvalidArgumentException e) {\n            throw new TaskPrepareException(\"Can't change value in one of IObjects\", e);\n        }\n    }", "signature": "void prepare(final IObject query)", "full_signature": "@Override public void prepare(final IObject query)", "class_method_signature": "CreateAsyncOperationTask.prepare(final IObject query)", "testcase": false, "constructor": false, "invocations": ["resolve", "getOrAdd", "in", "in"]}, "repository": {"repo_id": 52972024, "url": "https://github.com/SmartTools/smartactors-core", "language": "Java", "is_fork": false, "fork_count": 7, "stargazer_count": 17, "size": 58816, "license": "licensed"}}