{"test_class": {"identifier": "OperatorsTest", "superclass": "", "interfaces": "", "fields": [{"original_string": "private PostgresQueryWriterResolver resolver;", "modifier": "private", "type": "PostgresQueryWriterResolver", "declarator": "resolver", "var_name": "resolver"}], "file": "CoreFeatures/Database-postgresql/PostgresSchema/src/test/java/info/smart_tools/smartactors/database_postgresql/postgres_schema/search/OperatorsTest.java"}, "test_case": {"identifier": "writeFieldExistsCheckConditionTest", "parameters": "()", "modifiers": "@Test public", "return": "void", "body": "@Test\n    public void writeFieldExistsCheckConditionTest() throws Exception {\n        FieldPath fieldPath = PostgresFieldPath.fromString(\"isNull\");\n\n        QueryStatement queryStatementIsNull = new QueryStatement();\n        resolver\n                .resolve(\"$isNull\")\n                .write(queryStatementIsNull, resolver, fieldPath, \"true\");\n        assertEquals(queryStatementIsNull.getBodyWriter().toString().trim(), \"(document#>'{isNull}') is null\");\n\n        QueryStatement queryStatementIsNotNull = new QueryStatement();\n        resolver\n                .resolve(\"$isNull\")\n                .write(queryStatementIsNotNull, resolver, fieldPath, \"false\");\n        assertEquals(queryStatementIsNotNull.getBodyWriter().toString().trim(), \"(document#>'{isNull}') is not null\");\n    }", "signature": "void writeFieldExistsCheckConditionTest()", "full_signature": "@Test public void writeFieldExistsCheckConditionTest()", "class_method_signature": "OperatorsTest.writeFieldExistsCheckConditionTest()", "testcase": true, "constructor": false, "invocations": ["fromString", "write", "resolve", "assertEquals", "trim", "toString", "getBodyWriter", "write", "resolve", "assertEquals", "trim", "toString", "getBodyWriter"]}, "focal_class": {"identifier": "Operators", "superclass": "", "interfaces": "", "fields": [], "methods": [{"identifier": "Operators", "parameters": "()", "modifiers": "private", "return": "", "signature": " Operators()", "full_signature": "private  Operators()", "class_method_signature": "Operators.Operators()", "testcase": false, "constructor": true}, {"identifier": "addAll", "parameters": "(final PostgresQueryWriterResolver resolver)", "modifiers": "public static", "return": "void", "signature": "void addAll(final PostgresQueryWriterResolver resolver)", "full_signature": "public static void addAll(final PostgresQueryWriterResolver resolver)", "class_method_signature": "Operators.addAll(final PostgresQueryWriterResolver resolver)", "testcase": false, "constructor": false}, {"identifier": "formattedCheckWriter", "parameters": "(final String format)", "modifiers": "private static", "return": "QueryWriter", "signature": "QueryWriter formattedCheckWriter(final String format)", "full_signature": "private static QueryWriter formattedCheckWriter(final String format)", "class_method_signature": "Operators.formattedCheckWriter(final String format)", "testcase": false, "constructor": false}, {"identifier": "writeFieldCheckCondition", "parameters": "(\n            final String format,\n            final QueryStatement query,\n            final FieldPath contextFieldPath,\n            final Object queryParameter\n    )", "modifiers": "private static", "return": "void", "signature": "void writeFieldCheckCondition(\n            final String format,\n            final QueryStatement query,\n            final FieldPath contextFieldPath,\n            final Object queryParameter\n    )", "full_signature": "private static void writeFieldCheckCondition(\n            final String format,\n            final QueryStatement query,\n            final FieldPath contextFieldPath,\n            final Object queryParameter\n    )", "class_method_signature": "Operators.writeFieldCheckCondition(\n            final String format,\n            final QueryStatement query,\n            final FieldPath contextFieldPath,\n            final Object queryParameter\n    )", "testcase": false, "constructor": false}, {"identifier": "writeFieldExistsCheckCondition", "parameters": "(\n            final QueryStatement query,\n            final QueryWriterResolver resolver,\n            final FieldPath contextFieldPath,\n            final Object queryParameter\n    )", "modifiers": "private static", "return": "void", "signature": "void writeFieldExistsCheckCondition(\n            final QueryStatement query,\n            final QueryWriterResolver resolver,\n            final FieldPath contextFieldPath,\n            final Object queryParameter\n    )", "full_signature": "private static void writeFieldExistsCheckCondition(\n            final QueryStatement query,\n            final QueryWriterResolver resolver,\n            final FieldPath contextFieldPath,\n            final Object queryParameter\n    )", "class_method_signature": "Operators.writeFieldExistsCheckCondition(\n            final QueryStatement query,\n            final QueryWriterResolver resolver,\n            final FieldPath contextFieldPath,\n            final Object queryParameter\n    )", "testcase": false, "constructor": false}, {"identifier": "writeFieldInArrayCheckCondition", "parameters": "(\n            final QueryStatement query,\n            final QueryWriterResolver resolver,\n            final FieldPath contextFieldPath,\n            final Object queryParameter\n    )", "modifiers": "private static", "return": "void", "signature": "void writeFieldInArrayCheckCondition(\n            final QueryStatement query,\n            final QueryWriterResolver resolver,\n            final FieldPath contextFieldPath,\n            final Object queryParameter\n    )", "full_signature": "private static void writeFieldInArrayCheckCondition(\n            final QueryStatement query,\n            final QueryWriterResolver resolver,\n            final FieldPath contextFieldPath,\n            final Object queryParameter\n    )", "class_method_signature": "Operators.writeFieldInArrayCheckCondition(\n            final QueryStatement query,\n            final QueryWriterResolver resolver,\n            final FieldPath contextFieldPath,\n            final Object queryParameter\n    )", "testcase": false, "constructor": false}], "file": "CoreFeatures/Database-postgresql/PostgresSchema/src/main/java/info/smart_tools/smartactors/database_postgresql/postgres_schema/search/Operators.java"}, "focal_method": {"identifier": "writeFieldExistsCheckCondition", "parameters": "(\n            final QueryStatement query,\n            final QueryWriterResolver resolver,\n            final FieldPath contextFieldPath,\n            final Object queryParameter\n    )", "modifiers": "private static", "return": "void", "body": "private static void writeFieldExistsCheckCondition(\n            final QueryStatement query,\n            final QueryWriterResolver resolver,\n            final FieldPath contextFieldPath,\n            final Object queryParameter\n    ) throws QueryBuildException {\n\n        if (contextFieldPath == null) {\n            throw new QueryBuildException(\"Field check conditions not allowed outside of field context.\");\n        }\n\n        try {\n            String isNullStr = String.valueOf(queryParameter);\n            if (!(isNullStr.equalsIgnoreCase(\"true\") || isNullStr.equalsIgnoreCase(\"false\"))) {\n                throw new QueryBuildException(\"Parameter for existence checking should represent boolean value.\");\n            }\n            Boolean isNull = Boolean.parseBoolean(isNullStr);\n            String condition = isNull ? \"(%s) is null\" : \"(%s) is not null\";\n            query.getBodyWriter().write(String.format(condition, contextFieldPath.toSQL()));\n        } catch (IOException e) {\n            throw new QueryBuildException(\"Query search conditions write failed because of exception.\", e);\n        }\n    }", "signature": "void writeFieldExistsCheckCondition(\n            final QueryStatement query,\n            final QueryWriterResolver resolver,\n            final FieldPath contextFieldPath,\n            final Object queryParameter\n    )", "full_signature": "private static void writeFieldExistsCheckCondition(\n            final QueryStatement query,\n            final QueryWriterResolver resolver,\n            final FieldPath contextFieldPath,\n            final Object queryParameter\n    )", "class_method_signature": "Operators.writeFieldExistsCheckCondition(\n            final QueryStatement query,\n            final QueryWriterResolver resolver,\n            final FieldPath contextFieldPath,\n            final Object queryParameter\n    )", "testcase": false, "constructor": false, "invocations": ["valueOf", "equalsIgnoreCase", "equalsIgnoreCase", "parseBoolean", "write", "getBodyWriter", "format", "toSQL"]}, "repository": {"repo_id": 52972024, "url": "https://github.com/SmartTools/smartactors-core", "language": "Java", "is_fork": false, "fork_count": 7, "stargazer_count": 17, "size": 58816, "license": "licensed"}}