{"test_class": {"identifier": "FullObjectCreatorResolutionStrategyTest", "superclass": "extends PluginsLoadingTestBase", "interfaces": "", "fields": [{"original_string": "private IResolveDependencyStrategy creator1ResolutionStrategyMock;", "modifier": "private", "type": "IResolveDependencyStrategy", "declarator": "creator1ResolutionStrategyMock", "var_name": "creator1ResolutionStrategyMock"}, {"original_string": "private IResolveDependencyStrategy creator2ResolutionStrategyMock;", "modifier": "private", "type": "IResolveDependencyStrategy", "declarator": "creator2ResolutionStrategyMock", "var_name": "creator2ResolutionStrategyMock"}, {"original_string": "private IReceiverObjectCreator creator1Mock;", "modifier": "private", "type": "IReceiverObjectCreator", "declarator": "creator1Mock", "var_name": "creator1Mock"}, {"original_string": "private IReceiverObjectCreator creator2Mock;", "modifier": "private", "type": "IReceiverObjectCreator", "declarator": "creator2Mock", "var_name": "creator2Mock"}], "file": "CoreFeatures/MessageProcessing/ObjectCreationStrategies/src/test/java/info/smart_tools/smartactors/message_processing/object_creation_strategies/FullObjectCreatorResolutionStrategyTest.java"}, "test_case": {"identifier": "Should_resolveCreatorsPipeline", "parameters": "()", "modifiers": "@Test public", "return": "void", "body": "@Test\n    public void Should_resolveCreatorsPipeline()\n            throws Exception {\n        IObject objectConfig = IOC.resolve(Keys.getOrAdd(\"info.smart_tools.smartactors.iobject.iobject.IObject\"),\n                (\"{\" +\n                 \"  'filters':[\" +\n                 \"      {\" +\n                        \"   'dependency':'filter 1 dependency'\" +\n                 \"      },\" +\n                        \"{\" +\n                        \"   'dependency':'filter 2 dependency'\" +\n                        \"}\" +\n                 \"  ]\" +\n                 \"}\").replace('\\'','\"'));\n\n        IReceiverObjectCreator result = new FullObjectCreatorResolutionStrategy().resolve(objectConfig);\n\n        assertSame(creator2Mock, result);\n    }", "signature": "void Should_resolveCreatorsPipeline()", "full_signature": "@Test public void Should_resolveCreatorsPipeline()", "class_method_signature": "FullObjectCreatorResolutionStrategyTest.Should_resolveCreatorsPipeline()", "testcase": true, "constructor": false, "invocations": ["resolve", "getOrAdd", "replace", "resolve", "assertSame"]}, "focal_class": {"identifier": "FullObjectCreatorResolutionStrategy", "superclass": "", "interfaces": "implements IResolveDependencyStrategy", "fields": [{"original_string": "private final IFieldName filtersFieldName;", "modifier": "private final", "type": "IFieldName", "declarator": "filtersFieldName", "var_name": "filtersFieldName"}, {"original_string": "private final IFieldName dependencyFieldName;", "modifier": "private final", "type": "IFieldName", "declarator": "dependencyFieldName", "var_name": "dependencyFieldName"}], "methods": [{"identifier": "FullObjectCreatorResolutionStrategy", "parameters": "()", "modifiers": "public", "return": "", "signature": " FullObjectCreatorResolutionStrategy()", "full_signature": "public  FullObjectCreatorResolutionStrategy()", "class_method_signature": "FullObjectCreatorResolutionStrategy.FullObjectCreatorResolutionStrategy()", "testcase": false, "constructor": true}, {"identifier": "resolve", "parameters": "(Object... args)", "modifiers": "@Override public", "return": "T", "signature": "T resolve(Object... args)", "full_signature": "@Override public T resolve(Object... args)", "class_method_signature": "FullObjectCreatorResolutionStrategy.resolve(Object... args)", "testcase": false, "constructor": false}], "file": "CoreFeatures/MessageProcessing/ObjectCreationStrategies/src/main/java/info/smart_tools/smartactors/message_processing/object_creation_strategies/FullObjectCreatorResolutionStrategy.java"}, "focal_method": {"identifier": "resolve", "parameters": "(Object... args)", "modifiers": "@Override public", "return": "T", "body": "@Override\n    public <T> T resolve(Object... args) throws ResolveDependencyStrategyException {\n        IObject config = (IObject) args[0];\n\n        try {\n            IReceiverObjectCreator creator = null;\n            List<IObject> filtersList = (List) config.getValue(filtersFieldName);\n\n            for (IObject fDesc : filtersList) {\n                creator = IOC.resolve(\n                        IOC.resolve(\n                                IOC.getKeyForKeyStorage(),\n                                fDesc.getValue(dependencyFieldName)\n                        ),\n                        creator,\n                        fDesc,\n                        config\n                );\n            }\n\n            return (T) creator;\n        } catch (InvalidArgumentException | ReadValueException | ResolutionException e) {\n            throw new ResolveDependencyStrategyException(e);\n        }\n    }", "signature": "T resolve(Object... args)", "full_signature": "@Override public T resolve(Object... args)", "class_method_signature": "FullObjectCreatorResolutionStrategy.resolve(Object... args)", "testcase": false, "constructor": false, "invocations": ["getValue", "resolve", "resolve", "getKeyForKeyStorage", "getValue"]}, "repository": {"repo_id": 52972024, "url": "https://github.com/SmartTools/smartactors-core", "language": "Java", "is_fork": false, "fork_count": 7, "stargazer_count": 17, "size": 58816, "license": "licensed"}}