{"test_class": {"identifier": "MapToIObjectResolveDependencyStrategyTest", "superclass": "", "interfaces": "", "fields": [{"original_string": "private MapToIObjectResolveDependencyStrategy strategy;", "modifier": "private", "type": "MapToIObjectResolveDependencyStrategy", "declarator": "strategy", "var_name": "strategy"}], "file": "CoreFeatures/IOCStrategyPack/ResolveIObjectStrategies/src/test/java/info/smart_tools/smartactors/ioc_strategy_pack/resolve_iobject_strategies/MapToIObjectResolveDependencyStrategyTest.java"}, "test_case": {"identifier": "ShouldCorrectConvertMapToIObject", "parameters": "()", "modifiers": "@Test public", "return": "void", "body": "@Test\n    public void ShouldCorrectConvertMapToIObject() throws Exception {\n\n        IKey key = mock(IKey.class);\n        when(Keys.getOrAdd(\"info.smart_tools.smartactors.iobject.ifield_name.IFieldName\")).thenReturn(key);\n\n        IFieldName fieldName1 = mock(IFieldName.class);\n        IFieldName fieldName2 = mock(IFieldName.class);\n        when(IOC.resolve(key, \"key1\")).thenReturn(fieldName1);\n        when(IOC.resolve(key, \"key2\")).thenReturn(fieldName2);\n\n        Map<String, Object> map = new LinkedHashMap<>();\n        map.put(\"key1\", 123);\n        map.put(\"key2\", \"value\");\n\n        IObject result = strategy.resolve(map);\n        assertEquals(result.getValue(fieldName1), 123);\n        assertEquals(result.getValue(fieldName2), \"value\");\n    }", "signature": "void ShouldCorrectConvertMapToIObject()", "full_signature": "@Test public void ShouldCorrectConvertMapToIObject()", "class_method_signature": "MapToIObjectResolveDependencyStrategyTest.ShouldCorrectConvertMapToIObject()", "testcase": true, "constructor": false, "invocations": ["mock", "thenReturn", "when", "getOrAdd", "mock", "mock", "thenReturn", "when", "resolve", "thenReturn", "when", "resolve", "put", "put", "resolve", "assertEquals", "getValue", "assertEquals", "getValue"]}, "focal_class": {"identifier": "MapToIObjectResolveDependencyStrategy", "superclass": "", "interfaces": "implements IResolveDependencyStrategy", "fields": [], "methods": [{"identifier": "resolve", "parameters": "(final Object... args)", "modifiers": "@Override public", "return": "T", "signature": "T resolve(final Object... args)", "full_signature": "@Override public T resolve(final Object... args)", "class_method_signature": "MapToIObjectResolveDependencyStrategy.resolve(final Object... args)", "testcase": false, "constructor": false}], "file": "CoreFeatures/IOCStrategyPack/ResolveIObjectStrategies/src/main/java/info/smart_tools/smartactors/ioc_strategy_pack/resolve_iobject_strategies/MapToIObjectResolveDependencyStrategy.java"}, "focal_method": {"identifier": "resolve", "parameters": "(final Object... args)", "modifiers": "@Override public", "return": "T", "body": "@Override\n    public <T> T resolve(final Object... args) throws ResolveDependencyStrategyException {\n\n        try {\n            Map<String, Object> stringObjectMap = (Map<String, Object>) args[0];\n            Map<IFieldName, Object> fieldNameObjectMap = new HashMap<>();\n            for (String key: stringObjectMap.keySet()) {\n                IFieldName fieldName = IOC.resolve(Keys.getOrAdd(\"info.smart_tools.smartactors.iobject.ifield_name.IFieldName\"), key);\n                fieldNameObjectMap.put(fieldName, stringObjectMap.get(key));\n            }\n\n            return (T) new DSObject(fieldNameObjectMap);\n        } catch (Exception e) {\n            throw new ResolveDependencyStrategyException(\"Can't create IObject from Map.\", e);\n        }\n    }", "signature": "T resolve(final Object... args)", "full_signature": "@Override public T resolve(final Object... args)", "class_method_signature": "MapToIObjectResolveDependencyStrategy.resolve(final Object... args)", "testcase": false, "constructor": false, "invocations": ["keySet", "resolve", "getOrAdd", "put", "get"]}, "repository": {"repo_id": 52972024, "url": "https://github.com/SmartTools/smartactors-core", "language": "Java", "is_fork": false, "fork_count": 7, "stargazer_count": 17, "size": 58816, "license": "licensed"}}