{"test_class": {"identifier": "CloseAsyncOperationActorPluginTest", "superclass": "", "interfaces": "", "fields": [{"original_string": "private CloseAsyncOperationActorPlugin plugin;", "modifier": "private", "type": "CloseAsyncOperationActorPlugin", "declarator": "plugin", "var_name": "plugin"}, {"original_string": "private IBootstrap bootstrap;", "modifier": "private", "type": "IBootstrap", "declarator": "bootstrap", "var_name": "bootstrap"}], "file": "CommonFeatures/AsyncOperations-plugins/PluginCloseAsyncOperationActor/src/test/java/info/smart_tools/smartactors/async_operations_plugins/close_async_operation_actor_plugin/CloseAsyncOperationActorPluginTest.java"}, "test_case": {"identifier": "MustCorrectLoadPlugin", "parameters": "()", "modifiers": "@Test public", "return": "void", "body": "@Test\n    public void MustCorrectLoadPlugin() throws Exception {\n\n        BootstrapItem bootstrapItem = mock(BootstrapItem.class);\n        whenNew(BootstrapItem.class).withArguments(\"CloseAsyncOperationActorPlugin\").thenReturn(bootstrapItem);\n\n        when(bootstrapItem.after(anyString())).thenReturn(bootstrapItem);\n        when(bootstrapItem.before(anyString())).thenReturn(bootstrapItem);\n\n        plugin.load();\n\n        verifyNew(BootstrapItem.class).withArguments(\"CloseAsyncOperationActorPlugin\");\n\n        ArgumentCaptor<IPoorAction> actionArgumentCaptor = ArgumentCaptor.forClass(IPoorAction.class);\n\n       // verify(bootstrapItem).after(\"IOC\");\n        verify(bootstrapItem).process(actionArgumentCaptor.capture());\n\n        verify(bootstrap).add(bootstrapItem);\n\n        IKey checkUserByEmailActorKey = mock(IKey.class);\n        when(Keys.getOrAdd(CloseAsyncOperationActor.class.getCanonicalName())).thenReturn(checkUserByEmailActorKey);\n\n        actionArgumentCaptor.getValue().execute();\n\n        verifyStatic();\n        Keys.getOrAdd(CloseAsyncOperationActor.class.getCanonicalName());\n\n        ArgumentCaptor<CreateNewInstanceStrategy> createNewInstanceStrategyArgumentCaptor = ArgumentCaptor.forClass(CreateNewInstanceStrategy.class);\n\n        verifyStatic();\n        IOC.register(eq(checkUserByEmailActorKey), createNewInstanceStrategyArgumentCaptor.capture());\n\n        CloseAsyncOperationActor actor = mock(CloseAsyncOperationActor.class);\n        IObject actorParams = mock(IObject.class);\n        whenNew(CloseAsyncOperationActor.class).withArguments(actorParams).thenReturn(actor);\n\n        assertEquals(\"Objects must return correct object\", createNewInstanceStrategyArgumentCaptor.getValue().resolve(actorParams), actor);\n\n        verifyNew(CloseAsyncOperationActor.class).withArguments(actorParams);\n    }", "signature": "void MustCorrectLoadPlugin()", "full_signature": "@Test public void MustCorrectLoadPlugin()", "class_method_signature": "CloseAsyncOperationActorPluginTest.MustCorrectLoadPlugin()", "testcase": true, "constructor": false, "invocations": ["mock", "thenReturn", "withArguments", "whenNew", "thenReturn", "when", "after", "anyString", "thenReturn", "when", "before", "anyString", "load", "withArguments", "verifyNew", "forClass", "process", "verify", "capture", "add", "verify", "mock", "thenReturn", "when", "getOrAdd", "getCanonicalName", "execute", "getValue", "verifyStatic", "getOrAdd", "getCanonicalName", "forClass", "verifyStatic", "register", "eq", "capture", "mock", "mock", "thenReturn", "withArguments", "whenNew", "assertEquals", "resolve", "getValue", "withArguments", "verifyNew"]}, "focal_class": {"identifier": "CloseAsyncOperationActorPlugin", "superclass": "", "interfaces": "implements IPlugin", "fields": [{"original_string": "private final IBootstrap<IBootstrapItem<String>> bootstrap;", "modifier": "private final", "type": "IBootstrap<IBootstrapItem<String>>", "declarator": "bootstrap", "var_name": "bootstrap"}], "methods": [{"identifier": "CloseAsyncOperationActorPlugin", "parameters": "(final IBootstrap<IBootstrapItem<String>> bootstrap)", "modifiers": "public", "return": "", "signature": " CloseAsyncOperationActorPlugin(final IBootstrap<IBootstrapItem<String>> bootstrap)", "full_signature": "public  CloseAsyncOperationActorPlugin(final IBootstrap<IBootstrapItem<String>> bootstrap)", "class_method_signature": "CloseAsyncOperationActorPlugin.CloseAsyncOperationActorPlugin(final IBootstrap<IBootstrapItem<String>> bootstrap)", "testcase": false, "constructor": true}, {"identifier": "load", "parameters": "()", "modifiers": "@Override public", "return": "void", "signature": "void load()", "full_signature": "@Override public void load()", "class_method_signature": "CloseAsyncOperationActorPlugin.load()", "testcase": false, "constructor": false}], "file": "CommonFeatures/AsyncOperations-plugins/PluginCloseAsyncOperationActor/src/main/java/info/smart_tools/smartactors/async_operations_plugins/close_async_operation_actor_plugin/CloseAsyncOperationActorPlugin.java"}, "focal_method": {"identifier": "load", "parameters": "()", "modifiers": "@Override public", "return": "void", "body": "@Override\n    public void load() throws PluginException {\n        try {\n            IBootstrapItem<String> item = new BootstrapItem(\"CloseAsyncOperationActorPlugin\");\n\n            item\n//                    .after(\"IOC\")\n//                    .before(\"starter\")\n                    .process(() -> {\n                        try {\n                            IKey checkUserByEmailActorKey = Keys.getOrAdd(CloseAsyncOperationActor.class.getCanonicalName());\n                            IOC.register(checkUserByEmailActorKey,\n                                    new CreateNewInstanceStrategy(\n                                            (args) -> {\n                                                try {\n                                                    return new CloseAsyncOperationActor((IObject) args[0]);\n                                                } catch (ArrayIndexOutOfBoundsException e) {\n                                                    throw new RuntimeException(\n                                                            \"Can't get args: args must contain one or more elements \" +\n                                                                    \"and first element must be IObject\",\n                                                            e);\n                                                } catch (InvalidArgumentException e) {\n                                                    throw new RuntimeException(\n                                                            \"Can't create actor with this args: \"\n                                                                    + Arrays.toString(args),\n                                                            e);\n                                                }\n                                            }\n                                    )\n                            );\n                        } catch (ResolutionException e) {\n                            throw new ActionExecuteException(\"CloseAsyncOperationActor plugin can't load: can't get CloseAsyncOperationActor key\", e);\n                        } catch (InvalidArgumentException e) {\n                            throw new ActionExecuteException(\"CloseAsyncOperationActor plugin can't load: can't create strategy\", e);\n                        } catch (RegistrationException e) {\n                            throw new ActionExecuteException(\"CloseAsyncOperationActor plugin can't load: can't register new strategy\", e);\n                        }\n                    });\n            bootstrap.add(item);\n        } catch (InvalidArgumentException e) {\n            throw new PluginException(\"Can't get BootstrapItem from one of reason\", e);\n        }\n    }", "signature": "void load()", "full_signature": "@Override public void load()", "class_method_signature": "CloseAsyncOperationActorPlugin.load()", "testcase": false, "constructor": false, "invocations": ["process", "getOrAdd", "getCanonicalName", "register", "toString", "add"]}, "repository": {"repo_id": 52972024, "url": "https://github.com/SmartTools/smartactors-core", "language": "Java", "is_fork": false, "fork_count": 7, "stargazer_count": 17, "size": 58816, "license": "licensed"}}