{"test_class": {"identifier": "SamplingFlagsTest", "superclass": "", "interfaces": "", "fields": [], "file": "brave/src/test/java/brave/propagation/SamplingFlagsTest.java"}, "test_case": {"identifier": "toSamplingFlags_returnsConstantsAndHasNiceToString", "parameters": "()", "modifiers": "@Test public", "return": "void", "body": "@Test public void toSamplingFlags_returnsConstantsAndHasNiceToString() {\n    assertThat(toSamplingFlags(SamplingFlags.EMPTY.flags))\n      .isSameAs(SamplingFlags.EMPTY)\n      .hasToString(\"\");\n    assertThat(toSamplingFlags(SamplingFlags.NOT_SAMPLED.flags))\n      .isSameAs(SamplingFlags.NOT_SAMPLED)\n      .hasToString(\"NOT_SAMPLED_REMOTE\");\n    assertThat(toSamplingFlags(SamplingFlags.SAMPLED.flags))\n      .isSameAs(SamplingFlags.SAMPLED)\n      .hasToString(\"SAMPLED_REMOTE\");\n    assertThat(toSamplingFlags(SamplingFlags.DEBUG.flags))\n      .isSameAs(SamplingFlags.DEBUG)\n      .hasToString(\"DEBUG\");\n    assertThat(toSamplingFlags(SamplingFlags.EMPTY.flags | FLAG_SAMPLED_LOCAL))\n      .isSameAs(SamplingFlags.EMPTY_SAMPLED_LOCAL)\n      .hasToString(\"SAMPLED_LOCAL\");\n    assertThat(toSamplingFlags(SamplingFlags.NOT_SAMPLED.flags | FLAG_SAMPLED_LOCAL))\n      .isSameAs(SamplingFlags.NOT_SAMPLED_SAMPLED_LOCAL)\n      .hasToString(\"NOT_SAMPLED_REMOTE|SAMPLED_LOCAL\");\n    assertThat(toSamplingFlags(SamplingFlags.SAMPLED.flags | FLAG_SAMPLED_LOCAL))\n      .isSameAs(SamplingFlags.SAMPLED_SAMPLED_LOCAL)\n      .hasToString(\"SAMPLED_REMOTE|SAMPLED_LOCAL\");\n    assertThat(toSamplingFlags(SamplingFlags.DEBUG.flags | FLAG_SAMPLED_LOCAL))\n      .isSameAs(SamplingFlags.DEBUG_SAMPLED_LOCAL)\n      .hasToString(\"DEBUG|SAMPLED_LOCAL\");\n  }", "signature": "void toSamplingFlags_returnsConstantsAndHasNiceToString()", "full_signature": "@Test public void toSamplingFlags_returnsConstantsAndHasNiceToString()", "class_method_signature": "SamplingFlagsTest.toSamplingFlags_returnsConstantsAndHasNiceToString()", "testcase": true, "constructor": false, "invocations": ["hasToString", "isSameAs", "assertThat", "toSamplingFlags", "hasToString", "isSameAs", "assertThat", "toSamplingFlags", "hasToString", "isSameAs", "assertThat", "toSamplingFlags", "hasToString", "isSameAs", "assertThat", "toSamplingFlags", "hasToString", "isSameAs", "assertThat", "toSamplingFlags", "hasToString", "isSameAs", "assertThat", "toSamplingFlags", "hasToString", "isSameAs", "assertThat", "toSamplingFlags", "hasToString", "isSameAs", "assertThat", "toSamplingFlags"]}, "focal_class": {"identifier": "SamplingFlags", "superclass": "", "interfaces": "", "fields": [{"original_string": "public static final SamplingFlags EMPTY = new SamplingFlags(0);", "modifier": "public static final", "type": "SamplingFlags", "declarator": "EMPTY = new SamplingFlags(0)", "var_name": "EMPTY"}, {"original_string": "public static final SamplingFlags NOT_SAMPLED = new SamplingFlags(FLAG_SAMPLED_SET);", "modifier": "public static final", "type": "SamplingFlags", "declarator": "NOT_SAMPLED = new SamplingFlags(FLAG_SAMPLED_SET)", "var_name": "NOT_SAMPLED"}, {"original_string": "public static final SamplingFlags SAMPLED = new SamplingFlags(NOT_SAMPLED.flags | FLAG_SAMPLED);", "modifier": "public static final", "type": "SamplingFlags", "declarator": "SAMPLED = new SamplingFlags(NOT_SAMPLED.flags | FLAG_SAMPLED)", "var_name": "SAMPLED"}, {"original_string": "public static final SamplingFlags DEBUG = new SamplingFlags(SAMPLED.flags | FLAG_DEBUG);", "modifier": "public static final", "type": "SamplingFlags", "declarator": "DEBUG = new SamplingFlags(SAMPLED.flags | FLAG_DEBUG)", "var_name": "DEBUG"}, {"original_string": "final int flags;", "modifier": "final", "type": "int", "declarator": "flags", "var_name": "flags"}, {"original_string": "static final SamplingFlags\n    EMPTY_SAMPLED_LOCAL = new SamplingFlags(FLAG_SAMPLED_LOCAL),\n    NOT_SAMPLED_SAMPLED_LOCAL = new SamplingFlags(NOT_SAMPLED.flags | FLAG_SAMPLED_LOCAL),\n    SAMPLED_SAMPLED_LOCAL = new SamplingFlags(SAMPLED.flags | FLAG_SAMPLED_LOCAL),\n    DEBUG_SAMPLED_LOCAL = new SamplingFlags(DEBUG.flags | FLAG_SAMPLED_LOCAL);", "modifier": "static final", "type": "SamplingFlags", "declarator": "EMPTY_SAMPLED_LOCAL = new SamplingFlags(FLAG_SAMPLED_LOCAL)", "var_name": "EMPTY_SAMPLED_LOCAL"}], "methods": [{"identifier": "SamplingFlags", "parameters": "(int flags)", "modifiers": "", "return": "", "signature": " SamplingFlags(int flags)", "full_signature": "  SamplingFlags(int flags)", "class_method_signature": "SamplingFlags.SamplingFlags(int flags)", "testcase": false, "constructor": true}, {"identifier": "sampled", "parameters": "()", "modifiers": "@Nullable public final", "return": "Boolean", "signature": "Boolean sampled()", "full_signature": "@Nullable public final Boolean sampled()", "class_method_signature": "SamplingFlags.sampled()", "testcase": false, "constructor": false}, {"identifier": "sampledLocal", "parameters": "()", "modifiers": "public final", "return": "boolean", "signature": "boolean sampledLocal()", "full_signature": "public final boolean sampledLocal()", "class_method_signature": "SamplingFlags.sampledLocal()", "testcase": false, "constructor": false}, {"identifier": "debug", "parameters": "()", "modifiers": "public final", "return": "boolean", "signature": "boolean debug()", "full_signature": "public final boolean debug()", "class_method_signature": "SamplingFlags.debug()", "testcase": false, "constructor": false}, {"identifier": "toString", "parameters": "()", "modifiers": "@Override public", "return": "String", "signature": "String toString()", "full_signature": "@Override public String toString()", "class_method_signature": "SamplingFlags.toString()", "testcase": false, "constructor": false}, {"identifier": "toString", "parameters": "(int flags)", "modifiers": "static", "return": "String", "signature": "String toString(int flags)", "full_signature": "static String toString(int flags)", "class_method_signature": "SamplingFlags.toString(int flags)", "testcase": false, "constructor": false}, {"identifier": "debug", "parameters": "(int flags)", "modifiers": "static", "return": "boolean", "signature": "boolean debug(int flags)", "full_signature": "static boolean debug(int flags)", "class_method_signature": "SamplingFlags.debug(int flags)", "testcase": false, "constructor": false}, {"identifier": "debug", "parameters": "(boolean debug, int flags)", "modifiers": "static", "return": "int", "signature": "int debug(boolean debug, int flags)", "full_signature": "static int debug(boolean debug, int flags)", "class_method_signature": "SamplingFlags.debug(boolean debug, int flags)", "testcase": false, "constructor": false}, {"identifier": "toSamplingFlags", "parameters": "(int flags)", "modifiers": "static", "return": "SamplingFlags", "signature": "SamplingFlags toSamplingFlags(int flags)", "full_signature": "static SamplingFlags toSamplingFlags(int flags)", "class_method_signature": "SamplingFlags.toSamplingFlags(int flags)", "testcase": false, "constructor": false}], "file": "brave/src/main/java/brave/propagation/SamplingFlags.java"}, "focal_method": {"identifier": "toSamplingFlags", "parameters": "(int flags)", "modifiers": "static", "return": "SamplingFlags", "body": "static SamplingFlags toSamplingFlags(int flags) {\n    switch (flags) {\n      case 0:\n        return EMPTY;\n      case FLAG_SAMPLED_SET:\n        return NOT_SAMPLED;\n      case FLAG_SAMPLED_SET | FLAG_SAMPLED:\n        return SAMPLED;\n      case FLAG_SAMPLED_SET | FLAG_SAMPLED | FLAG_DEBUG:\n        return DEBUG;\n      case FLAG_SAMPLED_LOCAL:\n        return EMPTY_SAMPLED_LOCAL;\n      case FLAG_SAMPLED_LOCAL | FLAG_SAMPLED_SET:\n        return NOT_SAMPLED_SAMPLED_LOCAL;\n      case FLAG_SAMPLED_LOCAL | FLAG_SAMPLED_SET | FLAG_SAMPLED:\n        return SAMPLED_SAMPLED_LOCAL;\n      case FLAG_SAMPLED_LOCAL | FLAG_SAMPLED_SET | FLAG_SAMPLED | FLAG_DEBUG:\n        return DEBUG_SAMPLED_LOCAL;\n      default:\n        assert false; // programming error, but build anyway\n        return new SamplingFlags(flags);\n    }\n  }", "signature": "SamplingFlags toSamplingFlags(int flags)", "full_signature": "static SamplingFlags toSamplingFlags(int flags)", "class_method_signature": "SamplingFlags.toSamplingFlags(int flags)", "testcase": false, "constructor": false, "invocations": []}, "repository": {"repo_id": 9278888, "url": "https://github.com/openzipkin/brave", "stars": 1754, "created": "4/7/2013 3:48:18 PM +00:00", "updates": "2020-01-26T11:52:41+00:00", "fork": "False", "license": "licensed"}}