{"test_class": {"identifier": "urn_perun_user_facility_attribute_def_virt_shellTest", "superclass": "", "interfaces": "", "fields": [{"original_string": "private static urn_perun_user_facility_attribute_def_virt_shell classInstance;", "modifier": "private static", "type": "urn_perun_user_facility_attribute_def_virt_shell", "declarator": "classInstance", "var_name": "classInstance"}, {"original_string": "private static PerunSessionImpl session;", "modifier": "private static", "type": "PerunSessionImpl", "declarator": "session", "var_name": "session"}, {"original_string": "private static Attribute preffered;", "modifier": "private static", "type": "Attribute", "declarator": "preffered", "var_name": "preffered"}, {"original_string": "private static Attribute defDefShell;", "modifier": "private static", "type": "Attribute", "declarator": "defDefShell", "var_name": "defDefShell"}, {"original_string": "private static Attribute facilityShell;", "modifier": "private static", "type": "Attribute", "declarator": "facilityShell", "var_name": "facilityShell"}, {"original_string": "private static List<String> resourceShell;", "modifier": "private static", "type": "List<String>", "declarator": "resourceShell", "var_name": "resourceShell"}, {"original_string": "private static List<String> listOfMntPts;", "modifier": "private static", "type": "List<String>", "declarator": "listOfMntPts", "var_name": "listOfMntPts"}, {"original_string": "private static User user;", "modifier": "private static", "type": "User", "declarator": "user", "var_name": "user"}, {"original_string": "private static Facility facility;", "modifier": "private static", "type": "Facility", "declarator": "facility", "var_name": "facility"}, {"original_string": "private static Resource resource;", "modifier": "private static", "type": "Resource", "declarator": "resource", "var_name": "resource"}, {"original_string": "private static Resource resource1;", "modifier": "private static", "type": "Resource", "declarator": "resource1", "var_name": "resource1"}, {"original_string": "private static List<Resource> resourceList;", "modifier": "private static", "type": "List<Resource>", "declarator": "resourceList", "var_name": "resourceList"}], "file": "perun-core/src/test/java/cz/metacentrum/perun/core/impl/modules/attributes/urn_perun_user_facility_attribute_def_virt_shellTest.java"}, "test_case": {"identifier": "getAttributeValueTest", "parameters": "()", "modifiers": "@Test public", "return": "void", "body": "@Test\n\tpublic void getAttributeValueTest() throws Exception{\n\t\tSystem.out.println(\"urn_perun_user_facility_attribute_def_virt_shell.GetAttributeValue()\");\n\n\t\twhen(session.getPerunBl().getAttributesManagerBl().getAttribute(any(PerunSessionImpl.class), any(Facility.class), any(User.class), eq(AttributesManager.NS_USER_FACILITY_ATTR_DEF + \":shell\"))).thenReturn(defDefShell);\n\t\twhen(session.getPerunBl().getAttributesManagerBl().getAttribute(any(PerunSessionImpl.class), any(Facility.class), eq(AttributesManager.NS_FACILITY_ATTR_DEF + \":shells\"))).thenReturn(facilityShell);\n\t\twhen(session.getPerunBl().getAttributesManagerBl().getAttribute(any(PerunSessionImpl.class), any(User.class), eq(AttributesManager.NS_USER_ATTR_DEF + \":preferredShells\"))).thenReturn(preffered);\n\t\twhen(session.getPerunBl().getAttributesManagerBl().getAttribute(any(PerunSessionImpl.class), any(Resource.class), eq(AttributesManager.NS_RESOURCE_ATTR_DEF + \":shells\")).getValue()).thenReturn(resourceShell);\n\t\twhen(session.getPerunBl().getUsersManagerBl().getAllowedResources(any(PerunSessionImpl.class), any(Facility.class), any(User.class))).thenReturn(resourceList);\n\n\t\tAttribute testAttr = classInstance.getAttributeValue(session, user, facility, session.getPerunBl().getAttributesManagerBl().getAttributeDefinition(session, AttributesManager.NS_USER_FACILITY_ATTR_VIRT + \"shell\"));\n\t\tassertEquals(\"/mnt/bash2\", testAttr.getValue());\n\n\t}", "signature": "void getAttributeValueTest()", "full_signature": "@Test public void getAttributeValueTest()", "class_method_signature": "urn_perun_user_facility_attribute_def_virt_shellTest.getAttributeValueTest()", "testcase": true, "constructor": false, "invocations": ["println", "thenReturn", "when", "getAttribute", "getAttributesManagerBl", "getPerunBl", "any", "any", "any", "eq", "thenReturn", "when", "getAttribute", "getAttributesManagerBl", "getPerunBl", "any", "any", "eq", "thenReturn", "when", "getAttribute", "getAttributesManagerBl", "getPerunBl", "any", "any", "eq", "thenReturn", "when", "getValue", "getAttribute", "getAttributesManagerBl", "getPerunBl", "any", "any", "eq", "thenReturn", "when", "getAllowedResources", "getUsersManagerBl", "getPerunBl", "any", "any", "any", "getAttributeValue", "getAttributeDefinition", "getAttributesManagerBl", "getPerunBl", "assertEquals", "getValue"]}, "focal_class": {"identifier": "urn_perun_user_facility_attribute_def_virt_shell", "superclass": "extends UserFacilityVirtualAttributesModuleAbstract", "interfaces": "implements UserFacilityVirtualAttributesModuleImplApi", "fields": [], "methods": [{"identifier": "getAttributeValue", "parameters": "(PerunSessionImpl sess, User user, Facility facility, AttributeDefinition attributeDefinition)", "modifiers": "@Override public", "return": "Attribute", "signature": "Attribute getAttributeValue(PerunSessionImpl sess, User user, Facility facility, AttributeDefinition attributeDefinition)", "full_signature": "@Override public Attribute getAttributeValue(PerunSessionImpl sess, User user, Facility facility, AttributeDefinition attributeDefinition)", "class_method_signature": "urn_perun_user_facility_attribute_def_virt_shell.getAttributeValue(PerunSessionImpl sess, User user, Facility facility, AttributeDefinition attributeDefinition)", "testcase": false, "constructor": false}, {"identifier": "setAttributeValue", "parameters": "(PerunSessionImpl sess, User user, Facility facility, Attribute attribute)", "modifiers": "@Override public", "return": "boolean", "signature": "boolean setAttributeValue(PerunSessionImpl sess, User user, Facility facility, Attribute attribute)", "full_signature": "@Override public boolean setAttributeValue(PerunSessionImpl sess, User user, Facility facility, Attribute attribute)", "class_method_signature": "urn_perun_user_facility_attribute_def_virt_shell.setAttributeValue(PerunSessionImpl sess, User user, Facility facility, Attribute attribute)", "testcase": false, "constructor": false}, {"identifier": "getStrongDependencies", "parameters": "()", "modifiers": "@Override public", "return": "List<String>", "signature": "List<String> getStrongDependencies()", "full_signature": "@Override public List<String> getStrongDependencies()", "class_method_signature": "urn_perun_user_facility_attribute_def_virt_shell.getStrongDependencies()", "testcase": false, "constructor": false}, {"identifier": "getAttributeDefinition", "parameters": "()", "modifiers": "@Override public", "return": "AttributeDefinition", "signature": "AttributeDefinition getAttributeDefinition()", "full_signature": "@Override public AttributeDefinition getAttributeDefinition()", "class_method_signature": "urn_perun_user_facility_attribute_def_virt_shell.getAttributeDefinition()", "testcase": false, "constructor": false}], "file": "perun-core/src/main/java/cz/metacentrum/perun/core/impl/modules/attributes/urn_perun_user_facility_attribute_def_virt_shell.java"}, "focal_method": {"identifier": "getAttributeValue", "parameters": "(PerunSessionImpl sess, User user, Facility facility, AttributeDefinition attributeDefinition)", "modifiers": "@Override public", "return": "Attribute", "body": "@Override\n\tpublic Attribute getAttributeValue(PerunSessionImpl sess, User user, Facility facility, AttributeDefinition attributeDefinition) {\n\t\tAttribute attr = new Attribute(attributeDefinition);\n\t\ttry {\n\t\t\tAttribute attribute = sess.getPerunBl().getAttributesManagerBl().getAttribute(sess, facility, user, AttributesManager.NS_USER_FACILITY_ATTR_DEF + \":shell\");\n\t\t\tif (attribute.getValue() != null) {\n\t\t\t\tUtils.copyAttributeToVirtualAttributeWithValue(attribute, attr);\n\t\t\t\treturn attr;\n\t\t\t}\n\t\t} catch (WrongAttributeAssignmentException | AttributeNotExistsException ex) {\n\t\t\tthrow new InternalErrorException(ex);\n\t\t}\n\n\t\ttry {\n\t\t\tAttribute facilityShells = sess.getPerunBl().getAttributesManagerBl().getAttribute(sess, facility, AttributesManager.NS_FACILITY_ATTR_DEF + \":shells\");\n\t\t\tAttribute userPrefferedShells = (sess.getPerunBl().getAttributesManagerBl().getAttribute(sess, user, AttributesManager.NS_USER_ATTR_DEF + \":preferredShells\"));\n\t\t\tList<Resource> resources = sess.getPerunBl().getUsersManagerBl().getAllowedResources(sess, facility, user);\n\t\t\tSet<String> resourcesShells = new HashSet<>();\n\n\t\t\tfor (Resource resource : resources) {\n\t\t\t\tList<String> resourcesShellsForTest = (List<String>) sess.getPerunBl().getAttributesManagerBl().getAttribute(sess, resource, AttributesManager.NS_RESOURCE_ATTR_DEF + \":shells\").getValue();\n\t\t\t\tif (resourcesShellsForTest != null) resourcesShells.addAll(resourcesShellsForTest);\n\t\t\t}\n\t\t\tif (userPrefferedShells.getValue() != null){\n\t\t\t\tfor (String pShell : (List<String>)userPrefferedShells.getValue()) {\n\t\t\t\t\tif (resourcesShells.contains(pShell)) {\n\t\t\t\t\t\tUtils.copyAttributeToViAttributeWithoutValue(userPrefferedShells, attr);\n\t\t\t\t\t\tattr.setValue(pShell);\n\t\t\t\t\t\treturn attr;\n\t\t\t\t\t}\n\t\t\t\t}\n\t\t\t}\n\t\t\tif (facilityShells.getValue() != null){\n\t\t\t\tfor (String fShell : (List<String>)facilityShells.getValue()) {\n\t\t\t\t\tif (resourcesShells.contains(fShell)) {\n\t\t\t\t\t\tUtils.copyAttributeToViAttributeWithoutValue(facilityShells, attr);\n\t\t\t\t\t\tattr.setValue(fShell);\n\t\t\t\t\t\treturn attr;\n\t\t\t\t\t}\n\t\t\t\t}\n\t\t\t}\n\n\t\t} catch (AttributeNotExistsException | WrongAttributeAssignmentException ex) {\n\t\t\tthrow new InternalErrorException(ex);\n\t\t}\n\t\treturn attr;\n\n\t}", "signature": "Attribute getAttributeValue(PerunSessionImpl sess, User user, Facility facility, AttributeDefinition attributeDefinition)", "full_signature": "@Override public Attribute getAttributeValue(PerunSessionImpl sess, User user, Facility facility, AttributeDefinition attributeDefinition)", "class_method_signature": "urn_perun_user_facility_attribute_def_virt_shell.getAttributeValue(PerunSessionImpl sess, User user, Facility facility, AttributeDefinition attributeDefinition)", "testcase": false, "constructor": false, "invocations": ["getAttribute", "getAttributesManagerBl", "getPerunBl", "getValue", "copyAttributeToVirtualAttributeWithValue", "getAttribute", "getAttributesManagerBl", "getPerunBl", "getAttribute", "getAttributesManagerBl", "getPerunBl", "getAllowedResources", "getUsersManagerBl", "getPerunBl", "getValue", "getAttribute", "getAttributesManagerBl", "getPerunBl", "addAll", "getValue", "getValue", "contains", "copyAttributeToViAttributeWithoutValue", "setValue", "getValue", "getValue", "contains", "copyAttributeToViAttributeWithoutValue", "setValue"]}, "repository": {"repo_id": 4085998, "url": "https://github.com/CESNET/perun", "stars": 38, "created": "4/20/2012 11:55:38 AM +00:00", "updates": "2020-01-27T09:51:13+00:00", "fork": "False", "license": "licensed"}}