{"test_class": {"identifier": "urn_perun_user_facility_attribute_def_def_homeMountPointTest", "superclass": "", "interfaces": "", "fields": [{"original_string": "private static PerunSessionImpl session;", "modifier": "private static", "type": "PerunSessionImpl", "declarator": "session", "var_name": "session"}, {"original_string": "private static urn_perun_user_facility_attribute_def_def_homeMountPoint classInstance;", "modifier": "private static", "type": "urn_perun_user_facility_attribute_def_def_homeMountPoint", "declarator": "classInstance", "var_name": "classInstance"}, {"original_string": "private static Attribute listOfMntPts;", "modifier": "private static", "type": "Attribute", "declarator": "listOfMntPts", "var_name": "listOfMntPts"}, {"original_string": "private static User user;", "modifier": "private static", "type": "User", "declarator": "user", "var_name": "user"}, {"original_string": "private static Facility facility;", "modifier": "private static", "type": "Facility", "declarator": "facility", "var_name": "facility"}, {"original_string": "private static Resource resource;", "modifier": "private static", "type": "Resource", "declarator": "resource", "var_name": "resource"}, {"original_string": "private static Resource resource1;", "modifier": "private static", "type": "Resource", "declarator": "resource1", "var_name": "resource1"}], "file": "perun-core/src/test/java/cz/metacentrum/perun/core/impl/modules/attributes/urn_perun_user_facility_attribute_def_def_homeMountPointTest.java"}, "test_case": {"identifier": "testCheckAttributeSemanticsWithEmptyAttribute", "parameters": "()", "modifiers": "@Test(expected = WrongReferenceAttributeValueException.class) public", "return": "void", "body": "@Test(expected = WrongReferenceAttributeValueException.class)\n\t\tpublic void testCheckAttributeSemanticsWithEmptyAttribute() throws Exception {\n\t\t\tSystem.out.println(\"testCheckAttributeSemanticsWithEmptyAttribute()\");\n\n\t\t\twhen(session.getPerunBl().getUsersManagerBl().getAllowedResources(any(PerunSession.class), any(Facility.class), any(User.class))).thenReturn(new ArrayList<Resource>() {\n\n\t\t\t\t{\n\t\t\t\t\tadd(resource);\n\t\t\t\t}\n\t\t\t});\n\t\t\twhen(session.getPerunBl().getFacilitiesManagerBl().getAssignedResources(any(PerunSession.class), any(Facility.class))).thenReturn(new ArrayList<Resource>() {\n\n\t\t\t\t{\n\t\t\t\t\tadd(resource);\n\t\t\t\t}\n\t\t\t});\n\t\t\twhen(session.getPerunBl().getAttributesManagerBl().getAttribute(any(PerunSession.class), any(Resource.class), anyString())).thenReturn(listOfMntPts);\n\n\t\t\tclassInstance.checkAttributeSemantics(session, user, facility, new Attribute());\n\t\t\tfail(\"Empty attribute should have thrown an exception\");\n\n\t\t}", "signature": "void testCheckAttributeSemanticsWithEmptyAttribute()", "full_signature": "@Test(expected = WrongReferenceAttributeValueException.class) public void testCheckAttributeSemanticsWithEmptyAttribute()", "class_method_signature": "urn_perun_user_facility_attribute_def_def_homeMountPointTest.testCheckAttributeSemanticsWithEmptyAttribute()", "testcase": true, "constructor": false, "invocations": ["println", "thenReturn", "when", "getAllowedResources", "getUsersManagerBl", "getPerunBl", "any", "any", "any", "add", "thenReturn", "when", "getAssignedResources", "getFacilitiesManagerBl", "getPerunBl", "any", "any", "add", "thenReturn", "when", "getAttribute", "getAttributesManagerBl", "getPerunBl", "any", "any", "anyString", "checkAttributeSemantics", "fail"]}, "focal_class": {"identifier": "urn_perun_user_facility_attribute_def_def_homeMountPoint", "superclass": "extends UserFacilityAttributesModuleAbstract", "interfaces": "implements UserFacilityAttributesModuleImplApi", "fields": [{"original_string": "private static final Pattern pattern = Pattern.compile(\"^/[-a-zA-Z.0-9_/]*$*\");", "modifier": "private static final", "type": "Pattern", "declarator": "pattern = Pattern.compile(\"^/[-a-zA-Z.0-9_/]*$*\")", "var_name": "pattern"}], "methods": [{"identifier": "checkAttributeSemantics", "parameters": "(PerunSessionImpl session, User user, Facility facility, Attribute attribute)", "modifiers": "@Override public", "return": "void", "signature": "void checkAttributeSemantics(PerunSessionImpl session, User user, Facility facility, Attribute attribute)", "full_signature": "@Override public void checkAttributeSemantics(PerunSessionImpl session, User user, Facility facility, Attribute attribute)", "class_method_signature": "urn_perun_user_facility_attribute_def_def_homeMountPoint.checkAttributeSemantics(PerunSessionImpl session, User user, Facility facility, Attribute attribute)", "testcase": false, "constructor": false}, {"identifier": "checkAttributeSyntax", "parameters": "(PerunSessionImpl session, User user, Facility facility, Attribute attribute)", "modifiers": "@Override public", "return": "void", "signature": "void checkAttributeSyntax(PerunSessionImpl session, User user, Facility facility, Attribute attribute)", "full_signature": "@Override public void checkAttributeSyntax(PerunSessionImpl session, User user, Facility facility, Attribute attribute)", "class_method_signature": "urn_perun_user_facility_attribute_def_def_homeMountPoint.checkAttributeSyntax(PerunSessionImpl session, User user, Facility facility, Attribute attribute)", "testcase": false, "constructor": false}, {"identifier": "fillAttribute", "parameters": "(PerunSessionImpl session, User user, Facility facility, AttributeDefinition attribute)", "modifiers": "@Override public", "return": "Attribute", "signature": "Attribute fillAttribute(PerunSessionImpl session, User user, Facility facility, AttributeDefinition attribute)", "full_signature": "@Override public Attribute fillAttribute(PerunSessionImpl session, User user, Facility facility, AttributeDefinition attribute)", "class_method_signature": "urn_perun_user_facility_attribute_def_def_homeMountPoint.fillAttribute(PerunSessionImpl session, User user, Facility facility, AttributeDefinition attribute)", "testcase": false, "constructor": false}, {"identifier": "getDependencies", "parameters": "()", "modifiers": "@Override public", "return": "List<String>", "signature": "List<String> getDependencies()", "full_signature": "@Override public List<String> getDependencies()", "class_method_signature": "urn_perun_user_facility_attribute_def_def_homeMountPoint.getDependencies()", "testcase": false, "constructor": false}, {"identifier": "getAttributeDefinition", "parameters": "()", "modifiers": "@Override public", "return": "AttributeDefinition", "signature": "AttributeDefinition getAttributeDefinition()", "full_signature": "@Override public AttributeDefinition getAttributeDefinition()", "class_method_signature": "urn_perun_user_facility_attribute_def_def_homeMountPoint.getAttributeDefinition()", "testcase": false, "constructor": false}], "file": "perun-core/src/main/java/cz/metacentrum/perun/core/impl/modules/attributes/urn_perun_user_facility_attribute_def_def_homeMountPoint.java"}, "focal_method": {"identifier": "checkAttributeSemantics", "parameters": "(PerunSessionImpl session, User user, Facility facility, Attribute attribute)", "modifiers": "@Override public", "return": "void", "body": "@Override\n\tpublic void checkAttributeSemantics(PerunSessionImpl session, User user, Facility facility, Attribute attribute) throws WrongReferenceAttributeValueException, WrongAttributeAssignmentException {\n\n\t\tList<Resource> usersResources = session.getPerunBl().getUsersManagerBl().getAllowedResources(session, facility, user);\n\n\t\tList<String> homeMntPointsOnAllResources = new ArrayList<>();\n\t\tfor (Resource res : usersResources) {\n\t\t\tAttribute resAttribute;\n\t\t\ttry {\n\t\t\t\tresAttribute = session.getPerunBl().getAttributesManagerBl().getAttribute(session, res, AttributesManager.NS_RESOURCE_ATTR_DEF + \":homeMountPoints\");\n\t\t\t} catch (AttributeNotExistsException ex) {\n\t\t\t\tthrow new InternalErrorException(\"no homemountpoints found on underlying resources\", ex);\n\t\t\t}\n\t\t\tList<String> homeMntPoint = resAttribute.valueAsList();\n\t\t\tif (homeMntPoint != null) {\n\t\t\t\thomeMntPointsOnAllResources.addAll(homeMntPoint);\n\t\t\t}\n\t\t}\n\t\tif (homeMntPointsOnAllResources.isEmpty()) {\n\t\t\tthrow new WrongReferenceAttributeValueException(\"No homeMountPoints set on associated resources.\");\n\t\t}\n\t\tif (!homeMntPointsOnAllResources.contains(attribute.valueAsString())) {\n\t\t\tthrow new WrongReferenceAttributeValueException(attribute, null, user, facility, \"User's home mount point is invalid. Valid mount points: \" + homeMntPointsOnAllResources);\n\t\t}\n\t}", "signature": "void checkAttributeSemantics(PerunSessionImpl session, User user, Facility facility, Attribute attribute)", "full_signature": "@Override public void checkAttributeSemantics(PerunSessionImpl session, User user, Facility facility, Attribute attribute)", "class_method_signature": "urn_perun_user_facility_attribute_def_def_homeMountPoint.checkAttributeSemantics(PerunSessionImpl session, User user, Facility facility, Attribute attribute)", "testcase": false, "constructor": false, "invocations": ["getAllowedResources", "getUsersManagerBl", "getPerunBl", "getAttribute", "getAttributesManagerBl", "getPerunBl", "valueAsList", "addAll", "isEmpty", "contains", "valueAsString"]}, "repository": {"repo_id": 4085998, "url": "https://github.com/CESNET/perun", "stars": 38, "created": "4/20/2012 11:55:38 AM +00:00", "updates": "2020-01-27T09:51:13+00:00", "fork": "False", "license": "licensed"}}