{"test_class": {"identifier": "TestExecutablePlainForm", "superclass": "", "interfaces": "", "fields": [], "file": "org.jvoicexml/src/test/java/org/jvoicexml/interpreter/dialog/TestExecutablePlainForm.java"}, "test_case": {"identifier": "testGetCatchElements", "parameters": "()", "modifiers": "@Test public", "return": "void", "body": "@Test\n    public void testGetCatchElements() throws Exception {\n        final VoiceXmlDocument document = new VoiceXmlDocument();\n        final Vxml vxml = document.getVxml();\n        final Form form = vxml.appendChild(Form.class);\n        form.appendChild(Filled.class);\n        final Noinput noinput = form.appendChild(Noinput.class);\n        final Help help = form.appendChild(Help.class);\n        final Catch catchNode = form.appendChild(Catch.class);\n        catchNode.setEvent(\"test\");\n\n        final ExecutablePlainForm dialog = new ExecutablePlainForm();\n        dialog.setNode(form);\n        final Collection<AbstractCatchElement> elements = dialog\n                .getCatchElements();\n        Assert.assertEquals(3, elements.size());\n        for (AbstractCatchElement element : elements) {\n            String tag = element.getTagName();\n            if (tag.equals(Noinput.TAG_NAME)) {\n                Assert.assertTrue(\"expected to find noinput element\",\n                        element.isEqualNode(noinput));\n            } else if (tag.equals(Help.TAG_NAME)) {\n                Assert.assertTrue(\"expected to find help element\",\n                        element.isEqualNode(help));\n            } else if (tag.equals(Catch.TAG_NAME)) {\n                Assert.assertTrue(\"expected to find catch element\",\n                        element.isEqualNode(catchNode));\n            } else {\n                Assert.fail(\"unknown tag: '\" + tag + \"'\");\n            }\n        }\n    }", "signature": "void testGetCatchElements()", "full_signature": "@Test public void testGetCatchElements()", "class_method_signature": "TestExecutablePlainForm.testGetCatchElements()", "testcase": true, "constructor": false, "invocations": ["getVxml", "appendChild", "appendChild", "appendChild", "appendChild", "appendChild", "setEvent", "setNode", "getCatchElements", "assertEquals", "size", "getTagName", "equals", "assertTrue", "isEqualNode", "equals", "assertTrue", "isEqualNode", "equals", "assertTrue", "isEqualNode", "fail"]}, "focal_class": {"identifier": "ExecutablePlainForm", "superclass": "", "interfaces": "implements Dialog", "fields": [{"original_string": "private Form form;", "modifier": "private", "type": "Form", "declarator": "form", "var_name": "form"}, {"original_string": "private String id;", "modifier": "private", "type": "String", "declarator": "id", "var_name": "id"}, {"original_string": "private Collection<FormItem> items;", "modifier": "private", "type": "Collection<FormItem>", "declarator": "items", "var_name": "items"}], "methods": [{"identifier": "ExecutablePlainForm", "parameters": "()", "modifiers": "public", "return": "", "signature": " ExecutablePlainForm()", "full_signature": "public  ExecutablePlainForm()", "class_method_signature": "ExecutablePlainForm.ExecutablePlainForm()", "testcase": false, "constructor": true}, {"identifier": "setNode", "parameters": "(final XmlNode node)", "modifiers": "@Override public", "return": "void", "signature": "void setNode(final XmlNode node)", "full_signature": "@Override public void setNode(final XmlNode node)", "class_method_signature": "ExecutablePlainForm.setNode(final XmlNode node)", "testcase": false, "constructor": false}, {"identifier": "getId", "parameters": "()", "modifiers": "public", "return": "String", "signature": "String getId()", "full_signature": "public String getId()", "class_method_signature": "ExecutablePlainForm.getId()", "testcase": false, "constructor": false}, {"identifier": "getChildNodes", "parameters": "()", "modifiers": "public", "return": "Collection<XmlNode>", "signature": "Collection<XmlNode> getChildNodes()", "full_signature": "public Collection<XmlNode> getChildNodes()", "class_method_signature": "ExecutablePlainForm.getChildNodes()", "testcase": false, "constructor": false}, {"identifier": "getFormItems", "parameters": "(\n            final VoiceXmlInterpreterContext context)", "modifiers": "public", "return": "Collection<FormItem>", "signature": "Collection<FormItem> getFormItems(\n            final VoiceXmlInterpreterContext context)", "full_signature": "public Collection<FormItem> getFormItems(\n            final VoiceXmlInterpreterContext context)", "class_method_signature": "ExecutablePlainForm.getFormItems(\n            final VoiceXmlInterpreterContext context)", "testcase": false, "constructor": false}, {"identifier": "getFilledElements", "parameters": "()", "modifiers": "public", "return": "Collection<Filled>", "signature": "Collection<Filled> getFilledElements()", "full_signature": "public Collection<Filled> getFilledElements()", "class_method_signature": "ExecutablePlainForm.getFilledElements()", "testcase": false, "constructor": false}, {"identifier": "getCatchElements", "parameters": "()", "modifiers": "public", "return": "Collection<AbstractCatchElement>", "signature": "Collection<AbstractCatchElement> getCatchElements()", "full_signature": "public Collection<AbstractCatchElement> getCatchElements()", "class_method_signature": "ExecutablePlainForm.getCatchElements()", "testcase": false, "constructor": false}, {"identifier": "clone", "parameters": "()", "modifiers": "@Override public", "return": "Dialog", "signature": "Dialog clone()", "full_signature": "@Override public Dialog clone()", "class_method_signature": "ExecutablePlainForm.clone()", "testcase": false, "constructor": false}], "file": "org.jvoicexml/src/main/java/org/jvoicexml/interpreter/dialog/ExecutablePlainForm.java"}, "focal_method": {"identifier": "getCatchElements", "parameters": "()", "modifiers": "public", "return": "Collection<AbstractCatchElement>", "body": "public Collection<AbstractCatchElement> getCatchElements() {\n        if (form == null) {\n            return null;\n        }\n\n        final Collection<AbstractCatchElement> catches =\n                new java.util.ArrayList<AbstractCatchElement>();\n        final NodeList children = form.getChildNodes();\n        for (int i = 0; i < children.getLength(); i++) {\n            final Node child = children.item(i);\n            if (child instanceof AbstractCatchElement) {\n                final AbstractCatchElement catchElement =\n                        (AbstractCatchElement) child;\n                catches.add(catchElement);\n            }\n        }\n\n        return catches;\n    }", "signature": "Collection<AbstractCatchElement> getCatchElements()", "full_signature": "public Collection<AbstractCatchElement> getCatchElements()", "class_method_signature": "ExecutablePlainForm.getCatchElements()", "testcase": false, "constructor": false, "invocations": ["getChildNodes", "getLength", "item", "add"]}, "repository": {"repo_id": 37717709, "url": "https://github.com/JVoiceXML/JVoiceXML", "language": "Java", "is_fork": false, "fork_count": 32, "stargazer_count": 50, "size": 436089, "license": "licensed"}}