{"test_class": {"identifier": "AlongTrackCoordinateMergerTest", "superclass": "", "interfaces": "", "fields": [], "file": "s3tbx-slstr-pdu-stitching/src/test/java/org/esa/s3tbx/slstr/pdu/stitching/manifest/AlongTrackCoordinateMergerTest.java"}, "test_case": {"identifier": "testMergeNodes", "parameters": "()", "modifiers": "@Test public", "return": "void", "body": "@Test\n    public void testMergeNodes() throws Exception {\n        List<Node> fromParents = new ArrayList<>();\n        fromParents.add(ManifestTestUtils.createNode(\n                \"<?xml version=\\\"1.0\\\" encoding=\\\"UTF-8\\\"?>\\n\" +\n                        \"                     <sentinel3:alongtrackCoordinate>6059</sentinel3:alongtrackCoordinate>\").getFirstChild());\n        fromParents.add(ManifestTestUtils.createNode(\n                \"<?xml version=\\\"1.0\\\" encoding=\\\"UTF-8\\\"?>\\n\" +\n                        \"                     <sentinel3:alongtrackCoordinate>6239</sentinel3:alongtrackCoordinate>\").getFirstChild());\n        fromParents.add(ManifestTestUtils.createNode(\n                \"<?xml version=\\\"1.0\\\" encoding=\\\"UTF-8\\\"?>\\n\" +\n                        \"                     <sentinel3:alongtrackCoordinate>6419</sentinel3:alongtrackCoordinate>\").getFirstChild());\n\n        Document manifest = ManifestTestUtils.createDocument();\n        final Element manifestElement = manifest.createElement(\"sentinel3:alongtrackCoordinate\");\n        manifest.appendChild(manifestElement);\n\n        new AlongTrackCoordinateMerger().mergeNodes(fromParents, manifestElement, manifest);\n\n        assertEquals(0, manifestElement.getAttributes().getLength());\n        assertEquals(1, manifestElement.getChildNodes().getLength());\n        assertEquals(\"6059\", manifestElement.getFirstChild().getNodeValue());\n        assertEquals(\"6059\", manifestElement.getTextContent());\n    }", "signature": "void testMergeNodes()", "full_signature": "@Test public void testMergeNodes()", "class_method_signature": "AlongTrackCoordinateMergerTest.testMergeNodes()", "testcase": true, "constructor": false, "invocations": ["add", "getFirstChild", "createNode", "add", "getFirstChild", "createNode", "add", "getFirstChild", "createNode", "createDocument", "createElement", "appendChild", "mergeNodes", "assertEquals", "getLength", "getAttributes", "assertEquals", "getLength", "getChildNodes", "assertEquals", "getNodeValue", "getFirstChild", "assertEquals", "getTextContent"]}, "focal_class": {"identifier": "AlongTrackCoordinateMerger", "superclass": "extends AbstractElementMerger", "interfaces": "", "fields": [], "methods": [{"identifier": "mergeNodes", "parameters": "(List<Node> fromParents, Element toParent, Document toDocument)", "modifiers": "@Override public", "return": "void", "signature": "void mergeNodes(List<Node> fromParents, Element toParent, Document toDocument)", "full_signature": "@Override public void mergeNodes(List<Node> fromParents, Element toParent, Document toDocument)", "class_method_signature": "AlongTrackCoordinateMerger.mergeNodes(List<Node> fromParents, Element toParent, Document toDocument)", "testcase": false, "constructor": false}], "file": "s3tbx-slstr-pdu-stitching/src/main/java/org/esa/s3tbx/slstr/pdu/stitching/manifest/AlongTrackCoordinateMerger.java"}, "focal_method": {"identifier": "mergeNodes", "parameters": "(List<Node> fromParents, Element toParent, Document toDocument)", "modifiers": "@Override public", "return": "void", "body": "@Override\n    public void mergeNodes(List<Node> fromParents, Element toParent, Document toDocument) throws PDUStitchingException {\n        int minAlongtrackCoordinate = Integer.MAX_VALUE;\n        for (Node node : fromParents) {\n            try {\n                final int alongTrackCoordinate = Integer.parseInt(node.getTextContent());\n                if (alongTrackCoordinate < minAlongtrackCoordinate) {\n                    minAlongtrackCoordinate = alongTrackCoordinate;\n                }\n            } catch (NumberFormatException nfe) {\n                throw new PDUStitchingException(\"Could not parse duration: \" + nfe.getMessage());\n            }\n        }\n        addTextToNode(toParent, String.valueOf(minAlongtrackCoordinate), toDocument);\n    }", "signature": "void mergeNodes(List<Node> fromParents, Element toParent, Document toDocument)", "full_signature": "@Override public void mergeNodes(List<Node> fromParents, Element toParent, Document toDocument)", "class_method_signature": "AlongTrackCoordinateMerger.mergeNodes(List<Node> fromParents, Element toParent, Document toDocument)", "testcase": false, "constructor": false, "invocations": ["parseInt", "getTextContent", "getMessage", "addTextToNode", "valueOf"]}, "repository": {"repo_id": 22256861, "url": "https://github.com/senbox-org/s3tbx", "stars": 22, "created": "7/25/2014 12:57:22 PM +00:00", "updates": "2020-01-27T10:23:46+00:00", "fork": "False", "license": "licensed"}}