{"test_class": {"identifier": "CharacterRuleProviderTest", "superclass": "", "interfaces": "", "fields": [], "file": "components/credentials/src/test/java/org/cloudfoundry/credhub/generators/CharacterRuleProviderTest.java"}, "test_case": {"identifier": "getCharacterRules_canCreateCharacterRulesWithoutUppercase", "parameters": "()", "modifiers": "@Test public", "return": "void", "body": "@Test\n  public void getCharacterRules_canCreateCharacterRulesWithoutUppercase() {\n    final StringGenerationParameters generationParameters = new StringGenerationParameters();\n    generationParameters.setExcludeUpper(true);\n\n    final List<CharacterRule> characterRules = CharacterRuleProvider\n      .getCharacterRules(generationParameters);\n    assertThat(characterRules, iterableWithSize(2));\n    assertThat(characterRules, containsInAnyOrder(\n      usesCharacters(EnglishCharacterData.LowerCase),\n      usesCharacters(EnglishCharacterData.Digit)\n    ));\n    assertThat(characterRules, not(containsInAnyOrder(\n      usesCharacters(EnglishCharacterData.UpperCase),\n      usesCharacters(CredHubCharacterData.SPECIAL),\n      usesCharacters(CredHubCharacterData.HEX)\n    )));\n  }", "signature": "void getCharacterRules_canCreateCharacterRulesWithoutUppercase()", "full_signature": "@Test public void getCharacterRules_canCreateCharacterRulesWithoutUppercase()", "class_method_signature": "CharacterRuleProviderTest.getCharacterRules_canCreateCharacterRulesWithoutUppercase()", "testcase": true, "constructor": false, "invocations": ["setExcludeUpper", "getCharacterRules", "assertThat", "iterableWithSize", "assertThat", "containsInAnyOrder", "usesCharacters", "usesCharacters", "assertThat", "not", "containsInAnyOrder", "usesCharacters", "usesCharacters", "usesCharacters"]}, "focal_class": {"identifier": "CharacterRuleProvider", "superclass": "", "interfaces": "", "fields": [], "methods": [{"identifier": "CharacterRuleProvider", "parameters": "()", "modifiers": "private", "return": "", "signature": " CharacterRuleProvider()", "full_signature": "private  CharacterRuleProvider()", "class_method_signature": "CharacterRuleProvider.CharacterRuleProvider()", "testcase": false, "constructor": true}, {"identifier": "getCharacterRules", "parameters": "(final StringGenerationParameters parameters)", "modifiers": "public static", "return": "List<CharacterRule>", "signature": "List<CharacterRule> getCharacterRules(final StringGenerationParameters parameters)", "full_signature": "public static List<CharacterRule> getCharacterRules(final StringGenerationParameters parameters)", "class_method_signature": "CharacterRuleProvider.getCharacterRules(final StringGenerationParameters parameters)", "testcase": false, "constructor": false}], "file": "components/credentials/src/main/java/org/cloudfoundry/credhub/generators/CharacterRuleProvider.java"}, "focal_method": {"identifier": "getCharacterRules", "parameters": "(final StringGenerationParameters parameters)", "modifiers": "public static", "return": "List<CharacterRule>", "body": "public static List<CharacterRule> getCharacterRules(final StringGenerationParameters parameters) {\n    final List<CharacterRule> characterRules = new ArrayList<>();\n\n    if (parameters.isIncludeSpecial()) {\n      characterRules.add(new CharacterRule(CredHubCharacterData.SPECIAL));\n    }\n\n    if (!parameters.isExcludeNumber()) {\n      characterRules.add(new CharacterRule(EnglishCharacterData.Digit));\n    }\n\n    if (!parameters.isExcludeUpper()) {\n      characterRules.add(new CharacterRule(EnglishCharacterData.UpperCase));\n    }\n\n    if (!parameters.isExcludeLower()) {\n      characterRules.add(new CharacterRule(EnglishCharacterData.LowerCase));\n    }\n\n    return characterRules;\n  }", "signature": "List<CharacterRule> getCharacterRules(final StringGenerationParameters parameters)", "full_signature": "public static List<CharacterRule> getCharacterRules(final StringGenerationParameters parameters)", "class_method_signature": "CharacterRuleProvider.getCharacterRules(final StringGenerationParameters parameters)", "testcase": false, "constructor": false, "invocations": ["isIncludeSpecial", "add", "isExcludeNumber", "add", "isExcludeUpper", "add", "isExcludeLower", "add"]}, "repository": {"repo_id": 57061988, "url": "https://github.com/cloudfoundry-incubator/credhub", "stars": 167, "created": "4/25/2016 5:30:51 PM +00:00", "updates": "2020-01-27T21:31:19+00:00", "fork": "False", "license": "licensed"}}