{"test_class": {"identifier": "SW360UpdaterTest", "superclass": "", "interfaces": "", "fields": [{"original_string": "private AntennaContext antennaContextMock;", "modifier": "private", "type": "AntennaContext", "declarator": "antennaContextMock", "var_name": "antennaContextMock"}], "file": "modules/sw360/sw360-workflow/src/test/java/org/eclipse/sw360/antenna/sw360/workflow/generators/SW360UpdaterTest.java"}, "test_case": {"identifier": "testCreateUpdaterImpl", "parameters": "()", "modifiers": "@Test public", "return": "void", "body": "@Test\n    public void testCreateUpdaterImpl() {\n        SW360ConnectionConfigurationFactory connectionFactory = mock(SW360ConnectionConfigurationFactory.class);\n        SW360Connection connection = mock(SW360Connection.class);\n        when(connectionFactory.createConnection(any(), any(), any())).thenReturn(connection);\n        SW360Updater updater = new SW360Updater(connectionFactory);\n        updater.setAntennaContext(antennaContextMock);\n\n        SW360UpdaterImpl updaterImpl = updater.createUpdaterImpl(createConfigMap());\n        assertThat(updaterImpl.isUpdateReleases()).isTrue();\n        assertThat(updaterImpl.isUploadSources()).isTrue();\n        assertThat(updaterImpl.isDeleteObsoleteSourceAttachments()).isTrue();\n    }", "signature": "void testCreateUpdaterImpl()", "full_signature": "@Test public void testCreateUpdaterImpl()", "class_method_signature": "SW360UpdaterTest.testCreateUpdaterImpl()", "testcase": true, "constructor": false, "invocations": ["mock", "mock", "thenReturn", "when", "createConnection", "any", "any", "any", "setAntennaContext", "createUpdaterImpl", "createConfigMap", "isTrue", "assertThat", "isUpdateReleases", "isTrue", "assertThat", "isUploadSources", "isTrue", "assertThat", "isDeleteObsoleteSourceAttachments"]}, "focal_class": {"identifier": "SW360Updater", "superclass": "extends AbstractGenerator", "interfaces": "", "fields": [{"original_string": "private static final String UPDATE_RELEASES = \"update_releases\";", "modifier": "private static final", "type": "String", "declarator": "UPDATE_RELEASES = \"update_releases\"", "var_name": "UPDATE_RELEASES"}, {"original_string": "private static final String UPLOAD_SOURCES = \"upload_sources\";", "modifier": "private static final", "type": "String", "declarator": "UPLOAD_SOURCES = \"upload_sources\"", "var_name": "UPLOAD_SOURCES"}, {"original_string": "private static final String DELETE_OBSOLETE_SOURCES = \"delete_obsolete_sources\";", "modifier": "private static final", "type": "String", "declarator": "DELETE_OBSOLETE_SOURCES = \"delete_obsolete_sources\"", "var_name": "DELETE_OBSOLETE_SOURCES"}, {"original_string": "private final SW360ConnectionConfigurationFactory connectionFactory;", "modifier": "private final", "type": "SW360ConnectionConfigurationFactory", "declarator": "connectionFactory", "var_name": "connectionFactory"}, {"original_string": "private SW360UpdaterImpl updaterImpl;", "modifier": "private", "type": "SW360UpdaterImpl", "declarator": "updaterImpl", "var_name": "updaterImpl"}], "methods": [{"identifier": "SW360Updater", "parameters": "()", "modifiers": "public", "return": "", "signature": " SW360Updater()", "full_signature": "public  SW360Updater()", "class_method_signature": "SW360Updater.SW360Updater()", "testcase": false, "constructor": true}, {"identifier": "SW360Updater", "parameters": "(SW360ConnectionConfigurationFactory factory)", "modifiers": "", "return": "", "signature": " SW360Updater(SW360ConnectionConfigurationFactory factory)", "full_signature": "  SW360Updater(SW360ConnectionConfigurationFactory factory)", "class_method_signature": "SW360Updater.SW360Updater(SW360ConnectionConfigurationFactory factory)", "testcase": false, "constructor": true}, {"identifier": "configure", "parameters": "(Map<String, String> configMap)", "modifiers": "@Override public", "return": "void", "signature": "void configure(Map<String, String> configMap)", "full_signature": "@Override public void configure(Map<String, String> configMap)", "class_method_signature": "SW360Updater.configure(Map<String, String> configMap)", "testcase": false, "constructor": false}, {"identifier": "getProjectVersion", "parameters": "()", "modifiers": "private", "return": "String", "signature": "String getProjectVersion()", "full_signature": "private String getProjectVersion()", "class_method_signature": "SW360Updater.getProjectVersion()", "testcase": false, "constructor": false}, {"identifier": "getProjectName", "parameters": "()", "modifiers": "private", "return": "String", "signature": "String getProjectName()", "full_signature": "private String getProjectName()", "class_method_signature": "SW360Updater.getProjectName()", "testcase": false, "constructor": false}, {"identifier": "produce", "parameters": "(Collection<Artifact> intermediates)", "modifiers": "@Override public", "return": "Map<String, IAttachable>", "signature": "Map<String, IAttachable> produce(Collection<Artifact> intermediates)", "full_signature": "@Override public Map<String, IAttachable> produce(Collection<Artifact> intermediates)", "class_method_signature": "SW360Updater.produce(Collection<Artifact> intermediates)", "testcase": false, "constructor": false}, {"identifier": "createUpdaterImpl", "parameters": "(Map<String, String> configMap)", "modifiers": "", "return": "SW360UpdaterImpl", "signature": "SW360UpdaterImpl createUpdaterImpl(Map<String, String> configMap)", "full_signature": " SW360UpdaterImpl createUpdaterImpl(Map<String, String> configMap)", "class_method_signature": "SW360Updater.createUpdaterImpl(Map<String, String> configMap)", "testcase": false, "constructor": false}, {"identifier": "getConnectionFactory", "parameters": "()", "modifiers": "", "return": "SW360ConnectionConfigurationFactory", "signature": "SW360ConnectionConfigurationFactory getConnectionFactory()", "full_signature": " SW360ConnectionConfigurationFactory getConnectionFactory()", "class_method_signature": "SW360Updater.getConnectionFactory()", "testcase": false, "constructor": false}], "file": "modules/sw360/sw360-workflow/src/main/java/org/eclipse/sw360/antenna/sw360/workflow/generators/SW360Updater.java"}, "focal_method": {"identifier": "createUpdaterImpl", "parameters": "(Map<String, String> configMap)", "modifiers": "", "return": "SW360UpdaterImpl", "body": "SW360UpdaterImpl createUpdaterImpl(Map<String, String> configMap) {\n        SW360Connection sw360Connection =\n                getConnectionFactory().createConnection(key -> getConfigValue(key, configMap),\n                        context.getHttpClient(), context.getObjectMapper());\n        SW360MetaDataUpdater sw360MetaDataUpdater = new SW360MetaDataUpdater(sw360Connection);\n\n        return new SW360UpdaterImpl(sw360MetaDataUpdater, getProjectName(), getProjectVersion(),\n                getBooleanConfigValue(UPDATE_RELEASES, configMap),\n                getBooleanConfigValue(UPLOAD_SOURCES, configMap),\n                getBooleanConfigValue(DELETE_OBSOLETE_SOURCES, configMap));\n    }", "signature": "SW360UpdaterImpl createUpdaterImpl(Map<String, String> configMap)", "full_signature": " SW360UpdaterImpl createUpdaterImpl(Map<String, String> configMap)", "class_method_signature": "SW360Updater.createUpdaterImpl(Map<String, String> configMap)", "testcase": false, "constructor": false, "invocations": ["createConnection", "getConnectionFactory", "getConfigValue", "getHttpClient", "getObjectMapper", "getProjectName", "getProjectVersion", "getBooleanConfigValue", "getBooleanConfigValue", "getBooleanConfigValue"]}, "repository": {"repo_id": 140017338, "url": "https://github.com/eclipse/antenna", "stars": 14, "created": "7/6/2018 6:17:28 PM +00:00", "updates": "2020-01-21T13:15:34+00:00", "fork": "False", "license": "licensed"}}