{"test_class": {"identifier": "WorldFireReaderPlugInTest", "superclass": "", "interfaces": "", "fields": [{"original_string": "private WorldFireReaderPlugIn plugIn;", "modifier": "private", "type": "WorldFireReaderPlugIn", "declarator": "plugIn", "var_name": "plugIn"}], "file": "beam-glob-due-reader/src/test/java/org/esa/beam/dataio/worldfire/WorldFireReaderPlugInTest.java"}, "test_case": {"identifier": "testDecodeQualificationFile", "parameters": "()", "modifiers": "@Test public", "return": "void", "body": "@Test\n    public void testDecodeQualificationFile() throws Exception {\n        File input;\n        input = TestResourceHelper.getAatsrAlgo1AsFile();\n        assertEquals(DecodeQualification.INTENDED, plugIn.getDecodeQualification(input));\n        input = TestResourceHelper.getAatsrAlgo2AsFile();\n        assertEquals(DecodeQualification.INTENDED, plugIn.getDecodeQualification(input));\n        input = TestResourceHelper.getAtsr2Algo1AsFile();\n        assertEquals(DecodeQualification.INTENDED, plugIn.getDecodeQualification(input));\n        input = TestResourceHelper.getAtsr2Algo2AsFile();\n        assertEquals(DecodeQualification.INTENDED, plugIn.getDecodeQualification(input));\n        input = new File(\"9708ESA02.notAFile\");\n        assertEquals(DecodeQualification.UNABLE, plugIn.getDecodeQualification(input));\n        input = File.createTempFile(\"emptyFile\", \".FIRE\");\n        assertEquals(DecodeQualification.UNABLE, plugIn.getDecodeQualification(input));\n    }", "signature": "void testDecodeQualificationFile()", "full_signature": "@Test public void testDecodeQualificationFile()", "class_method_signature": "WorldFireReaderPlugInTest.testDecodeQualificationFile()", "testcase": true, "constructor": false, "invocations": ["getAatsrAlgo1AsFile", "assertEquals", "getDecodeQualification", "getAatsrAlgo2AsFile", "assertEquals", "getDecodeQualification", "getAtsr2Algo1AsFile", "assertEquals", "getDecodeQualification", "getAtsr2Algo2AsFile", "assertEquals", "getDecodeQualification", "assertEquals", "getDecodeQualification", "createTempFile", "assertEquals", "getDecodeQualification"]}, "focal_class": {"identifier": "WorldFireReaderPlugIn", "superclass": "", "interfaces": "implements ProductReaderPlugIn", "fields": [{"original_string": "private static final String FORMAT_NAME = \"ATSR World Fire\";", "modifier": "private static final", "type": "String", "declarator": "FORMAT_NAME = \"ATSR World Fire\"", "var_name": "FORMAT_NAME"}, {"original_string": "private static final String[] FORMAT_NAMES = new String[]{FORMAT_NAME};", "modifier": "private static final", "type": "String[]", "declarator": "FORMAT_NAMES = new String[]{FORMAT_NAME}", "var_name": "FORMAT_NAMES"}, {"original_string": "private static final String DESCRIPTION = \"ATSR2/AATSR based Global Fire Maps\";", "modifier": "private static final", "type": "String", "declarator": "DESCRIPTION = \"ATSR2/AATSR based Global Fire Maps\"", "var_name": "DESCRIPTION"}, {"original_string": "private static final Class[] INPUT_TYPES = new Class[]{String.class, File.class};", "modifier": "private static final", "type": "Class[]", "declarator": "INPUT_TYPES = new Class[]{String.class, File.class}", "var_name": "INPUT_TYPES"}, {"original_string": "private static final String FIRE_FILE_EXTENSION = \".FIRE\";", "modifier": "private static final", "type": "String", "declarator": "FIRE_FILE_EXTENSION = \".FIRE\"", "var_name": "FIRE_FILE_EXTENSION"}, {"original_string": "private static final String[] DEFAULT_FILE_EXTENSIONS = new String[]{FIRE_FILE_EXTENSION};", "modifier": "private static final", "type": "String[]", "declarator": "DEFAULT_FILE_EXTENSIONS = new String[]{FIRE_FILE_EXTENSION}", "var_name": "DEFAULT_FILE_EXTENSIONS"}], "methods": [{"identifier": "getDecodeQualification", "parameters": "(Object input)", "modifiers": "@Override public", "return": "DecodeQualification", "signature": "DecodeQualification getDecodeQualification(Object input)", "full_signature": "@Override public DecodeQualification getDecodeQualification(Object input)", "class_method_signature": "WorldFireReaderPlugIn.getDecodeQualification(Object input)", "testcase": false, "constructor": false}, {"identifier": "getInputTypes", "parameters": "()", "modifiers": "@Override public", "return": "Class[]", "signature": "Class[] getInputTypes()", "full_signature": "@Override public Class[] getInputTypes()", "class_method_signature": "WorldFireReaderPlugIn.getInputTypes()", "testcase": false, "constructor": false}, {"identifier": "createReaderInstance", "parameters": "()", "modifiers": "@Override public", "return": "ProductReader", "signature": "ProductReader createReaderInstance()", "full_signature": "@Override public ProductReader createReaderInstance()", "class_method_signature": "WorldFireReaderPlugIn.createReaderInstance()", "testcase": false, "constructor": false}, {"identifier": "getFormatNames", "parameters": "()", "modifiers": "@Override public", "return": "String[]", "signature": "String[] getFormatNames()", "full_signature": "@Override public String[] getFormatNames()", "class_method_signature": "WorldFireReaderPlugIn.getFormatNames()", "testcase": false, "constructor": false}, {"identifier": "getDefaultFileExtensions", "parameters": "()", "modifiers": "@Override public", "return": "String[]", "signature": "String[] getDefaultFileExtensions()", "full_signature": "@Override public String[] getDefaultFileExtensions()", "class_method_signature": "WorldFireReaderPlugIn.getDefaultFileExtensions()", "testcase": false, "constructor": false}, {"identifier": "getDescription", "parameters": "(Locale locale)", "modifiers": "@Override public", "return": "String", "signature": "String getDescription(Locale locale)", "full_signature": "@Override public String getDescription(Locale locale)", "class_method_signature": "WorldFireReaderPlugIn.getDescription(Locale locale)", "testcase": false, "constructor": false}, {"identifier": "getProductFileFilter", "parameters": "()", "modifiers": "@Override public", "return": "BeamFileFilter", "signature": "BeamFileFilter getProductFileFilter()", "full_signature": "@Override public BeamFileFilter getProductFileFilter()", "class_method_signature": "WorldFireReaderPlugIn.getProductFileFilter()", "testcase": false, "constructor": false}, {"identifier": "getDecodeQualification", "parameters": "(InputStream inputStream)", "modifiers": "@SuppressWarnings({\"IOResourceOpenedButNotSafelyClosed\"}) private", "return": "DecodeQualification", "signature": "DecodeQualification getDecodeQualification(InputStream inputStream)", "full_signature": "@SuppressWarnings({\"IOResourceOpenedButNotSafelyClosed\"}) private DecodeQualification getDecodeQualification(InputStream inputStream)", "class_method_signature": "WorldFireReaderPlugIn.getDecodeQualification(InputStream inputStream)", "testcase": false, "constructor": false}], "file": "beam-glob-due-reader/src/main/java/org/esa/beam/dataio/worldfire/WorldFireReaderPlugIn.java"}, "focal_method": {"identifier": "getDecodeQualification", "parameters": "(Object input)", "modifiers": "@Override public", "return": "DecodeQualification", "body": "@Override\n    public DecodeQualification getDecodeQualification(Object input) {\n        File inputFile = new File(String.valueOf(input));\n        if(!inputFile.getName().toUpperCase().endsWith(FIRE_FILE_EXTENSION)) {\n            return DecodeQualification.UNABLE;\n        }\n\n        InputStream inputStream = null;\n        try {\n            inputStream = new FileInputStream(inputFile);\n            return getDecodeQualification(inputStream);\n        } catch (IOException ignored) {\n            return DecodeQualification.UNABLE;\n        }finally {\n            if(inputStream != null) {\n                try {\n                    inputStream.close();\n                } catch (IOException ignored) {}\n            }\n        }\n    }", "signature": "DecodeQualification getDecodeQualification(Object input)", "full_signature": "@Override public DecodeQualification getDecodeQualification(Object input)", "class_method_signature": "WorldFireReaderPlugIn.getDecodeQualification(Object input)", "testcase": false, "constructor": false, "invocations": ["valueOf", "endsWith", "toUpperCase", "getName", "getDecodeQualification", "close"]}, "repository": {"repo_id": 526150, "url": "https://github.com/bcdev/glob-box", "language": "Java", "is_fork": false, "fork_count": 1, "stargazer_count": 6, "size": 6440, "license": "licensed"}}