{"test_class": {"identifier": "ExecuteLimitFilterTest", "superclass": "", "interfaces": "", "fields": [{"original_string": "private ExecuteLimitFilter executeLimitFilter = new ExecuteLimitFilter();", "modifier": "private", "type": "ExecuteLimitFilter", "declarator": "executeLimitFilter = new ExecuteLimitFilter()", "var_name": "executeLimitFilter"}], "file": "dubbo-rpc/dubbo-rpc-api/src/test/java/org/apache/dubbo/rpc/filter/ExecuteLimitFilterTest.java"}, "test_case": {"identifier": "testMoreThanExecuteLimitInvoke", "parameters": "()", "modifiers": "@Test public", "return": "void", "body": "@Test\n    public void testMoreThanExecuteLimitInvoke() throws Exception {\n        int maxExecute = 10;\n        int totalExecute = 20;\n        final AtomicInteger failed = new AtomicInteger(0);\n\n        final Invocation invocation = Mockito.mock(Invocation.class);\n        when(invocation.getMethodName()).thenReturn(\"testMoreThanExecuteLimitInvoke\");\n\n        URL url = URL.valueOf(\"test://test:11/test?accesslog=true&group=dubbo&version=1.1&executes=\" + maxExecute);\n        final Invoker<ExecuteLimitFilter> invoker = new BlockMyInvoker<ExecuteLimitFilter>(url, 1000);\n\n        final CountDownLatch latch = new CountDownLatch(1);\n        for (int i = 0; i < totalExecute; i++) {\n            Thread thread = new Thread(new Runnable() {\n\n                public void run() {\n                    try {\n                        latch.await();\n                    } catch (InterruptedException e) {\n                        e.printStackTrace();\n                    }\n                    try {\n                        executeLimitFilter.invoke(invoker, invocation);\n                    } catch (RpcException expected) {\n                        failed.incrementAndGet();\n                    }\n\n                }\n            });\n            thread.start();\n        }\n        latch.countDown();\n\n        try {\n            Thread.sleep(1000);\n        } catch (InterruptedException e) {\n            e.printStackTrace();\n        }\n\n        Assertions.assertEquals(totalExecute - maxExecute, failed.get());\n    }", "signature": "void testMoreThanExecuteLimitInvoke()", "full_signature": "@Test public void testMoreThanExecuteLimitInvoke()", "class_method_signature": "ExecuteLimitFilterTest.testMoreThanExecuteLimitInvoke()", "testcase": true, "constructor": false, "invocations": ["mock", "thenReturn", "when", "getMethodName", "valueOf", "await", "printStackTrace", "invoke", "incrementAndGet", "start", "countDown", "sleep", "printStackTrace", "assertEquals", "get"]}, "focal_class": {"identifier": "ExecuteLimitFilter", "superclass": "", "interfaces": "implements Filter, Filter.Listener", "fields": [{"original_string": "private static final String EXECUTE_LIMIT_FILTER_START_TIME = \"execute_limit_filter_start_time\";", "modifier": "private static final", "type": "String", "declarator": "EXECUTE_LIMIT_FILTER_START_TIME = \"execute_limit_filter_start_time\"", "var_name": "EXECUTE_LIMIT_FILTER_START_TIME"}], "methods": [{"identifier": "invoke", "parameters": "(Invoker<?> invoker, Invocation invocation)", "modifiers": "@Override public", "return": "Result", "signature": "Result invoke(Invoker<?> invoker, Invocation invocation)", "full_signature": "@Override public Result invoke(Invoker<?> invoker, Invocation invocation)", "class_method_signature": "ExecuteLimitFilter.invoke(Invoker<?> invoker, Invocation invocation)", "testcase": false, "constructor": false}, {"identifier": "onResponse", "parameters": "(Result appResponse, Invoker<?> invoker, Invocation invocation)", "modifiers": "@Override public", "return": "void", "signature": "void onResponse(Result appResponse, Invoker<?> invoker, Invocation invocation)", "full_signature": "@Override public void onResponse(Result appResponse, Invoker<?> invoker, Invocation invocation)", "class_method_signature": "ExecuteLimitFilter.onResponse(Result appResponse, Invoker<?> invoker, Invocation invocation)", "testcase": false, "constructor": false}, {"identifier": "onError", "parameters": "(Throwable t, Invoker<?> invoker, Invocation invocation)", "modifiers": "@Override public", "return": "void", "signature": "void onError(Throwable t, Invoker<?> invoker, Invocation invocation)", "full_signature": "@Override public void onError(Throwable t, Invoker<?> invoker, Invocation invocation)", "class_method_signature": "ExecuteLimitFilter.onError(Throwable t, Invoker<?> invoker, Invocation invocation)", "testcase": false, "constructor": false}, {"identifier": "getElapsed", "parameters": "(Invocation invocation)", "modifiers": "private", "return": "long", "signature": "long getElapsed(Invocation invocation)", "full_signature": "private long getElapsed(Invocation invocation)", "class_method_signature": "ExecuteLimitFilter.getElapsed(Invocation invocation)", "testcase": false, "constructor": false}], "file": "dubbo-rpc/dubbo-rpc-api/src/main/java/org/apache/dubbo/rpc/filter/ExecuteLimitFilter.java"}, "focal_method": {"identifier": "invoke", "parameters": "(Invoker<?> invoker, Invocation invocation)", "modifiers": "@Override public", "return": "Result", "body": "@Override\n    public Result invoke(Invoker<?> invoker, Invocation invocation) throws RpcException {\n        URL url = invoker.getUrl();\n        String methodName = invocation.getMethodName();\n        int max = url.getMethodParameter(methodName, EXECUTES_KEY, 0);\n        if (!RpcStatus.beginCount(url, methodName, max)) {\n            throw new RpcException(RpcException.LIMIT_EXCEEDED_EXCEPTION,\n                    \"Failed to invoke method \" + invocation.getMethodName() + \" in provider \" +\n                            url + \", cause: The service using threads greater than <dubbo:service executes=\\\"\" + max +\n                            \"\\\" /> limited.\");\n        }\n\n        invocation.put(EXECUTE_LIMIT_FILTER_START_TIME, System.currentTimeMillis());\n        try {\n            return invoker.invoke(invocation);\n        } catch (Throwable t) {\n            if (t instanceof RuntimeException) {\n                throw (RuntimeException) t;\n            } else {\n                throw new RpcException(\"unexpected exception when ExecuteLimitFilter\", t);\n            }\n        }\n    }", "signature": "Result invoke(Invoker<?> invoker, Invocation invocation)", "full_signature": "@Override public Result invoke(Invoker<?> invoker, Invocation invocation)", "class_method_signature": "ExecuteLimitFilter.invoke(Invoker<?> invoker, Invocation invocation)", "testcase": false, "constructor": false, "invocations": ["getUrl", "getMethodName", "getMethodParameter", "beginCount", "getMethodName", "put", "currentTimeMillis", "invoke"]}, "repository": {"repo_id": 4710920, "url": "https://github.com/apache/dubbo", "stars": 30960, "created": "6/19/2012 7:56:02 AM +00:00", "updates": "2020-01-27T14:21:03+00:00", "fork": "False", "license": "licensed"}}