{"test_class": {"identifier": "DataSetSummaryTest", "superclass": "", "interfaces": "", "fields": [{"original_string": "@Mock DataSetClientServices dataSetClientServices;", "modifier": "@Mock", "type": "DataSetClientServices", "declarator": "dataSetClientServices", "var_name": "dataSetClientServices"}, {"original_string": "@Mock ClientDataSetManager clientDataSetManager;", "modifier": "@Mock", "type": "ClientDataSetManager", "declarator": "clientDataSetManager", "var_name": "clientDataSetManager"}, {"original_string": "@Mock EventSourceMock<ErrorEvent> errorEvent;", "modifier": "@Mock", "type": "EventSourceMock<ErrorEvent>", "declarator": "errorEvent", "var_name": "errorEvent"}, {"original_string": "@Mock DataSetDef dataSetDef;", "modifier": "@Mock", "type": "DataSetDef", "declarator": "dataSetDef", "var_name": "dataSetDef"}, {"original_string": "@Mock DataSetSummary.View view;", "modifier": "@Mock", "type": "DataSetSummary.View", "declarator": "view", "var_name": "view"}, {"original_string": "private DataSetSummary presenter;", "modifier": "private", "type": "DataSetSummary", "declarator": "presenter", "var_name": "presenter"}, {"original_string": "final DataSetMetadata dataSetMetadata = mock(DataSetMetadata.class);", "modifier": "final", "type": "DataSetMetadata", "declarator": "dataSetMetadata = mock(DataSetMetadata.class)", "var_name": "dataSetMetadata"}], "file": "dashbuilder-client/dashbuilder-widgets/src/test/java/org/dashbuilder/client/widgets/dataset/explorer/DataSetSummaryTest.java"}, "test_case": {"identifier": "testShow", "parameters": "()", "modifiers": "@Test public", "return": "void", "body": "@Test\n    public void testShow() throws Exception {\n        final int estimatedSize = 100;\n        final int rowCount = 10;\n        when(dataSetMetadata.getEstimatedSize()).thenReturn(estimatedSize);\n        when(dataSetMetadata.getNumberOfRows()).thenReturn(rowCount);\n        presenter.show(dataSetDef);\n        verify(view, times(0)).init(presenter);\n        verify(view, times(1)).showStatusPanel(true, true, true);\n        verify(view, times(1)).showSizePanelIcon(any(IconType.class), anyString(), anyString(), anyBoolean());\n        verify(view, times(1)).showSizePanel(anyString(), anyString());\n    }", "signature": "void testShow()", "full_signature": "@Test public void testShow()", "class_method_signature": "DataSetSummaryTest.testShow()", "testcase": true, "constructor": false, "invocations": ["thenReturn", "when", "getEstimatedSize", "thenReturn", "when", "getNumberOfRows", "show", "init", "verify", "times", "showStatusPanel", "verify", "times", "showSizePanelIcon", "verify", "times", "any", "anyString", "anyString", "anyBoolean", "showSizePanel", "verify", "times", "anyString", "anyString"]}, "focal_class": {"identifier": "DataSetSummary", "superclass": "", "interfaces": "implements IsWidget", "fields": [{"original_string": "private final static String ESTIMATIONS_FORMAT = \"#,###.0\";", "modifier": "private final static", "type": "String", "declarator": "ESTIMATIONS_FORMAT = \"#,###.0\"", "var_name": "ESTIMATIONS_FORMAT"}, {"original_string": "private final static String ICON_COLOR_DEFAULT = \"black\";", "modifier": "private final static", "type": "String", "declarator": "ICON_COLOR_DEFAULT = \"black\"", "var_name": "ICON_COLOR_DEFAULT"}, {"original_string": "private final static String ICON_COLOR_ERROR = \"red\";", "modifier": "private final static", "type": "String", "declarator": "ICON_COLOR_ERROR = \"red\"", "var_name": "ICON_COLOR_ERROR"}, {"original_string": "DataSetClientServices clientServices;", "modifier": "", "type": "DataSetClientServices", "declarator": "clientServices", "var_name": "clientServices"}, {"original_string": "Event<ErrorEvent> errorEvent;", "modifier": "", "type": "Event<ErrorEvent>", "declarator": "errorEvent", "var_name": "errorEvent"}, {"original_string": "View view;", "modifier": "", "type": "View", "declarator": "view", "var_name": "view"}], "methods": [{"identifier": "DataSetSummary", "parameters": "(final DataSetClientServices clientServices, \n                          final Event<ErrorEvent> errorEvent, \n                          final View view)", "modifiers": "@Inject public", "return": "", "signature": " DataSetSummary(final DataSetClientServices clientServices, \n                          final Event<ErrorEvent> errorEvent, \n                          final View view)", "full_signature": "@Inject public  DataSetSummary(final DataSetClientServices clientServices, \n                          final Event<ErrorEvent> errorEvent, \n                          final View view)", "class_method_signature": "DataSetSummary.DataSetSummary(final DataSetClientServices clientServices, \n                          final Event<ErrorEvent> errorEvent, \n                          final View view)", "testcase": false, "constructor": true}, {"identifier": "init", "parameters": "()", "modifiers": "@PostConstruct public", "return": "void", "signature": "void init()", "full_signature": "@PostConstruct public void init()", "class_method_signature": "DataSetSummary.init()", "testcase": false, "constructor": false}, {"identifier": "asWidget", "parameters": "()", "modifiers": "@Override public", "return": "Widget", "signature": "Widget asWidget()", "full_signature": "@Override public Widget asWidget()", "class_method_signature": "DataSetSummary.asWidget()", "testcase": false, "constructor": false}, {"identifier": "show", "parameters": "(final DataSetDef def)", "modifiers": "public", "return": "void", "signature": "void show(final DataSetDef def)", "full_signature": "public void show(final DataSetDef def)", "class_method_signature": "DataSetSummary.show(final DataSetDef def)", "testcase": false, "constructor": false}, {"identifier": "humanReadableByteCount", "parameters": "(long bytes)", "modifiers": "", "return": "String", "signature": "String humanReadableByteCount(long bytes)", "full_signature": " String humanReadableByteCount(long bytes)", "class_method_signature": "DataSetSummary.humanReadableByteCount(long bytes)", "testcase": false, "constructor": false}, {"identifier": "humanReadableRowCount", "parameters": "(long rows)", "modifiers": "", "return": "String", "signature": "String humanReadableRowCount(long rows)", "full_signature": " String humanReadableRowCount(long rows)", "class_method_signature": "DataSetSummary.humanReadableRowCount(long rows)", "testcase": false, "constructor": false}, {"identifier": "getMetadata", "parameters": "(final DataSetDef def, final DataSetMetadataCallback callback)", "modifiers": "private", "return": "void", "signature": "void getMetadata(final DataSetDef def, final DataSetMetadataCallback callback)", "full_signature": "private void getMetadata(final DataSetDef def, final DataSetMetadataCallback callback)", "class_method_signature": "DataSetSummary.getMetadata(final DataSetDef def, final DataSetMetadataCallback callback)", "testcase": false, "constructor": false}, {"identifier": "showLoadingIcon", "parameters": "()", "modifiers": "", "return": "void", "signature": "void showLoadingIcon()", "full_signature": " void showLoadingIcon()", "class_method_signature": "DataSetSummary.showLoadingIcon()", "testcase": false, "constructor": false}, {"identifier": "showErrorIcon", "parameters": "()", "modifiers": "", "return": "void", "signature": "void showErrorIcon()", "full_signature": " void showErrorIcon()", "class_method_signature": "DataSetSummary.showErrorIcon()", "testcase": false, "constructor": false}, {"identifier": "showError", "parameters": "(final String uuid, final ClientRuntimeError error)", "modifiers": "", "return": "void", "signature": "void showError(final String uuid, final ClientRuntimeError error)", "full_signature": " void showError(final String uuid, final ClientRuntimeError error)", "class_method_signature": "DataSetSummary.showError(final String uuid, final ClientRuntimeError error)", "testcase": false, "constructor": false}, {"identifier": "showError", "parameters": "(final String uuid, final Throwable throwable)", "modifiers": "", "return": "void", "signature": "void showError(final String uuid, final Throwable throwable)", "full_signature": " void showError(final String uuid, final Throwable throwable)", "class_method_signature": "DataSetSummary.showError(final String uuid, final Throwable throwable)", "testcase": false, "constructor": false}, {"identifier": "showError", "parameters": "(final String uuid, final String message)", "modifiers": "", "return": "void", "signature": "void showError(final String uuid, final String message)", "full_signature": " void showError(final String uuid, final String message)", "class_method_signature": "DataSetSummary.showError(final String uuid, final String message)", "testcase": false, "constructor": false}], "file": "dashbuilder-client/dashbuilder-widgets/src/main/java/org/dashbuilder/client/widgets/dataset/explorer/DataSetSummary.java"}, "focal_method": {"identifier": "show", "parameters": "(final DataSetDef def)", "modifiers": "public", "return": "void", "body": "public void show(final DataSetDef def) {\n        if (def != null) {\n            // Cache status panel.\n            final boolean isShowBackendCache = def.getProvider() != null\n                    && ( !DataSetProviderType.BEAN.equals(def.getProvider())\n                    && !DataSetProviderType.CSV.equals(def.getProvider() ));\n            final Boolean isCacheEnabled = isShowBackendCache ? def.isCacheEnabled() : null;\n            final boolean isPushEnabled = def.isPushEnabled();\n            final boolean isRefreshEnabled = def.getRefreshTime() != null;\n            view.showStatusPanel(isCacheEnabled, isPushEnabled, isRefreshEnabled);\n            \n            \n            // Show loading icon on size panel while performing the backend request.\n            showLoadingIcon();\n\n            getMetadata(def, new DataSetMetadataCallback() {\n                @Override\n                public void callback(final DataSetMetadata metadata) {\n                    final int estimatedSize = metadata.getEstimatedSize();\n                    final int rowCount = metadata.getNumberOfRows();\n                    view.showSizePanel(humanReadableRowCount(rowCount) + \" \" + DataSetExplorerConstants.INSTANCE.rows(), \n                            humanReadableByteCount(estimatedSize));\n                }\n\n                @Override\n                public void notFound() {\n                    showErrorIcon();\n                    showError(def.getUUID(), DataSetExplorerConstants.INSTANCE.notFound());\n                    \n                }\n\n                @Override\n                public boolean onError(final ClientRuntimeError error) {\n                    showErrorIcon();\n                    showError(def.getUUID(), error);\n                    return false;\n                }\n            });\n        }\n    }", "signature": "void show(final DataSetDef def)", "full_signature": "public void show(final DataSetDef def)", "class_method_signature": "DataSetSummary.show(final DataSetDef def)", "testcase": false, "constructor": false, "invocations": ["getProvider", "equals", "getProvider", "equals", "getProvider", "isCacheEnabled", "isPushEnabled", "getRefreshTime", "showStatusPanel", "showLoadingIcon", "getMetadata", "getEstimatedSize", "getNumberOfRows", "showSizePanel", "humanReadableRowCount", "rows", "humanReadableByteCount", "showErrorIcon", "showError", "getUUID", "notFound", "showErrorIcon", "showError", "getUUID"]}, "repository": {"repo_id": 17898911, "url": "https://github.com/dashbuilder/dashbuilder", "language": "Java", "is_fork": false, "fork_count": 119, "stargazer_count": 160, "size": 10456, "license": "licensed"}}