{"test_class": {"identifier": "ClientRuntimeErrorPopupPresenterTest", "superclass": "", "interfaces": "", "fields": [{"original_string": "@Mock ErrorPopupPresenter.View view;", "modifier": "@Mock", "type": "ErrorPopupPresenter.View", "declarator": "view", "var_name": "view"}, {"original_string": "private ClientRuntimeErrorPopupPresenter presenter;", "modifier": "private", "type": "ClientRuntimeErrorPopupPresenter", "declarator": "presenter", "var_name": "presenter"}], "file": "dashbuilder-client/dashbuilder-widgets/src/test/java/org/dashbuilder/client/widgets/common/ClientRuntimeErrorPopupPresenterTest.java"}, "test_case": {"identifier": "testShowMessage", "parameters": "()", "modifiers": "@Test public", "return": "void", "body": "@Test\n    public void testShowMessage() throws Exception {\n        final ClientRuntimeError error = mock(ClientRuntimeError.class);\n        final String message = \"message\";\n        final Throwable cause = mock(Throwable.class);\n        final String localizedMessage = \"localizedMessage\";\n        when(cause.getLocalizedMessage()).thenReturn(localizedMessage);\n        when(error.getMessage()).thenReturn(message);\n        when(error.getRootCause()).thenReturn(cause);\n        presenter.showMessage(error);\n        verify(view, times(1)).showMessage(anyString(), any(Command.class), any(Command.class));\n    }", "signature": "void testShowMessage()", "full_signature": "@Test public void testShowMessage()", "class_method_signature": "ClientRuntimeErrorPopupPresenterTest.testShowMessage()", "testcase": true, "constructor": false, "invocations": ["mock", "mock", "thenReturn", "when", "getLocalizedMessage", "thenReturn", "when", "getMessage", "thenReturn", "when", "getRootCause", "showMessage", "showMessage", "verify", "times", "anyString", "any", "any"]}, "focal_class": {"identifier": "ClientRuntimeErrorPopupPresenter", "superclass": "extends ErrorPopupPresenter", "interfaces": "", "fields": [], "methods": [{"identifier": "ClientRuntimeErrorPopupPresenter", "parameters": "(View view)", "modifiers": "@Inject public", "return": "", "signature": " ClientRuntimeErrorPopupPresenter(View view)", "full_signature": "@Inject public  ClientRuntimeErrorPopupPresenter(View view)", "class_method_signature": "ClientRuntimeErrorPopupPresenter.ClientRuntimeErrorPopupPresenter(View view)", "testcase": false, "constructor": true}, {"identifier": "showMessage", "parameters": "( final ClientRuntimeError error)", "modifiers": "public", "return": "void", "signature": "void showMessage( final ClientRuntimeError error)", "full_signature": "public void showMessage( final ClientRuntimeError error)", "class_method_signature": "ClientRuntimeErrorPopupPresenter.showMessage( final ClientRuntimeError error)", "testcase": false, "constructor": false}], "file": "dashbuilder-client/dashbuilder-widgets/src/main/java/org/dashbuilder/client/widgets/common/ClientRuntimeErrorPopupPresenter.java"}, "focal_method": {"identifier": "showMessage", "parameters": "( final ClientRuntimeError error)", "modifiers": "public", "return": "void", "body": "public void showMessage( final ClientRuntimeError error) {\n        StringBuilder result = new StringBuilder(DataSetExplorerConstants.INSTANCE.error());\n        \n        if (error != null) {\n            final String message = error.getMessage();\n            Throwable t = error.getRootCause();\n            String localizedMessage = t != null ? t.getLocalizedMessage() : null;\n            result = new StringBuilder(message);\n            if (localizedMessage != null) {\n                result.append(\" \").append(DataSetExplorerConstants.INSTANCE.cause()).\n                        append(\": \").append(localizedMessage);\n            }\n        }\n        \n        showMessage(result.toString());\n    }", "signature": "void showMessage( final ClientRuntimeError error)", "full_signature": "public void showMessage( final ClientRuntimeError error)", "class_method_signature": "ClientRuntimeErrorPopupPresenter.showMessage( final ClientRuntimeError error)", "testcase": false, "constructor": false, "invocations": ["error", "getMessage", "getRootCause", "getLocalizedMessage", "append", "append", "append", "append", "cause", "showMessage", "toString"]}, "repository": {"repo_id": 17898911, "url": "https://github.com/dashbuilder/dashbuilder", "language": "Java", "is_fork": false, "fork_count": 119, "stargazer_count": 160, "size": 10456, "license": "licensed"}}