{"test_class": {"identifier": "Transformers3WValidationTest", "superclass": "extends AbstractValidationTest", "interfaces": "", "fields": [{"original_string": "private TwtTestData twtValidationData;", "modifier": "private", "type": "TwtTestData", "declarator": "twtValidationData", "var_name": "twtValidationData"}], "file": "loadflow/loadflow-validation/src/test/java/com/powsybl/loadflow/validation/Transformers3WValidationTest.java"}, "test_case": {"identifier": "checkNetworkTwts", "parameters": "()", "modifiers": "@Test public", "return": "void", "body": "@Test\n    public void checkNetworkTwts() throws IOException {\n        Network network = Mockito.mock(Network.class);\n        Mockito.when(network.getId()).thenReturn(\"network\");\n        Mockito.when(network.getThreeWindingsTransformerStream()).thenAnswer(dummy -> Stream.of(twtValidationData.get3WTransformer()));\n\n        assertFalse(Transformers3WValidation.INSTANCE.checkTransformers(network, strictConfig, data));\n        assertFalse(ValidationType.TWTS3W.check(network, strictConfig, tmpDir));\n\n        ValidationWriter validationWriter = ValidationUtils.createValidationWriter(network.getId(), strictConfig, NullWriter.NULL_WRITER, ValidationType.TWTS);\n        assertFalse(ValidationType.TWTS3W.check(network, strictConfig, validationWriter));\n\n        strictConfig.setThreshold(.3);\n        assertTrue(Transformers3WValidation.INSTANCE.checkTransformers(network, strictConfig, NullWriter.NULL_WRITER));\n    }", "signature": "void checkNetworkTwts()", "full_signature": "@Test public void checkNetworkTwts()", "class_method_signature": "Transformers3WValidationTest.checkNetworkTwts()", "testcase": true, "constructor": false, "invocations": ["mock", "thenReturn", "when", "getId", "thenAnswer", "when", "getThreeWindingsTransformerStream", "of", "get3WTransformer", "assertFalse", "checkTransformers", "assertFalse", "check", "createValidationWriter", "getId", "assertFalse", "check", "setThreshold", "assertTrue", "checkTransformers"]}, "focal_class": {"identifier": "Transformers3WValidation", "superclass": "extends AbstractTransformersValidation", "interfaces": "", "fields": [{"original_string": "private static final Logger LOGGER = LoggerFactory.getLogger(Transformers3WValidation.class);", "modifier": "private static final", "type": "Logger", "declarator": "LOGGER = LoggerFactory.getLogger(Transformers3WValidation.class)", "var_name": "LOGGER"}, {"original_string": "public static final Transformers3WValidation INSTANCE = new Transformers3WValidation();", "modifier": "public static final", "type": "Transformers3WValidation", "declarator": "INSTANCE = new Transformers3WValidation()", "var_name": "INSTANCE"}], "methods": [{"identifier": "Transformers3WValidation", "parameters": "()", "modifiers": "private", "return": "", "signature": " Transformers3WValidation()", "full_signature": "private  Transformers3WValidation()", "class_method_signature": "Transformers3WValidation.Transformers3WValidation()", "testcase": false, "constructor": true}, {"identifier": "checkTransformers", "parameters": "(Network network, ValidationConfig config, ValidationWriter twtsWriter)", "modifiers": "@Override public", "return": "boolean", "signature": "boolean checkTransformers(Network network, ValidationConfig config, ValidationWriter twtsWriter)", "full_signature": "@Override public boolean checkTransformers(Network network, ValidationConfig config, ValidationWriter twtsWriter)", "class_method_signature": "Transformers3WValidation.checkTransformers(Network network, ValidationConfig config, ValidationWriter twtsWriter)", "testcase": false, "constructor": false}, {"identifier": "checkTransformer", "parameters": "(ThreeWindingsTransformer twt, ValidationConfig config, Writer writer)", "modifiers": "public", "return": "boolean", "signature": "boolean checkTransformer(ThreeWindingsTransformer twt, ValidationConfig config, Writer writer)", "full_signature": "public boolean checkTransformer(ThreeWindingsTransformer twt, ValidationConfig config, Writer writer)", "class_method_signature": "Transformers3WValidation.checkTransformer(ThreeWindingsTransformer twt, ValidationConfig config, Writer writer)", "testcase": false, "constructor": false}, {"identifier": "checkTransformer", "parameters": "(ThreeWindingsTransformer twt, ValidationConfig config, ValidationWriter twtsWriter)", "modifiers": "public", "return": "boolean", "signature": "boolean checkTransformer(ThreeWindingsTransformer twt, ValidationConfig config, ValidationWriter twtsWriter)", "full_signature": "public boolean checkTransformer(ThreeWindingsTransformer twt, ValidationConfig config, ValidationWriter twtsWriter)", "class_method_signature": "Transformers3WValidation.checkTransformer(ThreeWindingsTransformer twt, ValidationConfig config, ValidationWriter twtsWriter)", "testcase": false, "constructor": false}, {"identifier": "checkLeg", "parameters": "(TwtData twtData, Side side, ValidationConfig config)", "modifiers": "private static", "return": "boolean", "signature": "boolean checkLeg(TwtData twtData, Side side, ValidationConfig config)", "full_signature": "private static boolean checkLeg(TwtData twtData, Side side, ValidationConfig config)", "class_method_signature": "Transformers3WValidation.checkLeg(TwtData twtData, Side side, ValidationConfig config)", "testcase": false, "constructor": false}], "file": "loadflow/loadflow-validation/src/main/java/com/powsybl/loadflow/validation/Transformers3WValidation.java"}, "focal_method": {"identifier": "checkTransformers", "parameters": "(Network network, ValidationConfig config, ValidationWriter twtsWriter)", "modifiers": "@Override public", "return": "boolean", "body": "@Override\n    public boolean checkTransformers(Network network, ValidationConfig config, ValidationWriter twtsWriter) {\n        Objects.requireNonNull(network);\n        Objects.requireNonNull(config);\n        Objects.requireNonNull(twtsWriter);\n\n        LOGGER.info(\"Checking 3W transformers of network {}\", network.getId());\n        return network.getThreeWindingsTransformerStream()\n                .sorted(Comparator.comparing(ThreeWindingsTransformer::getId))\n                .map(twt -> checkTransformer(twt, config, twtsWriter))\n                .reduce(Boolean::logicalAnd)\n                .orElse(true);\n    }", "signature": "boolean checkTransformers(Network network, ValidationConfig config, ValidationWriter twtsWriter)", "full_signature": "@Override public boolean checkTransformers(Network network, ValidationConfig config, ValidationWriter twtsWriter)", "class_method_signature": "Transformers3WValidation.checkTransformers(Network network, ValidationConfig config, ValidationWriter twtsWriter)", "testcase": false, "constructor": false, "invocations": ["requireNonNull", "requireNonNull", "requireNonNull", "info", "getId", "orElse", "reduce", "map", "sorted", "getThreeWindingsTransformerStream", "comparing", "checkTransformer"]}, "repository": {"repo_id": 105284146, "url": "https://github.com/powsybl/powsybl-core", "stars": 53, "created": "9/29/2017 2:51:18 PM +00:00", "updates": "2020-01-27T10:39:13+00:00", "fork": "False", "license": "licensed"}}