{"test_class": {"identifier": "UcteAliasesCreationTest", "superclass": "", "interfaces": "", "fields": [], "file": "ucte/ucte-util/src/test/java/com/powsybl/ucte/util/UcteAliasesCreationTest.java"}, "test_case": {"identifier": "checkAliasesCreationWhenImportingMergedFile", "parameters": "()", "modifiers": "@Test public", "return": "void", "body": "@Test\n    public void checkAliasesCreationWhenImportingMergedFile() {\n        Network network = loadNetworkFromResourceFile(\"/uxTestGridForMerging.uct\");\n\n        // Merged dangling lines disappeared\n        assertNull(network.getIdentifiable(\"BBBBBB11 XXXXXX11 1\"));\n        assertNull(network.getIdentifiable(\"FFFFFF11 XXXXXX11 1\"));\n\n        // No aliases on element name\n        assertNull(network.getIdentifiable(\"BBBBBB11 XXXXXX11 ABCDE\"));\n        assertNull(network.getIdentifiable(\"FFFFFF11 XXXXXX11 ABCDE\"));\n\n        // No aliases on disappeared dangling lines\n        assertNull(network.getIdentifiable(\"BBBBBB11 XXXXXX11 1\"));\n        assertNull(network.getIdentifiable(\"FFFFFF11 XXXXXX11 1\"));\n\n        UcteAliasesCreation.createAliases(network);\n\n        // Aliases on element name have been created\n        assertNotNull(network.getIdentifiable(\"BBBBBB11 XXXXXX11 ABCDE\"));\n        assertNotNull(network.getIdentifiable(\"FFFFFF11 XXXXXX11 ABCDE\"));\n\n        // Aliases on disappeared dangling lines have been created\n        assertNotNull(network.getIdentifiable(\"BBBBBB11 XXXXXX11 1\"));\n        assertNotNull(network.getIdentifiable(\"FFFFFF11 XXXXXX11 1\"));\n\n        // They are all referencing the same identifiable\n        assertEquals(network.getIdentifiable(\"BBBBBB11 XXXXXX11 ABCDE\"), network.getIdentifiable(\"FFFFFF11 XXXXXX11 ABCDE\"));\n        assertEquals(network.getIdentifiable(\"BBBBBB11 XXXXXX11 ABCDE\"), network.getIdentifiable(\"BBBBBB11 XXXXXX11 1\"));\n        assertEquals(network.getIdentifiable(\"FFFFFF11 XXXXXX11 ABCDE\"), network.getIdentifiable(\"FFFFFF11 XXXXXX11 1\"));\n    }", "signature": "void checkAliasesCreationWhenImportingMergedFile()", "full_signature": "@Test public void checkAliasesCreationWhenImportingMergedFile()", "class_method_signature": "UcteAliasesCreationTest.checkAliasesCreationWhenImportingMergedFile()", "testcase": true, "constructor": false, "invocations": ["loadNetworkFromResourceFile", "assertNull", "getIdentifiable", "assertNull", "getIdentifiable", "assertNull", "getIdentifiable", "assertNull", "getIdentifiable", "assertNull", "getIdentifiable", "assertNull", "getIdentifiable", "createAliases", "assertNotNull", "getIdentifiable", "assertNotNull", "getIdentifiable", "assertNotNull", "getIdentifiable", "assertNotNull", "getIdentifiable", "assertEquals", "getIdentifiable", "getIdentifiable", "assertEquals", "getIdentifiable", "getIdentifiable", "assertEquals", "getIdentifiable", "getIdentifiable"]}, "focal_class": {"identifier": "UcteAliasesCreation", "superclass": "", "interfaces": "", "fields": [{"original_string": "private static final String ALIAS_TRIPLET_TEMPLATE = \"%s %s %s\";", "modifier": "private static final", "type": "String", "declarator": "ALIAS_TRIPLET_TEMPLATE = \"%s %s %s\"", "var_name": "ALIAS_TRIPLET_TEMPLATE"}, {"original_string": "private static final String ELEMENT_NAME_PROPERTY_KEY = \"elementName\";", "modifier": "private static final", "type": "String", "declarator": "ELEMENT_NAME_PROPERTY_KEY = \"elementName\"", "var_name": "ELEMENT_NAME_PROPERTY_KEY"}], "methods": [{"identifier": "UcteAliasesCreation", "parameters": "()", "modifiers": "private", "return": "", "signature": " UcteAliasesCreation()", "full_signature": "private  UcteAliasesCreation()", "class_method_signature": "UcteAliasesCreation.UcteAliasesCreation()", "testcase": false, "constructor": true}, {"identifier": "createAliases", "parameters": "(Network network)", "modifiers": "public static", "return": "void", "signature": "void createAliases(Network network)", "full_signature": "public static void createAliases(Network network)", "class_method_signature": "UcteAliasesCreation.createAliases(Network network)", "testcase": false, "constructor": false}, {"identifier": "addElementNameAlias", "parameters": "(Identifiable<?> identifiable, Set<String> duplicatedAliases)", "modifiers": "private static", "return": "void", "signature": "void addElementNameAlias(Identifiable<?> identifiable, Set<String> duplicatedAliases)", "full_signature": "private static void addElementNameAlias(Identifiable<?> identifiable, Set<String> duplicatedAliases)", "class_method_signature": "UcteAliasesCreation.addElementNameAlias(Identifiable<?> identifiable, Set<String> duplicatedAliases)", "testcase": false, "constructor": false}, {"identifier": "addHalfElementNameAliases", "parameters": "(TieLine tieLine, Set<String> duplicatedAliases)", "modifiers": "private static", "return": "void", "signature": "void addHalfElementNameAliases(TieLine tieLine, Set<String> duplicatedAliases)", "full_signature": "private static void addHalfElementNameAliases(TieLine tieLine, Set<String> duplicatedAliases)", "class_method_signature": "UcteAliasesCreation.addHalfElementNameAliases(TieLine tieLine, Set<String> duplicatedAliases)", "testcase": false, "constructor": false}, {"identifier": "safeAddAlias", "parameters": "(Identifiable<?> identifiable, Set<String> duplicatedAliases, String alias)", "modifiers": "private static", "return": "void", "signature": "void safeAddAlias(Identifiable<?> identifiable, Set<String> duplicatedAliases, String alias)", "full_signature": "private static void safeAddAlias(Identifiable<?> identifiable, Set<String> duplicatedAliases, String alias)", "class_method_signature": "UcteAliasesCreation.safeAddAlias(Identifiable<?> identifiable, Set<String> duplicatedAliases, String alias)", "testcase": false, "constructor": false}], "file": "ucte/ucte-util/src/main/java/com/powsybl/ucte/util/UcteAliasesCreation.java"}, "focal_method": {"identifier": "createAliases", "parameters": "(Network network)", "modifiers": "public static", "return": "void", "body": "public static void createAliases(Network network) {\n        Set<String> duplicatedAliases = new HashSet<>();\n        network.getBranchStream().forEach(branch -> {\n            if (branch instanceof TieLine) {\n                TieLine tieLine = (TieLine) branch;\n                tieLine.addAlias(tieLine.getHalf1().getId());\n                tieLine.addAlias(tieLine.getHalf2().getId());\n                addHalfElementNameAliases(tieLine, duplicatedAliases);\n            }\n            addElementNameAlias(branch, duplicatedAliases);\n        });\n        network.getSwitchStream().forEach(switchEl -> addElementNameAlias(switchEl, duplicatedAliases));\n        network.getDanglingLineStream().forEach(dl -> addElementNameAlias(dl, duplicatedAliases));\n    }", "signature": "void createAliases(Network network)", "full_signature": "public static void createAliases(Network network)", "class_method_signature": "UcteAliasesCreation.createAliases(Network network)", "testcase": false, "constructor": false, "invocations": ["forEach", "getBranchStream", "addAlias", "getId", "getHalf1", "addAlias", "getId", "getHalf2", "addHalfElementNameAliases", "addElementNameAlias", "forEach", "getSwitchStream", "addElementNameAlias", "forEach", "getDanglingLineStream", "addElementNameAlias"]}, "repository": {"repo_id": 105284146, "url": "https://github.com/powsybl/powsybl-core", "stars": 53, "created": "9/29/2017 2:51:18 PM +00:00", "updates": "2020-01-27T10:39:13+00:00", "fork": "False", "license": "licensed"}}