{"test_class": {"identifier": "StaticVarCompensatorsValidationTest", "superclass": "extends AbstractValidationTest", "interfaces": "", "fields": [{"original_string": "private double p = 0;", "modifier": "private", "type": "double", "declarator": "p = 0", "var_name": "p"}, {"original_string": "private double q = 3.72344;", "modifier": "private", "type": "double", "declarator": "q = 3.72344", "var_name": "q"}, {"original_string": "private double v = 380;", "modifier": "private", "type": "double", "declarator": "v = 380", "var_name": "v"}, {"original_string": "private double nominalV = 380;", "modifier": "private", "type": "double", "declarator": "nominalV = 380", "var_name": "nominalV"}, {"original_string": "private double reactivePowerSetpoint = 3.72344;", "modifier": "private", "type": "double", "declarator": "reactivePowerSetpoint = 3.72344", "var_name": "reactivePowerSetpoint"}, {"original_string": "private final double voltageSetpoint = 380;", "modifier": "private final", "type": "double", "declarator": "voltageSetpoint = 380", "var_name": "voltageSetpoint"}, {"original_string": "private RegulationMode regulationMode = RegulationMode.REACTIVE_POWER;", "modifier": "private", "type": "RegulationMode", "declarator": "regulationMode = RegulationMode.REACTIVE_POWER", "var_name": "regulationMode"}, {"original_string": "private final double bMin = -.01;", "modifier": "private final", "type": "double", "declarator": "bMin = -.01", "var_name": "bMin"}, {"original_string": "private final double bMax = .1;", "modifier": "private final", "type": "double", "declarator": "bMax = .1", "var_name": "bMax"}, {"original_string": "private final boolean connected = true;", "modifier": "private final", "type": "boolean", "declarator": "connected = true", "var_name": "connected"}, {"original_string": "private boolean mainComponent = true;", "modifier": "private", "type": "boolean", "declarator": "mainComponent = true", "var_name": "mainComponent"}, {"original_string": "private BusView svcBusView;", "modifier": "private", "type": "BusView", "declarator": "svcBusView", "var_name": "svcBusView"}, {"original_string": "private Terminal svcTerminal;", "modifier": "private", "type": "Terminal", "declarator": "svcTerminal", "var_name": "svcTerminal"}, {"original_string": "private StaticVarCompensator svc;", "modifier": "private", "type": "StaticVarCompensator", "declarator": "svc", "var_name": "svc"}], "file": "loadflow/loadflow-validation/src/test/java/com/powsybl/loadflow/validation/StaticVarCompensatorsValidationTest.java"}, "test_case": {"identifier": "checkSvcsValues", "parameters": "()", "modifiers": "@Test public", "return": "void", "body": "@Test\n    public void checkSvcsValues() {\n        // active power should be equal to 0\n        assertTrue(StaticVarCompensatorsValidation.INSTANCE.checkSVCs(\"test\", p, q, v, v, nominalV, reactivePowerSetpoint, voltageSetpoint, regulationMode, bMin, bMax, connected, mainComponent, strictConfig, NullWriter.NULL_WRITER));\n        p = -39.8;\n        assertFalse(StaticVarCompensatorsValidation.INSTANCE.checkSVCs(\"test\", p, q, v, v, nominalV, reactivePowerSetpoint, voltageSetpoint, regulationMode, bMin, bMax, connected, mainComponent, strictConfig, NullWriter.NULL_WRITER));\n        p = -0.01;\n        assertTrue(StaticVarCompensatorsValidation.INSTANCE.checkSVCs(\"test\", p, q, v, v, nominalV, reactivePowerSetpoint, voltageSetpoint, regulationMode, bMin, bMax, connected, mainComponent, strictConfig, NullWriter.NULL_WRITER));\n\n        // if regulationMode = OFF then reactive power should be equal to 0\n        regulationMode = RegulationMode.OFF;\n        assertFalse(StaticVarCompensatorsValidation.INSTANCE.checkSVCs(\"test\", p, q, v, v, nominalV, reactivePowerSetpoint, voltageSetpoint, regulationMode, bMin, bMax, connected, mainComponent, strictConfig, NullWriter.NULL_WRITER));\n\n        //  if regulationMode = REACTIVE_POWER if the setpoint is in [Qmin=bMin*V*V, Qmax=bMax*V*V] then then reactive power should be equal to setpoint\n        regulationMode = RegulationMode.REACTIVE_POWER;\n        assertTrue(StaticVarCompensatorsValidation.INSTANCE.checkSVCs(\"test\", p, q, v, v, nominalV, reactivePowerSetpoint, voltageSetpoint, regulationMode, bMin, bMax, connected, mainComponent, strictConfig, NullWriter.NULL_WRITER));\n        q = 3.7;\n        assertFalse(StaticVarCompensatorsValidation.INSTANCE.checkSVCs(\"test\", p, q, v, v, nominalV, reactivePowerSetpoint, voltageSetpoint, regulationMode, bMin, bMax, connected, mainComponent, strictConfig, NullWriter.NULL_WRITER));\n        assertTrue(StaticVarCompensatorsValidation.INSTANCE.checkSVCs(\"test\", p, q, v, v, nominalV, reactivePowerSetpoint, voltageSetpoint, regulationMode, bMin, bMax, connected, mainComponent, looseConfig, NullWriter.NULL_WRITER));\n\n        // check with NaN values\n        assertFalse(StaticVarCompensatorsValidation.INSTANCE.checkSVCs(\"test\", p, q, v, v, nominalV, Float.NaN, voltageSetpoint, regulationMode, bMin, bMax, connected, mainComponent, looseConfig, NullWriter.NULL_WRITER));\n        assertFalse(StaticVarCompensatorsValidation.INSTANCE.checkSVCs(\"test\", p, q, v, v, nominalV, reactivePowerSetpoint, voltageSetpoint, regulationMode, Float.NaN, bMax, connected, mainComponent, looseConfig, NullWriter.NULL_WRITER));\n        looseConfig.setOkMissingValues(true);\n        assertTrue(StaticVarCompensatorsValidation.INSTANCE.checkSVCs(\"test\", p, q, v, v, nominalV, Float.NaN, voltageSetpoint, regulationMode, bMin, bMax, connected, mainComponent, looseConfig, NullWriter.NULL_WRITER));\n        assertTrue(StaticVarCompensatorsValidation.INSTANCE.checkSVCs(\"test\", p, q, v, v, nominalV, reactivePowerSetpoint, voltageSetpoint, regulationMode, Float.NaN, bMax, connected, mainComponent, looseConfig, NullWriter.NULL_WRITER));\n        looseConfig.setOkMissingValues(false);\n\n        // if regulationMode = VOLTAGE then either V at the connected bus is equal to voltageSetpoint and q is bounded within [-Qmax=bMax*V*V, -Qmin=bMin*V*V]\n        regulationMode = RegulationMode.VOLTAGE;\n        assertTrue(StaticVarCompensatorsValidation.INSTANCE.checkSVCs(\"test\", p, q, v, v, nominalV, reactivePowerSetpoint, voltageSetpoint, regulationMode, bMin, bMax, connected, mainComponent, strictConfig, NullWriter.NULL_WRITER));\n        v = 400;\n        assertFalse(StaticVarCompensatorsValidation.INSTANCE.checkSVCs(\"test\", p, q, v, v, nominalV, reactivePowerSetpoint, voltageSetpoint, regulationMode, bMin, bMax, connected, mainComponent, strictConfig, NullWriter.NULL_WRITER));\n        v = 380;\n        q = 1445;\n        assertFalse(StaticVarCompensatorsValidation.INSTANCE.checkSVCs(\"test\", p, q, v, v, nominalV, reactivePowerSetpoint, voltageSetpoint, regulationMode, bMin, bMax, connected, mainComponent, strictConfig, NullWriter.NULL_WRITER));\n\n        // check with NaN values\n        q = 3.7;\n        assertFalse(StaticVarCompensatorsValidation.INSTANCE.checkSVCs(\"test\", p, q, v, v, nominalV, reactivePowerSetpoint, voltageSetpoint, regulationMode, Float.NaN, bMax, connected, mainComponent, strictConfig, NullWriter.NULL_WRITER));\n        assertFalse(StaticVarCompensatorsValidation.INSTANCE.checkSVCs(\"test\", p, q, v, v, nominalV, reactivePowerSetpoint, voltageSetpoint, regulationMode, bMin, Float.NaN, connected, mainComponent, strictConfig, NullWriter.NULL_WRITER));\n        assertFalse(StaticVarCompensatorsValidation.INSTANCE.checkSVCs(\"test\", p, q, v, v, nominalV, reactivePowerSetpoint, Float.NaN, regulationMode, bMin, bMax, connected, mainComponent, strictConfig, NullWriter.NULL_WRITER));\n        strictConfig.setOkMissingValues(true);\n        assertTrue(StaticVarCompensatorsValidation.INSTANCE.checkSVCs(\"test\", p, q, v, v, nominalV, reactivePowerSetpoint, voltageSetpoint, regulationMode, Float.NaN, bMax, connected, mainComponent, strictConfig, NullWriter.NULL_WRITER));\n        assertTrue(StaticVarCompensatorsValidation.INSTANCE.checkSVCs(\"test\", p, q, v, v, nominalV, reactivePowerSetpoint, voltageSetpoint, regulationMode, bMin, Float.NaN, connected, mainComponent, strictConfig, NullWriter.NULL_WRITER));\n        assertTrue(StaticVarCompensatorsValidation.INSTANCE.checkSVCs(\"test\", p, q, v, v, nominalV, reactivePowerSetpoint, Float.NaN, regulationMode, bMin, bMax, connected, mainComponent, strictConfig, NullWriter.NULL_WRITER));\n        strictConfig.setOkMissingValues(false);\n\n        // if regulationMode = VOLTAGE then either q is equal to -bMin * V * V and V is lower than voltageSetpoint\n        q = 1296;\n        v = 360;\n        nominalV = 360;\n        assertTrue(StaticVarCompensatorsValidation.INSTANCE.checkSVCs(\"test\", p, q, v, v, nominalV, reactivePowerSetpoint, voltageSetpoint, regulationMode, bMin, bMax, connected, mainComponent, strictConfig, NullWriter.NULL_WRITER));\n        v = 340;\n        nominalV = 340;\n        assertFalse(StaticVarCompensatorsValidation.INSTANCE.checkSVCs(\"test\", p, q, v, v, nominalV, reactivePowerSetpoint, voltageSetpoint, regulationMode, bMin, bMax, connected, mainComponent, strictConfig, NullWriter.NULL_WRITER));\n\n        // if regulationMode = VOLTAGE then either q is equal to -bMax * V * V and V is higher than voltageSetpoint\n        q = -16000;\n        v = 400;\n        nominalV = 400;\n        assertTrue(StaticVarCompensatorsValidation.INSTANCE.checkSVCs(\"test\", p, q, v, v, nominalV, reactivePowerSetpoint, voltageSetpoint, regulationMode, bMin, bMax, connected, mainComponent, strictConfig, NullWriter.NULL_WRITER));\n        v = 420;\n        nominalV = 420;\n        assertFalse(StaticVarCompensatorsValidation.INSTANCE.checkSVCs(\"test\", p, q, v, v, nominalV, reactivePowerSetpoint, voltageSetpoint, regulationMode, bMin, bMax, connected, mainComponent, strictConfig, NullWriter.NULL_WRITER));\n        // check main component\n        mainComponent = false;\n        assertTrue(StaticVarCompensatorsValidation.INSTANCE.checkSVCs(\"test\", p, q, v, v, nominalV, reactivePowerSetpoint, voltageSetpoint, regulationMode, bMin, bMax, connected, mainComponent, strictConfig, NullWriter.NULL_WRITER));\n        mainComponent = true;\n\n        // a validation error should be detected if there is both a voltage and a target but no p or q\n        v = 380;\n        nominalV = 380;\n        p = Float.NaN;\n        q = Float.NaN;\n        assertFalse(StaticVarCompensatorsValidation.INSTANCE.checkSVCs(\"test\", p, q, v, v, nominalV, reactivePowerSetpoint, voltageSetpoint, regulationMode, bMin, bMax, connected, mainComponent, strictConfig, NullWriter.NULL_WRITER));\n        reactivePowerSetpoint = 0;\n        assertTrue(StaticVarCompensatorsValidation.INSTANCE.checkSVCs(\"test\", p, q, v, v, nominalV, reactivePowerSetpoint, voltageSetpoint, regulationMode, bMin, bMax, connected, mainComponent, strictConfig, NullWriter.NULL_WRITER));\n    }", "signature": "void checkSvcsValues()", "full_signature": "@Test public void checkSvcsValues()", "class_method_signature": "StaticVarCompensatorsValidationTest.checkSvcsValues()", "testcase": true, "constructor": false, "invocations": ["assertTrue", "checkSVCs", "assertFalse", "checkSVCs", "assertTrue", "checkSVCs", "assertFalse", "checkSVCs", "assertTrue", "checkSVCs", "assertFalse", "checkSVCs", "assertTrue", "checkSVCs", "assertFalse", "checkSVCs", "assertFalse", "checkSVCs", "setOkMissingValues", "assertTrue", "checkSVCs", "assertTrue", "checkSVCs", "setOkMissingValues", "assertTrue", "checkSVCs", "assertFalse", "checkSVCs", "assertFalse", "checkSVCs", "assertFalse", "checkSVCs", "assertFalse", "checkSVCs", "assertFalse", "checkSVCs", "setOkMissingValues", "assertTrue", "checkSVCs", "assertTrue", "checkSVCs", "assertTrue", "checkSVCs", "setOkMissingValues", "assertTrue", "checkSVCs", "assertFalse", "checkSVCs", "assertTrue", "checkSVCs", "assertFalse", "checkSVCs", "assertTrue", "checkSVCs", "assertFalse", "checkSVCs", "assertTrue", "checkSVCs"]}, "focal_class": {"identifier": "StaticVarCompensatorsValidation", "superclass": "", "interfaces": "", "fields": [{"original_string": "private static final Logger LOGGER = LoggerFactory.getLogger(StaticVarCompensatorsValidation.class);", "modifier": "private static final", "type": "Logger", "declarator": "LOGGER = LoggerFactory.getLogger(StaticVarCompensatorsValidation.class)", "var_name": "LOGGER"}, {"original_string": "public static final StaticVarCompensatorsValidation INSTANCE = new StaticVarCompensatorsValidation();", "modifier": "public static final", "type": "StaticVarCompensatorsValidation", "declarator": "INSTANCE = new StaticVarCompensatorsValidation()", "var_name": "INSTANCE"}], "methods": [{"identifier": "StaticVarCompensatorsValidation", "parameters": "()", "modifiers": "private", "return": "", "signature": " StaticVarCompensatorsValidation()", "full_signature": "private  StaticVarCompensatorsValidation()", "class_method_signature": "StaticVarCompensatorsValidation.StaticVarCompensatorsValidation()", "testcase": false, "constructor": true}, {"identifier": "checkSVCs", "parameters": "(Network network, ValidationConfig config, Path file)", "modifiers": "public", "return": "boolean", "signature": "boolean checkSVCs(Network network, ValidationConfig config, Path file)", "full_signature": "public boolean checkSVCs(Network network, ValidationConfig config, Path file)", "class_method_signature": "StaticVarCompensatorsValidation.checkSVCs(Network network, ValidationConfig config, Path file)", "testcase": false, "constructor": false}, {"identifier": "checkSVCs", "parameters": "(Network network, ValidationConfig config, Writer writer)", "modifiers": "public", "return": "boolean", "signature": "boolean checkSVCs(Network network, ValidationConfig config, Writer writer)", "full_signature": "public boolean checkSVCs(Network network, ValidationConfig config, Writer writer)", "class_method_signature": "StaticVarCompensatorsValidation.checkSVCs(Network network, ValidationConfig config, Writer writer)", "testcase": false, "constructor": false}, {"identifier": "checkSVCs", "parameters": "(Network network, ValidationConfig config, ValidationWriter svcsWriter)", "modifiers": "public", "return": "boolean", "signature": "boolean checkSVCs(Network network, ValidationConfig config, ValidationWriter svcsWriter)", "full_signature": "public boolean checkSVCs(Network network, ValidationConfig config, ValidationWriter svcsWriter)", "class_method_signature": "StaticVarCompensatorsValidation.checkSVCs(Network network, ValidationConfig config, ValidationWriter svcsWriter)", "testcase": false, "constructor": false}, {"identifier": "checkSVCs", "parameters": "(StaticVarCompensator svc, ValidationConfig config, Writer writer)", "modifiers": "public", "return": "boolean", "signature": "boolean checkSVCs(StaticVarCompensator svc, ValidationConfig config, Writer writer)", "full_signature": "public boolean checkSVCs(StaticVarCompensator svc, ValidationConfig config, Writer writer)", "class_method_signature": "StaticVarCompensatorsValidation.checkSVCs(StaticVarCompensator svc, ValidationConfig config, Writer writer)", "testcase": false, "constructor": false}, {"identifier": "checkSVCs", "parameters": "(StaticVarCompensator svc, ValidationConfig config, ValidationWriter svcsWriter)", "modifiers": "public", "return": "boolean", "signature": "boolean checkSVCs(StaticVarCompensator svc, ValidationConfig config, ValidationWriter svcsWriter)", "full_signature": "public boolean checkSVCs(StaticVarCompensator svc, ValidationConfig config, ValidationWriter svcsWriter)", "class_method_signature": "StaticVarCompensatorsValidation.checkSVCs(StaticVarCompensator svc, ValidationConfig config, ValidationWriter svcsWriter)", "testcase": false, "constructor": false}, {"identifier": "checkSVCs", "parameters": "(String id, double p, double q, double vControlled, double vController, double nominalVcontroller, double reactivePowerSetpoint, double voltageSetpoint,\n                                    RegulationMode regulationMode, double bMin, double bMax, boolean connected, boolean mainComponent,\n                                    ValidationConfig config, Writer writer)", "modifiers": "public", "return": "boolean", "signature": "boolean checkSVCs(String id, double p, double q, double vControlled, double vController, double nominalVcontroller, double reactivePowerSetpoint, double voltageSetpoint,\n                                    RegulationMode regulationMode, double bMin, double bMax, boolean connected, boolean mainComponent,\n                                    ValidationConfig config, Writer writer)", "full_signature": "public boolean checkSVCs(String id, double p, double q, double vControlled, double vController, double nominalVcontroller, double reactivePowerSetpoint, double voltageSetpoint,\n                                    RegulationMode regulationMode, double bMin, double bMax, boolean connected, boolean mainComponent,\n                                    ValidationConfig config, Writer writer)", "class_method_signature": "StaticVarCompensatorsValidation.checkSVCs(String id, double p, double q, double vControlled, double vController, double nominalVcontroller, double reactivePowerSetpoint, double voltageSetpoint,\n                                    RegulationMode regulationMode, double bMin, double bMax, boolean connected, boolean mainComponent,\n                                    ValidationConfig config, Writer writer)", "testcase": false, "constructor": false}, {"identifier": "checkSVCs", "parameters": "(String id, double p, double q, double vControlled, double vController, double nominalVcontroller, double reactivePowerSetpoint, double voltageSetpoint,\n                                    RegulationMode regulationMode, double bMin, double bMax, boolean connected, boolean mainComponent,\n                                    ValidationConfig config, ValidationWriter svcsWriter)", "modifiers": "public", "return": "boolean", "signature": "boolean checkSVCs(String id, double p, double q, double vControlled, double vController, double nominalVcontroller, double reactivePowerSetpoint, double voltageSetpoint,\n                                    RegulationMode regulationMode, double bMin, double bMax, boolean connected, boolean mainComponent,\n                                    ValidationConfig config, ValidationWriter svcsWriter)", "full_signature": "public boolean checkSVCs(String id, double p, double q, double vControlled, double vController, double nominalVcontroller, double reactivePowerSetpoint, double voltageSetpoint,\n                                    RegulationMode regulationMode, double bMin, double bMax, boolean connected, boolean mainComponent,\n                                    ValidationConfig config, ValidationWriter svcsWriter)", "class_method_signature": "StaticVarCompensatorsValidation.checkSVCs(String id, double p, double q, double vControlled, double vController, double nominalVcontroller, double reactivePowerSetpoint, double voltageSetpoint,\n                                    RegulationMode regulationMode, double bMin, double bMax, boolean connected, boolean mainComponent,\n                                    ValidationConfig config, ValidationWriter svcsWriter)", "testcase": false, "constructor": false}, {"identifier": "checkSVCsNaNValues", "parameters": "(String id, double p, double q, double reactivePowerSetpoint)", "modifiers": "private static", "return": "boolean", "signature": "boolean checkSVCsNaNValues(String id, double p, double q, double reactivePowerSetpoint)", "full_signature": "private static boolean checkSVCsNaNValues(String id, double p, double q, double reactivePowerSetpoint)", "class_method_signature": "StaticVarCompensatorsValidation.checkSVCsNaNValues(String id, double p, double q, double reactivePowerSetpoint)", "testcase": false, "constructor": false}, {"identifier": "checkSVCsValues", "parameters": "(String id, double p, double q, double vControlled, double vController,\n        double nominalVcontroller, double reactivePowerSetpoint, double voltageSetpoint,\n        RegulationMode regulationMode, double bMin, double bMax, ValidationConfig config)", "modifiers": "private static", "return": "boolean", "signature": "boolean checkSVCsValues(String id, double p, double q, double vControlled, double vController,\n        double nominalVcontroller, double reactivePowerSetpoint, double voltageSetpoint,\n        RegulationMode regulationMode, double bMin, double bMax, ValidationConfig config)", "full_signature": "private static boolean checkSVCsValues(String id, double p, double q, double vControlled, double vController,\n        double nominalVcontroller, double reactivePowerSetpoint, double voltageSetpoint,\n        RegulationMode regulationMode, double bMin, double bMax, ValidationConfig config)", "class_method_signature": "StaticVarCompensatorsValidation.checkSVCsValues(String id, double p, double q, double vControlled, double vController,\n        double nominalVcontroller, double reactivePowerSetpoint, double voltageSetpoint,\n        RegulationMode regulationMode, double bMin, double bMax, ValidationConfig config)", "testcase": false, "constructor": false}, {"identifier": "reactivePowerRegulationModeKo", "parameters": "(RegulationMode regulationMode, double q, double qMin,\n        double qMax, double reactivePowerSetpoint, ValidationConfig config)", "modifiers": "private static", "return": "boolean", "signature": "boolean reactivePowerRegulationModeKo(RegulationMode regulationMode, double q, double qMin,\n        double qMax, double reactivePowerSetpoint, ValidationConfig config)", "full_signature": "private static boolean reactivePowerRegulationModeKo(RegulationMode regulationMode, double q, double qMin,\n        double qMax, double reactivePowerSetpoint, ValidationConfig config)", "class_method_signature": "StaticVarCompensatorsValidation.reactivePowerRegulationModeKo(RegulationMode regulationMode, double q, double qMin,\n        double qMax, double reactivePowerSetpoint, ValidationConfig config)", "testcase": false, "constructor": false}, {"identifier": "voltageRegulationModeKo", "parameters": "(RegulationMode regulationMode, double q, double qMin,\n        double qMax, double vControlled, double voltageSetpoint, ValidationConfig config)", "modifiers": "private static", "return": "boolean", "signature": "boolean voltageRegulationModeKo(RegulationMode regulationMode, double q, double qMin,\n        double qMax, double vControlled, double voltageSetpoint, ValidationConfig config)", "full_signature": "private static boolean voltageRegulationModeKo(RegulationMode regulationMode, double q, double qMin,\n        double qMax, double vControlled, double voltageSetpoint, ValidationConfig config)", "class_method_signature": "StaticVarCompensatorsValidation.voltageRegulationModeKo(RegulationMode regulationMode, double q, double qMin,\n        double qMax, double vControlled, double voltageSetpoint, ValidationConfig config)", "testcase": false, "constructor": false}, {"identifier": "offRegulationModeKo", "parameters": "(RegulationMode regulationMode, double q, ValidationConfig config)", "modifiers": "private static", "return": "boolean", "signature": "boolean offRegulationModeKo(RegulationMode regulationMode, double q, ValidationConfig config)", "full_signature": "private static boolean offRegulationModeKo(RegulationMode regulationMode, double q, ValidationConfig config)", "class_method_signature": "StaticVarCompensatorsValidation.offRegulationModeKo(RegulationMode regulationMode, double q, ValidationConfig config)", "testcase": false, "constructor": false}], "file": "loadflow/loadflow-validation/src/main/java/com/powsybl/loadflow/validation/StaticVarCompensatorsValidation.java"}, "focal_method": {"identifier": "checkSVCsValues", "parameters": "(String id, double p, double q, double vControlled, double vController,\n        double nominalVcontroller, double reactivePowerSetpoint, double voltageSetpoint,\n        RegulationMode regulationMode, double bMin, double bMax, ValidationConfig config)", "modifiers": "private static", "return": "boolean", "body": "private static boolean checkSVCsValues(String id, double p, double q, double vControlled, double vController,\n        double nominalVcontroller, double reactivePowerSetpoint, double voltageSetpoint,\n        RegulationMode regulationMode, double bMin, double bMax, ValidationConfig config) {\n        boolean validated = true;\n        // active power should be equal to 0\n        if (Math.abs(p) > config.getThreshold()) {\n            LOGGER.warn(\"{} {}: {}: P={}\", ValidationType.SVCS, ValidationUtils.VALIDATION_ERROR, id, p);\n            validated = false;\n        }\n\n        double vAux = vController;\n        if (vAux == 0 || Double.isNaN(vAux)) {\n            vAux = nominalVcontroller;\n        }\n        double qMin = -bMax * vAux * vAux;\n        double qMax = -bMin * vAux * vAux;\n\n        if (reactivePowerRegulationModeKo(regulationMode, q, qMin, qMax, reactivePowerSetpoint, config)) {\n            LOGGER.warn(\n                \"{} {}: {}: regulator mode={} - Q={} qMin={} qMax={} bMin={} bMax={} Vcontroller={} nominalV={} reactivePowerSetpoint={}\",\n                ValidationType.SVCS, ValidationUtils.VALIDATION_ERROR, id, regulationMode, q, qMin, qMax, bMin, bMax,\n                vController, nominalVcontroller, reactivePowerSetpoint);\n            validated = false;\n        }\n\n        if (voltageRegulationModeKo(regulationMode, q, qMin, qMax, vControlled, voltageSetpoint, config)) {\n            LOGGER.warn(\n                \"{} {}: {}: regulator mode={} - Q={} qMin={} qMax={} bMin={} bMax={} Vcontroller={} Vcontrolled={} targetV={}\",\n                ValidationType.SVCS, ValidationUtils.VALIDATION_ERROR, id, regulationMode, q, qMin, qMax, bMin, bMax,\n                vController, vControlled, voltageSetpoint);\n            validated = false;\n        }\n\n        if (offRegulationModeKo(regulationMode, q, config)) {\n            LOGGER.warn(\"{} {}: {}: regulator mode={} - Q={} \", ValidationType.SVCS, ValidationUtils.VALIDATION_ERROR,\n                id, regulationMode, q);\n            validated = false;\n        }\n        return validated;\n    }", "signature": "boolean checkSVCsValues(String id, double p, double q, double vControlled, double vController,\n        double nominalVcontroller, double reactivePowerSetpoint, double voltageSetpoint,\n        RegulationMode regulationMode, double bMin, double bMax, ValidationConfig config)", "full_signature": "private static boolean checkSVCsValues(String id, double p, double q, double vControlled, double vController,\n        double nominalVcontroller, double reactivePowerSetpoint, double voltageSetpoint,\n        RegulationMode regulationMode, double bMin, double bMax, ValidationConfig config)", "class_method_signature": "StaticVarCompensatorsValidation.checkSVCsValues(String id, double p, double q, double vControlled, double vController,\n        double nominalVcontroller, double reactivePowerSetpoint, double voltageSetpoint,\n        RegulationMode regulationMode, double bMin, double bMax, ValidationConfig config)", "testcase": false, "constructor": false, "invocations": ["abs", "getThreshold", "warn", "isNaN", "reactivePowerRegulationModeKo", "warn", "voltageRegulationModeKo", "warn", "offRegulationModeKo", "warn"]}, "repository": {"repo_id": 105284146, "url": "https://github.com/powsybl/powsybl-core", "stars": 53, "created": "9/29/2017 2:51:18 PM +00:00", "updates": "2020-01-27T10:39:13+00:00", "fork": "False", "license": "licensed"}}