{"test_class": {"identifier": "CoincidesFunctionTest", "superclass": "", "interfaces": "", "fields": [{"original_string": "private CoincidesFunction coincidesFunction;", "modifier": "private", "type": "CoincidesFunction", "declarator": "coincidesFunction", "var_name": "coincidesFunction"}], "file": "kie-dmn/kie-dmn-feel/src/test/java/org/kie/dmn/feel/runtime/functions/interval/CoincidesFunctionTest.java"}, "test_case": {"identifier": "invokeParamSingles", "parameters": "()", "modifiers": "@Test public", "return": "void", "body": "@Test\n    public void invokeParamSingles() {\n        FunctionTestUtil.assertResult( coincidesFunction.invoke( \"a\", \"b\" ), Boolean.FALSE );\n        FunctionTestUtil.assertResult( coincidesFunction.invoke( \"a\", \"a\" ), Boolean.TRUE );\n        FunctionTestUtil.assertResult( coincidesFunction.invoke( \"b\", \"a\" ), Boolean.FALSE );\n        FunctionTestUtil.assertResult( coincidesFunction.invoke( BigDecimal.valueOf(2), BigDecimal.valueOf(1) ), Boolean.FALSE );\n        FunctionTestUtil.assertResult( coincidesFunction.invoke( BigDecimal.valueOf(1), BigDecimal.valueOf(2) ), Boolean.FALSE );\n        FunctionTestUtil.assertResult( coincidesFunction.invoke( BigDecimal.valueOf(1), BigDecimal.valueOf(1) ), Boolean.TRUE );\n    }", "signature": "void invokeParamSingles()", "full_signature": "@Test public void invokeParamSingles()", "class_method_signature": "CoincidesFunctionTest.invokeParamSingles()", "testcase": true, "constructor": false, "invocations": ["assertResult", "invoke", "assertResult", "invoke", "assertResult", "invoke", "assertResult", "invoke", "valueOf", "valueOf", "assertResult", "invoke", "valueOf", "valueOf", "assertResult", "invoke", "valueOf", "valueOf"]}, "focal_class": {"identifier": "CoincidesFunction", "superclass": "extends BaseFEELFunction", "interfaces": "", "fields": [{"original_string": "public static final CoincidesFunction INSTANCE = new CoincidesFunction();", "modifier": "public static final", "type": "CoincidesFunction", "declarator": "INSTANCE = new CoincidesFunction()", "var_name": "INSTANCE"}], "methods": [{"identifier": "CoincidesFunction", "parameters": "()", "modifiers": "public", "return": "", "signature": " CoincidesFunction()", "full_signature": "public  CoincidesFunction()", "class_method_signature": "CoincidesFunction.CoincidesFunction()", "testcase": false, "constructor": true}, {"identifier": "invoke", "parameters": "(@ParameterName( \"value1\" ) Comparable value1, @ParameterName( \"value2\" ) Comparable value2)", "modifiers": "public", "return": "FEELFnResult<Boolean>", "signature": "FEELFnResult<Boolean> invoke(@ParameterName( \"value1\" ) Comparable value1, @ParameterName( \"value2\" ) Comparable value2)", "full_signature": "public FEELFnResult<Boolean> invoke(@ParameterName( \"value1\" ) Comparable value1, @ParameterName( \"value2\" ) Comparable value2)", "class_method_signature": "CoincidesFunction.invoke(@ParameterName( \"value1\" ) Comparable value1, @ParameterName( \"value2\" ) Comparable value2)", "testcase": false, "constructor": false}, {"identifier": "invoke", "parameters": "(@ParameterName( \"range1\" ) Range range1, @ParameterName( \"range2\" ) Range range2)", "modifiers": "public", "return": "FEELFnResult<Boolean>", "signature": "FEELFnResult<Boolean> invoke(@ParameterName( \"range1\" ) Range range1, @ParameterName( \"range2\" ) Range range2)", "full_signature": "public FEELFnResult<Boolean> invoke(@ParameterName( \"range1\" ) Range range1, @ParameterName( \"range2\" ) Range range2)", "class_method_signature": "CoincidesFunction.invoke(@ParameterName( \"range1\" ) Range range1, @ParameterName( \"range2\" ) Range range2)", "testcase": false, "constructor": false}], "file": "kie-dmn/kie-dmn-feel/src/main/java/org/kie/dmn/feel/runtime/functions/interval/CoincidesFunction.java"}, "focal_method": {"identifier": "invoke", "parameters": "(@ParameterName( \"value1\" ) Comparable value1, @ParameterName( \"value2\" ) Comparable value2)", "modifiers": "public", "return": "FEELFnResult<Boolean>", "body": "public FEELFnResult<Boolean> invoke(@ParameterName( \"value1\" ) Comparable value1, @ParameterName( \"value2\" ) Comparable value2) {\n        if ( value1 == null ) {\n            return FEELFnResult.ofError(new InvalidParametersEvent(Severity.ERROR, \"value1\", \"cannot be null\"));\n        }\n        if ( value2 == null ) {\n            return FEELFnResult.ofError(new InvalidParametersEvent(Severity.ERROR, \"value2\", \"cannot be null\"));\n        }\n        try {\n            boolean result = value1.compareTo( value2 ) == 0;\n            return FEELFnResult.ofResult( result );\n        } catch( Exception e ) {\n            // values are not comparable\n            return FEELFnResult.ofError(new InvalidParametersEvent(Severity.ERROR, \"value1\", \"cannot be compared to value2\"));\n        }\n    }", "signature": "FEELFnResult<Boolean> invoke(@ParameterName( \"value1\" ) Comparable value1, @ParameterName( \"value2\" ) Comparable value2)", "full_signature": "public FEELFnResult<Boolean> invoke(@ParameterName( \"value1\" ) Comparable value1, @ParameterName( \"value2\" ) Comparable value2)", "class_method_signature": "CoincidesFunction.invoke(@ParameterName( \"value1\" ) Comparable value1, @ParameterName( \"value2\" ) Comparable value2)", "testcase": false, "constructor": false, "invocations": ["ofError", "ofError", "compareTo", "ofResult", "ofError"]}, "repository": {"repo_id": 1381673, "url": "https://github.com/kiegroup/drools", "stars": 2733, "created": "2/18/2011 8:37:05 AM +00:00", "updates": "2020-01-27T13:12:15+00:00", "fork": "False", "license": "licensed"}}