{"test_class": {"identifier": "StartsFunctionTest", "superclass": "", "interfaces": "", "fields": [{"original_string": "private StartsFunction startsFunction;", "modifier": "private", "type": "StartsFunction", "declarator": "startsFunction", "var_name": "startsFunction"}], "file": "kie-dmn/kie-dmn-feel/src/test/java/org/kie/dmn/feel/runtime/functions/interval/StartsFunctionTest.java"}, "test_case": {"identifier": "invokeParamSingleAndRange", "parameters": "()", "modifiers": "@Test public", "return": "void", "body": "@Test\n    public void invokeParamSingleAndRange() {\n        FunctionTestUtil.assertResult( startsFunction.invoke( \"a\",\n                new RangeImpl( Range.RangeBoundary.CLOSED, \"a\", \"f\", Range.RangeBoundary.CLOSED )),\n                Boolean.TRUE );\n        FunctionTestUtil.assertResult( startsFunction.invoke( \"f\",\n                new RangeImpl( Range.RangeBoundary.CLOSED, \"a\", \"f\", Range.RangeBoundary.CLOSED )),\n                Boolean.FALSE );\n        FunctionTestUtil.assertResult( startsFunction.invoke( \"a\",\n                new RangeImpl( Range.RangeBoundary.OPEN, \"a\", \"f\", Range.RangeBoundary.CLOSED )),\n                Boolean.FALSE );\n        FunctionTestUtil.assertResult( startsFunction.invoke( \"a\",\n                new RangeImpl( Range.RangeBoundary.CLOSED, \"b\", \"f\", Range.RangeBoundary.CLOSED )),\n                Boolean.FALSE );\n    }", "signature": "void invokeParamSingleAndRange()", "full_signature": "@Test public void invokeParamSingleAndRange()", "class_method_signature": "StartsFunctionTest.invokeParamSingleAndRange()", "testcase": true, "constructor": false, "invocations": ["assertResult", "invoke", "assertResult", "invoke", "assertResult", "invoke", "assertResult", "invoke"]}, "focal_class": {"identifier": "StartsFunction", "superclass": "extends BaseFEELFunction", "interfaces": "", "fields": [{"original_string": "public static final StartsFunction INSTANCE = new StartsFunction();", "modifier": "public static final", "type": "StartsFunction", "declarator": "INSTANCE = new StartsFunction()", "var_name": "INSTANCE"}], "methods": [{"identifier": "StartsFunction", "parameters": "()", "modifiers": "public", "return": "", "signature": " StartsFunction()", "full_signature": "public  StartsFunction()", "class_method_signature": "StartsFunction.StartsFunction()", "testcase": false, "constructor": true}, {"identifier": "invoke", "parameters": "(@ParameterName( \"value\" ) Comparable value, @ParameterName( \"range\" ) Range range)", "modifiers": "public", "return": "FEELFnResult<Boolean>", "signature": "FEELFnResult<Boolean> invoke(@ParameterName( \"value\" ) Comparable value, @ParameterName( \"range\" ) Range range)", "full_signature": "public FEELFnResult<Boolean> invoke(@ParameterName( \"value\" ) Comparable value, @ParameterName( \"range\" ) Range range)", "class_method_signature": "StartsFunction.invoke(@ParameterName( \"value\" ) Comparable value, @ParameterName( \"range\" ) Range range)", "testcase": false, "constructor": false}, {"identifier": "invoke", "parameters": "(@ParameterName( \"range1\" ) Range range1, @ParameterName( \"range2\" ) Range range2)", "modifiers": "public", "return": "FEELFnResult<Boolean>", "signature": "FEELFnResult<Boolean> invoke(@ParameterName( \"range1\" ) Range range1, @ParameterName( \"range2\" ) Range range2)", "full_signature": "public FEELFnResult<Boolean> invoke(@ParameterName( \"range1\" ) Range range1, @ParameterName( \"range2\" ) Range range2)", "class_method_signature": "StartsFunction.invoke(@ParameterName( \"range1\" ) Range range1, @ParameterName( \"range2\" ) Range range2)", "testcase": false, "constructor": false}], "file": "kie-dmn/kie-dmn-feel/src/main/java/org/kie/dmn/feel/runtime/functions/interval/StartsFunction.java"}, "focal_method": {"identifier": "invoke", "parameters": "(@ParameterName( \"value\" ) Comparable value, @ParameterName( \"range\" ) Range range)", "modifiers": "public", "return": "FEELFnResult<Boolean>", "body": "public FEELFnResult<Boolean> invoke(@ParameterName( \"value\" ) Comparable value, @ParameterName( \"range\" ) Range range) {\n        if ( value == null ) {\n            return FEELFnResult.ofError(new InvalidParametersEvent(Severity.ERROR, \"value\", \"cannot be null\"));\n        }\n        if ( range == null ) {\n            return FEELFnResult.ofError(new InvalidParametersEvent(Severity.ERROR, \"range\", \"cannot be null\"));\n        }\n        try {\n            boolean result = ( range.getLowBoundary() == Range.RangeBoundary.CLOSED && value.compareTo( range.getLowEndPoint() ) == 0 );\n            return FEELFnResult.ofResult( result );\n        } catch( Exception e ) {\n            // values are not comparable\n            return FEELFnResult.ofError(new InvalidParametersEvent(Severity.ERROR, \"value\", \"cannot be compared to range\"));\n        }\n    }", "signature": "FEELFnResult<Boolean> invoke(@ParameterName( \"value\" ) Comparable value, @ParameterName( \"range\" ) Range range)", "full_signature": "public FEELFnResult<Boolean> invoke(@ParameterName( \"value\" ) Comparable value, @ParameterName( \"range\" ) Range range)", "class_method_signature": "StartsFunction.invoke(@ParameterName( \"value\" ) Comparable value, @ParameterName( \"range\" ) Range range)", "testcase": false, "constructor": false, "invocations": ["ofError", "ofError", "getLowBoundary", "compareTo", "getLowEndPoint", "ofResult", "ofError"]}, "repository": {"repo_id": 1381673, "url": "https://github.com/kiegroup/drools", "stars": 2733, "created": "2/18/2011 8:37:05 AM +00:00", "updates": "2020-01-27T13:12:15+00:00", "fork": "False", "license": "licensed"}}