{"test_class": {"identifier": "StartedByFunctionTest", "superclass": "", "interfaces": "", "fields": [{"original_string": "private StartedByFunction startedByFunction;", "modifier": "private", "type": "StartedByFunction", "declarator": "startedByFunction", "var_name": "startedByFunction"}], "file": "kie-dmn/kie-dmn-feel/src/test/java/org/kie/dmn/feel/runtime/functions/interval/StartedByFunctionTest.java"}, "test_case": {"identifier": "invokeParamRangeAndRange", "parameters": "()", "modifiers": "@Test public", "return": "void", "body": "@Test\n    public void invokeParamRangeAndRange() {\n        FunctionTestUtil.assertResult( startedByFunction.invoke(\n                new RangeImpl( Range.RangeBoundary.CLOSED, \"a\", \"f\", Range.RangeBoundary.CLOSED ),\n                new RangeImpl( Range.RangeBoundary.CLOSED, \"a\", \"f\", Range.RangeBoundary.CLOSED ) ),\n                Boolean.TRUE );\n        FunctionTestUtil.assertResult( startedByFunction.invoke(\n                new RangeImpl( Range.RangeBoundary.CLOSED, \"a\", \"k\", Range.RangeBoundary.CLOSED ),\n                new RangeImpl( Range.RangeBoundary.CLOSED, \"a\", \"f\", Range.RangeBoundary.CLOSED ) ),\n                Boolean.TRUE );\n        FunctionTestUtil.assertResult( startedByFunction.invoke(\n                new RangeImpl( Range.RangeBoundary.CLOSED, \"a\", \"f\", Range.RangeBoundary.CLOSED ),\n                new RangeImpl( Range.RangeBoundary.CLOSED, \"f\", \"k\", Range.RangeBoundary.CLOSED ) ),\n                Boolean.FALSE );\n        FunctionTestUtil.assertResult( startedByFunction.invoke(\n                new RangeImpl( Range.RangeBoundary.CLOSED, \"a\", \"k\", Range.RangeBoundary.CLOSED ),\n                new RangeImpl( Range.RangeBoundary.OPEN, \"a\", \"f\", Range.RangeBoundary.CLOSED ) ),\n                Boolean.FALSE );\n    }", "signature": "void invokeParamRangeAndRange()", "full_signature": "@Test public void invokeParamRangeAndRange()", "class_method_signature": "StartedByFunctionTest.invokeParamRangeAndRange()", "testcase": true, "constructor": false, "invocations": ["assertResult", "invoke", "assertResult", "invoke", "assertResult", "invoke", "assertResult", "invoke"]}, "focal_class": {"identifier": "StartedByFunction", "superclass": "extends BaseFEELFunction", "interfaces": "", "fields": [{"original_string": "public static final StartedByFunction INSTANCE = new StartedByFunction();", "modifier": "public static final", "type": "StartedByFunction", "declarator": "INSTANCE = new StartedByFunction()", "var_name": "INSTANCE"}], "methods": [{"identifier": "StartedByFunction", "parameters": "()", "modifiers": "public", "return": "", "signature": " StartedByFunction()", "full_signature": "public  StartedByFunction()", "class_method_signature": "StartedByFunction.StartedByFunction()", "testcase": false, "constructor": true}, {"identifier": "invoke", "parameters": "(@ParameterName( \"range\" ) Range range, @ParameterName( \"value\" ) Comparable value)", "modifiers": "public", "return": "FEELFnResult<Boolean>", "signature": "FEELFnResult<Boolean> invoke(@ParameterName( \"range\" ) Range range, @ParameterName( \"value\" ) Comparable value)", "full_signature": "public FEELFnResult<Boolean> invoke(@ParameterName( \"range\" ) Range range, @ParameterName( \"value\" ) Comparable value)", "class_method_signature": "StartedByFunction.invoke(@ParameterName( \"range\" ) Range range, @ParameterName( \"value\" ) Comparable value)", "testcase": false, "constructor": false}, {"identifier": "invoke", "parameters": "(@ParameterName( \"range1\" ) Range range1, @ParameterName( \"range2\" ) Range range2)", "modifiers": "public", "return": "FEELFnResult<Boolean>", "signature": "FEELFnResult<Boolean> invoke(@ParameterName( \"range1\" ) Range range1, @ParameterName( \"range2\" ) Range range2)", "full_signature": "public FEELFnResult<Boolean> invoke(@ParameterName( \"range1\" ) Range range1, @ParameterName( \"range2\" ) Range range2)", "class_method_signature": "StartedByFunction.invoke(@ParameterName( \"range1\" ) Range range1, @ParameterName( \"range2\" ) Range range2)", "testcase": false, "constructor": false}], "file": "kie-dmn/kie-dmn-feel/src/main/java/org/kie/dmn/feel/runtime/functions/interval/StartedByFunction.java"}, "focal_method": {"identifier": "invoke", "parameters": "(@ParameterName( \"range\" ) Range range, @ParameterName( \"value\" ) Comparable value)", "modifiers": "public", "return": "FEELFnResult<Boolean>", "body": "public FEELFnResult<Boolean> invoke(@ParameterName( \"range\" ) Range range, @ParameterName( \"value\" ) Comparable value) {\n        if ( value == null ) {\n            return FEELFnResult.ofError(new InvalidParametersEvent(Severity.ERROR, \"value\", \"cannot be null\"));\n        }\n        if ( range == null ) {\n            return FEELFnResult.ofError(new InvalidParametersEvent(Severity.ERROR, \"range\", \"cannot be null\"));\n        }\n        try {\n            boolean result = ( range.getLowBoundary() == Range.RangeBoundary.CLOSED && value.compareTo( range.getLowEndPoint() ) == 0 );\n            return FEELFnResult.ofResult( result );\n        } catch( Exception e ) {\n            // values are not comparable\n            return FEELFnResult.ofError(new InvalidParametersEvent(Severity.ERROR, \"value\", \"cannot be compared to range\"));\n        }\n    }", "signature": "FEELFnResult<Boolean> invoke(@ParameterName( \"range\" ) Range range, @ParameterName( \"value\" ) Comparable value)", "full_signature": "public FEELFnResult<Boolean> invoke(@ParameterName( \"range\" ) Range range, @ParameterName( \"value\" ) Comparable value)", "class_method_signature": "StartedByFunction.invoke(@ParameterName( \"range\" ) Range range, @ParameterName( \"value\" ) Comparable value)", "testcase": false, "constructor": false, "invocations": ["ofError", "ofError", "getLowBoundary", "compareTo", "getLowEndPoint", "ofResult", "ofError"]}, "repository": {"repo_id": 1381673, "url": "https://github.com/kiegroup/drools", "stars": 2733, "created": "2/18/2011 8:37:05 AM +00:00", "updates": "2020-01-27T13:12:15+00:00", "fork": "False", "license": "licensed"}}