{"test_class": {"identifier": "KiePMMLDroolsModelFactoryUtilsTest", "superclass": "", "interfaces": "", "fields": [{"original_string": "private static final String TEMPLATE_SOURCE = \"Template.tmpl\";", "modifier": "private static final", "type": "String", "declarator": "TEMPLATE_SOURCE = \"Template.tmpl\"", "var_name": "TEMPLATE_SOURCE"}, {"original_string": "private static final String TEMPLATE_CLASS_NAME = \"Template\";", "modifier": "private static final", "type": "String", "declarator": "TEMPLATE_CLASS_NAME = \"Template\"", "var_name": "TEMPLATE_CLASS_NAME"}, {"original_string": "private static CompilationUnit COMPILATION_UNIT;", "modifier": "private static", "type": "CompilationUnit", "declarator": "COMPILATION_UNIT", "var_name": "COMPILATION_UNIT"}, {"original_string": "private static ClassOrInterfaceDeclaration MODEL_TEMPLATE;", "modifier": "private static", "type": "ClassOrInterfaceDeclaration", "declarator": "MODEL_TEMPLATE", "var_name": "MODEL_TEMPLATE"}], "file": "kie-pmml-trusty/kie-pmml-models/kie-pmml-models-drools/kie-pmml-models-drools-common/src/test/java/org/kie/pmml/models/drools/utils/KiePMMLDroolsModelFactoryUtilsTest.java"}, "test_case": {"identifier": "addFieldTypeMapPopulation", "parameters": "()", "modifiers": "@Test public", "return": "void", "body": "@Test\n    public void addFieldTypeMapPopulation() {\n        BlockStmt blockStmt = new BlockStmt();\n        Map<String, KiePMMLOriginalTypeGeneratedType> fieldTypeMap = new HashMap<>();\n        IntStream.range(0, 3).forEach(index -> {\n            String key = \"KEY-\" + index;\n            KiePMMLOriginalTypeGeneratedType value = new KiePMMLOriginalTypeGeneratedType(\"ORIGINALTYPE-\" + index,\n                                                                                          \"GENERATEDTYPE-\" + index);\n            fieldTypeMap.put(key, value);\n        });\n        KiePMMLDroolsModelFactoryUtils.addFieldTypeMapPopulation(blockStmt, fieldTypeMap);\n        commonEvaluateFieldTypeMap(blockStmt, fieldTypeMap, fieldTypeMap.size());\n    }", "signature": "void addFieldTypeMapPopulation()", "full_signature": "@Test public void addFieldTypeMapPopulation()", "class_method_signature": "KiePMMLDroolsModelFactoryUtilsTest.addFieldTypeMapPopulation()", "testcase": true, "constructor": false, "invocations": ["forEach", "range", "put", "addFieldTypeMapPopulation", "commonEvaluateFieldTypeMap", "size"]}, "focal_class": {"identifier": "KiePMMLDroolsModelFactoryUtils", "superclass": "", "interfaces": "", "fields": [{"original_string": "private static final Logger logger = LoggerFactory.getLogger(KiePMMLDroolsModelFactoryUtils.class.getName());", "modifier": "private static final", "type": "Logger", "declarator": "logger = LoggerFactory.getLogger(KiePMMLDroolsModelFactoryUtils.class.getName())", "var_name": "logger"}, {"original_string": "static final String GETKMODULEPACKAGENAME_METHOD = \"getKModulePackageName\";", "modifier": "static final", "type": "String", "declarator": "GETKMODULEPACKAGENAME_METHOD = \"getKModulePackageName\"", "var_name": "GETKMODULEPACKAGENAME_METHOD"}], "methods": [{"identifier": "KiePMMLDroolsModelFactoryUtils", "parameters": "()", "modifiers": "private", "return": "", "signature": " KiePMMLDroolsModelFactoryUtils()", "full_signature": "private  KiePMMLDroolsModelFactoryUtils()", "class_method_signature": "KiePMMLDroolsModelFactoryUtils.KiePMMLDroolsModelFactoryUtils()", "testcase": false, "constructor": true}, {"identifier": "getKiePMMLModelCompilationUnit", "parameters": "(final DataDictionary dataDictionary,\n                                                                 final Model model,\n                                                                 final Map<String, KiePMMLOriginalTypeGeneratedType> fieldTypeMap,\n                                                                 final String packageName,\n                                                                 final String javaTemplate,\n                                                                 final String modelClassName)", "modifiers": "public static", "return": "CompilationUnit", "signature": "CompilationUnit getKiePMMLModelCompilationUnit(final DataDictionary dataDictionary,\n                                                                 final Model model,\n                                                                 final Map<String, KiePMMLOriginalTypeGeneratedType> fieldTypeMap,\n                                                                 final String packageName,\n                                                                 final String javaTemplate,\n                                                                 final String modelClassName)", "full_signature": "public static CompilationUnit getKiePMMLModelCompilationUnit(final DataDictionary dataDictionary,\n                                                                 final Model model,\n                                                                 final Map<String, KiePMMLOriginalTypeGeneratedType> fieldTypeMap,\n                                                                 final String packageName,\n                                                                 final String javaTemplate,\n                                                                 final String modelClassName)", "class_method_signature": "KiePMMLDroolsModelFactoryUtils.getKiePMMLModelCompilationUnit(final DataDictionary dataDictionary,\n                                                                 final Model model,\n                                                                 final Map<String, KiePMMLOriginalTypeGeneratedType> fieldTypeMap,\n                                                                 final String packageName,\n                                                                 final String javaTemplate,\n                                                                 final String modelClassName)", "testcase": false, "constructor": false}, {"identifier": "setConstructor", "parameters": "(final Model model,\n                               final ConstructorDeclaration constructorDeclaration,\n                               final SimpleName tableName,\n                               final String targetField,\n                               final MINING_FUNCTION miningFunction)", "modifiers": "static", "return": "void", "signature": "void setConstructor(final Model model,\n                               final ConstructorDeclaration constructorDeclaration,\n                               final SimpleName tableName,\n                               final String targetField,\n                               final MINING_FUNCTION miningFunction)", "full_signature": "static void setConstructor(final Model model,\n                               final ConstructorDeclaration constructorDeclaration,\n                               final SimpleName tableName,\n                               final String targetField,\n                               final MINING_FUNCTION miningFunction)", "class_method_signature": "KiePMMLDroolsModelFactoryUtils.setConstructor(final Model model,\n                               final ConstructorDeclaration constructorDeclaration,\n                               final SimpleName tableName,\n                               final String targetField,\n                               final MINING_FUNCTION miningFunction)", "testcase": false, "constructor": false}, {"identifier": "addFieldTypeMapPopulation", "parameters": "(BlockStmt body, Map<String, KiePMMLOriginalTypeGeneratedType> fieldTypeMap)", "modifiers": "static", "return": "void", "signature": "void addFieldTypeMapPopulation(BlockStmt body, Map<String, KiePMMLOriginalTypeGeneratedType> fieldTypeMap)", "full_signature": "static void addFieldTypeMapPopulation(BlockStmt body, Map<String, KiePMMLOriginalTypeGeneratedType> fieldTypeMap)", "class_method_signature": "KiePMMLDroolsModelFactoryUtils.addFieldTypeMapPopulation(BlockStmt body, Map<String, KiePMMLOriginalTypeGeneratedType> fieldTypeMap)", "testcase": false, "constructor": false}, {"identifier": "populateGetKModulePackageName", "parameters": "(final MethodDeclaration getKModulePackageNameMethod, final String packageName)", "modifiers": "static", "return": "void", "signature": "void populateGetKModulePackageName(final MethodDeclaration getKModulePackageNameMethod, final String packageName)", "full_signature": "static void populateGetKModulePackageName(final MethodDeclaration getKModulePackageNameMethod, final String packageName)", "class_method_signature": "KiePMMLDroolsModelFactoryUtils.populateGetKModulePackageName(final MethodDeclaration getKModulePackageNameMethod, final String packageName)", "testcase": false, "constructor": false}], "file": "kie-pmml-trusty/kie-pmml-models/kie-pmml-models-drools/kie-pmml-models-drools-common/src/main/java/org/kie/pmml/models/drools/utils/KiePMMLDroolsModelFactoryUtils.java"}, "focal_method": {"identifier": "addFieldTypeMapPopulation", "parameters": "(BlockStmt body, Map<String, KiePMMLOriginalTypeGeneratedType> fieldTypeMap)", "modifiers": "static", "return": "void", "body": "static void addFieldTypeMapPopulation(BlockStmt body, Map<String, KiePMMLOriginalTypeGeneratedType> fieldTypeMap) {\n        for (Map.Entry<String, KiePMMLOriginalTypeGeneratedType> entry : fieldTypeMap.entrySet()) {\n            KiePMMLOriginalTypeGeneratedType kiePMMLOriginalTypeGeneratedType = entry.getValue();\n            NodeList<Expression> expressions = NodeList.nodeList(new StringLiteralExpr(kiePMMLOriginalTypeGeneratedType.getOriginalType()), new StringLiteralExpr(kiePMMLOriginalTypeGeneratedType.getGeneratedType()));\n            ObjectCreationExpr objectCreationExpr = new ObjectCreationExpr();\n            objectCreationExpr.setType(KiePMMLOriginalTypeGeneratedType.class.getName());\n            objectCreationExpr.setArguments(expressions);\n            expressions = NodeList.nodeList(new StringLiteralExpr(entry.getKey()), objectCreationExpr);\n            body.addStatement(new MethodCallExpr(new NameExpr(\"fieldTypeMap\"), \"put\", expressions));\n        }\n    }", "signature": "void addFieldTypeMapPopulation(BlockStmt body, Map<String, KiePMMLOriginalTypeGeneratedType> fieldTypeMap)", "full_signature": "static void addFieldTypeMapPopulation(BlockStmt body, Map<String, KiePMMLOriginalTypeGeneratedType> fieldTypeMap)", "class_method_signature": "KiePMMLDroolsModelFactoryUtils.addFieldTypeMapPopulation(BlockStmt body, Map<String, KiePMMLOriginalTypeGeneratedType> fieldTypeMap)", "testcase": false, "constructor": false, "invocations": ["entrySet", "getValue", "nodeList", "getOriginalType", "getGeneratedType", "setType", "getName", "setArguments", "nodeList", "getKey", "addStatement"]}, "repository": {"repo_id": 1381673, "url": "https://github.com/kiegroup/drools", "stars": 2733, "created": "2/18/2011 8:37:05 AM +00:00", "updates": "2020-01-27T13:12:15+00:00", "fork": "False", "license": "licensed"}}