{"test_class": {"identifier": "OpenLRProtoDecoderTest", "superclass": "", "interfaces": "", "fields": [{"original_string": "OpenLRProtoDecoder decoder = new OpenLRProtoDecoder();", "modifier": "", "type": "OpenLRProtoDecoder", "declarator": "decoder = new OpenLRProtoDecoder()", "var_name": "decoder"}], "file": "proto/src/test/java/openlr/proto/OpenLRProtoDecoderTest.java"}, "test_case": {"identifier": "testLineLocationReference", "parameters": "()", "modifiers": "@Test public", "return": "void", "body": "@Test\n    public void testLineLocationReference() throws PhysicalFormatException {\n        Coordinates firstCoordinates = Coordinates.newBuilder()\n                .setLongitude(1)\n                .setLatitude(2)\n                .build();\n\n        LineAttributes firstLineAttributes = LineAttributes.newBuilder()\n                .setBearing(90)\n                .setFrc(FRC.FRC_0)\n                .setFow(FOW.FOW_MOTORWAY)\n                .build();\n\n        PathAttributes firstPathAttributes = PathAttributes.newBuilder()\n                .setDistanceToNext(100)\n                .setLowestFrcAlongPath(FRC.FRC_1)\n                .build();\n\n        LocationReferencePoint first = LocationReferencePoint.newBuilder()\n                .setCoordinates(firstCoordinates)\n                .setLineAttributes(firstLineAttributes)\n                .setPathAttributes(firstPathAttributes)\n                .build();\n\n        Coordinates lastCoordinates = Coordinates.newBuilder()\n                .setLongitude(3)\n                .setLatitude(4)\n                .build();\n\n        LineAttributes lastLineAttributes = LineAttributes.newBuilder()\n                .setBearing(270)\n                .setFrc(FRC.FRC_1)\n                .setFow(FOW.FOW_MULTIPLE_CARRIAGEWAY)\n                .build();\n\n        LocationReferencePoint last = LocationReferencePoint.newBuilder()\n                .setCoordinates(lastCoordinates)\n                .setLineAttributes(lastLineAttributes)\n                .build();\n\n        LineLocationReference lineLocationReference = LineLocationReference.newBuilder()\n                .addLocationReferencePoints(first)\n                .addLocationReferencePoints(last)\n                .setPositiveOffset(1)\n                .setNegativeOffset(2)\n                .build();\n\n        LocationReferenceData locationReferenceData = LocationReferenceData.newBuilder()\n                .setLineLocationReference(lineLocationReference)\n                .build();\n\n        LocationReference locationReference = new LocationReferenceProtoImpl(\"1\", LocationType.LINE_LOCATION, locationReferenceData);\n\n        RawLocationReference rawLocationReference = decoder.decodeData(locationReference);\n\n        assertNotNull(rawLocationReference);\n        assertEquals(rawLocationReference.getID(), \"1\");\n        assertEquals(rawLocationReference.getLocationType(), LocationType.LINE_LOCATION);\n        assertTrue(rawLocationReference.isValid());\n    }", "signature": "void testLineLocationReference()", "full_signature": "@Test public void testLineLocationReference()", "class_method_signature": "OpenLRProtoDecoderTest.testLineLocationReference()", "testcase": true, "constructor": false, "invocations": ["build", "setLatitude", "setLongitude", "newBuilder", "build", "setFow", "setFrc", "setBearing", "newBuilder", "build", "setLowestFrcAlongPath", "setDistanceToNext", "newBuilder", "build", "setPathAttributes", "setLineAttributes", "setCoordinates", "newBuilder", "build", "setLatitude", "setLongitude", "newBuilder", "build", "setFow", "setFrc", "setBearing", "newBuilder", "build", "setLineAttributes", "setCoordinates", "newBuilder", "build", "setNegativeOffset", "setPositiveOffset", "addLocationReferencePoints", "addLocationReferencePoints", "newBuilder", "build", "setLineLocationReference", "newBuilder", "decodeData", "assertNotNull", "assertEquals", "getID", "assertEquals", "getLocationType", "assertTrue", "isValid"]}, "focal_class": {"identifier": "OpenLRProtoDecoder", "superclass": "", "interfaces": "implements PhysicalDecoder", "fields": [{"original_string": "private final LocationTypeDecoderRegistry locationTypeDecoderRegistry = LocationTypeDecoderRegistry.create();", "modifier": "private final", "type": "LocationTypeDecoderRegistry", "declarator": "locationTypeDecoderRegistry = LocationTypeDecoderRegistry.create()", "var_name": "locationTypeDecoderRegistry"}], "methods": [{"identifier": "getDataClass", "parameters": "()", "modifiers": "@Override public", "return": "Class<?>", "signature": "Class<?> getDataClass()", "full_signature": "@Override public Class<?> getDataClass()", "class_method_signature": "OpenLRProtoDecoder.getDataClass()", "testcase": false, "constructor": false}, {"identifier": "decodeData", "parameters": "(LocationReference data)", "modifiers": "@Override public", "return": "RawLocationReference", "signature": "RawLocationReference decodeData(LocationReference data)", "full_signature": "@Override public RawLocationReference decodeData(LocationReference data)", "class_method_signature": "OpenLRProtoDecoder.decodeData(LocationReference data)", "testcase": false, "constructor": false}, {"identifier": "getDataFormatIdentifier", "parameters": "()", "modifiers": "@Override public", "return": "String", "signature": "String getDataFormatIdentifier()", "full_signature": "@Override public String getDataFormatIdentifier()", "class_method_signature": "OpenLRProtoDecoder.getDataFormatIdentifier()", "testcase": false, "constructor": false}], "file": "proto/src/main/java/openlr/proto/OpenLRProtoDecoder.java"}, "focal_method": {"identifier": "decodeData", "parameters": "(LocationReference data)", "modifiers": "@Override public", "return": "RawLocationReference", "body": "@Override\n    public RawLocationReference decodeData(LocationReference data) throws PhysicalFormatException {\n        LocationType locationType = data.getLocationType();\n        LocationReferenceDecoder locationReferenceDecoder = locationTypeDecoderRegistry.getDecoder(locationType);\n\n        if (locationReferenceDecoder == null) {\n            throw new OpenLRProtoException(OpenLRProtoStatusCode.UNSUPPORTED_LOCATION_TYPE);\n        }\n\n        Object locationReferenceData = data.getLocationReferenceData();\n\n        if (!(locationReferenceData instanceof LocationReferenceData)) {\n            throw new OpenLRProtoException(OpenLRProtoStatusCode.INVALID_DATA_TYPE);\n        }\n\n        return locationReferenceDecoder.decode(data.getID(), (LocationReferenceData) locationReferenceData);\n    }", "signature": "RawLocationReference decodeData(LocationReference data)", "full_signature": "@Override public RawLocationReference decodeData(LocationReference data)", "class_method_signature": "OpenLRProtoDecoder.decodeData(LocationReference data)", "testcase": false, "constructor": false, "invocations": ["getLocationType", "getDecoder", "getLocationReferenceData", "decode", "getID"]}, "repository": {"repo_id": 187195345, "url": "https://github.com/tomtom-international/openlr", "language": "Java", "is_fork": false, "fork_count": 6, "stargazer_count": 24, "size": 4809, "license": "licensed"}}