{"test_class": {"identifier": "FruIdGeneratorUtilTest", "superclass": "", "interfaces": "", "fields": [{"original_string": "private static Logger logger = Logger.getLogger( FruIdGeneratorUtilTest.class );", "modifier": "private static", "type": "Logger", "declarator": "logger = Logger.getLogger( FruIdGeneratorUtilTest.class )", "var_name": "logger"}], "file": "modules/hms-util/src/test/java/com/vmware/vrack/hms/common/util/FruIdGeneratorUtilTest.java"}, "test_case": {"identifier": "serverFruIDGeneration", "parameters": "()", "modifiers": "@Test public", "return": "void", "body": "@Test\n    public void serverFruIDGeneration()\n    {\n\n        logger.info( \"Testing hmsutil FruIdGeneratorUtilTest\" );\n\n        ComponentIdentifier componentIdentifier = new ComponentIdentifier();\n\n        try\n        {\n            componentIdentifier.setManufacturer( \"DELL\" );\n            componentIdentifier.setProduct( \"PowerEdge R630\" );\n            componentIdentifier.setPartNumber( \"0CNCJWX36\" );\n            componentIdentifier.setSerialNumber( \"CN747514550128\" );\n            String location = \"2U\";\n\n            String fruID = FruIdGeneratorUtil.generateFruIdHashCode( componentIdentifier, location );\n            assertNotNull( fruID );\n        }\n        catch ( Exception e )\n        {\n            logger.info( \"Test hmsutil FruIdGeneratorUtilTest Failed\" );\n            e.printStackTrace();\n        }\n    }", "signature": "void serverFruIDGeneration()", "full_signature": "@Test public void serverFruIDGeneration()", "class_method_signature": "FruIdGeneratorUtilTest.serverFruIDGeneration()", "testcase": true, "constructor": false, "invocations": ["info", "setManufacturer", "setProduct", "setPartNumber", "setSerialNumber", "generateFruIdHashCode", "assertNotNull", "info", "printStackTrace"]}, "focal_class": {"identifier": "FruIdGeneratorUtil", "superclass": "", "interfaces": "", "fields": [{"original_string": "private static Logger logger = LoggerFactory.getLogger( FruIdGeneratorUtil.class );", "modifier": "private static", "type": "Logger", "declarator": "logger = LoggerFactory.getLogger( FruIdGeneratorUtil.class )", "var_name": "logger"}], "methods": [{"identifier": "generateFruIdHashCode", "parameters": "( ComponentIdentifier componentIdentifier, String location )", "modifiers": "public static", "return": "String", "signature": "String generateFruIdHashCode( ComponentIdentifier componentIdentifier, String location )", "full_signature": "public static String generateFruIdHashCode( ComponentIdentifier componentIdentifier, String location )", "class_method_signature": "FruIdGeneratorUtil.generateFruIdHashCode( ComponentIdentifier componentIdentifier, String location )", "testcase": false, "constructor": false}, {"identifier": "generateFruIdHashCodeServerComponent", "parameters": "( String fruId, String serverFruId )", "modifiers": "public static", "return": "String", "signature": "String generateFruIdHashCodeServerComponent( String fruId, String serverFruId )", "full_signature": "public static String generateFruIdHashCodeServerComponent( String fruId, String serverFruId )", "class_method_signature": "FruIdGeneratorUtil.generateFruIdHashCodeServerComponent( String fruId, String serverFruId )", "testcase": false, "constructor": false}, {"identifier": "generateFruIdHashCodeServerComponent", "parameters": "( String fruId, String serverFruId,\n                                                               String uniqueFruProperty )", "modifiers": "public static", "return": "String", "signature": "String generateFruIdHashCodeServerComponent( String fruId, String serverFruId,\n                                                               String uniqueFruProperty )", "full_signature": "public static String generateFruIdHashCodeServerComponent( String fruId, String serverFruId,\n                                                               String uniqueFruProperty )", "class_method_signature": "FruIdGeneratorUtil.generateFruIdHashCodeServerComponent( String fruId, String serverFruId,\n                                                               String uniqueFruProperty )", "testcase": false, "constructor": false}], "file": "modules/hms-util/src/main/java/com/vmware/vrack/hms/common/util/FruIdGeneratorUtil.java"}, "focal_method": {"identifier": "generateFruIdHashCode", "parameters": "( ComponentIdentifier componentIdentifier, String location )", "modifiers": "public static", "return": "String", "body": "public static String generateFruIdHashCode( ComponentIdentifier componentIdentifier, String location )\n    {\n        String hash = \"0\";\n\n        try\n        {\n            if ( componentIdentifier != null )\n            {\n                if ( componentIdentifier.getManufacturer() != null )\n                {\n                    hash = String.valueOf( componentIdentifier.getManufacturer().hashCode() );\n                }\n                if ( componentIdentifier.getProduct() != null )\n                {\n                    hash = hash.concat( String.valueOf( componentIdentifier.getProduct().hashCode() ) );\n                }\n                if ( componentIdentifier.getPartNumber() != null )\n                {\n                    hash = hash.concat( String.valueOf( componentIdentifier.getPartNumber().hashCode() ) );\n                }\n                if ( componentIdentifier.getSerialNumber() != null )\n                {\n                    hash = hash.concat( String.valueOf( componentIdentifier.getSerialNumber().hashCode() ) );\n                }\n            }\n            if ( location != null )\n            {\n                hash = hash.concat( String.valueOf( location.hashCode() ) );\n            }\n            return String.valueOf( hash.hashCode() );\n        }\n        catch ( Exception e )\n        {\n            logger.error( \" Error while generating the FRU ID {} \", componentIdentifier, location, e );\n        }\n        return hash;\n    }", "signature": "String generateFruIdHashCode( ComponentIdentifier componentIdentifier, String location )", "full_signature": "public static String generateFruIdHashCode( ComponentIdentifier componentIdentifier, String location )", "class_method_signature": "FruIdGeneratorUtil.generateFruIdHashCode( ComponentIdentifier componentIdentifier, String location )", "testcase": false, "constructor": false, "invocations": ["getManufacturer", "valueOf", "hashCode", "getManufacturer", "getProduct", "concat", "valueOf", "hashCode", "getProduct", "getPartNumber", "concat", "valueOf", "hashCode", "getPartNumber", "getSerialNumber", "concat", "valueOf", "hashCode", "getSerialNumber", "concat", "valueOf", "hashCode", "valueOf", "hashCode", "error"]}, "repository": {"repo_id": 61566208, "url": "https://github.com/vmware-archive/OHMS", "language": "Java", "is_fork": false, "fork_count": 6, "stargazer_count": 14, "size": 16092, "license": "licensed"}}