{"test_class": {"identifier": "FlacAudioFileReaderTest", "superclass": "", "interfaces": "", "fields": [], "file": "jflac-codec/src/test/java/org/jflac/sound/spi/FlacAudioFileReaderTest.java"}, "test_case": {"identifier": "testGetAudioFileFormatWithUnsupportedFile", "parameters": "()", "modifiers": "@Test public", "return": "void", "body": "@Test\n    public void testGetAudioFileFormatWithUnsupportedFile() throws IOException {\n        final FlacAudioFileReader flacAudioFileReader = new FlacAudioFileReader();\n        final File file = File.createTempFile(\"flacTest\", \".wav\");\n        final OutputStream out = new FileOutputStream(file);\n        out.write(new byte[2048]);\n        out.close();\n        try {\n            flacAudioFileReader.getAudioInputStream(file);\n            fail(\"Expected UnsupportedAudioFileException\");\n        } catch (UnsupportedAudioFileException e) {\n            // expected this\n        } finally {\n            file.delete();\n        }\n    }", "signature": "void testGetAudioFileFormatWithUnsupportedFile()", "full_signature": "@Test public void testGetAudioFileFormatWithUnsupportedFile()", "class_method_signature": "FlacAudioFileReaderTest.testGetAudioFileFormatWithUnsupportedFile()", "testcase": true, "constructor": false, "invocations": ["createTempFile", "write", "close", "getAudioInputStream", "fail", "delete"]}, "focal_class": {"identifier": "FlacAudioFileReader", "superclass": "extends AudioFileReader", "interfaces": "", "fields": [{"original_string": "private static final boolean DEBUG = false;", "modifier": "private static final", "type": "boolean", "declarator": "DEBUG = false", "var_name": "DEBUG"}, {"original_string": "public static final String KEY_DURATION = \"duration\";", "modifier": "public static final", "type": "String", "declarator": "KEY_DURATION = \"duration\"", "var_name": "KEY_DURATION"}, {"original_string": "private FLACDecoder decoder;", "modifier": "private", "type": "FLACDecoder", "declarator": "decoder", "var_name": "decoder"}, {"original_string": "private StreamInfo streamInfo;", "modifier": "private", "type": "StreamInfo", "declarator": "streamInfo", "var_name": "streamInfo"}], "methods": [{"identifier": "getAudioFileFormat", "parameters": "(File file)", "modifiers": "public", "return": "AudioFileFormat", "signature": "AudioFileFormat getAudioFileFormat(File file)", "full_signature": "public AudioFileFormat getAudioFileFormat(File file)", "class_method_signature": "FlacAudioFileReader.getAudioFileFormat(File file)", "testcase": false, "constructor": false}, {"identifier": "getAudioFileFormat", "parameters": "(URL url)", "modifiers": "public", "return": "AudioFileFormat", "signature": "AudioFileFormat getAudioFileFormat(URL url)", "full_signature": "public AudioFileFormat getAudioFileFormat(URL url)", "class_method_signature": "FlacAudioFileReader.getAudioFileFormat(URL url)", "testcase": false, "constructor": false}, {"identifier": "getAudioFileFormat", "parameters": "(InputStream stream)", "modifiers": "public", "return": "AudioFileFormat", "signature": "AudioFileFormat getAudioFileFormat(InputStream stream)", "full_signature": "public AudioFileFormat getAudioFileFormat(InputStream stream)", "class_method_signature": "FlacAudioFileReader.getAudioFileFormat(InputStream stream)", "testcase": false, "constructor": false}, {"identifier": "getAudioFileFormat", "parameters": "(InputStream bitStream, int mediaLength)", "modifiers": "protected", "return": "AudioFileFormat", "signature": "AudioFileFormat getAudioFileFormat(InputStream bitStream, int mediaLength)", "full_signature": "protected AudioFileFormat getAudioFileFormat(InputStream bitStream, int mediaLength)", "class_method_signature": "FlacAudioFileReader.getAudioFileFormat(InputStream bitStream, int mediaLength)", "testcase": false, "constructor": false}, {"identifier": "getAudioInputStream", "parameters": "(File file)", "modifiers": "public", "return": "AudioInputStream", "signature": "AudioInputStream getAudioInputStream(File file)", "full_signature": "public AudioInputStream getAudioInputStream(File file)", "class_method_signature": "FlacAudioFileReader.getAudioInputStream(File file)", "testcase": false, "constructor": false}, {"identifier": "getAudioInputStream", "parameters": "(URL url)", "modifiers": "public", "return": "AudioInputStream", "signature": "AudioInputStream getAudioInputStream(URL url)", "full_signature": "public AudioInputStream getAudioInputStream(URL url)", "class_method_signature": "FlacAudioFileReader.getAudioInputStream(URL url)", "testcase": false, "constructor": false}, {"identifier": "getAudioInputStream", "parameters": "(final InputStream stream)", "modifiers": "public", "return": "AudioInputStream", "signature": "AudioInputStream getAudioInputStream(final InputStream stream)", "full_signature": "public AudioInputStream getAudioInputStream(final InputStream stream)", "class_method_signature": "FlacAudioFileReader.getAudioInputStream(final InputStream stream)", "testcase": false, "constructor": false}, {"identifier": "getAudioInputStream", "parameters": "(InputStream inputStream, int medialength)", "modifiers": "protected", "return": "AudioInputStream", "signature": "AudioInputStream getAudioInputStream(InputStream inputStream, int medialength)", "full_signature": "protected AudioInputStream getAudioInputStream(InputStream inputStream, int medialength)", "class_method_signature": "FlacAudioFileReader.getAudioInputStream(InputStream inputStream, int medialength)", "testcase": false, "constructor": false}], "file": "jflac-codec/src/main/java/org/jflac/sound/spi/FlacAudioFileReader.java"}, "focal_method": {"identifier": "getAudioInputStream", "parameters": "(File file)", "modifiers": "public", "return": "AudioInputStream", "body": "public AudioInputStream getAudioInputStream(File file) throws UnsupportedAudioFileException, IOException {\n        InputStream inputStream = new FileInputStream(file);\n        try {\n            return getAudioInputStream(inputStream, (int) file.length());\n        } catch (UnsupportedAudioFileException e) {\n            try {\n                inputStream.close();\n            } catch (IOException e1) {\n                e1.printStackTrace();\n            }\n            throw e;\n        } catch (IOException e) {\n            try {\n                inputStream.close();\n            } catch (IOException e1) {\n                e1.printStackTrace();\n            }\n            throw e;\n        }\n    }", "signature": "AudioInputStream getAudioInputStream(File file)", "full_signature": "public AudioInputStream getAudioInputStream(File file)", "class_method_signature": "FlacAudioFileReader.getAudioInputStream(File file)", "testcase": false, "constructor": false, "invocations": ["getAudioInputStream", "length", "close", "printStackTrace", "close", "printStackTrace"]}, "repository": {"repo_id": 2017533, "url": "https://github.com/nguillaumin/jflac", "language": "Java", "is_fork": false, "fork_count": 11, "stargazer_count": 18, "size": 14787, "license": "licensed"}}