{"test_class": {"identifier": "CaseSearchPresenterTest", "superclass": "", "interfaces": "", "fields": [{"original_string": "@Mock\n    CaseService caseService;", "modifier": "@Mock", "type": "CaseService", "declarator": "caseService", "var_name": "caseService"}, {"original_string": "@InjectMocks\n    CaseSearchPresenter caseSearchPresenter;", "modifier": "@InjectMocks", "type": "CaseSearchPresenter", "declarator": "caseSearchPresenter", "var_name": "caseSearchPresenter"}], "file": "app/src/test/java/org/unicef/rapidreg/childcase/casesearch/CaseSearchPresenterTest.java"}, "test_case": {"identifier": "should_get_CP_search_result", "parameters": "()", "modifiers": "@Test public", "return": "void", "body": "@Test\n    public void should_get_CP_search_result() throws Exception {\n        List<Long> list = new ArrayList<>();\n        Map<String, String> searchCondition = mock(Map.class);\n        User user = new User();\n        user.setRole(User.ROLE_CP);\n\n        when(PrimeroAppConfiguration.getCurrentUser()).thenReturn(user);\n        when(searchCondition.get(anyString())).thenReturn(\"0\");\n        when(caseService.getCPSearchResult(anyString(),anyString(),anyInt(),anyInt(),anyString(),any()))\n                .thenReturn(list);\n\n        assertThat(\"Should return CP search list\", caseSearchPresenter.getSearchResult(searchCondition),\n                is(list));\n        verify(caseService, times(1)).\n                getCPSearchResult(anyString(), anyString(),anyInt(),anyInt(),anyString(),any());\n    }", "signature": "void should_get_CP_search_result()", "full_signature": "@Test public void should_get_CP_search_result()", "class_method_signature": "CaseSearchPresenterTest.should_get_CP_search_result()", "testcase": true, "constructor": false, "invocations": ["mock", "setRole", "thenReturn", "when", "getCurrentUser", "thenReturn", "when", "get", "anyString", "thenReturn", "when", "getCPSearchResult", "anyString", "anyString", "anyInt", "anyInt", "anyString", "any", "assertThat", "getSearchResult", "is", "getCPSearchResult", "verify", "times", "anyString", "anyString", "anyInt", "anyInt", "anyString", "any"]}, "focal_class": {"identifier": "CaseSearchPresenter", "superclass": "extends RecordSearchPresenter", "interfaces": "", "fields": [{"original_string": "private CaseService caseService;", "modifier": "private", "type": "CaseService", "declarator": "caseService", "var_name": "caseService"}], "methods": [{"identifier": "CaseSearchPresenter", "parameters": "(CaseService caseService)", "modifiers": "@Inject public", "return": "", "signature": " CaseSearchPresenter(CaseService caseService)", "full_signature": "@Inject public  CaseSearchPresenter(CaseService caseService)", "class_method_signature": "CaseSearchPresenter.CaseSearchPresenter(CaseService caseService)", "testcase": false, "constructor": true}, {"identifier": "getSearchResult", "parameters": "(Map<String, String> searchConditions)", "modifiers": "@Override protected", "return": "List<Long>", "signature": "List<Long> getSearchResult(Map<String, String> searchConditions)", "full_signature": "@Override protected List<Long> getSearchResult(Map<String, String> searchConditions)", "class_method_signature": "CaseSearchPresenter.getSearchResult(Map<String, String> searchConditions)", "testcase": false, "constructor": false}], "file": "app/src/main/java/org/unicef/rapidreg/childcase/casesearch/CaseSearchPresenter.java"}, "focal_method": {"identifier": "getSearchResult", "parameters": "(Map<String, String> searchConditions)", "modifiers": "@Override protected", "return": "List<Long>", "body": "@Override\n    protected List<Long> getSearchResult(Map<String, String> searchConditions) {\n        String uniqueId = searchConditions.get(ID);\n        String name = searchConditions.get(NAME);\n        String registrationDate = searchConditions.get(REGISTRATION_DATE);\n        if (PrimeroAppConfiguration.getCurrentUser().getRoleType() == User.Role.CP) {\n            int ageFrom = Integer.valueOf(searchConditions.get(AGE_FROM));\n            int ageTo = Integer.valueOf(searchConditions.get(AGE_TO));\n            String caregiver = searchConditions.get(CAREGIVER);\n            return caseService.getCPSearchResult(uniqueId, name, ageFrom, ageTo, caregiver, getDate(registrationDate));\n        } else {\n            String location = searchConditions.get(LOCATION);\n            return caseService.getGBVSearchResult(uniqueId, name, location, getDate(registrationDate));\n        }\n    }", "signature": "List<Long> getSearchResult(Map<String, String> searchConditions)", "full_signature": "@Override protected List<Long> getSearchResult(Map<String, String> searchConditions)", "class_method_signature": "CaseSearchPresenter.getSearchResult(Map<String, String> searchConditions)", "testcase": false, "constructor": false, "invocations": ["get", "get", "get", "getRoleType", "getCurrentUser", "valueOf", "get", "valueOf", "get", "get", "getCPSearchResult", "getDate", "get", "getGBVSearchResult", "getDate"]}, "repository": {"repo_id": 59507570, "url": "https://github.com/UnicefNY/RapidReg", "language": "Java", "is_fork": false, "fork_count": 3, "stargazer_count": 7, "size": 10753, "license": "Other"}}