{"test_class": {"identifier": "VulnerabilityUtilsTest", "superclass": "", "interfaces": "", "fields": [{"original_string": "VulnerabilityUpdateStatus vus1, vus2, vus3, emptyVus;", "modifier": "", "type": "VulnerabilityUpdateStatus", "declarator": "vus1", "var_name": "vus1"}, {"original_string": "Map<UpdateType, List<Vulnerability>> updateMap, failedUpdateMap;", "modifier": "", "type": "Map<UpdateType, List<Vulnerability>>", "declarator": "updateMap", "var_name": "updateMap"}], "file": "backend/src/src-cvesearch/src/test/java/org/eclipse/sw360/cvesearch/helper/VulnerabilityUtilsTest.java"}, "test_case": {"identifier": "testReduceVulnerabilityUpdateStatusTwoWithSecondEmpty", "parameters": "()", "modifiers": "@Test public", "return": "void", "body": "@Test\n    public void testReduceVulnerabilityUpdateStatusTwoWithSecondEmpty() throws Exception {\n        assertThat(reduceVulnerabilityUpdateStatus(vus1, emptyVus).getRequestStatus(), is(RequestStatus.SUCCESS));\n        assertThat(reduceVulnerabilityUpdateStatus(vus1, emptyVus).statusToVulnerabilityIds.get(UpdateType.UPDATED),\n                is(vus1.statusToVulnerabilityIds.get(UpdateType.UPDATED)));\n        assertThat(reduceVulnerabilityUpdateStatus(vus1, emptyVus).statusToVulnerabilityIds.get(UpdateType.FAILED),\n                is(vus1.statusToVulnerabilityIds.get(UpdateType.FAILED)));\n    }", "signature": "void testReduceVulnerabilityUpdateStatusTwoWithSecondEmpty()", "full_signature": "@Test public void testReduceVulnerabilityUpdateStatusTwoWithSecondEmpty()", "class_method_signature": "VulnerabilityUtilsTest.testReduceVulnerabilityUpdateStatusTwoWithSecondEmpty()", "testcase": true, "constructor": false, "invocations": ["assertThat", "getRequestStatus", "reduceVulnerabilityUpdateStatus", "is", "assertThat", "get", "reduceVulnerabilityUpdateStatus", "is", "get", "assertThat", "get", "reduceVulnerabilityUpdateStatus", "is", "get"]}, "focal_class": {"identifier": "VulnerabilityUtils", "superclass": "", "interfaces": "", "fields": [], "methods": [{"identifier": "getEmptyVulnerabilityUpdateStatus", "parameters": "(RequestStatus requestStatus)", "modifiers": "public static", "return": "VulnerabilityUpdateStatus", "signature": "VulnerabilityUpdateStatus getEmptyVulnerabilityUpdateStatus(RequestStatus requestStatus)", "full_signature": "public static VulnerabilityUpdateStatus getEmptyVulnerabilityUpdateStatus(RequestStatus requestStatus)", "class_method_signature": "VulnerabilityUtils.getEmptyVulnerabilityUpdateStatus(RequestStatus requestStatus)", "testcase": false, "constructor": false}, {"identifier": "getEmptyVulnerabilityUpdateStatus", "parameters": "()", "modifiers": "public static", "return": "VulnerabilityUpdateStatus", "signature": "VulnerabilityUpdateStatus getEmptyVulnerabilityUpdateStatus()", "full_signature": "public static VulnerabilityUpdateStatus getEmptyVulnerabilityUpdateStatus()", "class_method_signature": "VulnerabilityUtils.getEmptyVulnerabilityUpdateStatus()", "testcase": false, "constructor": false}, {"identifier": "reduceVulnerabilityUpdateStatus", "parameters": "(VulnerabilityUpdateStatus ... statuses)", "modifiers": "public static", "return": "VulnerabilityUpdateStatus", "signature": "VulnerabilityUpdateStatus reduceVulnerabilityUpdateStatus(VulnerabilityUpdateStatus ... statuses)", "full_signature": "public static VulnerabilityUpdateStatus reduceVulnerabilityUpdateStatus(VulnerabilityUpdateStatus ... statuses)", "class_method_signature": "VulnerabilityUtils.reduceVulnerabilityUpdateStatus(VulnerabilityUpdateStatus ... statuses)", "testcase": false, "constructor": false}, {"identifier": "getUpdateStatusFromUpdateMap", "parameters": "(Map<UpdateType, List<Vulnerability>> statusToVulnerabilities)", "modifiers": "public static", "return": "VulnerabilityUpdateStatus", "signature": "VulnerabilityUpdateStatus getUpdateStatusFromUpdateMap(Map<UpdateType, List<Vulnerability>> statusToVulnerabilities)", "full_signature": "public static VulnerabilityUpdateStatus getUpdateStatusFromUpdateMap(Map<UpdateType, List<Vulnerability>> statusToVulnerabilities)", "class_method_signature": "VulnerabilityUtils.getUpdateStatusFromUpdateMap(Map<UpdateType, List<Vulnerability>> statusToVulnerabilities)", "testcase": false, "constructor": false}, {"identifier": "successIdsFromUpdateMap", "parameters": "(Map<UpdateType, List<Vulnerability>> updateMap)", "modifiers": "public static", "return": "List<String>", "signature": "List<String> successIdsFromUpdateMap(Map<UpdateType, List<Vulnerability>> updateMap)", "full_signature": "public static List<String> successIdsFromUpdateMap(Map<UpdateType, List<Vulnerability>> updateMap)", "class_method_signature": "VulnerabilityUtils.successIdsFromUpdateMap(Map<UpdateType, List<Vulnerability>> updateMap)", "testcase": false, "constructor": false}], "file": "backend/src/src-cvesearch/src/main/java/org/eclipse/sw360/cvesearch/helper/VulnerabilityUtils.java"}, "focal_method": {"identifier": "reduceVulnerabilityUpdateStatus", "parameters": "(VulnerabilityUpdateStatus ... statuses)", "modifiers": "public static", "return": "VulnerabilityUpdateStatus", "body": "public static VulnerabilityUpdateStatus reduceVulnerabilityUpdateStatus(VulnerabilityUpdateStatus ... statuses){\n        VulnerabilityUpdateStatus resultStatus = getEmptyVulnerabilityUpdateStatus();\n\n        RequestStatus requestStatus = Arrays.stream(statuses)\n                .map(VulnerabilityUpdateStatus::getRequestStatus)\n                .reduce(RequestStatus.SUCCESS, CommonUtils::reduceRequestStatus);\n        resultStatus.setRequestStatus(requestStatus);\n\n        for(UpdateType updateType : UpdateType.values()) {\n            for (VulnerabilityUpdateStatus status : statuses) {\n                if(status.isSetStatusToVulnerabilityIds()) {\n                    resultStatus.statusToVulnerabilityIds.get(updateType)\n                            .addAll(nullToEmptyList(status.statusToVulnerabilityIds.get(updateType)));\n                }\n            }\n        }\n        return resultStatus;\n    }", "signature": "VulnerabilityUpdateStatus reduceVulnerabilityUpdateStatus(VulnerabilityUpdateStatus ... statuses)", "full_signature": "public static VulnerabilityUpdateStatus reduceVulnerabilityUpdateStatus(VulnerabilityUpdateStatus ... statuses)", "class_method_signature": "VulnerabilityUtils.reduceVulnerabilityUpdateStatus(VulnerabilityUpdateStatus ... statuses)", "testcase": false, "constructor": false, "invocations": ["getEmptyVulnerabilityUpdateStatus", "reduce", "map", "stream", "setRequestStatus", "values", "isSetStatusToVulnerabilityIds", "addAll", "get", "nullToEmptyList", "get"]}, "repository": {"repo_id": 43326581, "url": "https://github.com/sw360/sw360portal", "language": "Java", "is_fork": false, "fork_count": 23, "stargazer_count": 31, "size": 8770, "license": "licensed"}}