{"test_class": {"identifier": "FixTagParserTest", "superclass": "", "interfaces": "", "fields": [{"original_string": "private FixTagHandler fixTagHandler;", "modifier": "private", "type": "FixTagHandler", "declarator": "fixTagHandler", "var_name": "fixTagHandler"}], "file": "nanofix-client/src/test/java/com/lmax/nanofix/incoming/FixTagParserTest.java"}, "test_case": {"identifier": "shouldStopReadingWhenTheMessageIsNotLogon", "parameters": "()", "modifiers": "@Test public", "return": "void", "body": "@Test\n    public void shouldStopReadingWhenTheMessageIsNotLogon()\n    {\n        final byte[] newOrderSingleMsg = FixMessageUtil.getNewOrderSingle();\n\n        final InOrder inOrder = BDDMockito.inOrder(fixTagHandler);\n\n        given(fixTagHandler.isFinished()).willReturn(false).willReturn(false).willReturn(true);\n\n        final FixTagParser parser = new FixTagParser(fixTagHandler);\n        parser.parse(newOrderSingleMsg, 0, newOrderSingleMsg.length, true);\n\n        inOrder.verify(fixTagHandler).messageStart();\n\n        inOrder.verify(fixTagHandler).onTag(8, newOrderSingleMsg, 2, 7);\n        inOrder.verify(fixTagHandler, times(1)).isFinished();\n\n        inOrder.verify(fixTagHandler).onTag(9, newOrderSingleMsg, 12, 3);\n        inOrder.verify(fixTagHandler, times(1)).isFinished();\n\n        inOrder.verify(fixTagHandler).onTag(35, newOrderSingleMsg, 19, 1);\n        inOrder.verify(fixTagHandler, times(1)).isFinished();\n\n        inOrder.verify(fixTagHandler).messageEnd();\n    }", "signature": "void shouldStopReadingWhenTheMessageIsNotLogon()", "full_signature": "@Test public void shouldStopReadingWhenTheMessageIsNotLogon()", "class_method_signature": "FixTagParserTest.shouldStopReadingWhenTheMessageIsNotLogon()", "testcase": true, "constructor": false, "invocations": ["getNewOrderSingle", "inOrder", "willReturn", "willReturn", "willReturn", "given", "isFinished", "parse", "messageStart", "verify", "onTag", "verify", "isFinished", "verify", "times", "onTag", "verify", "isFinished", "verify", "times", "onTag", "verify", "isFinished", "verify", "times", "messageEnd", "verify"]}, "focal_class": {"identifier": "FixTagParser", "superclass": "", "interfaces": "", "fields": [{"original_string": "public static final byte SOH = 1;", "modifier": "public static final", "type": "byte", "declarator": "SOH = 1", "var_name": "SOH"}, {"original_string": "private static final byte ASCII_EQUALS = (byte)61;", "modifier": "private static final", "type": "byte", "declarator": "ASCII_EQUALS = (byte)61", "var_name": "ASCII_EQUALS"}, {"original_string": "private final FixTagHandler fixTagHandler;", "modifier": "private final", "type": "FixTagHandler", "declarator": "fixTagHandler", "var_name": "fixTagHandler"}, {"original_string": "private final byte[] lineSeparators;", "modifier": "private final", "type": "byte[]", "declarator": "lineSeparators", "var_name": "lineSeparators"}], "methods": [{"identifier": "FixTagParser", "parameters": "(final FixTagHandler fixTagHandler)", "modifiers": "public", "return": "", "signature": " FixTagParser(final FixTagHandler fixTagHandler)", "full_signature": "public  FixTagParser(final FixTagHandler fixTagHandler)", "class_method_signature": "FixTagParser.FixTagParser(final FixTagHandler fixTagHandler)", "testcase": false, "constructor": true}, {"identifier": "FixTagParser", "parameters": "(final FixTagHandler fixTagHandler, final byte[] lineSeparators)", "modifiers": "public", "return": "", "signature": " FixTagParser(final FixTagHandler fixTagHandler, final byte[] lineSeparators)", "full_signature": "public  FixTagParser(final FixTagHandler fixTagHandler, final byte[] lineSeparators)", "class_method_signature": "FixTagParser.FixTagParser(final FixTagHandler fixTagHandler, final byte[] lineSeparators)", "testcase": false, "constructor": true}, {"identifier": "parse", "parameters": "(final byte[] message, final int offset, final int length, final boolean throwExceptionOnParseFailure)", "modifiers": "public", "return": "boolean", "signature": "boolean parse(final byte[] message, final int offset, final int length, final boolean throwExceptionOnParseFailure)", "full_signature": "public boolean parse(final byte[] message, final int offset, final int length, final boolean throwExceptionOnParseFailure)", "class_method_signature": "FixTagParser.parse(final byte[] message, final int offset, final int length, final boolean throwExceptionOnParseFailure)", "testcase": false, "constructor": false}, {"identifier": "containsLineSeparator", "parameters": "(final byte separator)", "modifiers": "private", "return": "boolean", "signature": "boolean containsLineSeparator(final byte separator)", "full_signature": "private boolean containsLineSeparator(final byte separator)", "class_method_signature": "FixTagParser.containsLineSeparator(final byte separator)", "testcase": false, "constructor": false}, {"identifier": "raiseException", "parameters": "(final String reason,\n                                       final byte[] message,\n                                       final int offset,\n                                       final int length,\n                                       final int tagStart,\n                                       final int equalsIndex)", "modifiers": "private static", "return": "void", "signature": "void raiseException(final String reason,\n                                       final byte[] message,\n                                       final int offset,\n                                       final int length,\n                                       final int tagStart,\n                                       final int equalsIndex)", "full_signature": "private static void raiseException(final String reason,\n                                       final byte[] message,\n                                       final int offset,\n                                       final int length,\n                                       final int tagStart,\n                                       final int equalsIndex)", "class_method_signature": "FixTagParser.raiseException(final String reason,\n                                       final byte[] message,\n                                       final int offset,\n                                       final int length,\n                                       final int tagStart,\n                                       final int equalsIndex)", "testcase": false, "constructor": false}], "file": "nanofix-client/src/main/java/com/lmax/nanofix/incoming/FixTagParser.java"}, "focal_method": {"identifier": "parse", "parameters": "(final byte[] message, final int offset, final int length, final boolean throwExceptionOnParseFailure)", "modifiers": "public", "return": "boolean", "body": "public boolean parse(final byte[] message, final int offset, final int length, final boolean throwExceptionOnParseFailure)\n    {\n        fixTagHandler.messageStart();\n\n        int tagStart = offset;\n        int equalsIndex = -1;\n\n        for (int i = 0; i < length; i++)\n        {\n            int index = i + offset;\n            if (ASCII_EQUALS == message[index])\n            {\n                equalsIndex = index;\n            }\n\n            if (containsLineSeparator(message[index]))\n            {\n                if (-1 != equalsIndex)\n                {\n                    if (!ByteUtil.isInteger(message, tagStart, equalsIndex - tagStart))\n                    {\n                        if (throwExceptionOnParseFailure)\n                        {\n                            raiseException(\"Invalid tag id\", message, offset, length, tagStart, equalsIndex);\n                        }\n                        return false;\n                    }\n\n                    int tagIdentity = ByteUtil.readIntFromAscii(message, tagStart, equalsIndex - tagStart);\n\n                    final int tagValueOffset = equalsIndex + 1;\n                    final int tagValueLength = index - tagValueOffset;\n\n                    fixTagHandler.onTag(tagIdentity, message, tagValueOffset, tagValueLength);\n\n                    if (fixTagHandler.isFinished())\n                    {\n                        break;\n                    }\n                }\n\n                tagStart = index + 1;\n                equalsIndex = -1;\n            }\n        }\n\n        fixTagHandler.messageEnd();\n\n        return true;\n    }", "signature": "boolean parse(final byte[] message, final int offset, final int length, final boolean throwExceptionOnParseFailure)", "full_signature": "public boolean parse(final byte[] message, final int offset, final int length, final boolean throwExceptionOnParseFailure)", "class_method_signature": "FixTagParser.parse(final byte[] message, final int offset, final int length, final boolean throwExceptionOnParseFailure)", "testcase": false, "constructor": false, "invocations": ["messageStart", "containsLineSeparator", "isInteger", "raiseException", "readIntFromAscii", "onTag", "isFinished", "messageEnd"]}, "repository": {"repo_id": 30593072, "url": "https://github.com/LMAX-Exchange/nanofix", "language": "Java", "is_fork": false, "fork_count": 18, "stargazer_count": 24, "size": 193, "license": "licensed"}}