{"test_class": {"identifier": "SiddhiUtilsTest", "superclass": "", "interfaces": "", "fields": [{"original_string": "private List<Attribute> listAttributes;", "modifier": "private", "type": "List<Attribute>", "declarator": "listAttributes", "var_name": "listAttributes"}], "file": "engine/src/test/java/com/stratio/decision/utils/SiddhiUtilsTest.java"}, "test_case": {"identifier": "testDecode", "parameters": "()", "modifiers": "@Test public", "return": "void", "body": "@Test\n    public void testDecode() throws Exception {\n        assertEquals(\"Unexpected result\", \"text\", SiddhiUtils.decodeSiddhiValue(\"text\", Attribute.Type.STRING));\n        assertEquals(\"Unexpected result\", true, SiddhiUtils.decodeSiddhiValue(\"true\", Attribute.Type.BOOL));\n        assertEquals(\"Unexpected result\", 12.1, SiddhiUtils.decodeSiddhiValue(\"12.1\", Attribute.Type.DOUBLE));\n        assertEquals(\"Unexpected result\", 12, SiddhiUtils.decodeSiddhiValue(\"12\", Attribute.Type.INT));\n        assertEquals(\"Unexpected result\", 7L, SiddhiUtils.decodeSiddhiValue(\"7\", Attribute.Type.LONG));\n        assertEquals(\"Unexpected result\", 22f, SiddhiUtils.decodeSiddhiValue(\"22\", Attribute.Type.FLOAT));\n\n        Double d= 22d;\n        assertEquals(\"Unexpected result\", \"22.0\", SiddhiUtils.decodeSiddhiValue(d, Attribute.Type.STRING));\n        assertEquals(\"Unexpected result\", d, SiddhiUtils.decodeSiddhiValue(d, Attribute.Type.DOUBLE));\n        assertEquals(\"Unexpected result\", 22, SiddhiUtils.decodeSiddhiValue(d, Attribute.Type.INT));\n        assertEquals(\"Unexpected result\", 22L, SiddhiUtils.decodeSiddhiValue(d, Attribute.Type.LONG));\n        assertEquals(\"Unexpected result\", 22f, SiddhiUtils.decodeSiddhiValue(d, Attribute.Type.FLOAT));\n    }", "signature": "void testDecode()", "full_signature": "@Test public void testDecode()", "class_method_signature": "SiddhiUtilsTest.testDecode()", "testcase": true, "constructor": false, "invocations": ["assertEquals", "decodeSiddhiValue", "assertEquals", "decodeSiddhiValue", "assertEquals", "decodeSiddhiValue", "assertEquals", "decodeSiddhiValue", "assertEquals", "decodeSiddhiValue", "assertEquals", "decodeSiddhiValue", "assertEquals", "decodeSiddhiValue", "assertEquals", "decodeSiddhiValue", "assertEquals", "decodeSiddhiValue", "assertEquals", "decodeSiddhiValue", "assertEquals", "decodeSiddhiValue"]}, "focal_class": {"identifier": "SiddhiUtils", "superclass": "", "interfaces": "", "fields": [{"original_string": "public static final String QUERY_PLAN_IDENTIFIER = \"StratioStreamingCEP-Cluster\";", "modifier": "public static final", "type": "String", "declarator": "QUERY_PLAN_IDENTIFIER = \"StratioStreamingCEP-Cluster\"", "var_name": "QUERY_PLAN_IDENTIFIER"}], "methods": [{"identifier": "SiddhiUtils", "parameters": "()", "modifiers": "private", "return": "", "signature": " SiddhiUtils()", "full_signature": "private  SiddhiUtils()", "class_method_signature": "SiddhiUtils.SiddhiUtils()", "testcase": false, "constructor": true}, {"identifier": "columnAlreadyExistsInStream", "parameters": "(String columnName, StreamDefinition streamMetaData)", "modifiers": "public static", "return": "boolean", "signature": "boolean columnAlreadyExistsInStream(String columnName, StreamDefinition streamMetaData)", "full_signature": "public static boolean columnAlreadyExistsInStream(String columnName, StreamDefinition streamMetaData)", "class_method_signature": "SiddhiUtils.columnAlreadyExistsInStream(String columnName, StreamDefinition streamMetaData)", "testcase": false, "constructor": false}, {"identifier": "getOrderedValues", "parameters": "(StreamDefinition streamMetaData, List<ColumnNameTypeValue> columns)", "modifiers": "public static", "return": "Object[]", "signature": "Object[] getOrderedValues(StreamDefinition streamMetaData, List<ColumnNameTypeValue> columns)", "full_signature": "public static Object[] getOrderedValues(StreamDefinition streamMetaData, List<ColumnNameTypeValue> columns)", "class_method_signature": "SiddhiUtils.getOrderedValues(StreamDefinition streamMetaData, List<ColumnNameTypeValue> columns)", "testcase": false, "constructor": false}, {"identifier": "decodeSiddhiValue", "parameters": "(String originalValue, Attribute.Type type)", "modifiers": "protected static", "return": "Object", "signature": "Object decodeSiddhiValue(String originalValue, Attribute.Type type)", "full_signature": "protected static Object decodeSiddhiValue(String originalValue, Attribute.Type type)", "class_method_signature": "SiddhiUtils.decodeSiddhiValue(String originalValue, Attribute.Type type)", "testcase": false, "constructor": false}, {"identifier": "decodeSiddhiValue", "parameters": "(Double originalValue, Attribute.Type type)", "modifiers": "protected static", "return": "Object", "signature": "Object decodeSiddhiValue(Double originalValue, Attribute.Type type)", "full_signature": "protected static Object decodeSiddhiValue(Double originalValue, Attribute.Type type)", "class_method_signature": "SiddhiUtils.decodeSiddhiValue(Double originalValue, Attribute.Type type)", "testcase": false, "constructor": false}, {"identifier": "isStreamAllowedForThisOperation", "parameters": "(String streamName, String operation)", "modifiers": "public static", "return": "Boolean", "signature": "Boolean isStreamAllowedForThisOperation(String streamName, String operation)", "full_signature": "public static Boolean isStreamAllowedForThisOperation(String streamName, String operation)", "class_method_signature": "SiddhiUtils.isStreamAllowedForThisOperation(String streamName, String operation)", "testcase": false, "constructor": false}], "file": "engine/src/main/java/com/stratio/decision/utils/SiddhiUtils.java"}, "focal_method": {"identifier": "decodeSiddhiValue", "parameters": "(String originalValue, Attribute.Type type)", "modifiers": "protected static", "return": "Object", "body": "protected static Object decodeSiddhiValue(String originalValue, Attribute.Type type) {\n\n        switch (type) {\n        case STRING:\n            return originalValue;\n        case BOOL:\n            return Boolean.valueOf(originalValue);\n        case DOUBLE:\n            return Double.valueOf(originalValue);\n        case INT:\n            return Integer.valueOf(originalValue);\n        case LONG:\n            return Long.valueOf(originalValue);\n        case FLOAT:\n            return Float.valueOf(originalValue);\n        default:\n            throw new RuntimeException(\"Unsupported Column type: \" + originalValue + \"/\" + type.toString());\n        }\n\n    }", "signature": "Object decodeSiddhiValue(String originalValue, Attribute.Type type)", "full_signature": "protected static Object decodeSiddhiValue(String originalValue, Attribute.Type type)", "class_method_signature": "SiddhiUtils.decodeSiddhiValue(String originalValue, Attribute.Type type)", "testcase": false, "constructor": false, "invocations": ["valueOf", "valueOf", "valueOf", "valueOf", "valueOf", "toString"]}, "repository": {"repo_id": 20521495, "url": "https://github.com/Stratio/Decision", "language": "Java", "is_fork": false, "fork_count": 85, "stargazer_count": 305, "size": 41858, "license": "licensed"}}