{"test_class": {"identifier": "ResourceExceptionTest", "superclass": "", "interfaces": "", "fields": [], "file": "libs/java/server_common/src/test/java/com/yahoo/athenz/common/server/rest/ResourceExceptionTest.java"}, "test_case": {"identifier": "testSymbolForCode", "parameters": "()", "modifiers": "@Test public", "return": "void", "body": "@Test\n    public void testSymbolForCode() {\n        assertEquals(ResourceException.symbolForCode(200), \"OK\");\n        assertEquals(ResourceException.symbolForCode(201), \"CREATED\");\n        assertEquals(ResourceException.symbolForCode(202), \"ACCEPTED\");\n        assertEquals(ResourceException.symbolForCode(204), \"NO_CONTENT\");\n        assertEquals(ResourceException.symbolForCode(301), \"MOVED_PERMANENTLY\");\n        assertEquals(ResourceException.symbolForCode(302), \"FOUND\");\n        assertEquals(ResourceException.symbolForCode(303), \"SEE_OTHER\");\n        assertEquals(ResourceException.symbolForCode(304), \"NOT_MODIFIED\");\n        assertEquals(ResourceException.symbolForCode(307), \"TEMPORARY_REDIRECT\");\n        assertEquals(ResourceException.symbolForCode(400), \"BAD_REQUEST\");\n        assertEquals(ResourceException.symbolForCode(403), \"FORBIDDEN\");\n        assertEquals(ResourceException.symbolForCode(401), \"UNAUTHORIZED\");\n        assertEquals(ResourceException.symbolForCode(404), \"NOT_FOUND\");\n        assertEquals(ResourceException.symbolForCode(409), \"CONFLICT\");\n        assertEquals(ResourceException.symbolForCode(410), \"GONE\");\n        assertEquals(ResourceException.symbolForCode(412), \"PRECONDITION_FAILED\");\n        assertEquals(ResourceException.symbolForCode(415), \"UNSUPPORTED_MEDIA_TYPE\");\n        assertEquals(ResourceException.symbolForCode(500), \"INTERNAL_SERVER_ERROR\");\n        assertEquals(ResourceException.symbolForCode(501), \"NOT_IMPLEMENTED\");\n        assertEquals(ResourceException.symbolForCode(503), \"SERVICE_UNAVAILABLE\");\n        assertEquals(ResourceException.symbolForCode(401), \"UNAUTHORIZED\");\n        assertNull(ResourceException.symbolForCode(1111));\n    }", "signature": "void testSymbolForCode()", "full_signature": "@Test public void testSymbolForCode()", "class_method_signature": "ResourceExceptionTest.testSymbolForCode()", "testcase": true, "constructor": false, "invocations": ["assertEquals", "symbolForCode", "assertEquals", "symbolForCode", "assertEquals", "symbolForCode", "assertEquals", "symbolForCode", "assertEquals", "symbolForCode", "assertEquals", "symbolForCode", "assertEquals", "symbolForCode", "assertEquals", "symbolForCode", "assertEquals", "symbolForCode", "assertEquals", "symbolForCode", "assertEquals", "symbolForCode", "assertEquals", "symbolForCode", "assertEquals", "symbolForCode", "assertEquals", "symbolForCode", "assertEquals", "symbolForCode", "assertEquals", "symbolForCode", "assertEquals", "symbolForCode", "assertEquals", "symbolForCode", "assertEquals", "symbolForCode", "assertEquals", "symbolForCode", "assertEquals", "symbolForCode", "assertNull", "symbolForCode"]}, "focal_class": {"identifier": "ResourceException", "superclass": "extends RuntimeException", "interfaces": "", "fields": [{"original_string": "private static final long serialVersionUID = 2289910486634456175L;", "modifier": "private static final", "type": "long", "declarator": "serialVersionUID = 2289910486634456175L", "var_name": "serialVersionUID"}, {"original_string": "public final static int OK = 200;", "modifier": "public final static", "type": "int", "declarator": "OK = 200", "var_name": "OK"}, {"original_string": "public final static int CREATED = 201;", "modifier": "public final static", "type": "int", "declarator": "CREATED = 201", "var_name": "CREATED"}, {"original_string": "public final static int ACCEPTED = 202;", "modifier": "public final static", "type": "int", "declarator": "ACCEPTED = 202", "var_name": "ACCEPTED"}, {"original_string": "public final static int NO_CONTENT = 204;", "modifier": "public final static", "type": "int", "declarator": "NO_CONTENT = 204", "var_name": "NO_CONTENT"}, {"original_string": "public final static int MOVED_PERMANENTLY = 301;", "modifier": "public final static", "type": "int", "declarator": "MOVED_PERMANENTLY = 301", "var_name": "MOVED_PERMANENTLY"}, {"original_string": "public final static int FOUND = 302;", "modifier": "public final static", "type": "int", "declarator": "FOUND = 302", "var_name": "FOUND"}, {"original_string": "public final static int SEE_OTHER = 303;", "modifier": "public final static", "type": "int", "declarator": "SEE_OTHER = 303", "var_name": "SEE_OTHER"}, {"original_string": "public final static int NOT_MODIFIED = 304;", "modifier": "public final static", "type": "int", "declarator": "NOT_MODIFIED = 304", "var_name": "NOT_MODIFIED"}, {"original_string": "public final static int TEMPORARY_REDIRECT = 307;", "modifier": "public final static", "type": "int", "declarator": "TEMPORARY_REDIRECT = 307", "var_name": "TEMPORARY_REDIRECT"}, {"original_string": "public final static int BAD_REQUEST = 400;", "modifier": "public final static", "type": "int", "declarator": "BAD_REQUEST = 400", "var_name": "BAD_REQUEST"}, {"original_string": "public final static int UNAUTHORIZED = 401;", "modifier": "public final static", "type": "int", "declarator": "UNAUTHORIZED = 401", "var_name": "UNAUTHORIZED"}, {"original_string": "public final static int FORBIDDEN = 403;", "modifier": "public final static", "type": "int", "declarator": "FORBIDDEN = 403", "var_name": "FORBIDDEN"}, {"original_string": "public final static int NOT_FOUND = 404;", "modifier": "public final static", "type": "int", "declarator": "NOT_FOUND = 404", "var_name": "NOT_FOUND"}, {"original_string": "public final static int CONFLICT = 409;", "modifier": "public final static", "type": "int", "declarator": "CONFLICT = 409", "var_name": "CONFLICT"}, {"original_string": "public final static int GONE = 410;", "modifier": "public final static", "type": "int", "declarator": "GONE = 410", "var_name": "GONE"}, {"original_string": "public final static int PRECONDITION_FAILED = 412;", "modifier": "public final static", "type": "int", "declarator": "PRECONDITION_FAILED = 412", "var_name": "PRECONDITION_FAILED"}, {"original_string": "public final static int UNSUPPORTED_MEDIA_TYPE = 415;", "modifier": "public final static", "type": "int", "declarator": "UNSUPPORTED_MEDIA_TYPE = 415", "var_name": "UNSUPPORTED_MEDIA_TYPE"}, {"original_string": "public final static int INTERNAL_SERVER_ERROR = 500;", "modifier": "public final static", "type": "int", "declarator": "INTERNAL_SERVER_ERROR = 500", "var_name": "INTERNAL_SERVER_ERROR"}, {"original_string": "public final static int NOT_IMPLEMENTED = 501;", "modifier": "public final static", "type": "int", "declarator": "NOT_IMPLEMENTED = 501", "var_name": "NOT_IMPLEMENTED"}, {"original_string": "public final static int SERVICE_UNAVAILABLE = 503;", "modifier": "public final static", "type": "int", "declarator": "SERVICE_UNAVAILABLE = 503", "var_name": "SERVICE_UNAVAILABLE"}, {"original_string": "int code;", "modifier": "", "type": "int", "declarator": "code", "var_name": "code"}, {"original_string": "Object data;", "modifier": "", "type": "Object", "declarator": "data", "var_name": "data"}], "methods": [{"identifier": "codeForSymbol", "parameters": "(String sym)", "modifiers": "public static", "return": "int", "signature": "int codeForSymbol(String sym)", "full_signature": "public static int codeForSymbol(String sym)", "class_method_signature": "ResourceException.codeForSymbol(String sym)", "testcase": false, "constructor": false}, {"identifier": "symbolForCode", "parameters": "(int code)", "modifiers": "public static", "return": "String", "signature": "String symbolForCode(int code)", "full_signature": "public static String symbolForCode(int code)", "class_method_signature": "ResourceException.symbolForCode(int code)", "testcase": false, "constructor": false}, {"identifier": "ResourceException", "parameters": "(int code)", "modifiers": "public", "return": "", "signature": " ResourceException(int code)", "full_signature": "public  ResourceException(int code)", "class_method_signature": "ResourceException.ResourceException(int code)", "testcase": false, "constructor": true}, {"identifier": "ResourceException", "parameters": "(int code, Object data)", "modifiers": "public", "return": "", "signature": " ResourceException(int code, Object data)", "full_signature": "public  ResourceException(int code, Object data)", "class_method_signature": "ResourceException.ResourceException(int code, Object data)", "testcase": false, "constructor": true}, {"identifier": "getCode", "parameters": "()", "modifiers": "public", "return": "int", "signature": "int getCode()", "full_signature": "public int getCode()", "class_method_signature": "ResourceException.getCode()", "testcase": false, "constructor": false}, {"identifier": "getData", "parameters": "()", "modifiers": "public", "return": "Object", "signature": "Object getData()", "full_signature": "public Object getData()", "class_method_signature": "ResourceException.getData()", "testcase": false, "constructor": false}, {"identifier": "getData", "parameters": "(Class<T> cl)", "modifiers": "public", "return": "T", "signature": "T getData(Class<T> cl)", "full_signature": "public T getData(Class<T> cl)", "class_method_signature": "ResourceException.getData(Class<T> cl)", "testcase": false, "constructor": false}], "file": "libs/java/server_common/src/main/java/com/yahoo/athenz/common/server/rest/ResourceException.java"}, "focal_method": {"identifier": "symbolForCode", "parameters": "(int code)", "modifiers": "public static", "return": "String", "body": "public static String symbolForCode(int code) {\n        switch (code) {\n        case OK:\n            return \"OK\";\n        case CREATED:\n            return \"CREATED\";\n        case ACCEPTED:\n            return \"ACCEPTED\";\n        case NO_CONTENT:\n            return \"NO_CONTENT\";\n        case MOVED_PERMANENTLY:\n            return \"MOVED_PERMANENTLY\";\n        case FOUND:\n            return \"FOUND\";\n        case SEE_OTHER:\n            return \"SEE_OTHER\";\n        case NOT_MODIFIED:\n            return \"NOT_MODIFIED\";\n        case TEMPORARY_REDIRECT:\n            return \"TEMPORARY_REDIRECT\";\n        case BAD_REQUEST:\n            return \"BAD_REQUEST\";\n        case UNAUTHORIZED:\n            return \"UNAUTHORIZED\";\n        case FORBIDDEN:\n            return \"FORBIDDEN\";\n        case NOT_FOUND:\n            return \"NOT_FOUND\";\n        case CONFLICT:\n            return \"CONFLICT\";\n        case GONE:\n            return \"GONE\";\n        case PRECONDITION_FAILED:\n            return \"PRECONDITION_FAILED\";\n        case INTERNAL_SERVER_ERROR:\n            return \"INTERNAL_SERVER_ERROR\";\n        case NOT_IMPLEMENTED:\n            return \"NOT_IMPLEMENTED\";\n        case UNSUPPORTED_MEDIA_TYPE:\n            return \"UNSUPPORTED_MEDIA_TYPE\";\n        case SERVICE_UNAVAILABLE:\n            return \"SERVICE_UNAVAILABLE\";\n        }\n        return null;\n    }", "signature": "String symbolForCode(int code)", "full_signature": "public static String symbolForCode(int code)", "class_method_signature": "ResourceException.symbolForCode(int code)", "testcase": false, "constructor": false, "invocations": []}, "repository": {"repo_id": 73948366, "url": "https://github.com/yahoo/athenz", "stars": 394, "created": "11/16/2016 6:23:08 PM +00:00", "updates": "2020-01-27T15:36:13+00:00", "fork": "False", "license": "licensed"}}