{"test_class": {"identifier": "RoleMemberExpiryNotificationTaskTest", "superclass": "", "interfaces": "", "fields": [], "file": "servers/zms/src/test/java/com/yahoo/athenz/zms/notification/RoleMemberExpiryNotificationTaskTest.java"}, "test_case": {"identifier": "testSendRoleMemberExpiryReminders", "parameters": "()", "modifiers": "@Test public", "return": "void", "body": "@Test\n    public void testSendRoleMemberExpiryReminders() {\n\n        DBService dbsvc = Mockito.mock(DBService.class);\n        NotificationService mockNotificationService =  Mockito.mock(NotificationService.class);\n        NotificationServiceFactory testfact = () -> mockNotificationService;\n\n        List<MemberRole> memberRoles = new ArrayList<>();\n        memberRoles.add(new MemberRole().setRoleName(\"role1\")\n                .setDomainName(\"athenz1\")\n                .setMemberName(\"user.joe\")\n                .setExpiration(Timestamp.fromMillis(100)));\n        DomainRoleMember domainRoleMember = new DomainRoleMember()\n                .setMemberName(\"user.joe\")\n                .setMemberRoles(memberRoles);\n        Map<String, DomainRoleMember> expiryMembers = new HashMap<>();\n        expiryMembers.put(\"user.joe\", domainRoleMember);\n\n        // we're going to return null for our first thread which will\n        // run during init call and then the real data for the second\n        // call\n\n        Mockito.when(dbsvc.getRoleExpiryMembers(1))\n                .thenReturn(null)\n                .thenReturn(expiryMembers);\n\n        NotificationManager notificationManager = getNotificationManager(dbsvc, testfact);\n\n        ZMSTestUtils.sleep(1000);\n\n        AthenzDomain domain = new AthenzDomain(\"athenz1\");\n        List<RoleMember> roleMembers = new ArrayList<>();\n        roleMembers.add(new RoleMember().setMemberName(\"user.jane\"));\n        Role adminRole = new Role()\n                .setName(\"athenz1:role.admin\")\n                .setRoleMembers(roleMembers);\n        List<Role> roles = new ArrayList<>();\n        roles.add(adminRole);\n        domain.setRoles(roles);\n\n        Mockito.when(dbsvc.getRolesByDomain(\"athenz1\")).thenReturn(domain.getRoles());\n\n        List<Notification> notifications = new RoleMemberExpiryNotificationTask(dbsvc, USER_DOMAIN_PREFIX).getNotifications();\n\n\n        // we should get 2 notifications - one for user and one for domain\n        assertEquals(notifications.size(), 2);\n\n        // Verify contents of notifications is as expected\n        Notification expectedFirstNotification = new Notification();\n        expectedFirstNotification.addRecipient(\"user.joe\");\n        expectedFirstNotification.addDetails(NOTIFICATION_DETAILS_ROLES_LIST, \"athenz1;role1;1970-01-01T00:00:00.100Z\");\n        expectedFirstNotification.addDetails(\"member\", \"user.joe\");\n        expectedFirstNotification.setNotificationToEmailConverter(new RoleMemberExpiryNotificationTask.RoleExpiryPrincipalNotificationToEmailConverter());\n        expectedFirstNotification.setType(\"role_membership_expiry\");\n\n        Notification expectedSecondNotification = new Notification();\n        expectedSecondNotification.addRecipient(\"user.jane\");\n        expectedSecondNotification.addDetails(NOTIFICATION_DETAILS_MEMBERS_LIST, \"user.joe;role1;1970-01-01T00:00:00.100Z\");\n        expectedSecondNotification.addDetails(\"domain\", \"athenz1\");\n        expectedSecondNotification.setNotificationToEmailConverter(new RoleMemberExpiryNotificationTask.RoleExpiryDomainNotificationToEmailConverter());\n        expectedSecondNotification.setType(\"role_membership_expiry\");\n\n        assertEquals(notifications.get(0), expectedFirstNotification);\n        assertEquals(notifications.get(1), expectedSecondNotification);\n\n        notificationManager.shutdown();\n    }", "signature": "void testSendRoleMemberExpiryReminders()", "full_signature": "@Test public void testSendRoleMemberExpiryReminders()", "class_method_signature": "RoleMemberExpiryNotificationTaskTest.testSendRoleMemberExpiryReminders()", "testcase": true, "constructor": false, "invocations": ["mock", "mock", "add", "setExpiration", "setMemberName", "setDomainName", "setRoleName", "fromMillis", "setMemberRoles", "setMemberName", "put", "thenReturn", "thenReturn", "when", "getRoleExpiryMembers", "getNotificationManager", "sleep", "add", "setMemberName", "setRoleMembers", "setName", "add", "setRoles", "thenReturn", "when", "getRolesByDomain", "getRoles", "getNotifications", "assertEquals", "size", "addRecipient", "addDetails", "addDetails", "setNotificationToEmailConverter", "setType", "addRecipient", "addDetails", "addDetails", "setNotificationToEmailConverter", "setType", "assertEquals", "get", "assertEquals", "get", "shutdown"]}, "focal_class": {"identifier": "RoleMemberExpiryNotificationTask", "superclass": "", "interfaces": "implements NotificationTask", "fields": [{"original_string": "private final DBService dbService;", "modifier": "private final", "type": "DBService", "declarator": "dbService", "var_name": "dbService"}, {"original_string": "private final RoleMemberNotificationCommon roleMemberNotificationCommon;", "modifier": "private final", "type": "RoleMemberNotificationCommon", "declarator": "roleMemberNotificationCommon", "var_name": "roleMemberNotificationCommon"}, {"original_string": "private static final Logger LOGGER = LoggerFactory.getLogger(RoleMemberExpiryNotificationTask.class);", "modifier": "private static final", "type": "Logger", "declarator": "LOGGER = LoggerFactory.getLogger(RoleMemberExpiryNotificationTask.class)", "var_name": "LOGGER"}, {"original_string": "private final static String DESCRIPTION = \"membership expiration reminders\";", "modifier": "private final static", "type": "String", "declarator": "DESCRIPTION = \"membership expiration reminders\"", "var_name": "DESCRIPTION"}, {"original_string": "private final static String NOTIFICATION_TYPE = \"role_membership_expiry\";", "modifier": "private final static", "type": "String", "declarator": "NOTIFICATION_TYPE = \"role_membership_expiry\"", "var_name": "NOTIFICATION_TYPE"}, {"original_string": "private final RoleExpiryDomainNotificationToEmailConverter roleExpiryDomainNotificationToEmailConverter;", "modifier": "private final", "type": "RoleExpiryDomainNotificationToEmailConverter", "declarator": "roleExpiryDomainNotificationToEmailConverter", "var_name": "roleExpiryDomainNotificationToEmailConverter"}, {"original_string": "private final RoleExpiryPrincipalNotificationToEmailConverter roleExpiryPrincipalNotificationToEmailConverter;", "modifier": "private final", "type": "RoleExpiryPrincipalNotificationToEmailConverter", "declarator": "roleExpiryPrincipalNotificationToEmailConverter", "var_name": "roleExpiryPrincipalNotificationToEmailConverter"}], "methods": [{"identifier": "RoleMemberExpiryNotificationTask", "parameters": "(DBService dbService, String userDomainPrefix)", "modifiers": "public", "return": "", "signature": " RoleMemberExpiryNotificationTask(DBService dbService, String userDomainPrefix)", "full_signature": "public  RoleMemberExpiryNotificationTask(DBService dbService, String userDomainPrefix)", "class_method_signature": "RoleMemberExpiryNotificationTask.RoleMemberExpiryNotificationTask(DBService dbService, String userDomainPrefix)", "testcase": false, "constructor": true}, {"identifier": "getNotifications", "parameters": "()", "modifiers": "@Override public", "return": "List<Notification>", "signature": "List<Notification> getNotifications()", "full_signature": "@Override public List<Notification> getNotifications()", "class_method_signature": "RoleMemberExpiryNotificationTask.getNotifications()", "testcase": false, "constructor": false}, {"identifier": "getDescription", "parameters": "()", "modifiers": "@Override public", "return": "String", "signature": "String getDescription()", "full_signature": "@Override public String getDescription()", "class_method_signature": "RoleMemberExpiryNotificationTask.getDescription()", "testcase": false, "constructor": false}], "file": "servers/zms/src/main/java/com/yahoo/athenz/zms/notification/RoleMemberExpiryNotificationTask.java"}, "focal_method": {"identifier": "getNotifications", "parameters": "()", "modifiers": "@Override public", "return": "List<Notification>", "body": "@Override\n    public List<Notification> getNotifications() {\n        Map<String, DomainRoleMember> expiryMembers = dbService.getRoleExpiryMembers(1);\n        if (expiryMembers == null || expiryMembers.isEmpty()) {\n            if (LOGGER.isDebugEnabled()) {\n                LOGGER.debug(\"No expiry members available to send notifications\");\n            }\n            return new ArrayList<>();\n        }\n\n        return roleMemberNotificationCommon.getNotificationDetails(\n                expiryMembers,\n                roleExpiryPrincipalNotificationToEmailConverter,\n                roleExpiryDomainNotificationToEmailConverter,\n                new ExpiryRoleMemberDetailStringer(),\n                NOTIFICATION_TYPE);\n    }", "signature": "List<Notification> getNotifications()", "full_signature": "@Override public List<Notification> getNotifications()", "class_method_signature": "RoleMemberExpiryNotificationTask.getNotifications()", "testcase": false, "constructor": false, "invocations": ["getRoleExpiryMembers", "isEmpty", "isDebugEnabled", "debug", "getNotificationDetails"]}, "repository": {"repo_id": 73948366, "url": "https://github.com/yahoo/athenz", "stars": 394, "created": "11/16/2016 6:23:08 PM +00:00", "updates": "2020-01-27T15:36:13+00:00", "fork": "False", "license": "licensed"}}