{"test_class": {"identifier": "ExpectedPartitionValueRestControllerTest", "superclass": "extends AbstractRestTest", "interfaces": "", "fields": [{"original_string": "@InjectMocks\n    private ExpectedPartitionValueRestController expectedPartitionValueRestController;", "modifier": "@InjectMocks\n    private", "type": "ExpectedPartitionValueRestController", "declarator": "expectedPartitionValueRestController", "var_name": "expectedPartitionValueRestController"}, {"original_string": "@Mock\n    private ExpectedPartitionValueService expectedPartitionValueService;", "modifier": "@Mock\n    private", "type": "ExpectedPartitionValueService", "declarator": "expectedPartitionValueService", "var_name": "expectedPartitionValueService"}], "file": "herd-code/herd-rest/src/test/java/org/finra/herd/rest/ExpectedPartitionValueRestControllerTest.java"}, "test_case": {"identifier": "testGetExpectedPartitionValues", "parameters": "()", "modifiers": "@Test public", "return": "void", "body": "@Test\n    public void testGetExpectedPartitionValues()\n    {\n        PartitionKeyGroupKey partitionKeyGroupKey = new PartitionKeyGroupKey();\n        partitionKeyGroupKey.setPartitionKeyGroupName(PARTITION_KEY_GROUP);\n        List<String> testSortedExpectedPartitionValues = expectedPartitionValueDaoTestHelper.getTestSortedExpectedPartitionValues();\n        int startExpectedPartitionValueIndex = 1;\n        int endExpectedPartitionValueIndex = testSortedExpectedPartitionValues.size() - 2;\n        PartitionValueRange partitionValueRange = new PartitionValueRange();\n        partitionValueRange.setStartPartitionValue(testSortedExpectedPartitionValues.get(startExpectedPartitionValueIndex));\n        partitionValueRange.setEndPartitionValue(testSortedExpectedPartitionValues.get(endExpectedPartitionValueIndex));\n\n        ExpectedPartitionValuesInformation expectedPartitionValuesInformation =\n            new ExpectedPartitionValuesInformation(partitionKeyGroupServiceTestHelper.createPartitionKeyGroupKey(PARTITION_KEY_GROUP),\n                expectedPartitionValueDaoTestHelper.getTestSortedExpectedPartitionValues()\n                    .subList(startExpectedPartitionValueIndex, endExpectedPartitionValueIndex));\n\n        when(expectedPartitionValueService.getExpectedPartitionValues(partitionKeyGroupKey, partitionValueRange))\n            .thenReturn(expectedPartitionValuesInformation);\n\n        ExpectedPartitionValuesInformation resultPartitionValuesInformation = expectedPartitionValueRestController\n            .getExpectedPartitionValues(PARTITION_KEY_GROUP, testSortedExpectedPartitionValues.get(startExpectedPartitionValueIndex),\n                testSortedExpectedPartitionValues.get(endExpectedPartitionValueIndex));\n\n        // Validate the returned object.\n        expectedPartitionValueServiceTestHelper.validateExpectedPartitionValuesInformation(PARTITION_KEY_GROUP,\n            testSortedExpectedPartitionValues.subList(startExpectedPartitionValueIndex, endExpectedPartitionValueIndex), resultPartitionValuesInformation);\n        // Verify the external calls.\n        verify(expectedPartitionValueService).getExpectedPartitionValues(partitionKeyGroupKey, partitionValueRange);\n        verifyNoMoreInteractions(expectedPartitionValueService);\n        // Validate the returned object.\n        assertEquals(expectedPartitionValuesInformation, resultPartitionValuesInformation);\n    }", "signature": "void testGetExpectedPartitionValues()", "full_signature": "@Test public void testGetExpectedPartitionValues()", "class_method_signature": "ExpectedPartitionValueRestControllerTest.testGetExpectedPartitionValues()", "testcase": true, "constructor": false, "invocations": ["setPartitionKeyGroupName", "getTestSortedExpectedPartitionValues", "size", "setStartPartitionValue", "get", "setEndPartitionValue", "get", "createPartitionKeyGroupKey", "subList", "getTestSortedExpectedPartitionValues", "thenReturn", "when", "getExpectedPartitionValues", "getExpectedPartitionValues", "get", "get", "validateExpectedPartitionValuesInformation", "subList", "getExpectedPartitionValues", "verify", "verifyNoMoreInteractions", "assertEquals"]}, "focal_class": {"identifier": "ExpectedPartitionValueRestController", "superclass": "extends HerdBaseController", "interfaces": "", "fields": [{"original_string": "public static final String EXPECTED_PARTITION_VALUES_URI_PREFIX = \"/expectedPartitionValues\";", "modifier": "public static final", "type": "String", "declarator": "EXPECTED_PARTITION_VALUES_URI_PREFIX = \"/expectedPartitionValues\"", "var_name": "EXPECTED_PARTITION_VALUES_URI_PREFIX"}, {"original_string": "@Autowired\n    private ExpectedPartitionValueService expectedPartitionValueService;", "modifier": "@Autowired\n    private", "type": "ExpectedPartitionValueService", "declarator": "expectedPartitionValueService", "var_name": "expectedPartitionValueService"}], "methods": [{"identifier": "createExpectedPartitionValues", "parameters": "(@RequestBody ExpectedPartitionValuesCreateRequest request)", "modifiers": "@RequestMapping(value = EXPECTED_PARTITION_VALUES_URI_PREFIX, method = RequestMethod.POST, consumes = {\"application/xml\", \"application/json\"}) @Secured(SecurityFunctions.FN_EXPECTED_PARTITION_VALUES_POST) public", "return": "ExpectedPartitionValuesInformation", "signature": "ExpectedPartitionValuesInformation createExpectedPartitionValues(@RequestBody ExpectedPartitionValuesCreateRequest request)", "full_signature": "@RequestMapping(value = EXPECTED_PARTITION_VALUES_URI_PREFIX, method = RequestMethod.POST, consumes = {\"application/xml\", \"application/json\"}) @Secured(SecurityFunctions.FN_EXPECTED_PARTITION_VALUES_POST) public ExpectedPartitionValuesInformation createExpectedPartitionValues(@RequestBody ExpectedPartitionValuesCreateRequest request)", "class_method_signature": "ExpectedPartitionValueRestController.createExpectedPartitionValues(@RequestBody ExpectedPartitionValuesCreateRequest request)", "testcase": false, "constructor": false}, {"identifier": "getExpectedPartitionValue", "parameters": "(@PathVariable(\"partitionKeyGroupName\") String partitionKeyGroupName,\n        @PathVariable(\"expectedPartitionValue\") String expectedPartitionValue, @RequestParam(value = \"offset\", required = false) Integer offset)", "modifiers": "@RequestMapping( value = EXPECTED_PARTITION_VALUES_URI_PREFIX + \"/partitionKeyGroups/{partitionKeyGroupName}/expectedPartitionValues/{expectedPartitionValue}\", method = RequestMethod.GET) @Secured(SecurityFunctions.FN_EXPECTED_PARTITION_VALUES_GET) public", "return": "ExpectedPartitionValueInformation", "signature": "ExpectedPartitionValueInformation getExpectedPartitionValue(@PathVariable(\"partitionKeyGroupName\") String partitionKeyGroupName,\n        @PathVariable(\"expectedPartitionValue\") String expectedPartitionValue, @RequestParam(value = \"offset\", required = false) Integer offset)", "full_signature": "@RequestMapping( value = EXPECTED_PARTITION_VALUES_URI_PREFIX + \"/partitionKeyGroups/{partitionKeyGroupName}/expectedPartitionValues/{expectedPartitionValue}\", method = RequestMethod.GET) @Secured(SecurityFunctions.FN_EXPECTED_PARTITION_VALUES_GET) public ExpectedPartitionValueInformation getExpectedPartitionValue(@PathVariable(\"partitionKeyGroupName\") String partitionKeyGroupName,\n        @PathVariable(\"expectedPartitionValue\") String expectedPartitionValue, @RequestParam(value = \"offset\", required = false) Integer offset)", "class_method_signature": "ExpectedPartitionValueRestController.getExpectedPartitionValue(@PathVariable(\"partitionKeyGroupName\") String partitionKeyGroupName,\n        @PathVariable(\"expectedPartitionValue\") String expectedPartitionValue, @RequestParam(value = \"offset\", required = false) Integer offset)", "testcase": false, "constructor": false}, {"identifier": "getExpectedPartitionValues", "parameters": "(@PathVariable(\"partitionKeyGroupName\") String partitionKeyGroupName,\n        @RequestParam(value = \"startExpectedPartitionValue\", required = false) String startExpectedPartitionValue,\n        @RequestParam(value = \"endExpectedPartitionValue\", required = false) String endExpectedPartitionValue)", "modifiers": "@RequestMapping(value = EXPECTED_PARTITION_VALUES_URI_PREFIX + \"/partitionKeyGroups/{partitionKeyGroupName}\", method = RequestMethod.GET) @Secured(SecurityFunctions.FN_EXPECTED_PARTITION_VALUES_GET) public", "return": "ExpectedPartitionValuesInformation", "signature": "ExpectedPartitionValuesInformation getExpectedPartitionValues(@PathVariable(\"partitionKeyGroupName\") String partitionKeyGroupName,\n        @RequestParam(value = \"startExpectedPartitionValue\", required = false) String startExpectedPartitionValue,\n        @RequestParam(value = \"endExpectedPartitionValue\", required = false) String endExpectedPartitionValue)", "full_signature": "@RequestMapping(value = EXPECTED_PARTITION_VALUES_URI_PREFIX + \"/partitionKeyGroups/{partitionKeyGroupName}\", method = RequestMethod.GET) @Secured(SecurityFunctions.FN_EXPECTED_PARTITION_VALUES_GET) public ExpectedPartitionValuesInformation getExpectedPartitionValues(@PathVariable(\"partitionKeyGroupName\") String partitionKeyGroupName,\n        @RequestParam(value = \"startExpectedPartitionValue\", required = false) String startExpectedPartitionValue,\n        @RequestParam(value = \"endExpectedPartitionValue\", required = false) String endExpectedPartitionValue)", "class_method_signature": "ExpectedPartitionValueRestController.getExpectedPartitionValues(@PathVariable(\"partitionKeyGroupName\") String partitionKeyGroupName,\n        @RequestParam(value = \"startExpectedPartitionValue\", required = false) String startExpectedPartitionValue,\n        @RequestParam(value = \"endExpectedPartitionValue\", required = false) String endExpectedPartitionValue)", "testcase": false, "constructor": false}, {"identifier": "deleteExpectedPartitionValues", "parameters": "(@RequestBody ExpectedPartitionValuesDeleteRequest request)", "modifiers": "@RequestMapping(value = EXPECTED_PARTITION_VALUES_URI_PREFIX, method = RequestMethod.DELETE, consumes = {\"application/xml\", \"application/json\"}) @Secured(SecurityFunctions.FN_EXPECTED_PARTITION_VALUES_DELETE) public", "return": "ExpectedPartitionValuesInformation", "signature": "ExpectedPartitionValuesInformation deleteExpectedPartitionValues(@RequestBody ExpectedPartitionValuesDeleteRequest request)", "full_signature": "@RequestMapping(value = EXPECTED_PARTITION_VALUES_URI_PREFIX, method = RequestMethod.DELETE, consumes = {\"application/xml\", \"application/json\"}) @Secured(SecurityFunctions.FN_EXPECTED_PARTITION_VALUES_DELETE) public ExpectedPartitionValuesInformation deleteExpectedPartitionValues(@RequestBody ExpectedPartitionValuesDeleteRequest request)", "class_method_signature": "ExpectedPartitionValueRestController.deleteExpectedPartitionValues(@RequestBody ExpectedPartitionValuesDeleteRequest request)", "testcase": false, "constructor": false}], "file": "herd-code/herd-rest/src/main/java/org/finra/herd/rest/ExpectedPartitionValueRestController.java"}, "focal_method": {"identifier": "getExpectedPartitionValues", "parameters": "(@PathVariable(\"partitionKeyGroupName\") String partitionKeyGroupName,\n        @RequestParam(value = \"startExpectedPartitionValue\", required = false) String startExpectedPartitionValue,\n        @RequestParam(value = \"endExpectedPartitionValue\", required = false) String endExpectedPartitionValue)", "modifiers": "@RequestMapping(value = EXPECTED_PARTITION_VALUES_URI_PREFIX + \"/partitionKeyGroups/{partitionKeyGroupName}\", method = RequestMethod.GET) @Secured(SecurityFunctions.FN_EXPECTED_PARTITION_VALUES_GET) public", "return": "ExpectedPartitionValuesInformation", "body": "@RequestMapping(value = EXPECTED_PARTITION_VALUES_URI_PREFIX + \"/partitionKeyGroups/{partitionKeyGroupName}\", method = RequestMethod.GET)\n    @Secured(SecurityFunctions.FN_EXPECTED_PARTITION_VALUES_GET)\n    public ExpectedPartitionValuesInformation getExpectedPartitionValues(@PathVariable(\"partitionKeyGroupName\") String partitionKeyGroupName,\n        @RequestParam(value = \"startExpectedPartitionValue\", required = false) String startExpectedPartitionValue,\n        @RequestParam(value = \"endExpectedPartitionValue\", required = false) String endExpectedPartitionValue)\n    {\n        PartitionKeyGroupKey partitionKeyGroupKey = new PartitionKeyGroupKey();\n        partitionKeyGroupKey.setPartitionKeyGroupName(partitionKeyGroupName);\n        PartitionValueRange partitionValueRange = new PartitionValueRange();\n        partitionValueRange.setStartPartitionValue(startExpectedPartitionValue);\n        partitionValueRange.setEndPartitionValue(endExpectedPartitionValue);\n        return expectedPartitionValueService.getExpectedPartitionValues(partitionKeyGroupKey, partitionValueRange);\n    }", "signature": "ExpectedPartitionValuesInformation getExpectedPartitionValues(@PathVariable(\"partitionKeyGroupName\") String partitionKeyGroupName,\n        @RequestParam(value = \"startExpectedPartitionValue\", required = false) String startExpectedPartitionValue,\n        @RequestParam(value = \"endExpectedPartitionValue\", required = false) String endExpectedPartitionValue)", "full_signature": "@RequestMapping(value = EXPECTED_PARTITION_VALUES_URI_PREFIX + \"/partitionKeyGroups/{partitionKeyGroupName}\", method = RequestMethod.GET) @Secured(SecurityFunctions.FN_EXPECTED_PARTITION_VALUES_GET) public ExpectedPartitionValuesInformation getExpectedPartitionValues(@PathVariable(\"partitionKeyGroupName\") String partitionKeyGroupName,\n        @RequestParam(value = \"startExpectedPartitionValue\", required = false) String startExpectedPartitionValue,\n        @RequestParam(value = \"endExpectedPartitionValue\", required = false) String endExpectedPartitionValue)", "class_method_signature": "ExpectedPartitionValueRestController.getExpectedPartitionValues(@PathVariable(\"partitionKeyGroupName\") String partitionKeyGroupName,\n        @RequestParam(value = \"startExpectedPartitionValue\", required = false) String startExpectedPartitionValue,\n        @RequestParam(value = \"endExpectedPartitionValue\", required = false) String endExpectedPartitionValue)", "testcase": false, "constructor": false, "invocations": ["setPartitionKeyGroupName", "setStartPartitionValue", "setEndPartitionValue", "getExpectedPartitionValues"]}, "repository": {"repo_id": 42949039, "url": "https://github.com/FINRAOS/herd", "language": "Java", "is_fork": false, "fork_count": 36, "stargazer_count": 120, "size": 205797, "license": "licensed"}}