{"test_class": {"identifier": "BusinessObjectFormatExternalInterfaceServiceImplTest", "superclass": "", "interfaces": "", "fields": [{"original_string": "@Rule\n    public ExpectedException expectedException = ExpectedException.none();", "modifier": "@Rule\n    public", "type": "ExpectedException", "declarator": "expectedException = ExpectedException.none()", "var_name": "expectedException"}, {"original_string": "@Mock\n    private BusinessObjectFormatDaoHelper businessObjectFormatDaoHelper;", "modifier": "@Mock\n    private", "type": "BusinessObjectFormatDaoHelper", "declarator": "businessObjectFormatDaoHelper", "var_name": "businessObjectFormatDaoHelper"}, {"original_string": "@Mock\n    private BusinessObjectFormatExternalInterfaceDao businessObjectFormatExternalInterfaceDao;", "modifier": "@Mock\n    private", "type": "BusinessObjectFormatExternalInterfaceDao", "declarator": "businessObjectFormatExternalInterfaceDao", "var_name": "businessObjectFormatExternalInterfaceDao"}, {"original_string": "@Mock\n    private BusinessObjectFormatExternalInterfaceDaoHelper businessObjectFormatExternalInterfaceDaoHelper;", "modifier": "@Mock\n    private", "type": "BusinessObjectFormatExternalInterfaceDaoHelper", "declarator": "businessObjectFormatExternalInterfaceDaoHelper", "var_name": "businessObjectFormatExternalInterfaceDaoHelper"}, {"original_string": "@Mock\n    private BusinessObjectFormatExternalInterfaceHelper businessObjectFormatExternalInterfaceHelper;", "modifier": "@Mock\n    private", "type": "BusinessObjectFormatExternalInterfaceHelper", "declarator": "businessObjectFormatExternalInterfaceHelper", "var_name": "businessObjectFormatExternalInterfaceHelper"}, {"original_string": "@InjectMocks\n    private BusinessObjectFormatExternalInterfaceServiceImpl businessObjectFormatExternalInterfaceService;", "modifier": "@InjectMocks\n    private", "type": "BusinessObjectFormatExternalInterfaceServiceImpl", "declarator": "businessObjectFormatExternalInterfaceService", "var_name": "businessObjectFormatExternalInterfaceService"}, {"original_string": "@Mock\n    private ExternalInterfaceDaoHelper externalInterfaceDaoHelper;", "modifier": "@Mock\n    private", "type": "ExternalInterfaceDaoHelper", "declarator": "externalInterfaceDaoHelper", "var_name": "externalInterfaceDaoHelper"}], "file": "herd-code/herd-service/src/test/java/org/finra/herd/service/impl/BusinessObjectFormatExternalInterfaceServiceImplTest.java"}, "test_case": {"identifier": "testGetBusinessObjectFormatExternalInterface", "parameters": "()", "modifiers": "@Test public", "return": "void", "body": "@Test\n    public void testGetBusinessObjectFormatExternalInterface()\n    {\n        // Create a business object format to external interface mapping key.\n        BusinessObjectFormatExternalInterfaceKey businessObjectFormatExternalInterfaceKey =\n            new BusinessObjectFormatExternalInterfaceKey(NAMESPACE, BDEF_NAME, FORMAT_USAGE_CODE, FORMAT_FILE_TYPE_CODE, EXTERNAL_INTERFACE);\n\n        // Create a business object format to external interface mapping.\n        BusinessObjectFormatExternalInterface businessObjectFormatExternalInterface =\n            new BusinessObjectFormatExternalInterface(ID, businessObjectFormatExternalInterfaceKey);\n\n        // Create a business object format to external interface mapping entity.\n        BusinessObjectFormatExternalInterfaceEntity businessObjectFormatExternalInterfaceEntity = new BusinessObjectFormatExternalInterfaceEntity();\n\n        // Mock the external calls.\n        when(businessObjectFormatExternalInterfaceDaoHelper.getBusinessObjectFormatExternalInterfaceEntity(businessObjectFormatExternalInterfaceKey))\n            .thenReturn(businessObjectFormatExternalInterfaceEntity);\n        when(businessObjectFormatExternalInterfaceHelper.createBusinessObjectFormatExternalInterfaceFromEntity(businessObjectFormatExternalInterfaceEntity))\n            .thenReturn(businessObjectFormatExternalInterface);\n\n        // Call the method under test.\n        BusinessObjectFormatExternalInterface result =\n            businessObjectFormatExternalInterfaceService.getBusinessObjectFormatExternalInterface(businessObjectFormatExternalInterfaceKey);\n\n        // Validate the results.\n        assertEquals(businessObjectFormatExternalInterface, result);\n\n        // Verify the external calls.\n        verify(businessObjectFormatExternalInterfaceHelper).validateAndTrimBusinessObjectFormatExternalInterfaceKey(businessObjectFormatExternalInterfaceKey);\n        verify(businessObjectFormatExternalInterfaceDaoHelper).getBusinessObjectFormatExternalInterfaceEntity(businessObjectFormatExternalInterfaceKey);\n        verify(businessObjectFormatExternalInterfaceHelper).createBusinessObjectFormatExternalInterfaceFromEntity(businessObjectFormatExternalInterfaceEntity);\n        verifyNoMoreInteractionsHelper();\n    }", "signature": "void testGetBusinessObjectFormatExternalInterface()", "full_signature": "@Test public void testGetBusinessObjectFormatExternalInterface()", "class_method_signature": "BusinessObjectFormatExternalInterfaceServiceImplTest.testGetBusinessObjectFormatExternalInterface()", "testcase": true, "constructor": false, "invocations": ["thenReturn", "when", "getBusinessObjectFormatExternalInterfaceEntity", "thenReturn", "when", "createBusinessObjectFormatExternalInterfaceFromEntity", "getBusinessObjectFormatExternalInterface", "assertEquals", "validateAndTrimBusinessObjectFormatExternalInterfaceKey", "verify", "getBusinessObjectFormatExternalInterfaceEntity", "verify", "createBusinessObjectFormatExternalInterfaceFromEntity", "verify", "verifyNoMoreInteractionsHelper"]}, "focal_class": {"identifier": "BusinessObjectFormatExternalInterfaceServiceImpl", "superclass": "", "interfaces": "implements BusinessObjectFormatExternalInterfaceService", "fields": [{"original_string": "@Autowired\n    private BusinessObjectFormatDaoHelper businessObjectFormatDaoHelper;", "modifier": "@Autowired\n    private", "type": "BusinessObjectFormatDaoHelper", "declarator": "businessObjectFormatDaoHelper", "var_name": "businessObjectFormatDaoHelper"}, {"original_string": "@Autowired\n    private BusinessObjectFormatExternalInterfaceDao businessObjectFormatExternalInterfaceDao;", "modifier": "@Autowired\n    private", "type": "BusinessObjectFormatExternalInterfaceDao", "declarator": "businessObjectFormatExternalInterfaceDao", "var_name": "businessObjectFormatExternalInterfaceDao"}, {"original_string": "@Autowired\n    private BusinessObjectFormatExternalInterfaceDaoHelper businessObjectFormatExternalInterfaceDaoHelper;", "modifier": "@Autowired\n    private", "type": "BusinessObjectFormatExternalInterfaceDaoHelper", "declarator": "businessObjectFormatExternalInterfaceDaoHelper", "var_name": "businessObjectFormatExternalInterfaceDaoHelper"}, {"original_string": "@Autowired\n    private BusinessObjectFormatExternalInterfaceHelper businessObjectFormatExternalInterfaceHelper;", "modifier": "@Autowired\n    private", "type": "BusinessObjectFormatExternalInterfaceHelper", "declarator": "businessObjectFormatExternalInterfaceHelper", "var_name": "businessObjectFormatExternalInterfaceHelper"}, {"original_string": "@Autowired\n    private ExternalInterfaceDaoHelper externalInterfaceDaoHelper;", "modifier": "@Autowired\n    private", "type": "ExternalInterfaceDaoHelper", "declarator": "externalInterfaceDaoHelper", "var_name": "externalInterfaceDaoHelper"}], "methods": [{"identifier": "createBusinessObjectFormatExternalInterface", "parameters": "(\n        BusinessObjectFormatExternalInterfaceCreateRequest businessObjectFormatExternalInterfaceCreateRequest)", "modifiers": "@Override public", "return": "BusinessObjectFormatExternalInterface", "signature": "BusinessObjectFormatExternalInterface createBusinessObjectFormatExternalInterface(\n        BusinessObjectFormatExternalInterfaceCreateRequest businessObjectFormatExternalInterfaceCreateRequest)", "full_signature": "@Override public BusinessObjectFormatExternalInterface createBusinessObjectFormatExternalInterface(\n        BusinessObjectFormatExternalInterfaceCreateRequest businessObjectFormatExternalInterfaceCreateRequest)", "class_method_signature": "BusinessObjectFormatExternalInterfaceServiceImpl.createBusinessObjectFormatExternalInterface(\n        BusinessObjectFormatExternalInterfaceCreateRequest businessObjectFormatExternalInterfaceCreateRequest)", "testcase": false, "constructor": false}, {"identifier": "deleteBusinessObjectFormatExternalInterface", "parameters": "(\n        BusinessObjectFormatExternalInterfaceKey businessObjectFormatExternalInterfaceKey)", "modifiers": "@Override public", "return": "BusinessObjectFormatExternalInterface", "signature": "BusinessObjectFormatExternalInterface deleteBusinessObjectFormatExternalInterface(\n        BusinessObjectFormatExternalInterfaceKey businessObjectFormatExternalInterfaceKey)", "full_signature": "@Override public BusinessObjectFormatExternalInterface deleteBusinessObjectFormatExternalInterface(\n        BusinessObjectFormatExternalInterfaceKey businessObjectFormatExternalInterfaceKey)", "class_method_signature": "BusinessObjectFormatExternalInterfaceServiceImpl.deleteBusinessObjectFormatExternalInterface(\n        BusinessObjectFormatExternalInterfaceKey businessObjectFormatExternalInterfaceKey)", "testcase": false, "constructor": false}, {"identifier": "getBusinessObjectFormatExternalInterface", "parameters": "(\n        BusinessObjectFormatExternalInterfaceKey businessObjectFormatExternalInterfaceKey)", "modifiers": "@Override public", "return": "BusinessObjectFormatExternalInterface", "signature": "BusinessObjectFormatExternalInterface getBusinessObjectFormatExternalInterface(\n        BusinessObjectFormatExternalInterfaceKey businessObjectFormatExternalInterfaceKey)", "full_signature": "@Override public BusinessObjectFormatExternalInterface getBusinessObjectFormatExternalInterface(\n        BusinessObjectFormatExternalInterfaceKey businessObjectFormatExternalInterfaceKey)", "class_method_signature": "BusinessObjectFormatExternalInterfaceServiceImpl.getBusinessObjectFormatExternalInterface(\n        BusinessObjectFormatExternalInterfaceKey businessObjectFormatExternalInterfaceKey)", "testcase": false, "constructor": false}], "file": "herd-code/herd-service/src/main/java/org/finra/herd/service/impl/BusinessObjectFormatExternalInterfaceServiceImpl.java"}, "focal_method": {"identifier": "getBusinessObjectFormatExternalInterface", "parameters": "(\n        BusinessObjectFormatExternalInterfaceKey businessObjectFormatExternalInterfaceKey)", "modifiers": "@Override public", "return": "BusinessObjectFormatExternalInterface", "body": "@Override\n    public BusinessObjectFormatExternalInterface getBusinessObjectFormatExternalInterface(\n        BusinessObjectFormatExternalInterfaceKey businessObjectFormatExternalInterfaceKey)\n    {\n        // Validate and trim the business object format to external interface mapping key.\n        businessObjectFormatExternalInterfaceHelper.validateAndTrimBusinessObjectFormatExternalInterfaceKey(businessObjectFormatExternalInterfaceKey);\n\n        // Retrieve and ensure that a business object format to external interface mapping with the specified key exists.\n        BusinessObjectFormatExternalInterfaceEntity businessObjectFormatExternalInterfaceEntity =\n            businessObjectFormatExternalInterfaceDaoHelper.getBusinessObjectFormatExternalInterfaceEntity(businessObjectFormatExternalInterfaceKey);\n\n        // Create a business object format to external interface mapping object from the entity and return it.\n        return businessObjectFormatExternalInterfaceHelper.createBusinessObjectFormatExternalInterfaceFromEntity(businessObjectFormatExternalInterfaceEntity);\n    }", "signature": "BusinessObjectFormatExternalInterface getBusinessObjectFormatExternalInterface(\n        BusinessObjectFormatExternalInterfaceKey businessObjectFormatExternalInterfaceKey)", "full_signature": "@Override public BusinessObjectFormatExternalInterface getBusinessObjectFormatExternalInterface(\n        BusinessObjectFormatExternalInterfaceKey businessObjectFormatExternalInterfaceKey)", "class_method_signature": "BusinessObjectFormatExternalInterfaceServiceImpl.getBusinessObjectFormatExternalInterface(\n        BusinessObjectFormatExternalInterfaceKey businessObjectFormatExternalInterfaceKey)", "testcase": false, "constructor": false, "invocations": ["validateAndTrimBusinessObjectFormatExternalInterfaceKey", "getBusinessObjectFormatExternalInterfaceEntity", "createBusinessObjectFormatExternalInterfaceFromEntity"]}, "repository": {"repo_id": 42949039, "url": "https://github.com/FINRAOS/herd", "language": "Java", "is_fork": false, "fork_count": 36, "stargazer_count": 120, "size": 205797, "license": "licensed"}}