{"test_class": {"identifier": "StorageUnitDaoHelperTest", "superclass": "", "interfaces": "", "fields": [{"original_string": "@Mock\n    private BusinessObjectDataHelper businessObjectDataHelper;", "modifier": "@Mock\n    private", "type": "BusinessObjectDataHelper", "declarator": "businessObjectDataHelper", "var_name": "businessObjectDataHelper"}, {"original_string": "@Mock\n    private MessageNotificationEventService messageNotificationEventService;", "modifier": "@Mock\n    private", "type": "MessageNotificationEventService", "declarator": "messageNotificationEventService", "var_name": "messageNotificationEventService"}, {"original_string": "@Mock\n    private StorageDao storageDao;", "modifier": "@Mock\n    private", "type": "StorageDao", "declarator": "storageDao", "var_name": "storageDao"}, {"original_string": "@Mock\n    private StorageUnitDao storageUnitDao;", "modifier": "@Mock\n    private", "type": "StorageUnitDao", "declarator": "storageUnitDao", "var_name": "storageUnitDao"}, {"original_string": "@InjectMocks\n    private StorageUnitDaoHelper storageUnitDaoHelper;", "modifier": "@InjectMocks\n    private", "type": "StorageUnitDaoHelper", "declarator": "storageUnitDaoHelper", "var_name": "storageUnitDaoHelper"}, {"original_string": "@Mock\n    private StorageUnitStatusDaoHelper storageUnitStatusDaoHelper;", "modifier": "@Mock\n    private", "type": "StorageUnitStatusDaoHelper", "declarator": "storageUnitStatusDaoHelper", "var_name": "storageUnitStatusDaoHelper"}], "file": "herd-code/herd-service/src/test/java/org/finra/herd/service/helper/StorageUnitDaoHelperTest.java"}, "test_case": {"identifier": "testGetStorageUnitEntityByKey", "parameters": "()", "modifiers": "@Test public", "return": "void", "body": "@Test\n    public void testGetStorageUnitEntityByKey()\n    {\n        // Create a storage unit key.\n        BusinessObjectDataStorageUnitKey businessObjectDataStorageUnitKey =\n            new BusinessObjectDataStorageUnitKey(BDEF_NAMESPACE, BDEF_NAME, FORMAT_USAGE_CODE, FORMAT_FILE_TYPE_CODE, FORMAT_VERSION, PARTITION_VALUE,\n                SUBPARTITION_VALUES, DATA_VERSION, STORAGE_NAME);\n\n        // Create a storage unit entity.\n        StorageUnitEntity storageUnitEntity = new StorageUnitEntity();\n\n        // Mock the external calls.\n        when(storageUnitDao.getStorageUnitByKey(businessObjectDataStorageUnitKey)).thenReturn(storageUnitEntity);\n\n        // Call the method under test.\n        StorageUnitEntity result = storageUnitDaoHelper.getStorageUnitEntityByKey(businessObjectDataStorageUnitKey);\n\n        // Validate the results.\n        assertEquals(storageUnitEntity, result);\n\n        // Verify the external calls.\n        verify(storageUnitDao).getStorageUnitByKey(businessObjectDataStorageUnitKey);\n        verifyNoMoreInteractionsHelper();\n    }", "signature": "void testGetStorageUnitEntityByKey()", "full_signature": "@Test public void testGetStorageUnitEntityByKey()", "class_method_signature": "StorageUnitDaoHelperTest.testGetStorageUnitEntityByKey()", "testcase": true, "constructor": false, "invocations": ["thenReturn", "when", "getStorageUnitByKey", "getStorageUnitEntityByKey", "assertEquals", "getStorageUnitByKey", "verify", "verifyNoMoreInteractionsHelper"]}, "focal_class": {"identifier": "StorageUnitDaoHelper", "superclass": "", "interfaces": "", "fields": [{"original_string": "@Autowired\n    private BusinessObjectDataHelper businessObjectDataHelper;", "modifier": "@Autowired\n    private", "type": "BusinessObjectDataHelper", "declarator": "businessObjectDataHelper", "var_name": "businessObjectDataHelper"}, {"original_string": "@Autowired\n    private BusinessObjectFormatHelper businessObjectFormatHelper;", "modifier": "@Autowired\n    private", "type": "BusinessObjectFormatHelper", "declarator": "businessObjectFormatHelper", "var_name": "businessObjectFormatHelper"}, {"original_string": "@Autowired\n    private MessageNotificationEventService messageNotificationEventService;", "modifier": "@Autowired\n    private", "type": "MessageNotificationEventService", "declarator": "messageNotificationEventService", "var_name": "messageNotificationEventService"}, {"original_string": "@Autowired\n    private StorageDao storageDao;", "modifier": "@Autowired\n    private", "type": "StorageDao", "declarator": "storageDao", "var_name": "storageDao"}, {"original_string": "@Autowired\n    private StorageUnitDao storageUnitDao;", "modifier": "@Autowired\n    private", "type": "StorageUnitDao", "declarator": "storageUnitDao", "var_name": "storageUnitDao"}, {"original_string": "@Autowired\n    private StorageUnitStatusDaoHelper storageUnitStatusDaoHelper;", "modifier": "@Autowired\n    private", "type": "StorageUnitStatusDaoHelper", "declarator": "storageUnitStatusDaoHelper", "var_name": "storageUnitStatusDaoHelper"}], "methods": [{"identifier": "findExplicitlyRegisteredSubPartitionInStorageForBusinessObjectData", "parameters": "(StorageEntity storageEntity,\n        BusinessObjectFormatEntity businessObjectFormatEntity, BusinessObjectFormat businessObjectFormat, BusinessObjectDataKey businessObjectDataKey)", "modifiers": "public", "return": "StorageUnitEntity", "signature": "StorageUnitEntity findExplicitlyRegisteredSubPartitionInStorageForBusinessObjectData(StorageEntity storageEntity,\n        BusinessObjectFormatEntity businessObjectFormatEntity, BusinessObjectFormat businessObjectFormat, BusinessObjectDataKey businessObjectDataKey)", "full_signature": "public StorageUnitEntity findExplicitlyRegisteredSubPartitionInStorageForBusinessObjectData(StorageEntity storageEntity,\n        BusinessObjectFormatEntity businessObjectFormatEntity, BusinessObjectFormat businessObjectFormat, BusinessObjectDataKey businessObjectDataKey)", "class_method_signature": "StorageUnitDaoHelper.findExplicitlyRegisteredSubPartitionInStorageForBusinessObjectData(StorageEntity storageEntity,\n        BusinessObjectFormatEntity businessObjectFormatEntity, BusinessObjectFormat businessObjectFormat, BusinessObjectDataKey businessObjectDataKey)", "testcase": false, "constructor": false}, {"identifier": "getStorageUnitEntity", "parameters": "(String storageName, BusinessObjectDataEntity businessObjectDataEntity)", "modifiers": "public", "return": "StorageUnitEntity", "signature": "StorageUnitEntity getStorageUnitEntity(String storageName, BusinessObjectDataEntity businessObjectDataEntity)", "full_signature": "public StorageUnitEntity getStorageUnitEntity(String storageName, BusinessObjectDataEntity businessObjectDataEntity)", "class_method_signature": "StorageUnitDaoHelper.getStorageUnitEntity(String storageName, BusinessObjectDataEntity businessObjectDataEntity)", "testcase": false, "constructor": false}, {"identifier": "getStorageUnitEntityByBusinessObjectDataAndStorage", "parameters": "(BusinessObjectDataEntity businessObjectDataEntity, StorageEntity storageEntity)", "modifiers": "public", "return": "StorageUnitEntity", "signature": "StorageUnitEntity getStorageUnitEntityByBusinessObjectDataAndStorage(BusinessObjectDataEntity businessObjectDataEntity, StorageEntity storageEntity)", "full_signature": "public StorageUnitEntity getStorageUnitEntityByBusinessObjectDataAndStorage(BusinessObjectDataEntity businessObjectDataEntity, StorageEntity storageEntity)", "class_method_signature": "StorageUnitDaoHelper.getStorageUnitEntityByBusinessObjectDataAndStorage(BusinessObjectDataEntity businessObjectDataEntity, StorageEntity storageEntity)", "testcase": false, "constructor": false}, {"identifier": "getStorageUnitEntityByKey", "parameters": "(BusinessObjectDataStorageUnitKey businessObjectDataStorageUnitKey)", "modifiers": "public", "return": "StorageUnitEntity", "signature": "StorageUnitEntity getStorageUnitEntityByKey(BusinessObjectDataStorageUnitKey businessObjectDataStorageUnitKey)", "full_signature": "public StorageUnitEntity getStorageUnitEntityByKey(BusinessObjectDataStorageUnitKey businessObjectDataStorageUnitKey)", "class_method_signature": "StorageUnitDaoHelper.getStorageUnitEntityByKey(BusinessObjectDataStorageUnitKey businessObjectDataStorageUnitKey)", "testcase": false, "constructor": false}, {"identifier": "setStorageUnitStatus", "parameters": "(StorageUnitEntity storageUnitEntity, StorageUnitStatusEntity storageUnitStatusEntity)", "modifiers": "public", "return": "void", "signature": "void setStorageUnitStatus(StorageUnitEntity storageUnitEntity, StorageUnitStatusEntity storageUnitStatusEntity)", "full_signature": "public void setStorageUnitStatus(StorageUnitEntity storageUnitEntity, StorageUnitStatusEntity storageUnitStatusEntity)", "class_method_signature": "StorageUnitDaoHelper.setStorageUnitStatus(StorageUnitEntity storageUnitEntity, StorageUnitStatusEntity storageUnitStatusEntity)", "testcase": false, "constructor": false}, {"identifier": "updateStorageUnitStatus", "parameters": "(StorageUnitEntity storageUnitEntity, String storageUnitStatus, String reason)", "modifiers": "public", "return": "void", "signature": "void updateStorageUnitStatus(StorageUnitEntity storageUnitEntity, String storageUnitStatus, String reason)", "full_signature": "public void updateStorageUnitStatus(StorageUnitEntity storageUnitEntity, String storageUnitStatus, String reason)", "class_method_signature": "StorageUnitDaoHelper.updateStorageUnitStatus(StorageUnitEntity storageUnitEntity, String storageUnitStatus, String reason)", "testcase": false, "constructor": false}, {"identifier": "updateStorageUnitStatus", "parameters": "(StorageUnitEntity storageUnitEntity, StorageUnitStatusEntity storageUnitStatusEntity, String reason)", "modifiers": "public", "return": "void", "signature": "void updateStorageUnitStatus(StorageUnitEntity storageUnitEntity, StorageUnitStatusEntity storageUnitStatusEntity, String reason)", "full_signature": "public void updateStorageUnitStatus(StorageUnitEntity storageUnitEntity, StorageUnitStatusEntity storageUnitStatusEntity, String reason)", "class_method_signature": "StorageUnitDaoHelper.updateStorageUnitStatus(StorageUnitEntity storageUnitEntity, StorageUnitStatusEntity storageUnitStatusEntity, String reason)", "testcase": false, "constructor": false}, {"identifier": "validateNoExplicitlyRegisteredSubPartitionInStorageForBusinessObjectData", "parameters": "(StorageEntity storageEntity,\n        BusinessObjectFormatEntity businessObjectFormatEntity, BusinessObjectDataKey businessObjectDataKey, String s3KeyPrefix)", "modifiers": "public", "return": "void", "signature": "void validateNoExplicitlyRegisteredSubPartitionInStorageForBusinessObjectData(StorageEntity storageEntity,\n        BusinessObjectFormatEntity businessObjectFormatEntity, BusinessObjectDataKey businessObjectDataKey, String s3KeyPrefix)", "full_signature": "public void validateNoExplicitlyRegisteredSubPartitionInStorageForBusinessObjectData(StorageEntity storageEntity,\n        BusinessObjectFormatEntity businessObjectFormatEntity, BusinessObjectDataKey businessObjectDataKey, String s3KeyPrefix)", "class_method_signature": "StorageUnitDaoHelper.validateNoExplicitlyRegisteredSubPartitionInStorageForBusinessObjectData(StorageEntity storageEntity,\n        BusinessObjectFormatEntity businessObjectFormatEntity, BusinessObjectDataKey businessObjectDataKey, String s3KeyPrefix)", "testcase": false, "constructor": false}], "file": "herd-code/herd-service/src/main/java/org/finra/herd/service/helper/StorageUnitDaoHelper.java"}, "focal_method": {"identifier": "getStorageUnitEntityByKey", "parameters": "(BusinessObjectDataStorageUnitKey businessObjectDataStorageUnitKey)", "modifiers": "public", "return": "StorageUnitEntity", "body": "public StorageUnitEntity getStorageUnitEntityByKey(BusinessObjectDataStorageUnitKey businessObjectDataStorageUnitKey)\n    {\n        StorageUnitEntity storageUnitEntity = storageUnitDao.getStorageUnitByKey(businessObjectDataStorageUnitKey);\n\n        if (storageUnitEntity == null)\n        {\n            throw new ObjectNotFoundException(String.format(\n                \"Business object data storage unit {namespace: \\\"%s\\\", businessObjectDefinitionName: \\\"%s\\\", businessObjectFormatUsage: \\\"%s\\\", \" +\n                    \"businessObjectFormatFileType: \\\"%s\\\", businessObjectFormatVersion: %d, businessObjectDataPartitionValue: \\\"%s\\\", \" +\n                    \"businessObjectDataSubPartitionValues: \\\"%s\\\", businessObjectDataVersion: %d, storageName: \\\"%s\\\"} doesn't exist.\",\n                businessObjectDataStorageUnitKey.getNamespace(), businessObjectDataStorageUnitKey.getBusinessObjectDefinitionName(),\n                businessObjectDataStorageUnitKey.getBusinessObjectFormatUsage(), businessObjectDataStorageUnitKey.getBusinessObjectFormatFileType(),\n                businessObjectDataStorageUnitKey.getBusinessObjectFormatVersion(), businessObjectDataStorageUnitKey.getPartitionValue(),\n                CollectionUtils.isEmpty(businessObjectDataStorageUnitKey.getSubPartitionValues()) ? \"\" :\n                    StringUtils.join(businessObjectDataStorageUnitKey.getSubPartitionValues(), \",\"),\n                businessObjectDataStorageUnitKey.getBusinessObjectDataVersion(), businessObjectDataStorageUnitKey.getStorageName()));\n        }\n\n        return storageUnitEntity;\n    }", "signature": "StorageUnitEntity getStorageUnitEntityByKey(BusinessObjectDataStorageUnitKey businessObjectDataStorageUnitKey)", "full_signature": "public StorageUnitEntity getStorageUnitEntityByKey(BusinessObjectDataStorageUnitKey businessObjectDataStorageUnitKey)", "class_method_signature": "StorageUnitDaoHelper.getStorageUnitEntityByKey(BusinessObjectDataStorageUnitKey businessObjectDataStorageUnitKey)", "testcase": false, "constructor": false, "invocations": ["getStorageUnitByKey", "format", "getNamespace", "getBusinessObjectDefinitionName", "getBusinessObjectFormatUsage", "getBusinessObjectFormatFileType", "getBusinessObjectFormatVersion", "getPartitionValue", "isEmpty", "getSubPartitionValues", "join", "getSubPartitionValues", "getBusinessObjectDataVersion", "getStorageName"]}, "repository": {"repo_id": 42949039, "url": "https://github.com/FINRAOS/herd", "language": "Java", "is_fork": false, "fork_count": 36, "stargazer_count": 120, "size": 205797, "license": "licensed"}}