{"test_class": {"identifier": "BusinessObjectFormatExternalInterfaceHelperTest", "superclass": "", "interfaces": "", "fields": [{"original_string": "@Rule\n    public ExpectedException expectedException = ExpectedException.none();", "modifier": "@Rule\n    public", "type": "ExpectedException", "declarator": "expectedException = ExpectedException.none()", "var_name": "expectedException"}, {"original_string": "@Mock\n    private AlternateKeyHelper alternateKeyHelper;", "modifier": "@Mock\n    private", "type": "AlternateKeyHelper", "declarator": "alternateKeyHelper", "var_name": "alternateKeyHelper"}, {"original_string": "@InjectMocks\n    private BusinessObjectFormatExternalInterfaceHelper businessObjectFormatExternalInterfaceHelper;", "modifier": "@InjectMocks\n    private", "type": "BusinessObjectFormatExternalInterfaceHelper", "declarator": "businessObjectFormatExternalInterfaceHelper", "var_name": "businessObjectFormatExternalInterfaceHelper"}], "file": "herd-code/herd-service/src/test/java/org/finra/herd/service/helper/BusinessObjectFormatExternalInterfaceHelperTest.java"}, "test_case": {"identifier": "testValidateAndTrimBusinessObjectFormatExternalInterfaceKey", "parameters": "()", "modifiers": "@Test public", "return": "void", "body": "@Test\n    public void testValidateAndTrimBusinessObjectFormatExternalInterfaceKey()\n    {\n        // Create a business object format to external interface mapping key.\n        BusinessObjectFormatExternalInterfaceKey businessObjectFormatExternalInterfaceKey =\n            new BusinessObjectFormatExternalInterfaceKey(NAMESPACE, BDEF_NAME, FORMAT_USAGE_CODE, FORMAT_FILE_TYPE_CODE, EXTERNAL_INTERFACE);\n\n        // Mock the external calls.\n        when(alternateKeyHelper.validateStringParameter(\"namespace\", NAMESPACE)).thenReturn(NAMESPACE_2);\n        when(alternateKeyHelper.validateStringParameter(\"business object definition name\", BDEF_NAME)).thenReturn(BDEF_NAME_2);\n        when(alternateKeyHelper.validateStringParameter(\"business object format usage\", FORMAT_USAGE_CODE)).thenReturn(FORMAT_USAGE_CODE_2);\n        when(alternateKeyHelper.validateStringParameter(\"business object format file type\", FORMAT_FILE_TYPE_CODE)).thenReturn(FORMAT_FILE_TYPE_CODE_2);\n        when(alternateKeyHelper.validateStringParameter(\"An\", \"external interface name\", EXTERNAL_INTERFACE)).thenReturn(EXTERNAL_INTERFACE_2);\n\n        // Call the method under test.\n        businessObjectFormatExternalInterfaceHelper.validateAndTrimBusinessObjectFormatExternalInterfaceKey(businessObjectFormatExternalInterfaceKey);\n\n        // Validate the results.\n        assertEquals(new BusinessObjectFormatExternalInterfaceKey(NAMESPACE_2, BDEF_NAME_2, FORMAT_USAGE_CODE_2, FORMAT_FILE_TYPE_CODE_2, EXTERNAL_INTERFACE_2),\n            businessObjectFormatExternalInterfaceKey);\n\n        // Verify the external calls.\n        verify(alternateKeyHelper).validateStringParameter(\"namespace\", NAMESPACE);\n        verify(alternateKeyHelper).validateStringParameter(\"business object definition name\", BDEF_NAME);\n        verify(alternateKeyHelper).validateStringParameter(\"business object format usage\", FORMAT_USAGE_CODE);\n        verify(alternateKeyHelper).validateStringParameter(\"business object format file type\", FORMAT_FILE_TYPE_CODE);\n        verify(alternateKeyHelper).validateStringParameter(\"An\", \"external interface name\", EXTERNAL_INTERFACE);\n        verifyNoMoreInteractions(alternateKeyHelper);\n    }", "signature": "void testValidateAndTrimBusinessObjectFormatExternalInterfaceKey()", "full_signature": "@Test public void testValidateAndTrimBusinessObjectFormatExternalInterfaceKey()", "class_method_signature": "BusinessObjectFormatExternalInterfaceHelperTest.testValidateAndTrimBusinessObjectFormatExternalInterfaceKey()", "testcase": true, "constructor": false, "invocations": ["thenReturn", "when", "validateStringParameter", "thenReturn", "when", "validateStringParameter", "thenReturn", "when", "validateStringParameter", "thenReturn", "when", "validateStringParameter", "thenReturn", "when", "validateStringParameter", "validateAndTrimBusinessObjectFormatExternalInterfaceKey", "assertEquals", "validateStringParameter", "verify", "validateStringParameter", "verify", "validateStringParameter", "verify", "validateStringParameter", "verify", "validateStringParameter", "verify", "verifyNoMoreInteractions"]}, "focal_class": {"identifier": "BusinessObjectFormatExternalInterfaceHelper", "superclass": "", "interfaces": "", "fields": [{"original_string": "@Autowired\n    private AlternateKeyHelper alternateKeyHelper;", "modifier": "@Autowired\n    private", "type": "AlternateKeyHelper", "declarator": "alternateKeyHelper", "var_name": "alternateKeyHelper"}], "methods": [{"identifier": "createBusinessObjectFormatExternalInterfaceFromEntity", "parameters": "(\n        BusinessObjectFormatExternalInterfaceEntity businessObjectFormatExternalInterfaceEntity)", "modifiers": "public", "return": "BusinessObjectFormatExternalInterface", "signature": "BusinessObjectFormatExternalInterface createBusinessObjectFormatExternalInterfaceFromEntity(\n        BusinessObjectFormatExternalInterfaceEntity businessObjectFormatExternalInterfaceEntity)", "full_signature": "public BusinessObjectFormatExternalInterface createBusinessObjectFormatExternalInterfaceFromEntity(\n        BusinessObjectFormatExternalInterfaceEntity businessObjectFormatExternalInterfaceEntity)", "class_method_signature": "BusinessObjectFormatExternalInterfaceHelper.createBusinessObjectFormatExternalInterfaceFromEntity(\n        BusinessObjectFormatExternalInterfaceEntity businessObjectFormatExternalInterfaceEntity)", "testcase": false, "constructor": false}, {"identifier": "createBusinessObjectFormatExternalInterfaceKeyFromEntity", "parameters": "(\n        BusinessObjectFormatExternalInterfaceEntity businessObjectFormatExternalInterfaceEntity)", "modifiers": "public", "return": "BusinessObjectFormatExternalInterfaceKey", "signature": "BusinessObjectFormatExternalInterfaceKey createBusinessObjectFormatExternalInterfaceKeyFromEntity(\n        BusinessObjectFormatExternalInterfaceEntity businessObjectFormatExternalInterfaceEntity)", "full_signature": "public BusinessObjectFormatExternalInterfaceKey createBusinessObjectFormatExternalInterfaceKeyFromEntity(\n        BusinessObjectFormatExternalInterfaceEntity businessObjectFormatExternalInterfaceEntity)", "class_method_signature": "BusinessObjectFormatExternalInterfaceHelper.createBusinessObjectFormatExternalInterfaceKeyFromEntity(\n        BusinessObjectFormatExternalInterfaceEntity businessObjectFormatExternalInterfaceEntity)", "testcase": false, "constructor": false}, {"identifier": "validateAndTrimBusinessObjectFormatExternalInterfaceCreateRequest", "parameters": "(\n        BusinessObjectFormatExternalInterfaceCreateRequest businessObjectFormatExternalInterfaceCreateRequest)", "modifiers": "public", "return": "void", "signature": "void validateAndTrimBusinessObjectFormatExternalInterfaceCreateRequest(\n        BusinessObjectFormatExternalInterfaceCreateRequest businessObjectFormatExternalInterfaceCreateRequest)", "full_signature": "public void validateAndTrimBusinessObjectFormatExternalInterfaceCreateRequest(\n        BusinessObjectFormatExternalInterfaceCreateRequest businessObjectFormatExternalInterfaceCreateRequest)", "class_method_signature": "BusinessObjectFormatExternalInterfaceHelper.validateAndTrimBusinessObjectFormatExternalInterfaceCreateRequest(\n        BusinessObjectFormatExternalInterfaceCreateRequest businessObjectFormatExternalInterfaceCreateRequest)", "testcase": false, "constructor": false}, {"identifier": "validateAndTrimBusinessObjectFormatExternalInterfaceKey", "parameters": "(BusinessObjectFormatExternalInterfaceKey businessObjectFormatExternalInterfaceKey)", "modifiers": "public", "return": "void", "signature": "void validateAndTrimBusinessObjectFormatExternalInterfaceKey(BusinessObjectFormatExternalInterfaceKey businessObjectFormatExternalInterfaceKey)", "full_signature": "public void validateAndTrimBusinessObjectFormatExternalInterfaceKey(BusinessObjectFormatExternalInterfaceKey businessObjectFormatExternalInterfaceKey)", "class_method_signature": "BusinessObjectFormatExternalInterfaceHelper.validateAndTrimBusinessObjectFormatExternalInterfaceKey(BusinessObjectFormatExternalInterfaceKey businessObjectFormatExternalInterfaceKey)", "testcase": false, "constructor": false}], "file": "herd-code/herd-service/src/main/java/org/finra/herd/service/helper/BusinessObjectFormatExternalInterfaceHelper.java"}, "focal_method": {"identifier": "validateAndTrimBusinessObjectFormatExternalInterfaceKey", "parameters": "(BusinessObjectFormatExternalInterfaceKey businessObjectFormatExternalInterfaceKey)", "modifiers": "public", "return": "void", "body": "public void validateAndTrimBusinessObjectFormatExternalInterfaceKey(BusinessObjectFormatExternalInterfaceKey businessObjectFormatExternalInterfaceKey)\n    {\n        Assert.notNull(businessObjectFormatExternalInterfaceKey, \"A business object format to external interface mapping key must be specified.\");\n        businessObjectFormatExternalInterfaceKey\n            .setNamespace(alternateKeyHelper.validateStringParameter(\"namespace\", businessObjectFormatExternalInterfaceKey.getNamespace()));\n        businessObjectFormatExternalInterfaceKey.setBusinessObjectDefinitionName(alternateKeyHelper\n            .validateStringParameter(\"business object definition name\", businessObjectFormatExternalInterfaceKey.getBusinessObjectDefinitionName()));\n        businessObjectFormatExternalInterfaceKey.setBusinessObjectFormatUsage(alternateKeyHelper\n            .validateStringParameter(\"business object format usage\", businessObjectFormatExternalInterfaceKey.getBusinessObjectFormatUsage()));\n        businessObjectFormatExternalInterfaceKey.setBusinessObjectFormatFileType(alternateKeyHelper\n            .validateStringParameter(\"business object format file type\", businessObjectFormatExternalInterfaceKey.getBusinessObjectFormatFileType()));\n        businessObjectFormatExternalInterfaceKey.setExternalInterfaceName(\n            alternateKeyHelper.validateStringParameter(\"An\", \"external interface name\", businessObjectFormatExternalInterfaceKey.getExternalInterfaceName()));\n    }", "signature": "void validateAndTrimBusinessObjectFormatExternalInterfaceKey(BusinessObjectFormatExternalInterfaceKey businessObjectFormatExternalInterfaceKey)", "full_signature": "public void validateAndTrimBusinessObjectFormatExternalInterfaceKey(BusinessObjectFormatExternalInterfaceKey businessObjectFormatExternalInterfaceKey)", "class_method_signature": "BusinessObjectFormatExternalInterfaceHelper.validateAndTrimBusinessObjectFormatExternalInterfaceKey(BusinessObjectFormatExternalInterfaceKey businessObjectFormatExternalInterfaceKey)", "testcase": false, "constructor": false, "invocations": ["notNull", "setNamespace", "validateStringParameter", "getNamespace", "setBusinessObjectDefinitionName", "validateStringParameter", "getBusinessObjectDefinitionName", "setBusinessObjectFormatUsage", "validateStringParameter", "getBusinessObjectFormatUsage", "setBusinessObjectFormatFileType", "validateStringParameter", "getBusinessObjectFormatFileType", "setExternalInterfaceName", "validateStringParameter", "getExternalInterfaceName"]}, "repository": {"repo_id": 42949039, "url": "https://github.com/FINRAOS/herd", "language": "Java", "is_fork": false, "fork_count": 36, "stargazer_count": 120, "size": 205797, "license": "licensed"}}