{"test_class": {"identifier": "JobDefinitionHelperTest", "superclass": "extends AbstractServiceTest", "interfaces": "", "fields": [], "file": "herd-code/herd-service/src/test/java/org/finra/herd/service/helper/JobDefinitionHelperTest.java"}, "test_case": {"identifier": "testGetActivitiJobDefinitionTemplateUsingConfiguredActivitiIdTemplate", "parameters": "()", "modifiers": "@Test public", "return": "void", "body": "@Test\n    public void testGetActivitiJobDefinitionTemplateUsingConfiguredActivitiIdTemplate() throws Exception\n    {\n        // Set up test values.\n        String testActivitiIdTemplate = \"testActivitiIdTemplate\";\n\n        // Override configuration.\n        Map<String, Object> overrideMap = new HashMap<>();\n        overrideMap.put(ConfigurationValue.ACTIVITI_JOB_DEFINITION_ID_TEMPLATE.getKey(), testActivitiIdTemplate);\n        modifyPropertySourceInEnvironment(overrideMap);\n\n        try\n        {\n            assertEquals(testActivitiIdTemplate, jobDefinitionHelper.getActivitiJobDefinitionTemplate());\n        }\n        finally\n        {\n            // Restore the property sources so we don't affect other tests.\n            restorePropertySourceInEnvironment();\n        }\n    }", "signature": "void testGetActivitiJobDefinitionTemplateUsingConfiguredActivitiIdTemplate()", "full_signature": "@Test public void testGetActivitiJobDefinitionTemplateUsingConfiguredActivitiIdTemplate()", "class_method_signature": "JobDefinitionHelperTest.testGetActivitiJobDefinitionTemplateUsingConfiguredActivitiIdTemplate()", "testcase": true, "constructor": false, "invocations": ["put", "getKey", "modifyPropertySourceInEnvironment", "assertEquals", "getActivitiJobDefinitionTemplate", "restorePropertySourceInEnvironment"]}, "focal_class": {"identifier": "JobDefinitionHelper", "superclass": "", "interfaces": "", "fields": [{"original_string": "@Autowired\n    private ConfigurationHelper configurationHelper;", "modifier": "@Autowired\n    private", "type": "ConfigurationHelper", "declarator": "configurationHelper", "var_name": "configurationHelper"}], "methods": [{"identifier": "buildActivitiIdString", "parameters": "(String namespaceCd, String jobName)", "modifiers": "public", "return": "String", "signature": "String buildActivitiIdString(String namespaceCd, String jobName)", "full_signature": "public String buildActivitiIdString(String namespaceCd, String jobName)", "class_method_signature": "JobDefinitionHelper.buildActivitiIdString(String namespaceCd, String jobName)", "testcase": false, "constructor": false}, {"identifier": "getActivitiJobDefinitionTemplate", "parameters": "()", "modifiers": "public", "return": "String", "signature": "String getActivitiJobDefinitionTemplate()", "full_signature": "public String getActivitiJobDefinitionTemplate()", "class_method_signature": "JobDefinitionHelper.getActivitiJobDefinitionTemplate()", "testcase": false, "constructor": false}, {"identifier": "getJobNameToken", "parameters": "()", "modifiers": "public", "return": "String", "signature": "String getJobNameToken()", "full_signature": "public String getJobNameToken()", "class_method_signature": "JobDefinitionHelper.getJobNameToken()", "testcase": false, "constructor": false}, {"identifier": "getNamespaceAndJobNameRegexPattern", "parameters": "()", "modifiers": "public", "return": "Pattern", "signature": "Pattern getNamespaceAndJobNameRegexPattern()", "full_signature": "public Pattern getNamespaceAndJobNameRegexPattern()", "class_method_signature": "JobDefinitionHelper.getNamespaceAndJobNameRegexPattern()", "testcase": false, "constructor": false}, {"identifier": "getJobDefinitionKey", "parameters": "(String processDefinitionKey)", "modifiers": "public", "return": "JobDefinitionAlternateKeyDto", "signature": "JobDefinitionAlternateKeyDto getJobDefinitionKey(String processDefinitionKey)", "full_signature": "public JobDefinitionAlternateKeyDto getJobDefinitionKey(String processDefinitionKey)", "class_method_signature": "JobDefinitionHelper.getJobDefinitionKey(String processDefinitionKey)", "testcase": false, "constructor": false}, {"identifier": "getJobDefinitionKey", "parameters": "(String processDefinitionKey, Pattern regexPattern)", "modifiers": "public", "return": "JobDefinitionAlternateKeyDto", "signature": "JobDefinitionAlternateKeyDto getJobDefinitionKey(String processDefinitionKey, Pattern regexPattern)", "full_signature": "public JobDefinitionAlternateKeyDto getJobDefinitionKey(String processDefinitionKey, Pattern regexPattern)", "class_method_signature": "JobDefinitionHelper.getJobDefinitionKey(String processDefinitionKey, Pattern regexPattern)", "testcase": false, "constructor": false}, {"identifier": "getNamespaceToken", "parameters": "()", "modifiers": "public", "return": "String", "signature": "String getNamespaceToken()", "full_signature": "public String getNamespaceToken()", "class_method_signature": "JobDefinitionHelper.getNamespaceToken()", "testcase": false, "constructor": false}, {"identifier": "maskPassword", "parameters": "(Parameter parameter)", "modifiers": "public", "return": "void", "signature": "void maskPassword(Parameter parameter)", "full_signature": "public void maskPassword(Parameter parameter)", "class_method_signature": "JobDefinitionHelper.maskPassword(Parameter parameter)", "testcase": false, "constructor": false}], "file": "herd-code/herd-service/src/main/java/org/finra/herd/service/helper/JobDefinitionHelper.java"}, "focal_method": {"identifier": "getActivitiJobDefinitionTemplate", "parameters": "()", "modifiers": "public", "return": "String", "body": "public String getActivitiJobDefinitionTemplate()\n    {\n        // Set the default Activiti Id tokenized template.\n        // ~namespace~.~jobName~\n        String defaultActivitiIdTemplate = getNamespaceToken() + \".\" + getJobNameToken();\n\n        // Get the Activiti Id template from the environment, but use the default if one isn't configured.\n        // This gives us the ability to customize/change the format post deployment.\n        String template = configurationHelper.getProperty(ConfigurationValue.ACTIVITI_JOB_DEFINITION_ID_TEMPLATE);\n\n        if (template == null)\n        {\n            template = defaultActivitiIdTemplate;\n        }\n\n        return template;\n    }", "signature": "String getActivitiJobDefinitionTemplate()", "full_signature": "public String getActivitiJobDefinitionTemplate()", "class_method_signature": "JobDefinitionHelper.getActivitiJobDefinitionTemplate()", "testcase": false, "constructor": false, "invocations": ["getNamespaceToken", "getJobNameToken", "getProperty"]}, "repository": {"repo_id": 42949039, "url": "https://github.com/FINRAOS/herd", "language": "Java", "is_fork": false, "fork_count": 36, "stargazer_count": 120, "size": 205797, "license": "licensed"}}