{"test_class": {"identifier": "UploadDownloadHelperTest", "superclass": "", "interfaces": "", "fields": [{"original_string": "@Rule\n    public ExpectedException expectedException = ExpectedException.none();", "modifier": "@Rule\n    public", "type": "ExpectedException", "declarator": "expectedException = ExpectedException.none()", "var_name": "expectedException"}, {"original_string": "@Mock\n    private AlternateKeyHelper alternateKeyHelper;", "modifier": "@Mock\n    private", "type": "AlternateKeyHelper", "declarator": "alternateKeyHelper", "var_name": "alternateKeyHelper"}, {"original_string": "@InjectMocks\n    private UploadDownloadHelper uploadDownloadHelper;", "modifier": "@InjectMocks\n    private", "type": "UploadDownloadHelper", "declarator": "uploadDownloadHelper", "var_name": "uploadDownloadHelper"}], "file": "herd-code/herd-service/src/test/java/org/finra/herd/service/helper/UploadDownloadHelperTest.java"}, "test_case": {"identifier": "testValidateAndTrimBusinessObjectStorageFileKeyWithNullSubPartitionValues", "parameters": "()", "modifiers": "@Test public", "return": "void", "body": "@Test\n    public void testValidateAndTrimBusinessObjectStorageFileKeyWithNullSubPartitionValues()\n    {\n        // Create a business object data storage file key.\n        BusinessObjectDataStorageFileKey businessObjectDataStorageFileKey =\n            new BusinessObjectDataStorageFileKey(NAMESPACE, BDEF_NAME, FORMAT_USAGE_CODE, FORMAT_FILE_TYPE_CODE, FORMAT_VERSION, PARTITION_VALUE, null,\n                DATA_VERSION, STORAGE_NAME, TEST_S3_KEY_PREFIX + \"/\" + LOCAL_FILE + \"    \");\n\n        // Mock the external calls.\n        when(alternateKeyHelper.validateStringParameter(\"namespace\", NAMESPACE)).thenReturn(NAMESPACE_2);\n        when(alternateKeyHelper.validateStringParameter(\"business object definition name\", BDEF_NAME)).thenReturn(BDEF_NAME_2);\n        when(alternateKeyHelper.validateStringParameter(\"business object format usage\", FORMAT_USAGE_CODE)).thenReturn(FORMAT_USAGE_CODE_2);\n        when(alternateKeyHelper.validateStringParameter(\"business object format file type\", FORMAT_FILE_TYPE_CODE)).thenReturn(FORMAT_FILE_TYPE_CODE_2);\n        when(alternateKeyHelper.validateStringParameter(\"partition value\", PARTITION_VALUE)).thenReturn(PARTITION_VALUE_2);\n        when(alternateKeyHelper.validateStringParameter(\"storage name\", STORAGE_NAME)).thenReturn(STORAGE_NAME_2);\n\n        // Call the method under test.\n        uploadDownloadHelper.validateAndTrimBusinessObjectDataStorageFileKey(businessObjectDataStorageFileKey);\n\n        // Validate the results.\n        assertEquals(\n            new BusinessObjectDataStorageFileKey(NAMESPACE_2, BDEF_NAME_2, FORMAT_USAGE_CODE_2, FORMAT_FILE_TYPE_CODE_2, FORMAT_VERSION, PARTITION_VALUE_2,\n                Lists.newArrayList(), DATA_VERSION, STORAGE_NAME_2, TEST_S3_KEY_PREFIX + \"/\" + LOCAL_FILE), businessObjectDataStorageFileKey);\n\n        // Verify the external calls.\n        verify(alternateKeyHelper).validateStringParameter(\"namespace\", NAMESPACE);\n        verify(alternateKeyHelper).validateStringParameter(\"business object definition name\", BDEF_NAME);\n        verify(alternateKeyHelper).validateStringParameter(\"business object format usage\", FORMAT_USAGE_CODE);\n        verify(alternateKeyHelper).validateStringParameter(\"business object format file type\", FORMAT_FILE_TYPE_CODE);\n        verify(alternateKeyHelper).validateStringParameter(\"partition value\", PARTITION_VALUE);\n        verify(alternateKeyHelper).validateStringParameter(\"storage name\", STORAGE_NAME);\n        verifyNoMoreInteractions(alternateKeyHelper);\n    }", "signature": "void testValidateAndTrimBusinessObjectStorageFileKeyWithNullSubPartitionValues()", "full_signature": "@Test public void testValidateAndTrimBusinessObjectStorageFileKeyWithNullSubPartitionValues()", "class_method_signature": "UploadDownloadHelperTest.testValidateAndTrimBusinessObjectStorageFileKeyWithNullSubPartitionValues()", "testcase": true, "constructor": false, "invocations": ["thenReturn", "when", "validateStringParameter", "thenReturn", "when", "validateStringParameter", "thenReturn", "when", "validateStringParameter", "thenReturn", "when", "validateStringParameter", "thenReturn", "when", "validateStringParameter", "thenReturn", "when", "validateStringParameter", "validateAndTrimBusinessObjectDataStorageFileKey", "assertEquals", "newArrayList", "validateStringParameter", "verify", "validateStringParameter", "verify", "validateStringParameter", "verify", "validateStringParameter", "verify", "validateStringParameter", "verify", "validateStringParameter", "verify", "verifyNoMoreInteractions"]}, "focal_class": {"identifier": "UploadDownloadHelper", "superclass": "", "interfaces": "", "fields": [{"original_string": "@Autowired\n    private AlternateKeyHelper alternateKeyHelper;", "modifier": "@Autowired\n    private", "type": "AlternateKeyHelper", "declarator": "alternateKeyHelper", "var_name": "alternateKeyHelper"}], "methods": [{"identifier": "validateAndTrimDownloadBusinessObjectDataStorageFileSingleInitiationRequest", "parameters": "(\n        DownloadBusinessObjectDataStorageFileSingleInitiationRequest downloadBusinessObjectDataStorageFileSingleInitiationRequest)", "modifiers": "public", "return": "void", "signature": "void validateAndTrimDownloadBusinessObjectDataStorageFileSingleInitiationRequest(\n        DownloadBusinessObjectDataStorageFileSingleInitiationRequest downloadBusinessObjectDataStorageFileSingleInitiationRequest)", "full_signature": "public void validateAndTrimDownloadBusinessObjectDataStorageFileSingleInitiationRequest(\n        DownloadBusinessObjectDataStorageFileSingleInitiationRequest downloadBusinessObjectDataStorageFileSingleInitiationRequest)", "class_method_signature": "UploadDownloadHelper.validateAndTrimDownloadBusinessObjectDataStorageFileSingleInitiationRequest(\n        DownloadBusinessObjectDataStorageFileSingleInitiationRequest downloadBusinessObjectDataStorageFileSingleInitiationRequest)", "testcase": false, "constructor": false}, {"identifier": "validateAndTrimBusinessObjectDataStorageFileKey", "parameters": "(BusinessObjectDataStorageFileKey businessObjectDataStorageFileKey)", "modifiers": "public", "return": "void", "signature": "void validateAndTrimBusinessObjectDataStorageFileKey(BusinessObjectDataStorageFileKey businessObjectDataStorageFileKey)", "full_signature": "public void validateAndTrimBusinessObjectDataStorageFileKey(BusinessObjectDataStorageFileKey businessObjectDataStorageFileKey)", "class_method_signature": "UploadDownloadHelper.validateAndTrimBusinessObjectDataStorageFileKey(BusinessObjectDataStorageFileKey businessObjectDataStorageFileKey)", "testcase": false, "constructor": false}], "file": "herd-code/herd-service/src/main/java/org/finra/herd/service/helper/UploadDownloadHelper.java"}, "focal_method": {"identifier": "validateAndTrimBusinessObjectDataStorageFileKey", "parameters": "(BusinessObjectDataStorageFileKey businessObjectDataStorageFileKey)", "modifiers": "public", "return": "void", "body": "public void validateAndTrimBusinessObjectDataStorageFileKey(BusinessObjectDataStorageFileKey businessObjectDataStorageFileKey)\n    {\n        Assert.notNull(businessObjectDataStorageFileKey, \"A business object data storage file key must be specified.\");\n        businessObjectDataStorageFileKey\n            .setNamespace(alternateKeyHelper.validateStringParameter(\"namespace\", businessObjectDataStorageFileKey.getNamespace()));\n        businessObjectDataStorageFileKey.setBusinessObjectDefinitionName(alternateKeyHelper\n            .validateStringParameter(\"business object definition name\", businessObjectDataStorageFileKey.getBusinessObjectDefinitionName()));\n        businessObjectDataStorageFileKey.setBusinessObjectFormatUsage(alternateKeyHelper\n            .validateStringParameter(\"business object format usage\", businessObjectDataStorageFileKey.getBusinessObjectFormatUsage()));\n        businessObjectDataStorageFileKey.setBusinessObjectFormatFileType(alternateKeyHelper\n            .validateStringParameter(\"business object format file type\", businessObjectDataStorageFileKey.getBusinessObjectFormatFileType()));\n\n        Assert.notNull(businessObjectDataStorageFileKey.getBusinessObjectFormatVersion(), \"A business object format version must be specified.\");\n\n        businessObjectDataStorageFileKey.setPartitionValue(alternateKeyHelper\n            .validateStringParameter(\"partition value\", businessObjectDataStorageFileKey.getPartitionValue()));\n\n        List<String> subPartitionValues = Lists.newArrayList();\n        if (CollectionUtils.isNotEmpty(businessObjectDataStorageFileKey.getSubPartitionValues()))\n        {\n            for (String subPartitionValue : businessObjectDataStorageFileKey.getSubPartitionValues())\n            {\n                subPartitionValues.add(alternateKeyHelper.validateStringParameter(\"sub partition value\", subPartitionValue));\n            }\n        }\n        businessObjectDataStorageFileKey.setSubPartitionValues(subPartitionValues);\n\n        Assert.notNull(businessObjectDataStorageFileKey.getBusinessObjectDataVersion(), \"A business object data version must be specified.\");\n\n        businessObjectDataStorageFileKey.setStorageName(alternateKeyHelper\n            .validateStringParameter(\"storage name\", businessObjectDataStorageFileKey.getStorageName()));\n\n        Assert.hasText(businessObjectDataStorageFileKey.getFilePath(), \"A file path must be specified.\");\n\n        businessObjectDataStorageFileKey.setFilePath(businessObjectDataStorageFileKey.getFilePath().trim());\n    }", "signature": "void validateAndTrimBusinessObjectDataStorageFileKey(BusinessObjectDataStorageFileKey businessObjectDataStorageFileKey)", "full_signature": "public void validateAndTrimBusinessObjectDataStorageFileKey(BusinessObjectDataStorageFileKey businessObjectDataStorageFileKey)", "class_method_signature": "UploadDownloadHelper.validateAndTrimBusinessObjectDataStorageFileKey(BusinessObjectDataStorageFileKey businessObjectDataStorageFileKey)", "testcase": false, "constructor": false, "invocations": ["notNull", "setNamespace", "validateStringParameter", "getNamespace", "setBusinessObjectDefinitionName", "validateStringParameter", "getBusinessObjectDefinitionName", "setBusinessObjectFormatUsage", "validateStringParameter", "getBusinessObjectFormatUsage", "setBusinessObjectFormatFileType", "validateStringParameter", "getBusinessObjectFormatFileType", "notNull", "getBusinessObjectFormatVersion", "setPartitionValue", "validateStringParameter", "getPartitionValue", "newArrayList", "isNotEmpty", "getSubPartitionValues", "getSubPartitionValues", "add", "validateStringParameter", "setSubPartitionValues", "notNull", "getBusinessObjectDataVersion", "setStorageName", "validateStringParameter", "getStorageName", "hasText", "getFilePath", "setFilePath", "trim", "getFilePath"]}, "repository": {"repo_id": 42949039, "url": "https://github.com/FINRAOS/herd", "language": "Java", "is_fork": false, "fork_count": 36, "stargazer_count": 120, "size": 205797, "license": "licensed"}}