{"test_class": {"identifier": "GlobalAttributeDefinitionDaoHelperTest", "superclass": "extends AbstractServiceTest", "interfaces": "", "fields": [{"original_string": "@InjectMocks\n    private GlobalAttributeDefinitionDaoHelper globalAttributeDefinitionDaoHelper;", "modifier": "@InjectMocks\n    private", "type": "GlobalAttributeDefinitionDaoHelper", "declarator": "globalAttributeDefinitionDaoHelper", "var_name": "globalAttributeDefinitionDaoHelper"}, {"original_string": "@Mock\n    private GlobalAttributeDefinitionDao globalAttributeDefinitionDao;", "modifier": "@Mock\n    private", "type": "GlobalAttributeDefinitionDao", "declarator": "globalAttributeDefinitionDao", "var_name": "globalAttributeDefinitionDao"}], "file": "herd-code/herd-service/src/test/java/org/finra/herd/service/helper/GlobalAttributeDefinitionDaoHelperTest.java"}, "test_case": {"identifier": "testGetGlobalAttributeDefinitionEntity", "parameters": "()", "modifiers": "@Test public", "return": "void", "body": "@Test\n    public void testGetGlobalAttributeDefinitionEntity()\n    {\n        // Create a global attribute definition key.\n        GlobalAttributeDefinitionKey globalAttributeDefinitionKey =\n            new GlobalAttributeDefinitionKey(GLOBAL_ATTRIBUTE_DEFINITON_LEVEL, GLOBAL_ATTRIBUTE_DEFINITON_NAME);\n\n        // Create a global attribute definition entity.\n        GlobalAttributeDefinitionEntity globalAttributeDefinitionEntity =\n            globalAttributeDefinitionDaoTestHelper.createGlobalAttributeDefinitionEntity(GLOBAL_ATTRIBUTE_DEFINITON_LEVEL, GLOBAL_ATTRIBUTE_DEFINITON_NAME);\n\n        // Mock calls to external methods.\n        when(globalAttributeDefinitionDao.getGlobalAttributeDefinitionByKey(globalAttributeDefinitionKey)).thenReturn(globalAttributeDefinitionEntity);\n\n        // Call the method under test.\n        GlobalAttributeDefinitionEntity response = globalAttributeDefinitionDaoHelper.getGlobalAttributeDefinitionEntity(globalAttributeDefinitionKey);\n\n        // Verify the external calls.\n        verify(globalAttributeDefinitionDao).getGlobalAttributeDefinitionByKey(globalAttributeDefinitionKey);\n        verifyNoMoreInteractions(globalAttributeDefinitionDao);\n\n        // Validate the response.\n        assertEquals(globalAttributeDefinitionEntity, response);\n    }", "signature": "void testGetGlobalAttributeDefinitionEntity()", "full_signature": "@Test public void testGetGlobalAttributeDefinitionEntity()", "class_method_signature": "GlobalAttributeDefinitionDaoHelperTest.testGetGlobalAttributeDefinitionEntity()", "testcase": true, "constructor": false, "invocations": ["createGlobalAttributeDefinitionEntity", "thenReturn", "when", "getGlobalAttributeDefinitionByKey", "getGlobalAttributeDefinitionEntity", "getGlobalAttributeDefinitionByKey", "verify", "verifyNoMoreInteractions", "assertEquals"]}, "focal_class": {"identifier": "GlobalAttributeDefinitionDaoHelper", "superclass": "", "interfaces": "", "fields": [{"original_string": "@Autowired\n    private GlobalAttributeDefinitionDao globalAttributeDefinitionDao;", "modifier": "@Autowired\n    private", "type": "GlobalAttributeDefinitionDao", "declarator": "globalAttributeDefinitionDao", "var_name": "globalAttributeDefinitionDao"}], "methods": [{"identifier": "getGlobalAttributeDefinitionEntity", "parameters": "(GlobalAttributeDefinitionKey globalAttributeDefinitionKey)", "modifiers": "public", "return": "GlobalAttributeDefinitionEntity", "signature": "GlobalAttributeDefinitionEntity getGlobalAttributeDefinitionEntity(GlobalAttributeDefinitionKey globalAttributeDefinitionKey)", "full_signature": "public GlobalAttributeDefinitionEntity getGlobalAttributeDefinitionEntity(GlobalAttributeDefinitionKey globalAttributeDefinitionKey)", "class_method_signature": "GlobalAttributeDefinitionDaoHelper.getGlobalAttributeDefinitionEntity(GlobalAttributeDefinitionKey globalAttributeDefinitionKey)", "testcase": false, "constructor": false}, {"identifier": "validateGlobalAttributeDefinitionNoExists", "parameters": "(GlobalAttributeDefinitionKey globalAttributeDefinitionKey)", "modifiers": "public", "return": "void", "signature": "void validateGlobalAttributeDefinitionNoExists(GlobalAttributeDefinitionKey globalAttributeDefinitionKey)", "full_signature": "public void validateGlobalAttributeDefinitionNoExists(GlobalAttributeDefinitionKey globalAttributeDefinitionKey)", "class_method_signature": "GlobalAttributeDefinitionDaoHelper.validateGlobalAttributeDefinitionNoExists(GlobalAttributeDefinitionKey globalAttributeDefinitionKey)", "testcase": false, "constructor": false}, {"identifier": "getAllowedAttributeValues", "parameters": "(GlobalAttributeDefinitionKey globalAttributeDefinitionKey)", "modifiers": "public", "return": "List<String>", "signature": "List<String> getAllowedAttributeValues(GlobalAttributeDefinitionKey globalAttributeDefinitionKey)", "full_signature": "public List<String> getAllowedAttributeValues(GlobalAttributeDefinitionKey globalAttributeDefinitionKey)", "class_method_signature": "GlobalAttributeDefinitionDaoHelper.getAllowedAttributeValues(GlobalAttributeDefinitionKey globalAttributeDefinitionKey)", "testcase": false, "constructor": false}], "file": "herd-code/herd-service/src/main/java/org/finra/herd/service/helper/GlobalAttributeDefinitionDaoHelper.java"}, "focal_method": {"identifier": "getGlobalAttributeDefinitionEntity", "parameters": "(GlobalAttributeDefinitionKey globalAttributeDefinitionKey)", "modifiers": "public", "return": "GlobalAttributeDefinitionEntity", "body": "public GlobalAttributeDefinitionEntity getGlobalAttributeDefinitionEntity(GlobalAttributeDefinitionKey globalAttributeDefinitionKey)\n        throws ObjectNotFoundException\n    {\n        GlobalAttributeDefinitionEntity globalAttributeDefinitionEntity =\n            globalAttributeDefinitionDao.getGlobalAttributeDefinitionByKey(globalAttributeDefinitionKey);\n\n        if (globalAttributeDefinitionEntity == null)\n        {\n            throw new ObjectNotFoundException(String\n                .format(\"Global attribute definition with level \\\"%s\\\" doesn't exist for global attribute definition name \\\"%s\\\".\",\n                    globalAttributeDefinitionKey.getGlobalAttributeDefinitionLevel(), globalAttributeDefinitionKey.getGlobalAttributeDefinitionName()));\n        }\n\n        return globalAttributeDefinitionEntity;\n    }", "signature": "GlobalAttributeDefinitionEntity getGlobalAttributeDefinitionEntity(GlobalAttributeDefinitionKey globalAttributeDefinitionKey)", "full_signature": "public GlobalAttributeDefinitionEntity getGlobalAttributeDefinitionEntity(GlobalAttributeDefinitionKey globalAttributeDefinitionKey)", "class_method_signature": "GlobalAttributeDefinitionDaoHelper.getGlobalAttributeDefinitionEntity(GlobalAttributeDefinitionKey globalAttributeDefinitionKey)", "testcase": false, "constructor": false, "invocations": ["getGlobalAttributeDefinitionByKey", "format", "getGlobalAttributeDefinitionLevel", "getGlobalAttributeDefinitionName"]}, "repository": {"repo_id": 42949039, "url": "https://github.com/FINRAOS/herd", "language": "Java", "is_fork": false, "fork_count": 36, "stargazer_count": 120, "size": 205797, "license": "licensed"}}