{"test_class": {"identifier": "AttributeValueListDaoHelperTest", "superclass": "extends AbstractServiceTest", "interfaces": "", "fields": [{"original_string": "@Mock\n    private AttributeValueListDao attributeValueListDao;", "modifier": "@Mock\n    private", "type": "AttributeValueListDao", "declarator": "attributeValueListDao", "var_name": "attributeValueListDao"}, {"original_string": "@InjectMocks\n    private AttributeValueListDaoHelper attributeValueListDaoHelper;", "modifier": "@InjectMocks\n    private", "type": "AttributeValueListDaoHelper", "declarator": "attributeValueListDaoHelper", "var_name": "attributeValueListDaoHelper"}], "file": "herd-code/herd-service/src/test/java/org/finra/herd/service/helper/AttributeValueListDaoHelperTest.java"}, "test_case": {"identifier": "testGetAttributeValueListEntity", "parameters": "()", "modifiers": "@Test public", "return": "void", "body": "@Test\n    public void testGetAttributeValueListEntity()\n    {\n        // Create an attribute value list key.\n        AttributeValueListKey attributeValueListKey = new AttributeValueListKey(ATTRIBUTE_VALUE_LIST_NAMESPACE, ATTRIBUTE_VALUE_LIST_NAME);\n\n        // Create an attribute value list entity.\n        AttributeValueListEntity attributeValueListEntity = new AttributeValueListEntity();\n\n        // Mock calls to external methods.\n        when(attributeValueListDao.getAttributeValueListByKey(attributeValueListKey)).thenReturn(attributeValueListEntity);\n\n        // Call the method under test.\n        AttributeValueListEntity result = attributeValueListDaoHelper.getAttributeValueListEntity(attributeValueListKey);\n\n        // Verify the external calls.\n        verify(attributeValueListDao).getAttributeValueListByKey(attributeValueListKey);\n        verifyNoMoreInteractions(attributeValueListDao);\n\n        // Validate the result.\n        assertEquals(attributeValueListEntity, result);\n    }", "signature": "void testGetAttributeValueListEntity()", "full_signature": "@Test public void testGetAttributeValueListEntity()", "class_method_signature": "AttributeValueListDaoHelperTest.testGetAttributeValueListEntity()", "testcase": true, "constructor": false, "invocations": ["thenReturn", "when", "getAttributeValueListByKey", "getAttributeValueListEntity", "getAttributeValueListByKey", "verify", "verifyNoMoreInteractions", "assertEquals"]}, "focal_class": {"identifier": "AttributeValueListDaoHelper", "superclass": "", "interfaces": "", "fields": [{"original_string": "@Autowired\n    private AttributeValueListDao attributeValueListDao;", "modifier": "@Autowired\n    private", "type": "AttributeValueListDao", "declarator": "attributeValueListDao", "var_name": "attributeValueListDao"}], "methods": [{"identifier": "getAttributeValueListEntity", "parameters": "(AttributeValueListKey attributeValueListKey)", "modifiers": "public", "return": "AttributeValueListEntity", "signature": "AttributeValueListEntity getAttributeValueListEntity(AttributeValueListKey attributeValueListKey)", "full_signature": "public AttributeValueListEntity getAttributeValueListEntity(AttributeValueListKey attributeValueListKey)", "class_method_signature": "AttributeValueListDaoHelper.getAttributeValueListEntity(AttributeValueListKey attributeValueListKey)", "testcase": false, "constructor": false}, {"identifier": "createAttributeValueListFromEntity", "parameters": "(AttributeValueListEntity attributeValueListEntity)", "modifiers": "public", "return": "AttributeValueList", "signature": "AttributeValueList createAttributeValueListFromEntity(AttributeValueListEntity attributeValueListEntity)", "full_signature": "public AttributeValueList createAttributeValueListFromEntity(AttributeValueListEntity attributeValueListEntity)", "class_method_signature": "AttributeValueListDaoHelper.createAttributeValueListFromEntity(AttributeValueListEntity attributeValueListEntity)", "testcase": false, "constructor": false}], "file": "herd-code/herd-service/src/main/java/org/finra/herd/service/helper/AttributeValueListDaoHelper.java"}, "focal_method": {"identifier": "getAttributeValueListEntity", "parameters": "(AttributeValueListKey attributeValueListKey)", "modifiers": "public", "return": "AttributeValueListEntity", "body": "public AttributeValueListEntity getAttributeValueListEntity(AttributeValueListKey attributeValueListKey)\n    {\n        AttributeValueListEntity attributeValueListEntity = attributeValueListDao.getAttributeValueListByKey(attributeValueListKey);\n\n        if (attributeValueListEntity == null)\n        {\n            throw new ObjectNotFoundException(String\n                .format(\"Attribute value list with name \\\"%s\\\" doesn't exist for namespace \\\"%s\\\".\", attributeValueListKey.getAttributeValueListName(),\n                    attributeValueListKey.getNamespace()));\n        }\n\n        return attributeValueListEntity;\n    }", "signature": "AttributeValueListEntity getAttributeValueListEntity(AttributeValueListKey attributeValueListKey)", "full_signature": "public AttributeValueListEntity getAttributeValueListEntity(AttributeValueListKey attributeValueListKey)", "class_method_signature": "AttributeValueListDaoHelper.getAttributeValueListEntity(AttributeValueListKey attributeValueListKey)", "testcase": false, "constructor": false, "invocations": ["getAttributeValueListByKey", "format", "getAttributeValueListName", "getNamespace"]}, "repository": {"repo_id": 42949039, "url": "https://github.com/FINRAOS/herd", "language": "Java", "is_fork": false, "fork_count": 36, "stargazer_count": 120, "size": 205797, "license": "licensed"}}