{"test_class": {"identifier": "BusinessObjectFormatExternalInterfaceDescriptiveInformationServiceImplTest", "superclass": "", "interfaces": "", "fields": [{"original_string": "@Mock\n    private BusinessObjectFormatDaoHelper businessObjectFormatDaoHelper;", "modifier": "@Mock\n    private", "type": "BusinessObjectFormatDaoHelper", "declarator": "businessObjectFormatDaoHelper", "var_name": "businessObjectFormatDaoHelper"}, {"original_string": "@Mock\n    private BusinessObjectFormatExternalInterfaceDaoHelper businessObjectFormatExternalInterfaceDaoHelper;", "modifier": "@Mock\n    private", "type": "BusinessObjectFormatExternalInterfaceDaoHelper", "declarator": "businessObjectFormatExternalInterfaceDaoHelper", "var_name": "businessObjectFormatExternalInterfaceDaoHelper"}, {"original_string": "@Mock\n    private BusinessObjectFormatExternalInterfaceDescriptiveInformationHelper businessObjectFormatExternalInterfaceDescriptiveInformationHelper;", "modifier": "@Mock\n    private", "type": "BusinessObjectFormatExternalInterfaceDescriptiveInformationHelper", "declarator": "businessObjectFormatExternalInterfaceDescriptiveInformationHelper", "var_name": "businessObjectFormatExternalInterfaceDescriptiveInformationHelper"}, {"original_string": "@Mock\n    private BusinessObjectFormatExternalInterfaceHelper businessObjectFormatExternalInterfaceHelper;", "modifier": "@Mock\n    private", "type": "BusinessObjectFormatExternalInterfaceHelper", "declarator": "businessObjectFormatExternalInterfaceHelper", "var_name": "businessObjectFormatExternalInterfaceHelper"}, {"original_string": "@InjectMocks\n    private BusinessObjectFormatExternalInterfaceDescriptiveInformationServiceImpl businessObjectFormatExternalInterfaceDescriptiveInformationService;", "modifier": "@InjectMocks\n    private", "type": "BusinessObjectFormatExternalInterfaceDescriptiveInformationServiceImpl", "declarator": "businessObjectFormatExternalInterfaceDescriptiveInformationService", "var_name": "businessObjectFormatExternalInterfaceDescriptiveInformationService"}, {"original_string": "@Mock\n    private ExternalInterfaceDaoHelper externalInterfaceDaoHelper;", "modifier": "@Mock\n    private", "type": "ExternalInterfaceDaoHelper", "declarator": "externalInterfaceDaoHelper", "var_name": "externalInterfaceDaoHelper"}], "file": "herd-code/herd-service/src/test/java/org/finra/herd/service/impl/BusinessObjectFormatExternalInterfaceDescriptiveInformationServiceImplTest.java"}, "test_case": {"identifier": "testGetBusinessObjectFormatExternalInterfaceDescriptiveInformation", "parameters": "()", "modifiers": "@Test public", "return": "void", "body": "@Test\n    public void testGetBusinessObjectFormatExternalInterfaceDescriptiveInformation()\n    {\n        // Create a business object format external interface key.\n        BusinessObjectFormatExternalInterfaceKey businessObjectFormatExternalInterfaceKey =\n            new BusinessObjectFormatExternalInterfaceKey(NAMESPACE, BDEF_NAME, FORMAT_USAGE_CODE, FORMAT_FILE_TYPE_CODE, EXTERNAL_INTERFACE);\n\n        // Create a business object format key\n        BusinessObjectFormatKey businessObjectFormatKey = new BusinessObjectFormatKey(NAMESPACE, BDEF_NAME, FORMAT_USAGE_CODE, FORMAT_FILE_TYPE_CODE, null);\n\n        // Create an external interface entity.\n        ExternalInterfaceEntity externalInterfaceEntity = new ExternalInterfaceEntity();\n\n        // Create a business object format entity.\n        BusinessObjectFormatEntity businessObjectFormatEntity = new BusinessObjectFormatEntity();\n\n        // Create a business object external interface descriptive information object\n        BusinessObjectFormatExternalInterfaceDescriptiveInformation businessObjectFormatExternalInterfaceDescriptiveInformation =\n            new BusinessObjectFormatExternalInterfaceDescriptiveInformation(businessObjectFormatExternalInterfaceKey, DISPLAY_NAME_FIELD, DESCRIPTION);\n\n        // Mock the external calls.\n        when(externalInterfaceDaoHelper.getExternalInterfaceEntity(EXTERNAL_INTERFACE)).thenReturn(externalInterfaceEntity);\n        when(businessObjectFormatDaoHelper.getBusinessObjectFormatEntity(businessObjectFormatKey)).thenReturn(businessObjectFormatEntity);\n        when(businessObjectFormatExternalInterfaceDescriptiveInformationHelper\n            .createBusinessObjectFormatExternalInterfaceDescriptiveInformationFromEntities(businessObjectFormatEntity, externalInterfaceEntity))\n            .thenReturn(businessObjectFormatExternalInterfaceDescriptiveInformation);\n\n        // Call the method under test.\n        BusinessObjectFormatExternalInterfaceDescriptiveInformation result = businessObjectFormatExternalInterfaceDescriptiveInformationService\n            .getBusinessObjectFormatExternalInterfaceDescriptiveInformation(businessObjectFormatExternalInterfaceKey);\n\n        // Validate the results.\n        assertEquals(businessObjectFormatExternalInterfaceDescriptiveInformation, result);\n\n        // Verify the external calls.\n        verify(businessObjectFormatExternalInterfaceHelper).validateAndTrimBusinessObjectFormatExternalInterfaceKey(businessObjectFormatExternalInterfaceKey);\n        verify(businessObjectFormatExternalInterfaceDaoHelper).getBusinessObjectFormatExternalInterfaceEntity(businessObjectFormatExternalInterfaceKey);\n        verify(externalInterfaceDaoHelper).getExternalInterfaceEntity(EXTERNAL_INTERFACE);\n        verify(businessObjectFormatDaoHelper).getBusinessObjectFormatEntity(businessObjectFormatKey);\n        verify(businessObjectFormatExternalInterfaceDescriptiveInformationHelper)\n            .createBusinessObjectFormatExternalInterfaceDescriptiveInformationFromEntities(businessObjectFormatEntity, externalInterfaceEntity);\n        verifyNoMoreInteractionsHelper();\n    }", "signature": "void testGetBusinessObjectFormatExternalInterfaceDescriptiveInformation()", "full_signature": "@Test public void testGetBusinessObjectFormatExternalInterfaceDescriptiveInformation()", "class_method_signature": "BusinessObjectFormatExternalInterfaceDescriptiveInformationServiceImplTest.testGetBusinessObjectFormatExternalInterfaceDescriptiveInformation()", "testcase": true, "constructor": false, "invocations": ["thenReturn", "when", "getExternalInterfaceEntity", "thenReturn", "when", "getBusinessObjectFormatEntity", "thenReturn", "when", "createBusinessObjectFormatExternalInterfaceDescriptiveInformationFromEntities", "getBusinessObjectFormatExternalInterfaceDescriptiveInformation", "assertEquals", "validateAndTrimBusinessObjectFormatExternalInterfaceKey", "verify", "getBusinessObjectFormatExternalInterfaceEntity", "verify", "getExternalInterfaceEntity", "verify", "getBusinessObjectFormatEntity", "verify", "createBusinessObjectFormatExternalInterfaceDescriptiveInformationFromEntities", "verify", "verifyNoMoreInteractionsHelper"]}, "focal_class": {"identifier": "BusinessObjectFormatExternalInterfaceDescriptiveInformationServiceImpl", "superclass": "", "interfaces": "implements BusinessObjectFormatExternalInterfaceDescriptiveInformationService", "fields": [{"original_string": "@Autowired\n    private BusinessObjectFormatDaoHelper businessObjectFormatDaoHelper;", "modifier": "@Autowired\n    private", "type": "BusinessObjectFormatDaoHelper", "declarator": "businessObjectFormatDaoHelper", "var_name": "businessObjectFormatDaoHelper"}, {"original_string": "@Autowired\n    private BusinessObjectFormatExternalInterfaceDaoHelper businessObjectFormatExternalInterfaceDaoHelper;", "modifier": "@Autowired\n    private", "type": "BusinessObjectFormatExternalInterfaceDaoHelper", "declarator": "businessObjectFormatExternalInterfaceDaoHelper", "var_name": "businessObjectFormatExternalInterfaceDaoHelper"}, {"original_string": "@Autowired\n    private BusinessObjectFormatExternalInterfaceDescriptiveInformationHelper businessObjectFormatExternalInterfaceDescriptiveInformationHelper;", "modifier": "@Autowired\n    private", "type": "BusinessObjectFormatExternalInterfaceDescriptiveInformationHelper", "declarator": "businessObjectFormatExternalInterfaceDescriptiveInformationHelper", "var_name": "businessObjectFormatExternalInterfaceDescriptiveInformationHelper"}, {"original_string": "@Autowired\n    private BusinessObjectFormatExternalInterfaceHelper businessObjectFormatExternalInterfaceHelper;", "modifier": "@Autowired\n    private", "type": "BusinessObjectFormatExternalInterfaceHelper", "declarator": "businessObjectFormatExternalInterfaceHelper", "var_name": "businessObjectFormatExternalInterfaceHelper"}, {"original_string": "@Autowired\n    private ExternalInterfaceDaoHelper externalInterfaceDaoHelper;", "modifier": "@Autowired\n    private", "type": "ExternalInterfaceDaoHelper", "declarator": "externalInterfaceDaoHelper", "var_name": "externalInterfaceDaoHelper"}], "methods": [{"identifier": "getBusinessObjectFormatExternalInterfaceDescriptiveInformation", "parameters": "(\n        BusinessObjectFormatExternalInterfaceKey businessObjectFormatExternalInterfaceKey)", "modifiers": "@Override public", "return": "BusinessObjectFormatExternalInterfaceDescriptiveInformation", "signature": "BusinessObjectFormatExternalInterfaceDescriptiveInformation getBusinessObjectFormatExternalInterfaceDescriptiveInformation(\n        BusinessObjectFormatExternalInterfaceKey businessObjectFormatExternalInterfaceKey)", "full_signature": "@Override public BusinessObjectFormatExternalInterfaceDescriptiveInformation getBusinessObjectFormatExternalInterfaceDescriptiveInformation(\n        BusinessObjectFormatExternalInterfaceKey businessObjectFormatExternalInterfaceKey)", "class_method_signature": "BusinessObjectFormatExternalInterfaceDescriptiveInformationServiceImpl.getBusinessObjectFormatExternalInterfaceDescriptiveInformation(\n        BusinessObjectFormatExternalInterfaceKey businessObjectFormatExternalInterfaceKey)", "testcase": false, "constructor": false}], "file": "herd-code/herd-service/src/main/java/org/finra/herd/service/impl/BusinessObjectFormatExternalInterfaceDescriptiveInformationServiceImpl.java"}, "focal_method": {"identifier": "getBusinessObjectFormatExternalInterfaceDescriptiveInformation", "parameters": "(\n        BusinessObjectFormatExternalInterfaceKey businessObjectFormatExternalInterfaceKey)", "modifiers": "@Override public", "return": "BusinessObjectFormatExternalInterfaceDescriptiveInformation", "body": "@Override\n    public BusinessObjectFormatExternalInterfaceDescriptiveInformation getBusinessObjectFormatExternalInterfaceDescriptiveInformation(\n        BusinessObjectFormatExternalInterfaceKey businessObjectFormatExternalInterfaceKey)\n    {\n        // Validate and trim the business object format external interface key.\n        businessObjectFormatExternalInterfaceHelper.validateAndTrimBusinessObjectFormatExternalInterfaceKey(businessObjectFormatExternalInterfaceKey);\n\n        // Ensure that a business object format to external interface mapping with the specified key exists.\n        businessObjectFormatExternalInterfaceDaoHelper.getBusinessObjectFormatExternalInterfaceEntity(businessObjectFormatExternalInterfaceKey);\n\n        // Retrieve and ensure that an external interface with the specified name exists.\n        ExternalInterfaceEntity externalInterfaceEntity =\n            externalInterfaceDaoHelper.getExternalInterfaceEntity(businessObjectFormatExternalInterfaceKey.getExternalInterfaceName());\n\n        // Get a business object format key from the request. Please note that the key is version-less.\n        BusinessObjectFormatKey businessObjectFormatKey = new BusinessObjectFormatKey(businessObjectFormatExternalInterfaceKey.getNamespace(),\n            businessObjectFormatExternalInterfaceKey.getBusinessObjectDefinitionName(), businessObjectFormatExternalInterfaceKey.getBusinessObjectFormatUsage(),\n            businessObjectFormatExternalInterfaceKey.getBusinessObjectFormatFileType(), null);\n\n        // Retrieve and ensure that a business object format with the specified alternate key values exists.\n        BusinessObjectFormatEntity businessObjectFormatEntity = businessObjectFormatDaoHelper.getBusinessObjectFormatEntity(businessObjectFormatKey);\n\n        // Create a business object format external interface descriptive information object from the business object format external interface entity and the\n        // external interface entity and return it.\n        return businessObjectFormatExternalInterfaceDescriptiveInformationHelper\n            .createBusinessObjectFormatExternalInterfaceDescriptiveInformationFromEntities(businessObjectFormatEntity, externalInterfaceEntity);\n    }", "signature": "BusinessObjectFormatExternalInterfaceDescriptiveInformation getBusinessObjectFormatExternalInterfaceDescriptiveInformation(\n        BusinessObjectFormatExternalInterfaceKey businessObjectFormatExternalInterfaceKey)", "full_signature": "@Override public BusinessObjectFormatExternalInterfaceDescriptiveInformation getBusinessObjectFormatExternalInterfaceDescriptiveInformation(\n        BusinessObjectFormatExternalInterfaceKey businessObjectFormatExternalInterfaceKey)", "class_method_signature": "BusinessObjectFormatExternalInterfaceDescriptiveInformationServiceImpl.getBusinessObjectFormatExternalInterfaceDescriptiveInformation(\n        BusinessObjectFormatExternalInterfaceKey businessObjectFormatExternalInterfaceKey)", "testcase": false, "constructor": false, "invocations": ["validateAndTrimBusinessObjectFormatExternalInterfaceKey", "getBusinessObjectFormatExternalInterfaceEntity", "getExternalInterfaceEntity", "getExternalInterfaceName", "getNamespace", "getBusinessObjectDefinitionName", "getBusinessObjectFormatUsage", "getBusinessObjectFormatFileType", "getBusinessObjectFormatEntity", "createBusinessObjectFormatExternalInterfaceDescriptiveInformationFromEntities"]}, "repository": {"repo_id": 42949039, "url": "https://github.com/FINRAOS/herd", "language": "Java", "is_fork": false, "fork_count": 36, "stargazer_count": 120, "size": 205797, "license": "licensed"}}