{"test_class": {"identifier": "AnalyticsAggregationTypeTest", "superclass": "", "interfaces": "", "fields": [], "file": "dhis-2/dhis-services/dhis-service-analytics/src/test/java/org/hisp/dhis/analytics/AnalyticsAggregationTypeTest.java"}, "test_case": {"identifier": "verifyFromAggregationType", "parameters": "()", "modifiers": "@Test public", "return": "void", "body": "@Test\n    public void verifyFromAggregationType()\n    {\n        assertAggregationType( fromAggregationType( AVERAGE_SUM_ORG_UNIT ), SUM, AVERAGE );\n        assertAggregationType( fromAggregationType( LAST ), SUM, LAST );\n        assertAggregationType( fromAggregationType( LAST_AVERAGE_ORG_UNIT ), AVERAGE, LAST );\n        assertAggregationType( fromAggregationType( FIRST ), SUM, FIRST );\n        assertAggregationType( fromAggregationType( FIRST_AVERAGE_ORG_UNIT ), AVERAGE, FIRST );\n        assertAggregationType( fromAggregationType( SUM ), SUM, SUM );\n        assertAggregationType( fromAggregationType( LAST_IN_PERIOD ), SUM, LAST_IN_PERIOD );\n        assertAggregationType( fromAggregationType( LAST_IN_PERIOD_AVERAGE_ORG_UNIT ), AVERAGE, LAST_IN_PERIOD );\n    }", "signature": "void verifyFromAggregationType()", "full_signature": "@Test public void verifyFromAggregationType()", "class_method_signature": "AnalyticsAggregationTypeTest.verifyFromAggregationType()", "testcase": true, "constructor": false, "invocations": ["assertAggregationType", "fromAggregationType", "assertAggregationType", "fromAggregationType", "assertAggregationType", "fromAggregationType", "assertAggregationType", "fromAggregationType", "assertAggregationType", "fromAggregationType", "assertAggregationType", "fromAggregationType", "assertAggregationType", "fromAggregationType", "assertAggregationType", "fromAggregationType"]}, "focal_class": {"identifier": "AnalyticsAggregationType", "superclass": "", "interfaces": "", "fields": [{"original_string": "public static final AnalyticsAggregationType SUM = new AnalyticsAggregationType( AggregationType.SUM, AggregationType.SUM );", "modifier": "public static final", "type": "AnalyticsAggregationType", "declarator": "SUM = new AnalyticsAggregationType( AggregationType.SUM, AggregationType.SUM )", "var_name": "SUM"}, {"original_string": "public static final AnalyticsAggregationType AVERAGE = new AnalyticsAggregationType( AggregationType.AVERAGE, AggregationType.AVERAGE );", "modifier": "public static final", "type": "AnalyticsAggregationType", "declarator": "AVERAGE = new AnalyticsAggregationType( AggregationType.AVERAGE, AggregationType.AVERAGE )", "var_name": "AVERAGE"}, {"original_string": "public static final AnalyticsAggregationType COUNT = new AnalyticsAggregationType( AggregationType.COUNT, AggregationType.COUNT );", "modifier": "public static final", "type": "AnalyticsAggregationType", "declarator": "COUNT = new AnalyticsAggregationType( AggregationType.COUNT, AggregationType.COUNT )", "var_name": "COUNT"}, {"original_string": "public static final AnalyticsAggregationType FIRST = new AnalyticsAggregationType( AggregationType.FIRST, AggregationType.FIRST );", "modifier": "public static final", "type": "AnalyticsAggregationType", "declarator": "FIRST = new AnalyticsAggregationType( AggregationType.FIRST, AggregationType.FIRST )", "var_name": "FIRST"}, {"original_string": "public static final AnalyticsAggregationType LAST = new AnalyticsAggregationType( AggregationType.LAST, AggregationType.LAST );", "modifier": "public static final", "type": "AnalyticsAggregationType", "declarator": "LAST = new AnalyticsAggregationType( AggregationType.LAST, AggregationType.LAST )", "var_name": "LAST"}, {"original_string": "public static final AnalyticsAggregationType LAST_IN_PERIOD = new AnalyticsAggregationType( AggregationType.LAST_IN_PERIOD, AggregationType.LAST_IN_PERIOD );", "modifier": "public static final", "type": "AnalyticsAggregationType", "declarator": "LAST_IN_PERIOD = new AnalyticsAggregationType( AggregationType.LAST_IN_PERIOD, AggregationType.LAST_IN_PERIOD )", "var_name": "LAST_IN_PERIOD"}, {"original_string": "private AggregationType aggregationType;", "modifier": "private", "type": "AggregationType", "declarator": "aggregationType", "var_name": "aggregationType"}, {"original_string": "private AggregationType periodAggregationType;", "modifier": "private", "type": "AggregationType", "declarator": "periodAggregationType", "var_name": "periodAggregationType"}, {"original_string": "private DataType dataType;", "modifier": "private", "type": "DataType", "declarator": "dataType", "var_name": "dataType"}, {"original_string": "private boolean disaggregation;", "modifier": "private", "type": "boolean", "declarator": "disaggregation", "var_name": "disaggregation"}], "methods": [{"identifier": "AnalyticsAggregationType", "parameters": "( AggregationType aggregationType, AggregationType periodAggregationType )", "modifiers": "public", "return": "", "signature": " AnalyticsAggregationType( AggregationType aggregationType, AggregationType periodAggregationType )", "full_signature": "public  AnalyticsAggregationType( AggregationType aggregationType, AggregationType periodAggregationType )", "class_method_signature": "AnalyticsAggregationType.AnalyticsAggregationType( AggregationType aggregationType, AggregationType periodAggregationType )", "testcase": false, "constructor": true}, {"identifier": "AnalyticsAggregationType", "parameters": "( AggregationType aggregationType, AggregationType periodAggregationType, DataType dataType, boolean disaggregation )", "modifiers": "public", "return": "", "signature": " AnalyticsAggregationType( AggregationType aggregationType, AggregationType periodAggregationType, DataType dataType, boolean disaggregation )", "full_signature": "public  AnalyticsAggregationType( AggregationType aggregationType, AggregationType periodAggregationType, DataType dataType, boolean disaggregation )", "class_method_signature": "AnalyticsAggregationType.AnalyticsAggregationType( AggregationType aggregationType, AggregationType periodAggregationType, DataType dataType, boolean disaggregation )", "testcase": false, "constructor": true}, {"identifier": "instance", "parameters": "()", "modifiers": "public", "return": "AnalyticsAggregationType", "signature": "AnalyticsAggregationType instance()", "full_signature": "public AnalyticsAggregationType instance()", "class_method_signature": "AnalyticsAggregationType.instance()", "testcase": false, "constructor": false}, {"identifier": "fromAggregationType", "parameters": "( AggregationType aggregationType )", "modifiers": "public static", "return": "AnalyticsAggregationType", "signature": "AnalyticsAggregationType fromAggregationType( AggregationType aggregationType )", "full_signature": "public static AnalyticsAggregationType fromAggregationType( AggregationType aggregationType )", "class_method_signature": "AnalyticsAggregationType.fromAggregationType( AggregationType aggregationType )", "testcase": false, "constructor": false}, {"identifier": "isAggregationType", "parameters": "( AggregationType type )", "modifiers": "public", "return": "boolean", "signature": "boolean isAggregationType( AggregationType type )", "full_signature": "public boolean isAggregationType( AggregationType type )", "class_method_signature": "AnalyticsAggregationType.isAggregationType( AggregationType type )", "testcase": false, "constructor": false}, {"identifier": "isPeriodAggregationType", "parameters": "( AggregationType type )", "modifiers": "public", "return": "boolean", "signature": "boolean isPeriodAggregationType( AggregationType type )", "full_signature": "public boolean isPeriodAggregationType( AggregationType type )", "class_method_signature": "AnalyticsAggregationType.isPeriodAggregationType( AggregationType type )", "testcase": false, "constructor": false}, {"identifier": "isLastPeriodAggregationType", "parameters": "()", "modifiers": "public", "return": "boolean", "signature": "boolean isLastPeriodAggregationType()", "full_signature": "public boolean isLastPeriodAggregationType()", "class_method_signature": "AnalyticsAggregationType.isLastPeriodAggregationType()", "testcase": false, "constructor": false}, {"identifier": "isFirstPeriodAggregationType", "parameters": "()", "modifiers": "public", "return": "boolean", "signature": "boolean isFirstPeriodAggregationType()", "full_signature": "public boolean isFirstPeriodAggregationType()", "class_method_signature": "AnalyticsAggregationType.isFirstPeriodAggregationType()", "testcase": false, "constructor": false}, {"identifier": "isLastInPeriodAggregationType", "parameters": "()", "modifiers": "public", "return": "boolean", "signature": "boolean isLastInPeriodAggregationType()", "full_signature": "public boolean isLastInPeriodAggregationType()", "class_method_signature": "AnalyticsAggregationType.isLastInPeriodAggregationType()", "testcase": false, "constructor": false}, {"identifier": "isFirstOrLastPeriodAggregationType", "parameters": "()", "modifiers": "public", "return": "boolean", "signature": "boolean isFirstOrLastPeriodAggregationType()", "full_signature": "public boolean isFirstOrLastPeriodAggregationType()", "class_method_signature": "AnalyticsAggregationType.isFirstOrLastPeriodAggregationType()", "testcase": false, "constructor": false}, {"identifier": "isFirstOrLastOrLastInPeriodAggregationType", "parameters": "()", "modifiers": "public", "return": "boolean", "signature": "boolean isFirstOrLastOrLastInPeriodAggregationType()", "full_signature": "public boolean isFirstOrLastOrLastInPeriodAggregationType()", "class_method_signature": "AnalyticsAggregationType.isFirstOrLastOrLastInPeriodAggregationType()", "testcase": false, "constructor": false}, {"identifier": "isNumericDataType", "parameters": "()", "modifiers": "public", "return": "boolean", "signature": "boolean isNumericDataType()", "full_signature": "public boolean isNumericDataType()", "class_method_signature": "AnalyticsAggregationType.isNumericDataType()", "testcase": false, "constructor": false}, {"identifier": "isBooleanDataType", "parameters": "()", "modifiers": "public", "return": "boolean", "signature": "boolean isBooleanDataType()", "full_signature": "public boolean isBooleanDataType()", "class_method_signature": "AnalyticsAggregationType.isBooleanDataType()", "testcase": false, "constructor": false}, {"identifier": "getAggregationType", "parameters": "()", "modifiers": "public", "return": "AggregationType", "signature": "AggregationType getAggregationType()", "full_signature": "public AggregationType getAggregationType()", "class_method_signature": "AnalyticsAggregationType.getAggregationType()", "testcase": false, "constructor": false}, {"identifier": "getPeriodAggregationType", "parameters": "()", "modifiers": "public", "return": "AggregationType", "signature": "AggregationType getPeriodAggregationType()", "full_signature": "public AggregationType getPeriodAggregationType()", "class_method_signature": "AnalyticsAggregationType.getPeriodAggregationType()", "testcase": false, "constructor": false}, {"identifier": "getDataType", "parameters": "()", "modifiers": "public", "return": "DataType", "signature": "DataType getDataType()", "full_signature": "public DataType getDataType()", "class_method_signature": "AnalyticsAggregationType.getDataType()", "testcase": false, "constructor": false}, {"identifier": "isDisaggregation", "parameters": "()", "modifiers": "public", "return": "boolean", "signature": "boolean isDisaggregation()", "full_signature": "public boolean isDisaggregation()", "class_method_signature": "AnalyticsAggregationType.isDisaggregation()", "testcase": false, "constructor": false}, {"identifier": "toString", "parameters": "()", "modifiers": "@Override public", "return": "String", "signature": "String toString()", "full_signature": "@Override public String toString()", "class_method_signature": "AnalyticsAggregationType.toString()", "testcase": false, "constructor": false}, {"identifier": "equals", "parameters": "( Object object )", "modifiers": "@Override public", "return": "boolean", "signature": "boolean equals( Object object )", "full_signature": "@Override public boolean equals( Object object )", "class_method_signature": "AnalyticsAggregationType.equals( Object object )", "testcase": false, "constructor": false}, {"identifier": "hashCode", "parameters": "()", "modifiers": "@Override public", "return": "int", "signature": "int hashCode()", "full_signature": "@Override public int hashCode()", "class_method_signature": "AnalyticsAggregationType.hashCode()", "testcase": false, "constructor": false}], "file": "dhis-2/dhis-services/dhis-service-analytics/src/main/java/org/hisp/dhis/analytics/AnalyticsAggregationType.java"}, "focal_method": {"identifier": "fromAggregationType", "parameters": "( AggregationType aggregationType )", "modifiers": "public static", "return": "AnalyticsAggregationType", "body": "public static AnalyticsAggregationType fromAggregationType( AggregationType aggregationType )\n    {\n        AnalyticsAggregationType analyticsAggregationType;\n        switch ( aggregationType )\n        {\n\n        case AVERAGE_SUM_ORG_UNIT:\n            analyticsAggregationType = new AnalyticsAggregationType( AggregationType.SUM, AggregationType.AVERAGE );\n            break;\n        case LAST:\n            analyticsAggregationType = new AnalyticsAggregationType( AggregationType.SUM, AggregationType.LAST );\n            break;\n        case LAST_AVERAGE_ORG_UNIT:\n            analyticsAggregationType = new AnalyticsAggregationType( AggregationType.AVERAGE, AggregationType.LAST );\n            break;\n        case LAST_IN_PERIOD:\n            analyticsAggregationType = new AnalyticsAggregationType( AggregationType.SUM, AggregationType.LAST_IN_PERIOD );\n            break;\n        case LAST_IN_PERIOD_AVERAGE_ORG_UNIT:\n            analyticsAggregationType = new AnalyticsAggregationType( AggregationType.AVERAGE, AggregationType.LAST_IN_PERIOD );\n            break;\n        case FIRST:\n            analyticsAggregationType = new AnalyticsAggregationType( AggregationType.SUM, AggregationType.FIRST );\n            break;\n        case FIRST_AVERAGE_ORG_UNIT:\n            analyticsAggregationType = new AnalyticsAggregationType( AggregationType.AVERAGE, AggregationType.FIRST );\n            break;\n        default:\n            analyticsAggregationType = new AnalyticsAggregationType( aggregationType, aggregationType );\n        }\n\n        return analyticsAggregationType;\n    }", "signature": "AnalyticsAggregationType fromAggregationType( AggregationType aggregationType )", "full_signature": "public static AnalyticsAggregationType fromAggregationType( AggregationType aggregationType )", "class_method_signature": "AnalyticsAggregationType.fromAggregationType( AggregationType aggregationType )", "testcase": false, "constructor": false, "invocations": []}, "repository": {"repo_id": 66940520, "url": "https://github.com/dhis2/dhis2-core", "stars": 151, "created": "8/30/2016 12:57:05 PM +00:00", "updates": "2020-01-24T18:06:36+00:00", "fork": "False", "license": "licensed"}}