{"test_class": {"identifier": "InsertAttributeModelTest", "superclass": "", "interfaces": "", "fields": [{"original_string": "private AttributeResolver resolver;", "modifier": "private", "type": "AttributeResolver", "declarator": "resolver", "var_name": "resolver"}, {"original_string": "private InsertAttributeModel model;", "modifier": "private", "type": "InsertAttributeModel", "declarator": "model", "var_name": "model"}], "file": "tiles-template/src/test/java/org/apache/tiles/template/InsertAttributeModelTest.java"}, "test_case": {"identifier": "testExecute", "parameters": "()", "modifiers": "@Test public", "return": "void", "body": "@Test\n    public void testExecute() throws IOException {\n        TilesContainer container = createMock(TilesContainer.class);\n        Request request = createMock(Request.class);\n        Attribute attribute = new Attribute(\"myValue\");\n        AttributeContext attributeContext = createMock(AttributeContext.class);\n        Map<String, Object> requestScope = new HashMap<String, Object>();\n        requestScope.put(TilesAccess.CURRENT_CONTAINER_ATTRIBUTE_NAME, container);\n        ApplicationContext applicationContext = createMock(ApplicationContext.class);\n        ModelBody modelBody = createMock(ModelBody.class);\n\n        modelBody.evaluateWithoutWriting();\n        expect(request.getApplicationContext()).andReturn(applicationContext).times(2);\n        expect(request.getContext(\"request\")).andReturn(requestScope).anyTimes();\n\n        container.prepare(\"myPreparer\", request);\n        expect(resolver.computeAttribute(container, attribute, \"myName\", \"myRole\", false, \"myDefaultValue\",\n                \"myDefaultValueRole\", \"myDefaultValueType\", request)).andReturn(attribute);\n        expect(container.startContext(request)).andReturn(attributeContext);\n        container.endContext(request);\n        container.render(attribute, request);\n\n        replay(resolver, container, request, applicationContext, modelBody);\n        model.execute(false, \"myPreparer\", \"myRole\", \"myDefaultValue\", \"myDefaultValueRole\",\n                \"myDefaultValueType\", \"myName\", attribute, false, request, modelBody);\n        verify(resolver, container, request, applicationContext, modelBody);\n    }", "signature": "void testExecute()", "full_signature": "@Test public void testExecute()", "class_method_signature": "InsertAttributeModelTest.testExecute()", "testcase": true, "constructor": false, "invocations": ["createMock", "createMock", "createMock", "put", "createMock", "createMock", "evaluateWithoutWriting", "times", "andReturn", "expect", "getApplicationContext", "anyTimes", "andReturn", "expect", "getContext", "prepare", "andReturn", "expect", "computeAttribute", "andReturn", "expect", "startContext", "endContext", "render", "replay", "execute", "verify"]}, "focal_class": {"identifier": "InsertAttributeModel", "superclass": "", "interfaces": "", "fields": [{"original_string": "private Logger log = LoggerFactory.getLogger(getClass());", "modifier": "private", "type": "Logger", "declarator": "log = LoggerFactory.getLogger(getClass())", "var_name": "log"}, {"original_string": "private AttributeResolver attributeResolver;", "modifier": "private", "type": "AttributeResolver", "declarator": "attributeResolver", "var_name": "attributeResolver"}], "methods": [{"identifier": "InsertAttributeModel", "parameters": "()", "modifiers": "public", "return": "", "signature": " InsertAttributeModel()", "full_signature": "public  InsertAttributeModel()", "class_method_signature": "InsertAttributeModel.InsertAttributeModel()", "testcase": false, "constructor": true}, {"identifier": "InsertAttributeModel", "parameters": "(AttributeResolver attributeResolver)", "modifiers": "public", "return": "", "signature": " InsertAttributeModel(AttributeResolver attributeResolver)", "full_signature": "public  InsertAttributeModel(AttributeResolver attributeResolver)", "class_method_signature": "InsertAttributeModel.InsertAttributeModel(AttributeResolver attributeResolver)", "testcase": false, "constructor": true}, {"identifier": "execute", "parameters": "(boolean ignore, String preparer,\n            String role, Object defaultValue, String defaultValueRole,\n            String defaultValueType, String name, Attribute value,\n            boolean flush, Request request, ModelBody modelBody)", "modifiers": "public", "return": "void", "signature": "void execute(boolean ignore, String preparer,\n            String role, Object defaultValue, String defaultValueRole,\n            String defaultValueType, String name, Attribute value,\n            boolean flush, Request request, ModelBody modelBody)", "full_signature": "public void execute(boolean ignore, String preparer,\n            String role, Object defaultValue, String defaultValueRole,\n            String defaultValueType, String name, Attribute value,\n            boolean flush, Request request, ModelBody modelBody)", "class_method_signature": "InsertAttributeModel.execute(boolean ignore, String preparer,\n            String role, Object defaultValue, String defaultValueRole,\n            String defaultValueType, String name, Attribute value,\n            boolean flush, Request request, ModelBody modelBody)", "testcase": false, "constructor": false}, {"identifier": "resolveAttribute", "parameters": "(TilesContainer container,\n            boolean ignore, String preparer, String role, Object defaultValue,\n            String defaultValueRole, String defaultValueType, String name,\n            Attribute value, Request request)", "modifiers": "private", "return": "Attribute", "signature": "Attribute resolveAttribute(TilesContainer container,\n            boolean ignore, String preparer, String role, Object defaultValue,\n            String defaultValueRole, String defaultValueType, String name,\n            Attribute value, Request request)", "full_signature": "private Attribute resolveAttribute(TilesContainer container,\n            boolean ignore, String preparer, String role, Object defaultValue,\n            String defaultValueRole, String defaultValueType, String name,\n            Attribute value, Request request)", "class_method_signature": "InsertAttributeModel.resolveAttribute(TilesContainer container,\n            boolean ignore, String preparer, String role, Object defaultValue,\n            String defaultValueRole, String defaultValueType, String name,\n            Attribute value, Request request)", "testcase": false, "constructor": false}, {"identifier": "renderAttribute", "parameters": "(TilesContainer container, boolean ignore,\n            Attribute attribute, Request request)", "modifiers": "private", "return": "void", "signature": "void renderAttribute(TilesContainer container, boolean ignore,\n            Attribute attribute, Request request)", "full_signature": "private void renderAttribute(TilesContainer container, boolean ignore,\n            Attribute attribute, Request request)", "class_method_signature": "InsertAttributeModel.renderAttribute(TilesContainer container, boolean ignore,\n            Attribute attribute, Request request)", "testcase": false, "constructor": false}], "file": "tiles-template/src/main/java/org/apache/tiles/template/InsertAttributeModel.java"}, "focal_method": {"identifier": "execute", "parameters": "(boolean ignore, String preparer,\n            String role, Object defaultValue, String defaultValueRole,\n            String defaultValueType, String name, Attribute value,\n            boolean flush, Request request, ModelBody modelBody)", "modifiers": "public", "return": "void", "body": "public void execute(boolean ignore, String preparer,\n            String role, Object defaultValue, String defaultValueRole,\n            String defaultValueType, String name, Attribute value,\n            boolean flush, Request request, ModelBody modelBody) throws IOException {\n        TilesContainer container = TilesAccess.getCurrentContainer(request);\n        Deque<Object> composeStack = ComposeStackUtil.getComposeStack(request);\n        Attribute attribute = resolveAttribute(container, ignore, preparer,\n                role, defaultValue, defaultValueRole, defaultValueType, name,\n                value, request);\n        if (attribute != null) {\n            composeStack.push(attribute);\n        }\n        modelBody.evaluateWithoutWriting();\n        container = TilesAccess.getCurrentContainer(request);\n        if (attribute != null) {\n            attribute = (Attribute) composeStack.pop();\n        }\n        renderAttribute(container, ignore, attribute, request);\n        if (flush) {\n            request.getWriter().flush();\n        }\n    }", "signature": "void execute(boolean ignore, String preparer,\n            String role, Object defaultValue, String defaultValueRole,\n            String defaultValueType, String name, Attribute value,\n            boolean flush, Request request, ModelBody modelBody)", "full_signature": "public void execute(boolean ignore, String preparer,\n            String role, Object defaultValue, String defaultValueRole,\n            String defaultValueType, String name, Attribute value,\n            boolean flush, Request request, ModelBody modelBody)", "class_method_signature": "InsertAttributeModel.execute(boolean ignore, String preparer,\n            String role, Object defaultValue, String defaultValueRole,\n            String defaultValueType, String name, Attribute value,\n            boolean flush, Request request, ModelBody modelBody)", "testcase": false, "constructor": false, "invocations": ["getCurrentContainer", "getComposeStack", "resolveAttribute", "push", "evaluateWithoutWriting", "getCurrentContainer", "pop", "renderAttribute", "flush", "getWriter"]}, "repository": {"repo_id": 2641714, "url": "https://github.com/apache/tiles", "language": "Java", "is_fork": false, "fork_count": 65, "stargazer_count": 99, "size": 12554, "license": "licensed"}}