{"test_class": {"identifier": "CompleteAutoloadTilesContainerFactoryTest", "superclass": "", "interfaces": "", "fields": [{"original_string": "private CompleteAutoloadTilesContainerFactory factory;", "modifier": "private", "type": "CompleteAutoloadTilesContainerFactory", "declarator": "factory", "var_name": "factory"}], "file": "tiles-extras/src/test/java/org/apache/tiles/extras/complete/CompleteAutoloadTilesContainerFactoryTest.java"}, "test_case": {"identifier": "testCreateDefaultAttributeRenderer", "parameters": "()", "modifiers": "@Test public", "return": "void", "body": "@Test\n    public void testCreateDefaultAttributeRenderer() {\n        ApplicationContext applicationContext = createMock(ApplicationContext.class);\n        TilesContainer container = createMock(TilesContainer.class);\n        AttributeEvaluatorFactory attributeEvaluatorFactory = createMock(AttributeEvaluatorFactory.class);\n        BasicRendererFactory rendererFactory = createMock(BasicRendererFactory.class);\n        Renderer stringRenderer = createMock(Renderer.class);\n        Renderer templateRenderer = createMock(Renderer.class);\n        Renderer definitionRenderer = createMock(Renderer.class);\n        Renderer velocityRenderer = createMock(Renderer.class);\n        Renderer freemarkerRenderer = createMock(Renderer.class);\n        Renderer mustacheRenderer = createMock(Renderer.class);\n\n        expect(rendererFactory.getRenderer(\"string\")).andReturn(stringRenderer);\n        expect(rendererFactory.getRenderer(\"template\")).andReturn(templateRenderer);\n        expect(rendererFactory.getRenderer(\"definition\")).andReturn(definitionRenderer);\n        expect(rendererFactory.getRenderer(\"velocity\")).andReturn(velocityRenderer);\n        expect(rendererFactory.getRenderer(\"freemarker\")).andReturn(freemarkerRenderer);\n        expect(rendererFactory.getRenderer(\"mustache\")).andReturn(mustacheRenderer);\n\n        replay(container, attributeEvaluatorFactory, rendererFactory, applicationContext);\n        Renderer renderer = factory.createDefaultAttributeRenderer(rendererFactory, applicationContext, container,\n                attributeEvaluatorFactory);\n        assertTrue(\"The default renderer class is not correct\", renderer instanceof ChainedDelegateRenderer);\n        verify(container, attributeEvaluatorFactory, rendererFactory, applicationContext);\n    }", "signature": "void testCreateDefaultAttributeRenderer()", "full_signature": "@Test public void testCreateDefaultAttributeRenderer()", "class_method_signature": "CompleteAutoloadTilesContainerFactoryTest.testCreateDefaultAttributeRenderer()", "testcase": true, "constructor": false, "invocations": ["createMock", "createMock", "createMock", "createMock", "createMock", "createMock", "createMock", "createMock", "createMock", "createMock", "andReturn", "expect", "getRenderer", "andReturn", "expect", "getRenderer", "andReturn", "expect", "getRenderer", "andReturn", "expect", "getRenderer", "andReturn", "expect", "getRenderer", "andReturn", "expect", "getRenderer", "replay", "createDefaultAttributeRenderer", "assertTrue", "verify"]}, "focal_class": {"identifier": "CompleteAutoloadTilesContainerFactory", "superclass": "extends BasicTilesContainerFactory", "interfaces": "", "fields": [{"original_string": "private static final String FREEMARKER_RENDERER_NAME = \"freemarker\";", "modifier": "private static final", "type": "String", "declarator": "FREEMARKER_RENDERER_NAME = \"freemarker\"", "var_name": "FREEMARKER_RENDERER_NAME"}, {"original_string": "private static final String VELOCITY_RENDERER_NAME = \"velocity\";", "modifier": "private static final", "type": "String", "declarator": "VELOCITY_RENDERER_NAME = \"velocity\"", "var_name": "VELOCITY_RENDERER_NAME"}, {"original_string": "private static final String MUSTACHE_RENDERER_NAME = \"mustache\";", "modifier": "private static final", "type": "String", "declarator": "MUSTACHE_RENDERER_NAME = \"mustache\"", "var_name": "MUSTACHE_RENDERER_NAME"}], "methods": [{"identifier": "createDecoratedContainer", "parameters": "(TilesContainer originalContainer,\n            ApplicationContext applicationContext)", "modifiers": "@Override public", "return": "TilesContainer", "signature": "TilesContainer createDecoratedContainer(TilesContainer originalContainer,\n            ApplicationContext applicationContext)", "full_signature": "@Override public TilesContainer createDecoratedContainer(TilesContainer originalContainer,\n            ApplicationContext applicationContext)", "class_method_signature": "CompleteAutoloadTilesContainerFactory.createDecoratedContainer(TilesContainer originalContainer,\n            ApplicationContext applicationContext)", "testcase": false, "constructor": false}, {"identifier": "registerAttributeRenderers", "parameters": "(\n            final BasicRendererFactory rendererFactory,\n            final ApplicationContext applicationContext,\n            final TilesContainer container,\n            final AttributeEvaluatorFactory attributeEvaluatorFactory)", "modifiers": "@Override protected", "return": "void", "signature": "void registerAttributeRenderers(\n            final BasicRendererFactory rendererFactory,\n            final ApplicationContext applicationContext,\n            final TilesContainer container,\n            final AttributeEvaluatorFactory attributeEvaluatorFactory)", "full_signature": "@Override protected void registerAttributeRenderers(\n            final BasicRendererFactory rendererFactory,\n            final ApplicationContext applicationContext,\n            final TilesContainer container,\n            final AttributeEvaluatorFactory attributeEvaluatorFactory)", "class_method_signature": "CompleteAutoloadTilesContainerFactory.registerAttributeRenderers(\n            final BasicRendererFactory rendererFactory,\n            final ApplicationContext applicationContext,\n            final TilesContainer container,\n            final AttributeEvaluatorFactory attributeEvaluatorFactory)", "testcase": false, "constructor": false}, {"identifier": "createDefaultAttributeRenderer", "parameters": "(BasicRendererFactory rendererFactory,\n            ApplicationContext applicationContext, TilesContainer container,\n            AttributeEvaluatorFactory attributeEvaluatorFactory)", "modifiers": "@Override protected", "return": "Renderer", "signature": "Renderer createDefaultAttributeRenderer(BasicRendererFactory rendererFactory,\n            ApplicationContext applicationContext, TilesContainer container,\n            AttributeEvaluatorFactory attributeEvaluatorFactory)", "full_signature": "@Override protected Renderer createDefaultAttributeRenderer(BasicRendererFactory rendererFactory,\n            ApplicationContext applicationContext, TilesContainer container,\n            AttributeEvaluatorFactory attributeEvaluatorFactory)", "class_method_signature": "CompleteAutoloadTilesContainerFactory.createDefaultAttributeRenderer(BasicRendererFactory rendererFactory,\n            ApplicationContext applicationContext, TilesContainer container,\n            AttributeEvaluatorFactory attributeEvaluatorFactory)", "testcase": false, "constructor": false}, {"identifier": "createAttributeEvaluatorFactory", "parameters": "(ApplicationContext applicationContext,\n            LocaleResolver resolver)", "modifiers": "@Override protected", "return": "AttributeEvaluatorFactory", "signature": "AttributeEvaluatorFactory createAttributeEvaluatorFactory(ApplicationContext applicationContext,\n            LocaleResolver resolver)", "full_signature": "@Override protected AttributeEvaluatorFactory createAttributeEvaluatorFactory(ApplicationContext applicationContext,\n            LocaleResolver resolver)", "class_method_signature": "CompleteAutoloadTilesContainerFactory.createAttributeEvaluatorFactory(ApplicationContext applicationContext,\n            LocaleResolver resolver)", "testcase": false, "constructor": false}, {"identifier": "createPatternDefinitionResolver", "parameters": "(Class<T> customizationKeyClass)", "modifiers": "@Override protected", "return": "PatternDefinitionResolver<T>", "signature": "PatternDefinitionResolver<T> createPatternDefinitionResolver(Class<T> customizationKeyClass)", "full_signature": "@Override protected PatternDefinitionResolver<T> createPatternDefinitionResolver(Class<T> customizationKeyClass)", "class_method_signature": "CompleteAutoloadTilesContainerFactory.createPatternDefinitionResolver(Class<T> customizationKeyClass)", "testcase": false, "constructor": false}, {"identifier": "getSources", "parameters": "(ApplicationContext applicationContext)", "modifiers": "@Override protected", "return": "List<ApplicationResource>", "signature": "List<ApplicationResource> getSources(ApplicationContext applicationContext)", "full_signature": "@Override protected List<ApplicationResource> getSources(ApplicationContext applicationContext)", "class_method_signature": "CompleteAutoloadTilesContainerFactory.getSources(ApplicationContext applicationContext)", "testcase": false, "constructor": false}, {"identifier": "createDefinitionsReader", "parameters": "(ApplicationContext applicationContext)", "modifiers": "@Override protected", "return": "DefinitionsReader", "signature": "DefinitionsReader createDefinitionsReader(ApplicationContext applicationContext)", "full_signature": "@Override protected DefinitionsReader createDefinitionsReader(ApplicationContext applicationContext)", "class_method_signature": "CompleteAutoloadTilesContainerFactory.createDefinitionsReader(ApplicationContext applicationContext)", "testcase": false, "constructor": false}, {"identifier": "createELEvaluator", "parameters": "(ApplicationContext applicationContext)", "modifiers": "private", "return": "ELAttributeEvaluator", "signature": "ELAttributeEvaluator createELEvaluator(ApplicationContext applicationContext)", "full_signature": "private ELAttributeEvaluator createELEvaluator(ApplicationContext applicationContext)", "class_method_signature": "CompleteAutoloadTilesContainerFactory.createELEvaluator(ApplicationContext applicationContext)", "testcase": false, "constructor": false}, {"identifier": "createMVELEvaluator", "parameters": "()", "modifiers": "private", "return": "MVELAttributeEvaluator", "signature": "MVELAttributeEvaluator createMVELEvaluator()", "full_signature": "private MVELAttributeEvaluator createMVELEvaluator()", "class_method_signature": "CompleteAutoloadTilesContainerFactory.createMVELEvaluator()", "testcase": false, "constructor": false}, {"identifier": "createOGNLEvaluator", "parameters": "()", "modifiers": "private", "return": "OGNLAttributeEvaluator", "signature": "OGNLAttributeEvaluator createOGNLEvaluator()", "full_signature": "private OGNLAttributeEvaluator createOGNLEvaluator()", "class_method_signature": "CompleteAutoloadTilesContainerFactory.createOGNLEvaluator()", "testcase": false, "constructor": false}], "file": "tiles-extras/src/main/java/org/apache/tiles/extras/complete/CompleteAutoloadTilesContainerFactory.java"}, "focal_method": {"identifier": "createDefaultAttributeRenderer", "parameters": "(BasicRendererFactory rendererFactory,\n            ApplicationContext applicationContext, TilesContainer container,\n            AttributeEvaluatorFactory attributeEvaluatorFactory)", "modifiers": "@Override protected", "return": "Renderer", "body": "@Override\n    protected Renderer createDefaultAttributeRenderer(BasicRendererFactory rendererFactory,\n            ApplicationContext applicationContext, TilesContainer container,\n            AttributeEvaluatorFactory attributeEvaluatorFactory) {\n\n        ChainedDelegateRenderer retValue = new ChainedDelegateRenderer();\n        retValue.addAttributeRenderer(rendererFactory.getRenderer(DEFINITION_RENDERER_NAME));\n        retValue.addAttributeRenderer(rendererFactory.getRenderer(VELOCITY_RENDERER_NAME));\n        retValue.addAttributeRenderer(rendererFactory.getRenderer(FREEMARKER_RENDERER_NAME));\n        retValue.addAttributeRenderer(rendererFactory.getRenderer(MUSTACHE_RENDERER_NAME));\n        retValue.addAttributeRenderer(rendererFactory.getRenderer(TEMPLATE_RENDERER_NAME));\n        retValue.addAttributeRenderer(rendererFactory.getRenderer(STRING_RENDERER_NAME));\n        return retValue;\n    }", "signature": "Renderer createDefaultAttributeRenderer(BasicRendererFactory rendererFactory,\n            ApplicationContext applicationContext, TilesContainer container,\n            AttributeEvaluatorFactory attributeEvaluatorFactory)", "full_signature": "@Override protected Renderer createDefaultAttributeRenderer(BasicRendererFactory rendererFactory,\n            ApplicationContext applicationContext, TilesContainer container,\n            AttributeEvaluatorFactory attributeEvaluatorFactory)", "class_method_signature": "CompleteAutoloadTilesContainerFactory.createDefaultAttributeRenderer(BasicRendererFactory rendererFactory,\n            ApplicationContext applicationContext, TilesContainer container,\n            AttributeEvaluatorFactory attributeEvaluatorFactory)", "testcase": false, "constructor": false, "invocations": ["addAttributeRenderer", "getRenderer", "addAttributeRenderer", "getRenderer", "addAttributeRenderer", "getRenderer", "addAttributeRenderer", "getRenderer", "addAttributeRenderer", "getRenderer", "addAttributeRenderer", "getRenderer"]}, "repository": {"repo_id": 2641714, "url": "https://github.com/apache/tiles", "language": "Java", "is_fork": false, "fork_count": 65, "stargazer_count": 99, "size": 12554, "license": "licensed"}}