{"test_class": {"identifier": "VelocityAutotagRuntimeTest", "superclass": "", "interfaces": "", "fields": [], "file": "tiles-request-velocity/src/test/java/org/apache/tiles/request/velocity/autotag/VelocityAutotagRuntimeTest.java"}, "test_case": {"identifier": "testCreateRequest", "parameters": "()", "modifiers": "@Test public", "return": "void", "body": "@Test\n    public void testCreateRequest() {\n        InternalContextAdapter context = createMock(InternalContextAdapter.class);\n        Writer writer = createMock(Writer.class);\n        Node node = createMock(Node.class);\n        ViewToolContext viewContext = createMock(ViewToolContext.class);\n        HttpServletRequest request = createMock(HttpServletRequest.class);\n        HttpServletResponse response = createMock(HttpServletResponse.class);\n        ServletContext servletContext = createMock(ServletContext.class);\n        ApplicationContext applicationContext = createMock(ApplicationContext.class);\n\n        expect(context.getInternalUserContext()).andReturn(viewContext);\n        expect(viewContext.getRequest()).andReturn(request);\n        expect(viewContext.getResponse()).andReturn(response);\n        expect(viewContext.getServletContext()).andReturn(servletContext);\n        expect(servletContext.getAttribute(ApplicationAccess.APPLICATION_CONTEXT_ATTRIBUTE)).andReturn(applicationContext);\n\n        replay(context, writer, node, viewContext, request, response, servletContext, applicationContext);\n        VelocityAutotagRuntime runtime = new VelocityAutotagRuntime();\n        runtime.render(context, writer, node);\n        Request velocityRequest = runtime.createRequest();\n        assertTrue(velocityRequest instanceof VelocityRequest);\n        verify(context, writer, node, viewContext, request, response, servletContext, applicationContext);\n    }", "signature": "void testCreateRequest()", "full_signature": "@Test public void testCreateRequest()", "class_method_signature": "VelocityAutotagRuntimeTest.testCreateRequest()", "testcase": true, "constructor": false, "invocations": ["createMock", "createMock", "createMock", "createMock", "createMock", "createMock", "createMock", "createMock", "andReturn", "expect", "getInternalUserContext", "andReturn", "expect", "getRequest", "andReturn", "expect", "getResponse", "andReturn", "expect", "getServletContext", "andReturn", "expect", "getAttribute", "replay", "render", "createRequest", "assertTrue", "verify"]}, "focal_class": {"identifier": "VelocityAutotagRuntime", "superclass": "extends Directive", "interfaces": "implements AutotagRuntime<Request>", "fields": [{"original_string": "private InternalContextAdapter context;", "modifier": "private", "type": "InternalContextAdapter", "declarator": "context", "var_name": "context"}, {"original_string": "private Writer                 writer;", "modifier": "private", "type": "Writer", "declarator": "writer", "var_name": "writer"}, {"original_string": "private Node                   node;", "modifier": "private", "type": "Node", "declarator": "node", "var_name": "node"}, {"original_string": "private Map<String, Object>    params;", "modifier": "private", "type": "Map<String, Object>", "declarator": "params", "var_name": "params"}], "methods": [{"identifier": "createRequest", "parameters": "()", "modifiers": "@Override public", "return": "Request", "signature": "Request createRequest()", "full_signature": "@Override public Request createRequest()", "class_method_signature": "VelocityAutotagRuntime.createRequest()", "testcase": false, "constructor": false}, {"identifier": "createModelBody", "parameters": "()", "modifiers": "@Override public", "return": "ModelBody", "signature": "ModelBody createModelBody()", "full_signature": "@Override public ModelBody createModelBody()", "class_method_signature": "VelocityAutotagRuntime.createModelBody()", "testcase": false, "constructor": false}, {"identifier": "getParameter", "parameters": "(String name, Class<T> type, T defaultValue)", "modifiers": "@Override @SuppressWarnings(\"unchecked\") public", "return": "T", "signature": "T getParameter(String name, Class<T> type, T defaultValue)", "full_signature": "@Override @SuppressWarnings(\"unchecked\") public T getParameter(String name, Class<T> type, T defaultValue)", "class_method_signature": "VelocityAutotagRuntime.getParameter(String name, Class<T> type, T defaultValue)", "testcase": false, "constructor": false}, {"identifier": "getName", "parameters": "()", "modifiers": "@Override public", "return": "String", "signature": "String getName()", "full_signature": "@Override public String getName()", "class_method_signature": "VelocityAutotagRuntime.getName()", "testcase": false, "constructor": false}, {"identifier": "getType", "parameters": "()", "modifiers": "@Override public", "return": "int", "signature": "int getType()", "full_signature": "@Override public int getType()", "class_method_signature": "VelocityAutotagRuntime.getType()", "testcase": false, "constructor": false}, {"identifier": "render", "parameters": "(InternalContextAdapter context, Writer writer, Node node)", "modifiers": "@Override public", "return": "boolean", "signature": "boolean render(InternalContextAdapter context, Writer writer, Node node)", "full_signature": "@Override public boolean render(InternalContextAdapter context, Writer writer, Node node)", "class_method_signature": "VelocityAutotagRuntime.render(InternalContextAdapter context, Writer writer, Node node)", "testcase": false, "constructor": false}], "file": "tiles-request-velocity/src/main/java/org/apache/tiles/request/velocity/autotag/VelocityAutotagRuntime.java"}, "focal_method": {"identifier": "createRequest", "parameters": "()", "modifiers": "@Override public", "return": "Request", "body": "@Override\n    public Request createRequest() {\n        ViewContext viewContext = (ViewContext) context.getInternalUserContext();\n        HttpServletRequest request = viewContext.getRequest();\n        HttpServletResponse response = viewContext.getResponse();\n        ServletContext servletContext = viewContext.getServletContext();\n        return VelocityRequest.createVelocityRequest(ServletUtil.getApplicationContext(servletContext),\n                                                     request,\n                                                     response,\n                                                     context,\n                                                     writer);\n    }", "signature": "Request createRequest()", "full_signature": "@Override public Request createRequest()", "class_method_signature": "VelocityAutotagRuntime.createRequest()", "testcase": false, "constructor": false, "invocations": ["getInternalUserContext", "getRequest", "getResponse", "getServletContext", "createVelocityRequest", "getApplicationContext"]}, "repository": {"repo_id": 4269155, "url": "https://github.com/apache/tiles-request", "language": "Java", "is_fork": false, "fork_count": 4, "stargazer_count": 5, "size": 865, "license": "licensed"}}