{"test_class": {"identifier": "TendersByItemExcelControllerTest", "superclass": "extends AbstractExcelControllerTest", "interfaces": "", "fields": [{"original_string": "@Autowired\n    private TendersByItemExcelController tendersByItemExcelController;", "modifier": "@Autowired\n    private", "type": "TendersByItemExcelController", "declarator": "tendersByItemExcelController", "var_name": "tendersByItemExcelController"}], "file": "web/src/test/java/org/devgateway/ocds/web/rest/controller/excelchart/TendersByItemExcelControllerTest.java"}, "test_case": {"identifier": "numberOfTendersByItemExcelChart", "parameters": "()", "modifiers": "@Test public", "return": "void", "body": "@Test\n    public void numberOfTendersByItemExcelChart() throws Exception {\n        LangYearFilterPagingRequest filter = getLangYearFilterMockRequest();\n        tendersByItemExcelController.numberOfTendersByItemExcelChart(\n                filter,\n                mockHttpServletResponse);\n\n        final byte[] responseOutput = mockHttpServletResponse.getContentAsByteArray();\n        final Workbook workbook = new XSSFWorkbook(new ByteArrayInputStream(responseOutput));\n        Assert.assertNotNull(workbook);\n\n        final Sheet sheet = workbook.getSheet(ChartType.barcol.toString());\n        Assert.assertNotNull(\"check chart type, sheet name should be the same as the type\", sheet);\n\n        final XSSFDrawing drawing = (XSSFDrawing) sheet.getDrawingPatriarch();\n        final List<XSSFChart> charts =  drawing.getCharts();\n        Assert.assertEquals(\"number of charts\", 1, charts.size());\n\n        final XSSFChart chart = charts.get(0);\n        Assert.assertEquals(\"chart title\",\n              translationService.getValue(filter.getLanguage(), \"charts:bidsByItem:title\"),\n                chart.getTitle().getString());\n\n        final List<? extends XSSFChartAxis> axis = chart.getAxis();\n        Assert.assertEquals(\"number of axis\", 2, axis.size());\n\n        final CTChart ctChart = chart.getCTChart();\n        Assert.assertEquals(\"Check if we have 1 bar chart\", 1, ctChart.getPlotArea().getBarChartArray().length);\n    }", "signature": "void numberOfTendersByItemExcelChart()", "full_signature": "@Test public void numberOfTendersByItemExcelChart()", "class_method_signature": "TendersByItemExcelControllerTest.numberOfTendersByItemExcelChart()", "testcase": true, "constructor": false, "invocations": ["getLangYearFilterMockRequest", "numberOfTendersByItemExcelChart", "getContentAsByteArray", "assertNotNull", "getSheet", "toString", "assertNotNull", "getDrawingPatriarch", "getCharts", "assertEquals", "size", "get", "assertEquals", "getValue", "getLanguage", "getString", "getTitle", "getAxis", "assertEquals", "size", "getCTChart", "assertEquals", "getBarChartArray", "getPlotArea"]}, "focal_class": {"identifier": "TendersByItemExcelController", "superclass": "extends ExcelChartOCDSController", "interfaces": "", "fields": [{"original_string": "@Autowired\n    private ExcelChartGenerator excelChartGenerator;", "modifier": "@Autowired\n    private", "type": "ExcelChartGenerator", "declarator": "excelChartGenerator", "var_name": "excelChartGenerator"}, {"original_string": "@Autowired\n    private ExcelChartHelper excelChartHelper;", "modifier": "@Autowired\n    private", "type": "ExcelChartHelper", "declarator": "excelChartHelper", "var_name": "excelChartHelper"}, {"original_string": "@Autowired\n    private TendersByItemClassification tendersByItemClassification;", "modifier": "@Autowired\n    private", "type": "TendersByItemClassification", "declarator": "tendersByItemClassification", "var_name": "tendersByItemClassification"}], "methods": [{"identifier": "numberOfTendersByItemExcelChart", "parameters": "(@ModelAttribute @Valid final LangYearFilterPagingRequest filter,\n                                                final HttpServletResponse response)", "modifiers": "@ApiOperation(value = \"Exports *Number of bids by item* dashboard in Excel format.\") @RequestMapping(value = \"/api/ocds/tendersByItemExcelChart\", method = {RequestMethod.GET, RequestMethod.POST}) public", "return": "void", "signature": "void numberOfTendersByItemExcelChart(@ModelAttribute @Valid final LangYearFilterPagingRequest filter,\n                                                final HttpServletResponse response)", "full_signature": "@ApiOperation(value = \"Exports *Number of bids by item* dashboard in Excel format.\") @RequestMapping(value = \"/api/ocds/tendersByItemExcelChart\", method = {RequestMethod.GET, RequestMethod.POST}) public void numberOfTendersByItemExcelChart(@ModelAttribute @Valid final LangYearFilterPagingRequest filter,\n                                                final HttpServletResponse response)", "class_method_signature": "TendersByItemExcelController.numberOfTendersByItemExcelChart(@ModelAttribute @Valid final LangYearFilterPagingRequest filter,\n                                                final HttpServletResponse response)", "testcase": false, "constructor": false}], "file": "web/src/main/java/org/devgateway/ocds/web/rest/controller/excelchart/TendersByItemExcelController.java"}, "focal_method": {"identifier": "numberOfTendersByItemExcelChart", "parameters": "(@ModelAttribute @Valid final LangYearFilterPagingRequest filter,\n                                                final HttpServletResponse response)", "modifiers": "@ApiOperation(value = \"Exports *Number of bids by item* dashboard in Excel format.\") @RequestMapping(value = \"/api/ocds/tendersByItemExcelChart\", method = {RequestMethod.GET, RequestMethod.POST}) public", "return": "void", "body": "@ApiOperation(value = \"Exports *Number of bids by item* dashboard in Excel format.\")\n    @RequestMapping(value = \"/api/ocds/tendersByItemExcelChart\",\n            method = {RequestMethod.GET, RequestMethod.POST})\n    public void numberOfTendersByItemExcelChart(@ModelAttribute @Valid final LangYearFilterPagingRequest filter,\n                                                final HttpServletResponse response) throws IOException {\n\n        final String chartTitle = translationService.getValue(filter.getLanguage(), \"charts:bidsByItem:title\");\n\n        // fetch the data that will be displayed in the chart\n        final List<Document> numberOfTendersByItem =\n                tendersByItemClassification.tendersByItemClassification(filter);\n\n        final List<?> categories = excelChartHelper.getCategoriesFromDBObject(\n                TendersByItemClassification.Keys.DESCRIPTION, numberOfTendersByItem);\n\n        final List<List<? extends Number>> values = new ArrayList<>();\n\n        final List<Number> totalTenderAmount = excelChartHelper.getValuesFromDBObject(numberOfTendersByItem,\n                categories, TendersByItemClassification.Keys.DESCRIPTION,\n                TendersByItemClassification.Keys.TOTAL_TENDERS);\n        if (!totalTenderAmount.isEmpty()) {\n            values.add(totalTenderAmount);\n        }\n\n        // check if we have anything to display before setting the *seriesTitle*.\n        final List<String> seriesTitle;\n        if (!values.isEmpty()) {\n            seriesTitle = Arrays.asList(\n                    translationService.getValue(filter.getLanguage(), \"charts:bidsByItem:xAxisTitle\"));\n        } else {\n            seriesTitle = new ArrayList<>();\n        }\n\n        response.setContentType(\"application/vnd.openxmlformats-officedocument.spreadsheetml.sheet\");\n        response.setHeader(\"Content-Disposition\", \"attachment; filename=\" + chartTitle + \".xlsx\");\n        response.getOutputStream().write(\n                excelChartGenerator.getExcelChart(\n                        ChartType.barcol,\n                        chartTitle,\n                        seriesTitle,\n                        categories, values));\n    }", "signature": "void numberOfTendersByItemExcelChart(@ModelAttribute @Valid final LangYearFilterPagingRequest filter,\n                                                final HttpServletResponse response)", "full_signature": "@ApiOperation(value = \"Exports *Number of bids by item* dashboard in Excel format.\") @RequestMapping(value = \"/api/ocds/tendersByItemExcelChart\", method = {RequestMethod.GET, RequestMethod.POST}) public void numberOfTendersByItemExcelChart(@ModelAttribute @Valid final LangYearFilterPagingRequest filter,\n                                                final HttpServletResponse response)", "class_method_signature": "TendersByItemExcelController.numberOfTendersByItemExcelChart(@ModelAttribute @Valid final LangYearFilterPagingRequest filter,\n                                                final HttpServletResponse response)", "testcase": false, "constructor": false, "invocations": ["getValue", "getLanguage", "tendersByItemClassification", "getCategoriesFromDBObject", "getValuesFromDBObject", "isEmpty", "add", "isEmpty", "asList", "getValue", "getLanguage", "setContentType", "setHeader", "write", "getOutputStream", "getExcelChart"]}, "repository": {"repo_id": 59118773, "url": "https://github.com/devgateway/oc-explorer", "language": "Java", "is_fork": false, "fork_count": 2, "stargazer_count": 5, "size": 9004, "license": "licensed"}}