{"test_class": {"identifier": "TenderPriceExcelControllerTest", "superclass": "extends AbstractExcelControllerTest", "interfaces": "", "fields": [{"original_string": "@Autowired\n    private TenderPriceExcelController tenderPriceExcelController;", "modifier": "@Autowired\n    private", "type": "TenderPriceExcelController", "declarator": "tenderPriceExcelController", "var_name": "tenderPriceExcelController"}], "file": "web/src/test/java/org/devgateway/ocds/web/rest/controller/excelchart/TenderPriceExcelControllerTest.java"}, "test_case": {"identifier": "procurementMethodExcelChart", "parameters": "()", "modifiers": "@Test public", "return": "void", "body": "@Test\n    public void procurementMethodExcelChart() throws Exception {\n        LangYearFilterPagingRequest filter = getLangYearFilterMockRequest();\n        tenderPriceExcelController.procurementMethodExcelChart(\n                filter,\n                mockHttpServletResponse);\n\n        final byte[] responseOutput = mockHttpServletResponse.getContentAsByteArray();\n        final Workbook workbook = new XSSFWorkbook(new ByteArrayInputStream(responseOutput));\n        Assert.assertNotNull(workbook);\n\n        final Sheet sheet = workbook.getSheet(ChartType.barcol.toString());\n        Assert.assertNotNull(\"check chart type, sheet name should be the same as the type\", sheet);\n\n        final XSSFDrawing drawing = (XSSFDrawing) sheet.getDrawingPatriarch();\n        final List<XSSFChart> charts =  drawing.getCharts();\n        Assert.assertEquals(\"number of charts\", 1, charts.size());\n\n        final XSSFChart chart = charts.get(0);\n        Assert.assertEquals(\"chart title\",\n                translationService.getValue(filter.getLanguage(),\"charts:procurementMethod:title\"),\n                chart.getTitle().getString());\n\n        final List<? extends XSSFChartAxis> axis = chart.getAxis();\n        Assert.assertEquals(\"number of axis\", 2, axis.size());\n\n        final CTChart ctChart = chart.getCTChart();\n        Assert.assertEquals(\"Check if we have 1 bar chart\", 1, ctChart.getPlotArea().getBarChartArray().length);\n    }", "signature": "void procurementMethodExcelChart()", "full_signature": "@Test public void procurementMethodExcelChart()", "class_method_signature": "TenderPriceExcelControllerTest.procurementMethodExcelChart()", "testcase": true, "constructor": false, "invocations": ["getLangYearFilterMockRequest", "procurementMethodExcelChart", "getContentAsByteArray", "assertNotNull", "getSheet", "toString", "assertNotNull", "getDrawingPatriarch", "getCharts", "assertEquals", "size", "get", "assertEquals", "getValue", "getLanguage", "getString", "getTitle", "getAxis", "assertEquals", "size", "getCTChart", "assertEquals", "getBarChartArray", "getPlotArea"]}, "focal_class": {"identifier": "TenderPriceExcelController", "superclass": "extends ExcelChartOCDSController", "interfaces": "", "fields": [{"original_string": "@Autowired\n    private ExcelChartGenerator excelChartGenerator;", "modifier": "@Autowired\n    private", "type": "ExcelChartGenerator", "declarator": "excelChartGenerator", "var_name": "excelChartGenerator"}, {"original_string": "@Autowired\n    private ExcelChartHelper excelChartHelper;", "modifier": "@Autowired\n    private", "type": "ExcelChartHelper", "declarator": "excelChartHelper", "var_name": "excelChartHelper"}, {"original_string": "@Autowired\n    private TenderPriceByTypeYearController tenderPriceByTypeYearController;", "modifier": "@Autowired\n    private", "type": "TenderPriceByTypeYearController", "declarator": "tenderPriceByTypeYearController", "var_name": "tenderPriceByTypeYearController"}], "methods": [{"identifier": "procurementMethodExcelChart", "parameters": "(@ModelAttribute @Valid final LangYearFilterPagingRequest filter,\n                                            final HttpServletResponse response)", "modifiers": "@ApiOperation(value = \"Exports *Procurement method* dashboard in Excel format.\") @RequestMapping(value = \"/api/ocds/procurementMethodExcelChart\", method = {RequestMethod.GET, RequestMethod.POST}) public", "return": "void", "signature": "void procurementMethodExcelChart(@ModelAttribute @Valid final LangYearFilterPagingRequest filter,\n                                            final HttpServletResponse response)", "full_signature": "@ApiOperation(value = \"Exports *Procurement method* dashboard in Excel format.\") @RequestMapping(value = \"/api/ocds/procurementMethodExcelChart\", method = {RequestMethod.GET, RequestMethod.POST}) public void procurementMethodExcelChart(@ModelAttribute @Valid final LangYearFilterPagingRequest filter,\n                                            final HttpServletResponse response)", "class_method_signature": "TenderPriceExcelController.procurementMethodExcelChart(@ModelAttribute @Valid final LangYearFilterPagingRequest filter,\n                                            final HttpServletResponse response)", "testcase": false, "constructor": false}], "file": "web/src/main/java/org/devgateway/ocds/web/rest/controller/excelchart/TenderPriceExcelController.java"}, "focal_method": {"identifier": "procurementMethodExcelChart", "parameters": "(@ModelAttribute @Valid final LangYearFilterPagingRequest filter,\n                                            final HttpServletResponse response)", "modifiers": "@ApiOperation(value = \"Exports *Procurement method* dashboard in Excel format.\") @RequestMapping(value = \"/api/ocds/procurementMethodExcelChart\", method = {RequestMethod.GET, RequestMethod.POST}) public", "return": "void", "body": "@ApiOperation(value = \"Exports *Procurement method* dashboard in Excel format.\")\n    @RequestMapping(value = \"/api/ocds/procurementMethodExcelChart\", method = {RequestMethod.GET, RequestMethod.POST})\n    public void procurementMethodExcelChart(@ModelAttribute @Valid final LangYearFilterPagingRequest filter,\n                                            final HttpServletResponse response) throws IOException {\n\n        final String chartTitle = translationService.getValue(filter.getLanguage(), \"charts:procurementMethod:title\");\n\n        // fetch the data that will be displayed in the chart\n        final List<Document> tenderPriceByBidSelection =\n                tenderPriceByTypeYearController.tenderPriceByProcurementMethod(filter);\n\n        final List<?> categories = excelChartHelper.getCategoriesFromDBObject(\n                TenderPriceByTypeYearController.Keys.PROCUREMENT_METHOD, tenderPriceByBidSelection);\n\n        final List<List<? extends Number>> values = new ArrayList<>();\n        final List<Number> totalTenderAmount = excelChartHelper.getValuesFromDBObject(tenderPriceByBidSelection,\n                categories, TenderPriceByTypeYearController.Keys.PROCUREMENT_METHOD,\n                TenderPriceByTypeYearController.Keys.TOTAL_TENDER_AMOUNT);\n        if (!totalTenderAmount.isEmpty()) {\n            values.add(totalTenderAmount);\n        }\n\n        // check if we have anything to display before setting the *seriesTitle*.\n        final List<String> seriesTitle;\n        if (!values.isEmpty()) {\n            seriesTitle = Arrays.asList(\n                    translationService.getValue(filter.getLanguage(), \"charts:procurementMethod:xAxisName\")\n                    );\n        } else {\n            seriesTitle = new ArrayList<>();\n        }\n\n        response.setContentType(\"application/vnd.openxmlformats-officedocument.spreadsheetml.sheet\");\n        response.setHeader(\"Content-Disposition\", \"attachment; filename=\" + chartTitle + \".xlsx\");\n        response.getOutputStream().write(\n                excelChartGenerator.getExcelChart(\n                        ChartType.barcol,\n                        chartTitle,\n                        seriesTitle,\n                        categories, values));\n    }", "signature": "void procurementMethodExcelChart(@ModelAttribute @Valid final LangYearFilterPagingRequest filter,\n                                            final HttpServletResponse response)", "full_signature": "@ApiOperation(value = \"Exports *Procurement method* dashboard in Excel format.\") @RequestMapping(value = \"/api/ocds/procurementMethodExcelChart\", method = {RequestMethod.GET, RequestMethod.POST}) public void procurementMethodExcelChart(@ModelAttribute @Valid final LangYearFilterPagingRequest filter,\n                                            final HttpServletResponse response)", "class_method_signature": "TenderPriceExcelController.procurementMethodExcelChart(@ModelAttribute @Valid final LangYearFilterPagingRequest filter,\n                                            final HttpServletResponse response)", "testcase": false, "constructor": false, "invocations": ["getValue", "getLanguage", "tenderPriceByProcurementMethod", "getCategoriesFromDBObject", "getValuesFromDBObject", "isEmpty", "add", "isEmpty", "asList", "getValue", "getLanguage", "setContentType", "setHeader", "write", "getOutputStream", "getExcelChart"]}, "repository": {"repo_id": 59118773, "url": "https://github.com/devgateway/oc-explorer", "language": "Java", "is_fork": false, "fork_count": 2, "stargazer_count": 5, "size": 9004, "license": "licensed"}}