{"test_class": {"identifier": "TopTenControllerTest", "superclass": "extends AbstractEndPointControllerTest", "interfaces": "", "fields": [{"original_string": "@Autowired\n    private TopTenController topTenController;", "modifier": "@Autowired\n    private", "type": "TopTenController", "declarator": "topTenController", "var_name": "topTenController"}], "file": "web/src/test/java/org/devgateway/ocds/web/rest/controller/TopTenControllerTest.java"}, "test_case": {"identifier": "topTenLargestAwards", "parameters": "()", "modifiers": "@Test public", "return": "void", "body": "@Test\n    public void topTenLargestAwards() throws Exception {\n        final List<Document> topTenLargestAwards = topTenController\n                .topTenLargestAwards(new YearFilterPagingRequest());\n\n        Assert.assertEquals(2, topTenLargestAwards.size());\n\n        final Document first = topTenLargestAwards.get(0);\n        BasicDBObject awards = (BasicDBObject) first.get(\"awards\");\n        BasicDBObject value = (BasicDBObject) awards.get(\"value\");\n        double amount = (double) value.get(\"amount\");\n        Assert.assertEquals(6000000.0, amount, 0);\n\n        final Document second = topTenLargestAwards.get(1);\n        awards = (BasicDBObject) second.get(\"awards\");\n        value = (BasicDBObject) awards.get(\"value\");\n        amount = (double) value.get(\"amount\");\n        Assert.assertEquals(40000.0, amount, 0);\n    }", "signature": "void topTenLargestAwards()", "full_signature": "@Test public void topTenLargestAwards()", "class_method_signature": "TopTenControllerTest.topTenLargestAwards()", "testcase": true, "constructor": false, "invocations": ["topTenLargestAwards", "assertEquals", "size", "get", "get", "get", "get", "assertEquals", "get", "get", "get", "get", "assertEquals"]}, "focal_class": {"identifier": "TopTenController", "superclass": "extends GenericOCDSController", "interfaces": "", "fields": [], "methods": [{"identifier": "topTenLargestAwards", "parameters": "(@ModelAttribute @Valid final YearFilterPagingRequest filter)", "modifiers": "@ApiOperation(value = \"Returns the top ten largest active awards.\" + \" The amount is taken from the award.value field. The returned data will contain\" + \"the following fields: \" + \"awards.date, awards.suppliers.name, \" + \"awards.value.amount, awards.suppliers.name, planning.budget (if any)\") @RequestMapping(value = \"/api/topTenLargestAwards\", method = {RequestMethod.POST, RequestMethod.GET}, produces = \"application/json\") public", "return": "List<Document>", "signature": "List<Document> topTenLargestAwards(@ModelAttribute @Valid final YearFilterPagingRequest filter)", "full_signature": "@ApiOperation(value = \"Returns the top ten largest active awards.\" + \" The amount is taken from the award.value field. The returned data will contain\" + \"the following fields: \" + \"awards.date, awards.suppliers.name, \" + \"awards.value.amount, awards.suppliers.name, planning.budget (if any)\") @RequestMapping(value = \"/api/topTenLargestAwards\", method = {RequestMethod.POST, RequestMethod.GET}, produces = \"application/json\") public List<Document> topTenLargestAwards(@ModelAttribute @Valid final YearFilterPagingRequest filter)", "class_method_signature": "TopTenController.topTenLargestAwards(@ModelAttribute @Valid final YearFilterPagingRequest filter)", "testcase": false, "constructor": false}, {"identifier": "topTenLargestTenders", "parameters": "(@ModelAttribute @Valid final YearFilterPagingRequest filter)", "modifiers": "@ApiOperation(value = \"Returns the top ten largest active tenders.\" + \" The amount is taken from the tender.value.amount field.\" + \" The returned data will contain\" + \"the following fields: \" + \"tender.date, tender.value.amount, tender.tenderPeriod, \" + \"tender.procuringEntity.name\") @RequestMapping(value = \"/api/topTenLargestTenders\", method = {RequestMethod.POST, RequestMethod.GET}, produces = \"application/json\") public", "return": "List<Document>", "signature": "List<Document> topTenLargestTenders(@ModelAttribute @Valid final YearFilterPagingRequest filter)", "full_signature": "@ApiOperation(value = \"Returns the top ten largest active tenders.\" + \" The amount is taken from the tender.value.amount field.\" + \" The returned data will contain\" + \"the following fields: \" + \"tender.date, tender.value.amount, tender.tenderPeriod, \" + \"tender.procuringEntity.name\") @RequestMapping(value = \"/api/topTenLargestTenders\", method = {RequestMethod.POST, RequestMethod.GET}, produces = \"application/json\") public List<Document> topTenLargestTenders(@ModelAttribute @Valid final YearFilterPagingRequest filter)", "class_method_signature": "TopTenController.topTenLargestTenders(@ModelAttribute @Valid final YearFilterPagingRequest filter)", "testcase": false, "constructor": false}, {"identifier": "topTenLargestSuppliers", "parameters": "(@ModelAttribute @Valid final YearFilterPagingRequest filter)", "modifiers": "@ApiOperation(value = \"This endpoint should return the following data for the Top 10 suppliers (by award value).\" + \"Returns supplier id, total awarded amount of all awarded contracts, count of awarded contracts,\" + \"Ids of the procuring entities from which they have received an award, and their count. \" + \"All filters ally here, the year filter uses the awards.date field.\") @RequestMapping(value = \"/api/topTenSuppliers\", method = {RequestMethod.POST, RequestMethod.GET}, produces = \"application/json\") public", "return": "List<Document>", "signature": "List<Document> topTenLargestSuppliers(@ModelAttribute @Valid final YearFilterPagingRequest filter)", "full_signature": "@ApiOperation(value = \"This endpoint should return the following data for the Top 10 suppliers (by award value).\" + \"Returns supplier id, total awarded amount of all awarded contracts, count of awarded contracts,\" + \"Ids of the procuring entities from which they have received an award, and their count. \" + \"All filters ally here, the year filter uses the awards.date field.\") @RequestMapping(value = \"/api/topTenSuppliers\", method = {RequestMethod.POST, RequestMethod.GET}, produces = \"application/json\") public List<Document> topTenLargestSuppliers(@ModelAttribute @Valid final YearFilterPagingRequest filter)", "class_method_signature": "TopTenController.topTenLargestSuppliers(@ModelAttribute @Valid final YearFilterPagingRequest filter)", "testcase": false, "constructor": false}], "file": "web/src/main/java/org/devgateway/ocds/web/rest/controller/TopTenController.java"}, "focal_method": {"identifier": "topTenLargestAwards", "parameters": "(@ModelAttribute @Valid final YearFilterPagingRequest filter)", "modifiers": "@ApiOperation(value = \"Returns the top ten largest active awards.\" + \" The amount is taken from the award.value field. The returned data will contain\" + \"the following fields: \" + \"awards.date, awards.suppliers.name, \" + \"awards.value.amount, awards.suppliers.name, planning.budget (if any)\") @RequestMapping(value = \"/api/topTenLargestAwards\", method = {RequestMethod.POST, RequestMethod.GET}, produces = \"application/json\") public", "return": "List<Document>", "body": "@ApiOperation(value = \"Returns the top ten largest active awards.\"\n            + \" The amount is taken from the award.value field. The returned data will contain\"\n            + \"the following fields: \"\n            + \"awards.date, awards.suppliers.name, \"\n            + \"awards.value.amount, awards.suppliers.name, planning.budget (if any)\")\n    @RequestMapping(value = \"/api/topTenLargestAwards\", method = {RequestMethod.POST,\n            RequestMethod.GET},\n            produces = \"application/json\")\n    public List<Document> topTenLargestAwards(@ModelAttribute @Valid final YearFilterPagingRequest filter) {\n\n        BasicDBObject project = new BasicDBObject();\n        project.put(Fields.UNDERSCORE_ID, 0);\n        project.put(MongoConstants.FieldNames.AWARDS_DATE, 1);\n        project.put(\"awards.suppliers.name\", 1);\n        project.put(MongoConstants.FieldNames.AWARDS_VALUE_AMOUNT, 1);\n        project.put(\"planning.budget\", 1);\n\n        Aggregation agg = newAggregation(\n                match(where(MongoConstants.FieldNames.AWARDS_VALUE_AMOUNT).exists(true)\n                        .and(MongoConstants.FieldNames.AWARDS_STATUS)\n                        .is(Award.Status.active.toString())\n                        .andOperator(getDefaultFilterCriteria(filter))),\n                unwind(\"awards\"),\n                match(getYearFilterCriteria(filter.awardFiltering(), MongoConstants.FieldNames.AWARDS_DATE)),\n                new CustomOperation(new Document(\"$project\", project)),\n                sort(Direction.DESC, MongoConstants.FieldNames.AWARDS_VALUE_AMOUNT), limit(10)\n        );\n\n        return releaseAgg(agg);\n    }", "signature": "List<Document> topTenLargestAwards(@ModelAttribute @Valid final YearFilterPagingRequest filter)", "full_signature": "@ApiOperation(value = \"Returns the top ten largest active awards.\" + \" The amount is taken from the award.value field. The returned data will contain\" + \"the following fields: \" + \"awards.date, awards.suppliers.name, \" + \"awards.value.amount, awards.suppliers.name, planning.budget (if any)\") @RequestMapping(value = \"/api/topTenLargestAwards\", method = {RequestMethod.POST, RequestMethod.GET}, produces = \"application/json\") public List<Document> topTenLargestAwards(@ModelAttribute @Valid final YearFilterPagingRequest filter)", "class_method_signature": "TopTenController.topTenLargestAwards(@ModelAttribute @Valid final YearFilterPagingRequest filter)", "testcase": false, "constructor": false, "invocations": ["put", "put", "put", "put", "put", "newAggregation", "match", "andOperator", "is", "and", "exists", "where", "toString", "getDefaultFilterCriteria", "unwind", "match", "getYearFilterCriteria", "awardFiltering", "sort", "limit", "releaseAgg"]}, "repository": {"repo_id": 59118773, "url": "https://github.com/devgateway/oc-explorer", "language": "Java", "is_fork": false, "fork_count": 2, "stargazer_count": 5, "size": 9004, "license": "licensed"}}