{"test_class": {"identifier": "RadicalSiteHrAlphaReactionTest", "superclass": "extends ReactionProcessTest", "interfaces": "", "fields": [{"original_string": "private IChemObjectBuilder builder = SilentChemObjectBuilder.getInstance();", "modifier": "private", "type": "IChemObjectBuilder", "declarator": "builder = SilentChemObjectBuilder.getInstance()", "var_name": "builder"}], "file": "base/reaction/src/test/java/org/openscience/cdk/reaction/type/RadicalSiteHrAlphaReactionTest.java"}, "test_case": {"identifier": "testMapping", "parameters": "()", "modifiers": "@Test public", "return": "void", "body": "@Test\n    public void testMapping() throws Exception {\n        IReactionProcess type = new RadicalSiteHrAlphaReaction();\n\n        IAtomContainerSet setOfReactants = getExampleReactants();\n        IAtomContainer molecule = setOfReactants.getAtomContainer(0);\n\n        /* automatic search of the center active */\n        List<IParameterReact> paramList = new ArrayList<IParameterReact>();\n        IParameterReact param = new SetReactionCenter();\n        param.setParameter(Boolean.FALSE);\n        paramList.add(param);\n        type.setParameterList(paramList);\n\n        /* initiate */\n        IReactionSet setOfReactions = type.initiate(setOfReactants, null);\n\n        IAtomContainer product = setOfReactions.getReaction(2).getProducts().getAtomContainer(0);\n\n        Assert.assertEquals(19, setOfReactions.getReaction(2).getMappingCount());\n        IAtom mappedProductA1 = (IAtom) ReactionManipulator.getMappedChemObject(setOfReactions.getReaction(2),\n                molecule.getAtom(0));\n        Assert.assertEquals(mappedProductA1, product.getAtom(0));\n        IAtom mappedProductA2 = (IAtom) ReactionManipulator.getMappedChemObject(setOfReactions.getReaction(2),\n                molecule.getAtom(6));\n        Assert.assertEquals(mappedProductA2, product.getAtom(6));\n        IAtom mappedProductA3 = (IAtom) ReactionManipulator.getMappedChemObject(setOfReactions.getReaction(2),\n                molecule.getAtom(2));\n        Assert.assertEquals(mappedProductA3, product.getAtom(2));\n    }", "signature": "void testMapping()", "full_signature": "@Test public void testMapping()", "class_method_signature": "RadicalSiteHrAlphaReactionTest.testMapping()", "testcase": true, "constructor": false, "invocations": ["getExampleReactants", "getAtomContainer", "setParameter", "add", "setParameterList", "initiate", "getAtomContainer", "getProducts", "getReaction", "assertEquals", "getMappingCount", "getReaction", "getMappedChemObject", "getReaction", "getAtom", "assertEquals", "getAtom", "getMappedChemObject", "getReaction", "getAtom", "assertEquals", "getAtom", "getMappedChemObject", "getReaction", "getAtom", "assertEquals", "getAtom"]}, "focal_class": {"identifier": "RadicalSiteHrAlphaReaction", "superclass": "extends ReactionEngine", "interfaces": "implements IReactionProcess", "fields": [{"original_string": "private static ILoggingTool logger = LoggingToolFactory.createLoggingTool(RadicalSiteHrAlphaReaction.class);", "modifier": "private static", "type": "ILoggingTool", "declarator": "logger = LoggingToolFactory.createLoggingTool(RadicalSiteHrAlphaReaction.class)", "var_name": "logger"}], "methods": [{"identifier": "RadicalSiteHrAlphaReaction", "parameters": "()", "modifiers": "public", "return": "", "signature": " RadicalSiteHrAlphaReaction()", "full_signature": "public  RadicalSiteHrAlphaReaction()", "class_method_signature": "RadicalSiteHrAlphaReaction.RadicalSiteHrAlphaReaction()", "testcase": false, "constructor": true}, {"identifier": "getSpecification", "parameters": "()", "modifiers": "@Override public", "return": "ReactionSpecification", "signature": "ReactionSpecification getSpecification()", "full_signature": "@Override public ReactionSpecification getSpecification()", "class_method_signature": "RadicalSiteHrAlphaReaction.getSpecification()", "testcase": false, "constructor": false}, {"identifier": "initiate", "parameters": "(IAtomContainerSet reactants, IAtomContainerSet agents)", "modifiers": "@Override public", "return": "IReactionSet", "signature": "IReactionSet initiate(IAtomContainerSet reactants, IAtomContainerSet agents)", "full_signature": "@Override public IReactionSet initiate(IAtomContainerSet reactants, IAtomContainerSet agents)", "class_method_signature": "RadicalSiteHrAlphaReaction.initiate(IAtomContainerSet reactants, IAtomContainerSet agents)", "testcase": false, "constructor": false}, {"identifier": "setActiveCenters", "parameters": "(IAtomContainer reactant)", "modifiers": "private", "return": "void", "signature": "void setActiveCenters(IAtomContainer reactant)", "full_signature": "private void setActiveCenters(IAtomContainer reactant)", "class_method_signature": "RadicalSiteHrAlphaReaction.setActiveCenters(IAtomContainer reactant)", "testcase": false, "constructor": false}], "file": "base/reaction/src/main/java/org/openscience/cdk/reaction/type/RadicalSiteHrAlphaReaction.java"}, "focal_method": {"identifier": "initiate", "parameters": "(IAtomContainerSet reactants, IAtomContainerSet agents)", "modifiers": "@Override public", "return": "IReactionSet", "body": "@Override\n    public IReactionSet initiate(IAtomContainerSet reactants, IAtomContainerSet agents) throws CDKException {\n\n        logger.debug(\"initiate reaction: RadicalSiteHrAlphaReaction\");\n\n        if (reactants.getAtomContainerCount() != 1) {\n            throw new CDKException(\"RadicalSiteHrAlphaReaction only expects one reactant\");\n        }\n        if (agents != null) {\n            throw new CDKException(\"RadicalSiteHrAlphaReaction don't expects agents\");\n        }\n\n        IReactionSet setOfReactions = reactants.getBuilder().newInstance(IReactionSet.class);\n        IAtomContainer reactant = reactants.getAtomContainer(0);\n\n        AtomContainerManipulator.percieveAtomTypesAndConfigureAtoms(reactant);\n        Aromaticity.cdkLegacy().apply(reactant);\n        AllRingsFinder arf = new AllRingsFinder();\n        IRingSet ringSet = arf.findAllRings(reactant);\n        for (int ir = 0; ir < ringSet.getAtomContainerCount(); ir++) {\n            IRing ring = (IRing) ringSet.getAtomContainer(ir);\n            for (int jr = 0; jr < ring.getAtomCount(); jr++) {\n                IAtom aring = ring.getAtom(jr);\n                aring.setFlag(CDKConstants.ISINRING, true);\n            }\n        }\n        /*\n         * if the parameter hasActiveCenter is not fixed yet, set the active\n         * centers\n         */\n        IParameterReact ipr = super.getParameterClass(SetReactionCenter.class);\n        if (ipr != null && !ipr.isSetParameter()) setActiveCenters(reactant);\n\n        HOSECodeGenerator hcg = new HOSECodeGenerator();\n        Iterator<IAtom> atomis = reactant.atoms().iterator();\n        while (atomis.hasNext()) {\n            IAtom atomi = atomis.next();\n            if (atomi.getFlag(CDKConstants.REACTIVE_CENTER) && reactant.getConnectedSingleElectronsCount(atomi) == 1) {\n\n                hcg.getSpheres(reactant, atomi, 2, true);\n                Iterator<IAtom> atomls = hcg.getNodesInSphere(2).iterator();\n                while (atomls.hasNext()) {\n                    IAtom atoml = atomls.next();\n                    if (atoml != null && atoml.getFlag(CDKConstants.REACTIVE_CENTER)\n                            && !atoml.getFlag(CDKConstants.ISINRING)\n                            && (atoml.getFormalCharge() == CDKConstants.UNSET ? 0 : atoml.getFormalCharge()) == 0\n                            && !atoml.getSymbol().equals(\"H\") && reactant.getMaximumBondOrder(atoml) == IBond.Order.SINGLE) {\n\n                        Iterator<IAtom> atomhs = reactant.getConnectedAtomsList(atoml).iterator();\n                        while (atomhs.hasNext()) {\n                            IAtom atomh = atomhs.next();\n                            if (reactant.getBond(atomh, atoml).getFlag(CDKConstants.REACTIVE_CENTER)\n                                    && atomh.getFlag(CDKConstants.REACTIVE_CENTER) && atomh.getSymbol().equals(\"H\")) {\n\n                                ArrayList<IAtom> atomList = new ArrayList<IAtom>();\n                                atomList.add(atomh);\n                                atomList.add(atomi);\n                                atomList.add(atoml);\n                                ArrayList<IBond> bondList = new ArrayList<IBond>();\n                                bondList.add(reactant.getBond(atomh, atoml));\n\n                                IAtomContainerSet moleculeSet = reactant.getBuilder().newInstance(\n                                        IAtomContainerSet.class);\n                                moleculeSet.addAtomContainer(reactant);\n                                IReaction reaction = mechanism.initiate(moleculeSet, atomList, bondList);\n                                if (reaction == null)\n                                    continue;\n                                else\n                                    setOfReactions.addReaction(reaction);\n\n                            }\n\n                        }\n\n                    }\n                }\n            }\n        }\n        return setOfReactions;\n    }", "signature": "IReactionSet initiate(IAtomContainerSet reactants, IAtomContainerSet agents)", "full_signature": "@Override public IReactionSet initiate(IAtomContainerSet reactants, IAtomContainerSet agents)", "class_method_signature": "RadicalSiteHrAlphaReaction.initiate(IAtomContainerSet reactants, IAtomContainerSet agents)", "testcase": false, "constructor": false, "invocations": ["debug", "getAtomContainerCount", "newInstance", "getBuilder", "getAtomContainer", "percieveAtomTypesAndConfigureAtoms", "apply", "cdkLegacy", "findAllRings", "getAtomContainerCount", "getAtomContainer", "getAtomCount", "getAtom", "setFlag", "getParameterClass", "isSetParameter", "setActiveCenters", "iterator", "atoms", "hasNext", "next", "getFlag", "getConnectedSingleElectronsCount", "getSpheres", "iterator", "getNodesInSphere", "hasNext", "next", "getFlag", "getFlag", "getFormalCharge", "getFormalCharge", "equals", "getSymbol", "getMaximumBondOrder", "iterator", "getConnectedAtomsList", "hasNext", "next", "getFlag", "getBond", "getFlag", "equals", "getSymbol", "add", "add", "add", "add", "getBond", "newInstance", "getBuilder", "addAtomContainer", "initiate", "addReaction"]}, "repository": {"repo_id": 660443, "url": "https://github.com/cdk/cdk", "stars": 220, "created": "5/11/2010 8:30:07 AM +00:00", "updates": "2020-01-27T19:04:04+00:00", "fork": "False", "license": "licensed"}}