{"test_class": {"identifier": "HomolyticCleavageReactionTest", "superclass": "extends ReactionProcessTest", "interfaces": "", "fields": [{"original_string": "private final LonePairElectronChecker lpcheck = new LonePairElectronChecker();", "modifier": "private final", "type": "LonePairElectronChecker", "declarator": "lpcheck = new LonePairElectronChecker()", "var_name": "lpcheck"}, {"original_string": "private IChemObjectBuilder            builder = SilentChemObjectBuilder.getInstance();", "modifier": "private", "type": "IChemObjectBuilder", "declarator": "builder = SilentChemObjectBuilder.getInstance()", "var_name": "builder"}, {"original_string": "private UniversalIsomorphismTester    uiTester;", "modifier": "private", "type": "UniversalIsomorphismTester", "declarator": "uiTester", "var_name": "uiTester"}], "file": "base/reaction/src/test/java/org/openscience/cdk/reaction/type/HomolyticCleavageReactionTest.java"}, "test_case": {"identifier": "testEthylbenzaldehydeManual", "parameters": "()", "modifiers": "@Test public", "return": "void", "body": "@Test\n    public void testEthylbenzaldehydeManual() throws Exception {\n        IReactionProcess type = new HomolyticCleavageReaction();\n        IAtomContainerSet setOfReactants = builder.newInstance(IAtomContainerSet.class);\n\n        //smiles(\"CCc1ccc(C=O)cc1\")\n        IAtomContainer molecule = builder.newInstance(IAtomContainer.class);\n        molecule.addAtom(builder.newInstance(IAtom.class, \"C\"));\n        molecule.addAtom(builder.newInstance(IAtom.class, \"C\"));\n        molecule.addBond(0, 1, IBond.Order.SINGLE);\n        molecule.addAtom(builder.newInstance(IAtom.class, \"C\"));\n        molecule.addBond(1, 2, IBond.Order.SINGLE);\n        molecule.addAtom(builder.newInstance(IAtom.class, \"C\"));\n        molecule.addBond(2, 3, IBond.Order.SINGLE);\n        molecule.addAtom(builder.newInstance(IAtom.class, \"C\"));\n        molecule.addBond(3, 4, IBond.Order.DOUBLE);\n        molecule.addAtom(builder.newInstance(IAtom.class, \"C\"));\n        molecule.addBond(4, 5, IBond.Order.SINGLE);\n        molecule.addAtom(builder.newInstance(IAtom.class, \"C\"));\n        molecule.addBond(5, 6, IBond.Order.SINGLE);\n        molecule.addAtom(builder.newInstance(IAtom.class, \"O\"));\n        molecule.addBond(6, 7, IBond.Order.DOUBLE);\n        molecule.addAtom(builder.newInstance(IAtom.class, \"C\"));\n        molecule.addBond(5, 8, IBond.Order.DOUBLE);\n        molecule.addAtom(builder.newInstance(IAtom.class, \"C\"));\n        molecule.addBond(8, 9, IBond.Order.SINGLE);\n        molecule.addBond(9, 2, IBond.Order.DOUBLE);\n        addExplicitHydrogens(molecule);\n        AtomContainerManipulator.percieveAtomTypesAndConfigureAtoms(molecule);\n\n        LonePairElectronChecker lpcheck = new LonePairElectronChecker();\n        lpcheck.saturate(molecule);\n\n        molecule.getAtom(0).setFlag(CDKConstants.REACTIVE_CENTER, true);\n        molecule.getAtom(1).setFlag(CDKConstants.REACTIVE_CENTER, true);\n        molecule.getAtom(2).setFlag(CDKConstants.REACTIVE_CENTER, true);\n        molecule.getBond(0).setFlag(CDKConstants.REACTIVE_CENTER, true);\n        molecule.getBond(1).setFlag(CDKConstants.REACTIVE_CENTER, true);\n\n        setOfReactants.addAtomContainer(molecule);\n\n        /* has active center */\n        List<IParameterReact> paramList = new ArrayList<IParameterReact>();\n        IParameterReact param = new SetReactionCenter();\n        param.setParameter(Boolean.TRUE);\n        paramList.add(param);\n        type.setParameterList(paramList);\n\n        /* initiate */\n        makeSureAtomTypesAreRecognized(molecule);\n\n        IReactionSet setOfReactions = type.initiate(setOfReactants, null);\n\n        Assert.assertEquals(2, setOfReactions.getReactionCount());\n        Assert.assertEquals(2, setOfReactions.getReaction(0).getProductCount());\n        Assert.assertEquals(2, setOfReactions.getReaction(1).getProductCount());\n\n        IAtomContainer product = setOfReactions.getReaction(0).getProducts().getAtomContainer(0);\n        /* C */\n        IAtomContainer molecule2 = builder.newInstance(IAtomContainer.class);\n        molecule2.addAtom(builder.newInstance(IAtom.class, \"C\"));\n        molecule2.addAtom(builder.newInstance(IAtom.class, \"H\"));\n        molecule2.addBond(0, 1, IBond.Order.SINGLE);\n        molecule2.addAtom(builder.newInstance(IAtom.class, \"H\"));\n        molecule2.addBond(0, 2, IBond.Order.SINGLE);\n        molecule2.addAtom(builder.newInstance(IAtom.class, \"H\"));\n        molecule2.addBond(0, 3, IBond.Order.SINGLE);\n        molecule2.addSingleElectron(new SingleElectron(molecule2.getAtom(0)));\n\n        Assert.assertTrue(uiTester.isIsomorph(molecule2, product));\n\n        product = setOfReactions.getReaction(0).getProducts().getAtomContainer(1);\n        /* Cc1ccc(C=O)cc1 */\n        IAtomContainer molecule3 = builder.newInstance(IAtomContainer.class);\n        molecule3.addAtom(builder.newInstance(IAtom.class, \"C\"));\n        molecule3.getAtom(0).setFormalCharge(1);\n        molecule3.addAtom(builder.newInstance(IAtom.class, \"C\"));\n        molecule3.addBond(0, 1, IBond.Order.SINGLE);\n        molecule3.addAtom(builder.newInstance(IAtom.class, \"C\"));\n        molecule3.addBond(1, 2, IBond.Order.SINGLE);\n        molecule3.addAtom(builder.newInstance(IAtom.class, \"C\"));\n        molecule3.addBond(2, 3, IBond.Order.DOUBLE);\n        molecule3.addAtom(builder.newInstance(IAtom.class, \"C\"));\n        molecule3.addBond(3, 4, IBond.Order.SINGLE);\n        molecule3.addAtom(builder.newInstance(IAtom.class, \"C\"));\n        molecule3.addBond(4, 5, IBond.Order.SINGLE);\n        molecule3.addAtom(builder.newInstance(IAtom.class, \"O\"));\n        molecule3.addBond(5, 6, IBond.Order.DOUBLE);\n        molecule3.addAtom(builder.newInstance(IAtom.class, \"C\"));\n        molecule3.addBond(4, 7, IBond.Order.DOUBLE);\n        molecule3.addAtom(builder.newInstance(IAtom.class, \"C\"));\n        molecule3.addBond(7, 8, IBond.Order.SINGLE);\n        molecule3.addBond(8, 1, IBond.Order.DOUBLE);\n        addExplicitHydrogens(molecule3);\n        AtomContainerManipulator.percieveAtomTypesAndConfigureAtoms(molecule3);\n        molecule3.addSingleElectron(new SingleElectron(molecule3.getAtom(0)));\n        molecule3.getAtom(0).setFormalCharge(0);\n\n        Assert.assertTrue(uiTester.isIsomorph(molecule3, product));\n\n        product = setOfReactions.getReaction(1).getProducts().getAtomContainer(0);\n        /* CC */\n        molecule2 = builder.newInstance(IAtomContainer.class);\n        molecule2.addAtom(builder.newInstance(IAtom.class, \"C\"));\n        molecule2.addAtom(builder.newInstance(IAtom.class, \"C\"));\n        molecule2.addBond(0, 1, IBond.Order.SINGLE);\n        molecule2.getAtom(0).setFormalCharge(1);\n        addExplicitHydrogens(molecule2);\n        molecule2.getAtom(0).setFormalCharge(0);\n        molecule2.addSingleElectron(new SingleElectron(molecule2.getAtom(0)));\n\n        Assert.assertTrue(uiTester.isIsomorph(molecule2, product));\n\n        product = setOfReactions.getReaction(1).getProducts().getAtomContainer(1);\n        /* c1ccc(C=O)cc1 */\n        molecule3 = builder.newInstance(IAtomContainer.class);\n        molecule3.addAtom(builder.newInstance(IAtom.class, \"C\"));\n        molecule3.addAtom(builder.newInstance(IAtom.class, \"C\"));\n        molecule3.addBond(0, 1, IBond.Order.SINGLE);\n        molecule3.addAtom(builder.newInstance(IAtom.class, \"C\"));\n        molecule3.addBond(1, 2, IBond.Order.DOUBLE);\n        molecule3.addAtom(builder.newInstance(IAtom.class, \"C\"));\n        molecule3.addBond(2, 3, IBond.Order.SINGLE);\n        molecule3.addAtom(builder.newInstance(IAtom.class, \"C\"));\n        molecule3.addBond(3, 4, IBond.Order.SINGLE);\n        molecule3.addAtom(builder.newInstance(IAtom.class, \"O\"));\n        molecule3.addBond(4, 5, IBond.Order.DOUBLE);\n        molecule3.addAtom(builder.newInstance(IAtom.class, \"C\"));\n        molecule3.addBond(3, 6, IBond.Order.DOUBLE);\n        molecule3.addAtom(builder.newInstance(IAtom.class, \"C\"));\n        molecule3.addBond(6, 7, IBond.Order.SINGLE);\n        molecule3.addBond(7, 0, IBond.Order.DOUBLE);\n\n        molecule3.getAtom(0).setFormalCharge(1);\n        addExplicitHydrogens(molecule3);\n        molecule3.getAtom(0).setFormalCharge(0);\n        molecule3.addSingleElectron(new SingleElectron(molecule3.getAtom(0)));\n\n        AtomContainerManipulator.percieveAtomTypesAndConfigureAtoms(molecule3);\n        molecule3.addSingleElectron(new SingleElectron(molecule3.getAtom(0)));\n\n        Assert.assertTrue(uiTester.isIsomorph(molecule3, product));\n\n    }", "signature": "void testEthylbenzaldehydeManual()", "full_signature": "@Test public void testEthylbenzaldehydeManual()", "class_method_signature": "HomolyticCleavageReactionTest.testEthylbenzaldehydeManual()", "testcase": true, "constructor": false, "invocations": ["newInstance", "newInstance", "addAtom", "newInstance", "addAtom", "newInstance", "addBond", "addAtom", "newInstance", "addBond", "addAtom", "newInstance", "addBond", "addAtom", "newInstance", "addBond", "addAtom", "newInstance", "addBond", "addAtom", "newInstance", "addBond", "addAtom", "newInstance", "addBond", "addAtom", "newInstance", "addBond", "addAtom", "newInstance", "addBond", "addBond", "addExplicitHydrogens", "percieveAtomTypesAndConfigureAtoms", "saturate", "setFlag", "getAtom", "setFlag", "getAtom", "setFlag", "getAtom", "setFlag", "getBond", "setFlag", "getBond", "addAtomContainer", "setParameter", "add", "setParameterList", "makeSureAtomTypesAreRecognized", "initiate", "assertEquals", "getReactionCount", "assertEquals", "getProductCount", "getReaction", "assertEquals", "getProductCount", "getReaction", "getAtomContainer", "getProducts", "getReaction", "newInstance", "addAtom", "newInstance", "addAtom", "newInstance", "addBond", "addAtom", "newInstance", "addBond", "addAtom", "newInstance", "addBond", "addSingleElectron", "getAtom", "assertTrue", "isIsomorph", "getAtomContainer", "getProducts", "getReaction", "newInstance", "addAtom", "newInstance", "setFormalCharge", "getAtom", "addAtom", "newInstance", "addBond", "addAtom", "newInstance", "addBond", "addAtom", "newInstance", "addBond", "addAtom", "newInstance", "addBond", "addAtom", "newInstance", "addBond", "addAtom", "newInstance", "addBond", "addAtom", "newInstance", "addBond", "addAtom", "newInstance", "addBond", "addBond", "addExplicitHydrogens", "percieveAtomTypesAndConfigureAtoms", "addSingleElectron", "getAtom", "setFormalCharge", "getAtom", "assertTrue", "isIsomorph", "getAtomContainer", "getProducts", "getReaction", "newInstance", "addAtom", "newInstance", "addAtom", "newInstance", "addBond", "setFormalCharge", "getAtom", "addExplicitHydrogens", "setFormalCharge", "getAtom", "addSingleElectron", "getAtom", "assertTrue", "isIsomorph", "getAtomContainer", "getProducts", "getReaction", "newInstance", "addAtom", "newInstance", "addAtom", "newInstance", "addBond", "addAtom", "newInstance", "addBond", "addAtom", "newInstance", "addBond", "addAtom", "newInstance", "addBond", "addAtom", "newInstance", "addBond", "addAtom", "newInstance", "addBond", "addAtom", "newInstance", "addBond", "addBond", "setFormalCharge", "getAtom", "addExplicitHydrogens", "setFormalCharge", "getAtom", "addSingleElectron", "getAtom", "percieveAtomTypesAndConfigureAtoms", "addSingleElectron", "getAtom", "assertTrue", "isIsomorph"]}, "focal_class": {"identifier": "HomolyticCleavageReaction", "superclass": "extends ReactionEngine", "interfaces": "implements IReactionProcess", "fields": [{"original_string": "private static ILoggingTool logger = LoggingToolFactory.createLoggingTool(HomolyticCleavageReaction.class);", "modifier": "private static", "type": "ILoggingTool", "declarator": "logger = LoggingToolFactory.createLoggingTool(HomolyticCleavageReaction.class)", "var_name": "logger"}], "methods": [{"identifier": "HomolyticCleavageReaction", "parameters": "()", "modifiers": "public", "return": "", "signature": " HomolyticCleavageReaction()", "full_signature": "public  HomolyticCleavageReaction()", "class_method_signature": "HomolyticCleavageReaction.HomolyticCleavageReaction()", "testcase": false, "constructor": true}, {"identifier": "getSpecification", "parameters": "()", "modifiers": "@Override public", "return": "ReactionSpecification", "signature": "ReactionSpecification getSpecification()", "full_signature": "@Override public ReactionSpecification getSpecification()", "class_method_signature": "HomolyticCleavageReaction.getSpecification()", "testcase": false, "constructor": false}, {"identifier": "initiate", "parameters": "(IAtomContainerSet reactants, IAtomContainerSet agents)", "modifiers": "@Override public", "return": "IReactionSet", "signature": "IReactionSet initiate(IAtomContainerSet reactants, IAtomContainerSet agents)", "full_signature": "@Override public IReactionSet initiate(IAtomContainerSet reactants, IAtomContainerSet agents)", "class_method_signature": "HomolyticCleavageReaction.initiate(IAtomContainerSet reactants, IAtomContainerSet agents)", "testcase": false, "constructor": false}, {"identifier": "setActiveCenters", "parameters": "(IAtomContainer reactant)", "modifiers": "private", "return": "void", "signature": "void setActiveCenters(IAtomContainer reactant)", "full_signature": "private void setActiveCenters(IAtomContainer reactant)", "class_method_signature": "HomolyticCleavageReaction.setActiveCenters(IAtomContainer reactant)", "testcase": false, "constructor": false}], "file": "base/reaction/src/main/java/org/openscience/cdk/reaction/type/HomolyticCleavageReaction.java"}, "focal_method": {"identifier": "initiate", "parameters": "(IAtomContainerSet reactants, IAtomContainerSet agents)", "modifiers": "@Override public", "return": "IReactionSet", "body": "@Override\n    public IReactionSet initiate(IAtomContainerSet reactants, IAtomContainerSet agents) throws CDKException {\n\n        logger.debug(\"initiate reaction: HomolyticCleavageReaction\");\n\n        if (reactants.getAtomContainerCount() != 1) {\n            throw new CDKException(\"HomolyticCleavageReaction only expects one reactant\");\n        }\n        if (agents != null) {\n            throw new CDKException(\"HomolyticCleavageReaction don't expects agents\");\n        }\n\n        IReactionSet setOfReactions = reactants.getBuilder().newInstance(IReactionSet.class);\n        IAtomContainer reactant = reactants.getAtomContainer(0);\n\n        /*\n         * if the parameter hasActiveCenter is not fixed yet, set the active\n         * centers\n         */\n        IParameterReact ipr = super.getParameterClass(SetReactionCenter.class);\n        if (ipr != null && !ipr.isSetParameter()) setActiveCenters(reactant);\n\n        Iterator<IBond> bondis = reactant.bonds().iterator();\n        while (bondis.hasNext()) {\n            IBond bondi = bondis.next();\n            IAtom atom1 = bondi.getBegin();\n            IAtom atom2 = bondi.getEnd();\n            if (bondi.getFlag(CDKConstants.REACTIVE_CENTER) && atom1.getFlag(CDKConstants.REACTIVE_CENTER)\n                    && atom2.getFlag(CDKConstants.REACTIVE_CENTER)\n                    && (atom1.getFormalCharge() == CDKConstants.UNSET ? 0 : atom1.getFormalCharge()) == 0\n                    && (atom2.getFormalCharge() == CDKConstants.UNSET ? 0 : atom2.getFormalCharge()) == 0\n                    && reactant.getConnectedSingleElectronsCount(atom1) == 0\n                    && reactant.getConnectedSingleElectronsCount(atom2) == 0) {\n\n                ArrayList<IAtom> atomList = new ArrayList<IAtom>();\n                atomList.add(atom1);\n                atomList.add(atom2);\n                ArrayList<IBond> bondList = new ArrayList<IBond>();\n                bondList.add(bondi);\n                IAtomContainerSet moleculeSet = reactant.getBuilder().newInstance(IAtomContainerSet.class);\n                moleculeSet.addAtomContainer(reactant);\n                IReaction reaction = mechanism.initiate(moleculeSet, atomList, bondList);\n                if (reaction == null)\n                    continue;\n                else\n                    setOfReactions.addReaction(reaction);\n\n            }\n\n        }\n\n        return setOfReactions;\n    }", "signature": "IReactionSet initiate(IAtomContainerSet reactants, IAtomContainerSet agents)", "full_signature": "@Override public IReactionSet initiate(IAtomContainerSet reactants, IAtomContainerSet agents)", "class_method_signature": "HomolyticCleavageReaction.initiate(IAtomContainerSet reactants, IAtomContainerSet agents)", "testcase": false, "constructor": false, "invocations": ["debug", "getAtomContainerCount", "newInstance", "getBuilder", "getAtomContainer", "getParameterClass", "isSetParameter", "setActiveCenters", "iterator", "bonds", "hasNext", "next", "getBegin", "getEnd", "getFlag", "getFlag", "getFlag", "getFormalCharge", "getFormalCharge", "getFormalCharge", "getFormalCharge", "getConnectedSingleElectronsCount", "getConnectedSingleElectronsCount", "add", "add", "add", "newInstance", "getBuilder", "addAtomContainer", "initiate", "addReaction"]}, "repository": {"repo_id": 660443, "url": "https://github.com/cdk/cdk", "stars": 220, "created": "5/11/2010 8:30:07 AM +00:00", "updates": "2020-01-27T19:04:04+00:00", "fork": "False", "license": "licensed"}}