{"test_class": {"identifier": "SMILESReaderTest", "superclass": "extends SimpleChemObjectReaderTest", "interfaces": "", "fields": [{"original_string": "private static ILoggingTool logger = LoggingToolFactory.createLoggingTool(SMILESReaderTest.class);", "modifier": "private static", "type": "ILoggingTool", "declarator": "logger = LoggingToolFactory.createLoggingTool(SMILESReaderTest.class)", "var_name": "logger"}], "file": "storage/smiles/src/test/java/org/openscience/cdk/io/SMILESReaderTest.java"}, "test_case": {"identifier": "badSmilesLine", "parameters": "()", "modifiers": "@Test public", "return": "void", "body": "@Test \n    public void badSmilesLine() throws CDKException {\n        IChemObjectBuilder bldr = SilentChemObjectBuilder.getInstance();\n        String input = \"C\\nn1cccc1\\nc1ccccc1\\n\";\n        DefaultChemObjectReader cor = new SMILESReader(new StringReader(input));\n        IAtomContainerSet mols = cor.read(bldr.newInstance(IAtomContainerSet.class));\n        assertThat(mols.getAtomContainerCount(), is(3));\n        assertThat(mols.getAtomContainer(0).getAtomCount(), is(1));\n        assertThat(mols.getAtomContainer(0).getProperty(IteratingSMILESReader.BAD_SMILES_INPUT),\n                   nullValue());\n        assertThat(mols.getAtomContainer(1).getAtomCount(), is(0));\n        assertThat(mols.getAtomContainer(1).getProperty(IteratingSMILESReader.BAD_SMILES_INPUT),\n                   notNullValue());\n        assertThat(mols.getAtomContainer(2).getAtomCount(), is(6));\n        assertThat(mols.getAtomContainer(2).getProperty(IteratingSMILESReader.BAD_SMILES_INPUT),\n                   nullValue());\n    }", "signature": "void badSmilesLine()", "full_signature": "@Test public void badSmilesLine()", "class_method_signature": "SMILESReaderTest.badSmilesLine()", "testcase": true, "constructor": false, "invocations": ["getInstance", "read", "newInstance", "assertThat", "getAtomContainerCount", "is", "assertThat", "getAtomCount", "getAtomContainer", "is", "assertThat", "getProperty", "getAtomContainer", "nullValue", "assertThat", "getAtomCount", "getAtomContainer", "is", "assertThat", "getProperty", "getAtomContainer", "notNullValue", "assertThat", "getAtomCount", "getAtomContainer", "is", "assertThat", "getProperty", "getAtomContainer", "nullValue"]}, "focal_class": {"identifier": "SMILESReader", "superclass": "extends DefaultChemObjectReader", "interfaces": "", "fields": [{"original_string": "private BufferedReader      input  = null;", "modifier": "private", "type": "BufferedReader", "declarator": "input  = null", "var_name": "input"}, {"original_string": "private SmilesParser        sp     = null;", "modifier": "private", "type": "SmilesParser", "declarator": "sp     = null", "var_name": "sp"}, {"original_string": "private static ILoggingTool logger = LoggingToolFactory.createLoggingTool(SMILESReader.class);", "modifier": "private static", "type": "ILoggingTool", "declarator": "logger = LoggingToolFactory.createLoggingTool(SMILESReader.class)", "var_name": "logger"}], "methods": [{"identifier": "SMILESReader", "parameters": "(Reader input)", "modifiers": "public", "return": "", "signature": " SMILESReader(Reader input)", "full_signature": "public  SMILESReader(Reader input)", "class_method_signature": "SMILESReader.SMILESReader(Reader input)", "testcase": false, "constructor": true}, {"identifier": "SMILESReader", "parameters": "(InputStream input)", "modifiers": "public", "return": "", "signature": " SMILESReader(InputStream input)", "full_signature": "public  SMILESReader(InputStream input)", "class_method_signature": "SMILESReader.SMILESReader(InputStream input)", "testcase": false, "constructor": true}, {"identifier": "SMILESReader", "parameters": "()", "modifiers": "public", "return": "", "signature": " SMILESReader()", "full_signature": "public  SMILESReader()", "class_method_signature": "SMILESReader.SMILESReader()", "testcase": false, "constructor": true}, {"identifier": "getFormat", "parameters": "()", "modifiers": "@Override public", "return": "IResourceFormat", "signature": "IResourceFormat getFormat()", "full_signature": "@Override public IResourceFormat getFormat()", "class_method_signature": "SMILESReader.getFormat()", "testcase": false, "constructor": false}, {"identifier": "setReader", "parameters": "(Reader input)", "modifiers": "@Override public", "return": "void", "signature": "void setReader(Reader input)", "full_signature": "@Override public void setReader(Reader input)", "class_method_signature": "SMILESReader.setReader(Reader input)", "testcase": false, "constructor": false}, {"identifier": "setReader", "parameters": "(InputStream input)", "modifiers": "@Override public", "return": "void", "signature": "void setReader(InputStream input)", "full_signature": "@Override public void setReader(InputStream input)", "class_method_signature": "SMILESReader.setReader(InputStream input)", "testcase": false, "constructor": false}, {"identifier": "accepts", "parameters": "(Class<? extends IChemObject> classObject)", "modifiers": "@Override public", "return": "boolean", "signature": "boolean accepts(Class<? extends IChemObject> classObject)", "full_signature": "@Override public boolean accepts(Class<? extends IChemObject> classObject)", "class_method_signature": "SMILESReader.accepts(Class<? extends IChemObject> classObject)", "testcase": false, "constructor": false}, {"identifier": "read", "parameters": "(T object)", "modifiers": "@Override public", "return": "T", "signature": "T read(T object)", "full_signature": "@Override public T read(T object)", "class_method_signature": "SMILESReader.read(T object)", "testcase": false, "constructor": false}, {"identifier": "readAtomContainerSet", "parameters": "(IAtomContainerSet som)", "modifiers": "private", "return": "IAtomContainerSet", "signature": "IAtomContainerSet readAtomContainerSet(IAtomContainerSet som)", "full_signature": "private IAtomContainerSet readAtomContainerSet(IAtomContainerSet som)", "class_method_signature": "SMILESReader.readAtomContainerSet(IAtomContainerSet som)", "testcase": false, "constructor": false}, {"identifier": "close", "parameters": "()", "modifiers": "@Override public", "return": "void", "signature": "void close()", "full_signature": "@Override public void close()", "class_method_signature": "SMILESReader.close()", "testcase": false, "constructor": false}, {"identifier": "suffix", "parameters": "(final String line)", "modifiers": "private", "return": "String", "signature": "String suffix(final String line)", "full_signature": "private String suffix(final String line)", "class_method_signature": "SMILESReader.suffix(final String line)", "testcase": false, "constructor": false}], "file": "storage/smiles/src/main/java/org/openscience/cdk/io/SMILESReader.java"}, "focal_method": {"identifier": "read", "parameters": "(T object)", "modifiers": "@Override public", "return": "T", "body": "@Override\n    public <T extends IChemObject> T read(T object) throws CDKException {\n        sp = new SmilesParser(object.getBuilder());\n\n        if (object instanceof IAtomContainerSet) {\n            return (T) readAtomContainerSet((IAtomContainerSet) object);\n        } else if (object instanceof IChemFile) {\n            IChemFile file = (IChemFile) object;\n            IChemSequence sequence = file.getBuilder().newInstance(IChemSequence.class);\n            IChemModel chemModel = file.getBuilder().newInstance(IChemModel.class);\n            chemModel.setMoleculeSet(readAtomContainerSet(file.getBuilder().newInstance(IAtomContainerSet.class)));\n            sequence.addChemModel(chemModel);\n            file.addChemSequence(sequence);\n            return (T) file;\n        } else {\n            throw new CDKException(\"Only supported is reading of MoleculeSet objects.\");\n        }\n    }", "signature": "T read(T object)", "full_signature": "@Override public T read(T object)", "class_method_signature": "SMILESReader.read(T object)", "testcase": false, "constructor": false, "invocations": ["getBuilder", "readAtomContainerSet", "newInstance", "getBuilder", "newInstance", "getBuilder", "setMoleculeSet", "readAtomContainerSet", "newInstance", "getBuilder", "addChemModel", "addChemSequence"]}, "repository": {"repo_id": 660443, "url": "https://github.com/cdk/cdk", "stars": 220, "created": "5/11/2010 8:30:07 AM +00:00", "updates": "2020-01-27T19:04:04+00:00", "fork": "False", "license": "licensed"}}