{"test_class": {"identifier": "AtomHybridizationVSEPRDescriptorTest", "superclass": "extends AtomicDescriptorTest", "interfaces": "", "fields": [], "file": "descriptor/qsaratomic/src/test/java/org/openscience/cdk/qsar/descriptors/atomic/AtomHybridizationVSEPRDescriptorTest.java"}, "test_case": {"identifier": "testAtomHybridizationVSEPRDescriptorTest_7", "parameters": "()", "modifiers": "@Test public", "return": "void", "body": "@Test\n    public void testAtomHybridizationVSEPRDescriptorTest_7() throws ClassNotFoundException, CDKException,\n            java.lang.Exception {\n        int[] testResult = {IAtomType.Hybridization.SP3.ordinal(), IAtomType.Hybridization.SP2.ordinal(),\n                IAtomType.Hybridization.SP2.ordinal()}; /*\n                                                         * from Petra online:\n                                                         * http\n                                                         * ://www2.chemie.uni\n                                                         * -erlangen\n                                                         * .de/services/\n                                                         * petra/smiles.phtml\n                                                         */\n\n        AtomHybridizationVSEPRDescriptor descriptor = new AtomHybridizationVSEPRDescriptor();\n\n        SmilesParser sp = new SmilesParser(DefaultChemObjectBuilder.getInstance());\n        IAtomContainer mol = sp.parseSmiles(\"F-C=C\");\n\n        AtomContainerManipulator.percieveAtomTypesAndConfigureAtoms(mol);\n        assertAtomTypesPerceived(mol);\n        addExplicitHydrogens(mol);\n\n        LonePairElectronChecker lpcheck = new LonePairElectronChecker();\n        lpcheck.saturate(mol);\n\n        assertAtomTypesPerceived(mol);\n        for (int i = 0; i < 3; i++) {\n            Assert.assertEquals(testResult[i],\n                    ((IntegerResult) descriptor.calculate(mol.getAtom(i), mol).getValue()).intValue());\n        }\n    }", "signature": "void testAtomHybridizationVSEPRDescriptorTest_7()", "full_signature": "@Test public void testAtomHybridizationVSEPRDescriptorTest_7()", "class_method_signature": "AtomHybridizationVSEPRDescriptorTest.testAtomHybridizationVSEPRDescriptorTest_7()", "testcase": true, "constructor": false, "invocations": ["ordinal", "ordinal", "ordinal", "getInstance", "parseSmiles", "percieveAtomTypesAndConfigureAtoms", "assertAtomTypesPerceived", "addExplicitHydrogens", "saturate", "assertAtomTypesPerceived", "assertEquals", "intValue", "getValue", "calculate", "getAtom"]}, "focal_class": {"identifier": "AtomHybridizationVSEPRDescriptor", "superclass": "extends AbstractAtomicDescriptor", "interfaces": "implements IAtomicDescriptor", "fields": [], "methods": [{"identifier": "AtomHybridizationVSEPRDescriptor", "parameters": "()", "modifiers": "public", "return": "", "signature": " AtomHybridizationVSEPRDescriptor()", "full_signature": "public  AtomHybridizationVSEPRDescriptor()", "class_method_signature": "AtomHybridizationVSEPRDescriptor.AtomHybridizationVSEPRDescriptor()", "testcase": false, "constructor": true}, {"identifier": "getSpecification", "parameters": "()", "modifiers": "@Override public", "return": "DescriptorSpecification", "signature": "DescriptorSpecification getSpecification()", "full_signature": "@Override public DescriptorSpecification getSpecification()", "class_method_signature": "AtomHybridizationVSEPRDescriptor.getSpecification()", "testcase": false, "constructor": false}, {"identifier": "setParameters", "parameters": "(Object[] params)", "modifiers": "@Override public", "return": "void", "signature": "void setParameters(Object[] params)", "full_signature": "@Override public void setParameters(Object[] params)", "class_method_signature": "AtomHybridizationVSEPRDescriptor.setParameters(Object[] params)", "testcase": false, "constructor": false}, {"identifier": "getParameters", "parameters": "()", "modifiers": "@Override public", "return": "Object[]", "signature": "Object[] getParameters()", "full_signature": "@Override public Object[] getParameters()", "class_method_signature": "AtomHybridizationVSEPRDescriptor.getParameters()", "testcase": false, "constructor": false}, {"identifier": "getDescriptorNames", "parameters": "()", "modifiers": "@Override public", "return": "String[]", "signature": "String[] getDescriptorNames()", "full_signature": "@Override public String[] getDescriptorNames()", "class_method_signature": "AtomHybridizationVSEPRDescriptor.getDescriptorNames()", "testcase": false, "constructor": false}, {"identifier": "calculate", "parameters": "(IAtom atom, IAtomContainer container)", "modifiers": "@Override public", "return": "DescriptorValue", "signature": "DescriptorValue calculate(IAtom atom, IAtomContainer container)", "full_signature": "@Override public DescriptorValue calculate(IAtom atom, IAtomContainer container)", "class_method_signature": "AtomHybridizationVSEPRDescriptor.calculate(IAtom atom, IAtomContainer container)", "testcase": false, "constructor": false}, {"identifier": "getParameterNames", "parameters": "()", "modifiers": "@Override public", "return": "String[]", "signature": "String[] getParameterNames()", "full_signature": "@Override public String[] getParameterNames()", "class_method_signature": "AtomHybridizationVSEPRDescriptor.getParameterNames()", "testcase": false, "constructor": false}, {"identifier": "getParameterType", "parameters": "(String name)", "modifiers": "@Override public", "return": "Object", "signature": "Object getParameterType(String name)", "full_signature": "@Override public Object getParameterType(String name)", "class_method_signature": "AtomHybridizationVSEPRDescriptor.getParameterType(String name)", "testcase": false, "constructor": false}], "file": "descriptor/qsaratomic/src/main/java/org/openscience/cdk/qsar/descriptors/atomic/AtomHybridizationVSEPRDescriptor.java"}, "focal_method": {"identifier": "calculate", "parameters": "(IAtom atom, IAtomContainer container)", "modifiers": "@Override public", "return": "DescriptorValue", "body": "@Override\n    public DescriptorValue calculate(IAtom atom, IAtomContainer container) {\n        IAtomType atomType;\n        try {\n            atomType = CDKAtomTypeMatcher.getInstance(atom.getBuilder()).findMatchingAtomType(container, atom);\n        } catch (CDKException e) {\n            return new DescriptorValue(getSpecification(), getParameterNames(), getParameters(), new IntegerResult(\n                    (int) Double.NaN), // does that work??\n                    getDescriptorNames(), new CDKException(\"Atom type was null\"));\n        }\n        if (atomType == null) {\n            return new DescriptorValue(getSpecification(), getParameterNames(), getParameters(), new IntegerResult(\n                    (int) Double.NaN), // does that work??\n                    getDescriptorNames(), new CDKException(\"Atom type was null\"));\n\n        }\n\n        if (atomType.getHybridization() == null) {\n            return new DescriptorValue(getSpecification(), getParameterNames(), getParameters(), new IntegerResult(\n                    (int) Double.NaN), // does that work??\n                    getDescriptorNames(), new CDKException(\"Hybridization was null\"));\n        }\n        int hybridizationCDK = atomType.getHybridization().ordinal();\n\n        return new DescriptorValue(getSpecification(), getParameterNames(), getParameters(), new IntegerResult(\n                hybridizationCDK), getDescriptorNames());\n    }", "signature": "DescriptorValue calculate(IAtom atom, IAtomContainer container)", "full_signature": "@Override public DescriptorValue calculate(IAtom atom, IAtomContainer container)", "class_method_signature": "AtomHybridizationVSEPRDescriptor.calculate(IAtom atom, IAtomContainer container)", "testcase": false, "constructor": false, "invocations": ["findMatchingAtomType", "getInstance", "getBuilder", "getSpecification", "getParameterNames", "getParameters", "getDescriptorNames", "getSpecification", "getParameterNames", "getParameters", "getDescriptorNames", "getHybridization", "getSpecification", "getParameterNames", "getParameters", "getDescriptorNames", "ordinal", "getHybridization", "getSpecification", "getParameterNames", "getParameters", "getDescriptorNames"]}, "repository": {"repo_id": 660443, "url": "https://github.com/cdk/cdk", "stars": 220, "created": "5/11/2010 8:30:07 AM +00:00", "updates": "2020-01-27T19:04:04+00:00", "fork": "False", "license": "licensed"}}