{"test_class": {"identifier": "SingleElectronDiffTest", "superclass": "extends CDKTestCase", "interfaces": "", "fields": [], "file": "misc/diff/src/test/java/org/openscience/cdk/tools/diff/SingleElectronDiffTest.java"}, "test_case": {"identifier": "testDifference", "parameters": "()", "modifiers": "@Test public", "return": "void", "body": "@Test\n    public void testDifference() {\n        IAtom carbon = mock(IAtom.class);\n        IAtom oxygen = mock(IAtom.class);\n\n        when(carbon.getSymbol()).thenReturn(\"C\");\n        when(carbon.getSymbol()).thenReturn(\"H\");\n\n        IBond bond1 = mock(IBond.class);\n        IBond bond2 = mock(IBond.class);\n\n        when(bond1.getOrder()).thenReturn(IBond.Order.SINGLE);\n        when(bond2.getOrder()).thenReturn(IBond.Order.DOUBLE);\n\n        when(bond1.getAtomCount()).thenReturn(2);\n        when(bond2.getAtomCount()).thenReturn(2);\n\n        when(bond1.getBegin()).thenReturn(carbon);\n        when(bond1.getEnd()).thenReturn(carbon);\n        when(bond2.getBegin()).thenReturn(carbon);\n        when(bond2.getEnd()).thenReturn(oxygen);\n\n        bond1.setOrder(IBond.Order.SINGLE);\n        bond2.setOrder(IBond.Order.DOUBLE);\n\n        IDifference difference = BondDiff.difference(bond1, bond2);\n        Assert.assertNotNull(difference);\n    }", "signature": "void testDifference()", "full_signature": "@Test public void testDifference()", "class_method_signature": "SingleElectronDiffTest.testDifference()", "testcase": true, "constructor": false, "invocations": ["mock", "mock", "thenReturn", "when", "getSymbol", "thenReturn", "when", "getSymbol", "mock", "mock", "thenReturn", "when", "getOrder", "thenReturn", "when", "getOrder", "thenReturn", "when", "getAtomCount", "thenReturn", "when", "getAtomCount", "thenReturn", "when", "getBegin", "thenReturn", "when", "getEnd", "thenReturn", "when", "getBegin", "thenReturn", "when", "getEnd", "setOrder", "setOrder", "difference", "assertNotNull"]}, "focal_class": {"identifier": "SingleElectronDiff", "superclass": "", "interfaces": "", "fields": [], "methods": [{"identifier": "SingleElectronDiff", "parameters": "()", "modifiers": "private", "return": "", "signature": " SingleElectronDiff()", "full_signature": "private  SingleElectronDiff()", "class_method_signature": "SingleElectronDiff.SingleElectronDiff()", "testcase": false, "constructor": true}, {"identifier": "diff", "parameters": "(IChemObject first, IChemObject second)", "modifiers": "public static", "return": "String", "signature": "String diff(IChemObject first, IChemObject second)", "full_signature": "public static String diff(IChemObject first, IChemObject second)", "class_method_signature": "SingleElectronDiff.diff(IChemObject first, IChemObject second)", "testcase": false, "constructor": false}, {"identifier": "difference", "parameters": "(IChemObject first, IChemObject second)", "modifiers": "public static", "return": "IDifference", "signature": "IDifference difference(IChemObject first, IChemObject second)", "full_signature": "public static IDifference difference(IChemObject first, IChemObject second)", "class_method_signature": "SingleElectronDiff.difference(IChemObject first, IChemObject second)", "testcase": false, "constructor": false}], "file": "misc/diff/src/main/java/org/openscience/cdk/tools/diff/SingleElectronDiff.java"}, "focal_method": {"identifier": "difference", "parameters": "(IChemObject first, IChemObject second)", "modifiers": "public static", "return": "IDifference", "body": "public static IDifference difference(IChemObject first, IChemObject second) {\n        if (!(first instanceof ISingleElectron && second instanceof ISingleElectron)) {\n            return null;\n        }\n        ISingleElectron firstB = (ISingleElectron) first;\n        ISingleElectron secondB = (ISingleElectron) second;\n        IDifferenceList totalDiff = new ChemObjectDifference(\"SingleElectronDiff\");\n        totalDiff.addChild(AtomDiff.difference(firstB.getAtom(), secondB.getAtom()));\n        totalDiff.addChild(ElectronContainerDiff.difference(first, second));\n        if (totalDiff.childCount() > 0) {\n            return totalDiff;\n        } else {\n            return null;\n        }\n    }", "signature": "IDifference difference(IChemObject first, IChemObject second)", "full_signature": "public static IDifference difference(IChemObject first, IChemObject second)", "class_method_signature": "SingleElectronDiff.difference(IChemObject first, IChemObject second)", "testcase": false, "constructor": false, "invocations": ["addChild", "difference", "getAtom", "getAtom", "addChild", "difference", "childCount"]}, "repository": {"repo_id": 660443, "url": "https://github.com/cdk/cdk", "stars": 220, "created": "5/11/2010 8:30:07 AM +00:00", "updates": "2020-01-27T19:04:04+00:00", "fork": "False", "license": "licensed"}}