{"test_class": {"identifier": "AtomHybridizationDescriptorTest", "superclass": "extends AtomicDescriptorTest", "interfaces": "", "fields": [], "file": "descriptor/qsaratomic/src/test/java/org/openscience/cdk/qsar/descriptors/atomic/AtomHybridizationDescriptorTest.java"}, "test_case": {"identifier": "testAtomHybridizationDescriptorTest", "parameters": "()", "modifiers": "@Test public", "return": "void", "body": "@Test\n    public void testAtomHybridizationDescriptorTest() throws ClassNotFoundException, CDKException, java.lang.Exception {\n        SmilesParser sp = new SmilesParser(DefaultChemObjectBuilder.getInstance());\n        IAtomContainer mol = sp.parseSmiles(\"C#CC=CC\"); //\n        addExplicitHydrogens(mol);\n        IAtomType.Hybridization[] expectedStates = new IAtomType.Hybridization[]{IAtomType.Hybridization.SP1,\n                IAtomType.Hybridization.SP1, IAtomType.Hybridization.SP2, IAtomType.Hybridization.SP2,\n                IAtomType.Hybridization.SP3};\n        for (int i = 0; i < expectedStates.length; i++) {\n            Assert.assertEquals(expectedStates[i].ordinal(), ((IntegerResult) descriptor.calculate(mol.getAtom(i), mol)\n                    .getValue()).intValue());\n        }\n    }", "signature": "void testAtomHybridizationDescriptorTest()", "full_signature": "@Test public void testAtomHybridizationDescriptorTest()", "class_method_signature": "AtomHybridizationDescriptorTest.testAtomHybridizationDescriptorTest()", "testcase": true, "constructor": false, "invocations": ["getInstance", "parseSmiles", "addExplicitHydrogens", "assertEquals", "ordinal", "intValue", "getValue", "calculate", "getAtom"]}, "focal_class": {"identifier": "AtomHybridizationDescriptor", "superclass": "extends AbstractAtomicDescriptor", "interfaces": "implements IAtomicDescriptor", "fields": [{"original_string": "AtomTypeManipulator atman   = null;", "modifier": "", "type": "AtomTypeManipulator", "declarator": "atman   = null", "var_name": "atman"}, {"original_string": "IAtom               atom    = null;", "modifier": "", "type": "IAtom", "declarator": "atom    = null", "var_name": "atom"}, {"original_string": "IAtomType           matched = null;", "modifier": "", "type": "IAtomType", "declarator": "matched = null", "var_name": "matched"}], "methods": [{"identifier": "getSpecification", "parameters": "()", "modifiers": "@Override public", "return": "DescriptorSpecification", "signature": "DescriptorSpecification getSpecification()", "full_signature": "@Override public DescriptorSpecification getSpecification()", "class_method_signature": "AtomHybridizationDescriptor.getSpecification()", "testcase": false, "constructor": false}, {"identifier": "setParameters", "parameters": "(Object[] params)", "modifiers": "@Override public", "return": "void", "signature": "void setParameters(Object[] params)", "full_signature": "@Override public void setParameters(Object[] params)", "class_method_signature": "AtomHybridizationDescriptor.setParameters(Object[] params)", "testcase": false, "constructor": false}, {"identifier": "getParameters", "parameters": "()", "modifiers": "@Override public", "return": "Object[]", "signature": "Object[] getParameters()", "full_signature": "@Override public Object[] getParameters()", "class_method_signature": "AtomHybridizationDescriptor.getParameters()", "testcase": false, "constructor": false}, {"identifier": "getDescriptorNames", "parameters": "()", "modifiers": "@Override public", "return": "String[]", "signature": "String[] getDescriptorNames()", "full_signature": "@Override public String[] getDescriptorNames()", "class_method_signature": "AtomHybridizationDescriptor.getDescriptorNames()", "testcase": false, "constructor": false}, {"identifier": "getDummyDescriptorValue", "parameters": "(Exception e)", "modifiers": "private", "return": "DescriptorValue", "signature": "DescriptorValue getDummyDescriptorValue(Exception e)", "full_signature": "private DescriptorValue getDummyDescriptorValue(Exception e)", "class_method_signature": "AtomHybridizationDescriptor.getDummyDescriptorValue(Exception e)", "testcase": false, "constructor": false}, {"identifier": "calculate", "parameters": "(IAtom atom, IAtomContainer container)", "modifiers": "@Override public", "return": "DescriptorValue", "signature": "DescriptorValue calculate(IAtom atom, IAtomContainer container)", "full_signature": "@Override public DescriptorValue calculate(IAtom atom, IAtomContainer container)", "class_method_signature": "AtomHybridizationDescriptor.calculate(IAtom atom, IAtomContainer container)", "testcase": false, "constructor": false}, {"identifier": "getParameterNames", "parameters": "()", "modifiers": "@Override public", "return": "String[]", "signature": "String[] getParameterNames()", "full_signature": "@Override public String[] getParameterNames()", "class_method_signature": "AtomHybridizationDescriptor.getParameterNames()", "testcase": false, "constructor": false}, {"identifier": "getParameterType", "parameters": "(String name)", "modifiers": "@Override public", "return": "Object", "signature": "Object getParameterType(String name)", "full_signature": "@Override public Object getParameterType(String name)", "class_method_signature": "AtomHybridizationDescriptor.getParameterType(String name)", "testcase": false, "constructor": false}], "file": "descriptor/qsaratomic/src/main/java/org/openscience/cdk/qsar/descriptors/atomic/AtomHybridizationDescriptor.java"}, "focal_method": {"identifier": "calculate", "parameters": "(IAtom atom, IAtomContainer container)", "modifiers": "@Override public", "return": "DescriptorValue", "body": "@Override\n    public DescriptorValue calculate(IAtom atom, IAtomContainer container) {\n        try {\n            matched = CDKAtomTypeMatcher.getInstance(atom.getBuilder()).findMatchingAtomType(container, atom);\n        } catch (CDKException e) {\n            return getDummyDescriptorValue(e);\n        }\n        if (matched == null) {\n            int atnum = container.indexOf(atom);\n            return getDummyDescriptorValue(new CDKException(\"The matched atom type was null (atom number \" + atnum\n                    + \") \" + atom.getSymbol()));\n        }\n        Hybridization atomHybridization = matched.getHybridization();\n        IntegerResult result = new IntegerResult(atomHybridization == null ? 0 : atomHybridization.ordinal());\n        return new DescriptorValue(getSpecification(), getParameterNames(), getParameters(), result,\n                getDescriptorNames());\n    }", "signature": "DescriptorValue calculate(IAtom atom, IAtomContainer container)", "full_signature": "@Override public DescriptorValue calculate(IAtom atom, IAtomContainer container)", "class_method_signature": "AtomHybridizationDescriptor.calculate(IAtom atom, IAtomContainer container)", "testcase": false, "constructor": false, "invocations": ["findMatchingAtomType", "getInstance", "getBuilder", "getDummyDescriptorValue", "indexOf", "getDummyDescriptorValue", "getSymbol", "getHybridization", "ordinal", "getSpecification", "getParameterNames", "getParameters", "getDescriptorNames"]}, "repository": {"repo_id": 660443, "url": "https://github.com/cdk/cdk", "stars": 220, "created": "5/11/2010 8:30:07 AM +00:00", "updates": "2020-01-27T19:04:04+00:00", "fork": "False", "license": "licensed"}}