{"test_class": {"identifier": "AdductionProtonLPReactionTest", "superclass": "extends ReactionProcessTest", "interfaces": "", "fields": [{"original_string": "private final LonePairElectronChecker lpcheck = new LonePairElectronChecker();", "modifier": "private final", "type": "LonePairElectronChecker", "declarator": "lpcheck = new LonePairElectronChecker()", "var_name": "lpcheck"}, {"original_string": "private IChemObjectBuilder            builder = SilentChemObjectBuilder.getInstance();", "modifier": "private", "type": "IChemObjectBuilder", "declarator": "builder = SilentChemObjectBuilder.getInstance()", "var_name": "builder"}, {"original_string": "private UniversalIsomorphismTester    uiTester;", "modifier": "private", "type": "UniversalIsomorphismTester", "declarator": "uiTester", "var_name": "uiTester"}], "file": "base/reaction/src/test/java/org/openscience/cdk/reaction/type/AdductionProtonLPReactionTest.java"}, "test_case": {"identifier": "testCDKConstants_REACTIVE_CENTER", "parameters": "()", "modifiers": "@Test public", "return": "void", "body": "@Test\n    public void testCDKConstants_REACTIVE_CENTER() throws Exception {\n        IReactionProcess type = new AdductionProtonLPReaction();\n        IAtomContainerSet setOfReactants = getExampleReactants();\n\n        /* manually putting the active center */\n        IAtomContainer molecule = setOfReactants.getAtomContainer(0);\n        molecule.getAtom(0).setFlag(CDKConstants.REACTIVE_CENTER, true);\n        molecule.getAtom(1).setFlag(CDKConstants.REACTIVE_CENTER, true);\n        molecule.getAtom(2).setFlag(CDKConstants.REACTIVE_CENTER, true);\n        molecule.getAtom(4).setFlag(CDKConstants.REACTIVE_CENTER, true);\n        molecule.getBond(0).setFlag(CDKConstants.REACTIVE_CENTER, true);\n        molecule.getBond(1).setFlag(CDKConstants.REACTIVE_CENTER, true);\n        molecule.getBond(3).setFlag(CDKConstants.REACTIVE_CENTER, true);\n\n        List<IParameterReact> paramList = new ArrayList<IParameterReact>();\n        IParameterReact param = new SetReactionCenter();\n        param.setParameter(Boolean.TRUE);\n        paramList.add(param);\n        type.setParameterList(paramList);\n        /* initiate */\n        IReactionSet setOfReactions = type.initiate(setOfReactants, null);\n\n        IAtomContainer reactant = setOfReactions.getReaction(0).getReactants().getAtomContainer(0);\n        Assert.assertTrue(molecule.getAtom(0).getFlag(CDKConstants.REACTIVE_CENTER));\n        Assert.assertTrue(reactant.getAtom(0).getFlag(CDKConstants.REACTIVE_CENTER));\n        Assert.assertTrue(molecule.getAtom(1).getFlag(CDKConstants.REACTIVE_CENTER));\n        Assert.assertTrue(reactant.getAtom(1).getFlag(CDKConstants.REACTIVE_CENTER));\n        Assert.assertTrue(molecule.getAtom(2).getFlag(CDKConstants.REACTIVE_CENTER));\n        Assert.assertTrue(reactant.getAtom(2).getFlag(CDKConstants.REACTIVE_CENTER));\n        Assert.assertTrue(molecule.getAtom(4).getFlag(CDKConstants.REACTIVE_CENTER));\n        Assert.assertTrue(reactant.getAtom(4).getFlag(CDKConstants.REACTIVE_CENTER));\n        Assert.assertTrue(molecule.getBond(0).getFlag(CDKConstants.REACTIVE_CENTER));\n        Assert.assertTrue(reactant.getBond(0).getFlag(CDKConstants.REACTIVE_CENTER));\n        Assert.assertTrue(molecule.getBond(1).getFlag(CDKConstants.REACTIVE_CENTER));\n        Assert.assertTrue(reactant.getBond(1).getFlag(CDKConstants.REACTIVE_CENTER));\n        Assert.assertTrue(molecule.getBond(3).getFlag(CDKConstants.REACTIVE_CENTER));\n        Assert.assertTrue(reactant.getBond(3).getFlag(CDKConstants.REACTIVE_CENTER));\n    }", "signature": "void testCDKConstants_REACTIVE_CENTER()", "full_signature": "@Test public void testCDKConstants_REACTIVE_CENTER()", "class_method_signature": "AdductionProtonLPReactionTest.testCDKConstants_REACTIVE_CENTER()", "testcase": true, "constructor": false, "invocations": ["getExampleReactants", "getAtomContainer", "setFlag", "getAtom", "setFlag", "getAtom", "setFlag", "getAtom", "setFlag", "getAtom", "setFlag", "getBond", "setFlag", "getBond", "setFlag", "getBond", "setParameter", "add", "setParameterList", "initiate", "getAtomContainer", "getReactants", "getReaction", "assertTrue", "getFlag", "getAtom", "assertTrue", "getFlag", "getAtom", "assertTrue", "getFlag", "getAtom", "assertTrue", "getFlag", "getAtom", "assertTrue", "getFlag", "getAtom", "assertTrue", "getFlag", "getAtom", "assertTrue", "getFlag", "getAtom", "assertTrue", "getFlag", "getAtom", "assertTrue", "getFlag", "getBond", "assertTrue", "getFlag", "getBond", "assertTrue", "getFlag", "getBond", "assertTrue", "getFlag", "getBond", "assertTrue", "getFlag", "getBond", "assertTrue", "getFlag", "getBond"]}, "focal_class": {"identifier": "AdductionProtonLPReaction", "superclass": "extends ReactionEngine", "interfaces": "implements IReactionProcess", "fields": [{"original_string": "private static ILoggingTool logger = LoggingToolFactory.createLoggingTool(AdductionProtonLPReaction.class);", "modifier": "private static", "type": "ILoggingTool", "declarator": "logger = LoggingToolFactory.createLoggingTool(AdductionProtonLPReaction.class)", "var_name": "logger"}], "methods": [{"identifier": "AdductionProtonLPReaction", "parameters": "()", "modifiers": "public", "return": "", "signature": " AdductionProtonLPReaction()", "full_signature": "public  AdductionProtonLPReaction()", "class_method_signature": "AdductionProtonLPReaction.AdductionProtonLPReaction()", "testcase": false, "constructor": true}, {"identifier": "getSpecification", "parameters": "()", "modifiers": "@Override public", "return": "ReactionSpecification", "signature": "ReactionSpecification getSpecification()", "full_signature": "@Override public ReactionSpecification getSpecification()", "class_method_signature": "AdductionProtonLPReaction.getSpecification()", "testcase": false, "constructor": false}, {"identifier": "initiate", "parameters": "(IAtomContainerSet reactants, IAtomContainerSet agents)", "modifiers": "@Override public", "return": "IReactionSet", "signature": "IReactionSet initiate(IAtomContainerSet reactants, IAtomContainerSet agents)", "full_signature": "@Override public IReactionSet initiate(IAtomContainerSet reactants, IAtomContainerSet agents)", "class_method_signature": "AdductionProtonLPReaction.initiate(IAtomContainerSet reactants, IAtomContainerSet agents)", "testcase": false, "constructor": false}, {"identifier": "setActiveCenters", "parameters": "(IAtomContainer reactant)", "modifiers": "private", "return": "void", "signature": "void setActiveCenters(IAtomContainer reactant)", "full_signature": "private void setActiveCenters(IAtomContainer reactant)", "class_method_signature": "AdductionProtonLPReaction.setActiveCenters(IAtomContainer reactant)", "testcase": false, "constructor": false}], "file": "base/reaction/src/main/java/org/openscience/cdk/reaction/type/AdductionProtonLPReaction.java"}, "focal_method": {"identifier": "initiate", "parameters": "(IAtomContainerSet reactants, IAtomContainerSet agents)", "modifiers": "@Override public", "return": "IReactionSet", "body": "@Override\n    public IReactionSet initiate(IAtomContainerSet reactants, IAtomContainerSet agents) throws CDKException {\n\n        logger.debug(\"initiate reaction: AdductionProtonLPReaction\");\n\n        if (reactants.getAtomContainerCount() != 1) {\n            throw new CDKException(\"AdductionProtonLPReaction only expects one reactant\");\n        }\n        if (agents != null) {\n            throw new CDKException(\"AdductionProtonLPReaction don't expects agents\");\n        }\n\n        IReactionSet setOfReactions = reactants.getBuilder().newInstance(IReactionSet.class);\n        IAtomContainer reactant = reactants.getAtomContainer(0);\n\n        IParameterReact ipr = super.getParameterClass(SetReactionCenter.class);\n        if (ipr != null && !ipr.isSetParameter()) setActiveCenters(reactant);\n\n        if (AtomContainerManipulator.getTotalCharge(reactant) > 0) return setOfReactions;\n\n        Iterator<IAtom> atoms = reactant.atoms().iterator();\n        while (atoms.hasNext()) {\n            IAtom atomi = atoms.next(); // Atom pos 1\n            if (atomi.getFlag(CDKConstants.REACTIVE_CENTER)\n                    && (atomi.getFormalCharge() == CDKConstants.UNSET ? 0 : atomi.getFormalCharge()) <= 0\n                    && reactant.getConnectedLonePairsCount(atomi) > 0\n                    && reactant.getConnectedSingleElectronsCount(atomi) == 0) {\n\n                ArrayList<IAtom> atomList = new ArrayList<IAtom>();\n                atomList.add(atomi);\n                IAtom atomH = reactant.getBuilder().newInstance(IAtom.class, \"H\");\n                atomH.setFormalCharge(1);\n                atomList.add(atomH);\n\n                IAtomContainerSet moleculeSet = reactant.getBuilder().newInstance(IAtomContainerSet.class);\n                moleculeSet.addAtomContainer(reactant);\n                IAtomContainer adduct = reactant.getBuilder().newInstance(IAtomContainer.class);\n                adduct.addAtom(atomH);\n                moleculeSet.addAtomContainer(adduct);\n\n                IReaction reaction = mechanism.initiate(moleculeSet, atomList, null);\n                if (reaction == null)\n                    continue;\n                else\n                    setOfReactions.addReaction(reaction);\n\n            }\n        }\n\n        return setOfReactions;\n    }", "signature": "IReactionSet initiate(IAtomContainerSet reactants, IAtomContainerSet agents)", "full_signature": "@Override public IReactionSet initiate(IAtomContainerSet reactants, IAtomContainerSet agents)", "class_method_signature": "AdductionProtonLPReaction.initiate(IAtomContainerSet reactants, IAtomContainerSet agents)", "testcase": false, "constructor": false, "invocations": ["debug", "getAtomContainerCount", "newInstance", "getBuilder", "getAtomContainer", "getParameterClass", "isSetParameter", "setActiveCenters", "getTotalCharge", "iterator", "atoms", "hasNext", "next", "getFlag", "getFormalCharge", "getFormalCharge", "getConnectedLonePairsCount", "getConnectedSingleElectronsCount", "add", "newInstance", "getBuilder", "setFormalCharge", "add", "newInstance", "getBuilder", "addAtomContainer", "newInstance", "getBuilder", "addAtom", "addAtomContainer", "initiate", "addReaction"]}, "repository": {"repo_id": 660443, "url": "https://github.com/cdk/cdk", "stars": 220, "created": "5/11/2010 8:30:07 AM +00:00", "updates": "2020-01-27T19:04:04+00:00", "fork": "False", "license": "licensed"}}