{"test_class": {"identifier": "ElectronImpactPDBReactionTest", "superclass": "extends ReactionProcessTest", "interfaces": "", "fields": [{"original_string": "private final LonePairElectronChecker lpcheck = new LonePairElectronChecker();", "modifier": "private final", "type": "LonePairElectronChecker", "declarator": "lpcheck = new LonePairElectronChecker()", "var_name": "lpcheck"}, {"original_string": "private IChemObjectBuilder            builder = SilentChemObjectBuilder.getInstance();", "modifier": "private", "type": "IChemObjectBuilder", "declarator": "builder = SilentChemObjectBuilder.getInstance()", "var_name": "builder"}], "file": "base/reaction/src/test/java/org/openscience/cdk/reaction/type/ElectronImpactPDBReactionTest.java"}, "test_case": {"identifier": "testCDKConstants_REACTIVE_CENTER", "parameters": "()", "modifiers": "@Test public", "return": "void", "body": "@Test\n    public void testCDKConstants_REACTIVE_CENTER() throws Exception {\n        IReactionProcess type = new ElectronImpactPDBReaction();\n        IAtomContainerSet setOfReactants = getExampleReactants();\n        IAtomContainer molecule = setOfReactants.getAtomContainer(0);\n\n        /* manually put the reactive center */\n        molecule.getAtom(0).setFlag(CDKConstants.REACTIVE_CENTER, true);\n        molecule.getAtom(1).setFlag(CDKConstants.REACTIVE_CENTER, true);\n        molecule.getBond(0).setFlag(CDKConstants.REACTIVE_CENTER, true);\n\n        List<IParameterReact> paramList = new ArrayList<IParameterReact>();\n        IParameterReact param = new SetReactionCenter();\n        param.setParameter(Boolean.TRUE);\n        paramList.add(param);\n        type.setParameterList(paramList);\n\n        /* initiate */\n        makeSureAtomTypesAreRecognized(molecule);\n\n        IReactionSet setOfReactions = type.initiate(setOfReactants, null);\n\n        Assert.assertEquals(2, setOfReactions.getReactionCount());\n        Assert.assertEquals(1, setOfReactions.getReaction(0).getProductCount());\n\n        IAtomContainer reactant = setOfReactions.getReaction(0).getReactants().getAtomContainer(0);\n        Assert.assertTrue(molecule.getAtom(0).getFlag(CDKConstants.REACTIVE_CENTER));\n        Assert.assertTrue(reactant.getAtom(0).getFlag(CDKConstants.REACTIVE_CENTER));\n        Assert.assertTrue(molecule.getAtom(1).getFlag(CDKConstants.REACTIVE_CENTER));\n        Assert.assertTrue(reactant.getAtom(1).getFlag(CDKConstants.REACTIVE_CENTER));\n        Assert.assertTrue(molecule.getBond(0).getFlag(CDKConstants.REACTIVE_CENTER));\n        Assert.assertTrue(reactant.getBond(0).getFlag(CDKConstants.REACTIVE_CENTER));\n    }", "signature": "void testCDKConstants_REACTIVE_CENTER()", "full_signature": "@Test public void testCDKConstants_REACTIVE_CENTER()", "class_method_signature": "ElectronImpactPDBReactionTest.testCDKConstants_REACTIVE_CENTER()", "testcase": true, "constructor": false, "invocations": ["getExampleReactants", "getAtomContainer", "setFlag", "getAtom", "setFlag", "getAtom", "setFlag", "getBond", "setParameter", "add", "setParameterList", "makeSureAtomTypesAreRecognized", "initiate", "assertEquals", "getReactionCount", "assertEquals", "getProductCount", "getReaction", "getAtomContainer", "getReactants", "getReaction", "assertTrue", "getFlag", "getAtom", "assertTrue", "getFlag", "getAtom", "assertTrue", "getFlag", "getAtom", "assertTrue", "getFlag", "getAtom", "assertTrue", "getFlag", "getBond", "assertTrue", "getFlag", "getBond"]}, "focal_class": {"identifier": "ElectronImpactPDBReaction", "superclass": "extends ReactionEngine", "interfaces": "implements IReactionProcess", "fields": [{"original_string": "private static ILoggingTool logger = LoggingToolFactory.createLoggingTool(ElectronImpactPDBReaction.class);", "modifier": "private static", "type": "ILoggingTool", "declarator": "logger = LoggingToolFactory.createLoggingTool(ElectronImpactPDBReaction.class)", "var_name": "logger"}], "methods": [{"identifier": "ElectronImpactPDBReaction", "parameters": "()", "modifiers": "public", "return": "", "signature": " ElectronImpactPDBReaction()", "full_signature": "public  ElectronImpactPDBReaction()", "class_method_signature": "ElectronImpactPDBReaction.ElectronImpactPDBReaction()", "testcase": false, "constructor": true}, {"identifier": "getSpecification", "parameters": "()", "modifiers": "@Override public", "return": "ReactionSpecification", "signature": "ReactionSpecification getSpecification()", "full_signature": "@Override public ReactionSpecification getSpecification()", "class_method_signature": "ElectronImpactPDBReaction.getSpecification()", "testcase": false, "constructor": false}, {"identifier": "initiate", "parameters": "(IAtomContainerSet reactants, IAtomContainerSet agents)", "modifiers": "@Override public", "return": "IReactionSet", "signature": "IReactionSet initiate(IAtomContainerSet reactants, IAtomContainerSet agents)", "full_signature": "@Override public IReactionSet initiate(IAtomContainerSet reactants, IAtomContainerSet agents)", "class_method_signature": "ElectronImpactPDBReaction.initiate(IAtomContainerSet reactants, IAtomContainerSet agents)", "testcase": false, "constructor": false}, {"identifier": "setActiveCenters", "parameters": "(IAtomContainer reactant)", "modifiers": "private", "return": "void", "signature": "void setActiveCenters(IAtomContainer reactant)", "full_signature": "private void setActiveCenters(IAtomContainer reactant)", "class_method_signature": "ElectronImpactPDBReaction.setActiveCenters(IAtomContainer reactant)", "testcase": false, "constructor": false}], "file": "base/reaction/src/main/java/org/openscience/cdk/reaction/type/ElectronImpactPDBReaction.java"}, "focal_method": {"identifier": "initiate", "parameters": "(IAtomContainerSet reactants, IAtomContainerSet agents)", "modifiers": "@Override public", "return": "IReactionSet", "body": "@Override\n    public IReactionSet initiate(IAtomContainerSet reactants, IAtomContainerSet agents) throws CDKException {\n\n        logger.debug(\"initiate reaction: ElectronImpactPDBReaction\");\n\n        if (reactants.getAtomContainerCount() != 1) {\n            throw new CDKException(\"ElectronImpactPDBReaction only expects one reactant\");\n        }\n        if (agents != null) {\n            throw new CDKException(\"ElectronImpactPDBReaction don't expects agents\");\n        }\n\n        IReactionSet setOfReactions = reactants.getBuilder().newInstance(IReactionSet.class);\n        IAtomContainer reactant = reactants.getAtomContainer(0);\n\n        /*\n         * if the parameter hasActiveCenter is not fixed yet, set the active\n         * centers\n         */\n        IParameterReact ipr = super.getParameterClass(SetReactionCenter.class);\n        if (ipr != null && !ipr.isSetParameter()) setActiveCenters(reactant);\n\n        Iterator<IBond> bonds = reactant.bonds().iterator();\n        while (bonds.hasNext()) {\n            IBond bondi = bonds.next();\n            IAtom atom1 = bondi.getBegin();\n            IAtom atom2 = bondi.getEnd();\n            if (bondi.getFlag(CDKConstants.REACTIVE_CENTER)\n                    && (bondi.getOrder() == IBond.Order.DOUBLE || bondi.getOrder() == IBond.Order.TRIPLE)\n                    && atom1.getFlag(CDKConstants.REACTIVE_CENTER) && atom2.getFlag(CDKConstants.REACTIVE_CENTER)\n                    && (atom1.getFormalCharge() == CDKConstants.UNSET ? 0 : atom1.getFormalCharge()) == 0\n                    && (atom2.getFormalCharge() == CDKConstants.UNSET ? 0 : atom2.getFormalCharge()) == 0\n                    && reactant.getConnectedSingleElectronsCount(atom1) == 0\n                    && reactant.getConnectedSingleElectronsCount(atom2) == 0) {\n\n                for (int j = 0; j < 2; j++) {\n\n                    ArrayList<IAtom> atomList = new ArrayList<IAtom>();\n                    if (j == 0) {\n                        atomList.add(atom1);\n                        atomList.add(atom2);\n                    } else {\n                        atomList.add(atom2);\n                        atomList.add(atom1);\n                    }\n                    ArrayList<IBond> bondList = new ArrayList<IBond>();\n                    bondList.add(bondi);\n\n                    IAtomContainerSet moleculeSet = reactant.getBuilder().newInstance(IAtomContainerSet.class);\n                    moleculeSet.addAtomContainer(reactant);\n                    IReaction reaction = mechanism.initiate(moleculeSet, atomList, bondList);\n                    if (reaction == null)\n                        continue;\n                    else\n                        setOfReactions.addReaction(reaction);\n                }\n\n            }\n        }\n        return setOfReactions;\n\n    }", "signature": "IReactionSet initiate(IAtomContainerSet reactants, IAtomContainerSet agents)", "full_signature": "@Override public IReactionSet initiate(IAtomContainerSet reactants, IAtomContainerSet agents)", "class_method_signature": "ElectronImpactPDBReaction.initiate(IAtomContainerSet reactants, IAtomContainerSet agents)", "testcase": false, "constructor": false, "invocations": ["debug", "getAtomContainerCount", "newInstance", "getBuilder", "getAtomContainer", "getParameterClass", "isSetParameter", "setActiveCenters", "iterator", "bonds", "hasNext", "next", "getBegin", "getEnd", "getFlag", "getOrder", "getOrder", "getFlag", "getFlag", "getFormalCharge", "getFormalCharge", "getFormalCharge", "getFormalCharge", "getConnectedSingleElectronsCount", "getConnectedSingleElectronsCount", "add", "add", "add", "add", "add", "newInstance", "getBuilder", "addAtomContainer", "initiate", "addReaction"]}, "repository": {"repo_id": 660443, "url": "https://github.com/cdk/cdk", "stars": 220, "created": "5/11/2010 8:30:07 AM +00:00", "updates": "2020-01-27T19:04:04+00:00", "fork": "False", "license": "licensed"}}