{"test_class": {"identifier": "StructGenMatcherTest", "superclass": "extends AbstractAtomTypeTest", "interfaces": "", "fields": [{"original_string": "private final static String          ATOMTYPE_LIST = \"structgen_atomtypes.owl\";", "modifier": "private final static", "type": "String", "declarator": "ATOMTYPE_LIST = \"structgen_atomtypes.owl\"", "var_name": "ATOMTYPE_LIST"}, {"original_string": "private final static AtomTypeFactory factory       = AtomTypeFactory.getInstance(\"org/openscience/cdk/config/data/\"\n                                                               + ATOMTYPE_LIST, SilentChemObjectBuilder.getInstance());", "modifier": "private final static", "type": "AtomTypeFactory", "declarator": "factory       = AtomTypeFactory.getInstance(\"org/openscience/cdk/config/data/\"\n                                                               + ATOMTYPE_LIST, SilentChemObjectBuilder.getInstance())", "var_name": "factory"}, {"original_string": "private static Map<String, Integer> testedAtomTypes = new HashMap<String, Integer>();", "modifier": "private static", "type": "Map<String, Integer>", "declarator": "testedAtomTypes = new HashMap<String, Integer>()", "var_name": "testedAtomTypes"}], "file": "tool/structgen/src/test/java/org/openscience/cdk/atomtype/StructGenMatcherTest.java"}, "test_case": {"identifier": "testP4", "parameters": "()", "modifiers": "@Test public", "return": "void", "body": "@Test\n    public void testP4() throws Exception {\n        IAtomContainer mol = DefaultChemObjectBuilder.getInstance().newInstance(IAtomContainer.class);\n        IAtom p = DefaultChemObjectBuilder.getInstance().newInstance(IAtom.class, \"P\");\n        IAtom cl1 = DefaultChemObjectBuilder.getInstance().newInstance(IAtom.class, \"Cl\");\n        IAtom cl2 = DefaultChemObjectBuilder.getInstance().newInstance(IAtom.class, \"Cl\");\n        IAtom cl3 = DefaultChemObjectBuilder.getInstance().newInstance(IAtom.class, \"Cl\");\n        IAtom s = DefaultChemObjectBuilder.getInstance().newInstance(IAtom.class, \"S\");\n\n        IBond bond1 = DefaultChemObjectBuilder.getInstance().newInstance(IBond.class, p, cl1, IBond.Order.SINGLE);\n        IBond bond2 = DefaultChemObjectBuilder.getInstance().newInstance(IBond.class, p, cl2, IBond.Order.SINGLE);\n        IBond bond3 = DefaultChemObjectBuilder.getInstance().newInstance(IBond.class, p, cl3, IBond.Order.SINGLE);\n        IBond bond4 = DefaultChemObjectBuilder.getInstance().newInstance(IBond.class, p, s, IBond.Order.DOUBLE);\n\n        mol.addAtom(p);\n        mol.addAtom(cl1);\n        mol.addAtom(cl2);\n        mol.addAtom(cl3);\n        mol.addAtom(s);\n\n        mol.addBond(bond1);\n        mol.addBond(bond2);\n        mol.addBond(bond3);\n        mol.addBond(bond4);\n\n        StructGenMatcher matcher = new StructGenMatcher();\n        IAtomType matched;\n\n        matched = matcher.findMatchingAtomType(mol, mol.getAtom(0));\n        assertAtomType(testedAtomTypes, \"P4\", matched);\n\n        matched = matcher.findMatchingAtomType(mol, mol.getAtom(4));\n        assertAtomType(testedAtomTypes, \"S2\", matched);\n\n        for (int i = 1; i < 4; i++) {\n            matched = matcher.findMatchingAtomType(mol, mol.getAtom(i));\n            assertAtomType(testedAtomTypes, \"atom \" + i + \" failed to match\", \"Cl1\", matched);\n        }\n    }", "signature": "void testP4()", "full_signature": "@Test public void testP4()", "class_method_signature": "StructGenMatcherTest.testP4()", "testcase": true, "constructor": false, "invocations": ["newInstance", "getInstance", "newInstance", "getInstance", "newInstance", "getInstance", "newInstance", "getInstance", "newInstance", "getInstance", "newInstance", "getInstance", "newInstance", "getInstance", "newInstance", "getInstance", "newInstance", "getInstance", "newInstance", "getInstance", "addAtom", "addAtom", "addAtom", "addAtom", "addAtom", "addBond", "addBond", "addBond", "addBond", "findMatchingAtomType", "getAtom", "assertAtomType", "findMatchingAtomType", "getAtom", "assertAtomType", "findMatchingAtomType", "getAtom", "assertAtomType"]}, "focal_class": {"identifier": "StructGenMatcher", "superclass": "", "interfaces": "implements IAtomTypeMatcher", "fields": [{"original_string": "private static AtomTypeFactory factory = null;", "modifier": "private static", "type": "AtomTypeFactory", "declarator": "factory = null", "var_name": "factory"}, {"original_string": "private static ILoggingTool    logger  = LoggingToolFactory.createLoggingTool(StructGenMatcher.class);", "modifier": "private static", "type": "ILoggingTool", "declarator": "logger  = LoggingToolFactory.createLoggingTool(StructGenMatcher.class)", "var_name": "logger"}], "methods": [{"identifier": "StructGenMatcher", "parameters": "()", "modifiers": "public", "return": "", "signature": " StructGenMatcher()", "full_signature": "public  StructGenMatcher()", "class_method_signature": "StructGenMatcher.StructGenMatcher()", "testcase": false, "constructor": true}, {"identifier": "findMatchingAtomTypes", "parameters": "(IAtomContainer atomContainer)", "modifiers": "@Override public", "return": "IAtomType[]", "signature": "IAtomType[] findMatchingAtomTypes(IAtomContainer atomContainer)", "full_signature": "@Override public IAtomType[] findMatchingAtomTypes(IAtomContainer atomContainer)", "class_method_signature": "StructGenMatcher.findMatchingAtomTypes(IAtomContainer atomContainer)", "testcase": false, "constructor": false}, {"identifier": "findMatchingAtomType", "parameters": "(IAtomContainer atomContainer, IAtom atom)", "modifiers": "@Override public", "return": "IAtomType", "signature": "IAtomType findMatchingAtomType(IAtomContainer atomContainer, IAtom atom)", "full_signature": "@Override public IAtomType findMatchingAtomType(IAtomContainer atomContainer, IAtom atom)", "class_method_signature": "StructGenMatcher.findMatchingAtomType(IAtomContainer atomContainer, IAtom atom)", "testcase": false, "constructor": false}], "file": "tool/structgen/src/main/java/org/openscience/cdk/atomtype/StructGenMatcher.java"}, "focal_method": {"identifier": "findMatchingAtomType", "parameters": "(IAtomContainer atomContainer, IAtom atom)", "modifiers": "@Override public", "return": "IAtomType", "body": "@Override\n    public IAtomType findMatchingAtomType(IAtomContainer atomContainer, IAtom atom) throws CDKException {\n        if (factory == null) {\n            try {\n                factory = AtomTypeFactory.getInstance(\"org/openscience/cdk/config/data/structgen_atomtypes.xml\",\n                        atom.getBuilder());\n            } catch (Exception ex1) {\n                logger.error(ex1.getMessage());\n                logger.debug(ex1);\n                throw new CDKException(\"Could not instantiate the AtomType list!\", ex1);\n            }\n        }\n\n        double bondOrderSum = atomContainer.getBondOrderSum(atom);\n        IBond.Order maxBondOrder = atomContainer.getMaximumBondOrder(atom);\n        int charge = atom.getFormalCharge();\n        int hcount = atom.getImplicitHydrogenCount() == null ? 0 : atom.getImplicitHydrogenCount();\n\n        IAtomType[] types = factory.getAtomTypes(atom.getSymbol());\n        for (IAtomType type : types) {\n            logger.debug(\"   ... matching atom \", atom, \" vs \", type);\n            if (bondOrderSum - charge + hcount == type.getBondOrderSum()\n                    && !BondManipulator.isHigherOrder(maxBondOrder, type.getMaxBondOrder())) {\n                return type;\n            }\n        }\n        logger.debug(\"    No Match\");\n\n        return null;\n    }", "signature": "IAtomType findMatchingAtomType(IAtomContainer atomContainer, IAtom atom)", "full_signature": "@Override public IAtomType findMatchingAtomType(IAtomContainer atomContainer, IAtom atom)", "class_method_signature": "StructGenMatcher.findMatchingAtomType(IAtomContainer atomContainer, IAtom atom)", "testcase": false, "constructor": false, "invocations": ["getInstance", "getBuilder", "error", "getMessage", "debug", "getBondOrderSum", "getMaximumBondOrder", "getFormalCharge", "getImplicitHydrogenCount", "getImplicitHydrogenCount", "getAtomTypes", "getSymbol", "debug", "getBondOrderSum", "isHigherOrder", "getMaxBondOrder", "debug"]}, "repository": {"repo_id": 660443, "url": "https://github.com/cdk/cdk", "stars": 220, "created": "5/11/2010 8:30:07 AM +00:00", "updates": "2020-01-27T19:04:04+00:00", "fork": "False", "license": "licensed"}}