{"test_class": {"identifier": "RearrangementLonePairReactionTest", "superclass": "extends ReactionProcessTest", "interfaces": "", "fields": [{"original_string": "private final LonePairElectronChecker lpcheck = new LonePairElectronChecker();", "modifier": "private final", "type": "LonePairElectronChecker", "declarator": "lpcheck = new LonePairElectronChecker()", "var_name": "lpcheck"}, {"original_string": "private IChemObjectBuilder            builder = SilentChemObjectBuilder.getInstance();", "modifier": "private", "type": "IChemObjectBuilder", "declarator": "builder = SilentChemObjectBuilder.getInstance()", "var_name": "builder"}], "file": "base/reaction/src/test/java/org/openscience/cdk/reaction/type/RearrangementLonePairReactionTest.java"}, "test_case": {"identifier": "testCDKConstants_REACTIVE_CENTER", "parameters": "()", "modifiers": "@Test public", "return": "void", "body": "@Test\n    public void testCDKConstants_REACTIVE_CENTER() throws Exception {\n        IReactionProcess type = new RearrangementLonePairReaction();\n\n        IAtomContainerSet setOfReactants = getExampleReactants();\n        IAtomContainer molecule = setOfReactants.getAtomContainer(0);\n\n        /* manually put the reactive center */\n        molecule.getAtom(0).setFlag(CDKConstants.REACTIVE_CENTER, true);\n        molecule.getAtom(1).setFlag(CDKConstants.REACTIVE_CENTER, true);\n        molecule.getAtom(2).setFlag(CDKConstants.REACTIVE_CENTER, true);\n        molecule.getBond(0).setFlag(CDKConstants.REACTIVE_CENTER, true);\n        molecule.getBond(1).setFlag(CDKConstants.REACTIVE_CENTER, true);\n\n        List<IParameterReact> paramList = new ArrayList<IParameterReact>();\n        IParameterReact param = new SetReactionCenter();\n        param.setParameter(Boolean.TRUE);\n        paramList.add(param);\n        type.setParameterList(paramList);\n\n        /* initiate */\n        IReactionSet setOfReactions = type.initiate(setOfReactants, null);\n\n        IAtomContainer reactant = setOfReactions.getReaction(0).getReactants().getAtomContainer(0);\n        Assert.assertTrue(molecule.getAtom(0).getFlag(CDKConstants.REACTIVE_CENTER));\n        Assert.assertTrue(reactant.getAtom(0).getFlag(CDKConstants.REACTIVE_CENTER));\n        Assert.assertTrue(molecule.getAtom(1).getFlag(CDKConstants.REACTIVE_CENTER));\n        Assert.assertTrue(reactant.getAtom(1).getFlag(CDKConstants.REACTIVE_CENTER));\n        Assert.assertTrue(molecule.getAtom(2).getFlag(CDKConstants.REACTIVE_CENTER));\n        Assert.assertTrue(reactant.getAtom(2).getFlag(CDKConstants.REACTIVE_CENTER));\n        Assert.assertTrue(molecule.getBond(0).getFlag(CDKConstants.REACTIVE_CENTER));\n        Assert.assertTrue(reactant.getBond(0).getFlag(CDKConstants.REACTIVE_CENTER));\n        Assert.assertTrue(molecule.getBond(1).getFlag(CDKConstants.REACTIVE_CENTER));\n        Assert.assertTrue(reactant.getBond(1).getFlag(CDKConstants.REACTIVE_CENTER));\n    }", "signature": "void testCDKConstants_REACTIVE_CENTER()", "full_signature": "@Test public void testCDKConstants_REACTIVE_CENTER()", "class_method_signature": "RearrangementLonePairReactionTest.testCDKConstants_REACTIVE_CENTER()", "testcase": true, "constructor": false, "invocations": ["getExampleReactants", "getAtomContainer", "setFlag", "getAtom", "setFlag", "getAtom", "setFlag", "getAtom", "setFlag", "getBond", "setFlag", "getBond", "setParameter", "add", "setParameterList", "initiate", "getAtomContainer", "getReactants", "getReaction", "assertTrue", "getFlag", "getAtom", "assertTrue", "getFlag", "getAtom", "assertTrue", "getFlag", "getAtom", "assertTrue", "getFlag", "getAtom", "assertTrue", "getFlag", "getAtom", "assertTrue", "getFlag", "getAtom", "assertTrue", "getFlag", "getBond", "assertTrue", "getFlag", "getBond", "assertTrue", "getFlag", "getBond", "assertTrue", "getFlag", "getBond"]}, "focal_class": {"identifier": "RearrangementLonePairReaction", "superclass": "extends ReactionEngine", "interfaces": "implements IReactionProcess", "fields": [{"original_string": "private static ILoggingTool logger = LoggingToolFactory.createLoggingTool(RearrangementLonePairReaction.class);", "modifier": "private static", "type": "ILoggingTool", "declarator": "logger = LoggingToolFactory.createLoggingTool(RearrangementLonePairReaction.class)", "var_name": "logger"}], "methods": [{"identifier": "RearrangementLonePairReaction", "parameters": "()", "modifiers": "public", "return": "", "signature": " RearrangementLonePairReaction()", "full_signature": "public  RearrangementLonePairReaction()", "class_method_signature": "RearrangementLonePairReaction.RearrangementLonePairReaction()", "testcase": false, "constructor": true}, {"identifier": "getSpecification", "parameters": "()", "modifiers": "@Override public", "return": "ReactionSpecification", "signature": "ReactionSpecification getSpecification()", "full_signature": "@Override public ReactionSpecification getSpecification()", "class_method_signature": "RearrangementLonePairReaction.getSpecification()", "testcase": false, "constructor": false}, {"identifier": "initiate", "parameters": "(IAtomContainerSet reactants, IAtomContainerSet agents)", "modifiers": "@Override public", "return": "IReactionSet", "signature": "IReactionSet initiate(IAtomContainerSet reactants, IAtomContainerSet agents)", "full_signature": "@Override public IReactionSet initiate(IAtomContainerSet reactants, IAtomContainerSet agents)", "class_method_signature": "RearrangementLonePairReaction.initiate(IAtomContainerSet reactants, IAtomContainerSet agents)", "testcase": false, "constructor": false}, {"identifier": "setActiveCenters", "parameters": "(IAtomContainer reactant)", "modifiers": "private", "return": "void", "signature": "void setActiveCenters(IAtomContainer reactant)", "full_signature": "private void setActiveCenters(IAtomContainer reactant)", "class_method_signature": "RearrangementLonePairReaction.setActiveCenters(IAtomContainer reactant)", "testcase": false, "constructor": false}], "file": "base/reaction/src/main/java/org/openscience/cdk/reaction/type/RearrangementLonePairReaction.java"}, "focal_method": {"identifier": "initiate", "parameters": "(IAtomContainerSet reactants, IAtomContainerSet agents)", "modifiers": "@Override public", "return": "IReactionSet", "body": "@Override\n    public IReactionSet initiate(IAtomContainerSet reactants, IAtomContainerSet agents) throws CDKException {\n\n        logger.debug(\"initiate reaction: RearrangementLonePairReaction\");\n\n        if (reactants.getAtomContainerCount() != 1) {\n            throw new CDKException(\"RearrangementLonePairReaction only expects one reactant\");\n        }\n        if (agents != null) {\n            throw new CDKException(\"RearrangementLonePairReaction don't expects agents\");\n        }\n\n        IReactionSet setOfReactions = reactants.getBuilder().newInstance(IReactionSet.class);\n        IAtomContainer reactant = reactants.getAtomContainer(0);\n\n        /*\n         * if the parameter hasActiveCenter is not fixed yet, set the active\n         * centers\n         */\n        IParameterReact ipr = super.getParameterClass(SetReactionCenter.class);\n        if (ipr != null && !ipr.isSetParameter()) setActiveCenters(reactant);\n\n        Iterator<IAtom> atomis = reactant.atoms().iterator();\n        while (atomis.hasNext()) {\n            IAtom atomi = atomis.next();\n            if (atomi.getFlag(CDKConstants.REACTIVE_CENTER)\n                    && (atomi.getFormalCharge() == CDKConstants.UNSET ? 0 : atomi.getFormalCharge()) == 0\n                    && reactant.getConnectedLonePairsCount(atomi) > 0) {\n\n                Iterator<IBond> bondis = reactant.getConnectedBondsList(atomi).iterator();\n                while (bondis.hasNext()) {\n                    IBond bondi = bondis.next();\n                    if (bondi.getFlag(CDKConstants.REACTIVE_CENTER) && bondi.getOrder() == IBond.Order.SINGLE) {\n                        IAtom atomj = bondi.getOther(atomi);\n                        if (atomj.getFlag(CDKConstants.REACTIVE_CENTER)\n                                && (atomj.getFormalCharge() == CDKConstants.UNSET ? 0 : atomj.getFormalCharge()) == 0\n                                && reactant.getConnectedSingleElectronsCount(atomj) == 0) {\n\n                            Iterator<IBond> bondjs = reactant.getConnectedBondsList(atomj).iterator();\n                            while (bondjs.hasNext()) {\n                                IBond bondj = bondjs.next();\n                                if (bondj.equals(bondi)) continue;\n\n                                if (bondj.getFlag(CDKConstants.REACTIVE_CENTER)\n                                        && bondj.getOrder() == IBond.Order.DOUBLE) {\n                                    IAtom atomk = bondj.getOther(atomj);\n\n                                    if (atomk.getFlag(CDKConstants.REACTIVE_CENTER)\n                                            && reactant.getConnectedSingleElectronsCount(atomk) == 0\n                                            && (atomk.getFormalCharge() == CDKConstants.UNSET ? 0 : atomk\n                                                    .getFormalCharge()) >= 0) {\n\n                                        ArrayList<IAtom> atomList = new ArrayList<IAtom>();\n                                        atomList.add(atomi);\n                                        atomList.add(atomj);\n                                        atomList.add(atomk);\n                                        ArrayList<IBond> bondList = new ArrayList<IBond>();\n                                        bondList.add(bondi);\n                                        bondList.add(bondj);\n\n                                        IAtomContainerSet moleculeSet = reactant.getBuilder().newInstance(\n                                                IAtomContainerSet.class);\n                                        moleculeSet.addAtomContainer(reactant);\n                                        IReaction reaction = mechanism.initiate(moleculeSet, atomList, bondList);\n                                        if (reaction == null)\n                                            continue;\n                                        else\n                                            setOfReactions.addReaction(reaction);\n                                    }\n                                }\n                            }\n                        }\n                    }\n                }\n            }\n        }\n        return setOfReactions;\n\n    }", "signature": "IReactionSet initiate(IAtomContainerSet reactants, IAtomContainerSet agents)", "full_signature": "@Override public IReactionSet initiate(IAtomContainerSet reactants, IAtomContainerSet agents)", "class_method_signature": "RearrangementLonePairReaction.initiate(IAtomContainerSet reactants, IAtomContainerSet agents)", "testcase": false, "constructor": false, "invocations": ["debug", "getAtomContainerCount", "newInstance", "getBuilder", "getAtomContainer", "getParameterClass", "isSetParameter", "setActiveCenters", "iterator", "atoms", "hasNext", "next", "getFlag", "getFormalCharge", "getFormalCharge", "getConnectedLonePairsCount", "iterator", "getConnectedBondsList", "hasNext", "next", "getFlag", "getOrder", "getOther", "getFlag", "getFormalCharge", "getFormalCharge", "getConnectedSingleElectronsCount", "iterator", "getConnectedBondsList", "hasNext", "next", "equals", "getFlag", "getOrder", "getOther", "getFlag", "getConnectedSingleElectronsCount", "getFormalCharge", "getFormalCharge", "add", "add", "add", "add", "add", "newInstance", "getBuilder", "addAtomContainer", "initiate", "addReaction"]}, "repository": {"repo_id": 660443, "url": "https://github.com/cdk/cdk", "stars": 220, "created": "5/11/2010 8:30:07 AM +00:00", "updates": "2020-01-27T19:04:04+00:00", "fork": "False", "license": "licensed"}}