{"test_class": {"identifier": "MolecularFormulaSetManipulatorTest", "superclass": "extends CDKTestCase", "interfaces": "", "fields": [{"original_string": "private final static IChemObjectBuilder builder = SilentChemObjectBuilder.getInstance();", "modifier": "private final static", "type": "IChemObjectBuilder", "declarator": "builder = SilentChemObjectBuilder.getInstance()", "var_name": "builder"}], "file": "tool/formula/src/test/java/org/openscience/cdk/tools/manipulator/MolecularFormulaSetManipulatorTest.java"}, "test_case": {"identifier": "testRemove_IMolecularFormulaSet_MolecularFormulaRange", "parameters": "()", "modifiers": "@Test public", "return": "void", "body": "@Test\n    public void testRemove_IMolecularFormulaSet_MolecularFormulaRange() {\n\n        MolecularFormulaRange formulaRange = new MolecularFormulaRange();\n        formulaRange.addIsotope(builder.newInstance(IIsotope.class, \"C\"), 0, 4);\n        formulaRange.addIsotope(builder.newInstance(IIsotope.class, \"H\"), 0, 12);\n        formulaRange.addIsotope(builder.newInstance(IIsotope.class, \"N\"), 0, 2);\n\n        IMolecularFormula mf2 = new MolecularFormula();\n        mf2.addIsotope(builder.newInstance(IIsotope.class, \"C\"), 1);\n        mf2.addIsotope(builder.newInstance(IIsotope.class, \"H\"), 11);\n        mf2.addIsotope(builder.newInstance(IIsotope.class, \"N\"), 1);\n\n        IMolecularFormula mf1 = new MolecularFormula();\n        mf1.addIsotope(builder.newInstance(IIsotope.class, \"C\"), 3);\n        mf1.addIsotope(builder.newInstance(IIsotope.class, \"H\"), 10);\n\n        IMolecularFormulaSet formulaSet = new MolecularFormulaSet();\n        formulaSet.addMolecularFormula(mf1);\n        formulaSet.addMolecularFormula(mf2);\n\n        IMolecularFormulaSet newMFSet = MolecularFormulaSetManipulator.remove(formulaSet, formulaRange);\n        /* the mf2 is excluded from the limits. It doesn't contain N */\n\n        Assert.assertEquals(2, newMFSet.size());\n\n    }", "signature": "void testRemove_IMolecularFormulaSet_MolecularFormulaRange()", "full_signature": "@Test public void testRemove_IMolecularFormulaSet_MolecularFormulaRange()", "class_method_signature": "MolecularFormulaSetManipulatorTest.testRemove_IMolecularFormulaSet_MolecularFormulaRange()", "testcase": true, "constructor": false, "invocations": ["addIsotope", "newInstance", "addIsotope", "newInstance", "addIsotope", "newInstance", "addIsotope", "newInstance", "addIsotope", "newInstance", "addIsotope", "newInstance", "addIsotope", "newInstance", "addIsotope", "newInstance", "addMolecularFormula", "addMolecularFormula", "remove", "assertEquals", "size"]}, "focal_class": {"identifier": "MolecularFormulaSetManipulator", "superclass": "", "interfaces": "", "fields": [], "methods": [{"identifier": "getMaxOccurrenceElements", "parameters": "(IMolecularFormulaSet mfSet)", "modifiers": "public static", "return": "IMolecularFormula", "signature": "IMolecularFormula getMaxOccurrenceElements(IMolecularFormulaSet mfSet)", "full_signature": "public static IMolecularFormula getMaxOccurrenceElements(IMolecularFormulaSet mfSet)", "class_method_signature": "MolecularFormulaSetManipulator.getMaxOccurrenceElements(IMolecularFormulaSet mfSet)", "testcase": false, "constructor": false}, {"identifier": "getMinOccurrenceElements", "parameters": "(IMolecularFormulaSet mfSet)", "modifiers": "public static", "return": "IMolecularFormula", "signature": "IMolecularFormula getMinOccurrenceElements(IMolecularFormulaSet mfSet)", "full_signature": "public static IMolecularFormula getMinOccurrenceElements(IMolecularFormulaSet mfSet)", "class_method_signature": "MolecularFormulaSetManipulator.getMinOccurrenceElements(IMolecularFormulaSet mfSet)", "testcase": false, "constructor": false}, {"identifier": "remove", "parameters": "(IMolecularFormulaSet formulaSet, IMolecularFormula formulaMin,\n            IMolecularFormula formulaMax)", "modifiers": "public static", "return": "IMolecularFormulaSet", "signature": "IMolecularFormulaSet remove(IMolecularFormulaSet formulaSet, IMolecularFormula formulaMin,\n            IMolecularFormula formulaMax)", "full_signature": "public static IMolecularFormulaSet remove(IMolecularFormulaSet formulaSet, IMolecularFormula formulaMin,\n            IMolecularFormula formulaMax)", "class_method_signature": "MolecularFormulaSetManipulator.remove(IMolecularFormulaSet formulaSet, IMolecularFormula formulaMin,\n            IMolecularFormula formulaMax)", "testcase": false, "constructor": false}, {"identifier": "validCorrelation", "parameters": "(IMolecularFormula formulaMin, IMolecularFormula formulamax)", "modifiers": "private static", "return": "boolean", "signature": "boolean validCorrelation(IMolecularFormula formulaMin, IMolecularFormula formulamax)", "full_signature": "private static boolean validCorrelation(IMolecularFormula formulaMin, IMolecularFormula formulamax)", "class_method_signature": "MolecularFormulaSetManipulator.validCorrelation(IMolecularFormula formulaMin, IMolecularFormula formulamax)", "testcase": false, "constructor": false}, {"identifier": "contains", "parameters": "(IMolecularFormulaSet formulaSet, IMolecularFormula formula)", "modifiers": "public static", "return": "boolean", "signature": "boolean contains(IMolecularFormulaSet formulaSet, IMolecularFormula formula)", "full_signature": "public static boolean contains(IMolecularFormulaSet formulaSet, IMolecularFormula formula)", "class_method_signature": "MolecularFormulaSetManipulator.contains(IMolecularFormulaSet formulaSet, IMolecularFormula formula)", "testcase": false, "constructor": false}, {"identifier": "remove", "parameters": "(IMolecularFormulaSet formulaSet, MolecularFormulaRange formulaRange)", "modifiers": "public static", "return": "IMolecularFormulaSet", "signature": "IMolecularFormulaSet remove(IMolecularFormulaSet formulaSet, MolecularFormulaRange formulaRange)", "full_signature": "public static IMolecularFormulaSet remove(IMolecularFormulaSet formulaSet, MolecularFormulaRange formulaRange)", "class_method_signature": "MolecularFormulaSetManipulator.remove(IMolecularFormulaSet formulaSet, MolecularFormulaRange formulaRange)", "testcase": false, "constructor": false}], "file": "tool/formula/src/main/java/org/openscience/cdk/tools/manipulator/MolecularFormulaSetManipulator.java"}, "focal_method": {"identifier": "remove", "parameters": "(IMolecularFormulaSet formulaSet, IMolecularFormula formulaMin,\n            IMolecularFormula formulaMax)", "modifiers": "public static", "return": "IMolecularFormulaSet", "body": "public static IMolecularFormulaSet remove(IMolecularFormulaSet formulaSet, IMolecularFormula formulaMin,\n            IMolecularFormula formulaMax) {\n\n        // prove the correlation between maximum and minimum molecularFormula\n        if (!validCorrelation(formulaMin, formulaMax)) return null;\n\n        IMolecularFormulaSet newFormulaSet = formulaSet.getBuilder().newInstance(IMolecularFormulaSet.class);\n\n        for (IMolecularFormula formula : formulaSet.molecularFormulas()) {\n            boolean flagPass = true;\n\n            // the formula must contain all element found into the formulaMin\n            if (!validCorrelation(formula, formulaMin)) continue;\n\n            for (IElement element : MolecularFormulaManipulator.elements(formulaMin)) {\n                int occur = MolecularFormulaManipulator.getElementCount(formula, element);\n                int occurMax = MolecularFormulaManipulator.getElementCount(formulaMax, element);\n                int occurMin = MolecularFormulaManipulator.getElementCount(formulaMin, element);\n\n                if (!(occurMin <= occur) || !(occur <= occurMax)) {\n                    flagPass = false;\n                    break;\n                }\n\n            }\n            if (flagPass) // stored if each IElement occurrence is into the limits\n                newFormulaSet.addMolecularFormula(formula);\n\n        }\n        return newFormulaSet;\n    }", "signature": "IMolecularFormulaSet remove(IMolecularFormulaSet formulaSet, IMolecularFormula formulaMin,\n            IMolecularFormula formulaMax)", "full_signature": "public static IMolecularFormulaSet remove(IMolecularFormulaSet formulaSet, IMolecularFormula formulaMin,\n            IMolecularFormula formulaMax)", "class_method_signature": "MolecularFormulaSetManipulator.remove(IMolecularFormulaSet formulaSet, IMolecularFormula formulaMin,\n            IMolecularFormula formulaMax)", "testcase": false, "constructor": false, "invocations": ["validCorrelation", "newInstance", "getBuilder", "molecularFormulas", "validCorrelation", "elements", "getElementCount", "getElementCount", "getElementCount", "addMolecularFormula"]}, "repository": {"repo_id": 660443, "url": "https://github.com/cdk/cdk", "stars": 220, "created": "5/11/2010 8:30:07 AM +00:00", "updates": "2020-01-27T19:04:04+00:00", "fork": "False", "license": "licensed"}}