{"test_class": {"identifier": "PiElectronegativityDescriptorTest", "superclass": "extends AtomicDescriptorTest", "interfaces": "", "fields": [{"original_string": "private IChemObjectBuilder      builder = SilentChemObjectBuilder.getInstance();", "modifier": "private", "type": "IChemObjectBuilder", "declarator": "builder = SilentChemObjectBuilder.getInstance()", "var_name": "builder"}, {"original_string": "private LonePairElectronChecker lpcheck = new LonePairElectronChecker();", "modifier": "private", "type": "LonePairElectronChecker", "declarator": "lpcheck = new LonePairElectronChecker()", "var_name": "lpcheck"}], "file": "descriptor/qsaratomic/src/test/java/org/openscience/cdk/qsar/descriptors/atomic/PiElectronegativityDescriptorTest.java"}, "test_case": {"identifier": "testCompareIonized", "parameters": "()", "modifiers": "@Test public", "return": "void", "body": "@Test\n    public void testCompareIonized() throws ClassNotFoundException, CDKException, java.lang.Exception {\n\n        IAtomContainer molA = builder.newInstance(IAtomContainer.class);\n        molA.addAtom(builder.newInstance(IAtom.class, \"C\"));\n        molA.addAtom(builder.newInstance(IAtom.class, \"C\"));\n        molA.addBond(0, 1, IBond.Order.SINGLE);\n        molA.addAtom(builder.newInstance(IAtom.class, \"C\"));\n        molA.addBond(1, 2, IBond.Order.SINGLE);\n        molA.addAtom(builder.newInstance(IAtom.class, \"Cl\"));\n        molA.addBond(2, 3, IBond.Order.SINGLE);\n\n        AtomContainerManipulator.percieveAtomTypesAndConfigureAtoms(molA);\n        addExplicitHydrogens(molA);\n        lpcheck.saturate(molA);\n\n        double resultA = ((DoubleResult) descriptor.calculate(molA.getAtom(3), molA).getValue()).doubleValue();\n\n        IAtomContainer molB = builder.newInstance(IAtomContainer.class);\n        molB.addAtom(builder.newInstance(IAtom.class, \"C\"));\n        molB.addAtom(builder.newInstance(IAtom.class, \"C\"));\n        molB.addBond(0, 1, IBond.Order.SINGLE);\n        molB.addAtom(builder.newInstance(IAtom.class, \"C\"));\n        molB.addBond(1, 2, IBond.Order.SINGLE);\n        molB.addAtom(builder.newInstance(IAtom.class, \"Cl\"));\n        molB.getAtom(3).setFormalCharge(1);\n        molB.addSingleElectron(3);\n        molB.addLonePair(3);\n        molB.addLonePair(3);\n        molB.addBond(2, 3, IBond.Order.SINGLE);\n\n        addExplicitHydrogens(molB);\n        AtomContainerManipulator.percieveAtomTypesAndConfigureAtoms(molB);\n        lpcheck.saturate(molB);\n\n        Assert.assertEquals(1, molB.getAtom(3).getFormalCharge(), 0.00001);\n        Assert.assertEquals(1, molB.getSingleElectronCount(), 0.00001);\n        Assert.assertEquals(2, molB.getLonePairCount(), 0.00001);\n\n        IAtomicDescriptor descriptor = new PiElectronegativityDescriptor();\n        double resultB = ((DoubleResult) descriptor.calculate(molB.getAtom(3), molB).getValue()).doubleValue();\n\n        Assert.assertEquals(resultA, resultB, 0.00001);\n    }", "signature": "void testCompareIonized()", "full_signature": "@Test public void testCompareIonized()", "class_method_signature": "PiElectronegativityDescriptorTest.testCompareIonized()", "testcase": true, "constructor": false, "invocations": ["newInstance", "addAtom", "newInstance", "addAtom", "newInstance", "addBond", "addAtom", "newInstance", "addBond", "addAtom", "newInstance", "addBond", "percieveAtomTypesAndConfigureAtoms", "addExplicitHydrogens", "saturate", "doubleValue", "getValue", "calculate", "getAtom", "newInstance", "addAtom", "newInstance", "addAtom", "newInstance", "addBond", "addAtom", "newInstance", "addBond", "addAtom", "newInstance", "setFormalCharge", "getAtom", "addSingleElectron", "addLonePair", "addLonePair", "addBond", "addExplicitHydrogens", "percieveAtomTypesAndConfigureAtoms", "saturate", "assertEquals", "getFormalCharge", "getAtom", "assertEquals", "getSingleElectronCount", "assertEquals", "getLonePairCount", "doubleValue", "getValue", "calculate", "getAtom", "assertEquals"]}, "focal_class": {"identifier": "PiElectronegativityDescriptor", "superclass": "extends AbstractAtomicDescriptor", "interfaces": "implements IAtomicDescriptor", "fields": [{"original_string": "private int                   maxIterations   = -1;", "modifier": "private", "type": "int", "declarator": "maxIterations   = -1", "var_name": "maxIterations"}, {"original_string": "private int                   maxResonStruc   = -1;", "modifier": "private", "type": "int", "declarator": "maxResonStruc   = -1", "var_name": "maxResonStruc"}, {"original_string": "private boolean               lpeChecker      = true;", "modifier": "private", "type": "boolean", "declarator": "lpeChecker      = true", "var_name": "lpeChecker"}, {"original_string": "private static final String[] NAMES = {\"elecPiA\"};", "modifier": "private static final", "type": "String[]", "declarator": "NAMES = {\"elecPiA\"}", "var_name": "NAMES"}, {"original_string": "private PiElectronegativity   electronegativity;", "modifier": "private", "type": "PiElectronegativity", "declarator": "electronegativity", "var_name": "electronegativity"}], "methods": [{"identifier": "PiElectronegativityDescriptor", "parameters": "()", "modifiers": "public", "return": "", "signature": " PiElectronegativityDescriptor()", "full_signature": "public  PiElectronegativityDescriptor()", "class_method_signature": "PiElectronegativityDescriptor.PiElectronegativityDescriptor()", "testcase": false, "constructor": true}, {"identifier": "getSpecification", "parameters": "()", "modifiers": "@Override public", "return": "DescriptorSpecification", "signature": "DescriptorSpecification getSpecification()", "full_signature": "@Override public DescriptorSpecification getSpecification()", "class_method_signature": "PiElectronegativityDescriptor.getSpecification()", "testcase": false, "constructor": false}, {"identifier": "setParameters", "parameters": "(Object[] params)", "modifiers": "@Override public", "return": "void", "signature": "void setParameters(Object[] params)", "full_signature": "@Override public void setParameters(Object[] params)", "class_method_signature": "PiElectronegativityDescriptor.setParameters(Object[] params)", "testcase": false, "constructor": false}, {"identifier": "getParameters", "parameters": "()", "modifiers": "@Override public", "return": "Object[]", "signature": "Object[] getParameters()", "full_signature": "@Override public Object[] getParameters()", "class_method_signature": "PiElectronegativityDescriptor.getParameters()", "testcase": false, "constructor": false}, {"identifier": "getDescriptorNames", "parameters": "()", "modifiers": "@Override public", "return": "String[]", "signature": "String[] getDescriptorNames()", "full_signature": "@Override public String[] getDescriptorNames()", "class_method_signature": "PiElectronegativityDescriptor.getDescriptorNames()", "testcase": false, "constructor": false}, {"identifier": "calculate", "parameters": "(IAtom atom, IAtomContainer atomContainer)", "modifiers": "@Override public", "return": "DescriptorValue", "signature": "DescriptorValue calculate(IAtom atom, IAtomContainer atomContainer)", "full_signature": "@Override public DescriptorValue calculate(IAtom atom, IAtomContainer atomContainer)", "class_method_signature": "PiElectronegativityDescriptor.calculate(IAtom atom, IAtomContainer atomContainer)", "testcase": false, "constructor": false}, {"identifier": "getParameterNames", "parameters": "()", "modifiers": "@Override public", "return": "String[]", "signature": "String[] getParameterNames()", "full_signature": "@Override public String[] getParameterNames()", "class_method_signature": "PiElectronegativityDescriptor.getParameterNames()", "testcase": false, "constructor": false}, {"identifier": "getParameterType", "parameters": "(String name)", "modifiers": "@Override public", "return": "Object", "signature": "Object getParameterType(String name)", "full_signature": "@Override public Object getParameterType(String name)", "class_method_signature": "PiElectronegativityDescriptor.getParameterType(String name)", "testcase": false, "constructor": false}], "file": "descriptor/qsaratomic/src/main/java/org/openscience/cdk/qsar/descriptors/atomic/PiElectronegativityDescriptor.java"}, "focal_method": {"identifier": "calculate", "parameters": "(IAtom atom, IAtomContainer atomContainer)", "modifiers": "@Override public", "return": "DescriptorValue", "body": "@Override\n    public DescriptorValue calculate(IAtom atom, IAtomContainer atomContainer) {\n        IAtomContainer clone;\n        IAtom localAtom;\n        try {\n            clone = (IAtomContainer) atomContainer.clone();\n            AtomContainerManipulator.percieveAtomTypesAndConfigureAtoms(clone);\n            if (lpeChecker) {\n                LonePairElectronChecker lpcheck = new LonePairElectronChecker();\n                lpcheck.saturate(atomContainer);\n            }\n            localAtom = clone.getAtom(atomContainer.indexOf(atom));\n        } catch (CloneNotSupportedException e) {\n            return new DescriptorValue(getSpecification(), getParameterNames(), getParameters(), new DoubleResult(\n                    Double.NaN), NAMES, null);\n        } catch (CDKException e) {\n            return new DescriptorValue(getSpecification(), getParameterNames(), getParameters(), new DoubleResult(\n                    Double.NaN), NAMES, null);\n        }\n\n        if (maxIterations != -1 && maxIterations != 0) electronegativity.setMaxIterations(maxIterations);\n        if (maxResonStruc != -1 && maxResonStruc != 0) electronegativity.setMaxResonStruc(maxResonStruc);\n\n        double result = electronegativity.calculatePiElectronegativity(clone, localAtom);\n\n        return new DescriptorValue(getSpecification(), getParameterNames(), getParameters(), new DoubleResult(result),\n                                   NAMES);\n    }", "signature": "DescriptorValue calculate(IAtom atom, IAtomContainer atomContainer)", "full_signature": "@Override public DescriptorValue calculate(IAtom atom, IAtomContainer atomContainer)", "class_method_signature": "PiElectronegativityDescriptor.calculate(IAtom atom, IAtomContainer atomContainer)", "testcase": false, "constructor": false, "invocations": ["clone", "percieveAtomTypesAndConfigureAtoms", "saturate", "getAtom", "indexOf", "getSpecification", "getParameterNames", "getParameters", "getSpecification", "getParameterNames", "getParameters", "setMaxIterations", "setMaxResonStruc", "calculatePiElectronegativity", "getSpecification", "getParameterNames", "getParameters"]}, "repository": {"repo_id": 660443, "url": "https://github.com/cdk/cdk", "stars": 220, "created": "5/11/2010 8:30:07 AM +00:00", "updates": "2020-01-27T19:04:04+00:00", "fork": "False", "license": "licensed"}}