{"test_class": {"identifier": "MolecularFormulaSetManipulatorTest", "superclass": "extends CDKTestCase", "interfaces": "", "fields": [{"original_string": "private final static IChemObjectBuilder builder = SilentChemObjectBuilder.getInstance();", "modifier": "private final static", "type": "IChemObjectBuilder", "declarator": "builder = SilentChemObjectBuilder.getInstance()", "var_name": "builder"}], "file": "tool/formula/src/test/java/org/openscience/cdk/tools/manipulator/MolecularFormulaSetManipulatorTest.java"}, "test_case": {"identifier": "testGetMinOccurrenceElements_IMolecularFormulaSet", "parameters": "()", "modifiers": "@Test public", "return": "void", "body": "@Test\n    public void testGetMinOccurrenceElements_IMolecularFormulaSet() {\n        IMolecularFormula mf1 = new MolecularFormula(); /* C4H12NO4 */\n        mf1.addIsotope(builder.newInstance(IIsotope.class, \"C\"), 4);\n        mf1.addIsotope(builder.newInstance(IIsotope.class, \"H\"), 12);\n        mf1.addIsotope(builder.newInstance(IIsotope.class, \"N\"), 1);\n        mf1.addIsotope(builder.newInstance(IIsotope.class, \"O\"), 4);\n\n        IMolecularFormula mf2 = new MolecularFormula(); /* C7H20N4O2 */\n        mf2.addIsotope(builder.newInstance(IIsotope.class, \"C\"), 7);\n        mf2.addIsotope(builder.newInstance(IIsotope.class, \"H\"), 20);\n        mf2.addIsotope(builder.newInstance(IIsotope.class, \"N\"), 4);\n        mf2.addIsotope(builder.newInstance(IIsotope.class, \"O\"), 2);\n\n        IMolecularFormula mf3 = new MolecularFormula(); /* C9H5O7 */\n        mf3.addIsotope(builder.newInstance(IIsotope.class, \"C\"), 9);\n        mf3.addIsotope(builder.newInstance(IIsotope.class, \"H\"), 5);\n        mf3.addIsotope(builder.newInstance(IIsotope.class, \"O\"), 7);\n\n        IMolecularFormulaSet mfSet = new MolecularFormulaSet();\n        mfSet.addMolecularFormula(mf1);\n        mfSet.addMolecularFormula(mf2);\n        mfSet.addMolecularFormula(mf3);\n\n        IMolecularFormula molecularFormula = MolecularFormulaSetManipulator.getMinOccurrenceElements(mfSet);\n\n        /* Result: C4H5NO2 */\n\n        Assert.assertEquals(12, MolecularFormulaManipulator.getAtomCount(molecularFormula));\n        Assert.assertEquals(4, molecularFormula.getIsotopeCount());\n        Assert.assertEquals(4, molecularFormula.getIsotopeCount(builder.newInstance(IIsotope.class, \"C\")));\n        Assert.assertEquals(5, molecularFormula.getIsotopeCount(builder.newInstance(IIsotope.class, \"H\")));\n        Assert.assertEquals(1, molecularFormula.getIsotopeCount(builder.newInstance(IIsotope.class, \"N\")));\n        Assert.assertEquals(2, molecularFormula.getIsotopeCount(builder.newInstance(IIsotope.class, \"O\")));\n\n    }", "signature": "void testGetMinOccurrenceElements_IMolecularFormulaSet()", "full_signature": "@Test public void testGetMinOccurrenceElements_IMolecularFormulaSet()", "class_method_signature": "MolecularFormulaSetManipulatorTest.testGetMinOccurrenceElements_IMolecularFormulaSet()", "testcase": true, "constructor": false, "invocations": ["addIsotope", "newInstance", "addIsotope", "newInstance", "addIsotope", "newInstance", "addIsotope", "newInstance", "addIsotope", "newInstance", "addIsotope", "newInstance", "addIsotope", "newInstance", "addIsotope", "newInstance", "addIsotope", "newInstance", "addIsotope", "newInstance", "addIsotope", "newInstance", "addMolecularFormula", "addMolecularFormula", "addMolecularFormula", "getMinOccurrenceElements", "assertEquals", "getAtomCount", "assertEquals", "getIsotopeCount", "assertEquals", "getIsotopeCount", "newInstance", "assertEquals", "getIsotopeCount", "newInstance", "assertEquals", "getIsotopeCount", "newInstance", "assertEquals", "getIsotopeCount", "newInstance"]}, "focal_class": {"identifier": "MolecularFormulaSetManipulator", "superclass": "", "interfaces": "", "fields": [], "methods": [{"identifier": "getMaxOccurrenceElements", "parameters": "(IMolecularFormulaSet mfSet)", "modifiers": "public static", "return": "IMolecularFormula", "signature": "IMolecularFormula getMaxOccurrenceElements(IMolecularFormulaSet mfSet)", "full_signature": "public static IMolecularFormula getMaxOccurrenceElements(IMolecularFormulaSet mfSet)", "class_method_signature": "MolecularFormulaSetManipulator.getMaxOccurrenceElements(IMolecularFormulaSet mfSet)", "testcase": false, "constructor": false}, {"identifier": "getMinOccurrenceElements", "parameters": "(IMolecularFormulaSet mfSet)", "modifiers": "public static", "return": "IMolecularFormula", "signature": "IMolecularFormula getMinOccurrenceElements(IMolecularFormulaSet mfSet)", "full_signature": "public static IMolecularFormula getMinOccurrenceElements(IMolecularFormulaSet mfSet)", "class_method_signature": "MolecularFormulaSetManipulator.getMinOccurrenceElements(IMolecularFormulaSet mfSet)", "testcase": false, "constructor": false}, {"identifier": "remove", "parameters": "(IMolecularFormulaSet formulaSet, IMolecularFormula formulaMin,\n            IMolecularFormula formulaMax)", "modifiers": "public static", "return": "IMolecularFormulaSet", "signature": "IMolecularFormulaSet remove(IMolecularFormulaSet formulaSet, IMolecularFormula formulaMin,\n            IMolecularFormula formulaMax)", "full_signature": "public static IMolecularFormulaSet remove(IMolecularFormulaSet formulaSet, IMolecularFormula formulaMin,\n            IMolecularFormula formulaMax)", "class_method_signature": "MolecularFormulaSetManipulator.remove(IMolecularFormulaSet formulaSet, IMolecularFormula formulaMin,\n            IMolecularFormula formulaMax)", "testcase": false, "constructor": false}, {"identifier": "validCorrelation", "parameters": "(IMolecularFormula formulaMin, IMolecularFormula formulamax)", "modifiers": "private static", "return": "boolean", "signature": "boolean validCorrelation(IMolecularFormula formulaMin, IMolecularFormula formulamax)", "full_signature": "private static boolean validCorrelation(IMolecularFormula formulaMin, IMolecularFormula formulamax)", "class_method_signature": "MolecularFormulaSetManipulator.validCorrelation(IMolecularFormula formulaMin, IMolecularFormula formulamax)", "testcase": false, "constructor": false}, {"identifier": "contains", "parameters": "(IMolecularFormulaSet formulaSet, IMolecularFormula formula)", "modifiers": "public static", "return": "boolean", "signature": "boolean contains(IMolecularFormulaSet formulaSet, IMolecularFormula formula)", "full_signature": "public static boolean contains(IMolecularFormulaSet formulaSet, IMolecularFormula formula)", "class_method_signature": "MolecularFormulaSetManipulator.contains(IMolecularFormulaSet formulaSet, IMolecularFormula formula)", "testcase": false, "constructor": false}, {"identifier": "remove", "parameters": "(IMolecularFormulaSet formulaSet, MolecularFormulaRange formulaRange)", "modifiers": "public static", "return": "IMolecularFormulaSet", "signature": "IMolecularFormulaSet remove(IMolecularFormulaSet formulaSet, MolecularFormulaRange formulaRange)", "full_signature": "public static IMolecularFormulaSet remove(IMolecularFormulaSet formulaSet, MolecularFormulaRange formulaRange)", "class_method_signature": "MolecularFormulaSetManipulator.remove(IMolecularFormulaSet formulaSet, MolecularFormulaRange formulaRange)", "testcase": false, "constructor": false}], "file": "tool/formula/src/main/java/org/openscience/cdk/tools/manipulator/MolecularFormulaSetManipulator.java"}, "focal_method": {"identifier": "getMinOccurrenceElements", "parameters": "(IMolecularFormulaSet mfSet)", "modifiers": "public static", "return": "IMolecularFormula", "body": "public static IMolecularFormula getMinOccurrenceElements(IMolecularFormulaSet mfSet) {\n\n        IMolecularFormula molecularFormula = mfSet.getBuilder().newInstance(IMolecularFormula.class);\n        for (IMolecularFormula mf : mfSet.molecularFormulas()) {\n            for (IIsotope isotope : mf.isotopes()) {\n                IElement element = mfSet.getBuilder().newInstance(IElement.class, isotope);\n                int occur_new = MolecularFormulaManipulator.getElementCount(mf, element);\n                if (!MolecularFormulaManipulator.containsElement(molecularFormula, element)) {\n                    molecularFormula.addIsotope(mfSet.getBuilder().newInstance(IIsotope.class, element), occur_new);\n                } else {\n                    int occur_old = MolecularFormulaManipulator.getElementCount(molecularFormula, element);\n                    if (occur_new < occur_old) {\n                        MolecularFormulaManipulator.removeElement(molecularFormula, element);\n                        molecularFormula.addIsotope(mfSet.getBuilder().newInstance(IIsotope.class, element), occur_new);\n                    }\n                }\n            }\n        }\n        return molecularFormula;\n    }", "signature": "IMolecularFormula getMinOccurrenceElements(IMolecularFormulaSet mfSet)", "full_signature": "public static IMolecularFormula getMinOccurrenceElements(IMolecularFormulaSet mfSet)", "class_method_signature": "MolecularFormulaSetManipulator.getMinOccurrenceElements(IMolecularFormulaSet mfSet)", "testcase": false, "constructor": false, "invocations": ["newInstance", "getBuilder", "molecularFormulas", "isotopes", "newInstance", "getBuilder", "getElementCount", "containsElement", "addIsotope", "newInstance", "getBuilder", "getElementCount", "removeElement", "addIsotope", "newInstance", "getBuilder"]}, "repository": {"repo_id": 660443, "url": "https://github.com/cdk/cdk", "stars": 220, "created": "5/11/2010 8:30:07 AM +00:00", "updates": "2020-01-27T19:04:04+00:00", "fork": "False", "license": "licensed"}}