{"test_class": {"identifier": "PCSubstanceXMLReaderTest", "superclass": "extends SimpleChemObjectReaderTest", "interfaces": "", "fields": [{"original_string": "private static ILoggingTool logger = LoggingToolFactory.createLoggingTool(PCSubstanceXMLReaderTest.class);", "modifier": "private static", "type": "ILoggingTool", "declarator": "logger = LoggingToolFactory.createLoggingTool(PCSubstanceXMLReaderTest.class)", "var_name": "logger"}], "file": "storage/io/src/test/java/org/openscience/cdk/io/PCSubstanceXMLReaderTest.java"}, "test_case": {"identifier": "testReading", "parameters": "()", "modifiers": "@Test public", "return": "void", "body": "@Test\n    public void testReading() throws Exception {\n        String filename = \"data/asn/pubchem/sid577309.xml\";\n        logger.info(\"Testing: \" + filename);\n        InputStream ins = this.getClass().getClassLoader().getResourceAsStream(filename);\n        PCSubstanceXMLReader reader = new PCSubstanceXMLReader(ins);\n        IAtomContainer molecule = (IAtomContainer) reader.read(new AtomContainer());\n        Assert.assertNotNull(molecule);\n\n        // check atom stuff\n        Assert.assertEquals(19, molecule.getAtomCount());\n        Assert.assertTrue(molecule.getAtom(0) instanceof IPseudoAtom);\n\n        // check bond stuff\n        Assert.assertEquals(19, molecule.getBondCount());\n        Assert.assertNotNull(molecule.getBond(3));\n    }", "signature": "void testReading()", "full_signature": "@Test public void testReading()", "class_method_signature": "PCSubstanceXMLReaderTest.testReading()", "testcase": true, "constructor": false, "invocations": ["info", "getResourceAsStream", "getClassLoader", "getClass", "read", "assertNotNull", "assertEquals", "getAtomCount", "assertTrue", "getAtom", "assertEquals", "getBondCount", "assertNotNull", "getBond"]}, "focal_class": {"identifier": "PCSubstanceXMLReader", "superclass": "extends DefaultChemObjectReader", "interfaces": "", "fields": [{"original_string": "private Reader             input;", "modifier": "private", "type": "Reader", "declarator": "input", "var_name": "input"}, {"original_string": "private XMLStreamReader    parser;", "modifier": "private", "type": "XMLStreamReader", "declarator": "parser", "var_name": "parser"}, {"original_string": "private PubChemXMLHelper   parserHelper;", "modifier": "private", "type": "PubChemXMLHelper", "declarator": "parserHelper", "var_name": "parserHelper"}, {"original_string": "private IChemObjectBuilder builder;", "modifier": "private", "type": "IChemObjectBuilder", "declarator": "builder", "var_name": "builder"}, {"original_string": "IAtomContainer             molecule = null;", "modifier": "", "type": "IAtomContainer", "declarator": "molecule = null", "var_name": "molecule"}], "methods": [{"identifier": "PCSubstanceXMLReader", "parameters": "(Reader input)", "modifiers": "public", "return": "", "signature": " PCSubstanceXMLReader(Reader input)", "full_signature": "public  PCSubstanceXMLReader(Reader input)", "class_method_signature": "PCSubstanceXMLReader.PCSubstanceXMLReader(Reader input)", "testcase": false, "constructor": true}, {"identifier": "PCSubstanceXMLReader", "parameters": "(InputStream input)", "modifiers": "public", "return": "", "signature": " PCSubstanceXMLReader(InputStream input)", "full_signature": "public  PCSubstanceXMLReader(InputStream input)", "class_method_signature": "PCSubstanceXMLReader.PCSubstanceXMLReader(InputStream input)", "testcase": false, "constructor": true}, {"identifier": "PCSubstanceXMLReader", "parameters": "()", "modifiers": "public", "return": "", "signature": " PCSubstanceXMLReader()", "full_signature": "public  PCSubstanceXMLReader()", "class_method_signature": "PCSubstanceXMLReader.PCSubstanceXMLReader()", "testcase": false, "constructor": true}, {"identifier": "getFormat", "parameters": "()", "modifiers": "@Override public", "return": "IResourceFormat", "signature": "IResourceFormat getFormat()", "full_signature": "@Override public IResourceFormat getFormat()", "class_method_signature": "PCSubstanceXMLReader.getFormat()", "testcase": false, "constructor": false}, {"identifier": "setReader", "parameters": "(Reader input)", "modifiers": "@Override public", "return": "void", "signature": "void setReader(Reader input)", "full_signature": "@Override public void setReader(Reader input)", "class_method_signature": "PCSubstanceXMLReader.setReader(Reader input)", "testcase": false, "constructor": false}, {"identifier": "setReader", "parameters": "(InputStream input)", "modifiers": "@Override public", "return": "void", "signature": "void setReader(InputStream input)", "full_signature": "@Override public void setReader(InputStream input)", "class_method_signature": "PCSubstanceXMLReader.setReader(InputStream input)", "testcase": false, "constructor": false}, {"identifier": "accepts", "parameters": "(Class<? extends IChemObject> classObject)", "modifiers": "@Override public", "return": "boolean", "signature": "boolean accepts(Class<? extends IChemObject> classObject)", "full_signature": "@Override public boolean accepts(Class<? extends IChemObject> classObject)", "class_method_signature": "PCSubstanceXMLReader.accepts(Class<? extends IChemObject> classObject)", "testcase": false, "constructor": false}, {"identifier": "read", "parameters": "(T object)", "modifiers": "@Override public", "return": "T", "signature": "T read(T object)", "full_signature": "@Override public T read(T object)", "class_method_signature": "PCSubstanceXMLReader.read(T object)", "testcase": false, "constructor": false}, {"identifier": "close", "parameters": "()", "modifiers": "@Override public", "return": "void", "signature": "void close()", "full_signature": "@Override public void close()", "class_method_signature": "PCSubstanceXMLReader.close()", "testcase": false, "constructor": false}, {"identifier": "readMolecule", "parameters": "()", "modifiers": "private", "return": "IAtomContainer", "signature": "IAtomContainer readMolecule()", "full_signature": "private IAtomContainer readMolecule()", "class_method_signature": "PCSubstanceXMLReader.readMolecule()", "testcase": false, "constructor": false}], "file": "storage/io/src/main/java/org/openscience/cdk/io/PCSubstanceXMLReader.java"}, "focal_method": {"identifier": "read", "parameters": "(T object)", "modifiers": "@Override public", "return": "T", "body": "@Override\n    public <T extends IChemObject> T read(T object) throws CDKException {\n        if (object instanceof IAtomContainer) {\n            try {\n                parserHelper = new PubChemXMLHelper(object.getBuilder());\n                builder = object.getBuilder();\n                return (T) readMolecule();\n            } catch (IOException e) {\n                throw new CDKException(\"An IO Exception occurred while reading the file.\", e);\n            } catch (CDKException e) {\n                throw e;\n            } catch (Exception e) {\n                throw new CDKException(\"An error occurred: \" + e.getMessage(), e);\n            }\n        } else {\n            throw new CDKException(\"Only supported is reading of ChemFile objects.\");\n        }\n    }", "signature": "T read(T object)", "full_signature": "@Override public T read(T object)", "class_method_signature": "PCSubstanceXMLReader.read(T object)", "testcase": false, "constructor": false, "invocations": ["getBuilder", "getBuilder", "readMolecule", "getMessage"]}, "repository": {"repo_id": 660443, "url": "https://github.com/cdk/cdk", "stars": 220, "created": "5/11/2010 8:30:07 AM +00:00", "updates": "2020-01-27T19:04:04+00:00", "fork": "False", "license": "licensed"}}