{"test_class": {"identifier": "RadicalChargeSiteInitiationReactionTest", "superclass": "extends ReactionProcessTest", "interfaces": "", "fields": [{"original_string": "private IChemObjectBuilder builder = SilentChemObjectBuilder.getInstance();", "modifier": "private", "type": "IChemObjectBuilder", "declarator": "builder = SilentChemObjectBuilder.getInstance()", "var_name": "builder"}], "file": "base/reaction/src/test/java/org/openscience/cdk/reaction/type/RadicalChargeSiteInitiationReactionTest.java"}, "test_case": {"identifier": "testInitiate_IAtomContainerSet_IAtomContainerSet", "parameters": "()", "modifiers": "@Test @Override public", "return": "void", "body": "@Test\n    @Override\n    public void testInitiate_IAtomContainerSet_IAtomContainerSet() throws Exception {\n        IReactionProcess type = new RadicalChargeSiteInitiationReaction();\n\n        IAtomContainerSet setOfReactants = getExampleReactants();\n\n        /* initiate */\n\n        List<IParameterReact> paramList = new ArrayList<IParameterReact>();\n        IParameterReact param = new SetReactionCenter();\n        param.setParameter(Boolean.FALSE);\n        paramList.add(param);\n        type.setParameterList(paramList);\n        IReactionSet setOfReactions = type.initiate(setOfReactants, null);\n\n        Assert.assertEquals(1, setOfReactions.getReactionCount());\n        Assert.assertEquals(2, setOfReactions.getReaction(0).getProductCount());\n\n        IAtomContainer product1 = setOfReactions.getReaction(0).getProducts().getAtomContainer(0);\n\n        IAtomContainer molecule1 = getExpectedProducts().getAtomContainer(0);\n\n        assertEquals(molecule1, product1);\n\n        IAtomContainer product2 = setOfReactions.getReaction(0).getProducts().getAtomContainer(1);\n\n        IAtomContainer molecule2 = getExpectedProducts().getAtomContainer(1);\n\n        assertEquals(molecule2, product2);\n    }", "signature": "void testInitiate_IAtomContainerSet_IAtomContainerSet()", "full_signature": "@Test @Override public void testInitiate_IAtomContainerSet_IAtomContainerSet()", "class_method_signature": "RadicalChargeSiteInitiationReactionTest.testInitiate_IAtomContainerSet_IAtomContainerSet()", "testcase": true, "constructor": false, "invocations": ["getExampleReactants", "setParameter", "add", "setParameterList", "initiate", "assertEquals", "getReactionCount", "assertEquals", "getProductCount", "getReaction", "getAtomContainer", "getProducts", "getReaction", "getAtomContainer", "getExpectedProducts", "assertEquals", "getAtomContainer", "getProducts", "getReaction", "getAtomContainer", "getExpectedProducts", "assertEquals"]}, "focal_class": {"identifier": "RadicalChargeSiteInitiationReaction", "superclass": "extends ReactionEngine", "interfaces": "implements IReactionProcess", "fields": [{"original_string": "private static ILoggingTool logger = LoggingToolFactory\n                                               .createLoggingTool(RadicalChargeSiteInitiationReaction.class);", "modifier": "private static", "type": "ILoggingTool", "declarator": "logger = LoggingToolFactory\n                                               .createLoggingTool(RadicalChargeSiteInitiationReaction.class)", "var_name": "logger"}], "methods": [{"identifier": "RadicalChargeSiteInitiationReaction", "parameters": "()", "modifiers": "public", "return": "", "signature": " RadicalChargeSiteInitiationReaction()", "full_signature": "public  RadicalChargeSiteInitiationReaction()", "class_method_signature": "RadicalChargeSiteInitiationReaction.RadicalChargeSiteInitiationReaction()", "testcase": false, "constructor": true}, {"identifier": "getSpecification", "parameters": "()", "modifiers": "@Override public", "return": "ReactionSpecification", "signature": "ReactionSpecification getSpecification()", "full_signature": "@Override public ReactionSpecification getSpecification()", "class_method_signature": "RadicalChargeSiteInitiationReaction.getSpecification()", "testcase": false, "constructor": false}, {"identifier": "initiate", "parameters": "(IAtomContainerSet reactants, IAtomContainerSet agents)", "modifiers": "@Override public", "return": "IReactionSet", "signature": "IReactionSet initiate(IAtomContainerSet reactants, IAtomContainerSet agents)", "full_signature": "@Override public IReactionSet initiate(IAtomContainerSet reactants, IAtomContainerSet agents)", "class_method_signature": "RadicalChargeSiteInitiationReaction.initiate(IAtomContainerSet reactants, IAtomContainerSet agents)", "testcase": false, "constructor": false}, {"identifier": "setActiveCenters", "parameters": "(IAtomContainer reactant)", "modifiers": "private", "return": "void", "signature": "void setActiveCenters(IAtomContainer reactant)", "full_signature": "private void setActiveCenters(IAtomContainer reactant)", "class_method_signature": "RadicalChargeSiteInitiationReaction.setActiveCenters(IAtomContainer reactant)", "testcase": false, "constructor": false}], "file": "base/reaction/src/main/java/org/openscience/cdk/reaction/type/RadicalChargeSiteInitiationReaction.java"}, "focal_method": {"identifier": "initiate", "parameters": "(IAtomContainerSet reactants, IAtomContainerSet agents)", "modifiers": "@Override public", "return": "IReactionSet", "body": "@Override\n    public IReactionSet initiate(IAtomContainerSet reactants, IAtomContainerSet agents) throws CDKException {\n        logger.debug(\"initiate reaction: RadicalChargeSiteInitiationReaction\");\n\n        if (reactants.getAtomContainerCount() != 1) {\n            throw new CDKException(\"RadicalChargeSiteInitiationReaction only expects one reactant\");\n        }\n        if (agents != null) {\n            throw new CDKException(\"RadicalChargeSiteInitiationReaction don't expects agents\");\n        }\n\n        IReactionSet setOfReactions = reactants.getBuilder().newInstance(IReactionSet.class);\n        IAtomContainer reactant = reactants.getAtomContainer(0);\n\n        /*\n         * if the parameter hasActiveCenter is not fixed yet, set the active\n         * centers\n         */\n        IParameterReact ipr = super.getParameterClass(SetReactionCenter.class);\n        if (ipr != null && !ipr.isSetParameter()) setActiveCenters(reactant);\n\n        Iterator<IAtom> atoms = reactants.getAtomContainer(0).atoms().iterator();\n        while (atoms.hasNext()) {\n            IAtom atomi = atoms.next();\n            if (atomi.getFlag(CDKConstants.REACTIVE_CENTER) && reactant.getConnectedSingleElectronsCount(atomi) == 1\n                    && atomi.getFormalCharge() == 1) {\n\n                Iterator<IBond> bondis = reactant.getConnectedBondsList(atomi).iterator();\n\n                while (bondis.hasNext()) {\n                    IBond bondi = bondis.next();\n\n                    if (bondi.getFlag(CDKConstants.REACTIVE_CENTER) && bondi.getOrder() == IBond.Order.SINGLE) {\n\n                        IAtom atomj = bondi.getOther(atomi);\n                        if (atomj.getFlag(CDKConstants.REACTIVE_CENTER) && atomj.getFormalCharge() == 0) {\n\n                            Iterator<IBond> bondjs = reactant.getConnectedBondsList(atomj).iterator();\n                            while (bondjs.hasNext()) {\n                                IBond bondj = bondjs.next();\n\n                                if (bondj.equals(bondi)) continue;\n\n                                if (bondj.getFlag(CDKConstants.REACTIVE_CENTER)\n                                        && bondj.getOrder() == IBond.Order.SINGLE) {\n\n                                    IAtom atomk = bondj.getOther(atomj);\n                                    if (atomk.getFlag(CDKConstants.REACTIVE_CENTER) && atomk.getSymbol().equals(\"C\")\n                                            && atomk.getFormalCharge() == 0) {\n\n                                        ArrayList<IAtom> atomList = new ArrayList<IAtom>();\n                                        atomList.add(atomi);\n                                        atomList.add(atomj);\n                                        atomList.add(atomk);\n                                        ArrayList<IBond> bondList = new ArrayList<IBond>();\n                                        bondList.add(bondi);\n                                        bondList.add(bondj);\n\n                                        IAtomContainerSet moleculeSet = reactant.getBuilder().newInstance(\n                                                IAtomContainerSet.class);\n                                        moleculeSet.addAtomContainer(reactant);\n                                        IReaction reaction = mechanism.initiate(moleculeSet, atomList, bondList);\n                                        if (reaction == null)\n                                            continue;\n                                        else\n                                            setOfReactions.addReaction(reaction);\n\n                                    }\n                                }\n                            }\n                        }\n                    }\n                }\n            }\n        }\n        return setOfReactions;\n\n    }", "signature": "IReactionSet initiate(IAtomContainerSet reactants, IAtomContainerSet agents)", "full_signature": "@Override public IReactionSet initiate(IAtomContainerSet reactants, IAtomContainerSet agents)", "class_method_signature": "RadicalChargeSiteInitiationReaction.initiate(IAtomContainerSet reactants, IAtomContainerSet agents)", "testcase": false, "constructor": false, "invocations": ["debug", "getAtomContainerCount", "newInstance", "getBuilder", "getAtomContainer", "getParameterClass", "isSetParameter", "setActiveCenters", "iterator", "atoms", "getAtomContainer", "hasNext", "next", "getFlag", "getConnectedSingleElectronsCount", "getFormalCharge", "iterator", "getConnectedBondsList", "hasNext", "next", "getFlag", "getOrder", "getOther", "getFlag", "getFormalCharge", "iterator", "getConnectedBondsList", "hasNext", "next", "equals", "getFlag", "getOrder", "getOther", "getFlag", "equals", "getSymbol", "getFormalCharge", "add", "add", "add", "add", "add", "newInstance", "getBuilder", "addAtomContainer", "initiate", "addReaction"]}, "repository": {"repo_id": 660443, "url": "https://github.com/cdk/cdk", "stars": 220, "created": "5/11/2010 8:30:07 AM +00:00", "updates": "2020-01-27T19:04:04+00:00", "fork": "False", "license": "licensed"}}