{"test_class": {"identifier": "IsotopePatternManipulatorTest", "superclass": "extends CDKTestCase", "interfaces": "", "fields": [], "file": "tool/formula/src/test/java/org/openscience/cdk/formula/IsotopePatternManipulatorTest.java"}, "test_case": {"identifier": "testSortByMass_IsotopePattern", "parameters": "()", "modifiers": "@Test public", "return": "void", "body": "@Test\n    public void testSortByMass_IsotopePattern() {\n        IsotopePattern spExp = new IsotopePattern();\n        spExp.addIsotope(new IsotopeContainer(157.07503, 0.0002));\n        spExp.setMonoIsotope(new IsotopeContainer(156.07770, 2));\n        spExp.addIsotope(new IsotopeContainer(158.08135, 0.004));\n        spExp.addIsotope(new IsotopeContainer(157.08059, 0.0006));\n        spExp.setCharge(1);\n\n        IsotopePattern isoNorma = IsotopePatternManipulator.sortByMass(spExp);\n        List<IsotopeContainer> listISO = isoNorma.getIsotopes();\n        Assert.assertEquals(156.07770, isoNorma.getMonoIsotope().getMass(), 0.001);\n        Assert.assertEquals(156.07770, listISO.get(0).getMass(), 0.00001);\n        Assert.assertEquals(157.07503, listISO.get(1).getMass(), 0.00001);\n        Assert.assertEquals(157.08059, listISO.get(2).getMass(), 0.00001);\n        Assert.assertEquals(158.08135, listISO.get(3).getMass(), 0.00001);\n\n        Assert.assertEquals(2, isoNorma.getMonoIsotope().getIntensity(), 0.001);\n        Assert.assertEquals(2, listISO.get(0).getIntensity(), 0.001);\n        Assert.assertEquals(0.0002, listISO.get(1).getIntensity(), 0.00001);\n        Assert.assertEquals(0.0006, listISO.get(2).getIntensity(), 0.00001);\n        Assert.assertEquals(0.004, listISO.get(3).getIntensity(), 0.00001);\n\n        Assert.assertEquals(1, isoNorma.getCharge(), 0.001);\n    }", "signature": "void testSortByMass_IsotopePattern()", "full_signature": "@Test public void testSortByMass_IsotopePattern()", "class_method_signature": "IsotopePatternManipulatorTest.testSortByMass_IsotopePattern()", "testcase": true, "constructor": false, "invocations": ["addIsotope", "setMonoIsotope", "addIsotope", "addIsotope", "setCharge", "sortByMass", "getIsotopes", "assertEquals", "getMass", "getMonoIsotope", "assertEquals", "getMass", "get", "assertEquals", "getMass", "get", "assertEquals", "getMass", "get", "assertEquals", "getMass", "get", "assertEquals", "getIntensity", "getMonoIsotope", "assertEquals", "getIntensity", "get", "assertEquals", "getIntensity", "get", "assertEquals", "getIntensity", "get", "assertEquals", "getIntensity", "get", "assertEquals", "getCharge"]}, "focal_class": {"identifier": "IsotopePatternManipulator", "superclass": "", "interfaces": "", "fields": [], "methods": [{"identifier": "normalize", "parameters": "(IsotopePattern isotopeP)", "modifiers": "public static", "return": "IsotopePattern", "signature": "IsotopePattern normalize(IsotopePattern isotopeP)", "full_signature": "public static IsotopePattern normalize(IsotopePattern isotopeP)", "class_method_signature": "IsotopePatternManipulator.normalize(IsotopePattern isotopeP)", "testcase": false, "constructor": false}, {"identifier": "sortAndNormalizedByIntensity", "parameters": "(IsotopePattern isotopeP)", "modifiers": "public static", "return": "IsotopePattern", "signature": "IsotopePattern sortAndNormalizedByIntensity(IsotopePattern isotopeP)", "full_signature": "public static IsotopePattern sortAndNormalizedByIntensity(IsotopePattern isotopeP)", "class_method_signature": "IsotopePatternManipulator.sortAndNormalizedByIntensity(IsotopePattern isotopeP)", "testcase": false, "constructor": false}, {"identifier": "sortByIntensity", "parameters": "(IsotopePattern isotopeP)", "modifiers": "public static", "return": "IsotopePattern", "signature": "IsotopePattern sortByIntensity(IsotopePattern isotopeP)", "full_signature": "public static IsotopePattern sortByIntensity(IsotopePattern isotopeP)", "class_method_signature": "IsotopePatternManipulator.sortByIntensity(IsotopePattern isotopeP)", "testcase": false, "constructor": false}, {"identifier": "sortByMass", "parameters": "(IsotopePattern isotopeP)", "modifiers": "public static", "return": "IsotopePattern", "signature": "IsotopePattern sortByMass(IsotopePattern isotopeP)", "full_signature": "public static IsotopePattern sortByMass(IsotopePattern isotopeP)", "class_method_signature": "IsotopePatternManipulator.sortByMass(IsotopePattern isotopeP)", "testcase": false, "constructor": false}], "file": "tool/formula/src/main/java/org/openscience/cdk/formula/IsotopePatternManipulator.java"}, "focal_method": {"identifier": "sortByMass", "parameters": "(IsotopePattern isotopeP)", "modifiers": "public static", "return": "IsotopePattern", "body": "public static IsotopePattern sortByMass(IsotopePattern isotopeP) {\n        try {\n            IsotopePattern isoSort = (IsotopePattern) isotopeP.clone();\n            \n            // Do nothing for empty isotope pattern\n            if (isoSort.getNumberOfIsotopes() == 0) \n                return isoSort;\n\n            // Sort the isotopes\n            List<IsotopeContainer> listISO = isoSort.getIsotopes();\n            Collections.sort(listISO, new Comparator<IsotopeContainer>() {\n                @Override\n                public int compare(IsotopeContainer o1, IsotopeContainer o2) {\n                    return Double.compare(o1.getMass(),o2.getMass());\n                }\n            });\n           \n            // Set the monoisotopic peak to the one with lowest mass\n            isoSort.setMonoIsotope(listISO.get(0));\n            \n            return isoSort;\n\n        } catch (CloneNotSupportedException e) {\n            e.printStackTrace();\n        }\n\n        return null;\n    }", "signature": "IsotopePattern sortByMass(IsotopePattern isotopeP)", "full_signature": "public static IsotopePattern sortByMass(IsotopePattern isotopeP)", "class_method_signature": "IsotopePatternManipulator.sortByMass(IsotopePattern isotopeP)", "testcase": false, "constructor": false, "invocations": ["clone", "getNumberOfIsotopes", "getIsotopes", "sort", "compare", "getMass", "getMass", "setMonoIsotope", "get", "printStackTrace"]}, "repository": {"repo_id": 660443, "url": "https://github.com/cdk/cdk", "stars": 220, "created": "5/11/2010 8:30:07 AM +00:00", "updates": "2020-01-27T19:04:04+00:00", "fork": "False", "license": "licensed"}}