{"test_class": {"identifier": "RadicalSiteInitiationHReactionTest", "superclass": "extends ReactionProcessTest", "interfaces": "", "fields": [{"original_string": "private IChemObjectBuilder builder = SilentChemObjectBuilder.getInstance();", "modifier": "private", "type": "IChemObjectBuilder", "declarator": "builder = SilentChemObjectBuilder.getInstance()", "var_name": "builder"}], "file": "base/reaction/src/test/java/org/openscience/cdk/reaction/type/RadicalSiteInitiationHReactionTest.java"}, "test_case": {"identifier": "testCDKConstants_REACTIVE_CENTER", "parameters": "()", "modifiers": "@Test public", "return": "void", "body": "@Test\n    public void testCDKConstants_REACTIVE_CENTER() throws Exception {\n        IReactionProcess type = new RadicalSiteInitiationHReaction();\n        IAtomContainerSet setOfReactants = getExampleReactants();\n        IAtomContainer molecule = setOfReactants.getAtomContainer(0);\n\n        /* initiate */\n        makeSureAtomTypesAreRecognized(molecule);\n\n        /* manually put the reactive center */\n        molecule.getAtom(0).setFlag(CDKConstants.REACTIVE_CENTER, true);\n        molecule.getAtom(3).setFlag(CDKConstants.REACTIVE_CENTER, true);\n        molecule.getAtom(4).setFlag(CDKConstants.REACTIVE_CENTER, true);\n        molecule.getBond(2).setFlag(CDKConstants.REACTIVE_CENTER, true);\n        molecule.getBond(3).setFlag(CDKConstants.REACTIVE_CENTER, true);\n\n        List<IParameterReact> paramList = new ArrayList<IParameterReact>();\n        IParameterReact param = new SetReactionCenter();\n        param.setParameter(Boolean.TRUE);\n        paramList.add(param);\n        type.setParameterList(paramList);\n        IReactionSet setOfReactions = type.initiate(setOfReactants, null);\n\n        IAtomContainer reactant = setOfReactions.getReaction(0).getReactants().getAtomContainer(0);\n        Assert.assertTrue(molecule.getAtom(0).getFlag(CDKConstants.REACTIVE_CENTER));\n        Assert.assertTrue(reactant.getAtom(0).getFlag(CDKConstants.REACTIVE_CENTER));\n        Assert.assertTrue(molecule.getAtom(3).getFlag(CDKConstants.REACTIVE_CENTER));\n        Assert.assertTrue(reactant.getAtom(3).getFlag(CDKConstants.REACTIVE_CENTER));\n        Assert.assertTrue(molecule.getAtom(4).getFlag(CDKConstants.REACTIVE_CENTER));\n        Assert.assertTrue(reactant.getAtom(4).getFlag(CDKConstants.REACTIVE_CENTER));\n        Assert.assertTrue(molecule.getBond(2).getFlag(CDKConstants.REACTIVE_CENTER));\n        Assert.assertTrue(reactant.getBond(2).getFlag(CDKConstants.REACTIVE_CENTER));\n        Assert.assertTrue(molecule.getBond(3).getFlag(CDKConstants.REACTIVE_CENTER));\n        Assert.assertTrue(reactant.getBond(3).getFlag(CDKConstants.REACTIVE_CENTER));\n    }", "signature": "void testCDKConstants_REACTIVE_CENTER()", "full_signature": "@Test public void testCDKConstants_REACTIVE_CENTER()", "class_method_signature": "RadicalSiteInitiationHReactionTest.testCDKConstants_REACTIVE_CENTER()", "testcase": true, "constructor": false, "invocations": ["getExampleReactants", "getAtomContainer", "makeSureAtomTypesAreRecognized", "setFlag", "getAtom", "setFlag", "getAtom", "setFlag", "getAtom", "setFlag", "getBond", "setFlag", "getBond", "setParameter", "add", "setParameterList", "initiate", "getAtomContainer", "getReactants", "getReaction", "assertTrue", "getFlag", "getAtom", "assertTrue", "getFlag", "getAtom", "assertTrue", "getFlag", "getAtom", "assertTrue", "getFlag", "getAtom", "assertTrue", "getFlag", "getAtom", "assertTrue", "getFlag", "getAtom", "assertTrue", "getFlag", "getBond", "assertTrue", "getFlag", "getBond", "assertTrue", "getFlag", "getBond", "assertTrue", "getFlag", "getBond"]}, "focal_class": {"identifier": "RadicalSiteInitiationHReaction", "superclass": "extends ReactionEngine", "interfaces": "implements IReactionProcess", "fields": [{"original_string": "private static ILoggingTool logger = LoggingToolFactory.createLoggingTool(RadicalSiteInitiationHReaction.class);", "modifier": "private static", "type": "ILoggingTool", "declarator": "logger = LoggingToolFactory.createLoggingTool(RadicalSiteInitiationHReaction.class)", "var_name": "logger"}], "methods": [{"identifier": "RadicalSiteInitiationHReaction", "parameters": "()", "modifiers": "public", "return": "", "signature": " RadicalSiteInitiationHReaction()", "full_signature": "public  RadicalSiteInitiationHReaction()", "class_method_signature": "RadicalSiteInitiationHReaction.RadicalSiteInitiationHReaction()", "testcase": false, "constructor": true}, {"identifier": "getSpecification", "parameters": "()", "modifiers": "@Override public", "return": "ReactionSpecification", "signature": "ReactionSpecification getSpecification()", "full_signature": "@Override public ReactionSpecification getSpecification()", "class_method_signature": "RadicalSiteInitiationHReaction.getSpecification()", "testcase": false, "constructor": false}, {"identifier": "initiate", "parameters": "(IAtomContainerSet reactants, IAtomContainerSet agents)", "modifiers": "@Override public", "return": "IReactionSet", "signature": "IReactionSet initiate(IAtomContainerSet reactants, IAtomContainerSet agents)", "full_signature": "@Override public IReactionSet initiate(IAtomContainerSet reactants, IAtomContainerSet agents)", "class_method_signature": "RadicalSiteInitiationHReaction.initiate(IAtomContainerSet reactants, IAtomContainerSet agents)", "testcase": false, "constructor": false}, {"identifier": "setActiveCenters", "parameters": "(IAtomContainer reactant)", "modifiers": "private", "return": "void", "signature": "void setActiveCenters(IAtomContainer reactant)", "full_signature": "private void setActiveCenters(IAtomContainer reactant)", "class_method_signature": "RadicalSiteInitiationHReaction.setActiveCenters(IAtomContainer reactant)", "testcase": false, "constructor": false}], "file": "base/reaction/src/main/java/org/openscience/cdk/reaction/type/RadicalSiteInitiationHReaction.java"}, "focal_method": {"identifier": "initiate", "parameters": "(IAtomContainerSet reactants, IAtomContainerSet agents)", "modifiers": "@Override public", "return": "IReactionSet", "body": "@Override\n    public IReactionSet initiate(IAtomContainerSet reactants, IAtomContainerSet agents) throws CDKException {\n        logger.debug(\"initiate reaction: RadicalSiteInitiationHReaction\");\n\n        if (reactants.getAtomContainerCount() != 1) {\n            throw new CDKException(\"RadicalSiteInitiationHReaction only expects one reactant\");\n        }\n        if (agents != null) {\n            throw new CDKException(\"RadicalSiteInitiationHReaction don't expects agents\");\n        }\n\n        IReactionSet setOfReactions = reactants.getBuilder().newInstance(IReactionSet.class);\n        IAtomContainer reactant = reactants.getAtomContainer(0);\n\n        /*\n         * if the parameter hasActiveCenter is not fixed yet, set the active\n         * centers\n         */\n        IParameterReact ipr = super.getParameterClass(SetReactionCenter.class);\n        if (ipr != null && !ipr.isSetParameter()) setActiveCenters(reactant);\n\n        Iterator<IAtom> atoms = reactants.getAtomContainer(0).atoms().iterator();\n        while (atoms.hasNext()) {\n            IAtom atomi = atoms.next();\n            if (atomi.getFlag(CDKConstants.REACTIVE_CENTER) && reactant.getConnectedSingleElectronsCount(atomi) == 1\n                    && atomi.getFormalCharge() == 0) {\n\n                Iterator<IBond> bondis = reactant.getConnectedBondsList(atomi).iterator();\n\n                while (bondis.hasNext()) {\n                    IBond bondi = bondis.next();\n\n                    if (bondi.getFlag(CDKConstants.REACTIVE_CENTER) && bondi.getOrder() == IBond.Order.SINGLE) {\n\n                        IAtom atomj = bondi.getOther(atomi);\n                        if (atomj.getFlag(CDKConstants.REACTIVE_CENTER) && atomj.getFormalCharge() == 0) {\n\n                            Iterator<IBond> bondjs = reactant.getConnectedBondsList(atomj).iterator();\n                            while (bondjs.hasNext()) {\n                                IBond bondj = bondjs.next();\n\n                                if (bondj.equals(bondi)) continue;\n\n                                if (bondj.getFlag(CDKConstants.REACTIVE_CENTER)\n                                        && bondj.getOrder() == IBond.Order.SINGLE) {\n\n                                    IAtom atomk = bondj.getOther(atomj);\n                                    if (atomk.getFlag(CDKConstants.REACTIVE_CENTER) && atomk.getSymbol().equals(\"H\")\n                                            && atomk.getFormalCharge() == 0) {\n\n                                        ArrayList<IAtom> atomList = new ArrayList<IAtom>();\n                                        atomList.add(atomi);\n                                        atomList.add(atomj);\n                                        atomList.add(atomk);\n                                        ArrayList<IBond> bondList = new ArrayList<IBond>();\n                                        bondList.add(bondi);\n                                        bondList.add(bondj);\n\n                                        IAtomContainerSet moleculeSet = reactant.getBuilder().newInstance(\n                                                IAtomContainerSet.class);\n                                        moleculeSet.addAtomContainer(reactant);\n                                        IReaction reaction = mechanism.initiate(moleculeSet, atomList, bondList);\n                                        if (reaction == null)\n                                            continue;\n                                        else\n                                            setOfReactions.addReaction(reaction);\n                                    }\n                                }\n                            }\n                        }\n                    }\n                }\n            }\n        }\n        return setOfReactions;\n    }", "signature": "IReactionSet initiate(IAtomContainerSet reactants, IAtomContainerSet agents)", "full_signature": "@Override public IReactionSet initiate(IAtomContainerSet reactants, IAtomContainerSet agents)", "class_method_signature": "RadicalSiteInitiationHReaction.initiate(IAtomContainerSet reactants, IAtomContainerSet agents)", "testcase": false, "constructor": false, "invocations": ["debug", "getAtomContainerCount", "newInstance", "getBuilder", "getAtomContainer", "getParameterClass", "isSetParameter", "setActiveCenters", "iterator", "atoms", "getAtomContainer", "hasNext", "next", "getFlag", "getConnectedSingleElectronsCount", "getFormalCharge", "iterator", "getConnectedBondsList", "hasNext", "next", "getFlag", "getOrder", "getOther", "getFlag", "getFormalCharge", "iterator", "getConnectedBondsList", "hasNext", "next", "equals", "getFlag", "getOrder", "getOther", "getFlag", "equals", "getSymbol", "getFormalCharge", "add", "add", "add", "add", "add", "newInstance", "getBuilder", "addAtomContainer", "initiate", "addReaction"]}, "repository": {"repo_id": 660443, "url": "https://github.com/cdk/cdk", "stars": 220, "created": "5/11/2010 8:30:07 AM +00:00", "updates": "2020-01-27T19:04:04+00:00", "fork": "False", "license": "licensed"}}