{"test_class": {"identifier": "ClientConnectionServiceTest", "superclass": "", "interfaces": "", "fields": [{"original_string": "@InjectMocks\n    private ClientConnectionService clientConnectionService;", "modifier": "@InjectMocks\n    private", "type": "ClientConnectionService", "declarator": "clientConnectionService", "var_name": "clientConnectionService"}, {"original_string": "@Spy\n    private ClientConnectionCache connectionCache;", "modifier": "@Spy\n    private", "type": "ClientConnectionCache", "declarator": "connectionCache", "var_name": "connectionCache"}, {"original_string": "@Mock\n    private Client iec60870Client;", "modifier": "@Mock\n    private", "type": "Client", "declarator": "iec60870Client", "var_name": "iec60870Client"}, {"original_string": "@Mock\n    private Iec60870DeviceRepository iec60870DeviceRepository;", "modifier": "@Mock\n    private", "type": "Iec60870DeviceRepository", "declarator": "iec60870DeviceRepository", "var_name": "iec60870DeviceRepository"}, {"original_string": "@Mock\n    private ClientAsduHandlerRegistry clientAsduHandlerRegistry;", "modifier": "@Mock\n    private", "type": "ClientAsduHandlerRegistry", "declarator": "clientAsduHandlerRegistry", "var_name": "clientAsduHandlerRegistry"}], "file": "osgp/protocol-adapter-iec60870/osgp-protocol-adapter-iec60870/src/test/java/org/opensmartgridplatform/adapter/protocol/iec60870/domain/services/ClientConnectionServiceTest.java"}, "test_case": {"identifier": "testGetConnectionShouldReturnExistingConnectionToGatewayDeviceWhenInCache", "parameters": "()", "modifiers": "@Test", "return": "void", "body": "@Test\n    void testGetConnectionShouldReturnExistingConnectionToGatewayDeviceWhenInCache() throws Exception {\n        // Arrange\n        final String deviceIdentification = \"LM_DVC_1\";\n        final String gatewayDeviceIdentification = \"LM_GATEWAY_1\";\n        final Iec60870Device device = Iec60870DeviceFactory.createLightMeasurementDevice(deviceIdentification,\n                gatewayDeviceIdentification);\n        when(this.iec60870DeviceRepository.findByDeviceIdentification(deviceIdentification))\n                .thenReturn(Optional.of(device));\n\n        final RequestMetadata requestMetadata = RequestMetadataFactory.forDevice(deviceIdentification);\n\n        final ClientConnection expectedConnection = ClientConnectionFactory.forDevice(gatewayDeviceIdentification);\n        this.connectionCache.addConnection(gatewayDeviceIdentification, expectedConnection);\n\n        // Act\n        final ClientConnection actualConnection = this.clientConnectionService.getConnection(requestMetadata);\n\n        // Assert\n        assertThat(actualConnection).isEqualTo(expectedConnection);\n    }", "signature": "void testGetConnectionShouldReturnExistingConnectionToGatewayDeviceWhenInCache()", "full_signature": "@Test void testGetConnectionShouldReturnExistingConnectionToGatewayDeviceWhenInCache()", "class_method_signature": "ClientConnectionServiceTest.testGetConnectionShouldReturnExistingConnectionToGatewayDeviceWhenInCache()", "testcase": true, "constructor": false, "invocations": ["createLightMeasurementDevice", "thenReturn", "when", "findByDeviceIdentification", "of", "forDevice", "forDevice", "addConnection", "getConnection", "isEqualTo", "assertThat"]}, "focal_class": {"identifier": "ClientConnectionService", "superclass": "", "interfaces": "", "fields": [{"original_string": "private static final Logger LOGGER = LoggerFactory.getLogger(ClientConnectionService.class);", "modifier": "private static final", "type": "Logger", "declarator": "LOGGER = LoggerFactory.getLogger(ClientConnectionService.class)", "var_name": "LOGGER"}, {"original_string": "@Autowired\n    private ClientConnectionCache connectionCache;", "modifier": "@Autowired\n    private", "type": "ClientConnectionCache", "declarator": "connectionCache", "var_name": "connectionCache"}, {"original_string": "@Autowired\n    private Client iec60870Client;", "modifier": "@Autowired\n    private", "type": "Client", "declarator": "iec60870Client", "var_name": "iec60870Client"}, {"original_string": "@Autowired\n    private Iec60870DeviceRepository iec60870DeviceRepository;", "modifier": "@Autowired\n    private", "type": "Iec60870DeviceRepository", "declarator": "iec60870DeviceRepository", "var_name": "iec60870DeviceRepository"}, {"original_string": "@Autowired\n    private ClientAsduHandlerRegistry clientAsduHandlerRegistry;", "modifier": "@Autowired\n    private", "type": "ClientAsduHandlerRegistry", "declarator": "clientAsduHandlerRegistry", "var_name": "clientAsduHandlerRegistry"}], "methods": [{"identifier": "getConnection", "parameters": "(final RequestMetadata requestMetadata)", "modifiers": "public", "return": "ClientConnection", "signature": "ClientConnection getConnection(final RequestMetadata requestMetadata)", "full_signature": "public ClientConnection getConnection(final RequestMetadata requestMetadata)", "class_method_signature": "ClientConnectionService.getConnection(final RequestMetadata requestMetadata)", "testcase": false, "constructor": false}, {"identifier": "closeConnection", "parameters": "(final String deviceIdentification)", "modifiers": "public", "return": "void", "signature": "void closeConnection(final String deviceIdentification)", "full_signature": "public void closeConnection(final String deviceIdentification)", "class_method_signature": "ClientConnectionService.closeConnection(final String deviceIdentification)", "testcase": false, "constructor": false}, {"identifier": "close", "parameters": "(final ClientConnection connection)", "modifiers": "public synchronized", "return": "void", "signature": "void close(final ClientConnection connection)", "full_signature": "public synchronized void close(final ClientConnection connection)", "class_method_signature": "ClientConnectionService.close(final ClientConnection connection)", "testcase": false, "constructor": false}, {"identifier": "closeAllConnections", "parameters": "()", "modifiers": "@PreDestroy public", "return": "void", "signature": "void closeAllConnections()", "full_signature": "@PreDestroy public void closeAllConnections()", "class_method_signature": "ClientConnectionService.closeAllConnections()", "testcase": false, "constructor": false}, {"identifier": "createConnection", "parameters": "(final RequestMetadata requestMetadata)", "modifiers": "private", "return": "ClientConnection", "signature": "ClientConnection createConnection(final RequestMetadata requestMetadata)", "full_signature": "private ClientConnection createConnection(final RequestMetadata requestMetadata)", "class_method_signature": "ClientConnectionService.createConnection(final RequestMetadata requestMetadata)", "testcase": false, "constructor": false}, {"identifier": "createConnectionParameters", "parameters": "(final Iec60870Device device, final String ipAddress)", "modifiers": "private", "return": "ConnectionParameters", "signature": "ConnectionParameters createConnectionParameters(final Iec60870Device device, final String ipAddress)", "full_signature": "private ConnectionParameters createConnectionParameters(final Iec60870Device device, final String ipAddress)", "class_method_signature": "ClientConnectionService.createConnectionParameters(final Iec60870Device device, final String ipAddress)", "testcase": false, "constructor": false}, {"identifier": "getConnectionDeviceIdentification", "parameters": "(final Iec60870Device device)", "modifiers": "private", "return": "String", "signature": "String getConnectionDeviceIdentification(final Iec60870Device device)", "full_signature": "private String getConnectionDeviceIdentification(final Iec60870Device device)", "class_method_signature": "ClientConnectionService.getConnectionDeviceIdentification(final Iec60870Device device)", "testcase": false, "constructor": false}, {"identifier": "getConnectionDevice", "parameters": "(final Iec60870Device device)", "modifiers": "private", "return": "Iec60870Device", "signature": "Iec60870Device getConnectionDevice(final Iec60870Device device)", "full_signature": "private Iec60870Device getConnectionDevice(final Iec60870Device device)", "class_method_signature": "ClientConnectionService.getConnectionDevice(final Iec60870Device device)", "testcase": false, "constructor": false}, {"identifier": "getIec60870Device", "parameters": "(final String deviceIdentification)", "modifiers": "private", "return": "Iec60870Device", "signature": "Iec60870Device getIec60870Device(final String deviceIdentification)", "full_signature": "private Iec60870Device getIec60870Device(final String deviceIdentification)", "class_method_signature": "ClientConnectionService.getIec60870Device(final String deviceIdentification)", "testcase": false, "constructor": false}, {"identifier": "connectionFailureException", "parameters": "(final String deviceIdentification)", "modifiers": "private", "return": "Supplier<ConnectionFailureException>", "signature": "Supplier<ConnectionFailureException> connectionFailureException(final String deviceIdentification)", "full_signature": "private Supplier<ConnectionFailureException> connectionFailureException(final String deviceIdentification)", "class_method_signature": "ClientConnectionService.connectionFailureException(final String deviceIdentification)", "testcase": false, "constructor": false}], "file": "osgp/protocol-adapter-iec60870/osgp-protocol-adapter-iec60870/src/main/java/org/opensmartgridplatform/adapter/protocol/iec60870/domain/services/ClientConnectionService.java"}, "focal_method": {"identifier": "getConnection", "parameters": "(final RequestMetadata requestMetadata)", "modifiers": "public", "return": "ClientConnection", "body": "public ClientConnection getConnection(final RequestMetadata requestMetadata) throws ConnectionFailureException {\n        final String deviceIdentification = requestMetadata.getDeviceIdentification();\n        LOGGER.debug(\"Get connection called for device {}.\", deviceIdentification);\n\n        final Iec60870Device device = this.getIec60870Device(deviceIdentification);\n        final String connectionDeviceIdentification = this.getConnectionDeviceIdentification(device);\n\n        if (device.hasGatewayDevice()) {\n            LOGGER.debug(\"Getting connection for device {} using gateway device {}.\", deviceIdentification,\n                    connectionDeviceIdentification);\n        }\n\n        final ClientConnection cachedDeviceConnection = this.connectionCache\n                .getConnection(connectionDeviceIdentification);\n\n        if (cachedDeviceConnection != null) {\n            LOGGER.info(\"Connection found in cache for device {}.\", connectionDeviceIdentification);\n            return cachedDeviceConnection;\n        } else {\n            LOGGER.info(\"No connection found in cache for device {}, creating new connection.\",\n                    connectionDeviceIdentification);\n            return this.createConnection(requestMetadata);\n        }\n    }", "signature": "ClientConnection getConnection(final RequestMetadata requestMetadata)", "full_signature": "public ClientConnection getConnection(final RequestMetadata requestMetadata)", "class_method_signature": "ClientConnectionService.getConnection(final RequestMetadata requestMetadata)", "testcase": false, "constructor": false, "invocations": ["getDeviceIdentification", "debug", "getIec60870Device", "getConnectionDeviceIdentification", "hasGatewayDevice", "debug", "getConnection", "info", "info", "createConnection"]}, "repository": {"repo_id": 154302277, "url": "https://github.com/OSGP/open-smart-grid-platform", "stars": 30, "created": "10/23/2018 9:41:12 AM +00:00", "updates": "2020-01-26T20:15:09+00:00", "fork": "False", "license": "licensed"}}