{"test_class": {"identifier": "MetatableTransformerTest", "superclass": "", "interfaces": "", "fields": [], "file": "storage-service/src/test/java/com/stnetix/ariaddna/persistence/transformers/MetatableTransformerTest.java"}, "test_case": {"identifier": "metafileDTOtoEntity", "parameters": "()", "modifiers": "@Test public", "return": "void", "body": "@Test\n    public void metafileDTOtoEntity() throws Exception {\n        MetatableTransformer metatableTransformer = new MetatableTransformer();\n\n        MetatableDTO metatableDTO = TestHelper\n                .getMetatableDTO(UUID.randomUUID().toString(), \"0.0.0\", MetatableType.MASTER,\n                        new DateTime().getTimeInMillisec());\n\n        MetatableEntity metatableEntity = metatableTransformer.metafileDTOtoEntity(metatableDTO);\n\n        assertEquals(metatableEntity.getType(), metatableDTO.getType());\n        assertEquals(metatableEntity.getVersion(), metatableDTO.getVersion());\n        assertEquals(metatableEntity.getUuid(), metatableDTO.getUuid());\n        assertEquals(metatableEntity.getLastUpdateTimestamp(),\n                metatableDTO.getLastUpdateTimestamp());\n\n        MetafileDTO[] metafileDTOs = new MetafileDTO[metatableDTO.getMetafileSet().size()];\n        metatableDTO.getMetafileSet().toArray(metafileDTOs);\n\n        MetafileEntity[] metafileEntities = new MetafileEntity[metatableEntity.getMetafileSet()\n                .size()];\n        metatableEntity.getMetafileSet().toArray(metafileEntities);\n\n        assertEquals(metafileDTOs.length, metafileEntities.length);\n\n        int countEquals = compareMetafileDTOAndEntitySet(metatableDTO.getMetafileSet(),\n                metatableEntity.getMetafileSet());\n        assertEquals(countEquals, metafileDTOs.length);\n    }", "signature": "void metafileDTOtoEntity()", "full_signature": "@Test public void metafileDTOtoEntity()", "class_method_signature": "MetatableTransformerTest.metafileDTOtoEntity()", "testcase": true, "constructor": false, "invocations": ["getMetatableDTO", "toString", "randomUUID", "getTimeInMillisec", "metafileDTOtoEntity", "assertEquals", "getType", "getType", "assertEquals", "getVersion", "getVersion", "assertEquals", "getUuid", "getUuid", "assertEquals", "getLastUpdateTimestamp", "getLastUpdateTimestamp", "size", "getMetafileSet", "toArray", "getMetafileSet", "size", "getMetafileSet", "toArray", "getMetafileSet", "assertEquals", "compareMetafileDTOAndEntitySet", "getMetafileSet", "getMetafileSet", "assertEquals"]}, "focal_class": {"identifier": "MetatableTransformer", "superclass": "", "interfaces": "", "fields": [{"original_string": "private MetafileTransformer metafileTransformer;", "modifier": "private", "type": "MetafileTransformer", "declarator": "metafileTransformer", "var_name": "metafileTransformer"}], "methods": [{"identifier": "MetatableTransformer", "parameters": "()", "modifiers": "public", "return": "", "signature": " MetatableTransformer()", "full_signature": "public  MetatableTransformer()", "class_method_signature": "MetatableTransformer.MetatableTransformer()", "testcase": false, "constructor": true}, {"identifier": "metafileEntityToDTO", "parameters": "(MetatableEntity metatableEntity)", "modifiers": "public", "return": "MetatableDTO", "signature": "MetatableDTO metafileEntityToDTO(MetatableEntity metatableEntity)", "full_signature": "public MetatableDTO metafileEntityToDTO(MetatableEntity metatableEntity)", "class_method_signature": "MetatableTransformer.metafileEntityToDTO(MetatableEntity metatableEntity)", "testcase": false, "constructor": false}, {"identifier": "metafileDTOtoEntity", "parameters": "(MetatableDTO metatableDTO)", "modifiers": "public", "return": "MetatableEntity", "signature": "MetatableEntity metafileDTOtoEntity(MetatableDTO metatableDTO)", "full_signature": "public MetatableEntity metafileDTOtoEntity(MetatableDTO metatableDTO)", "class_method_signature": "MetatableTransformer.metafileDTOtoEntity(MetatableDTO metatableDTO)", "testcase": false, "constructor": false}], "file": "storage-service/src/main/java/com/stnetix/ariaddna/persistence/transformers/MetatableTransformer.java"}, "focal_method": {"identifier": "metafileDTOtoEntity", "parameters": "(MetatableDTO metatableDTO)", "modifiers": "public", "return": "MetatableEntity", "body": "public MetatableEntity metafileDTOtoEntity(MetatableDTO metatableDTO) {\n        MetatableEntity metatableEntity = new MetatableEntity();\n\n        metatableEntity.setUuid(metatableDTO.getUuid() != null ? metatableDTO.getUuid() : null);\n        metatableEntity.setType(\n                metatableDTO.getType() != null ? metatableDTO.getType() : null);\n\n        Set<MetafileEntity> metafileEntitySet = new HashSet<>();\n        metatableDTO.getMetafileSet().forEach(metafileDTO -> metafileEntitySet\n                .add(metafileTransformer.metafileDTOtoEntity(metafileDTO)));\n        metatableEntity.setMetafileSet(metafileEntitySet);\n\n        metatableEntity.setLastUpdateTimestamp(metatableDTO.getLastUpdateTimestamp() != null ?\n                metatableDTO.getLastUpdateTimestamp() : null);\n        metatableEntity.setVersion(metatableDTO.getVersion() != null ? metatableDTO.getVersion() :\n                null);\n        return metatableEntity;\n    }", "signature": "MetatableEntity metafileDTOtoEntity(MetatableDTO metatableDTO)", "full_signature": "public MetatableEntity metafileDTOtoEntity(MetatableDTO metatableDTO)", "class_method_signature": "MetatableTransformer.metafileDTOtoEntity(MetatableDTO metatableDTO)", "testcase": false, "constructor": false, "invocations": ["setUuid", "getUuid", "getUuid", "setType", "getType", "getType", "forEach", "getMetafileSet", "add", "metafileDTOtoEntity", "setMetafileSet", "setLastUpdateTimestamp", "getLastUpdateTimestamp", "getLastUpdateTimestamp", "setVersion", "getVersion", "getVersion"]}, "repository": {"repo_id": 73354878, "url": "https://github.com/StnetixDevTeam/ariADDna", "language": "Java", "is_fork": false, "fork_count": 11, "stargazer_count": 11, "size": 971, "license": "licensed"}}