{"test_class": {"identifier": "AmountViewUtilsTest", "superclass": "", "interfaces": "", "fields": [], "file": "app/src/test/java/de/koelle/christian/trickytripper/modelutils/AmountViewUtilsTest.java"}, "test_case": {"identifier": "testGetAmountStringFraction", "parameters": "()", "modifiers": "@Test public", "return": "void", "body": "@Test\n    public void testGetAmountStringFraction() {\n        Locale locale;\n        boolean justTheNumber;\n        boolean blankIfZero;\n        boolean blankIfNull;\n        boolean forceFraction;\n        boolean stripOffSign;\n\n        locale = Locale.UK;\n        justTheNumber = true;\n        blankIfZero = true;\n        blankIfNull = true;\n        forceFraction = true;\n        stripOffSign = true;\n        Amount inputAmount = createAmount(\"EUR\", 9.00);\n\n        Assert.assertEquals(\"9.00\", AmountViewUtils.getAmountString(locale, inputAmount, justTheNumber, blankIfZero,\n                blankIfNull, forceFraction, stripOffSign));\n\n        forceFraction = false;\n\n        Assert.assertEquals(\"9\", AmountViewUtils.getAmountString(locale, inputAmount, justTheNumber, blankIfZero,\n                blankIfNull, forceFraction, stripOffSign));\n    }", "signature": "void testGetAmountStringFraction()", "full_signature": "@Test public void testGetAmountStringFraction()", "class_method_signature": "AmountViewUtilsTest.testGetAmountStringFraction()", "testcase": true, "constructor": false, "invocations": ["createAmount", "assertEquals", "getAmountString", "assertEquals", "getAmountString"]}, "focal_class": {"identifier": "AmountViewUtils", "superclass": "", "interfaces": "", "fields": [], "methods": [{"identifier": "getColor", "parameters": "(Context context, Amount amount)", "modifiers": "public static", "return": "int", "signature": "int getColor(Context context, Amount amount)", "full_signature": "public static int getColor(Context context, Amount amount)", "class_method_signature": "AmountViewUtils.getColor(Context context, Amount amount)", "testcase": false, "constructor": false}, {"identifier": "getAmountString", "parameters": "(Locale locale, Amount amount, boolean justTheNumber,\n            boolean blankIfZero, boolean blankIfNull, boolean forceFraction, boolean stripOffSign)", "modifiers": "public static", "return": "String", "signature": "String getAmountString(Locale locale, Amount amount, boolean justTheNumber,\n            boolean blankIfZero, boolean blankIfNull, boolean forceFraction, boolean stripOffSign)", "full_signature": "public static String getAmountString(Locale locale, Amount amount, boolean justTheNumber,\n            boolean blankIfZero, boolean blankIfNull, boolean forceFraction, boolean stripOffSign)", "class_method_signature": "AmountViewUtils.getAmountString(Locale locale, Amount amount, boolean justTheNumber,\n            boolean blankIfZero, boolean blankIfNull, boolean forceFraction, boolean stripOffSign)", "testcase": false, "constructor": false}, {"identifier": "getDoubleString", "parameters": "(Locale locale, Double value)", "modifiers": "public static", "return": "String", "signature": "String getDoubleString(Locale locale, Double value)", "full_signature": "public static String getDoubleString(Locale locale, Double value)", "class_method_signature": "AmountViewUtils.getDoubleString(Locale locale, Double value)", "testcase": false, "constructor": false}, {"identifier": "getDoubleString", "parameters": "(Locale locale, Double value, boolean blankIfZero, boolean blankIfNull,\n            boolean forceFraction,\n            boolean stripOffSign, StringBuilder result)", "modifiers": "private static", "return": "String", "signature": "String getDoubleString(Locale locale, Double value, boolean blankIfZero, boolean blankIfNull,\n            boolean forceFraction,\n            boolean stripOffSign, StringBuilder result)", "full_signature": "private static String getDoubleString(Locale locale, Double value, boolean blankIfZero, boolean blankIfNull,\n            boolean forceFraction,\n            boolean stripOffSign, StringBuilder result)", "class_method_signature": "AmountViewUtils.getDoubleString(Locale locale, Double value, boolean blankIfZero, boolean blankIfNull,\n            boolean forceFraction,\n            boolean stripOffSign, StringBuilder result)", "testcase": false, "constructor": false}, {"identifier": "getAmountString", "parameters": "(Locale locale, Amount amount, boolean justTheNumber,\n            boolean stripOffSign, boolean forceFraction)", "modifiers": "public static", "return": "String", "signature": "String getAmountString(Locale locale, Amount amount, boolean justTheNumber,\n            boolean stripOffSign, boolean forceFraction)", "full_signature": "public static String getAmountString(Locale locale, Amount amount, boolean justTheNumber,\n            boolean stripOffSign, boolean forceFraction)", "class_method_signature": "AmountViewUtils.getAmountString(Locale locale, Amount amount, boolean justTheNumber,\n            boolean stripOffSign, boolean forceFraction)", "testcase": false, "constructor": false}, {"identifier": "getAmountString", "parameters": "(Locale locale, Amount amount, boolean justTheNumber, boolean stripOffSign)", "modifiers": "public static", "return": "String", "signature": "String getAmountString(Locale locale, Amount amount, boolean justTheNumber, boolean stripOffSign)", "full_signature": "public static String getAmountString(Locale locale, Amount amount, boolean justTheNumber, boolean stripOffSign)", "class_method_signature": "AmountViewUtils.getAmountString(Locale locale, Amount amount, boolean justTheNumber, boolean stripOffSign)", "testcase": false, "constructor": false}, {"identifier": "getAmountString", "parameters": "(Locale locale, Amount amount, boolean justTheNumber)", "modifiers": "public static", "return": "String", "signature": "String getAmountString(Locale locale, Amount amount, boolean justTheNumber)", "full_signature": "public static String getAmountString(Locale locale, Amount amount, boolean justTheNumber)", "class_method_signature": "AmountViewUtils.getAmountString(Locale locale, Amount amount, boolean justTheNumber)", "testcase": false, "constructor": false}, {"identifier": "getAmountString", "parameters": "(Locale locale, Amount amount)", "modifiers": "public static", "return": "String", "signature": "String getAmountString(Locale locale, Amount amount)", "full_signature": "public static String getAmountString(Locale locale, Amount amount)", "class_method_signature": "AmountViewUtils.getAmountString(Locale locale, Amount amount)", "testcase": false, "constructor": false}], "file": "app/src/main/java/de/koelle/christian/trickytripper/modelutils/AmountViewUtils.java"}, "focal_method": {"identifier": "getAmountString", "parameters": "(Locale locale, Amount amount, boolean justTheNumber,\n            boolean blankIfZero, boolean blankIfNull, boolean forceFraction, boolean stripOffSign)", "modifiers": "public static", "return": "String", "body": "public static String getAmountString(Locale locale, Amount amount, boolean justTheNumber,\n            boolean blankIfZero, boolean blankIfNull, boolean forceFraction, boolean stripOffSign) {\n        if (amount != null) {\n\n            StringBuilder result = new StringBuilder();\n            if (!justTheNumber) {\n                result.append(CurrencyUtil.getSymbolToCurrency(null, amount.getUnit())).append(\" \");\n            }\n            return getDoubleString(locale, amount.getValue(), blankIfZero, blankIfNull, forceFraction, stripOffSign,\n                    result);\n        }\n        return (blankIfNull) ? \"\" : null;\n    }", "signature": "String getAmountString(Locale locale, Amount amount, boolean justTheNumber,\n            boolean blankIfZero, boolean blankIfNull, boolean forceFraction, boolean stripOffSign)", "full_signature": "public static String getAmountString(Locale locale, Amount amount, boolean justTheNumber,\n            boolean blankIfZero, boolean blankIfNull, boolean forceFraction, boolean stripOffSign)", "class_method_signature": "AmountViewUtils.getAmountString(Locale locale, Amount amount, boolean justTheNumber,\n            boolean blankIfZero, boolean blankIfNull, boolean forceFraction, boolean stripOffSign)", "testcase": false, "constructor": false, "invocations": ["append", "append", "getSymbolToCurrency", "getUnit", "getDoubleString", "getValue"]}, "repository": {"repo_id": 3173086, "url": "https://github.com/koelleChristian/trickytripper", "language": "Java", "is_fork": false, "fork_count": 13, "stargazer_count": 41, "size": 30533, "license": "licensed"}}