{"test_class": {"identifier": "MoveFileTest", "superclass": "extends TransformationUtilityTestHelper", "interfaces": "", "fields": [], "file": "butterfly-utilities/src/test/java/com/paypal/butterfly/utilities/operations/file/MoveFileTest.java"}, "test_case": {"identifier": "nonFileTest", "parameters": "()", "modifiers": "@Test public", "return": "void", "body": "@Test\n    public void nonFileTest() {\n        MoveFile moveFile = new MoveFile().relative(\"blah\").setToRelative(\"src\");\n        TOExecutionResult executionResult = moveFile.execution(transformedAppFolder, transformationContext);\n\n        assertEquals(moveFile.getToRelative(), \"src\");\n        assertEquals(executionResult.getType(), TOExecutionResult.Type.ERROR);\n        assertEquals(executionResult.getException().getClass(), TransformationOperationException.class);\n        assertEquals(executionResult.getException().getMessage(), \"File could not be moved\");\n        assertEquals(executionResult.getException().getCause().getClass(), IOException.class);\n        assertEquals(executionResult.getException().getCause().getMessage(), \"/blah (Is a directory)\");\n        assertEquals(moveFile.getDescription(), \"Move file blah to src\");\n        assertNull(executionResult.getDetails());\n    }", "signature": "void nonFileTest()", "full_signature": "@Test public void nonFileTest()", "class_method_signature": "MoveFileTest.nonFileTest()", "testcase": true, "constructor": false, "invocations": ["setToRelative", "relative", "execution", "assertEquals", "getToRelative", "assertEquals", "getType", "assertEquals", "getClass", "getException", "assertEquals", "getMessage", "getException", "assertEquals", "getClass", "getCause", "getException", "assertEquals", "getMessage", "getCause", "getException", "assertEquals", "getDescription", "assertNull", "getDetails"]}, "focal_class": {"identifier": "MoveFile", "superclass": "extends AbstractToOperation<MoveFile>", "interfaces": "", "fields": [{"original_string": "private static final String DESCRIPTION = \"Move file %s to %s\";", "modifier": "private static final", "type": "String", "declarator": "DESCRIPTION = \"Move file %s to %s\"", "var_name": "DESCRIPTION"}], "methods": [{"identifier": "MoveFile", "parameters": "()", "modifiers": "public", "return": "", "signature": " MoveFile()", "full_signature": "public  MoveFile()", "class_method_signature": "MoveFile.MoveFile()", "testcase": false, "constructor": true}, {"identifier": "execution", "parameters": "(File transformedAppFolder, TransformationContext transformationContext)", "modifiers": "@Override protected", "return": "TOExecutionResult", "signature": "TOExecutionResult execution(File transformedAppFolder, TransformationContext transformationContext)", "full_signature": "@Override protected TOExecutionResult execution(File transformedAppFolder, TransformationContext transformationContext)", "class_method_signature": "MoveFile.execution(File transformedAppFolder, TransformationContext transformationContext)", "testcase": false, "constructor": false}], "file": "butterfly-utilities/src/main/java/com/paypal/butterfly/utilities/operations/file/MoveFile.java"}, "focal_method": {"identifier": "execution", "parameters": "(File transformedAppFolder, TransformationContext transformationContext)", "modifiers": "@Override protected", "return": "TOExecutionResult", "body": "@Override\n    protected TOExecutionResult execution(File transformedAppFolder, TransformationContext transformationContext) {\n        File fileFrom = getAbsoluteFile(transformedAppFolder, transformationContext);\n        File fileTo = getFileTo(transformedAppFolder, transformationContext);\n        TOExecutionResult result;\n\n        // TODO\n        // Check if it is really a file and if it exists!\n\n        try {\n            if (fileFrom.isDirectory()) {\n                IOException ex = new IOException(getRelativePath(transformedAppFolder, fileFrom) + \" (Is a directory)\");\n                result = TOExecutionResult.error(this, new TransformationOperationException(\"File could not be moved\", ex));\n            } else {\n                String details = String.format(\"File '%s' has been moved to '%s'\", getRelativePath(), getRelativePath(transformedAppFolder, fileTo));\n                FileUtils.copyFileToDirectory(fileFrom, fileTo);\n                FileUtils.fileDelete(fileFrom.getAbsolutePath());\n                result = TOExecutionResult.success(this, details);\n            }\n        } catch (IOException e) {\n            result = TOExecutionResult.error(this, new TransformationOperationException(\"File could not be moved\", e));\n        }\n\n        return result;\n    }", "signature": "TOExecutionResult execution(File transformedAppFolder, TransformationContext transformationContext)", "full_signature": "@Override protected TOExecutionResult execution(File transformedAppFolder, TransformationContext transformationContext)", "class_method_signature": "MoveFile.execution(File transformedAppFolder, TransformationContext transformationContext)", "testcase": false, "constructor": false, "invocations": ["getAbsoluteFile", "getFileTo", "isDirectory", "getRelativePath", "error", "format", "getRelativePath", "getRelativePath", "copyFileToDirectory", "fileDelete", "getAbsolutePath", "success", "error"]}, "repository": {"repo_id": 104398040, "url": "https://github.com/paypal/butterfly", "language": "Java", "is_fork": false, "fork_count": 42, "stargazer_count": 26, "size": 6906, "license": "licensed"}}