{"test_class": {"identifier": "MoveFileTest", "superclass": "extends TransformationUtilityTestHelper", "interfaces": "", "fields": [], "file": "butterfly-utilities/src/test/java/com/paypal/butterfly/utilities/operations/file/MoveFileTest.java"}, "test_case": {"identifier": "existentToFileTest", "parameters": "()", "modifiers": "@Test public", "return": "void", "body": "@Test\n    public void existentToFileTest() throws IOException {\n        File originalFile = new File(transformedAppFolder, \"src/main/resources/dogs.yaml\");\n        File toDir = new File(transformedAppFolder, \"/src/main/resources/more_yaml/\");\n\n        assertTrue(originalFile.exists());\n        assertTrue(originalFile.isFile());\n        assertTrue(toDir.exists());\n        assertTrue(new File(toDir, \"dogs.yaml\").exists());\n\n        // Saving original file as a temp file to have its content compared later\n        File tempOriginalFile = File.createTempFile(\"butterfly-test-file\", null);\n        FileUtils.copyFile(originalFile, tempOriginalFile);\n\n        MoveFile moveFile = new MoveFile().relative(\"src/main/resources/dogs.yaml\").setToRelative(\"src/main/resources/more_yaml\");\n        TOExecutionResult executionResult = moveFile.execution(transformedAppFolder, transformationContext);\n        assertEquals(executionResult.getType(), TOExecutionResult.Type.SUCCESS);\n        assertEquals(moveFile.getDescription(), \"Move file src/main/resources/dogs.yaml to src/main/resources/more_yaml\");\n        assertEquals(executionResult.getDetails(), \"File 'src/main/resources/dogs.yaml' has been moved to '/src/main/resources/more_yaml'\");\n\n        File movedFile = new File(transformedAppFolder, \"src/main/resources/more_yaml/dogs.yaml\");\n        assertFalse(originalFile.exists());\n        assertTrue(movedFile.exists());\n        assertTrue(FileUtils.contentEquals(tempOriginalFile, movedFile));\n\n        tempOriginalFile.delete();\n    }", "signature": "void existentToFileTest()", "full_signature": "@Test public void existentToFileTest()", "class_method_signature": "MoveFileTest.existentToFileTest()", "testcase": true, "constructor": false, "invocations": ["assertTrue", "exists", "assertTrue", "isFile", "assertTrue", "exists", "assertTrue", "exists", "createTempFile", "copyFile", "setToRelative", "relative", "execution", "assertEquals", "getType", "assertEquals", "getDescription", "assertEquals", "getDetails", "assertFalse", "exists", "assertTrue", "exists", "assertTrue", "contentEquals", "delete"]}, "focal_class": {"identifier": "MoveFile", "superclass": "extends AbstractToOperation<MoveFile>", "interfaces": "", "fields": [{"original_string": "private static final String DESCRIPTION = \"Move file %s to %s\";", "modifier": "private static final", "type": "String", "declarator": "DESCRIPTION = \"Move file %s to %s\"", "var_name": "DESCRIPTION"}], "methods": [{"identifier": "MoveFile", "parameters": "()", "modifiers": "public", "return": "", "signature": " MoveFile()", "full_signature": "public  MoveFile()", "class_method_signature": "MoveFile.MoveFile()", "testcase": false, "constructor": true}, {"identifier": "execution", "parameters": "(File transformedAppFolder, TransformationContext transformationContext)", "modifiers": "@Override protected", "return": "TOExecutionResult", "signature": "TOExecutionResult execution(File transformedAppFolder, TransformationContext transformationContext)", "full_signature": "@Override protected TOExecutionResult execution(File transformedAppFolder, TransformationContext transformationContext)", "class_method_signature": "MoveFile.execution(File transformedAppFolder, TransformationContext transformationContext)", "testcase": false, "constructor": false}], "file": "butterfly-utilities/src/main/java/com/paypal/butterfly/utilities/operations/file/MoveFile.java"}, "focal_method": {"identifier": "execution", "parameters": "(File transformedAppFolder, TransformationContext transformationContext)", "modifiers": "@Override protected", "return": "TOExecutionResult", "body": "@Override\n    protected TOExecutionResult execution(File transformedAppFolder, TransformationContext transformationContext) {\n        File fileFrom = getAbsoluteFile(transformedAppFolder, transformationContext);\n        File fileTo = getFileTo(transformedAppFolder, transformationContext);\n        TOExecutionResult result;\n\n        // TODO\n        // Check if it is really a file and if it exists!\n\n        try {\n            if (fileFrom.isDirectory()) {\n                IOException ex = new IOException(getRelativePath(transformedAppFolder, fileFrom) + \" (Is a directory)\");\n                result = TOExecutionResult.error(this, new TransformationOperationException(\"File could not be moved\", ex));\n            } else {\n                String details = String.format(\"File '%s' has been moved to '%s'\", getRelativePath(), getRelativePath(transformedAppFolder, fileTo));\n                FileUtils.copyFileToDirectory(fileFrom, fileTo);\n                FileUtils.fileDelete(fileFrom.getAbsolutePath());\n                result = TOExecutionResult.success(this, details);\n            }\n        } catch (IOException e) {\n            result = TOExecutionResult.error(this, new TransformationOperationException(\"File could not be moved\", e));\n        }\n\n        return result;\n    }", "signature": "TOExecutionResult execution(File transformedAppFolder, TransformationContext transformationContext)", "full_signature": "@Override protected TOExecutionResult execution(File transformedAppFolder, TransformationContext transformationContext)", "class_method_signature": "MoveFile.execution(File transformedAppFolder, TransformationContext transformationContext)", "testcase": false, "constructor": false, "invocations": ["getAbsoluteFile", "getFileTo", "isDirectory", "getRelativePath", "error", "format", "getRelativePath", "getRelativePath", "copyFileToDirectory", "fileDelete", "getAbsolutePath", "success", "error"]}, "repository": {"repo_id": 104398040, "url": "https://github.com/paypal/butterfly", "language": "Java", "is_fork": false, "fork_count": 42, "stargazer_count": 26, "size": 6906, "license": "licensed"}}