{"test_class": {"identifier": "RemoveVisitTest", "superclass": "", "interfaces": "", "fields": [{"original_string": "@Mock\n    private ScoreDirector<VehicleRoutingSolution> scoreDirector;", "modifier": "@Mock\n    private", "type": "ScoreDirector<VehicleRoutingSolution>", "declarator": "scoreDirector", "var_name": "scoreDirector"}], "file": "optaweb-vehicle-routing-backend/src/test/java/org/optaweb/vehiclerouting/plugin/planner/change/RemoveVisitTest.java"}, "test_case": {"identifier": "fail_fast_if_working_solution_visit_list_does_not_contain_working_visit", "parameters": "()", "modifiers": "@Test", "return": "void", "body": "@Test\n    void fail_fast_if_working_solution_visit_list_does_not_contain_working_visit() {\n        VehicleRoutingSolution solution = SolutionFactory.emptySolution();\n\n        long removedId = 111L;\n        PlanningVisit removedVisit = testVisit(removedId);\n        long wrongId = 222L;\n        PlanningVisit wrongVisit = testVisit(wrongId);\n        wrongVisit.setPreviousStandstill(testVisit(10));\n        removedVisit.setNextVisit(wrongVisit);\n        solution.getVisitList().add(wrongVisit);\n\n        when(scoreDirector.getWorkingSolution()).thenReturn(solution);\n        when(scoreDirector.lookUpWorkingObject(removedVisit)).thenReturn(removedVisit);\n\n        // do change\n        RemoveVisit removeVisit = new RemoveVisit(removedVisit);\n        assertThatIllegalStateException()\n                .isThrownBy(() -> removeVisit.doChange(scoreDirector))\n                .withMessageMatching(\".*List .*\" + wrongId + \".* doesn't contain the working.*\" + removedId + \".*\");\n    }", "signature": "void fail_fast_if_working_solution_visit_list_does_not_contain_working_visit()", "full_signature": "@Test void fail_fast_if_working_solution_visit_list_does_not_contain_working_visit()", "class_method_signature": "RemoveVisitTest.fail_fast_if_working_solution_visit_list_does_not_contain_working_visit()", "testcase": true, "constructor": false, "invocations": ["emptySolution", "testVisit", "testVisit", "setPreviousStandstill", "testVisit", "setNextVisit", "add", "getVisitList", "thenReturn", "when", "getWorkingSolution", "thenReturn", "when", "lookUpWorkingObject", "withMessageMatching", "isThrownBy", "assertThatIllegalStateException", "doChange"]}, "focal_class": {"identifier": "RemoveVisit", "superclass": "", "interfaces": "implements ProblemFactChange<VehicleRoutingSolution>", "fields": [{"original_string": "private final PlanningVisit planningVisit;", "modifier": "private final", "type": "PlanningVisit", "declarator": "planningVisit", "var_name": "planningVisit"}], "methods": [{"identifier": "RemoveVisit", "parameters": "(PlanningVisit planningVisit)", "modifiers": "public", "return": "", "signature": " RemoveVisit(PlanningVisit planningVisit)", "full_signature": "public  RemoveVisit(PlanningVisit planningVisit)", "class_method_signature": "RemoveVisit.RemoveVisit(PlanningVisit planningVisit)", "testcase": false, "constructor": true}, {"identifier": "doChange", "parameters": "(ScoreDirector<VehicleRoutingSolution> scoreDirector)", "modifiers": "@Override public", "return": "void", "signature": "void doChange(ScoreDirector<VehicleRoutingSolution> scoreDirector)", "full_signature": "@Override public void doChange(ScoreDirector<VehicleRoutingSolution> scoreDirector)", "class_method_signature": "RemoveVisit.doChange(ScoreDirector<VehicleRoutingSolution> scoreDirector)", "testcase": false, "constructor": false}], "file": "optaweb-vehicle-routing-backend/src/main/java/org/optaweb/vehiclerouting/plugin/planner/change/RemoveVisit.java"}, "focal_method": {"identifier": "doChange", "parameters": "(ScoreDirector<VehicleRoutingSolution> scoreDirector)", "modifiers": "@Override public", "return": "void", "body": "@Override\n    public void doChange(ScoreDirector<VehicleRoutingSolution> scoreDirector) {\n        VehicleRoutingSolution workingSolution = scoreDirector.getWorkingSolution();\n\n        // Look up a working copy of the visit\n        PlanningVisit workingVisit = scoreDirector.lookUpWorkingObject(planningVisit);\n        if (workingVisit == null) {\n            throw new IllegalStateException(\"Can't look up a working copy of \" + planningVisit);\n        }\n\n        // Fix the next visit and set its previousStandstill to the removed visit's previousStandstill\n        PlanningVisit nextVisit = workingVisit.getNextVisit();\n        if (nextVisit != null) { // otherwise it's the last visit\n            scoreDirector.beforeVariableChanged(nextVisit, \"previousStandstill\");\n            nextVisit.setPreviousStandstill(workingVisit.getPreviousStandstill());\n            scoreDirector.afterVariableChanged(nextVisit, \"previousStandstill\");\n        }\n\n        // No need to clone the visitList because it is a planning entity collection, so it is already planning-cloned.\n        // To learn more about problem fact changes, see:\n        // https://docs.jboss.org/optaplanner/release/latest/optaplanner-docs/html_single/#problemFactChangeExample\n\n        // Remove the visit\n        scoreDirector.beforeEntityRemoved(workingVisit);\n        if (!workingSolution.getVisitList().remove(workingVisit)) {\n            throw new IllegalStateException(\n                    \"Working solution's visitList \"\n                            + workingSolution.getVisitList()\n                            + \" doesn't contain the workingVisit (\"\n                            + workingVisit\n                            + \"). This is a bug!\");\n        }\n        scoreDirector.afterEntityRemoved(workingVisit);\n\n        scoreDirector.triggerVariableListeners();\n    }", "signature": "void doChange(ScoreDirector<VehicleRoutingSolution> scoreDirector)", "full_signature": "@Override public void doChange(ScoreDirector<VehicleRoutingSolution> scoreDirector)", "class_method_signature": "RemoveVisit.doChange(ScoreDirector<VehicleRoutingSolution> scoreDirector)", "testcase": false, "constructor": false, "invocations": ["getWorkingSolution", "lookUpWorkingObject", "getNextVisit", "beforeVariableChanged", "setPreviousStandstill", "getPreviousStandstill", "afterVariableChanged", "beforeEntityRemoved", "remove", "getVisitList", "getVisitList", "afterEntityRemoved", "triggerVariableListeners"]}, "repository": {"repo_id": 142603842, "url": "https://github.com/kiegroup/optaweb-vehicle-routing", "stars": 42, "created": "7/27/2018 5:08:08 PM +00:00", "updates": "2020-01-27T22:19:48+00:00", "fork": "False", "license": "licensed"}}