{"test_class": {"identifier": "DartAnalyzerReportParserTest", "superclass": "", "interfaces": "", "fields": [{"original_string": "private static final String FILE_PATH = \"lib/main.dart\";", "modifier": "private static final", "type": "String", "declarator": "FILE_PATH = \"lib/main.dart\"", "var_name": "FILE_PATH"}, {"original_string": "private static final String RULE_ID_UNUSED_LOCAL_VARIABLE = \"unused_local_variable\";", "modifier": "private static final", "type": "String", "declarator": "RULE_ID_UNUSED_LOCAL_VARIABLE = \"unused_local_variable\"", "var_name": "RULE_ID_UNUSED_LOCAL_VARIABLE"}, {"original_string": "private DartAnalyzerReportParser parser;", "modifier": "private", "type": "DartAnalyzerReportParser", "declarator": "parser", "var_name": "parser"}], "file": "dart-lang/src/test/java/fr/insideapp/sonarqube/dart/lang/issues/dartanalyzer/DartAnalyzerReportParserTest.java"}, "test_case": {"identifier": "parseWithCircles", "parameters": "()", "modifiers": "@Test public", "return": "void", "body": "@Test\n\tpublic void parseWithCircles() {\n\n\t\tString input = \"  lint \u2022 Close instances of `dart.core.Sink`. \u2022 lib/main.dart:63:9 \u2022 close_sinks\\n\"\n\t\t\t\t+ \"  hint \u2022 The value of the local variable '_controller' isn't used. \u2022 lib/main.dart:63:9 \u2022 unused_local_variable\";\n\n\t\tList<DartAnalyzerReportIssue> issues = parser.parse(input);\n\t\tassertThat(issues.size()).isEqualTo(2);\n\t\t\n\t\tassertFilePath(issues.get(0), FILE_PATH);\n\t\tassertLineNumber(issues.get(0), 63);\n\t\tassertRuleId(issues.get(0), \"close_sinks\");\n\t\tassertMessage(issues.get(0), \"Close instances of `dart.core.Sink`.\");\n\t\n\t\tassertFilePath(issues.get(1), FILE_PATH);\n\t\tassertLineNumber(issues.get(1), 63);\n\t\tassertRuleId(issues.get(1), RULE_ID_UNUSED_LOCAL_VARIABLE);\n\t\tassertMessage(issues.get(1), \"The value of the local variable '_controller' isn't used.\");\n\n\t}", "signature": "void parseWithCircles()", "full_signature": "@Test public void parseWithCircles()", "class_method_signature": "DartAnalyzerReportParserTest.parseWithCircles()", "testcase": true, "constructor": false, "invocations": ["parse", "isEqualTo", "assertThat", "size", "assertFilePath", "get", "assertLineNumber", "get", "assertRuleId", "get", "assertMessage", "get", "assertFilePath", "get", "assertLineNumber", "get", "assertRuleId", "get", "assertMessage", "get"]}, "focal_class": {"identifier": "DartAnalyzerReportParser", "superclass": "", "interfaces": "", "fields": [], "methods": [{"identifier": "parse", "parameters": "(String input)", "modifiers": "public", "return": "List<DartAnalyzerReportIssue>", "signature": "List<DartAnalyzerReportIssue> parse(String input)", "full_signature": "public List<DartAnalyzerReportIssue> parse(String input)", "class_method_signature": "DartAnalyzerReportParser.parse(String input)", "testcase": false, "constructor": false}], "file": "dart-lang/src/main/java/fr/insideapp/sonarqube/dart/lang/issues/dartanalyzer/DartAnalyzerReportParser.java"}, "focal_method": {"identifier": "parse", "parameters": "(String input)", "modifiers": "public", "return": "List<DartAnalyzerReportIssue>", "body": "public List<DartAnalyzerReportIssue> parse(String input) {\n\n        List<DartAnalyzerReportIssue> issues = new ArrayList<>();\n\n        String[] lines = input.split(System.getProperty(\"line.separator\"));\n        Pattern pattern = Pattern.compile(\"(error|hint|lint)(.*)(-|\u2022)(.*)(-|\u2022)(.*):(.*):(.*)(-|\u2022)(.*)\");\n        for (int i = 0; i < lines.length; i++) {\n            Matcher matcher = pattern.matcher(lines[i]);\n            while (matcher.find()) {\n                String filePath = matcher.group(6).trim();\n                int lineNum = Integer.parseInt(matcher.group(7).trim());\n                String message = matcher.group(4).trim();\n                String ruleId = matcher.group(10).trim();\n\n                issues.add(new DartAnalyzerReportIssue(ruleId, message, filePath, lineNum));\n            }\n        }\n        return issues;\n    }", "signature": "List<DartAnalyzerReportIssue> parse(String input)", "full_signature": "public List<DartAnalyzerReportIssue> parse(String input)", "class_method_signature": "DartAnalyzerReportParser.parse(String input)", "testcase": false, "constructor": false, "invocations": ["split", "getProperty", "compile", "matcher", "find", "trim", "group", "parseInt", "trim", "group", "trim", "group", "trim", "group", "add"]}, "repository": {"repo_id": 235879795, "url": "https://github.com/insideapp-oss/sonar-flutter", "language": "Java", "is_fork": false, "fork_count": 12, "stargazer_count": 70, "size": 799, "license": "licensed"}}