{"test_class": {"identifier": "StringToEnumConverterTest", "superclass": "", "interfaces": "", "fields": [{"original_string": "StringToEnumConverter converter = new StringToEnumConverter();", "modifier": "", "type": "StringToEnumConverter", "declarator": "converter = new StringToEnumConverter()", "var_name": "converter"}], "file": "beanmother-core/src/test/java/io/beanmother/core/converter/std/StringToEnumConverterTest.java"}, "test_case": {"identifier": "testConvert", "parameters": "()", "modifiers": "@Test public", "return": "void", "body": "@Test\n    public void testConvert() {\n        assertEquals(TestEnum.CONVERTER, converter.convert(\"CONVERTER\", TypeToken.of(TestEnum.class)));\n        assertEquals(TestEnum.CONVERTER, converter.convert(\"converter\", TypeToken.of(TestEnum.class)));\n\n        assertEquals(TestEnum.SCRIPT_PROCESSOR, converter.convert(\"SCRIPT_PROCESSOR\", TypeToken.of(TestEnum.class)));\n        assertEquals(TestEnum.SCRIPT_PROCESSOR, converter.convert(\"script processor\", TypeToken.of(TestEnum.class)));\n        assertEquals(TestEnum.SCRIPT_PROCESSOR, converter.convert(\"script-processor\", TypeToken.of(TestEnum.class)));\n    }", "signature": "void testConvert()", "full_signature": "@Test public void testConvert()", "class_method_signature": "StringToEnumConverterTest.testConvert()", "testcase": true, "constructor": false, "invocations": ["assertEquals", "convert", "of", "assertEquals", "convert", "of", "assertEquals", "convert", "of", "assertEquals", "convert", "of", "assertEquals", "convert", "of"]}, "focal_class": {"identifier": "StringToEnumConverter", "superclass": "extends AbstractConverter", "interfaces": "", "fields": [], "methods": [{"identifier": "convert", "parameters": "(Object source, TypeToken<?> targetTypeToken)", "modifiers": "@SuppressWarnings(\"unchecked\") @Override public", "return": "Object", "signature": "Object convert(Object source, TypeToken<?> targetTypeToken)", "full_signature": "@SuppressWarnings(\"unchecked\") @Override public Object convert(Object source, TypeToken<?> targetTypeToken)", "class_method_signature": "StringToEnumConverter.convert(Object source, TypeToken<?> targetTypeToken)", "testcase": false, "constructor": false}, {"identifier": "canHandle", "parameters": "(Object source, TypeToken<?> targetTypeToken)", "modifiers": "@Override public", "return": "boolean", "signature": "boolean canHandle(Object source, TypeToken<?> targetTypeToken)", "full_signature": "@Override public boolean canHandle(Object source, TypeToken<?> targetTypeToken)", "class_method_signature": "StringToEnumConverter.canHandle(Object source, TypeToken<?> targetTypeToken)", "testcase": false, "constructor": false}], "file": "beanmother-core/src/main/java/io/beanmother/core/converter/std/StringToEnumConverter.java"}, "focal_method": {"identifier": "convert", "parameters": "(Object source, TypeToken<?> targetTypeToken)", "modifiers": "@SuppressWarnings(\"unchecked\") @Override public", "return": "Object", "body": "@SuppressWarnings(\"unchecked\")\n    @Override\n    public Object convert(Object source, TypeToken<?> targetTypeToken) {\n        if (!canHandle(source, targetTypeToken)) throw new ConverterException(source, targetTypeToken.getRawType());\n\n        Class enumClass = targetTypeToken.getRawType();\n        for (Object enumConstant : enumClass.getEnumConstants()) {\n            String enumStr = enumConstant.toString().replaceAll(\"\\\\_\", \"\");\n            String sourceStr = ((String) source).replaceAll(\"\\\\-\", \"\").replaceAll(\"\\\\_\", \"\").replaceAll(\"\\\\s\", \"\");\n            if (enumStr.equalsIgnoreCase(sourceStr)) {\n                return Enum.valueOf(enumClass, enumConstant.toString());\n            }\n        }\n\n        throw new ConverterException(source, targetTypeToken.getRawType(), \"can not find enum constants\");\n    }", "signature": "Object convert(Object source, TypeToken<?> targetTypeToken)", "full_signature": "@SuppressWarnings(\"unchecked\") @Override public Object convert(Object source, TypeToken<?> targetTypeToken)", "class_method_signature": "StringToEnumConverter.convert(Object source, TypeToken<?> targetTypeToken)", "testcase": false, "constructor": false, "invocations": ["canHandle", "getRawType", "getRawType", "getEnumConstants", "replaceAll", "toString", "replaceAll", "replaceAll", "replaceAll", "equalsIgnoreCase", "valueOf", "toString", "getRawType"]}, "repository": {"repo_id": 100366560, "url": "https://github.com/keepcosmos/beanmother", "language": "Java", "is_fork": false, "fork_count": 19, "stargazer_count": 95, "size": 688, "license": "licensed"}}