{"test_class": {"identifier": "ActivityFragmentLeakInstanceFilterTest", "superclass": "", "interfaces": "", "fields": [], "file": "profilers/testSrc/com/android/tools/profilers/memory/adapters/instancefilters/ActivityFragmentLeakInstanceFilterTest.java"}, "test_case": {"identifier": "testFragmentLeaks", "parameters": "()", "modifiers": "@Test public", "return": "void", "body": "@Test\n  public void testFragmentLeaks() {\n    long baseClassNativeFragmentId = 1;\n    long subClassNativeFragmentId = 2;\n    long baseClassSupportFragmentId = 3;\n    long baseClassAndroidxFragmentId = 5;\n\n    FakeCaptureObject capture = new FakeCaptureObject.Builder().build();\n\n    // null FragmentManager and not waiting to be GC'd\n    FakeInstanceObject leakingNativeBaseNativeFragment =\n      new FakeInstanceObject.Builder(capture, baseClassNativeFragmentId, ActivityFragmentLeakInstanceFilter.NATIVE_FRAGMENT_CLASS_NAME)\n        .addField(ActivityFragmentLeakInstanceFilter.FRAGFMENT_MANAGER_FIELD_NAME, ValueObject.ValueType.OBJECT, null)\n        .setDepth(1)\n        .build();\n    // null FragmentManager but waiting to be GC'd\n    FakeInstanceObject nonLeakingBaseNativeFragment =\n      new FakeInstanceObject.Builder(capture, baseClassNativeFragmentId, ActivityFragmentLeakInstanceFilter.NATIVE_FRAGMENT_CLASS_NAME)\n        .addField(ActivityFragmentLeakInstanceFilter.FRAGFMENT_MANAGER_FIELD_NAME, ValueObject.ValueType.OBJECT, null)\n        .build();\n    // null FragmentManager and not waiting to be GC'd\n    FakeInstanceObject leakingSubClassNativeFragment =\n      new FakeInstanceObject.Builder(capture, subClassNativeFragmentId, \"my.native.fragment.subclass\")\n        .setSuperClassId(baseClassNativeFragmentId)\n        .addField(ActivityFragmentLeakInstanceFilter.FRAGFMENT_MANAGER_FIELD_NAME, ValueObject.ValueType.OBJECT, null)\n        .setDepth(1)\n        .build();\n    // non-null FragmentManager\n    FakeInstanceObject nonLeakingSubClassNativeFragment =\n      new FakeInstanceObject.Builder(capture, subClassNativeFragmentId, \"my.native.fragment.subclass\")\n        .setSuperClassId(baseClassNativeFragmentId)\n        .addField(ActivityFragmentLeakInstanceFilter.FRAGFMENT_MANAGER_FIELD_NAME, ValueObject.ValueType.OBJECT, new Object())\n        .setDepth(1)\n        .build();\n    // null FragmentManager and not waiting to be GC'd\n    FakeInstanceObject leakingSupportBaseNativeFragment =\n      new FakeInstanceObject.Builder(capture, baseClassSupportFragmentId, ActivityFragmentLeakInstanceFilter.SUPPORT_FRAGMENT_CLASS_NAME)\n        .addField(ActivityFragmentLeakInstanceFilter.FRAGFMENT_MANAGER_FIELD_NAME, ValueObject.ValueType.OBJECT, null)\n        .setDepth(1)\n        .build();\n    // no mFragmentManager field\n    FakeInstanceObject nonleakingAndroidXBaseNativeFragment =\n      new FakeInstanceObject.Builder(capture, baseClassAndroidxFragmentId, ActivityFragmentLeakInstanceFilter.ANDROIDX_FRAGMENT_CLASS_NAME)\n        .build();\n\n    Set<InstanceObject> instances = ImmutableSet.of(leakingNativeBaseNativeFragment,\n                                                    nonLeakingBaseNativeFragment,\n                                                    leakingSubClassNativeFragment,\n                                                    nonLeakingSubClassNativeFragment,\n                                                    leakingSupportBaseNativeFragment,\n                                                    nonleakingAndroidXBaseNativeFragment);\n\n    ActivityFragmentLeakInstanceFilter filter = new ActivityFragmentLeakInstanceFilter();\n    Set<InstanceObject> result = filter.filter(instances, capture.getClassDatabase());\n    assertThat(result).containsExactly(leakingNativeBaseNativeFragment, leakingSubClassNativeFragment, leakingSupportBaseNativeFragment);\n  }", "signature": "void testFragmentLeaks()", "full_signature": "@Test public void testFragmentLeaks()", "class_method_signature": "ActivityFragmentLeakInstanceFilterTest.testFragmentLeaks()", "testcase": true, "constructor": false, "invocations": ["build", "build", "setDepth", "addField", "build", "addField", "build", "setDepth", "addField", "setSuperClassId", "build", "setDepth", "addField", "setSuperClassId", "build", "setDepth", "addField", "build", "of", "filter", "getClassDatabase", "containsExactly", "assertThat"]}, "focal_class": {"identifier": "ActivityFragmentLeakInstanceFilter", "superclass": "", "interfaces": "implements CaptureObjectInstanceFilter", "fields": [{"original_string": "@VisibleForTesting static final String ACTIVTY_CLASS_NAME = \"android.app.Activity\";", "modifier": "@VisibleForTesting static final", "type": "String", "declarator": "ACTIVTY_CLASS_NAME = \"android.app.Activity\"", "var_name": "ACTIVTY_CLASS_NAME"}, {"original_string": "@VisibleForTesting static final String NATIVE_FRAGMENT_CLASS_NAME = \"android.app.Fragment\";", "modifier": "@VisibleForTesting static final", "type": "String", "declarator": "NATIVE_FRAGMENT_CLASS_NAME = \"android.app.Fragment\"", "var_name": "NATIVE_FRAGMENT_CLASS_NAME"}, {"original_string": "@VisibleForTesting static final String SUPPORT_FRAGMENT_CLASS_NAME = \"android.support.v4.app.Fragment\";", "modifier": "@VisibleForTesting static final", "type": "String", "declarator": "SUPPORT_FRAGMENT_CLASS_NAME = \"android.support.v4.app.Fragment\"", "var_name": "SUPPORT_FRAGMENT_CLASS_NAME"}, {"original_string": "@VisibleForTesting static final String ANDROIDX_FRAGMENT_CLASS_NAME = \"androidx.fragment.app.Fragment\";", "modifier": "@VisibleForTesting static final", "type": "String", "declarator": "ANDROIDX_FRAGMENT_CLASS_NAME = \"androidx.fragment.app.Fragment\"", "var_name": "ANDROIDX_FRAGMENT_CLASS_NAME"}, {"original_string": "@VisibleForTesting static final String FINISHED_FIELD_NAME = \"mFinished\";", "modifier": "@VisibleForTesting static final", "type": "String", "declarator": "FINISHED_FIELD_NAME = \"mFinished\"", "var_name": "FINISHED_FIELD_NAME"}, {"original_string": "@VisibleForTesting static final String DESTROYED_FIELD_NAME = \"mDestroyed\";", "modifier": "@VisibleForTesting static final", "type": "String", "declarator": "DESTROYED_FIELD_NAME = \"mDestroyed\"", "var_name": "DESTROYED_FIELD_NAME"}, {"original_string": "@VisibleForTesting static final String FRAGFMENT_MANAGER_FIELD_NAME = \"mFragmentManager\";", "modifier": "@VisibleForTesting static final", "type": "String", "declarator": "FRAGFMENT_MANAGER_FIELD_NAME = \"mFragmentManager\"", "var_name": "FRAGFMENT_MANAGER_FIELD_NAME"}, {"original_string": "private static final Set<String> FRAGMENT_CLASS_NAMES = ImmutableSet.of(\n    NATIVE_FRAGMENT_CLASS_NAME, SUPPORT_FRAGMENT_CLASS_NAME, ANDROIDX_FRAGMENT_CLASS_NAME\n  );", "modifier": "private static final", "type": "Set<String>", "declarator": "FRAGMENT_CLASS_NAMES = ImmutableSet.of(\n    NATIVE_FRAGMENT_CLASS_NAME, SUPPORT_FRAGMENT_CLASS_NAME, ANDROIDX_FRAGMENT_CLASS_NAME\n  )", "var_name": "FRAGMENT_CLASS_NAMES"}], "methods": [{"identifier": "getDisplayName", "parameters": "()", "modifiers": "@NotNull @Override public", "return": "String", "signature": "String getDisplayName()", "full_signature": "@NotNull @Override public String getDisplayName()", "class_method_signature": "ActivityFragmentLeakInstanceFilter.getDisplayName()", "testcase": false, "constructor": false}, {"identifier": "getSummaryDescription", "parameters": "()", "modifiers": "@NotNull @Override public", "return": "String", "signature": "String getSummaryDescription()", "full_signature": "@NotNull @Override public String getSummaryDescription()", "class_method_signature": "ActivityFragmentLeakInstanceFilter.getSummaryDescription()", "testcase": false, "constructor": false}, {"identifier": "getDetailedDescription", "parameters": "()", "modifiers": "@Nullable @Override public", "return": "String", "signature": "String getDetailedDescription()", "full_signature": "@Nullable @Override public String getDetailedDescription()", "class_method_signature": "ActivityFragmentLeakInstanceFilter.getDetailedDescription()", "testcase": false, "constructor": false}, {"identifier": "getDocumentationLink", "parameters": "()", "modifiers": "@Nullable @Override public", "return": "String", "signature": "String getDocumentationLink()", "full_signature": "@Nullable @Override public String getDocumentationLink()", "class_method_signature": "ActivityFragmentLeakInstanceFilter.getDocumentationLink()", "testcase": false, "constructor": false}, {"identifier": "filter", "parameters": "(@NotNull Set<InstanceObject> instances, @NotNull ClassDb classDatabase)", "modifiers": "@Override public", "return": "Set<InstanceObject>", "signature": "Set<InstanceObject> filter(@NotNull Set<InstanceObject> instances, @NotNull ClassDb classDatabase)", "full_signature": "@Override public Set<InstanceObject> filter(@NotNull Set<InstanceObject> instances, @NotNull ClassDb classDatabase)", "class_method_signature": "ActivityFragmentLeakInstanceFilter.filter(@NotNull Set<InstanceObject> instances, @NotNull ClassDb classDatabase)", "testcase": false, "constructor": false}, {"identifier": "isPotentialActivityLeak", "parameters": "(@NotNull InstanceObject instance)", "modifiers": "private", "return": "boolean", "signature": "boolean isPotentialActivityLeak(@NotNull InstanceObject instance)", "full_signature": "private boolean isPotentialActivityLeak(@NotNull InstanceObject instance)", "class_method_signature": "ActivityFragmentLeakInstanceFilter.isPotentialActivityLeak(@NotNull InstanceObject instance)", "testcase": false, "constructor": false}, {"identifier": "isPotentialFragmentLeak", "parameters": "(@NotNull InstanceObject instance)", "modifiers": "private", "return": "boolean", "signature": "boolean isPotentialFragmentLeak(@NotNull InstanceObject instance)", "full_signature": "private boolean isPotentialFragmentLeak(@NotNull InstanceObject instance)", "class_method_signature": "ActivityFragmentLeakInstanceFilter.isPotentialFragmentLeak(@NotNull InstanceObject instance)", "testcase": false, "constructor": false}], "file": "profilers/src/com/android/tools/profilers/memory/adapters/instancefilters/ActivityFragmentLeakInstanceFilter.java"}, "focal_method": {"identifier": "filter", "parameters": "(@NotNull Set<InstanceObject> instances, @NotNull ClassDb classDatabase)", "modifiers": "@Override public", "return": "Set<InstanceObject>", "body": "@Override\n  public Set<InstanceObject> filter(@NotNull Set<InstanceObject> instances, @NotNull ClassDb classDatabase) {\n    Set<ClassDb.ClassEntry> allActivitySubclasses = classDatabase.getEntriesByName(ACTIVTY_CLASS_NAME).stream()\n      .flatMap(classEntry -> classDatabase.getDescendantClasses(classEntry.getClassId()).stream())\n      .collect(Collectors.toSet());\n\n    Set<ClassDb.ClassEntry> allFragmentSubclasses = FRAGMENT_CLASS_NAMES.stream()\n      .flatMap(className -> classDatabase.getEntriesByName(className).stream())\n      .flatMap(classEntry -> classDatabase.getDescendantClasses(classEntry.getClassId()).stream())\n      .collect(Collectors.toSet());\n\n    return instances.stream().filter(instance -> {\n      if (allActivitySubclasses.contains(instance.getClassEntry()) && isPotentialActivityLeak(instance)) {\n        return true;\n      }\n      else if (allFragmentSubclasses.contains(instance.getClassEntry()) && isPotentialFragmentLeak(instance)) {\n        return true;\n      }\n      return false;\n    }).collect(Collectors.toSet());\n  }", "signature": "Set<InstanceObject> filter(@NotNull Set<InstanceObject> instances, @NotNull ClassDb classDatabase)", "full_signature": "@Override public Set<InstanceObject> filter(@NotNull Set<InstanceObject> instances, @NotNull ClassDb classDatabase)", "class_method_signature": "ActivityFragmentLeakInstanceFilter.filter(@NotNull Set<InstanceObject> instances, @NotNull ClassDb classDatabase)", "testcase": false, "constructor": false, "invocations": ["collect", "flatMap", "stream", "getEntriesByName", "stream", "getDescendantClasses", "getClassId", "toSet", "collect", "flatMap", "flatMap", "stream", "stream", "getEntriesByName", "stream", "getDescendantClasses", "getClassId", "toSet", "collect", "filter", "stream", "contains", "getClassEntry", "isPotentialActivityLeak", "contains", "getClassEntry", "isPotentialFragmentLeak", "toSet"]}, "repository": {"repo_id": 60701247, "url": "https://github.com/JetBrains/android", "stars": 486, "created": "6/8/2016 1:46:48 PM +00:00", "updates": "2020-01-27T16:45:40+00:00", "fork": "False", "license": "licensed"}}