{"test_class": {"identifier": "TextInputLayoutHandlerTest", "superclass": "", "interfaces": "", "fields": [], "file": "designer/testSrc/com/android/tools/idea/uibuilder/handlers/TextInputLayoutHandlerTest.java"}, "test_case": {"identifier": "testGetXmlForM1", "parameters": "()", "modifiers": "@Test public", "return": "void", "body": "@Test\n  public void testGetXmlForM1() {\n    @Language(\"XML\")\n    String expected = \"<android.support.design.widget.TextInputLayout\\n\" +\n                      \"    android:layout_width=\\\"match_parent\\\"\\n\" +\n                      \"    android:layout_height=\\\"wrap_content\\\">\\n\" +\n                      \"\\n\" +\n                      \"    <android.support.design.widget.TextInputEditText\\n\" +\n                      \"        android:layout_width=\\\"match_parent\\\"\\n\" +\n                      \"        android:layout_height=\\\"wrap_content\\\"\\n\" +\n                      \"        android:hint=\\\"hint\\\" />\\n\" +\n                      \"</android.support.design.widget.TextInputLayout>\\n\";\n    TextInputLayoutHandler handler = new TextInputLayoutHandler();\n    assertThat(handler.getXml(SdkConstants.TEXT_INPUT_LAYOUT.oldName(), XmlType.COMPONENT_CREATION)).isEqualTo(expected);\n  }", "signature": "void testGetXmlForM1()", "full_signature": "@Test public void testGetXmlForM1()", "class_method_signature": "TextInputLayoutHandlerTest.testGetXmlForM1()", "testcase": true, "constructor": false, "invocations": ["isEqualTo", "assertThat", "getXml", "oldName"]}, "focal_class": {"identifier": "TextInputLayoutHandler", "superclass": "extends LinearLayoutHandler", "interfaces": "", "fields": [], "methods": [{"identifier": "getInspectorProperties", "parameters": "()", "modifiers": "@Override @NotNull public", "return": "List<String>", "signature": "List<String> getInspectorProperties()", "full_signature": "@Override @NotNull public List<String> getInspectorProperties()", "class_method_signature": "TextInputLayoutHandler.getInspectorProperties()", "testcase": false, "constructor": false}, {"identifier": "getXml", "parameters": "(@NotNull String tagName, @NotNull XmlType xmlType)", "modifiers": "@Override @Language(\"XML\") @NotNull public", "return": "String", "signature": "String getXml(@NotNull String tagName, @NotNull XmlType xmlType)", "full_signature": "@Override @Language(\"XML\") @NotNull public String getXml(@NotNull String tagName, @NotNull XmlType xmlType)", "class_method_signature": "TextInputLayoutHandler.getXml(@NotNull String tagName, @NotNull XmlType xmlType)", "testcase": false, "constructor": false}], "file": "designer/src/com/android/tools/idea/uibuilder/handlers/TextInputLayoutHandler.java"}, "focal_method": {"identifier": "getXml", "parameters": "(@NotNull String tagName, @NotNull XmlType xmlType)", "modifiers": "@Override @Language(\"XML\") @NotNull public", "return": "String", "body": "@Override\n  @Language(\"XML\")\n  @NotNull\n  public String getXml(@NotNull String tagName, @NotNull XmlType xmlType) {\n    boolean isMaterial2 = tagName.startsWith(MATERIAL2_PKG);\n    switch (xmlType) {\n      case COMPONENT_CREATION:\n        String textInputEditTextTag = isMaterial2 ? TEXT_INPUT_EDIT_TEXT.newName() : TEXT_INPUT_EDIT_TEXT.oldName();\n        return new XmlBuilder()\n          .startTag(tagName)\n          .androidAttribute(ATTR_LAYOUT_WIDTH, VALUE_MATCH_PARENT)\n          .androidAttribute(ATTR_LAYOUT_HEIGHT, VALUE_WRAP_CONTENT)\n            .startTag(textInputEditTextTag)\n            .androidAttribute(ATTR_LAYOUT_WIDTH, VALUE_MATCH_PARENT)\n            .androidAttribute(ATTR_LAYOUT_HEIGHT, VALUE_WRAP_CONTENT)\n            .androidAttribute(ATTR_HINT, \"hint\")\n            .endTag(textInputEditTextTag)\n          .endTag(tagName)\n          .toString();\n      default:\n        return super.getXml(tagName, xmlType);\n    }\n  }", "signature": "String getXml(@NotNull String tagName, @NotNull XmlType xmlType)", "full_signature": "@Override @Language(\"XML\") @NotNull public String getXml(@NotNull String tagName, @NotNull XmlType xmlType)", "class_method_signature": "TextInputLayoutHandler.getXml(@NotNull String tagName, @NotNull XmlType xmlType)", "testcase": false, "constructor": false, "invocations": ["startsWith", "newName", "oldName", "toString", "endTag", "endTag", "androidAttribute", "androidAttribute", "androidAttribute", "startTag", "androidAttribute", "androidAttribute", "startTag", "getXml"]}, "repository": {"repo_id": 60701247, "url": "https://github.com/JetBrains/android", "stars": 486, "created": "6/8/2016 1:46:48 PM +00:00", "updates": "2020-01-27T16:45:40+00:00", "fork": "False", "license": "licensed"}}