{"test_class": {"identifier": "GeneralScriptHandlerTest", "superclass": "", "interfaces": "", "fields": [], "file": "step-functions-plugins/step-functions-plugins-java/step-functions-plugins-java-handler/src/test/java/step/plugins/java/handler/GeneralScriptHandlerTest.java"}, "test_case": {"identifier": "testJS223GroovyHappyPath", "parameters": "()", "modifiers": "@Test public", "return": "void", "body": "@Test\n\tpublic void testJS223GroovyHappyPath() throws Exception {\n\t\tGeneralScriptHandler handler = createHandler();\n\n\t\tInput<JsonObject> input = new Input<>();\n\t\tinput.setFunction(\"MyKeyword1\");\n\t\tinput.setPayload(Json.createObjectBuilder().add(\"key1\", \"MyValue\").build());\n\n\t\tHashMap<String, String> properties = new HashMap<>();\n\t\tproperties.put(ScriptHandler.SCRIPT_LANGUAGE, \"groovy\");\n\t\tproperties.put(ScriptHandler.SCRIPT_FILE+\".id\", \"scripts/testGroovyUTF8.groovy\");\n\t\tproperties.put(ScriptHandler.SCRIPT_FILE+\".version\", \"\");\n\t\tinput.setProperties(properties);\n\t\t\n\t\tOutput<JsonObject> output = handler.handle(input);\n\t\tAssert.assertEquals(\"k\u00e9\u00ff1\", output.getPayload().getString(\"key1\"));\n\t}", "signature": "void testJS223GroovyHappyPath()", "full_signature": "@Test public void testJS223GroovyHappyPath()", "class_method_signature": "GeneralScriptHandlerTest.testJS223GroovyHappyPath()", "testcase": true, "constructor": false, "invocations": ["createHandler", "setFunction", "setPayload", "build", "add", "createObjectBuilder", "put", "put", "put", "setProperties", "handle", "assertEquals", "tString(\"", "tPayload()"]}, "focal_class": {"identifier": "GeneralScriptHandler", "superclass": "extends JsonBasedFunctionHandler", "interfaces": "", "fields": [], "methods": [{"identifier": "handle", "parameters": "(Input<JsonObject> input)", "modifiers": "@Override public", "return": "Output<JsonObject>", "signature": "Output<JsonObject> handle(Input<JsonObject> input)", "full_signature": "@Override public Output<JsonObject> handle(Input<JsonObject> input)", "class_method_signature": "GeneralScriptHandler.handle(Input<JsonObject> input)", "testcase": false, "constructor": false}], "file": "step-functions-plugins/step-functions-plugins-java/step-functions-plugins-java-handler/src/main/java/step/plugins/java/handler/GeneralScriptHandler.java"}, "focal_method": {"identifier": "handle", "parameters": "(Input<JsonObject> input)", "modifiers": "@Override public", "return": "Output<JsonObject>", "body": "@Override\n\tpublic Output<JsonObject> handle(Input<JsonObject> input) throws Exception {\n\t\t// Using the forked to branch in order no to have the ClassLoader of java-plugin-handler.jar as parent.\n\t\t// the project java-plugin-handler.jar has many dependencies that might conflict with the dependencies of the \n\t\t// keyword. One of these dependencies is guava for example.\n\t\tpushLocalApplicationContext(FORKED_BRANCH, getCurrentContext().getClassLoader(), \"step-functions-plugins-java-keyword-handler.jar\");\n\t\t\n\t\tpushRemoteApplicationContext(FORKED_BRANCH, ScriptHandler.PLUGIN_LIBRARIES_FILE, input.getProperties());\n\t\t\n\t\tpushRemoteApplicationContext(FORKED_BRANCH, ScriptHandler.LIBRARIES_FILE, input.getProperties());\n\t\t\n\t\tString scriptLanguage = input.getProperties().get(ScriptHandler.SCRIPT_LANGUAGE);\n\t\tClass<?> handlerClass = scriptLanguage.equals(\"java\")?JavaJarHandler.class:ScriptHandler.class;\n\t\treturn delegate(handlerClass.getName(), input);\t\t\n\t}", "signature": "Output<JsonObject> handle(Input<JsonObject> input)", "full_signature": "@Override public Output<JsonObject> handle(Input<JsonObject> input)", "class_method_signature": "GeneralScriptHandler.handle(Input<JsonObject> input)", "testcase": false, "constructor": false, "invocations": ["pushLocalApplicationContext", "getClassLoader", "getCurrentContext", "pushRemoteApplicationContext", "getProperties", "pushRemoteApplicationContext", "getProperties", "get", "getProperties", "equals", "delegate", "getName"]}, "repository": {"repo_id": 62342369, "url": "https://github.com/exense/step", "stars": 12, "created": "6/30/2016 9:08:29 PM +00:00", "updates": "2020-01-24T17:13:24+00:00", "fork": "False", "license": "licensed"}}