{"test_class": {"identifier": "SlotValuesArgumentResolverTest", "superclass": "", "interfaces": "", "fields": [{"original_string": "private SlotValuesArgumentResolver resolver = new SlotValuesArgumentResolver();", "modifier": "private", "type": "SlotValuesArgumentResolver", "declarator": "resolver = new SlotValuesArgumentResolver()", "var_name": "resolver"}, {"original_string": "@Mock\n    SkillContext mockSkillContext;", "modifier": "@Mock", "type": "SkillContext", "declarator": "mockSkillContext", "var_name": "mockSkillContext"}], "file": "ask-sdk-mvc/src/test/java/com/amazon/ask/mvc/argument/SlotValuesArgumentResolverTest.java"}, "test_case": {"identifier": "testSupportAndResolve", "parameters": "()", "modifiers": "@Test public", "return": "void", "body": "@Test\n    public void testSupportAndResolve() throws NoSuchMethodException {\n        Method method = MappingsController.class.getMethod(\"handleSlotValues\", new Class[]{Map.class});\n        MethodParameter methodParameter = new MethodParameter(\n                method,\n                0,\n                Map.class,\n                method.getParameterAnnotations()[0]\n        );\n\n        RequestEnvelope envelope = Utils.buildSimpleEnvelope(\"intent\");\n        ArgumentResolverContext input = new ArgumentResolverContext(mockSkillContext, methodParameter, HandlerInput.builder().withRequestEnvelope(envelope).build());\n\n        assertEquals(Collections.singletonMap(\"GREETING\", \"hola\"), resolver.resolve(input).get());\n    }", "signature": "void testSupportAndResolve()", "full_signature": "@Test public void testSupportAndResolve()", "class_method_signature": "SlotValuesArgumentResolverTest.testSupportAndResolve()", "testcase": true, "constructor": false, "invocations": ["getMethod", "getParameterAnnotations", "buildSimpleEnvelope", "build", "withRequestEnvelope", "builder", "assertEquals", "singletonMap", "get", "resolve"]}, "focal_class": {"identifier": "SlotValuesArgumentResolver", "superclass": "", "interfaces": "implements ArgumentResolver", "fields": [], "methods": [{"identifier": "resolve", "parameters": "(ArgumentResolverContext input)", "modifiers": "@Override public", "return": "Optional<Object>", "signature": "Optional<Object> resolve(ArgumentResolverContext input)", "full_signature": "@Override public Optional<Object> resolve(ArgumentResolverContext input)", "class_method_signature": "SlotValuesArgumentResolver.resolve(ArgumentResolverContext input)", "testcase": false, "constructor": false}], "file": "ask-sdk-mvc/src/main/java/com/amazon/ask/mvc/argument/SlotValuesArgumentResolver.java"}, "focal_method": {"identifier": "resolve", "parameters": "(ArgumentResolverContext input)", "modifiers": "@Override public", "return": "Optional<Object>", "body": "@Override\n    public Optional<Object> resolve(ArgumentResolverContext input) {\n        if (input.requestTypeEquals(IntentRequest.class)\n            && input.parameterTypeEquals(Map.class)\n            && input.getMethodParameter().findAnnotation(SlotValues.class).isPresent()) {\n\n            IntentRequest request = (IntentRequest) input.unwrapRequest();\n\n\n            return Optional.of(request.getIntent()\n                .getSlots().entrySet().stream()\n                .collect(Collectors.toMap(Map.Entry::getKey, e -> e.getValue().getValue())));\n        } else {\n            return Optional.empty();\n        }\n    }", "signature": "Optional<Object> resolve(ArgumentResolverContext input)", "full_signature": "@Override public Optional<Object> resolve(ArgumentResolverContext input)", "class_method_signature": "SlotValuesArgumentResolver.resolve(ArgumentResolverContext input)", "testcase": false, "constructor": false, "invocations": ["requestTypeEquals", "parameterTypeEquals", "isPresent", "findAnnotation", "getMethodParameter", "unwrapRequest", "of", "collect", "stream", "entrySet", "getSlots", "getIntent", "toMap", "getValue", "getValue", "empty"]}, "repository": {"repo_id": 143249569, "url": "https://github.com/amazon-archives/ask-sdk-frameworks-java", "language": "Java", "is_fork": false, "fork_count": 12, "stargazer_count": 12, "size": 313, "license": "licensed"}}