{"test_class": {"identifier": "SlotArgumentResolverTest", "superclass": "", "interfaces": "", "fields": [{"original_string": "private SlotArgumentResolver resolver = new SlotArgumentResolver();", "modifier": "private", "type": "SlotArgumentResolver", "declarator": "resolver = new SlotArgumentResolver()", "var_name": "resolver"}, {"original_string": "@Mock\n    SkillContext mockSkillContext;", "modifier": "@Mock", "type": "SkillContext", "declarator": "mockSkillContext", "var_name": "mockSkillContext"}], "file": "ask-sdk-mvc/src/test/java/com/amazon/ask/mvc/argument/SlotArgumentResolverTest.java"}, "test_case": {"identifier": "testDoesntSupport", "parameters": "()", "modifiers": "@Test public", "return": "void", "body": "@Test\n    public void testDoesntSupport() throws NoSuchMethodException {\n        MethodParameter methodParameter = new MethodParameter(\n                this.getClass().getMethod(\"testSupportAndResolve\"),\n                0,\n                Object.class, //<---- wrong class\n                MethodParameter.EMPTY_ANNOTATIONS\n        );\n\n        RequestEnvelope envelope = Utils.buildSimpleEnvelope(\"intent\");\n        ArgumentResolverContext input = new ArgumentResolverContext(mockSkillContext, methodParameter, HandlerInput.builder().withRequestEnvelope(envelope).build());\n\n        assertFalse(resolver.resolve(input).isPresent());\n    }", "signature": "void testDoesntSupport()", "full_signature": "@Test public void testDoesntSupport()", "class_method_signature": "SlotArgumentResolverTest.testDoesntSupport()", "testcase": true, "constructor": false, "invocations": ["getMethod", "getClass", "buildSimpleEnvelope", "build", "withRequestEnvelope", "builder", "assertFalse", "isPresent", "resolve"]}, "focal_class": {"identifier": "SlotArgumentResolver", "superclass": "", "interfaces": "implements ArgumentResolver", "fields": [], "methods": [{"identifier": "resolve", "parameters": "(ArgumentResolverContext input)", "modifiers": "@Override public", "return": "Optional<Object>", "signature": "Optional<Object> resolve(ArgumentResolverContext input)", "full_signature": "@Override public Optional<Object> resolve(ArgumentResolverContext input)", "class_method_signature": "SlotArgumentResolver.resolve(ArgumentResolverContext input)", "testcase": false, "constructor": false}], "file": "ask-sdk-mvc/src/main/java/com/amazon/ask/mvc/argument/SlotArgumentResolver.java"}, "focal_method": {"identifier": "resolve", "parameters": "(ArgumentResolverContext input)", "modifiers": "@Override public", "return": "Optional<Object>", "body": "@Override\n    public Optional<Object> resolve(ArgumentResolverContext input) {\n        if (input.requestTypeEquals(IntentRequest.class)\n            && input.parameterTypeEquals(Slot.class)\n            && input.getMethodParameter().findAnnotation(com.amazon.ask.mvc.annotation.argument.Slot.class).isPresent()) {\n\n            String slotName = input.getMethodParameter().findAnnotation(com.amazon.ask.mvc.annotation.argument.Slot.class).get().value();\n            IntentRequest request = (IntentRequest) input.unwrapRequest();\n            return Optional.of(request.getIntent().getSlots().get(slotName));\n        }\n        return Optional.empty();\n    }", "signature": "Optional<Object> resolve(ArgumentResolverContext input)", "full_signature": "@Override public Optional<Object> resolve(ArgumentResolverContext input)", "class_method_signature": "SlotArgumentResolver.resolve(ArgumentResolverContext input)", "testcase": false, "constructor": false, "invocations": ["requestTypeEquals", "parameterTypeEquals", "isPresent", "findAnnotation", "getMethodParameter", "value", "get", "findAnnotation", "getMethodParameter", "unwrapRequest", "of", "get", "getSlots", "getIntent", "empty"]}, "repository": {"repo_id": 143249569, "url": "https://github.com/amazon-archives/ask-sdk-frameworks-java", "language": "Java", "is_fork": false, "fork_count": 12, "stargazer_count": 12, "size": 313, "license": "licensed"}}