{"test_class": {"identifier": "CubeWerxStrategyTest", "superclass": "", "interfaces": "", "fields": [{"original_string": "private static CubeWerxStrategy strategy;", "modifier": "private static", "type": "CubeWerxStrategy", "declarator": "strategy", "var_name": "strategy"}], "file": "modules/unsupported/wfs/src/test/java/org/geotools/data/wfs/v1_1_0/CubeWerxStrategyTest.java"}, "test_case": {"identifier": "testCreateGetFeatureRequest", "parameters": "()", "modifiers": "@Test public", "return": "void", "body": "@Test\n    public void testCreateGetFeatureRequest() throws IOException {\n        GetFeature query = new GetFeatureQueryAdapter(new Query(\n                CUBEWERX_GOVUNITCE.FEATURETYPENAME), \"GML2\", \"EPSG:4326\", ResultType.RESULTS);\n        RequestComponents getFeatureRequest = strategy.createGetFeatureRequest(wfs, query);\n        GetFeatureType serverRequest = getFeatureRequest.getServerRequest();\n        ResultTypeType resultType = serverRequest.getResultType();\n        assertNull(resultType);\n        Map<String, String> kvpParameters = getFeatureRequest.getKvpParameters();\n        assertNull(kvpParameters.get(\"RESULTTYPE\"));\n    }", "signature": "void testCreateGetFeatureRequest()", "full_signature": "@Test public void testCreateGetFeatureRequest()", "class_method_signature": "CubeWerxStrategyTest.testCreateGetFeatureRequest()", "testcase": true, "constructor": false, "invocations": ["createGetFeatureRequest", "getServerRequest", "getResultType", "assertNull", "getKvpParameters", "assertNull", "get"]}, "focal_class": {"identifier": "CubeWerxStrategy", "superclass": "extends DefaultWFSStrategy", "interfaces": "", "fields": [], "methods": [{"identifier": "createGetFeatureRequest", "parameters": "(WFSProtocol wfs, GetFeature query)", "modifiers": "@SuppressWarnings(\"nls\") @Override public", "return": "RequestComponents", "signature": "RequestComponents createGetFeatureRequest(WFSProtocol wfs, GetFeature query)", "full_signature": "@SuppressWarnings(\"nls\") @Override public RequestComponents createGetFeatureRequest(WFSProtocol wfs, GetFeature query)", "class_method_signature": "CubeWerxStrategy.createGetFeatureRequest(WFSProtocol wfs, GetFeature query)", "testcase": false, "constructor": false}, {"identifier": "splitFilters", "parameters": "(final Capabilities caps, final Filter queryFilter)", "modifiers": "@Override public", "return": "Filter[]", "signature": "Filter[] splitFilters(final Capabilities caps, final Filter queryFilter)", "full_signature": "@Override public Filter[] splitFilters(final Capabilities caps, final Filter queryFilter)", "class_method_signature": "CubeWerxStrategy.splitFilters(final Capabilities caps, final Filter queryFilter)", "testcase": false, "constructor": false}], "file": "modules/unsupported/wfs/src/main/java/org/geotools/data/wfs/v1_1_0/CubeWerxStrategy.java"}, "focal_method": {"identifier": "createGetFeatureRequest", "parameters": "(WFSProtocol wfs, GetFeature query)", "modifiers": "@SuppressWarnings(\"nls\") @Override public", "return": "RequestComponents", "body": "@SuppressWarnings(\"nls\")\n    @Override\n    public RequestComponents createGetFeatureRequest(WFSProtocol wfs, GetFeature query)\n            throws IOException {\n        RequestComponents parts = super.createGetFeatureRequest(wfs, query);\n\n        GetFeatureType serverRequest = parts.getServerRequest();\n        serverRequest.setResultType(null);\n        parts.setServerRequest(serverRequest);\n\n        GetFeatureType nonResultTypeRequest = new CubeWerxGetFeatureType();\n        EMFUtils.copy(serverRequest, nonResultTypeRequest);\n        // CubeWerx fails if the _mandatory_ resultType attribute is sent\n        nonResultTypeRequest.setResultType(null);\n        parts.setServerRequest(nonResultTypeRequest);\n\n        parts.getKvpParameters().remove(\"RESULTTYPE\");\n\n        return parts;\n    }", "signature": "RequestComponents createGetFeatureRequest(WFSProtocol wfs, GetFeature query)", "full_signature": "@SuppressWarnings(\"nls\") @Override public RequestComponents createGetFeatureRequest(WFSProtocol wfs, GetFeature query)", "class_method_signature": "CubeWerxStrategy.createGetFeatureRequest(WFSProtocol wfs, GetFeature query)", "testcase": false, "constructor": false, "invocations": ["createGetFeatureRequest", "getServerRequest", "setResultType", "setServerRequest", "copy", "setResultType", "setServerRequest", "remove", "getKvpParameters"]}, "repository": {"repo_id": 40735368, "url": "https://github.com/FUNCATE/geotools-android", "language": "Java", "is_fork": false, "fork_count": 2, "stargazer_count": 8, "size": 63952, "license": "licensed"}}