{"test_class": {"identifier": "NumberTypeTest", "superclass": "", "interfaces": "", "fields": [{"original_string": "private NumberType type = new NumberType();", "modifier": "private", "type": "NumberType", "declarator": "type = new NumberType()", "var_name": "type"}], "file": "smartparam-engine/src/test/java/org/smartparam/engine/types/number/NumberTypeTest.java"}, "test_case": {"identifier": "testConvert", "parameters": "()", "modifiers": "@Test public", "return": "void", "body": "@Test\n    public void testConvert() {\n\n        // przypadki testowe: [argument (Object)][oczekiwana wartosc holdera (BigDecimal)]\n        Object[][] testCases = {\n            {new Long(17), new BigDecimal(\"17\")},\n            {new Integer(50), new BigDecimal(\"50\")},\n            {new Double(0.12345), new BigDecimal(0.12345)},\n            {new Float(0.12345), new BigDecimal(0.12345f)},\n            {(byte) 100, new BigDecimal(100)},\n            {(short) 2000, new BigDecimal(2000)},\n            {(float) 123, new BigDecimal(123f)},\n            {null, null},\n            {\"\", null},\n            {\" \", null},\n            {\"123,45\", new BigDecimal(\"123.45\")},\n            {new BigInteger(\"1234\"), new BigDecimal(1234)},\n            {new BigDecimal(\"00.12\"), new BigDecimal(\"00.12\")},\n            {String.valueOf(Long.MIN_VALUE), new BigDecimal(Long.MIN_VALUE)},\n            {String.valueOf(Long.MAX_VALUE), new BigDecimal(Long.MAX_VALUE)}\n        };\n\n        // wykonanie testow\n        for (Object[] testCase : testCases) {\n            Object obj = testCase[0];\n            BigDecimal expectedValue = (BigDecimal) testCase[1];\n\n            assertEquals(expectedValue, type.convert(obj).getBigDecimal());\n            assertEquals(expectedValue, type.convert(obj).getValue());\n        }\n    }", "signature": "void testConvert()", "full_signature": "@Test public void testConvert()", "class_method_signature": "NumberTypeTest.testConvert()", "testcase": true, "constructor": false, "invocations": ["valueOf", "valueOf", "assertEquals", "getBigDecimal", "convert", "assertEquals", "getValue", "convert"]}, "focal_class": {"identifier": "NumberType", "superclass": "", "interfaces": "implements Type<NumberHolder>", "fields": [{"original_string": "public static final String TYPE_NAME = \"number\";", "modifier": "public static final", "type": "String", "declarator": "TYPE_NAME = \"number\"", "var_name": "TYPE_NAME"}], "methods": [{"identifier": "encode", "parameters": "(NumberHolder value)", "modifiers": "@Override public", "return": "String", "signature": "String encode(NumberHolder value)", "full_signature": "@Override public String encode(NumberHolder value)", "class_method_signature": "NumberType.encode(NumberHolder value)", "testcase": false, "constructor": false}, {"identifier": "decode", "parameters": "(String text)", "modifiers": "@Override public", "return": "NumberHolder", "signature": "NumberHolder decode(String text)", "full_signature": "@Override public NumberHolder decode(String text)", "class_method_signature": "NumberType.decode(String text)", "testcase": false, "constructor": false}, {"identifier": "convert", "parameters": "(Object obj)", "modifiers": "@Override public", "return": "NumberHolder", "signature": "NumberHolder convert(Object obj)", "full_signature": "@Override public NumberHolder convert(Object obj)", "class_method_signature": "NumberType.convert(Object obj)", "testcase": false, "constructor": false}, {"identifier": "newArray", "parameters": "(int size)", "modifiers": "@Override public", "return": "NumberHolder[]", "signature": "NumberHolder[] newArray(int size)", "full_signature": "@Override public NumberHolder[] newArray(int size)", "class_method_signature": "NumberType.newArray(int size)", "testcase": false, "constructor": false}, {"identifier": "parse", "parameters": "(String str)", "modifiers": "private", "return": "BigDecimal", "signature": "BigDecimal parse(String str)", "full_signature": "private BigDecimal parse(String str)", "class_method_signature": "NumberType.parse(String str)", "testcase": false, "constructor": false}], "file": "smartparam-engine/src/main/java/org/smartparam/engine/types/number/NumberType.java"}, "focal_method": {"identifier": "convert", "parameters": "(Object obj)", "modifiers": "@Override public", "return": "NumberHolder", "body": "@Override\n    public NumberHolder convert(Object obj) {\n\n        if (obj instanceof Number) {\n            Number n = (Number) obj;\n            BigDecimal result;\n\n            if (n instanceof Double || n instanceof Float) {\n                result = new BigDecimal(n.doubleValue());\n            } else if (n instanceof BigDecimal) {\n                result = (BigDecimal) n;\n            } else if (n instanceof BigInteger) {\n                result = new BigDecimal((BigInteger) n);\n            } else {\n                result = new BigDecimal(n.longValue());\n            }\n\n            return new NumberHolder(result);\n        }\n\n        if (obj == null) {\n            return new NumberHolder(null);\n        }\n\n        if (obj instanceof String) {\n            return decode((String) obj);\n        }\n\n        throw new IllegalArgumentException(\"conversion not supported for: \" + obj.getClass());\n    }", "signature": "NumberHolder convert(Object obj)", "full_signature": "@Override public NumberHolder convert(Object obj)", "class_method_signature": "NumberType.convert(Object obj)", "testcase": false, "constructor": false, "invocations": ["doubleValue", "longValue", "decode", "getClass"]}, "repository": {"repo_id": 15057951, "url": "https://github.com/smartparam/smartparam", "language": "Java", "is_fork": false, "fork_count": 6, "stargazer_count": 27, "size": 2358, "license": "licensed"}}