{"test_class": {"identifier": "TimerValuesTest", "superclass": "", "interfaces": "", "fields": [], "file": "poseidas/src/test/java/de/governikus/eumw/poseidas/server/timer/TimerValuesTest.java"}, "test_case": {"identifier": "testGetDeltaBlacklistRate", "parameters": "()", "modifiers": "@Test", "return": "void", "body": "@Test\n  void testGetDeltaBlacklistRate()\n  {\n    TimerValues timerValues = new TimerValues();\n    String deltaBlacklistRate = timerValues.getDeltaBlacklistRate(null);\n    final String defaultRate = String.valueOf(2 * TimerValues.HOUR);\n    Assertions.assertEquals(defaultRate, deltaBlacklistRate);\n\n    TimerConfigurationType timerConfiguration = new TimerConfigurationType();\n    deltaBlacklistRate = timerValues.getDeltaBlacklistRate(timerConfiguration);\n    Assertions.assertEquals(defaultRate, deltaBlacklistRate);\n\n    TimerType blackListTimer = new TimerType();\n    blackListTimer.setUnit(Calendar.MINUTE);\n    blackListTimer.setLength(30);\n    timerConfiguration.setBlacklistRenewal(blackListTimer);\n    deltaBlacklistRate = timerValues.getDeltaBlacklistRate(timerConfiguration);\n    Assertions.assertEquals(String.valueOf(30 * 60 * 1000), deltaBlacklistRate);\n  }", "signature": "void testGetDeltaBlacklistRate()", "full_signature": "@Test void testGetDeltaBlacklistRate()", "class_method_signature": "TimerValuesTest.testGetDeltaBlacklistRate()", "testcase": true, "constructor": false, "invocations": ["getDeltaBlacklistRate", "valueOf", "assertEquals", "getDeltaBlacklistRate", "assertEquals", "setUnit", "setLength", "setBlacklistRenewal", "getDeltaBlacklistRate", "assertEquals", "valueOf"]}, "focal_class": {"identifier": "TimerValues", "superclass": "", "interfaces": "", "fields": [{"original_string": "static final long SECOND = 1000;", "modifier": "static final", "type": "long", "declarator": "SECOND = 1000", "var_name": "SECOND"}, {"original_string": "static final long MINUTE = SECOND * 60;", "modifier": "static final", "type": "long", "declarator": "MINUTE = SECOND * 60", "var_name": "MINUTE"}, {"original_string": "static final long HOUR = MINUTE * 60;", "modifier": "static final", "type": "long", "declarator": "HOUR = MINUTE * 60", "var_name": "HOUR"}], "methods": [{"identifier": "getTimerConfiguration", "parameters": "()", "modifiers": "@Bean", "return": "TimerConfigurationType", "signature": "TimerConfigurationType getTimerConfiguration()", "full_signature": "@Bean TimerConfigurationType getTimerConfiguration()", "class_method_signature": "TimerValues.getTimerConfiguration()", "testcase": false, "constructor": false}, {"identifier": "getUnitOfTime", "parameters": "(int unitFromXML)", "modifiers": "private static", "return": "long", "signature": "long getUnitOfTime(int unitFromXML)", "full_signature": "private static long getUnitOfTime(int unitFromXML)", "class_method_signature": "TimerValues.getUnitOfTime(int unitFromXML)", "testcase": false, "constructor": false}, {"identifier": "getFullBlacklistRate", "parameters": "()", "modifiers": "@Bean public", "return": "String", "signature": "String getFullBlacklistRate()", "full_signature": "@Bean public String getFullBlacklistRate()", "class_method_signature": "TimerValues.getFullBlacklistRate()", "testcase": false, "constructor": false}, {"identifier": "getDeltaBlacklistRate", "parameters": "(TimerConfigurationType timerConfiguration)", "modifiers": "@Bean public", "return": "String", "signature": "String getDeltaBlacklistRate(TimerConfigurationType timerConfiguration)", "full_signature": "@Bean public String getDeltaBlacklistRate(TimerConfigurationType timerConfiguration)", "class_method_signature": "TimerValues.getDeltaBlacklistRate(TimerConfigurationType timerConfiguration)", "testcase": false, "constructor": false}, {"identifier": "getCVCRate", "parameters": "(TimerConfigurationType timerConfiguration)", "modifiers": "@Bean public", "return": "String", "signature": "String getCVCRate(TimerConfigurationType timerConfiguration)", "full_signature": "@Bean public String getCVCRate(TimerConfigurationType timerConfiguration)", "class_method_signature": "TimerValues.getCVCRate(TimerConfigurationType timerConfiguration)", "testcase": false, "constructor": false}, {"identifier": "getMasterDefectRate", "parameters": "(TimerConfigurationType timerConfiguration)", "modifiers": "@Bean public", "return": "String", "signature": "String getMasterDefectRate(TimerConfigurationType timerConfiguration)", "full_signature": "@Bean public String getMasterDefectRate(TimerConfigurationType timerConfiguration)", "class_method_signature": "TimerValues.getMasterDefectRate(TimerConfigurationType timerConfiguration)", "testcase": false, "constructor": false}, {"identifier": "getCrlRate", "parameters": "(TimerConfigurationType timerConfiguration)", "modifiers": "@Bean public", "return": "String", "signature": "String getCrlRate(TimerConfigurationType timerConfiguration)", "full_signature": "@Bean public String getCrlRate(TimerConfigurationType timerConfiguration)", "class_method_signature": "TimerValues.getCrlRate(TimerConfigurationType timerConfiguration)", "testcase": false, "constructor": false}, {"identifier": "getKeyLockRate", "parameters": "()", "modifiers": "@Bean public", "return": "String", "signature": "String getKeyLockRate()", "full_signature": "@Bean public String getKeyLockRate()", "class_method_signature": "TimerValues.getKeyLockRate()", "testcase": false, "constructor": false}, {"identifier": "logRateForTimer", "parameters": "(String timerName, String rate)", "modifiers": "private", "return": "void", "signature": "void logRateForTimer(String timerName, String rate)", "full_signature": "private void logRateForTimer(String timerName, String rate)", "class_method_signature": "TimerValues.logRateForTimer(String timerName, String rate)", "testcase": false, "constructor": false}], "file": "poseidas/src/main/java/de/governikus/eumw/poseidas/server/timer/TimerValues.java"}, "focal_method": {"identifier": "getDeltaBlacklistRate", "parameters": "(TimerConfigurationType timerConfiguration)", "modifiers": "@Bean public", "return": "String", "body": "@Bean\n  public String getDeltaBlacklistRate(TimerConfigurationType timerConfiguration)\n  {\n    String timerName = \"Delta blacklist renewal\";\n\n    // Check for configuration value\n    if (timerConfiguration != null && timerConfiguration.getBlacklistRenewal() != null)\n    {\n      TimerType blacklistRenewal = timerConfiguration.getBlacklistRenewal();\n      if (blacklistRenewal.getUnit() != 0 && blacklistRenewal.getLength() != 0)\n      {\n        String rate = String.valueOf(getUnitOfTime(blacklistRenewal.getUnit())\n                                     * blacklistRenewal.getLength());\n        logRateForTimer(timerName, rate);\n        return rate;\n      }\n    }\n\n    // Set default value for every 2 hours\n    String rate = String.valueOf(2 * HOUR);\n    logRateForTimer(timerName, rate);\n    return rate;\n  }", "signature": "String getDeltaBlacklistRate(TimerConfigurationType timerConfiguration)", "full_signature": "@Bean public String getDeltaBlacklistRate(TimerConfigurationType timerConfiguration)", "class_method_signature": "TimerValues.getDeltaBlacklistRate(TimerConfigurationType timerConfiguration)", "testcase": false, "constructor": false, "invocations": ["getBlacklistRenewal", "getBlacklistRenewal", "getUnit", "getLength", "valueOf", "getUnitOfTime", "getUnit", "getLength", "logRateForTimer", "valueOf", "logRateForTimer"]}, "repository": {"repo_id": 133799133, "url": "https://github.com/Governikus/eidas-middleware", "language": "Java", "is_fork": false, "fork_count": 11, "stargazer_count": 15, "size": 2286, "license": "licensed"}}