{"test_class": {"identifier": "RefreshOperationTest", "superclass": "", "interfaces": "", "fields": [{"original_string": "private GraphElementFactory graphElementFactory;", "modifier": "private", "type": "GraphElementFactory", "declarator": "graphElementFactory", "var_name": "graphElementFactory"}, {"original_string": "@Mock\n    private Connection connection;", "modifier": "@Mock\n    private", "type": "Connection", "declarator": "connection", "var_name": "connection"}, {"original_string": "@Spy\n    private RefreshOperation operation;", "modifier": "@Spy\n    private", "type": "RefreshOperation", "declarator": "operation", "var_name": "operation"}], "file": "neo4j/src/test/java/eu/drus/jpa/unit/neo4j/operation/RefreshOperationTest.java"}, "test_case": {"identifier": "testExecute", "parameters": "()", "modifiers": "@Test public", "return": "void", "body": "@Test\n    public void testExecute() throws Exception {\n        // GIVEN\n        final Node n1 = graphElementFactory.createNode(\"n1\", Arrays.asList(\"A\"),\n                ImmutableMap.<String, Object>builder().put(\"id\", 1l).put(\"value\", \"A\").build());\n        final Node n2 = graphElementFactory.createNode(\"n2\", Arrays.asList(\"A\"),\n                ImmutableMap.<String, Object>builder().put(\"id\", 2l).build());\n        final Edge e1 = graphElementFactory.createEdge(n1, n2, \"e1\", Arrays.asList(\"E\"),\n                ImmutableMap.<String, Object>builder().put(\"id\", 3l).put(\"value\", \"C\").build());\n\n        final Graph<Node, Edge> graph = new DefaultDirectedGraph<>(new ClassBasedEdgeFactory<>(Edge.class));\n        graph.addVertex(n1);\n        graph.addVertex(n2);\n        graph.addEdge(e1.getSourceNode(), e1.getTargetNode(), e1);\n\n        // WHEN\n        operation.execute(connection, graph);\n\n        // THEN\n        final ArgumentCaptor<String> queryCaptor = ArgumentCaptor.forClass(String.class);\n        verify(operation, times(3)).executeQuery(eq(connection), queryCaptor.capture());\n        final List<String> queries = queryCaptor.getAllValues();\n        assertThat(queries.get(0), containsString(\"MERGE (n1:A {id:1}) SET n1.value=\\\"A\\\"\"));\n        assertThat(queries.get(1), containsString(\"MERGE (n2:A {id:2})\"));\n        assertThat(queries.get(2), containsString(\"MATCH (n1:A {id:1}),(n2:A {id:2}) MERGE (n1)-[e1:E]->(n2) SET e1.id=3,e1.value=\\\"C\\\"\"));\n    }", "signature": "void testExecute()", "full_signature": "@Test public void testExecute()", "class_method_signature": "RefreshOperationTest.testExecute()", "testcase": true, "constructor": false, "invocations": ["createNode", "asList", "build", "put", "put", "builder", "createNode", "asList", "build", "put", "builder", "createEdge", "asList", "build", "put", "put", "builder", "addVertex", "addVertex", "addEdge", "getSourceNode", "getTargetNode", "execute", "forClass", "executeQuery", "verify", "times", "eq", "capture", "getAllValues", "assertThat", "get", "containsString", "assertThat", "get", "containsString", "assertThat", "get", "containsString"]}, "focal_class": {"identifier": "RefreshOperation", "superclass": "extends AbstractNeo4JOperation", "interfaces": "", "fields": [], "methods": [{"identifier": "execute", "parameters": "(final Connection connection, final Graph<Node, Edge> graph)", "modifiers": "@Override public", "return": "void", "signature": "void execute(final Connection connection, final Graph<Node, Edge> graph)", "full_signature": "@Override public void execute(final Connection connection, final Graph<Node, Edge> graph)", "class_method_signature": "RefreshOperation.execute(final Connection connection, final Graph<Node, Edge> graph)", "testcase": false, "constructor": false}], "file": "neo4j/src/main/java/eu/drus/jpa/unit/neo4j/operation/RefreshOperation.java"}, "focal_method": {"identifier": "execute", "parameters": "(final Connection connection, final Graph<Node, Edge> graph)", "modifiers": "@Override public", "return": "void", "body": "@Override\n    public void execute(final Connection connection, final Graph<Node, Edge> graph) throws SQLException {\n        for (final Node node : graph.vertexSet()) {\n\n            final List<SetExpression> attributes = node.getAttributes().stream().filter(a -> !a.isId())\n                    .map(a -> property(identifier(node.getId()).property(a.getName()), literal(a.getValue()))).collect(toList());\n\n            final UpdateNext query = merge(node.toPath().withIdAttributes().build()).set(attributes);\n\n            executeQuery(connection, query.toString());\n        }\n\n        for (final Edge edge : graph.edgeSet()) {\n            final Node sourceNode = edge.getSourceNode();\n            final Node targetNode = edge.getTargetNode();\n\n            final List<SetExpression> attributes = edge.getAttributes().stream()\n                    .map(a -> property(identifier(edge.getId()).property(a.getName()), literal(a.getValue()))).collect(toList());\n\n            final UpdateNext query = match(sourceNode.toPath().withIdAttributes().build(), targetNode.toPath().withIdAttributes().build())\n                    .merge(edge.toPath().build()).set(attributes);\n\n            executeQuery(connection, query.toString());\n        }\n    }", "signature": "void execute(final Connection connection, final Graph<Node, Edge> graph)", "full_signature": "@Override public void execute(final Connection connection, final Graph<Node, Edge> graph)", "class_method_signature": "RefreshOperation.execute(final Connection connection, final Graph<Node, Edge> graph)", "testcase": false, "constructor": false, "invocations": ["vertexSet", "collect", "map", "filter", "stream", "getAttributes", "isId", "property", "property", "identifier", "getId", "getName", "literal", "getValue", "toList", "set", "merge", "build", "withIdAttributes", "toPath", "executeQuery", "toString", "edgeSet", "getSourceNode", "getTargetNode", "collect", "map", "stream", "getAttributes", "property", "property", "identifier", "getId", "getName", "literal", "getValue", "toList", "set", "merge", "match", "build", "withIdAttributes", "toPath", "build", "withIdAttributes", "toPath", "build", "toPath", "executeQuery", "toString"]}, "repository": {"repo_id": 52435170, "url": "https://github.com/dadrus/jpa-unit", "language": "Java", "is_fork": false, "fork_count": 7, "stargazer_count": 24, "size": 1190, "license": "licensed"}}