{"test_class": {"identifier": "ServiceClassParserTest", "superclass": "", "interfaces": "", "fields": [{"original_string": "private ServiceClassParser serviceClassParser;", "modifier": "private", "type": "ServiceClassParser", "declarator": "serviceClassParser", "var_name": "serviceClassParser"}, {"original_string": "private TypescriptServiceGeneratorConfiguration settings;", "modifier": "private", "type": "TypescriptServiceGeneratorConfiguration", "declarator": "settings", "var_name": "settings"}], "file": "typescript-service-generator-core/src/test/java/com/palantir/code/ts/generator/ServiceClassParserTest.java"}, "test_case": {"identifier": "parseComplexClassTest", "parameters": "()", "modifiers": "@Test public", "return": "void", "body": "@Test\n    public void parseComplexClassTest() throws NoSuchMethodException, SecurityException {\n        ServiceModel model = serviceClassParser.parseServiceClass(TestComplexServiceClass.class, settings);\n        assertEquals(1, model.innerServiceModels().size());\n        Type genericReturnType = TestComplexServiceClass.class.getMethod(\"allOptionsPost\", String.class, Integer.class, DataObject.class).getGenericReturnType();\n        assertEquals(ImmutableSet.of(Boolean.class, ImmutablesObject.class, MyObject.class, GenericObject.class, Integer.class, String.class, DataObject.class, genericReturnType), model.referencedTypes());\n        assertEquals(\"TestComplexServiceClass\", model.name());\n        assertEquals(\"testComplexService\", model.innerServiceModels().get(0).servicePath());\n        List<ServiceEndpointModel> endpoints = Lists.newArrayList();\n        {\n            ServiceEndpointParameterModel aParam = ImmutableServiceEndpointParameterModel.builder().pathParam(\"a\").javaType(String.class).tsType(TsType.String).build();\n            ServiceEndpointParameterModel bParam = ImmutableServiceEndpointParameterModel.builder().queryParam(\"b\").javaType(Integer.class).tsType(TsType.Number).build();\n            ServiceEndpointParameterModel dataParam = ImmutableServiceEndpointParameterModel.builder().javaType(DataObject.class).tsType(new TsType.ReferenceType(new Symbol(\"DataObject\"))).build();\n            endpoints.add(ImmutableServiceEndpointModel.builder().javaReturnType(genericReturnType)\n                                                                 .tsReturnType(new TsType.ReferenceType(new Symbol(\"GenericObject<MyObject>\")))\n                                                                 .parameters(Lists.newArrayList(aParam, dataParam, bParam))\n                                                                 .endpointName(\"allOptionsPost\")\n                                                                 .endpointPath(\"allOptionsPost/{a}\")\n                                                                 .endpointMethodType(\"POST\")\n                                                                 .endpointRequestMediaType(MediaType.APPLICATION_JSON)\n                                                                 .build());\n        }\n        {\n            ServiceEndpointParameterModel xParam = ImmutableServiceEndpointParameterModel.builder().queryParam(\"x\").javaType(Boolean.class).tsType(TsType.Boolean).build();\n            endpoints.add(ImmutableServiceEndpointModel.builder().javaReturnType(MyObject.class)\n                                                                 .tsReturnType(new TsType.ReferenceType(new Symbol(\"MyObject\")))\n                                                                 .parameters(Lists.newArrayList(xParam))\n                                                                 .endpointName(\"queryGetter\")\n                                                                 .endpointPath(\"queryGetter\")\n                                                                 .endpointMethodType(\"GET\")\n                                                                 .build());\n        }\n        {\n            ServiceEndpointParameterModel dataParam = ImmutableServiceEndpointParameterModel.builder().javaType(DataObject.class).tsType(new TsType.ReferenceType(new Symbol(\"DataObject\"))).build();\n            endpoints.add(ImmutableServiceEndpointModel.builder().javaReturnType(ImmutablesObject.class)\n                                                                 .tsReturnType(new TsType.ReferenceType(new Symbol(\"ImmutablesObject\")))\n                                                                 .parameters(Lists.newArrayList(dataParam))\n                                                                 .endpointName(\"simplePut\")\n                                                                 .endpointPath(\"simplePut\")\n                                                                 .endpointMethodType(\"PUT\")\n                                                                 .build());\n        }\n        // To string because TsType has no equals method\n        assertEquals(endpoints.toString(), model.innerServiceModels().get(0).endpointModels().toString());\n    }", "signature": "void parseComplexClassTest()", "full_signature": "@Test public void parseComplexClassTest()", "class_method_signature": "ServiceClassParserTest.parseComplexClassTest()", "testcase": true, "constructor": false, "invocations": ["parseServiceClass", "assertEquals", "size", "innerServiceModels", "getGenericReturnType", "getMethod", "assertEquals", "of", "referencedTypes", "assertEquals", "name", "assertEquals", "servicePath", "get", "innerServiceModels", "newArrayList", "build", "tsType", "javaType", "pathParam", "builder", "build", "tsType", "javaType", "queryParam", "builder", "build", "tsType", "javaType", "builder", "add", "build", "endpointRequestMediaType", "endpointMethodType", "endpointPath", "endpointName", "parameters", "tsReturnType", "javaReturnType", "builder", "newArrayList", "build", "tsType", "javaType", "queryParam", "builder", "add", "build", "endpointMethodType", "endpointPath", "endpointName", "parameters", "tsReturnType", "javaReturnType", "builder", "newArrayList", "build", "tsType", "javaType", "builder", "add", "build", "endpointMethodType", "endpointPath", "endpointName", "parameters", "tsReturnType", "javaReturnType", "builder", "newArrayList", "assertEquals", "toString", "toString", "endpointModels", "get", "innerServiceModels"]}, "focal_class": {"identifier": "ServiceClassParser", "superclass": "", "interfaces": "", "fields": [{"original_string": "@SuppressWarnings(\"unchecked\")\n    private final static List<Class<? extends Annotation>> ANNOTATION_CLASSES = Lists.newArrayList(POST.class, GET.class, DELETE.class, PUT.class, OPTIONS.class);", "modifier": "@SuppressWarnings(\"unchecked\")\n    private final static", "type": "List<Class<? extends Annotation>>", "declarator": "ANNOTATION_CLASSES = Lists.newArrayList(POST.class, GET.class, DELETE.class, PUT.class, OPTIONS.class)", "var_name": "ANNOTATION_CLASSES"}], "methods": [{"identifier": "getAllServiceMethods", "parameters": "(Class<?> serviceClass, MethodFilter methodFilter)", "modifiers": "public", "return": "Set<Method>", "signature": "Set<Method> getAllServiceMethods(Class<?> serviceClass, MethodFilter methodFilter)", "full_signature": "public Set<Method> getAllServiceMethods(Class<?> serviceClass, MethodFilter methodFilter)", "class_method_signature": "ServiceClassParser.getAllServiceMethods(Class<?> serviceClass, MethodFilter methodFilter)", "testcase": false, "constructor": false}, {"identifier": "parseServiceClass", "parameters": "(Class<?> mainServiceClass, TypescriptServiceGeneratorConfiguration settings, Class<?>... serviceClassesToMerge)", "modifiers": "public", "return": "ServiceModel", "signature": "ServiceModel parseServiceClass(Class<?> mainServiceClass, TypescriptServiceGeneratorConfiguration settings, Class<?>... serviceClassesToMerge)", "full_signature": "public ServiceModel parseServiceClass(Class<?> mainServiceClass, TypescriptServiceGeneratorConfiguration settings, Class<?>... serviceClassesToMerge)", "class_method_signature": "ServiceClassParser.parseServiceClass(Class<?> mainServiceClass, TypescriptServiceGeneratorConfiguration settings, Class<?>... serviceClassesToMerge)", "testcase": false, "constructor": false}, {"identifier": "computeEndpointModels", "parameters": "(Set<Method> endpoints, ModelCompiler compiler, TypescriptServiceGeneratorConfiguration settings)", "modifiers": "private static", "return": "List<ServiceEndpointModel>", "signature": "List<ServiceEndpointModel> computeEndpointModels(Set<Method> endpoints, ModelCompiler compiler, TypescriptServiceGeneratorConfiguration settings)", "full_signature": "private static List<ServiceEndpointModel> computeEndpointModels(Set<Method> endpoints, ModelCompiler compiler, TypescriptServiceGeneratorConfiguration settings)", "class_method_signature": "ServiceClassParser.computeEndpointModels(Set<Method> endpoints, ModelCompiler compiler, TypescriptServiceGeneratorConfiguration settings)", "testcase": false, "constructor": false}, {"identifier": "getMethodType", "parameters": "(Method endpoint)", "modifiers": "private static", "return": "String", "signature": "String getMethodType(Method endpoint)", "full_signature": "private static String getMethodType(Method endpoint)", "class_method_signature": "ServiceClassParser.getMethodType(Method endpoint)", "testcase": false, "constructor": false}, {"identifier": "getParamterAnnotationMaps", "parameters": "(Method endpoint)", "modifiers": "private static", "return": "List<Map<Class<?>, Annotation>>", "signature": "List<Map<Class<?>, Annotation>> getParamterAnnotationMaps(Method endpoint)", "full_signature": "private static List<Map<Class<?>, Annotation>> getParamterAnnotationMaps(Method endpoint)", "class_method_signature": "ServiceClassParser.getParamterAnnotationMaps(Method endpoint)", "testcase": false, "constructor": false}, {"identifier": "getTypesFromEndpoint", "parameters": "(Method endpoint, TypescriptServiceGeneratorConfiguration settings)", "modifiers": "private static", "return": "Set<Type>", "signature": "Set<Type> getTypesFromEndpoint(Method endpoint, TypescriptServiceGeneratorConfiguration settings)", "full_signature": "private static Set<Type> getTypesFromEndpoint(Method endpoint, TypescriptServiceGeneratorConfiguration settings)", "class_method_signature": "ServiceClassParser.getTypesFromEndpoint(Method endpoint, TypescriptServiceGeneratorConfiguration settings)", "testcase": false, "constructor": false}], "file": "typescript-service-generator-core/src/main/java/com/palantir/code/ts/generator/ServiceClassParser.java"}, "focal_method": {"identifier": "parseServiceClass", "parameters": "(Class<?> mainServiceClass, TypescriptServiceGeneratorConfiguration settings, Class<?>... serviceClassesToMerge)", "modifiers": "public", "return": "ServiceModel", "body": "public ServiceModel parseServiceClass(Class<?> mainServiceClass, TypescriptServiceGeneratorConfiguration settings, Class<?>... serviceClassesToMerge) {\n        List<Class<?>> serviceClazzes = Lists.newArrayList(mainServiceClass);\n        serviceClazzes.addAll(Lists.newArrayList(serviceClassesToMerge));\n        ImmutableServiceModel.Builder serviceModel = ImmutableServiceModel.builder();\n        serviceModel.name(mainServiceClass.getSimpleName());\n        for (Class<?> serviceClass : serviceClazzes) {\n            ImmutableInnerServiceModel.Builder innerServiceModel = ImmutableInnerServiceModel.builder();\n            Path servicePathAnnotation = serviceClass.getAnnotation(Path.class);\n            innerServiceModel.servicePath(servicePathAnnotation == null ? \"\" : PathUtils.trimSlashes(servicePathAnnotation.value()));\n            innerServiceModel.name(serviceClass.getSimpleName());\n\n            Set<Method> serviceMethods = getAllServiceMethods(serviceClass, settings.methodFilter());\n            // find and stores all types that are referenced by this service\n            Set<Type> referencedTypes = Sets.newHashSet();\n            for (Method method : serviceMethods) {\n                referencedTypes.addAll(getTypesFromEndpoint(method, settings));\n            }\n            serviceModel.addAllReferencedTypes(referencedTypes);\n\n            ModelCompiler compiler = new TypeScriptGenerator(settings.getSettings()).getModelCompiler();\n\n            List<ServiceEndpointModel> endpointModels = Lists.newArrayList();\n            endpointModels = computeEndpointModels(serviceMethods, compiler, settings);\n\n            Collections.sort(endpointModels);\n            innerServiceModel.endpointModels(endpointModels);\n            serviceModel.addInnerServiceModels(innerServiceModel.build());\n        }\n        return serviceModel.build();\n    }", "signature": "ServiceModel parseServiceClass(Class<?> mainServiceClass, TypescriptServiceGeneratorConfiguration settings, Class<?>... serviceClassesToMerge)", "full_signature": "public ServiceModel parseServiceClass(Class<?> mainServiceClass, TypescriptServiceGeneratorConfiguration settings, Class<?>... serviceClassesToMerge)", "class_method_signature": "ServiceClassParser.parseServiceClass(Class<?> mainServiceClass, TypescriptServiceGeneratorConfiguration settings, Class<?>... serviceClassesToMerge)", "testcase": false, "constructor": false, "invocations": ["newArrayList", "addAll", "newArrayList", "builder", "name", "getSimpleName", "builder", "getAnnotation", "servicePath", "trimSlashes", "value", "name", "getSimpleName", "getAllServiceMethods", "methodFilter", "newHashSet", "addAll", "getTypesFromEndpoint", "addAllReferencedTypes", "getModelCompiler", "getSettings", "newArrayList", "computeEndpointModels", "sort", "endpointModels", "addInnerServiceModels", "build", "build"]}, "repository": {"repo_id": 47846388, "url": "https://github.com/palantir/typescript-service-generator", "language": "Java", "is_fork": false, "fork_count": 11, "stargazer_count": 20, "size": 371, "license": "licensed"}}