{"test_class": {"identifier": "FieldNameValidatorTest", "superclass": "", "interfaces": "", "fields": [], "file": "conjure-core/src/test/java/com/palantir/conjure/defs/validator/FieldNameValidatorTest.java"}, "test_case": {"identifier": "testValidNames", "parameters": "()", "modifiers": "@Test public", "return": "void", "body": "@Test\n    public void testValidNames() {\n        FieldNameValidator.validate(FieldName.of(\"camel\"));\n        FieldNameValidator.validate(FieldName.of(\"camelCase\"));\n        FieldNameValidator.validate(FieldName.of(\"camelCase1\"));\n        FieldNameValidator.validate(FieldName.of(\"camel1Case2\"));\n        FieldNameValidator.validate(FieldName.of(\"kebab-case\"));\n        FieldNameValidator.validate(FieldName.of(\"kebab1-case123\"));\n        FieldNameValidator.validate(FieldName.of(\"snake_case\"));\n        FieldNameValidator.validate(FieldName.of(\"snake1_case123\"));\n        FieldNameValidator.validate(FieldName.of(\"xCoordinate\"));\n        FieldNameValidator.validate(FieldName.of(\"defaultXPosition\"));\n        FieldNameValidator.validate(FieldName.of(\"defaultX\"));\n    }", "signature": "void testValidNames()", "full_signature": "@Test public void testValidNames()", "class_method_signature": "FieldNameValidatorTest.testValidNames()", "testcase": true, "constructor": false, "invocations": ["validate", "of", "validate", "of", "validate", "of", "validate", "of", "validate", "of", "validate", "of", "validate", "of", "validate", "of", "validate", "of", "validate", "of", "validate", "of"]}, "focal_class": {"identifier": "FieldNameValidator", "superclass": "", "interfaces": "", "fields": [{"original_string": "private static final Logger log = LoggerFactory.getLogger(FieldNameValidator.class);", "modifier": "private static final", "type": "Logger", "declarator": "log = LoggerFactory.getLogger(FieldNameValidator.class)", "var_name": "log"}], "methods": [{"identifier": "FieldNameValidator", "parameters": "()", "modifiers": "private", "return": "", "signature": " FieldNameValidator()", "full_signature": "private  FieldNameValidator()", "class_method_signature": "FieldNameValidator.FieldNameValidator()", "testcase": false, "constructor": true}, {"identifier": "capitalize", "parameters": "(FieldName fieldName)", "modifiers": "public static", "return": "String", "signature": "String capitalize(FieldName fieldName)", "full_signature": "public static String capitalize(FieldName fieldName)", "class_method_signature": "FieldNameValidator.capitalize(FieldName fieldName)", "testcase": false, "constructor": false}, {"identifier": "toCase", "parameters": "(FieldName fieldName, CaseConverter.Case targetCase)", "modifiers": "public static", "return": "FieldName", "signature": "FieldName toCase(FieldName fieldName, CaseConverter.Case targetCase)", "full_signature": "public static FieldName toCase(FieldName fieldName, CaseConverter.Case targetCase)", "class_method_signature": "FieldNameValidator.toCase(FieldName fieldName, CaseConverter.Case targetCase)", "testcase": false, "constructor": false}, {"identifier": "validate", "parameters": "(FieldName fieldName)", "modifiers": "@SuppressWarnings(\"Slf4jLogsafeArgs\") public static", "return": "void", "signature": "void validate(FieldName fieldName)", "full_signature": "@SuppressWarnings(\"Slf4jLogsafeArgs\") public static void validate(FieldName fieldName)", "class_method_signature": "FieldNameValidator.validate(FieldName fieldName)", "testcase": false, "constructor": false}, {"identifier": "nameCase", "parameters": "(FieldName fieldName)", "modifiers": "private static", "return": "CaseConverter.Case", "signature": "CaseConverter.Case nameCase(FieldName fieldName)", "full_signature": "private static CaseConverter.Case nameCase(FieldName fieldName)", "class_method_signature": "FieldNameValidator.nameCase(FieldName fieldName)", "testcase": false, "constructor": false}], "file": "conjure-core/src/main/java/com/palantir/conjure/defs/validator/FieldNameValidator.java"}, "focal_method": {"identifier": "validate", "parameters": "(FieldName fieldName)", "modifiers": "@SuppressWarnings(\"Slf4jLogsafeArgs\") public static", "return": "void", "body": "@SuppressWarnings(\"Slf4jLogsafeArgs\")\n    public static void validate(FieldName fieldName) {\n        Preconditions.checkArgument(\n                CaseConverter.CAMEL_CASE_PATTERN.matcher(fieldName.get()).matches()\n                        || CaseConverter.KEBAB_CASE_PATTERN\n                                .matcher(fieldName.get())\n                                .matches()\n                        || CaseConverter.SNAKE_CASE_PATTERN\n                                .matcher(fieldName.get())\n                                .matches(),\n                \"FieldName \\\"%s\\\" must follow one of the following patterns: %s\",\n                fieldName,\n                Arrays.toString(CaseConverter.Case.values()));\n\n        if (!CaseConverter.CAMEL_CASE_PATTERN.matcher(fieldName.get()).matches()) {\n            log.warn(\n                    \"{} should be specified in lowerCamelCase. kebab-case and snake_case are supported for \"\n                            + \"legacy endpoints only: {}\",\n                    FieldName.class,\n                    fieldName.get());\n        }\n    }", "signature": "void validate(FieldName fieldName)", "full_signature": "@SuppressWarnings(\"Slf4jLogsafeArgs\") public static void validate(FieldName fieldName)", "class_method_signature": "FieldNameValidator.validate(FieldName fieldName)", "testcase": false, "constructor": false, "invocations": ["checkArgument", "matches", "matcher", "get", "matches", "matcher", "get", "matches", "matcher", "get", "toString", "values", "matches", "matcher", "get", "warn", "get"]}, "repository": {"repo_id": 134616422, "url": "https://github.com/palantir/conjure", "stars": 211, "created": "5/23/2018 7:28:43 PM +00:00", "updates": "2020-01-24T17:51:52+00:00", "fork": "False", "license": "licensed"}}