{"test_class": {"identifier": "CloudShellCredentialTest", "superclass": "", "interfaces": "", "fields": [], "file": "google-api-client/src/test/java/com/google/api/client/googleapis/auth/oauth2/CloudShellCredentialTest.java"}, "test_case": {"identifier": "refreshAccessToken", "parameters": "()", "modifiers": "@Test public", "return": "void", "body": "@Test\n  public void refreshAccessToken() throws IOException{\n    final ServerSocket authSocket = new ServerSocket(0);\n    Runnable serverTask =\n        new Runnable() {\n          @Override\n          public void run() {\n            try {\n              Socket clientSocket = authSocket.accept();\n              BufferedReader input =\n                  new BufferedReader(new InputStreamReader(clientSocket.getInputStream()));\n              String lines = input.readLine();\n              lines += '\\n' + input.readLine();\n              assertEquals(CloudShellCredential.GET_AUTH_TOKEN_REQUEST, lines);\n\n              PrintWriter out =\n                  new PrintWriter(clientSocket.getOutputStream(), true);\n              out.println(\"32\\n[\\\"email\\\", \\\"project-id\\\", \\\"token\\\", 1234]\");\n            } catch (Exception reThrown) {\n              throw new RuntimeException(reThrown);\n            }\n          }\n        };\n    Thread serverThread = new Thread(serverTask);\n    serverThread.start();\n\n    GoogleCredential creds = new CloudShellCredential(\n        authSocket.getLocalPort(), GsonFactory.getDefaultInstance());\n    assertEquals(\"token\", creds.executeRefreshToken().getAccessToken());\n  }", "signature": "void refreshAccessToken()", "full_signature": "@Test public void refreshAccessToken()", "class_method_signature": "CloudShellCredentialTest.refreshAccessToken()", "testcase": true, "constructor": false, "invocations": ["accept", "getInputStream", "readLine", "readLine", "assertEquals", "getOutputStream", "println", "start", "getLocalPort", "getDefaultInstance", "assertEquals", "getAccessToken", "executeRefreshToken"]}, "focal_class": {"identifier": "CloudShellCredential", "superclass": "extends GoogleCredential", "interfaces": "", "fields": [{"original_string": "private static final int ACCESS_TOKEN_INDEX = 2;", "modifier": "private static final", "type": "int", "declarator": "ACCESS_TOKEN_INDEX = 2", "var_name": "ACCESS_TOKEN_INDEX"}, {"original_string": "private static final int READ_TIMEOUT_MS = 5000;", "modifier": "private static final", "type": "int", "declarator": "READ_TIMEOUT_MS = 5000", "var_name": "READ_TIMEOUT_MS"}, {"original_string": "protected static final String GET_AUTH_TOKEN_REQUEST = \"2\\n[]\";", "modifier": "protected static final", "type": "String", "declarator": "GET_AUTH_TOKEN_REQUEST = \"2\\n[]\"", "var_name": "GET_AUTH_TOKEN_REQUEST"}, {"original_string": "private final int authPort;", "modifier": "private final", "type": "int", "declarator": "authPort", "var_name": "authPort"}, {"original_string": "private final JsonFactory jsonFactory;", "modifier": "private final", "type": "JsonFactory", "declarator": "jsonFactory", "var_name": "jsonFactory"}], "methods": [{"identifier": "CloudShellCredential", "parameters": "(int authPort, JsonFactory jsonFactory)", "modifiers": "public", "return": "", "signature": " CloudShellCredential(int authPort, JsonFactory jsonFactory)", "full_signature": "public  CloudShellCredential(int authPort, JsonFactory jsonFactory)", "class_method_signature": "CloudShellCredential.CloudShellCredential(int authPort, JsonFactory jsonFactory)", "testcase": false, "constructor": true}, {"identifier": "getAuthPort", "parameters": "()", "modifiers": "protected", "return": "int", "signature": "int getAuthPort()", "full_signature": "protected int getAuthPort()", "class_method_signature": "CloudShellCredential.getAuthPort()", "testcase": false, "constructor": false}, {"identifier": "executeRefreshToken", "parameters": "()", "modifiers": "@Override protected", "return": "TokenResponse", "signature": "TokenResponse executeRefreshToken()", "full_signature": "@Override protected TokenResponse executeRefreshToken()", "class_method_signature": "CloudShellCredential.executeRefreshToken()", "testcase": false, "constructor": false}], "file": "google-api-client/src/main/java/com/google/api/client/googleapis/auth/oauth2/CloudShellCredential.java"}, "focal_method": {"identifier": "executeRefreshToken", "parameters": "()", "modifiers": "@Override protected", "return": "TokenResponse", "body": "@Override\n  protected TokenResponse executeRefreshToken()\n      throws IOException {\n    Socket socket = new Socket(\"localhost\", this.getAuthPort());\n    socket.setSoTimeout(READ_TIMEOUT_MS);\n    TokenResponse token = new TokenResponse();\n    try {\n      PrintWriter out =\n        new PrintWriter(socket.getOutputStream(), true);\n      out.println(GET_AUTH_TOKEN_REQUEST);\n\n      BufferedReader input =\n          new BufferedReader(new InputStreamReader(socket.getInputStream()));\n      // Ignore the size line\n      input.readLine();\n\n      Collection<Object> messageArray = jsonFactory.createJsonParser(input)\n        .parseArray(LinkedList.class, Object.class);\n      String accessToken = ((List<Object>) messageArray).get(ACCESS_TOKEN_INDEX).toString();\n      token.setAccessToken(accessToken);\n    } finally {\n      socket.close();\n    }\n    return token;\n  }", "signature": "TokenResponse executeRefreshToken()", "full_signature": "@Override protected TokenResponse executeRefreshToken()", "class_method_signature": "CloudShellCredential.executeRefreshToken()", "testcase": false, "constructor": false, "invocations": ["getAuthPort", "setSoTimeout", "getOutputStream", "println", "getInputStream", "readLine", "parseArray", "createJsonParser", "toString", "get", "setAccessToken", "close"]}, "repository": {"repo_id": 25881432, "url": "https://github.com/googleapis/google-api-java-client", "stars": 887, "created": "10/28/2014 5:31:34 PM +00:00", "updates": "2020-01-27T06:06:03+00:00", "fork": "False", "license": "licensed"}}