{"test_class": {"identifier": "JcrPropertiesTest", "superclass": "extends ProgressCheckTestBase", "interfaces": "", "fields": [], "file": "core/src/test/java/net/adamcin/oakpal/core/checks/JcrPropertiesTest.java"}, "test_case": {"identifier": "testPropertyValueDeny", "parameters": "()", "modifiers": "@Test public", "return": "void", "body": "@Test\n    public void testPropertyValueDeny() throws Exception {\n        File playground = TestPackageUtil.prepareTestPackageFromFolder(\"playground.zip\",\n                new File(\"src/test/resources/jcr_prop_constraints_playground\"));\n        TestUtil.testBlock(() -> {\n            ProgressCheck check = new JcrProperties().newInstance(obj()\n                    // intend to only check /apps/acme by ensuring scopePaths excludes /apps/aperture, which has the\n                    // same jcr:title value\n                    .key(\"scopePaths\", arr(new Rule(RuleType.INCLUDE, Pattern.compile(\"/apps/acme\"))))\n                    .key(\"properties\", arr()\n                            .val(obj()\n                                    .key(\"name\", \"jcr:title\")\n                                    .key(\"valueRules\", arr(new Rule(RuleType.DENY, Pattern.compile(\"Acme\"))))\n                            )\n                    )\n                    .get());\n            CheckReport report = scanWithCheck(check, playground);\n            Assert.assertEquals(\"one violation: \" + report.getViolations(), 1, report.getViolations().size());\n        });\n        TestUtil.testBlock(() -> {\n            ProgressCheck check = new JcrProperties().newInstance(obj()\n                    .key(\"properties\", arr()\n                            .val(obj()\n                                    .key(\"name\", \"multiString\")\n                                    .key(\"valueRules\", arr(new Rule(RuleType.DENY, Pattern.compile(\"two\"))))\n                            )\n                    )\n                    .get());\n            CheckReport report = scanWithCheck(check, playground);\n            Assert.assertEquals(\"two violation: \" + report.getViolations(), 2, report.getViolations().size());\n        });\n    }", "signature": "void testPropertyValueDeny()", "full_signature": "@Test public void testPropertyValueDeny()", "class_method_signature": "JcrPropertiesTest.testPropertyValueDeny()", "testcase": true, "constructor": false, "invocations": ["prepareTestPackageFromFolder", "testBlock", "newInstance", "get", "key", "key", "obj", "arr", "compile", "val", "arr", "key", "key", "obj", "arr", "compile", "scanWithCheck", "assertEquals", "getViolations", "size", "getViolations", "testBlock", "newInstance", "get", "key", "obj", "val", "arr", "key", "key", "obj", "arr", "compile", "scanWithCheck", "assertEquals", "getViolations", "size", "getViolations"]}, "focal_class": {"identifier": "JcrProperties", "superclass": "", "interfaces": "implements ProgressCheckFactory", "fields": [{"original_string": "private static final JsonKeys KEYS = new JsonKeys() {\n        @Override\n        public String scopePaths() {\n            return \"scopePaths\";\n        }\n\n        @Override\n        public String denyNodeTypes() {\n            return \"denyNodeTypes\";\n        }\n\n        @Override\n        public String scopeNodeTypes() {\n            return \"scopeNodeTypes\";\n        }\n\n        @Override\n        public String properties() {\n            return \"properties\";\n        }\n    };", "modifier": "private static final", "type": "JsonKeys", "declarator": "KEYS = new JsonKeys() {\n        @Override\n        public String scopePaths() {\n            return \"scopePaths\";\n        }\n\n        @Override\n        public String denyNodeTypes() {\n            return \"denyNodeTypes\";\n        }\n\n        @Override\n        public String scopeNodeTypes() {\n            return \"scopeNodeTypes\";\n        }\n\n        @Override\n        public String properties() {\n            return \"properties\";\n        }\n    }", "var_name": "KEYS"}, {"original_string": "@Deprecated\n    public static final String CONFIG_SCOPE_PATHS = keys().scopePaths();", "modifier": "@Deprecated\n    public static final", "type": "String", "declarator": "CONFIG_SCOPE_PATHS = keys().scopePaths()", "var_name": "CONFIG_SCOPE_PATHS"}, {"original_string": "@Deprecated\n    public static final String CONFIG_DENY_NODE_TYPES = keys().denyNodeTypes();", "modifier": "@Deprecated\n    public static final", "type": "String", "declarator": "CONFIG_DENY_NODE_TYPES = keys().denyNodeTypes()", "var_name": "CONFIG_DENY_NODE_TYPES"}, {"original_string": "@Deprecated\n    public static final String CONFIG_SCOPE_NODE_TYPES = keys().scopeNodeTypes();", "modifier": "@Deprecated\n    public static final", "type": "String", "declarator": "CONFIG_SCOPE_NODE_TYPES = keys().scopeNodeTypes()", "var_name": "CONFIG_SCOPE_NODE_TYPES"}, {"original_string": "@Deprecated\n    public static final String CONFIG_PROPERTIES = keys().properties();", "modifier": "@Deprecated\n    public static final", "type": "String", "declarator": "CONFIG_PROPERTIES = keys().properties()", "var_name": "CONFIG_PROPERTIES"}], "methods": [{"identifier": "keys", "parameters": "()", "modifiers": "@NotNull public static", "return": "JsonKeys", "signature": "JsonKeys keys()", "full_signature": "@NotNull public static JsonKeys keys()", "class_method_signature": "JcrProperties.keys()", "testcase": false, "constructor": false}, {"identifier": "newInstance", "parameters": "(final JsonObject config)", "modifiers": "@Override public", "return": "ProgressCheck", "signature": "ProgressCheck newInstance(final JsonObject config)", "full_signature": "@Override public ProgressCheck newInstance(final JsonObject config)", "class_method_signature": "JcrProperties.newInstance(final JsonObject config)", "testcase": false, "constructor": false}], "file": "core/src/main/java/net/adamcin/oakpal/core/checks/JcrProperties.java"}, "focal_method": {"identifier": "newInstance", "parameters": "(final JsonObject config)", "modifiers": "@Override public", "return": "ProgressCheck", "body": "@Override\n    public ProgressCheck newInstance(final JsonObject config) {\n        List<Rule> pathScope = Rules.fromJsonArray(arrayOrEmpty(config, keys().scopePaths()));\n\n        List<String> denyNodeTypes = mapArrayOfStrings(arrayOrEmpty(config, keys().denyNodeTypes()));\n        List<String> nodeTypeScope = mapArrayOfStrings(arrayOrEmpty(config, keys().scopeNodeTypes()));\n        final ResourceBundleHolder resourceBundleHolder = new ResourceBundleHolder();\n        List<JcrPropertyConstraints> propertyChecks = JcrPropertyConstraints\n                .fromJsonArray(resourceBundleHolder::getResourceBundle, arrayOrEmpty(config, keys().properties()));\n        return new Check(pathScope, denyNodeTypes, nodeTypeScope, propertyChecks, resourceBundleHolder);\n    }", "signature": "ProgressCheck newInstance(final JsonObject config)", "full_signature": "@Override public ProgressCheck newInstance(final JsonObject config)", "class_method_signature": "JcrProperties.newInstance(final JsonObject config)", "testcase": false, "constructor": false, "invocations": ["fromJsonArray", "arrayOrEmpty", "scopePaths", "keys", "mapArrayOfStrings", "arrayOrEmpty", "denyNodeTypes", "keys", "mapArrayOfStrings", "arrayOrEmpty", "scopeNodeTypes", "keys", "fromJsonArray", "arrayOrEmpty", "properties", "keys"]}, "repository": {"repo_id": 155883728, "url": "https://github.com/adamcin/oakpal", "language": "Java", "is_fork": false, "fork_count": 6, "stargazer_count": 6, "size": 13349, "license": "licensed"}}