{"test_class": {"identifier": "SafeObserverTest", "superclass": "", "interfaces": "", "fields": [{"original_string": "static final Disposable THROWING_DISPOSABLE = new Disposable() {\n\n        @Override\n        public boolean isDisposed() {\n            // TODO Auto-generated method stub\n            return false;\n        }\n\n        @Override\n        public void dispose() {\n            // break contract by throwing exception\n            throw new SafeObserverTestException(\"failure from unsubscribe\");\n        }\n    };", "modifier": "static final", "type": "Disposable", "declarator": "THROWING_DISPOSABLE = new Disposable() {\n\n        @Override\n        public boolean isDisposed() {\n            // TODO Auto-generated method stub\n            return false;\n        }\n\n        @Override\n        public void dispose() {\n            // break contract by throwing exception\n            throw new SafeObserverTestException(\"failure from unsubscribe\");\n        }\n    }", "var_name": "THROWING_DISPOSABLE"}], "file": "rxjava/src/test/java/io/reactivex/observers/SafeObserverTest.java"}, "test_case": {"identifier": "onErrorFailureSafe", "parameters": "()", "modifiers": "@Test @Ignore(\"Observers can't throw\") public", "return": "void", "body": "@Test\n    @Ignore(\"Observers can't throw\")\n    public void onErrorFailureSafe() {\n        try {\n            new SafeObserver<String>(OBSERVER_ONERROR_FAIL()).onError(new SafeObserverTestException(\"error!\"));\n            fail(\"expects exception to be thrown\");\n        } catch (Exception e) {\n            e.printStackTrace();\n            assertTrue(e instanceof RuntimeException);\n            assertEquals(\"Error occurred when trying to propagate error to Observer.onError\", e.getMessage());\n\n            Throwable e2 = e.getCause();\n            assertTrue(e2 instanceof CompositeException);\n            List<Throwable> innerExceptions = ((CompositeException) e2).getExceptions();\n            assertEquals(2, innerExceptions.size());\n\n            Throwable e3 = innerExceptions.get(0);\n            assertTrue(e3 instanceof SafeObserverTestException);\n            assertEquals(\"error!\", e3.getMessage());\n\n            Throwable e4 = innerExceptions.get(1);\n            assertTrue(e4 instanceof SafeObserverTestException);\n            assertEquals(\"onErrorFail\", e4.getMessage());\n        }\n    }", "signature": "void onErrorFailureSafe()", "full_signature": "@Test @Ignore(\"Observers can't throw\") public void onErrorFailureSafe()", "class_method_signature": "SafeObserverTest.onErrorFailureSafe()", "testcase": true, "constructor": false, "invocations": ["onError", "OBSERVER_ONERROR_FAIL", "fail", "printStackTrace", "assertTrue", "assertEquals", "getMessage", "getCause", "assertTrue", "getExceptions", "assertEquals", "size", "get", "assertTrue", "assertEquals", "getMessage", "get", "assertTrue", "assertEquals", "getMessage"]}, "focal_class": {"identifier": "SafeObserver", "superclass": "", "interfaces": "implements Observer<T>, Disposable", "fields": [{"original_string": "final Observer<? super T> actual;", "modifier": "final", "type": "Observer<? super T>", "declarator": "actual", "var_name": "actual"}, {"original_string": "Disposable s;", "modifier": "", "type": "Disposable", "declarator": "s", "var_name": "s"}, {"original_string": "boolean done;", "modifier": "", "type": "boolean", "declarator": "done", "var_name": "done"}], "methods": [{"identifier": "SafeObserver", "parameters": "(@NonNull Observer<? super T> actual)", "modifiers": "public", "return": "", "signature": " SafeObserver(@NonNull Observer<? super T> actual)", "full_signature": "public  SafeObserver(@NonNull Observer<? super T> actual)", "class_method_signature": "SafeObserver.SafeObserver(@NonNull Observer<? super T> actual)", "testcase": false, "constructor": true}, {"identifier": "onSubscribe", "parameters": "(@NonNull Disposable s)", "modifiers": "@Override public", "return": "void", "signature": "void onSubscribe(@NonNull Disposable s)", "full_signature": "@Override public void onSubscribe(@NonNull Disposable s)", "class_method_signature": "SafeObserver.onSubscribe(@NonNull Disposable s)", "testcase": false, "constructor": false}, {"identifier": "dispose", "parameters": "()", "modifiers": "@Override public", "return": "void", "signature": "void dispose()", "full_signature": "@Override public void dispose()", "class_method_signature": "SafeObserver.dispose()", "testcase": false, "constructor": false}, {"identifier": "isDisposed", "parameters": "()", "modifiers": "@Override public", "return": "boolean", "signature": "boolean isDisposed()", "full_signature": "@Override public boolean isDisposed()", "class_method_signature": "SafeObserver.isDisposed()", "testcase": false, "constructor": false}, {"identifier": "onNext", "parameters": "(@NonNull T t)", "modifiers": "@Override public", "return": "void", "signature": "void onNext(@NonNull T t)", "full_signature": "@Override public void onNext(@NonNull T t)", "class_method_signature": "SafeObserver.onNext(@NonNull T t)", "testcase": false, "constructor": false}, {"identifier": "onNextNoSubscription", "parameters": "()", "modifiers": "", "return": "void", "signature": "void onNextNoSubscription()", "full_signature": " void onNextNoSubscription()", "class_method_signature": "SafeObserver.onNextNoSubscription()", "testcase": false, "constructor": false}, {"identifier": "onError", "parameters": "(@NonNull Throwable t)", "modifiers": "@Override public", "return": "void", "signature": "void onError(@NonNull Throwable t)", "full_signature": "@Override public void onError(@NonNull Throwable t)", "class_method_signature": "SafeObserver.onError(@NonNull Throwable t)", "testcase": false, "constructor": false}, {"identifier": "onComplete", "parameters": "()", "modifiers": "@Override public", "return": "void", "signature": "void onComplete()", "full_signature": "@Override public void onComplete()", "class_method_signature": "SafeObserver.onComplete()", "testcase": false, "constructor": false}, {"identifier": "onCompleteNoSubscription", "parameters": "()", "modifiers": "", "return": "void", "signature": "void onCompleteNoSubscription()", "full_signature": " void onCompleteNoSubscription()", "class_method_signature": "SafeObserver.onCompleteNoSubscription()", "testcase": false, "constructor": false}], "file": "rxjava/src/main/java/io/reactivex/observers/SafeObserver.java"}, "focal_method": {"identifier": "onError", "parameters": "(@NonNull Throwable t)", "modifiers": "@Override public", "return": "void", "body": "@Override\n    public void onError(@NonNull Throwable t) {\n        if (done) {\n            RxJavaPlugins.onError(t);\n            return;\n        }\n        done = true;\n\n        if (s == null) {\n            Throwable npe = new NullPointerException(\"Subscription not set!\");\n\n            try {\n                actual.onSubscribe(EmptyDisposable.INSTANCE);\n            } catch (Throwable e) {\n                Exceptions.throwIfFatal(e);\n                // can't call onError because the actual's state may be corrupt at this point\n                RxJavaPlugins.onError(new CompositeException(t, npe, e));\n                return;\n            }\n            try {\n                actual.onError(new CompositeException(t, npe));\n            } catch (Throwable e) {\n                Exceptions.throwIfFatal(e);\n                // if onError failed, all that's left is to report the error to plugins\n                RxJavaPlugins.onError(new CompositeException(t, npe, e));\n            }\n            return;\n        }\n\n        if (t == null) {\n            t = new NullPointerException(\"onError called with null. Null values are generally not allowed in 2.x operators and sources.\");\n        }\n\n        try {\n            actual.onError(t);\n        } catch (Throwable ex) {\n            Exceptions.throwIfFatal(ex);\n\n            RxJavaPlugins.onError(new CompositeException(t, ex));\n        }\n    }", "signature": "void onError(@NonNull Throwable t)", "full_signature": "@Override public void onError(@NonNull Throwable t)", "class_method_signature": "SafeObserver.onError(@NonNull Throwable t)", "testcase": false, "constructor": false, "invocations": ["onError", "onSubscribe", "throwIfFatal", "onError", "onError", "throwIfFatal", "onError", "onError", "throwIfFatal", "onError"]}, "repository": {"repo_id": 128274093, "url": "https://github.com/artem-zinnatullin/error-prone-performance", "language": "Java", "is_fork": false, "fork_count": 1, "stargazer_count": 13, "size": 22484, "license": "licensed"}}