{"test_class": {"identifier": "SpringRestJobsServiceTest", "superclass": "", "interfaces": "", "fields": [{"original_string": "public static final String CALLBACK_URL = \"http://localhost\";", "modifier": "public static final", "type": "String", "declarator": "CALLBACK_URL = \"http://localhost\"", "var_name": "CALLBACK_URL"}, {"original_string": "public static final String JOB_SERVICE_URL = \"http://localhost:8085\";", "modifier": "public static final", "type": "String", "declarator": "JOB_SERVICE_URL = \"http://localhost:8085\"", "var_name": "JOB_SERVICE_URL"}, {"original_string": "private SpringRestJobsService tested;", "modifier": "private", "type": "SpringRestJobsService", "declarator": "tested", "var_name": "tested"}, {"original_string": "@Mock\n    private RestTemplate restTemplate;", "modifier": "@Mock\n    private", "type": "RestTemplate", "declarator": "restTemplate", "var_name": "restTemplate"}], "file": "addons/jobs/jobs-management-springboot-addon/src/test/java/org/kie/kogito/jobs/management/springboot/SpringRestJobsServiceTest.java"}, "test_case": {"identifier": "testScheduleProcessInstanceJob", "parameters": "()", "modifiers": "@Test", "return": "void", "body": "@Test\n    void testScheduleProcessInstanceJob() {\n        when(restTemplate.postForEntity(any(URI.class), any(Job.class), eq(String.class))).thenReturn(ResponseEntity.ok().build());\n        ProcessInstanceJobDescription processInstanceJobDescription = ProcessInstanceJobDescription.of(123,\n                                                                                                       ExactExpirationTime.now(),\n                                                                                                       \"processInstanceId\",\n                                                                                                       \"processId\");\n        tested.scheduleProcessInstanceJob(processInstanceJobDescription);\n        ArgumentCaptor<Job> jobArgumentCaptor = forClass(Job.class);\n        verify(restTemplate).postForEntity(eq(tested.getJobsServiceUri()),\n                                           jobArgumentCaptor.capture(),\n                                           eq(String.class));\n        Job job = jobArgumentCaptor.getValue();\n        assertThat(job.getId()).isEqualTo(processInstanceJobDescription.id());\n    }", "signature": "void testScheduleProcessInstanceJob()", "full_signature": "@Test void testScheduleProcessInstanceJob()", "class_method_signature": "SpringRestJobsServiceTest.testScheduleProcessInstanceJob()", "testcase": true, "constructor": false, "invocations": ["thenReturn", "when", "postForEntity", "any", "any", "eq", "build", "ok", "of", "now", "scheduleProcessInstanceJob", "forClass", "postForEntity", "verify", "eq", "getJobsServiceUri", "capture", "eq", "getValue", "isEqualTo", "assertThat", "getId", "id"]}, "focal_class": {"identifier": "SpringRestJobsService", "superclass": "extends RestJobsService", "interfaces": "", "fields": [{"original_string": "private static final Logger LOGGER = LoggerFactory.getLogger(SpringRestJobsService.class);", "modifier": "private static final", "type": "Logger", "declarator": "LOGGER = LoggerFactory.getLogger(SpringRestJobsService.class)", "var_name": "LOGGER"}, {"original_string": "private RestTemplate restTemplate;", "modifier": "private", "type": "RestTemplate", "declarator": "restTemplate", "var_name": "restTemplate"}], "methods": [{"identifier": "SpringRestJobsService", "parameters": "(\n            @Value(\"${kogito.jobs-service.url}\") String jobServiceUrl,\n            @Value(\"${kogito.service.url}\") String callbackEndpoint,\n            @Autowired(required=false) RestTemplate restTemplate)", "modifiers": "@Autowired public", "return": "", "signature": " SpringRestJobsService(\n            @Value(\"${kogito.jobs-service.url}\") String jobServiceUrl,\n            @Value(\"${kogito.service.url}\") String callbackEndpoint,\n            @Autowired(required=false) RestTemplate restTemplate)", "full_signature": "@Autowired public  SpringRestJobsService(\n            @Value(\"${kogito.jobs-service.url}\") String jobServiceUrl,\n            @Value(\"${kogito.service.url}\") String callbackEndpoint,\n            @Autowired(required=false) RestTemplate restTemplate)", "class_method_signature": "SpringRestJobsService.SpringRestJobsService(\n            @Value(\"${kogito.jobs-service.url}\") String jobServiceUrl,\n            @Value(\"${kogito.service.url}\") String callbackEndpoint,\n            @Autowired(required=false) RestTemplate restTemplate)", "testcase": false, "constructor": true}, {"identifier": "SpringRestJobsService", "parameters": "()", "modifiers": "", "return": "", "signature": " SpringRestJobsService()", "full_signature": "  SpringRestJobsService()", "class_method_signature": "SpringRestJobsService.SpringRestJobsService()", "testcase": false, "constructor": true}, {"identifier": "initialize", "parameters": "()", "modifiers": "@PostConstruct public", "return": "void", "signature": "void initialize()", "full_signature": "@PostConstruct public void initialize()", "class_method_signature": "SpringRestJobsService.initialize()", "testcase": false, "constructor": false}, {"identifier": "scheduleProcessJob", "parameters": "(ProcessJobDescription description)", "modifiers": "@Override public", "return": "String", "signature": "String scheduleProcessJob(ProcessJobDescription description)", "full_signature": "@Override public String scheduleProcessJob(ProcessJobDescription description)", "class_method_signature": "SpringRestJobsService.scheduleProcessJob(ProcessJobDescription description)", "testcase": false, "constructor": false}, {"identifier": "scheduleProcessInstanceJob", "parameters": "(ProcessInstanceJobDescription description)", "modifiers": "@Override public", "return": "String", "signature": "String scheduleProcessInstanceJob(ProcessInstanceJobDescription description)", "full_signature": "@Override public String scheduleProcessInstanceJob(ProcessInstanceJobDescription description)", "class_method_signature": "SpringRestJobsService.scheduleProcessInstanceJob(ProcessInstanceJobDescription description)", "testcase": false, "constructor": false}, {"identifier": "cancelJob", "parameters": "(String id)", "modifiers": "@Override public", "return": "boolean", "signature": "boolean cancelJob(String id)", "full_signature": "@Override public boolean cancelJob(String id)", "class_method_signature": "SpringRestJobsService.cancelJob(String id)", "testcase": false, "constructor": false}, {"identifier": "getScheduledTime", "parameters": "(String id)", "modifiers": "@Override public", "return": "ZonedDateTime", "signature": "ZonedDateTime getScheduledTime(String id)", "full_signature": "@Override public ZonedDateTime getScheduledTime(String id)", "class_method_signature": "SpringRestJobsService.getScheduledTime(String id)", "testcase": false, "constructor": false}], "file": "addons/jobs/jobs-management-springboot-addon/src/main/java/org/kie/kogito/jobs/management/springboot/SpringRestJobsService.java"}, "focal_method": {"identifier": "scheduleProcessInstanceJob", "parameters": "(ProcessInstanceJobDescription description)", "modifiers": "@Override public", "return": "String", "body": "@Override\n    public String scheduleProcessInstanceJob(ProcessInstanceJobDescription description) {\n        String callback = getCallbackEndpoint(description);\n        LOGGER.debug(\"Job to be scheduled {} with callback URL {}\", description, callback);\n        Job job = JobBuilder.builder()\n                .id(description.id())\n                .expirationTime(description.expirationTime().get())\n                .repeatInterval(description.expirationTime().repeatInterval())\n                .repeatLimit(description.expirationTime().repeatLimit())\n                .priority(0)\n                .callbackEndpoint(callback)\n                .processId(description.processId())\n                .processInstanceId(description.processInstanceId())\n                .rootProcessId(description.rootProcessId())\n                .rootProcessInstanceId(description.rootProcessInstanceId())\n                .build();\n\n        ResponseEntity<String> result = restTemplate.postForEntity(getJobsServiceUri(),\n                                                                   job,\n                                                                   String.class);\n        if (result.getStatusCode().ordinal() == 200) {\n            LOGGER.debug(\"Creating of the job {} done with status code {} \", job, result.getStatusCode());\n        }\n        return job.getId();\n    }", "signature": "String scheduleProcessInstanceJob(ProcessInstanceJobDescription description)", "full_signature": "@Override public String scheduleProcessInstanceJob(ProcessInstanceJobDescription description)", "class_method_signature": "SpringRestJobsService.scheduleProcessInstanceJob(ProcessInstanceJobDescription description)", "testcase": false, "constructor": false, "invocations": ["getCallbackEndpoint", "debug", "build", "rootProcessInstanceId", "rootProcessId", "processInstanceId", "processId", "callbackEndpoint", "priority", "repeatLimit", "repeatInterval", "expirationTime", "id", "builder", "id", "get", "expirationTime", "repeatInterval", "expirationTime", "repeatLimit", "expirationTime", "processId", "processInstanceId", "rootProcessId", "rootProcessInstanceId", "postForEntity", "getJobsServiceUri", "ordinal", "getStatusCode", "debug", "getStatusCode", "getId"]}, "repository": {"repo_id": 174306645, "url": "https://github.com/kiegroup/kogito-runtimes", "stars": 78, "created": "3/7/2019 8:49:09 AM +00:00", "updates": "2020-01-26T20:41:49+00:00", "fork": "False", "license": "licensed"}}