{"test_class": {"identifier": "BuiltInCohortDefinitionLibrary1_10Test", "superclass": "", "interfaces": "", "fields": [{"original_string": "private BuiltInCohortDefinitionLibrary1_10 library;", "modifier": "private", "type": "BuiltInCohortDefinitionLibrary1_10", "declarator": "library", "var_name": "library"}], "file": "api-1.10/src/test/java/org/openmrs/module/reporting/cohort/definition/library/BuiltInCohortDefinitionLibrary1_10Test.java"}, "test_case": {"identifier": "testgetDrugOrderSearch", "parameters": "()", "modifiers": "@Test public", "return": "void", "body": "@Test\n    public void testgetDrugOrderSearch() throws Exception {\n        CohortDefinition drugOrderCohortDefinition = library.getDrugOrderSearch();\n        assertTrue(DrugOrderCohortDefinition.class.isAssignableFrom(drugOrderCohortDefinition.getClass()));\n        assertThat(drugOrderCohortDefinition, hasParameter(\"which\", Match.class));\n        assertThat(drugOrderCohortDefinition, hasParameter(\"drugConcepts\", Concept.class, List.class));\n        assertThat(drugOrderCohortDefinition, hasParameter(\"drugSets\", Concept.class, List.class));\n        assertThat(drugOrderCohortDefinition, hasParameter(\"activatedOnOrBefore\", Date.class));\n        assertThat(drugOrderCohortDefinition, hasParameter(\"activatedOnOrAfter\", Date.class));\n        assertThat(drugOrderCohortDefinition, hasParameter(\"activeOnOrBefore\", Date.class));\n        assertThat(drugOrderCohortDefinition, hasParameter(\"activeOnOrAfter\", Date.class));\n        assertThat(drugOrderCohortDefinition, hasParameter(\"activeOnDate\", Date.class));\n        assertThat(drugOrderCohortDefinition, hasParameter(\"careSetting\", CareSetting.class));\n        assertThat(drugOrderCohortDefinition, hasParameter(\"drugs\", Drug.class, List.class));\n    }", "signature": "void testgetDrugOrderSearch()", "full_signature": "@Test public void testgetDrugOrderSearch()", "class_method_signature": "BuiltInCohortDefinitionLibrary1_10Test.testgetDrugOrderSearch()", "testcase": true, "constructor": false, "invocations": ["getDrugOrderSearch", "assertTrue", "isAssignableFrom", "getClass", "assertThat", "hasParameter", "assertThat", "hasParameter", "assertThat", "hasParameter", "assertThat", "hasParameter", "assertThat", "hasParameter", "assertThat", "hasParameter", "assertThat", "hasParameter", "assertThat", "hasParameter", "assertThat", "hasParameter", "assertThat", "hasParameter"]}, "focal_class": {"identifier": "BuiltInCohortDefinitionLibrary1_10", "superclass": "extends BuiltInCohortDefinitionLibrary", "interfaces": "", "fields": [], "methods": [{"identifier": "getDrugOrderSearch", "parameters": "()", "modifiers": "@DocumentedDefinition(\"drugOrderSearch\") public", "return": "CohortDefinition", "signature": "CohortDefinition getDrugOrderSearch()", "full_signature": "@DocumentedDefinition(\"drugOrderSearch\") public CohortDefinition getDrugOrderSearch()", "class_method_signature": "BuiltInCohortDefinitionLibrary1_10.getDrugOrderSearch()", "testcase": false, "constructor": false}], "file": "api-1.10/src/main/java/org/openmrs/module/reporting/cohort/definition/library/BuiltInCohortDefinitionLibrary1_10.java"}, "focal_method": {"identifier": "getDrugOrderSearch", "parameters": "()", "modifiers": "@DocumentedDefinition(\"drugOrderSearch\") public", "return": "CohortDefinition", "body": "@DocumentedDefinition(\"drugOrderSearch\")\n    public CohortDefinition getDrugOrderSearch() {\n        CohortDefinition drugOrderCohortDefinition = new DrugOrderCohortDefinition();\n        drugOrderCohortDefinition.addParameter(new Parameter(\"which\", \"reporting.parameter.which\", Match.class));\n        drugOrderCohortDefinition.addParameter(new Parameter(\"drugConcepts\", \"reporting.parameter.drugConcepts\", Concept.class, List.class, null));\n        drugOrderCohortDefinition.addParameter(new Parameter(\"drugSets\", \"reporting.parameter.drugSets\", Concept.class, List.class, null));\n        drugOrderCohortDefinition.addParameter(new Parameter(\"activatedOnOrBefore\", \"reporting.parameter.activatedOnOrBefore\", Date.class));\n        drugOrderCohortDefinition.addParameter(new Parameter(\"activatedOnOrAfter\", \"reporting.parameter.activatedOnOrAfter\", Date.class));\n        drugOrderCohortDefinition.addParameter(new Parameter(\"activeOnOrBefore\", \"reporting.parameter.activeOnOrBefore\", Date.class));\n        drugOrderCohortDefinition.addParameter(new Parameter(\"activeOnOrAfter\", \"reporting.parameter.activeOnOrAfter\", Date.class));\n        drugOrderCohortDefinition.addParameter(new Parameter(\"activeOnDate\", \"reporting.parameter.activeOnDate\", Date.class));\n        drugOrderCohortDefinition.addParameter(new Parameter(\"careSetting\", \"reporting.parameter.careSetting\", CareSetting.class));\n        drugOrderCohortDefinition.addParameter(new Parameter(\"drugs\", \"reporting.parameter.drugs\", Drug.class, List.class, null));\n        return drugOrderCohortDefinition;\n    }", "signature": "CohortDefinition getDrugOrderSearch()", "full_signature": "@DocumentedDefinition(\"drugOrderSearch\") public CohortDefinition getDrugOrderSearch()", "class_method_signature": "BuiltInCohortDefinitionLibrary1_10.getDrugOrderSearch()", "testcase": false, "constructor": false, "invocations": ["addParameter", "addParameter", "addParameter", "addParameter", "addParameter", "addParameter", "addParameter", "addParameter", "addParameter", "addParameter"]}, "repository": {"repo_id": 4713588, "url": "https://github.com/openmrs/openmrs-module-reporting", "language": "Java", "is_fork": false, "fork_count": 206, "stargazer_count": 15, "size": 58709, "license": "licensed"}}