{"test_class": {"identifier": "StringsTest", "superclass": "", "interfaces": "", "fields": [], "file": "resources/src/test/java/org/jboss/hal/resources/StringsTest.java"}, "test_case": {"identifier": "abbreviateMiddle", "parameters": "()", "modifiers": "@Test public", "return": "void", "body": "@Test\n    public void abbreviateMiddle() throws Exception {\n        assertNull(Strings.abbreviateMiddle(null, 0));\n        assertNull(Strings.abbreviateMiddle(null, 1));\n        assertNull(Strings.abbreviateMiddle(null, 100));\n\n        assertEquals(\"\", Strings.abbreviateMiddle(\"\", 0));\n        assertEquals(\"\", Strings.abbreviateMiddle(\"\", 1));\n        assertEquals(\"\", Strings.abbreviateMiddle(\"\", 100));\n\n        assertEquals(\"\", Strings.abbreviateMiddle(\"foo\", 0));\n        assertEquals(\"f\", Strings.abbreviateMiddle(\"foo\", 1));\n        assertEquals(\"fo\", Strings.abbreviateMiddle(\"foo\", 2));\n        assertEquals(\"foo\", Strings.abbreviateMiddle(\"foo\", 3));\n        assertEquals(\"foo\", Strings.abbreviateMiddle(\"foo\", 4));\n        assertEquals(\"foo\", Strings.abbreviateMiddle(\"foo\", 100));\n\n        assertEquals(\"\", Strings.abbreviateMiddle(\"foobar\", 0));\n        assertEquals(\"f\", Strings.abbreviateMiddle(\"foobar\", 1));\n        assertEquals(\"fo\", Strings.abbreviateMiddle(\"foobar\", 2));\n        assertEquals(\"foo\", Strings.abbreviateMiddle(\"foobar\", 3));\n        assertEquals(\"f...\", Strings.abbreviateMiddle(\"foobar\", 4));\n        assertEquals(\"f...r\", Strings.abbreviateMiddle(\"foobar\", 5));\n        assertEquals(\"foobar\", Strings.abbreviateMiddle(\"foobar\", 6));\n        assertEquals(\"foobar\", Strings.abbreviateMiddle(\"foobar\", 7));\n        assertEquals(\"foobar\", Strings.abbreviateMiddle(\"foobar\", 100));\n\n        assertEquals(\"\", Strings.abbreviateMiddle(\"Lorem ipsum dolor sit amet\", 0));\n        assertEquals(\"L\", Strings.abbreviateMiddle(\"Lorem ipsum dolor sit amet\", 1));\n        assertEquals(\"Lore...met\", Strings.abbreviateMiddle(\"Lorem ipsum dolor sit amet\", 10));\n        assertEquals(\"Lorem ipsum dolor sit amet\", Strings.abbreviateMiddle(\"Lorem ipsum dolor sit amet\", 26));\n        assertEquals(\"Lorem ipsum dolor sit amet\", Strings.abbreviateMiddle(\"Lorem ipsum dolor sit amet\", 100));\n    }", "signature": "void abbreviateMiddle()", "full_signature": "@Test public void abbreviateMiddle()", "class_method_signature": "StringsTest.abbreviateMiddle()", "testcase": true, "constructor": false, "invocations": ["assertNull", "abbreviateMiddle", "assertNull", "abbreviateMiddle", "assertNull", "abbreviateMiddle", "assertEquals", "abbreviateMiddle", "assertEquals", "abbreviateMiddle", "assertEquals", "abbreviateMiddle", "assertEquals", "abbreviateMiddle", "assertEquals", "abbreviateMiddle", "assertEquals", "abbreviateMiddle", "assertEquals", "abbreviateMiddle", "assertEquals", "abbreviateMiddle", "assertEquals", "abbreviateMiddle", "assertEquals", "abbreviateMiddle", "assertEquals", "abbreviateMiddle", "assertEquals", "abbreviateMiddle", "assertEquals", "abbreviateMiddle", "assertEquals", "abbreviateMiddle", "assertEquals", "abbreviateMiddle", "assertEquals", "abbreviateMiddle", "assertEquals", "abbreviateMiddle", "assertEquals", "abbreviateMiddle", "assertEquals", "abbreviateMiddle", "assertEquals", "abbreviateMiddle", "assertEquals", "abbreviateMiddle", "assertEquals", "abbreviateMiddle", "assertEquals", "abbreviateMiddle"]}, "focal_class": {"identifier": "Strings", "superclass": "", "interfaces": "", "fields": [{"original_string": "private static final int INDEX_NOT_FOUND = -1;", "modifier": "private static final", "type": "int", "declarator": "INDEX_NOT_FOUND = -1", "var_name": "INDEX_NOT_FOUND"}, {"original_string": "private static final String ELLIPSIS = \"...\";", "modifier": "private static final", "type": "String", "declarator": "ELLIPSIS = \"...\"", "var_name": "ELLIPSIS"}, {"original_string": "private static final String EMPTY = \"\";", "modifier": "private static final", "type": "String", "declarator": "EMPTY = \"\"", "var_name": "EMPTY"}, {"original_string": "private static final String SCHEME_HOST_SEPARATOR = \"://\";", "modifier": "private static final", "type": "String", "declarator": "SCHEME_HOST_SEPARATOR = \"://\"", "var_name": "SCHEME_HOST_SEPARATOR"}, {"original_string": "private static final String FQ_CLASS_NAME = \"\\\\B\\\\w+(\\\\.[a-z])\";", "modifier": "private static final", "type": "String", "declarator": "FQ_CLASS_NAME = \"\\\\B\\\\w+(\\\\.[a-z])\"", "var_name": "FQ_CLASS_NAME"}], "methods": [{"identifier": "abbreviate", "parameters": "(String str, int offset, int maxWidth)", "modifiers": "public static", "return": "String", "signature": "String abbreviate(String str, int offset, int maxWidth)", "full_signature": "public static String abbreviate(String str, int offset, int maxWidth)", "class_method_signature": "Strings.abbreviate(String str, int offset, int maxWidth)", "testcase": false, "constructor": false}, {"identifier": "abbreviateMiddle", "parameters": "(String string, int maxLength)", "modifiers": "public static", "return": "String", "signature": "String abbreviateMiddle(String string, int maxLength)", "full_signature": "public static String abbreviateMiddle(String string, int maxLength)", "class_method_signature": "Strings.abbreviateMiddle(String string, int maxLength)", "testcase": false, "constructor": false}, {"identifier": "abbreviateFqClassName", "parameters": "(String fqcn)", "modifiers": "public static", "return": "String", "signature": "String abbreviateFqClassName(String fqcn)", "full_signature": "public static String abbreviateFqClassName(String fqcn)", "class_method_signature": "Strings.abbreviateFqClassName(String fqcn)", "testcase": false, "constructor": false}, {"identifier": "capitalize", "parameters": "(String str)", "modifiers": "public static", "return": "String", "signature": "String capitalize(String str)", "full_signature": "public static String capitalize(String str)", "class_method_signature": "Strings.capitalize(String str)", "testcase": false, "constructor": false}, {"identifier": "substringAfterLast", "parameters": "(String str, String separator)", "modifiers": "public static", "return": "String", "signature": "String substringAfterLast(String str, String separator)", "full_signature": "public static String substringAfterLast(String str, String separator)", "class_method_signature": "Strings.substringAfterLast(String str, String separator)", "testcase": false, "constructor": false}, {"identifier": "strip", "parameters": "(String str, String stripChars)", "modifiers": "public static", "return": "String", "signature": "String strip(String str, String stripChars)", "full_signature": "public static String strip(String str, String stripChars)", "class_method_signature": "Strings.strip(String str, String stripChars)", "testcase": false, "constructor": false}, {"identifier": "stripStart", "parameters": "(String str, String stripChars)", "modifiers": "public static", "return": "String", "signature": "String stripStart(String str, String stripChars)", "full_signature": "public static String stripStart(String str, String stripChars)", "class_method_signature": "Strings.stripStart(String str, String stripChars)", "testcase": false, "constructor": false}, {"identifier": "stripEnd", "parameters": "(String str, String stripChars)", "modifiers": "public static", "return": "String", "signature": "String stripEnd(String str, String stripChars)", "full_signature": "public static String stripEnd(String str, String stripChars)", "class_method_signature": "Strings.stripEnd(String str, String stripChars)", "testcase": false, "constructor": false}, {"identifier": "getParent", "parameters": "(String path)", "modifiers": "public static", "return": "String", "signature": "String getParent(String path)", "full_signature": "public static String getParent(String path)", "class_method_signature": "Strings.getParent(String path)", "testcase": false, "constructor": false}, {"identifier": "getDomain", "parameters": "(String url)", "modifiers": "public static", "return": "String", "signature": "String getDomain(String url)", "full_signature": "public static String getDomain(String url)", "class_method_signature": "Strings.getDomain(String url)", "testcase": false, "constructor": false}, {"identifier": "sanitize", "parameters": "(String str)", "modifiers": "public static", "return": "String", "signature": "String sanitize(String str)", "full_signature": "public static String sanitize(String str)", "class_method_signature": "Strings.sanitize(String str)", "testcase": false, "constructor": false}, {"identifier": "Strings", "parameters": "()", "modifiers": "private", "return": "", "signature": " Strings()", "full_signature": "private  Strings()", "class_method_signature": "Strings.Strings()", "testcase": false, "constructor": true}], "file": "resources/src/main/java/org/jboss/hal/resources/Strings.java"}, "focal_method": {"identifier": "abbreviateMiddle", "parameters": "(String string, int maxLength)", "modifiers": "public static", "return": "String", "body": "public static String abbreviateMiddle(String string, int maxLength) {\n        if (string == null || maxLength >= string.length()) {\n            return string;\n        }\n        if (maxLength == 0) {\n            return \"\";\n        }\n        if (maxLength <= ELLIPSIS.length()) {\n            return string.substring(0, maxLength);\n        }\n\n        int targetSting = max(1, maxLength - ELLIPSIS.length());\n        int startOffset = targetSting / 2 + targetSting % 2;\n        int endOffset = string.length() - targetSting / 2;\n\n        return string.substring(0, startOffset) + ELLIPSIS + string.substring(endOffset);\n    }", "signature": "String abbreviateMiddle(String string, int maxLength)", "full_signature": "public static String abbreviateMiddle(String string, int maxLength)", "class_method_signature": "Strings.abbreviateMiddle(String string, int maxLength)", "testcase": false, "constructor": false, "invocations": ["length", "length", "substring", "max", "length", "length", "substring", "substring"]}, "repository": {"repo_id": 38317187, "url": "https://github.com/hal/console", "stars": 34, "created": "6/30/2015 3:26:19 PM +00:00", "updates": "2020-01-26T16:25:43+00:00", "fork": "False", "license": "licensed"}}