{"test_class": {"identifier": "AeadConfigTest", "superclass": "", "interfaces": "", "fields": [], "file": "java_src/src/test/java/com/google/crypto/tink/aead/AeadConfigTest.java"}, "test_case": {"identifier": "aaaTestInitialization", "parameters": "()", "modifiers": "@Test public", "return": "void", "body": "@Test\n  public void aaaTestInitialization() throws Exception {\n    try {\n      Registry.getCatalogue(\"tinkmac\");\n      fail(\"Expected GeneralSecurityException\");\n    } catch (GeneralSecurityException e) {\n      assertThat(e.toString()).contains(\"no catalogue found\");\n      assertThat(e.toString()).contains(\"MacConfig.register()\");\n    }\n    try {\n      Registry.getCatalogue(\"tinkaead\");\n      fail(\"Expected GeneralSecurityException\");\n    } catch (GeneralSecurityException e) {\n      assertThat(e.toString()).contains(\"no catalogue found\");\n      assertThat(e.toString()).contains(\"AeadConfig.register()\");\n    }\n\n    // Before registration, key manager should be absent.\n    String typeUrl = \"type.googleapis.com/google.crypto.tink.AesCtrHmacAeadKey\";\n    try {\n      Registry.getUntypedKeyManager(typeUrl);\n      fail(\"Expected GeneralSecurityException\");\n    } catch (GeneralSecurityException e) {\n      assertThat(e.toString()).contains(\"No key manager found\");\n    }\n\n    // Initialize the config.\n    AeadConfig.register();\n\n    // After registration the key manager should be present.\n    Registry.getKeyManager(typeUrl, Aead.class);\n\n    // Running init() manually again should succeed.\n    AeadConfig.register();\n  }", "signature": "void aaaTestInitialization()", "full_signature": "@Test public void aaaTestInitialization()", "class_method_signature": "AeadConfigTest.aaaTestInitialization()", "testcase": true, "constructor": false, "invocations": ["getCatalogue", "fail", "contains", "assertThat", "toString", "contains", "assertThat", "toString", "getCatalogue", "fail", "contains", "assertThat", "toString", "contains", "assertThat", "toString", "getUntypedKeyManager", "fail", "contains", "assertThat", "toString", "register", "getKeyManager", "register"]}, "focal_class": {"identifier": "AeadConfig", "superclass": "", "interfaces": "", "fields": [{"original_string": "public static final String AES_CTR_HMAC_AEAD_TYPE_URL =\n      new AesCtrHmacAeadKeyManager().getKeyType();", "modifier": "public static final", "type": "String", "declarator": "AES_CTR_HMAC_AEAD_TYPE_URL =\n      new AesCtrHmacAeadKeyManager().getKeyType()", "var_name": "AES_CTR_HMAC_AEAD_TYPE_URL"}, {"original_string": "public static final String AES_GCM_TYPE_URL = new AesGcmKeyManager().getKeyType();", "modifier": "public static final", "type": "String", "declarator": "AES_GCM_TYPE_URL = new AesGcmKeyManager().getKeyType()", "var_name": "AES_GCM_TYPE_URL"}, {"original_string": "public static final String AES_GCM_SIV_TYPE_URL = new AesGcmSivKeyManager().getKeyType();", "modifier": "public static final", "type": "String", "declarator": "AES_GCM_SIV_TYPE_URL = new AesGcmSivKeyManager().getKeyType()", "var_name": "AES_GCM_SIV_TYPE_URL"}, {"original_string": "public static final String AES_EAX_TYPE_URL = new AesEaxKeyManager().getKeyType();", "modifier": "public static final", "type": "String", "declarator": "AES_EAX_TYPE_URL = new AesEaxKeyManager().getKeyType()", "var_name": "AES_EAX_TYPE_URL"}, {"original_string": "public static final String KMS_AEAD_TYPE_URL = new KmsAeadKeyManager().getKeyType();", "modifier": "public static final", "type": "String", "declarator": "KMS_AEAD_TYPE_URL = new KmsAeadKeyManager().getKeyType()", "var_name": "KMS_AEAD_TYPE_URL"}, {"original_string": "public static final String KMS_ENVELOPE_AEAD_TYPE_URL =\n      new KmsEnvelopeAeadKeyManager().getKeyType();", "modifier": "public static final", "type": "String", "declarator": "KMS_ENVELOPE_AEAD_TYPE_URL =\n      new KmsEnvelopeAeadKeyManager().getKeyType()", "var_name": "KMS_ENVELOPE_AEAD_TYPE_URL"}, {"original_string": "public static final String CHACHA20_POLY1305_TYPE_URL =\n      new ChaCha20Poly1305KeyManager().getKeyType();", "modifier": "public static final", "type": "String", "declarator": "CHACHA20_POLY1305_TYPE_URL =\n      new ChaCha20Poly1305KeyManager().getKeyType()", "var_name": "CHACHA20_POLY1305_TYPE_URL"}, {"original_string": "public static final String XCHACHA20_POLY1305_TYPE_URL =\n      new XChaCha20Poly1305KeyManager().getKeyType();", "modifier": "public static final", "type": "String", "declarator": "XCHACHA20_POLY1305_TYPE_URL =\n      new XChaCha20Poly1305KeyManager().getKeyType()", "var_name": "XCHACHA20_POLY1305_TYPE_URL"}, {"original_string": "@Deprecated public static final RegistryConfig TINK_1_0_0 = RegistryConfig.getDefaultInstance();", "modifier": "@Deprecated public static final", "type": "RegistryConfig", "declarator": "TINK_1_0_0 = RegistryConfig.getDefaultInstance()", "var_name": "TINK_1_0_0"}, {"original_string": "@Deprecated public static final RegistryConfig TINK_1_1_0 = TINK_1_0_0;", "modifier": "@Deprecated public static final", "type": "RegistryConfig", "declarator": "TINK_1_1_0 = TINK_1_0_0", "var_name": "TINK_1_1_0"}, {"original_string": "@Deprecated public static final RegistryConfig LATEST = TINK_1_0_0;", "modifier": "@Deprecated public static final", "type": "RegistryConfig", "declarator": "LATEST = TINK_1_0_0", "var_name": "LATEST"}], "methods": [{"identifier": "init", "parameters": "()", "modifiers": "@Deprecated public static", "return": "void", "signature": "void init()", "full_signature": "@Deprecated public static void init()", "class_method_signature": "AeadConfig.init()", "testcase": false, "constructor": false}, {"identifier": "register", "parameters": "()", "modifiers": "public static", "return": "void", "signature": "void register()", "full_signature": "public static void register()", "class_method_signature": "AeadConfig.register()", "testcase": false, "constructor": false}, {"identifier": "registerStandardKeyTypes", "parameters": "()", "modifiers": "@Deprecated public static", "return": "void", "signature": "void registerStandardKeyTypes()", "full_signature": "@Deprecated public static void registerStandardKeyTypes()", "class_method_signature": "AeadConfig.registerStandardKeyTypes()", "testcase": false, "constructor": false}, {"identifier": "AeadConfig", "parameters": "()", "modifiers": "private", "return": "", "signature": " AeadConfig()", "full_signature": "private  AeadConfig()", "class_method_signature": "AeadConfig.AeadConfig()", "testcase": false, "constructor": true}], "file": "java_src/src/main/java/com/google/crypto/tink/aead/AeadConfig.java"}, "focal_method": {"identifier": "register", "parameters": "()", "modifiers": "public static", "return": "void", "body": "public static void register() throws GeneralSecurityException {\n    MacConfig.register();\n    AesCtrHmacAeadKeyManager.register(/*newKeyAllowed=*/ true);\n    AesEaxKeyManager.register(/*newKeyAllowed=*/ true);\n    AesGcmKeyManager.register(/*newKeyAllowed=*/ true);\n    AesGcmSivKeyManager.register(/*newKeyAllowed=*/ true);\n    ChaCha20Poly1305KeyManager.register(/*newKeyAllowed=*/ true);\n    KmsAeadKeyManager.register(/*newKeyAllowed=*/ true);\n    KmsEnvelopeAeadKeyManager.register(/*newKeyAllowed=*/ true);\n    XChaCha20Poly1305KeyManager.register(/*newKeyAllowed=*/ true);\n    AeadWrapper.register();\n  }", "signature": "void register()", "full_signature": "public static void register()", "class_method_signature": "AeadConfig.register()", "testcase": false, "constructor": false, "invocations": ["register", "register", "register", "register", "register", "register", "register", "register", "register", "register"]}, "repository": {"repo_id": 20570214, "url": "https://github.com/google/tink", "stars": 8884, "created": "6/6/2014 4:21:09 PM +00:00", "updates": "2020-01-27T11:52:16+00:00", "fork": "False", "license": "licensed"}}