{"test_class": {"identifier": "ObjectBuilderTest", "superclass": "", "interfaces": "", "fields": [{"original_string": "@Rule\n    public ExpectedException thrown = ExpectedException.none();", "modifier": "@Rule\n    public", "type": "ExpectedException", "declarator": "thrown = ExpectedException.none()", "var_name": "thrown"}, {"original_string": "private GroovyClassLoader groovyClassLoader = new GroovyClassLoader();", "modifier": "private", "type": "GroovyClassLoader", "declarator": "groovyClassLoader = new GroovyClassLoader()", "var_name": "groovyClassLoader"}], "file": "everrest-core/src/test/java/org/everrest/core/impl/provider/json/ObjectBuilderTest.java"}, "test_case": {"identifier": "createsProxyObjectForInterface", "parameters": "()", "modifiers": "@Test public", "return": "void", "body": "@Test\n    public void createsProxyObjectForInterface() throws Exception {\n        ObjectValue jsonBook = createJsonBook(createJunitBook());\n        IBook book = ObjectBuilder.createObject(IBook.class, jsonBook);\n\n        assertEquals(\"Vincent Massol\", book.getAuthor());\n        assertEquals(\"JUnit in Action\", book.getTitle());\n        assertEquals(386, book.getPages());\n        assertEquals(19.37, book.getPrice(), 0.01);\n        assertEquals(93011099534534L, book.getIsdn());\n        assertEquals(false, book.getAvailability());\n        assertEquals(false, book.getDelivery());\n    }", "signature": "void createsProxyObjectForInterface()", "full_signature": "@Test public void createsProxyObjectForInterface()", "class_method_signature": "ObjectBuilderTest.createsProxyObjectForInterface()", "testcase": true, "constructor": false, "invocations": ["createJsonBook", "createJunitBook", "createObject", "assertEquals", "getAuthor", "assertEquals", "getTitle", "assertEquals", "getPages", "assertEquals", "getPrice", "assertEquals", "getIsdn", "assertEquals", "getAvailability", "assertEquals", "getDelivery"]}, "focal_class": {"identifier": "ObjectBuilder", "superclass": "", "interfaces": "", "fields": [{"original_string": "private static final Collection<String> SKIP_METHODS = newHashSet(\"setMetaClass\");", "modifier": "private static final", "type": "Collection<String>", "declarator": "SKIP_METHODS = newHashSet(\"setMetaClass\")", "var_name": "SKIP_METHODS"}, {"original_string": "private static LoadingCache<Class<?>, JsonMethod[]> methodsCache = CacheBuilder.newBuilder()\n                                                                                   .concurrencyLevel(8)\n                                                                                   .maximumSize(256)\n                                                                                   .expireAfterAccess(10, MINUTES)\n                                                                                   .build(new CacheLoader<Class<?>, JsonMethod[]>() {\n                                                                                       @Override\n                                                                                       public JsonMethod[] load(Class<?> aClass)\n                                                                                               throws Exception {\n                                                                                           return getJsonMethods(aClass);\n                                                                                       }\n                                                                                   });", "modifier": "private static", "type": "LoadingCache<Class<?>, JsonMethod[]>", "declarator": "methodsCache = CacheBuilder.newBuilder()\n                                                                                   .concurrencyLevel(8)\n                                                                                   .maximumSize(256)\n                                                                                   .expireAfterAccess(10, MINUTES)\n                                                                                   .build(new CacheLoader<Class<?>, JsonMethod[]>() {\n                                                                                       @Override\n                                                                                       public JsonMethod[] load(Class<?> aClass)\n                                                                                               throws Exception {\n                                                                                           return getJsonMethods(aClass);\n                                                                                       }\n                                                                                   })", "var_name": "methodsCache"}, {"original_string": "private static Cache<Class<?>, Constructor<?>> constructorsCache = CacheBuilder.newBuilder()\n                                                                                   .concurrencyLevel(8)\n                                                                                   .maximumSize(256)\n                                                                                   .expireAfterAccess(10, MINUTES)\n                                                                                   .build();", "modifier": "private static", "type": "Cache<Class<?>, Constructor<?>>", "declarator": "constructorsCache = CacheBuilder.newBuilder()\n                                                                                   .concurrencyLevel(8)\n                                                                                   .maximumSize(256)\n                                                                                   .expireAfterAccess(10, MINUTES)\n                                                                                   .build()", "var_name": "constructorsCache"}], "methods": [{"identifier": "getJsonMethods", "parameters": "(Class<?> clazz)", "modifiers": "private static", "return": "JsonMethod[]", "signature": "JsonMethod[] getJsonMethods(Class<?> clazz)", "full_signature": "private static JsonMethod[] getJsonMethods(Class<?> clazz)", "class_method_signature": "ObjectBuilder.getJsonMethods(Class<?> clazz)", "testcase": false, "constructor": false}, {"identifier": "shouldBeProcessed", "parameters": "(Method method)", "modifiers": "private static", "return": "boolean", "signature": "boolean shouldBeProcessed(Method method)", "full_signature": "private static boolean shouldBeProcessed(Method method)", "class_method_signature": "ObjectBuilder.shouldBeProcessed(Method method)", "testcase": false, "constructor": false}, {"identifier": "isSetter", "parameters": "(Method method)", "modifiers": "private static", "return": "boolean", "signature": "boolean isSetter(Method method)", "full_signature": "private static boolean isSetter(Method method)", "class_method_signature": "ObjectBuilder.isSetter(Method method)", "testcase": false, "constructor": false}, {"identifier": "createArray", "parameters": "(Class<?> aClass, JsonValue jsonArray)", "modifiers": "public static", "return": "Object", "signature": "Object createArray(Class<?> aClass, JsonValue jsonArray)", "full_signature": "public static Object createArray(Class<?> aClass, JsonValue jsonArray)", "class_method_signature": "ObjectBuilder.createArray(Class<?> aClass, JsonValue jsonArray)", "testcase": false, "constructor": false}, {"identifier": "createCollection", "parameters": "(Class<T> collectionClass, Type genericType, JsonValue jsonArray)", "modifiers": "@SuppressWarnings(\"unchecked\") public static", "return": "T", "signature": "T createCollection(Class<T> collectionClass, Type genericType, JsonValue jsonArray)", "full_signature": "@SuppressWarnings(\"unchecked\") public static T createCollection(Class<T> collectionClass, Type genericType, JsonValue jsonArray)", "class_method_signature": "ObjectBuilder.createCollection(Class<T> collectionClass, Type genericType, JsonValue jsonArray)", "testcase": false, "constructor": false}, {"identifier": "findAcceptableCollectionImplementation", "parameters": "(Class<T> collectionClass)", "modifiers": "private static", "return": "Class", "signature": "Class findAcceptableCollectionImplementation(Class<T> collectionClass)", "full_signature": "private static Class findAcceptableCollectionImplementation(Class<T> collectionClass)", "class_method_signature": "ObjectBuilder.findAcceptableCollectionImplementation(Class<T> collectionClass)", "testcase": false, "constructor": false}, {"identifier": "createObject", "parameters": "(Class<T> mapClass, Type genericType, JsonValue jsonObject)", "modifiers": "@SuppressWarnings(\"unchecked\") public static", "return": "T", "signature": "T createObject(Class<T> mapClass, Type genericType, JsonValue jsonObject)", "full_signature": "@SuppressWarnings(\"unchecked\") public static T createObject(Class<T> mapClass, Type genericType, JsonValue jsonObject)", "class_method_signature": "ObjectBuilder.createObject(Class<T> mapClass, Type genericType, JsonValue jsonObject)", "testcase": false, "constructor": false}, {"identifier": "findAcceptableMapImplementation", "parameters": "(Class<T> mapClass)", "modifiers": "private static", "return": "Class", "signature": "Class findAcceptableMapImplementation(Class<T> mapClass)", "full_signature": "private static Class findAcceptableMapImplementation(Class<T> mapClass)", "class_method_signature": "ObjectBuilder.findAcceptableMapImplementation(Class<T> mapClass)", "testcase": false, "constructor": false}, {"identifier": "createObject", "parameters": "(Class<T> aClass, JsonValue jsonValue)", "modifiers": "@SuppressWarnings({\"unchecked\"}) public static", "return": "T", "signature": "T createObject(Class<T> aClass, JsonValue jsonValue)", "full_signature": "@SuppressWarnings({\"unchecked\"}) public static T createObject(Class<T> aClass, JsonValue jsonValue)", "class_method_signature": "ObjectBuilder.createObject(Class<T> aClass, JsonValue jsonValue)", "testcase": false, "constructor": false}, {"identifier": "mergeMessagesFromCausalJsonExceptions", "parameters": "(Throwable error, StringBuilder msg)", "modifiers": "private static", "return": "void", "signature": "void mergeMessagesFromCausalJsonExceptions(Throwable error, StringBuilder msg)", "full_signature": "private static void mergeMessagesFromCausalJsonExceptions(Throwable error, StringBuilder msg)", "class_method_signature": "ObjectBuilder.mergeMessagesFromCausalJsonExceptions(Throwable error, StringBuilder msg)", "testcase": false, "constructor": false}, {"identifier": "getConstructor", "parameters": "(Class<T> aClass, Class<?>... parameters)", "modifiers": "@SuppressWarnings(\"unchecked\") private static", "return": "Constructor<T>", "signature": "Constructor<T> getConstructor(Class<T> aClass, Class<?>... parameters)", "full_signature": "@SuppressWarnings(\"unchecked\") private static Constructor<T> getConstructor(Class<T> aClass, Class<?>... parameters)", "class_method_signature": "ObjectBuilder.getConstructor(Class<T> aClass, Class<?>... parameters)", "testcase": false, "constructor": false}, {"identifier": "createEnum", "parameters": "(Class enumClass, JsonValue jsonValue)", "modifiers": "@SuppressWarnings(\"unchecked\") private static", "return": "Enum<?>", "signature": "Enum<?> createEnum(Class enumClass, JsonValue jsonValue)", "full_signature": "@SuppressWarnings(\"unchecked\") private static Enum<?> createEnum(Class enumClass, JsonValue jsonValue)", "class_method_signature": "ObjectBuilder.createEnum(Class enumClass, JsonValue jsonValue)", "testcase": false, "constructor": false}, {"identifier": "createObjectKnownTypes", "parameters": "(Class<?> aClass, JsonValue jsonValue)", "modifiers": "private static", "return": "Object", "signature": "Object createObjectKnownTypes(Class<?> aClass, JsonValue jsonValue)", "full_signature": "private static Object createObjectKnownTypes(Class<?> aClass, JsonValue jsonValue)", "class_method_signature": "ObjectBuilder.createObjectKnownTypes(Class<?> aClass, JsonValue jsonValue)", "testcase": false, "constructor": false}, {"identifier": "ObjectBuilder", "parameters": "()", "modifiers": "private", "return": "", "signature": " ObjectBuilder()", "full_signature": "private  ObjectBuilder()", "class_method_signature": "ObjectBuilder.ObjectBuilder()", "testcase": false, "constructor": true}], "file": "everrest-core/src/main/java/org/everrest/core/impl/provider/json/ObjectBuilder.java"}, "focal_method": {"identifier": "createObject", "parameters": "(Class<T> mapClass, Type genericType, JsonValue jsonObject)", "modifiers": "@SuppressWarnings(\"unchecked\") public static", "return": "T", "body": "@SuppressWarnings(\"unchecked\")\n    public static <T extends Map<String, ?>> T createObject(Class<T> mapClass, Type genericType, JsonValue jsonObject)\n            throws JsonException {\n        if (jsonObject == null || jsonObject.isNull()) {\n            return null;\n        }\n        Class mapValueClass;\n        Type mapValueType;\n        if (genericType instanceof ParameterizedType) {\n            ParameterizedType parameterizedType = (ParameterizedType)genericType;\n            if (!String.class.isAssignableFrom((Class)parameterizedType.getActualTypeArguments()[0])) {\n                throw new JsonException(\"Key of Map must be String. \");\n            }\n            mapValueType = parameterizedType.getActualTypeArguments()[1];\n            if (mapValueType instanceof Class) {\n                mapValueClass = (Class)mapValueType;\n            } else if (mapValueType instanceof ParameterizedType) {\n                mapValueClass = (Class)((ParameterizedType)mapValueType).getRawType();\n            } else {\n                throw new JsonException(\n                        String.format(\"This type of Map can't be restored from JSON source.\\nMap is parameterized by wrong Type: %s\",\n                                      parameterizedType));\n            }\n        } else {\n            throw new JsonException(\"Map is not parameterized. Map<Sting, ?> is not supported.\");\n        }\n        Constructor<? extends T> constructor;\n        if (mapClass.isInterface() || Modifier.isAbstract(mapClass.getModifiers())) {\n            constructor = getConstructor(findAcceptableMapImplementation(mapClass), Map.class);\n        } else {\n            constructor = getConstructor(mapClass, Map.class);\n        }\n\n        Types jsonMapValueType = getType(mapValueClass);\n        HashMap<String, Object> sourceMap = new HashMap<>(jsonObject.size());\n        Iterator<String> keys = jsonObject.getKeys();\n        while (keys.hasNext()) {\n            String key = keys.next();\n            JsonValue childJsonValue = jsonObject.getElement(key);\n            if (jsonMapValueType == null) {\n                sourceMap.put(key, createObject(mapValueClass, childJsonValue));\n            } else {\n                switch (jsonMapValueType) {\n                    case BYTE:\n                    case SHORT:\n                    case INT:\n                    case LONG:\n                    case FLOAT:\n                    case DOUBLE:\n                    case BOOLEAN:\n                    case CHAR:\n                    case STRING:\n                    case NULL:\n                    case ARRAY_BYTE:\n                    case ARRAY_SHORT:\n                    case ARRAY_INT:\n                    case ARRAY_LONG:\n                    case ARRAY_FLOAT:\n                    case ARRAY_DOUBLE:\n                    case ARRAY_BOOLEAN:\n                    case ARRAY_CHAR:\n                    case ARRAY_STRING:\n                    case CLASS:\n                        sourceMap.put(key, createObjectKnownTypes(mapValueClass, childJsonValue));\n                        break;\n                    case ARRAY_OBJECT:\n                        sourceMap.put(key, createArray(mapValueClass, childJsonValue));\n                        break;\n                    case COLLECTION:\n                        sourceMap.put(key, createCollection(mapValueClass, mapValueType, childJsonValue));\n                        break;\n                    case MAP:\n                        sourceMap.put(key, createObject(mapValueClass, mapValueType, childJsonValue));\n                        break;\n                    case ENUM:\n                        sourceMap.put(key, createEnum(mapValueClass, childJsonValue));\n                        break;\n                }\n            }\n        }\n        try {\n            return constructor.newInstance(sourceMap);\n        } catch (Exception e) {\n            throw new JsonException(e.getMessage(), e);\n        }\n    }", "signature": "T createObject(Class<T> mapClass, Type genericType, JsonValue jsonObject)", "full_signature": "@SuppressWarnings(\"unchecked\") public static T createObject(Class<T> mapClass, Type genericType, JsonValue jsonObject)", "class_method_signature": "ObjectBuilder.createObject(Class<T> mapClass, Type genericType, JsonValue jsonObject)", "testcase": false, "constructor": false, "invocations": ["isNull", "isAssignableFrom", "getActualTypeArguments", "getActualTypeArguments", "getRawType", "format", "isInterface", "isAbstract", "getModifiers", "getConstructor", "findAcceptableMapImplementation", "getConstructor", "getType", "size", "getKeys", "hasNext", "next", "getElement", "put", "createObject", "put", "createObjectKnownTypes", "put", "createArray", "put", "createCollection", "put", "createObject", "put", "createEnum", "newInstance", "getMessage"]}, "repository": {"repo_id": 14550159, "url": "https://github.com/codenvy/everrest", "language": "Java", "is_fork": false, "fork_count": 14, "stargazer_count": 24, "size": 4563, "license": "licensed"}}