{"test_class": {"identifier": "ByzantiumConfigTest", "superclass": "", "interfaces": "", "fields": [{"original_string": "private static final byte[] FAKE_HASH = {11, 12};", "modifier": "private static final", "type": "byte[]", "declarator": "FAKE_HASH = {11, 12}", "var_name": "FAKE_HASH"}], "file": "ethereumj-core/src/test/java/org/ethereum/config/blockchain/ByzantiumConfigTest.java"}, "test_case": {"identifier": "testEtherscanIoBlock4490790", "parameters": "()", "modifiers": "@Test public", "return": "void", "body": "@Test\n    public void testEtherscanIoBlock4490790() throws Exception {\n        ByzantiumConfig byzantiumConfig = new ByzantiumConfig(new TestBlockchainConfig());\n\n        // https://etherscan.io/block/4490788\n        String parentHash = \"fd9d7467e933ff2975c33ea3045ddf8773c87c4cec4e7da8de1bcc015361b38b\";\n        BlockHeader parent = new BlockHeaderBuilder(parentHash.getBytes(), 4490788, \"1,377,255,445,606,146\")\n                .withTimestamp(1509827488)\n                // Actually an empty list hash, so _no_ uncles\n                .withUncles(Hex.decode(\"1dcc4de8dec75d7aab85b567b6ccd41ad312451b948a7413f0a142fd40d49347\"))\n                .build();\n\n        // https://etherscan.io/block/4490789\n        BlockHeader current = new BlockHeaderBuilder(parent.getHash(), 4490789, BigInteger.ZERO)\n                .withTimestamp(1509827494)\n                .build();\n\n        BigInteger minimumDifficulty = byzantiumConfig.calcDifficulty(current, parent);\n        BigInteger actualDifficultyOnEtherscan = BlockHeaderBuilder.parse(\"1,377,927,933,620,791\");\n        assertTrue(actualDifficultyOnEtherscan.compareTo(minimumDifficulty) > -1);\n    }", "signature": "void testEtherscanIoBlock4490790()", "full_signature": "@Test public void testEtherscanIoBlock4490790()", "class_method_signature": "ByzantiumConfigTest.testEtherscanIoBlock4490790()", "testcase": true, "constructor": false, "invocations": ["build", "withUncles", "withTimestamp", "getBytes", "decode", "build", "withTimestamp", "getHash", "calcDifficulty", "parse", "assertTrue", "compareTo"]}, "focal_class": {"identifier": "ByzantiumConfig", "superclass": "extends Eip160HFConfig", "interfaces": "", "fields": [{"original_string": "private final Constants constants;", "modifier": "private final", "type": "Constants", "declarator": "constants", "var_name": "constants"}], "methods": [{"identifier": "ByzantiumConfig", "parameters": "(BlockchainConfig parent)", "modifiers": "public", "return": "", "signature": " ByzantiumConfig(BlockchainConfig parent)", "full_signature": "public  ByzantiumConfig(BlockchainConfig parent)", "class_method_signature": "ByzantiumConfig.ByzantiumConfig(BlockchainConfig parent)", "testcase": false, "constructor": true}, {"identifier": "getConstants", "parameters": "()", "modifiers": "@Override public", "return": "Constants", "signature": "Constants getConstants()", "full_signature": "@Override public Constants getConstants()", "class_method_signature": "ByzantiumConfig.getConstants()", "testcase": false, "constructor": false}, {"identifier": "calcDifficulty", "parameters": "(BlockHeader curBlock, BlockHeader parent)", "modifiers": "@Override public", "return": "BigInteger", "signature": "BigInteger calcDifficulty(BlockHeader curBlock, BlockHeader parent)", "full_signature": "@Override public BigInteger calcDifficulty(BlockHeader curBlock, BlockHeader parent)", "class_method_signature": "ByzantiumConfig.calcDifficulty(BlockHeader curBlock, BlockHeader parent)", "testcase": false, "constructor": false}, {"identifier": "getExplosion", "parameters": "(BlockHeader curBlock, BlockHeader parent)", "modifiers": "protected", "return": "int", "signature": "int getExplosion(BlockHeader curBlock, BlockHeader parent)", "full_signature": "protected int getExplosion(BlockHeader curBlock, BlockHeader parent)", "class_method_signature": "ByzantiumConfig.getExplosion(BlockHeader curBlock, BlockHeader parent)", "testcase": false, "constructor": false}, {"identifier": "getCalcDifficultyMultiplier", "parameters": "(BlockHeader curBlock, BlockHeader parent)", "modifiers": "@Override public", "return": "BigInteger", "signature": "BigInteger getCalcDifficultyMultiplier(BlockHeader curBlock, BlockHeader parent)", "full_signature": "@Override public BigInteger getCalcDifficultyMultiplier(BlockHeader curBlock, BlockHeader parent)", "class_method_signature": "ByzantiumConfig.getCalcDifficultyMultiplier(BlockHeader curBlock, BlockHeader parent)", "testcase": false, "constructor": false}, {"identifier": "eip198", "parameters": "()", "modifiers": "@Override public", "return": "boolean", "signature": "boolean eip198()", "full_signature": "@Override public boolean eip198()", "class_method_signature": "ByzantiumConfig.eip198()", "testcase": false, "constructor": false}, {"identifier": "eip206", "parameters": "()", "modifiers": "@Override public", "return": "boolean", "signature": "boolean eip206()", "full_signature": "@Override public boolean eip206()", "class_method_signature": "ByzantiumConfig.eip206()", "testcase": false, "constructor": false}, {"identifier": "eip211", "parameters": "()", "modifiers": "@Override public", "return": "boolean", "signature": "boolean eip211()", "full_signature": "@Override public boolean eip211()", "class_method_signature": "ByzantiumConfig.eip211()", "testcase": false, "constructor": false}, {"identifier": "eip212", "parameters": "()", "modifiers": "@Override public", "return": "boolean", "signature": "boolean eip212()", "full_signature": "@Override public boolean eip212()", "class_method_signature": "ByzantiumConfig.eip212()", "testcase": false, "constructor": false}, {"identifier": "eip213", "parameters": "()", "modifiers": "@Override public", "return": "boolean", "signature": "boolean eip213()", "full_signature": "@Override public boolean eip213()", "class_method_signature": "ByzantiumConfig.eip213()", "testcase": false, "constructor": false}, {"identifier": "eip214", "parameters": "()", "modifiers": "@Override public", "return": "boolean", "signature": "boolean eip214()", "full_signature": "@Override public boolean eip214()", "class_method_signature": "ByzantiumConfig.eip214()", "testcase": false, "constructor": false}, {"identifier": "eip658", "parameters": "()", "modifiers": "@Override public", "return": "boolean", "signature": "boolean eip658()", "full_signature": "@Override public boolean eip658()", "class_method_signature": "ByzantiumConfig.eip658()", "testcase": false, "constructor": false}], "file": "ethereumj-core/src/main/java/org/ethereum/config/blockchain/ByzantiumConfig.java"}, "focal_method": {"identifier": "calcDifficulty", "parameters": "(BlockHeader curBlock, BlockHeader parent)", "modifiers": "@Override public", "return": "BigInteger", "body": "@Override\n    public BigInteger calcDifficulty(BlockHeader curBlock, BlockHeader parent) {\n        BigInteger pd = parent.getDifficultyBI();\n        BigInteger quotient = pd.divide(getConstants().getDIFFICULTY_BOUND_DIVISOR());\n\n        BigInteger sign = getCalcDifficultyMultiplier(curBlock, parent);\n\n        BigInteger fromParent = pd.add(quotient.multiply(sign));\n        BigInteger difficulty = max(getConstants().getMINIMUM_DIFFICULTY(), fromParent);\n\n        int explosion = getExplosion(curBlock, parent);\n\n        if (explosion >= 0) {\n            difficulty = max(getConstants().getMINIMUM_DIFFICULTY(), difficulty.add(BigInteger.ONE.shiftLeft(explosion)));\n        }\n\n        return difficulty;\n    }", "signature": "BigInteger calcDifficulty(BlockHeader curBlock, BlockHeader parent)", "full_signature": "@Override public BigInteger calcDifficulty(BlockHeader curBlock, BlockHeader parent)", "class_method_signature": "ByzantiumConfig.calcDifficulty(BlockHeader curBlock, BlockHeader parent)", "testcase": false, "constructor": false, "invocations": ["getDifficultyBI", "divide", "getDIFFICULTY_BOUND_DIVISOR", "getConstants", "getCalcDifficultyMultiplier", "add", "multiply", "max", "getMINIMUM_DIFFICULTY", "getConstants", "getExplosion", "max", "getMINIMUM_DIFFICULTY", "getConstants", "add", "shiftLeft"]}, "repository": {"repo_id": 19730456, "url": "https://github.com/ethereum/ethereumj", "language": "Java", "is_fork": false, "fork_count": 1034, "stargazer_count": 2058, "size": 47979, "license": "licensed"}}