{"test_class": {"identifier": "SavepointCoordinatorTest", "superclass": "", "interfaces": "", "fields": [], "file": "flink-runtime/src/test/java/org/apache/flink/runtime/checkpoint/SavepointCoordinatorTest.java"}, "test_case": {"identifier": "testShutdownDoesNotCleanUpCompletedCheckpointsWithFileSystemStore", "parameters": "()", "modifiers": "@Test public", "return": "void", "body": "@Test\n\tpublic void testShutdownDoesNotCleanUpCompletedCheckpointsWithFileSystemStore() throws Exception {\n\t\tJobID jobId = new JobID();\n\t\tlong checkpointTimeout = 60 * 1000;\n\t\tlong timestamp = 1272635;\n\t\tExecutionVertex[] vertices = new ExecutionVertex[] {\n\t\t\t\tmockExecutionVertex(jobId),\n\t\t\t\tmockExecutionVertex(jobId) };\n\t\tMockCheckpointIdCounter checkpointIdCounter = new MockCheckpointIdCounter();\n\n\t\t// Temporary directory for file state backend\n\t\tfinal File tmpDir = CommonTestUtils.createTempDirectory();\n\n\t\ttry {\n\t\t\tFileSystemStateStore<CompletedCheckpoint> savepointStore = new FileSystemStateStore<>(\n\t\t\t\t\ttmpDir.toURI().toString(), \"sp-\");\n\n\t\t\tSavepointCoordinator coordinator = createSavepointCoordinator(\n\t\t\t\t\tjobId,\n\t\t\t\t\tcheckpointTimeout,\n\t\t\t\t\tvertices,\n\t\t\t\t\tvertices,\n\t\t\t\t\tvertices,\n\t\t\t\t\tcheckpointIdCounter,\n\t\t\t\t\tsavepointStore);\n\n\t\t\t// Trigger the savepoint\n\t\t\tFuture<String> savepointPathFuture = coordinator.triggerSavepoint(timestamp);\n\t\t\tassertFalse(savepointPathFuture.isCompleted());\n\n\t\t\tlong checkpointId = checkpointIdCounter.getLastReturnedCount();\n\t\t\tassertEquals(0, checkpointId);\n\n\t\t\t// Verify send trigger messages\n\t\t\tfor (ExecutionVertex vertex : vertices) {\n\t\t\t\tverifyTriggerCheckpoint(vertex, checkpointId, timestamp);\n\t\t\t}\n\n\t\t\tPendingCheckpoint pendingCheckpoint = coordinator.getPendingCheckpoints()\n\t\t\t\t\t.get(checkpointId);\n\n\t\t\tverifyPendingCheckpoint(pendingCheckpoint, jobId, checkpointId,\n\t\t\t\t\ttimestamp, 0, 2, 0, false, false);\n\n\t\t\t// Acknowledge tasks\n\t\t\tfor (ExecutionVertex vertex : vertices) {\n\t\t\t\tcoordinator.receiveAcknowledgeMessage(new AcknowledgeCheckpoint(\n\t\t\t\t\t\tjobId, vertex.getCurrentExecutionAttempt().getAttemptId(),\n\t\t\t\t\t\tcheckpointId, createSerializedStateHandle(vertex), 0));\n\t\t\t}\n\n\t\t\t// The pending checkpoint is completed\n\t\t\tassertTrue(pendingCheckpoint.isDiscarded());\n\t\t\tassertEquals(0, coordinator.getSuccessfulCheckpoints().size());\n\n\t\t\t// Verify send notify complete messages\n\t\t\tfor (ExecutionVertex vertex : vertices) {\n\t\t\t\tverifyNotifyCheckpointComplete(vertex, checkpointId, timestamp);\n\t\t\t}\n\n\t\t\t// Verify that the future has been completed\n\t\t\tassertTrue(savepointPathFuture.isCompleted());\n\t\t\tString savepointPath = Await.result(savepointPathFuture, FiniteDuration.Zero());\n\n\t\t\t// Verify all promises removed\n\t\t\tassertEquals(0, getSavepointPromises(coordinator).size());\n\n\t\t\tcoordinator.shutdown();\n\n\t\t\t// Verify the savepoint is still available\n\t\t\tCompletedCheckpoint savepoint = savepointStore.getState(savepointPath);\n\t\t\tverifySavepoint(savepoint, jobId, checkpointId, timestamp,\n\t\t\t\t\tvertices);\n\t\t}\n\t\tfinally {\n\t\t\tFileUtils.deleteDirectory(tmpDir);\n\t\t}\n\t}", "signature": "void testShutdownDoesNotCleanUpCompletedCheckpointsWithFileSystemStore()", "full_signature": "@Test public void testShutdownDoesNotCleanUpCompletedCheckpointsWithFileSystemStore()", "class_method_signature": "SavepointCoordinatorTest.testShutdownDoesNotCleanUpCompletedCheckpointsWithFileSystemStore()", "testcase": true, "constructor": false, "invocations": ["mockExecutionVertex", "mockExecutionVertex", "createTempDirectory", "toString", "toURI", "createSavepointCoordinator", "triggerSavepoint", "assertFalse", "isCompleted", "getLastReturnedCount", "assertEquals", "verifyTriggerCheckpoint", "get", "getPendingCheckpoints", "verifyPendingCheckpoint", "receiveAcknowledgeMessage", "getAttemptId", "getCurrentExecutionAttempt", "createSerializedStateHandle", "assertTrue", "isDiscarded", "assertEquals", "size", "getSuccessfulCheckpoints", "verifyNotifyCheckpointComplete", "assertTrue", "isCompleted", "result", "Zero", "assertEquals", "size", "getSavepointPromises", "shutdown", "getState", "verifySavepoint", "deleteDirectory"]}, "focal_class": {"identifier": "SavepointCoordinator", "superclass": "extends CheckpointCoordinator", "interfaces": "", "fields": [{"original_string": "private static final Logger LOG = LoggerFactory.getLogger(SavepointCoordinator.class);", "modifier": "private static final", "type": "Logger", "declarator": "LOG = LoggerFactory.getLogger(SavepointCoordinator.class)", "var_name": "LOG"}, {"original_string": "private StateStore<CompletedCheckpoint> savepointStore;", "modifier": "private", "type": "StateStore<CompletedCheckpoint>", "declarator": "savepointStore", "var_name": "savepointStore"}, {"original_string": "private final Map<Long, Promise<String>> savepointPromises;", "modifier": "private final", "type": "Map<Long, Promise<String>>", "declarator": "savepointPromises", "var_name": "savepointPromises"}, {"original_string": "private volatile String savepointRestorePath;", "modifier": "private volatile", "type": "String", "declarator": "savepointRestorePath", "var_name": "savepointRestorePath"}], "methods": [{"identifier": "SavepointCoordinator", "parameters": "(\n\t\t\tJobID jobId,\n\t\t\tlong baseInterval,\n\t\t\tlong checkpointTimeout,\n\t\t\tExecutionVertex[] tasksToTrigger,\n\t\t\tExecutionVertex[] tasksToWaitFor,\n\t\t\tExecutionVertex[] tasksToCommitTo,\n\t\t\tClassLoader userClassLoader,\n\t\t\tCheckpointIDCounter checkpointIDCounter,\n\t\t\tStateStore<CompletedCheckpoint> savepointStore,\n\t\t\tCheckpointStatsTracker statsTracker)", "modifiers": "public", "return": "", "signature": " SavepointCoordinator(\n\t\t\tJobID jobId,\n\t\t\tlong baseInterval,\n\t\t\tlong checkpointTimeout,\n\t\t\tExecutionVertex[] tasksToTrigger,\n\t\t\tExecutionVertex[] tasksToWaitFor,\n\t\t\tExecutionVertex[] tasksToCommitTo,\n\t\t\tClassLoader userClassLoader,\n\t\t\tCheckpointIDCounter checkpointIDCounter,\n\t\t\tStateStore<CompletedCheckpoint> savepointStore,\n\t\t\tCheckpointStatsTracker statsTracker)", "full_signature": "public  SavepointCoordinator(\n\t\t\tJobID jobId,\n\t\t\tlong baseInterval,\n\t\t\tlong checkpointTimeout,\n\t\t\tExecutionVertex[] tasksToTrigger,\n\t\t\tExecutionVertex[] tasksToWaitFor,\n\t\t\tExecutionVertex[] tasksToCommitTo,\n\t\t\tClassLoader userClassLoader,\n\t\t\tCheckpointIDCounter checkpointIDCounter,\n\t\t\tStateStore<CompletedCheckpoint> savepointStore,\n\t\t\tCheckpointStatsTracker statsTracker)", "class_method_signature": "SavepointCoordinator.SavepointCoordinator(\n\t\t\tJobID jobId,\n\t\t\tlong baseInterval,\n\t\t\tlong checkpointTimeout,\n\t\t\tExecutionVertex[] tasksToTrigger,\n\t\t\tExecutionVertex[] tasksToWaitFor,\n\t\t\tExecutionVertex[] tasksToCommitTo,\n\t\t\tClassLoader userClassLoader,\n\t\t\tCheckpointIDCounter checkpointIDCounter,\n\t\t\tStateStore<CompletedCheckpoint> savepointStore,\n\t\t\tCheckpointStatsTracker statsTracker)", "testcase": false, "constructor": true}, {"identifier": "getSavepointRestorePath", "parameters": "()", "modifiers": "public", "return": "String", "signature": "String getSavepointRestorePath()", "full_signature": "public String getSavepointRestorePath()", "class_method_signature": "SavepointCoordinator.getSavepointRestorePath()", "testcase": false, "constructor": false}, {"identifier": "triggerSavepoint", "parameters": "(long timestamp)", "modifiers": "public", "return": "Future<String>", "signature": "Future<String> triggerSavepoint(long timestamp)", "full_signature": "public Future<String> triggerSavepoint(long timestamp)", "class_method_signature": "SavepointCoordinator.triggerSavepoint(long timestamp)", "testcase": false, "constructor": false}, {"identifier": "restoreSavepoint", "parameters": "(\n\t\t\tMap<JobVertexID, ExecutionJobVertex> tasks,\n\t\t\tString savepointPath)", "modifiers": "public", "return": "void", "signature": "void restoreSavepoint(\n\t\t\tMap<JobVertexID, ExecutionJobVertex> tasks,\n\t\t\tString savepointPath)", "full_signature": "public void restoreSavepoint(\n\t\t\tMap<JobVertexID, ExecutionJobVertex> tasks,\n\t\t\tString savepointPath)", "class_method_signature": "SavepointCoordinator.restoreSavepoint(\n\t\t\tMap<JobVertexID, ExecutionJobVertex> tasks,\n\t\t\tString savepointPath)", "testcase": false, "constructor": false}, {"identifier": "onShutdown", "parameters": "()", "modifiers": "@Override protected", "return": "void", "signature": "void onShutdown()", "full_signature": "@Override protected void onShutdown()", "class_method_signature": "SavepointCoordinator.onShutdown()", "testcase": false, "constructor": false}, {"identifier": "onCancelCheckpoint", "parameters": "(long canceledCheckpointId)", "modifiers": "@Override protected", "return": "void", "signature": "void onCancelCheckpoint(long canceledCheckpointId)", "full_signature": "@Override protected void onCancelCheckpoint(long canceledCheckpointId)", "class_method_signature": "SavepointCoordinator.onCancelCheckpoint(long canceledCheckpointId)", "testcase": false, "constructor": false}, {"identifier": "onFullyAcknowledgedCheckpoint", "parameters": "(CompletedCheckpoint checkpoint)", "modifiers": "@Override protected", "return": "void", "signature": "void onFullyAcknowledgedCheckpoint(CompletedCheckpoint checkpoint)", "full_signature": "@Override protected void onFullyAcknowledgedCheckpoint(CompletedCheckpoint checkpoint)", "class_method_signature": "SavepointCoordinator.onFullyAcknowledgedCheckpoint(CompletedCheckpoint checkpoint)", "testcase": false, "constructor": false}, {"identifier": "createActivatorDeactivator", "parameters": "(\n\t\t\tActorSystem actorSystem,\n\t\t\tUUID leaderSessionID)", "modifiers": "@Override public", "return": "ActorGateway", "signature": "ActorGateway createActivatorDeactivator(\n\t\t\tActorSystem actorSystem,\n\t\t\tUUID leaderSessionID)", "full_signature": "@Override public ActorGateway createActivatorDeactivator(\n\t\t\tActorSystem actorSystem,\n\t\t\tUUID leaderSessionID)", "class_method_signature": "SavepointCoordinator.createActivatorDeactivator(\n\t\t\tActorSystem actorSystem,\n\t\t\tUUID leaderSessionID)", "testcase": false, "constructor": false}], "file": "flink-runtime/src/main/java/org/apache/flink/runtime/checkpoint/SavepointCoordinator.java"}, "focal_method": {"identifier": "triggerSavepoint", "parameters": "(long timestamp)", "modifiers": "public", "return": "Future<String>", "body": "public Future<String> triggerSavepoint(long timestamp) throws Exception {\n\t\tfinal Promise<String> promise = new scala.concurrent.impl.Promise.DefaultPromise<>();\n\n\t\ttry {\n\t\t\t// Get the checkpoint ID up front. If we fail to trigger the checkpoint,\n\t\t\t// the ID will have changed, but this is OK as long as the checkpoint ID\n\t\t\t// generates ascending IDs.\n\t\t\tfinal long checkpointId = getAndIncrementCheckpointId();\n\n\t\t\tif (checkpointId == -1) {\n\t\t\t\tthrow new IllegalStateException(\"Failed to get checkpoint Id\");\n\t\t\t}\n\n\t\t\t// Important: make sure to add the promise to the map before calling\n\t\t\t// any methods that might trigger callbacks, which require the promise.\n\t\t\t// Otherwise, the might be race conditions.\n\t\t\tif (savepointPromises.put(checkpointId, promise) == null) {\n\t\t\t\tboolean success = false;\n\n\t\t\t\ttry {\n\t\t\t\t\t// All good. The future will be completed as soon as the\n\t\t\t\t\t// triggered checkpoint is done.\n\t\t\t\t\tsuccess = triggerCheckpoint(timestamp, checkpointId);\n\t\t\t\t}\n\t\t\t\tfinally {\n\t\t\t\t\tif (!success) {\n\t\t\t\t\t\tsavepointPromises.remove(checkpointId);\n\t\t\t\t\t\tpromise.failure(new Exception(\"Failed to trigger savepoint\"));\n\t\t\t\t\t}\n\t\t\t\t}\n\t\t\t}\n\t\t\telse {\n\t\t\t\tthrow new IllegalStateException(\"Duplicate checkpoint ID\");\n\t\t\t}\n\t\t}\n\t\tcatch (Throwable t) {\n\t\t\tpromise.failure(new Exception(\"Failed to trigger savepoint\", t));\n\t\t}\n\n\t\treturn promise.future();\n\t}", "signature": "Future<String> triggerSavepoint(long timestamp)", "full_signature": "public Future<String> triggerSavepoint(long timestamp)", "class_method_signature": "SavepointCoordinator.triggerSavepoint(long timestamp)", "testcase": false, "constructor": false, "invocations": ["getAndIncrementCheckpointId", "put", "triggerCheckpoint", "remove", "failure", "failure", "future"]}, "repository": {"repo_id": 47972099, "url": "https://github.com/streamline-eu/ML-Pipelines", "language": "Java", "is_fork": false, "fork_count": 7, "stargazer_count": 7, "size": 85537, "license": "licensed"}}