{"test_class": {"identifier": "BatchToResourceMapperTest", "superclass": "", "interfaces": "", "fields": [], "file": "spring-batch-lightmin-core/spring-batch-lightmin-core-service/src/test/java/org/tuxdevelop/spring/batch/lightmin/client/api/BatchToResourceMapperTest.java"}, "test_case": {"identifier": "testMapJobParameter", "parameters": "()", "modifiers": "@Test public", "return": "void", "body": "@Test\n    public void testMapJobParameter() {\n        final String parameterName = \"Long\";\n        final Long value = 10L;\n        final org.springframework.batch.core.JobParameters jobParameters =\n                new JobParametersBuilder().addLong(parameterName, value).toJobParameters();\n        final JobParameters result = BatchToResourceMapper.map(jobParameters);\n        final Map<String, JobParameter> resultMap = result.getParameters();\n        assertThat(resultMap.containsKey(parameterName)).isTrue();\n        assertThat(resultMap.get(parameterName).getParameter()).isEqualTo(value);\n\n    }", "signature": "void testMapJobParameter()", "full_signature": "@Test public void testMapJobParameter()", "class_method_signature": "BatchToResourceMapperTest.testMapJobParameter()", "testcase": true, "constructor": false, "invocations": ["toJobParameters", "addLong", "map", "getParameters", "isTrue", "assertThat", "containsKey", "isEqualTo", "assertThat", "getParameter", "get"]}, "focal_class": {"identifier": "BatchToResourceMapper", "superclass": "", "interfaces": "", "fields": [], "methods": [{"identifier": "BatchToResourceMapper", "parameters": "()", "modifiers": "private", "return": "", "signature": " BatchToResourceMapper()", "full_signature": "private  BatchToResourceMapper()", "class_method_signature": "BatchToResourceMapper.BatchToResourceMapper()", "testcase": false, "constructor": true}, {"identifier": "mapExecutions", "parameters": "(final Collection<org.springframework.batch.core.JobExecution>\n                                                           jobExecutions)", "modifiers": "public static", "return": "List<JobExecution>", "signature": "List<JobExecution> mapExecutions(final Collection<org.springframework.batch.core.JobExecution>\n                                                           jobExecutions)", "full_signature": "public static List<JobExecution> mapExecutions(final Collection<org.springframework.batch.core.JobExecution>\n                                                           jobExecutions)", "class_method_signature": "BatchToResourceMapper.mapExecutions(final Collection<org.springframework.batch.core.JobExecution>\n                                                           jobExecutions)", "testcase": false, "constructor": false}, {"identifier": "map", "parameters": "(final org.springframework.batch.core.JobExecution jobExecution)", "modifiers": "public static", "return": "JobExecution", "signature": "JobExecution map(final org.springframework.batch.core.JobExecution jobExecution)", "full_signature": "public static JobExecution map(final org.springframework.batch.core.JobExecution jobExecution)", "class_method_signature": "BatchToResourceMapper.map(final org.springframework.batch.core.JobExecution jobExecution)", "testcase": false, "constructor": false}, {"identifier": "mapInstances", "parameters": "(final Collection<org.springframework.batch.core.JobInstance>\n                                                         jobInstances)", "modifiers": "public static", "return": "List<JobInstance>", "signature": "List<JobInstance> mapInstances(final Collection<org.springframework.batch.core.JobInstance>\n                                                         jobInstances)", "full_signature": "public static List<JobInstance> mapInstances(final Collection<org.springframework.batch.core.JobInstance>\n                                                         jobInstances)", "class_method_signature": "BatchToResourceMapper.mapInstances(final Collection<org.springframework.batch.core.JobInstance>\n                                                         jobInstances)", "testcase": false, "constructor": false}, {"identifier": "map", "parameters": "(final org.springframework.batch.core.JobInstance jobInstance)", "modifiers": "public static", "return": "JobInstance", "signature": "JobInstance map(final org.springframework.batch.core.JobInstance jobInstance)", "full_signature": "public static JobInstance map(final org.springframework.batch.core.JobInstance jobInstance)", "class_method_signature": "BatchToResourceMapper.map(final org.springframework.batch.core.JobInstance jobInstance)", "testcase": false, "constructor": false}, {"identifier": "map", "parameters": "(final org.springframework.batch.core.JobParameters jobParameters)", "modifiers": "public static", "return": "JobParameters", "signature": "JobParameters map(final org.springframework.batch.core.JobParameters jobParameters)", "full_signature": "public static JobParameters map(final org.springframework.batch.core.JobParameters jobParameters)", "class_method_signature": "BatchToResourceMapper.map(final org.springframework.batch.core.JobParameters jobParameters)", "testcase": false, "constructor": false}, {"identifier": "map", "parameters": "(final org.springframework.batch.core.StepExecution stepExecution)", "modifiers": "public static", "return": "StepExecution", "signature": "StepExecution map(final org.springframework.batch.core.StepExecution stepExecution)", "full_signature": "public static StepExecution map(final org.springframework.batch.core.StepExecution stepExecution)", "class_method_signature": "BatchToResourceMapper.map(final org.springframework.batch.core.StepExecution stepExecution)", "testcase": false, "constructor": false}, {"identifier": "map", "parameters": "(final org.springframework.batch.core.ExitStatus exitStatus)", "modifiers": "public static", "return": "ExitStatus", "signature": "ExitStatus map(final org.springframework.batch.core.ExitStatus exitStatus)", "full_signature": "public static ExitStatus map(final org.springframework.batch.core.ExitStatus exitStatus)", "class_method_signature": "BatchToResourceMapper.map(final org.springframework.batch.core.ExitStatus exitStatus)", "testcase": false, "constructor": false}, {"identifier": "map", "parameters": "(final org.springframework.batch.core.BatchStatus batchStatus)", "modifiers": "public static", "return": "BatchStatus", "signature": "BatchStatus map(final org.springframework.batch.core.BatchStatus batchStatus)", "full_signature": "public static BatchStatus map(final org.springframework.batch.core.BatchStatus batchStatus)", "class_method_signature": "BatchToResourceMapper.map(final org.springframework.batch.core.BatchStatus batchStatus)", "testcase": false, "constructor": false}, {"identifier": "map", "parameters": "(final org.springframework.batch.core.JobParameter.ParameterType parameterType)", "modifiers": "public static", "return": "ParameterType", "signature": "ParameterType map(final org.springframework.batch.core.JobParameter.ParameterType parameterType)", "full_signature": "public static ParameterType map(final org.springframework.batch.core.JobParameter.ParameterType parameterType)", "class_method_signature": "BatchToResourceMapper.map(final org.springframework.batch.core.JobParameter.ParameterType parameterType)", "testcase": false, "constructor": false}, {"identifier": "mapStepExecutions", "parameters": "(final Collection<org.springframework.batch.core.StepExecution>\n                                                         stepExecutions)", "modifiers": "static", "return": "List<StepExecution>", "signature": "List<StepExecution> mapStepExecutions(final Collection<org.springframework.batch.core.StepExecution>\n                                                         stepExecutions)", "full_signature": "static List<StepExecution> mapStepExecutions(final Collection<org.springframework.batch.core.StepExecution>\n                                                         stepExecutions)", "class_method_signature": "BatchToResourceMapper.mapStepExecutions(final Collection<org.springframework.batch.core.StepExecution>\n                                                         stepExecutions)", "testcase": false, "constructor": false}], "file": "spring-batch-lightmin-core/spring-batch-lightmin-core-service/src/main/java/org/tuxdevelop/spring/batch/lightmin/client/api/BatchToResourceMapper.java"}, "focal_method": {"identifier": "map", "parameters": "(final org.springframework.batch.core.JobExecution jobExecution)", "modifiers": "public static", "return": "JobExecution", "body": "public static JobExecution map(final org.springframework.batch.core.JobExecution jobExecution) {\n        final JobExecution response = new JobExecution();\n        response.setId(jobExecution.getId());\n        response.setCreateTime(jobExecution.getCreateTime());\n        response.setEndTime(jobExecution.getEndTime());\n        response.setExitStatus(map(jobExecution.getExitStatus()));\n        response.setFailureExceptions(jobExecution.getFailureExceptions());\n        response.setJobConfigurationName(jobExecution.getJobConfigurationName());\n        response.setJobInstance(map(jobExecution.getJobInstance()));\n        response.setJobParameters(map(jobExecution.getJobParameters()));\n        response.setLastUpdated(jobExecution.getLastUpdated());\n        response.setStartTime(jobExecution.getStartTime());\n        response.setStatus(map(jobExecution.getStatus()));\n        response.setStepExecutions(mapStepExecutions(jobExecution.getStepExecutions()));\n        response.setVersion(jobExecution.getVersion());\n        return response;\n    }", "signature": "JobExecution map(final org.springframework.batch.core.JobExecution jobExecution)", "full_signature": "public static JobExecution map(final org.springframework.batch.core.JobExecution jobExecution)", "class_method_signature": "BatchToResourceMapper.map(final org.springframework.batch.core.JobExecution jobExecution)", "testcase": false, "constructor": false, "invocations": ["setId", "getId", "setCreateTime", "getCreateTime", "setEndTime", "getEndTime", "setExitStatus", "map", "getExitStatus", "setFailureExceptions", "getFailureExceptions", "setJobConfigurationName", "getJobConfigurationName", "setJobInstance", "map", "getJobInstance", "setJobParameters", "map", "getJobParameters", "setLastUpdated", "getLastUpdated", "setStartTime", "getStartTime", "setStatus", "map", "getStatus", "setStepExecutions", "mapStepExecutions", "getStepExecutions", "setVersion", "getVersion"]}, "repository": {"repo_id": 29479059, "url": "https://github.com/tuxdevelop/spring-batch-lightmin", "language": "Java", "is_fork": false, "fork_count": 34, "stargazer_count": 109, "size": 12355, "license": "licensed"}}