{"test_class": {"identifier": "JobLauncherFeServiceTest", "superclass": "", "interfaces": "", "fields": [{"original_string": "private JobLauncherFeService jobLauncherFeService;", "modifier": "private", "type": "JobLauncherFeService", "declarator": "jobLauncherFeService", "var_name": "jobLauncherFeService"}, {"original_string": "@Mock\n    private RegistrationBean registrationBean;", "modifier": "@Mock\n    private", "type": "RegistrationBean", "declarator": "registrationBean", "var_name": "registrationBean"}, {"original_string": "@Mock\n    private JobServerService jobServerService;", "modifier": "@Mock\n    private", "type": "JobServerService", "declarator": "jobServerService", "var_name": "jobServerService"}], "file": "spring-batch-lightmin-server/spring-batch-lightmin-server-fe/src/test/java/org/tuxdevelop/spring/batch/lightmin/server/fe/service/JobLauncherFeServiceTest.java"}, "test_case": {"identifier": "testLaunchJob", "parameters": "()", "modifiers": "@Test public", "return": "void", "body": "@Test\n    public void testLaunchJob() {\n        final String jobName = \"testJob\";\n        final String applicationInstanceId = \"testApp\";\n\n        final LightminClientApplication applicationInstance = new LightminClientApplication();\n        when(this.registrationBean.findById(applicationInstanceId)).thenReturn(applicationInstance);\n\n        try {\n            final JobLauncherModel jobLauncherModel = new JobLauncherModel();\n            jobLauncherModel.setApplicationInstanceId(applicationInstanceId);\n            jobLauncherModel.setJobName(jobName);\n            jobLauncherModel.setJobParameters(\"test(String)=hello,longValue(long)=1\");\n            jobLauncherModel.setJobIncrementer(\"DATE\");\n            this.jobLauncherFeService.launchJob(jobLauncherModel);\n        } catch (final Exception e) {\n            fail(e.getMessage());\n        }\n    }", "signature": "void testLaunchJob()", "full_signature": "@Test public void testLaunchJob()", "class_method_signature": "JobLauncherFeServiceTest.testLaunchJob()", "testcase": true, "constructor": false, "invocations": ["thenReturn", "when", "findById", "setApplicationInstanceId", "setJobName", "setJobParameters", "setJobIncrementer", "launchJob", "fail", "getMessage"]}, "focal_class": {"identifier": "JobLauncherFeService", "superclass": "extends CommonFeService", "interfaces": "", "fields": [{"original_string": "private final JobServerService jobServerService;", "modifier": "private final", "type": "JobServerService", "declarator": "jobServerService", "var_name": "jobServerService"}], "methods": [{"identifier": "JobLauncherFeService", "parameters": "(final RegistrationBean registrationBean, final JobServerService jobServerService)", "modifiers": "public", "return": "", "signature": " JobLauncherFeService(final RegistrationBean registrationBean, final JobServerService jobServerService)", "full_signature": "public  JobLauncherFeService(final RegistrationBean registrationBean, final JobServerService jobServerService)", "class_method_signature": "JobLauncherFeService.JobLauncherFeService(final RegistrationBean registrationBean, final JobServerService jobServerService)", "testcase": false, "constructor": true}, {"identifier": "getJobLauncherModel", "parameters": "(final String jobName,\n                                                final String applicationInstanceId)", "modifiers": "public", "return": "JobLauncherModel", "signature": "JobLauncherModel getJobLauncherModel(final String jobName,\n                                                final String applicationInstanceId)", "full_signature": "public JobLauncherModel getJobLauncherModel(final String jobName,\n                                                final String applicationInstanceId)", "class_method_signature": "JobLauncherFeService.getJobLauncherModel(final String jobName,\n                                                final String applicationInstanceId)", "testcase": false, "constructor": false}, {"identifier": "launchJob", "parameters": "(final JobLauncherModel jobLauncherModel)", "modifiers": "public", "return": "void", "signature": "void launchJob(final JobLauncherModel jobLauncherModel)", "full_signature": "public void launchJob(final JobLauncherModel jobLauncherModel)", "class_method_signature": "JobLauncherFeService.launchJob(final JobLauncherModel jobLauncherModel)", "testcase": false, "constructor": false}, {"identifier": "attachIncremeter", "parameters": "(final JobLauncherModel jobLauncherModel, final JobParameters jobParameters)", "modifiers": "", "return": "void", "signature": "void attachIncremeter(final JobLauncherModel jobLauncherModel, final JobParameters jobParameters)", "full_signature": " void attachIncremeter(final JobLauncherModel jobLauncherModel, final JobParameters jobParameters)", "class_method_signature": "JobLauncherFeService.attachIncremeter(final JobLauncherModel jobLauncherModel, final JobParameters jobParameters)", "testcase": false, "constructor": false}], "file": "spring-batch-lightmin-server/spring-batch-lightmin-server-fe/src/main/java/org/tuxdevelop/spring/batch/lightmin/server/fe/service/JobLauncherFeService.java"}, "focal_method": {"identifier": "launchJob", "parameters": "(final JobLauncherModel jobLauncherModel)", "modifiers": "public", "return": "void", "body": "public void launchJob(final JobLauncherModel jobLauncherModel) {\n\n        final LightminClientApplication lightminClientApplication =\n                this.findLightminClientApplicatonById(jobLauncherModel.getApplicationInstanceId());\n\n        final JobParameters jobParameters =\n                ApiParameterParser.parseParametersToJobParameters(jobLauncherModel.getJobParameters());\n\n        this.attachIncremeter(jobLauncherModel, jobParameters);\n\n        final JobLaunch jobLaunch = new JobLaunch();\n        jobLaunch.setJobName(jobLauncherModel.getJobName());\n        jobLaunch.setJobParameters(jobParameters);\n\n        this.jobServerService.launchJob(jobLaunch, lightminClientApplication);\n\n    }", "signature": "void launchJob(final JobLauncherModel jobLauncherModel)", "full_signature": "public void launchJob(final JobLauncherModel jobLauncherModel)", "class_method_signature": "JobLauncherFeService.launchJob(final JobLauncherModel jobLauncherModel)", "testcase": false, "constructor": false, "invocations": ["findLightminClientApplicatonById", "getApplicationInstanceId", "parseParametersToJobParameters", "getJobParameters", "attachIncremeter", "setJobName", "getJobName", "setJobParameters", "launchJob"]}, "repository": {"repo_id": 29479059, "url": "https://github.com/tuxdevelop/spring-batch-lightmin", "language": "Java", "is_fork": false, "fork_count": 34, "stargazer_count": 109, "size": 12355, "license": "licensed"}}