{"test_class": {"identifier": "JobListenerFeServiceTest", "superclass": "", "interfaces": "", "fields": [{"original_string": "private static final String APPLICATION_INSTANCE_ID = \"testApp\";", "modifier": "private static final", "type": "String", "declarator": "APPLICATION_INSTANCE_ID = \"testApp\"", "var_name": "APPLICATION_INSTANCE_ID"}, {"original_string": "private static final Long JC_ID = 1L;", "modifier": "private static final", "type": "Long", "declarator": "JC_ID = 1L", "var_name": "JC_ID"}, {"original_string": "private JobListenerFeService jobListenerFeService;", "modifier": "private", "type": "JobListenerFeService", "declarator": "jobListenerFeService", "var_name": "jobListenerFeService"}, {"original_string": "@Mock\n    private RegistrationBean registrationBean;", "modifier": "@Mock\n    private", "type": "RegistrationBean", "declarator": "registrationBean", "var_name": "registrationBean"}, {"original_string": "@Mock\n    private AdminServerService adminServerService;", "modifier": "@Mock\n    private", "type": "AdminServerService", "declarator": "adminServerService", "var_name": "adminServerService"}], "file": "spring-batch-lightmin-server/spring-batch-lightmin-server-fe/src/test/java/org/tuxdevelop/spring/batch/lightmin/server/fe/service/JobListenerFeServiceTest.java"}, "test_case": {"identifier": "testGetMapJobConfigurationModel", "parameters": "()", "modifiers": "@Test public", "return": "void", "body": "@Test\n    public void testGetMapJobConfigurationModel() {\n\n        final LightminClientApplication lightminClientApplication = ServiceTestHelper.createLightminClientApplication();\n        when(this.registrationBean.findById(APPLICATION_INSTANCE_ID)).thenReturn(lightminClientApplication);\n\n        final Map<String, JobConfigurations> jobConfigurationsMap = new HashMap<>();\n\n        ApiTestHelper.addJobConfigurations(jobConfigurationsMap,\n                APPLICATION_INSTANCE_ID,\n                ApiTestHelper.createJobListenerConfigurations(5));\n\n        when(this.adminServerService.getJobConfigurationsMap(lightminClientApplication)).thenReturn(jobConfigurationsMap);\n\n        final MapJobListenerConfigurationModel result =\n                this.jobListenerFeService.getMapJobConfigurationModel(APPLICATION_INSTANCE_ID);\n\n\n        BDDAssertions.then(result).isNotNull();\n        BDDAssertions.then(result.getJobConfigurations()).isNotNull();\n        BDDAssertions.then(result.getJobConfigurations().size()).isEqualTo(1);\n\n    }", "signature": "void testGetMapJobConfigurationModel()", "full_signature": "@Test public void testGetMapJobConfigurationModel()", "class_method_signature": "JobListenerFeServiceTest.testGetMapJobConfigurationModel()", "testcase": true, "constructor": false, "invocations": ["createLightminClientApplication", "thenReturn", "when", "findById", "addJobConfigurations", "createJobListenerConfigurations", "thenReturn", "when", "getJobConfigurationsMap", "getMapJobConfigurationModel", "isNotNull", "then", "isNotNull", "then", "getJobConfigurations", "isEqualTo", "then", "size", "getJobConfigurations"]}, "focal_class": {"identifier": "JobListenerFeService", "superclass": "extends CommonJobConfigurationFeService", "interfaces": "", "fields": [{"original_string": "private final AdminServerService adminServerService;", "modifier": "private final", "type": "AdminServerService", "declarator": "adminServerService", "var_name": "adminServerService"}], "methods": [{"identifier": "JobListenerFeService", "parameters": "(final RegistrationBean registrationBean, final AdminServerService adminServerService)", "modifiers": "public", "return": "", "signature": " JobListenerFeService(final RegistrationBean registrationBean, final AdminServerService adminServerService)", "full_signature": "public  JobListenerFeService(final RegistrationBean registrationBean, final AdminServerService adminServerService)", "class_method_signature": "JobListenerFeService.JobListenerFeService(final RegistrationBean registrationBean, final AdminServerService adminServerService)", "testcase": false, "constructor": true}, {"identifier": "getMapJobConfigurationModel", "parameters": "(final String applicationInstanceId)", "modifiers": "public", "return": "MapJobListenerConfigurationModel", "signature": "MapJobListenerConfigurationModel getMapJobConfigurationModel(final String applicationInstanceId)", "full_signature": "public MapJobListenerConfigurationModel getMapJobConfigurationModel(final String applicationInstanceId)", "class_method_signature": "JobListenerFeService.getMapJobConfigurationModel(final String applicationInstanceId)", "testcase": false, "constructor": false}, {"identifier": "getJobConfigurationModel", "parameters": "(final Long jobConfigurationId,\n                                                                  final String applicationInstanceId)", "modifiers": "public", "return": "ListenerJobConfigurationModel", "signature": "ListenerJobConfigurationModel getJobConfigurationModel(final Long jobConfigurationId,\n                                                                  final String applicationInstanceId)", "full_signature": "public ListenerJobConfigurationModel getJobConfigurationModel(final Long jobConfigurationId,\n                                                                  final String applicationInstanceId)", "class_method_signature": "JobListenerFeService.getJobConfigurationModel(final Long jobConfigurationId,\n                                                                  final String applicationInstanceId)", "testcase": false, "constructor": false}, {"identifier": "startListener", "parameters": "(final Long jobConfigurationId, final String applicationInstanceId)", "modifiers": "public", "return": "void", "signature": "void startListener(final Long jobConfigurationId, final String applicationInstanceId)", "full_signature": "public void startListener(final Long jobConfigurationId, final String applicationInstanceId)", "class_method_signature": "JobListenerFeService.startListener(final Long jobConfigurationId, final String applicationInstanceId)", "testcase": false, "constructor": false}, {"identifier": "stopListener", "parameters": "(final Long jobConfigurationId, final String applicationInstanceId)", "modifiers": "public", "return": "void", "signature": "void stopListener(final Long jobConfigurationId, final String applicationInstanceId)", "full_signature": "public void stopListener(final Long jobConfigurationId, final String applicationInstanceId)", "class_method_signature": "JobListenerFeService.stopListener(final Long jobConfigurationId, final String applicationInstanceId)", "testcase": false, "constructor": false}, {"identifier": "deleteListenerConfiguration", "parameters": "(final Long jobConfigurationId, final String applicationInstanceId)", "modifiers": "public", "return": "void", "signature": "void deleteListenerConfiguration(final Long jobConfigurationId, final String applicationInstanceId)", "full_signature": "public void deleteListenerConfiguration(final Long jobConfigurationId, final String applicationInstanceId)", "class_method_signature": "JobListenerFeService.deleteListenerConfiguration(final Long jobConfigurationId, final String applicationInstanceId)", "testcase": false, "constructor": false}, {"identifier": "addListenerConfiguration", "parameters": "(final ListenerJobConfigurationModel listenerModel,\n                                         final String applicationInstanceId)", "modifiers": "public", "return": "void", "signature": "void addListenerConfiguration(final ListenerJobConfigurationModel listenerModel,\n                                         final String applicationInstanceId)", "full_signature": "public void addListenerConfiguration(final ListenerJobConfigurationModel listenerModel,\n                                         final String applicationInstanceId)", "class_method_signature": "JobListenerFeService.addListenerConfiguration(final ListenerJobConfigurationModel listenerModel,\n                                         final String applicationInstanceId)", "testcase": false, "constructor": false}, {"identifier": "updateListenerConfiguration", "parameters": "(final ListenerJobConfigurationModel listenerModel,\n                                            final String applicationInstanceId)", "modifiers": "public", "return": "void", "signature": "void updateListenerConfiguration(final ListenerJobConfigurationModel listenerModel,\n                                            final String applicationInstanceId)", "full_signature": "public void updateListenerConfiguration(final ListenerJobConfigurationModel listenerModel,\n                                            final String applicationInstanceId)", "class_method_signature": "JobListenerFeService.updateListenerConfiguration(final ListenerJobConfigurationModel listenerModel,\n                                            final String applicationInstanceId)", "testcase": false, "constructor": false}, {"identifier": "map", "parameters": "(final JobConfiguration jobConfiguration)", "modifiers": "private", "return": "ListenerJobConfigurationModel", "signature": "ListenerJobConfigurationModel map(final JobConfiguration jobConfiguration)", "full_signature": "private ListenerJobConfigurationModel map(final JobConfiguration jobConfiguration)", "class_method_signature": "JobListenerFeService.map(final JobConfiguration jobConfiguration)", "testcase": false, "constructor": false}, {"identifier": "map", "parameters": "(final ListenerJobConfigurationModel listenerModel)", "modifiers": "", "return": "JobConfiguration", "signature": "JobConfiguration map(final ListenerJobConfigurationModel listenerModel)", "full_signature": " JobConfiguration map(final ListenerJobConfigurationModel listenerModel)", "class_method_signature": "JobListenerFeService.map(final ListenerJobConfigurationModel listenerModel)", "testcase": false, "constructor": false}, {"identifier": "mapListenerStatus", "parameters": "(final String status)", "modifiers": "private", "return": "ListenerStatus", "signature": "ListenerStatus mapListenerStatus(final String status)", "full_signature": "private ListenerStatus mapListenerStatus(final String status)", "class_method_signature": "JobListenerFeService.mapListenerStatus(final String status)", "testcase": false, "constructor": false}, {"identifier": "mapListenerType", "parameters": "(final String schedulerType)", "modifiers": "private", "return": "JobListenerType", "signature": "JobListenerType mapListenerType(final String schedulerType)", "full_signature": "private JobListenerType mapListenerType(final String schedulerType)", "class_method_signature": "JobListenerFeService.mapListenerType(final String schedulerType)", "testcase": false, "constructor": false}], "file": "spring-batch-lightmin-server/spring-batch-lightmin-server-fe/src/main/java/org/tuxdevelop/spring/batch/lightmin/server/fe/service/JobListenerFeService.java"}, "focal_method": {"identifier": "getMapJobConfigurationModel", "parameters": "(final String applicationInstanceId)", "modifiers": "public", "return": "MapJobListenerConfigurationModel", "body": "public MapJobListenerConfigurationModel getMapJobConfigurationModel(final String applicationInstanceId) {\n\n        final LightminClientApplication lightminClientApplication =\n                this.findLightminClientApplicatonById(applicationInstanceId);\n\n        final Map<String, JobConfigurations> jobConfigurations =\n                this.adminServerService.getJobConfigurationsMap(lightminClientApplication);\n\n\n        final MapJobListenerConfigurationModel mapJobListenerConfigurationModel = new MapJobListenerConfigurationModel();\n        for (final Map.Entry<String, JobConfigurations> entry : jobConfigurations.entrySet()) {\n            for (final JobConfiguration jobConfiguration : entry.getValue().getJobConfigurations()) {\n                if (jobConfiguration.getJobListenerConfiguration() != null) {\n                    final ListenerJobConfigurationModel model = this.map(jobConfiguration);\n                    mapJobListenerConfigurationModel.add(entry.getKey(), model);\n                } else {\n                    log.trace(\"No Scheduler configuration, nothing to map\");\n                }\n            }\n        }\n\n        return mapJobListenerConfigurationModel;\n\n    }", "signature": "MapJobListenerConfigurationModel getMapJobConfigurationModel(final String applicationInstanceId)", "full_signature": "public MapJobListenerConfigurationModel getMapJobConfigurationModel(final String applicationInstanceId)", "class_method_signature": "JobListenerFeService.getMapJobConfigurationModel(final String applicationInstanceId)", "testcase": false, "constructor": false, "invocations": ["findLightminClientApplicatonById", "getJobConfigurationsMap", "entrySet", "getJobConfigurations", "getValue", "getJobListenerConfiguration", "map", "add", "getKey", "trace"]}, "repository": {"repo_id": 29479059, "url": "https://github.com/tuxdevelop/spring-batch-lightmin", "language": "Java", "is_fork": false, "fork_count": 34, "stargazer_count": 109, "size": 12355, "license": "licensed"}}