{"test_class": {"identifier": "SnomedRequestCallbackTest", "superclass": "", "interfaces": "", "fields": [], "file": "snomed-coder-ui-web/src/test/java/org/t3as/snomedct/gwt/client/gwt/SnomedRequestCallbackTest.java"}, "test_case": {"identifier": "testNextMappingGroup", "parameters": "()", "modifiers": "@Test public", "return": "void", "body": "@Test\n    public void testNextMappingGroup() throws Exception {\n        assertEquals(SnomedRequestCallback.nextMappingGroup(null), \"A\");\n        assertEquals(SnomedRequestCallback.nextMappingGroup(\"\"), \"A\");\n\n        assertEquals(SnomedRequestCallback.nextMappingGroup(\"A\"), \"B\");\n        assertEquals(SnomedRequestCallback.nextMappingGroup(\"B\"), \"C\");\n        assertEquals(SnomedRequestCallback.nextMappingGroup(\"Z\"), \"AA\");\n\n        assertEquals(SnomedRequestCallback.nextMappingGroup(\"AA\"), \"AB\");\n        assertEquals(SnomedRequestCallback.nextMappingGroup(\"AC\"), \"AD\");\n        assertEquals(SnomedRequestCallback.nextMappingGroup(\"AZ\"), \"BA\");\n\n        assertEquals(SnomedRequestCallback.nextMappingGroup(\"BA\"), \"BB\");\n        assertEquals(SnomedRequestCallback.nextMappingGroup(\"ZZ\"), \"AAA\");\n\n        assertEquals(SnomedRequestCallback.nextMappingGroup(\"AAA\"), \"AAB\");\n        assertEquals(SnomedRequestCallback.nextMappingGroup(\"AZA\"), \"AZB\");\n        assertEquals(SnomedRequestCallback.nextMappingGroup(\"AZZ\"), \"BAA\");\n        assertEquals(SnomedRequestCallback.nextMappingGroup(\"ZZZ\"), \"AAAA\");\n\n        assertEquals(SnomedRequestCallback.nextMappingGroup(\"ABZZ\"), \"ACAA\");\n    }", "signature": "void testNextMappingGroup()", "full_signature": "@Test public void testNextMappingGroup()", "class_method_signature": "SnomedRequestCallbackTest.testNextMappingGroup()", "testcase": true, "constructor": false, "invocations": ["assertEquals", "nextMappingGroup", "assertEquals", "nextMappingGroup", "assertEquals", "nextMappingGroup", "assertEquals", "nextMappingGroup", "assertEquals", "nextMappingGroup", "assertEquals", "nextMappingGroup", "assertEquals", "nextMappingGroup", "assertEquals", "nextMappingGroup", "assertEquals", "nextMappingGroup", "assertEquals", "nextMappingGroup", "assertEquals", "nextMappingGroup", "assertEquals", "nextMappingGroup", "assertEquals", "nextMappingGroup", "assertEquals", "nextMappingGroup", "assertEquals", "nextMappingGroup"]}, "focal_class": {"identifier": "SnomedRequestCallback", "superclass": "", "interfaces": "implements RequestCallback", "fields": [{"original_string": "private final Messages messages = GWT.create(Messages.class);", "modifier": "private final", "type": "Messages", "declarator": "messages = GWT.create(Messages.class)", "var_name": "messages"}, {"original_string": "private final List<SnomedConcept> conceptList;", "modifier": "private final", "type": "List<SnomedConcept>", "declarator": "conceptList", "var_name": "conceptList"}, {"original_string": "private final Label statusLabel;", "modifier": "private final", "type": "Label", "declarator": "statusLabel", "var_name": "statusLabel"}, {"original_string": "private final GlassLoadingPanel glassPanel;", "modifier": "private final", "type": "GlassLoadingPanel", "declarator": "glassPanel", "var_name": "glassPanel"}, {"original_string": "private final Map<String, String> typeCodeToDescription;", "modifier": "private final", "type": "Map<String, String>", "declarator": "typeCodeToDescription", "var_name": "typeCodeToDescription"}], "methods": [{"identifier": "SnomedRequestCallback", "parameters": "(final List<SnomedConcept> conceptList, final Label statusLabel,\n                                 final GlassLoadingPanel glassPanel, final Map<String, String> typeCodeToDescription)", "modifiers": "public", "return": "", "signature": " SnomedRequestCallback(final List<SnomedConcept> conceptList, final Label statusLabel,\n                                 final GlassLoadingPanel glassPanel, final Map<String, String> typeCodeToDescription)", "full_signature": "public  SnomedRequestCallback(final List<SnomedConcept> conceptList, final Label statusLabel,\n                                 final GlassLoadingPanel glassPanel, final Map<String, String> typeCodeToDescription)", "class_method_signature": "SnomedRequestCallback.SnomedRequestCallback(final List<SnomedConcept> conceptList, final Label statusLabel,\n                                 final GlassLoadingPanel glassPanel, final Map<String, String> typeCodeToDescription)", "testcase": false, "constructor": true}, {"identifier": "onError", "parameters": "(final Request request, final Throwable e)", "modifiers": "public", "return": "void", "signature": "void onError(final Request request, final Throwable e)", "full_signature": "public void onError(final Request request, final Throwable e)", "class_method_signature": "SnomedRequestCallback.onError(final Request request, final Throwable e)", "testcase": false, "constructor": false}, {"identifier": "onResponseReceived", "parameters": "(final Request request, final Response response)", "modifiers": "public", "return": "void", "signature": "void onResponseReceived(final Request request, final Response response)", "full_signature": "public void onResponseReceived(final Request request, final Response response)", "class_method_signature": "SnomedRequestCallback.onResponseReceived(final Request request, final Response response)", "testcase": false, "constructor": false}, {"identifier": "nextMappingGroup", "parameters": "(final String mappingGroup)", "modifiers": "static", "return": "String", "signature": "String nextMappingGroup(final String mappingGroup)", "full_signature": "static String nextMappingGroup(final String mappingGroup)", "class_method_signature": "SnomedRequestCallback.nextMappingGroup(final String mappingGroup)", "testcase": false, "constructor": false}], "file": "snomed-coder-ui-web/src/main/java/org/t3as/snomedct/gwt/client/gwt/SnomedRequestCallback.java"}, "focal_method": {"identifier": "nextMappingGroup", "parameters": "(final String mappingGroup)", "modifiers": "static", "return": "String", "body": "static String nextMappingGroup(final String mappingGroup) {\n        if (mappingGroup == null || \"\".equals(mappingGroup)) return \"A\";\n\n        final char[] cs = mappingGroup.toCharArray();\n        boolean incrementFurther = true;\n\n        // step through the array backwards\n        for (int i = cs.length - 1; i >= 0; i--) {\n            // if we should no longer increment then break out of the loop\n            if (!incrementFurther) break;\n\n            // continue incrementing backwards through the array as long as we are finding Z's\n            if (++cs[i] > 'Z') cs[i] = 'A';\n            else incrementFurther = false;\n        }\n        final String result = new String(cs);\n        // if the first char of the array was a Z then we have a 'carry' operation and need to add another A at the end\n        if (incrementFurther) return result + \"A\";\n        else return result;\n    }", "signature": "String nextMappingGroup(final String mappingGroup)", "full_signature": "static String nextMappingGroup(final String mappingGroup)", "class_method_signature": "SnomedRequestCallback.nextMappingGroup(final String mappingGroup)", "testcase": false, "constructor": false, "invocations": ["equals", "toCharArray"]}, "repository": {"repo_id": 20043683, "url": "https://github.com/NICTA/t3as-snomedct-service", "language": "Java", "is_fork": false, "fork_count": 5, "stargazer_count": 7, "size": 1240, "license": "licensed"}}